Chunk_ID,Chunk_Index,Content,Content_Length,Quality_Score,Reliability,Source_Type,Original_Content,Enhancement_Version,averageConfidence,book_name,chunkIndex,enhancementTimestamp,enhancementVersion,fileName,filePath,grade,ocrMethod,publisher,qualityMetrics_chineseCharRatio,qualityMetrics_coherenceScore,qualityMetrics_lengthScore,qualityMetrics_ocrConfidence,semanticFeatures_hasDefinition,semanticFeatures_hasExperiment,semanticFeatures_hasFormulas,semanticFeatures_hasNumbers,semanticFeatures_hasQuestion,semanticFeatures_isTableContent,semanticFeatures_subjectArea,semester,source_file,subject,totalPages,uniqueId
中图版（主编_钟作慈）_七年级_义务教育教科书·地理七年级下册（主编_钟作慈）_chunk_5,5,中国 成立 以来 新建 的工业基地 nn 从六 省新 中国 成立 以来 扩建的 工业中 心到 全角 沿工 业基 地人 e 新中 国成 立以 来新 建的 工业中 心 1 二南海诸 岛注， 香港 、 澳门 特别行政区 和人 台湾省 数据暂 缺。 医 S 一 4 中国主 要工业基地分 布 w 第二 节工业揭 分市 和发 展 N D 11 阅读工业分 布图 的基本方法是， Fi ; 1 阅读图 例， 说出 表示工业中 心和 工业基地的 符号和 颜色。 2， 依据 图例， 在图 中找 出主要的 工业中 心， 描述 其地 理位 置， 说明 其分 布特点， 并分 析影 响其 分布 的地 理条 件。 3， 依据 图例， 在图 中技 出主要的 工业基地， 描述 其地 理位 置和 范围， 以及 所包括的 工业中 心， 说明 其分 布特点， 并分 析影 响其 分布 的地 理条 件。 新中 国成 立以 后， 我国 加大 了对 治海地区 的工业改造， 加强 了中 西部地 区的 工业建设。 辽中 南 、 京津 唐 、 沪宁 杭 、 珠江 三角 洲四 大工业基地成 为我 国最 重要的 工业基地。 甚中 辽中 南是 全国 最大 的重工业 基地， 京津 唐是 北方最 大的 综合性 工业基地， 沪宁 杭是 全国 最大 的综合性 工业基地， 珠江 三角 洲是 以轻工业为 主的 综合性 工业基地。 同时， 在黑龙江 、 河北 、 河南 、 潮北 、 湖南 、 重庆 、 四川 、 陕西 、 内蒙古和 新疆 等省 区出 现了 新建 的工业基地和 工业中 心。 本 ss A N 1 一了 二生生醒 和人 7 ) 亏要 和志 aa 证二 本 ss . 人 n 人,719,0.4199254205607476,medium-low,ocr,中 国 成 立 以 来 新 建 的 工业 基地 “nn 从 六 省\n@” 新 中 国 成 立 以 来 扩建 的 工业 中 心 到 全 角 沿 工 业 基 地 人\ne” 新 中 国 成 立 以 来 新 建 的 工业 中 心 1 二 南海 诸 岛\n注 ， 香港 、 澳 门 特别 行政 区 和 人 台湾 省 数据 暂 缺 。\n医 S 一 4 中国 主 要 工业 基地 分 布\n=== 第 24 页 ===\nw 第 二 节 工业 揭 分 市 和 发 展 N D 11\n阅读 工业 分 布 图 的 基本 方法 是 ， Fi& / ;\n1 阅读 图 例 ， 说 出 表示 工业 中 心 和 工业 基地 的 符号 和 颜色 。\n2， 依 据 图 例 ， 在 图 中 找 出 主要 的 工业 中 心 ， 描 述 其 地 理 位 置 ， 说 明 其 分 布 特点 ，\n并 分 析 影 响 其 分 布 的 地 理 条 件 。\n3， 依 据 图 例 ， 在 图 中 技 出 主要 的 工业 基地 ， 描 述 其 地 理 位 置 和 范围 ， 以 及 所 包括\n的 工业 中 心 ， 说 明 其 分 布 特点 ， 并 分 析 影 响 其 分 布 的 地 理 条 件 。\n新 中 国 成 立 以 后 ， 我 国 加 大 了 对 治 海地 区 的 工业 改造 ， 加 强 了\n中 西部 地 区 的 工业 建设 。 辽 中 南 、 京 津 唐 、 沪 宁 杭 、 珠 江 三 角 洲 四\n大 工业 基地 成 为 我 国 最 重要 的 工业 基地 。 甚 中 辽 中 南 是 全 国 最 大 的\n重工 业 基地 ， 京 津 唐 是 北方 最 大 的 综合 性 工业 基地 ， 沪 宁 杭 是 全 国\n最 大 的 综合 性 工业 基地 ， 珠 江 三 角 洲 是 以 轻工业 为 主 的 综合 性 工业\n基地 。 同 时 ， 在 黑龙 江 、 河 北 、 河 南 、 潮 北 、 湖 南 、 重 庆 、 四 川 、\n陕西 、 内 蒙古 和 新 疆 等 省 区 出 现 了 新 建 的 工业 基地 和 工业 中 心 。\n本 ss ~ A |¥\n— N 1\n一 了 二 生生 - | 醒 和\n| 人\n7 ) ER | “ 亏 要 和 志 aa 证 二\n本 > ss . / | 人 n- | 人\n|,2.0,70,中图版（主编_钟作慈）_七年级_义务教育教科书·地理七年级下册（主编_钟作慈）,17,2025-07-21T14:23:03.013Z,2.0,义务教育教科书·地理七年级下册（主编：钟作慈）,/Users/LeoQin/Documents/GitHub/PDFconvertor/training_data/初中/地理/中图版（主编：钟作慈）-中国地图出版社/七年级/义务教育教科书·地理七年级下册（主编：钟作慈）.pdf,七年级,tesseract.js-parallel,中图版,0.8605577689243028,0.5,1,70,,,,true,,,unknown,下册,中图版（主编：钟作慈）_七年级_义务教育教科书·地理七年级下册（主编：钟作慈）.json,地理,112,初中_地理_中图版（主编：钟作慈）_七年级_义务教育教科书·地理七年级下册（主编：钟作慈）
中图版（主编_钟作慈）_七年级_义务教育教科书·地理七年级下册（主编_钟作慈）_chunk_6,6,的影响传统民居 、 服饰 和饮食的 地区 差异深 受自然环境的 影响。 例如， 北方 地区 的传统民居主要考虑冬季御寒， 故追求厚重， 以当地土石为 原料， 南方 地区 的传统民居主要考虑夏季通风， 故追求宽敞通 透， 以当地易 取的 竹木 为原料。 在高 寒地 区， 服装 必须能 抵御寒 冷 ; 在湿热地 区， 服装 必须能 吸汗 透气。 北方 多产 小麦， 南方 多产 稻谷， 故北方人 喜吃 面食， 南方 人喜 吃大 米饭。 地方 文化 不仅 爱自 然环 境方面的 影响， 还受 社会 、 历史 等方面的 影响， 是在 长期 的历史发 展过程中 爱多 种因素综合影响而 形成的。 人二 71 7 1， 说明 自然环境对 你所 在地 区的 民居 、 服饰 和饮食等 有什。 观图 么影响。 2 说明湖南 、 湖北 、 江西 、 四川 、 重庆 和贵州等 地的 居民嗜 食辣椒， 与这 些地 方的 气候有 什么关系。 28 b 让第 具章 中国 的地 方文化特色和 旅游资源让 ea IEESE 学习 标准 ; 一一 结合有 关资 料， 说明 我国 地方 文化特色对 旅游业 发展 的影响。 一一 懂得保护世界文化遗产的 意义。 旅游是 大众 化的 休闲方式。 我国 地理 环境丰富多 彩， 和于 差万 别， 拥有 丰富的 旅游资源， 吸引 着人 们开展各 种旅游活动， 推动 着旅游业 的发 展。 旅游资源的 分类 旅游资源可 以分 为自然旅游资源和 人文 旅游资源两 大类。 自然 旅游资源包括名 出秀水、 奇峰异 洞 、 流录 飞瀑 、 阳交 海淮 、 旅游 气,686,0.38128156474820135,low,ocr,的 影响\n传统 民居 、 服 饰 和 饮食 的 地 区 差异 深 受 自然 环境 的 影响 。 例\n如 ， 北 方 地 区 的 传统 民居 主要 考虑 冬季 御寒 ， 故 追求 厚重 ， 以 当地\n土石 为 原料 ， 南 方 地 区 的 传统 民居 主要 考虑 夏季 通风 ， 故 追求 宽敞\n通 透 ， 以 当地 易 取 的 竹 木 为 原料 。 在 高 寒 地 区 ， 服 装 必须 能 抵御 寒\n冷 ; 在 湿热 地 区 ， 服 装 必须 能 吸 汗 透气 。 北 方 多 产 小 麦 ， 南 方 多 产\n稻谷 ， 故 北方 人 喜 吃 面食 ， 南 方 人 喜 吃 大 米饭 。\n地 方 文 化 不 仅 爱 自 然 环 境 方面 的 影响 ， 还 受 社会 、 历 史 等 方面 的\n影响 ， 是 在 长 期 的 历史 发 展 过程 中 爱 多 种 因素 综合 影响 而 形成 的 。\n&\n----------------------------- 人 -二 71 7\n1， 说 明 自然 环境 对 你 所 在 地 区 的 民居 、 服 饰 和 饮食 等 有 什 。 观 图\n么 影响 。\n2 说 明湖 南 、 湖 北 、 江 西 、 四 川 、 重 庆 和 贵州 等 地 的 居民 嗜 食 辣椒 ， 与 这 些 地 方\n的 气候 有 什么 关系 。\n=== 第 43 页 ===\n28 b 让 第 具 章 中 国 的 地 方 文化 特色 和 旅游 资源 让\nCE [ea PR\nIEESE\n学 习 标准 ;\n一 一 结合 有 关 资 料 ， 说 明 我 国 地 方 文化 特色 对 旅游 业 发 展 的\n影响 。\n一 一 懂得 保护 世界 文化 遗产 的 意义 。\n旅游 是 大 众 化 的 休闲 方式 。 我 国 地 理 环境 丰富 多 彩 ， 和 于 差 万\n别 ， 拥 有 丰富 的 旅游 资源 ， 吸 引 着 人 们 开展 各 种 旅游 活动 ， 推 动 着\n旅游 业 的 发 展 。\n旅游 资源 的 分 类\n旅游 资源 可 以 分 为 自然 旅游 资源 和 人 文 旅游 资源 两 大 类 。 自 然\n旅游 资源 包括 名 出 秀水、 奇峰 异 洞 、 流 录 飞 瀑 、 阳 交 海 淮 、 旅 游 气,2.0,70,中图版（主编_钟作慈）_七年级_义务教育教科书·地理七年级下册（主编_钟作慈）,32,2025-07-21T14:23:03.013Z,2.0,义务教育教科书·地理七年级下册（主编：钟作慈）,/Users/LeoQin/Documents/GitHub/PDFconvertor/training_data/初中/地理/中图版（主编：钟作慈）-中国地图出版社/七年级/义务教育教科书·地理七年级下册（主编：钟作慈）.pdf,七年级,tesseract.js-parallel,中图版,0.8803921568627451,0.5,1,70,,,,true,,,geography,下册,中图版（主编：钟作慈）_七年级_义务教育教科书·地理七年级下册（主编：钟作慈）.json,地理,112,初中_地理_中图版（主编：钟作慈）_七年级_义务教育教科书·地理七年级下册（主编：钟作慈）
中图版（主编_钟作慈）_七年级_义务教育教科书·地理七年级下册（主编_钟作慈）_chunk_7,7,"江 se 西龙 虎山 、 江两 鱼峰 、 浙江 江郎 山货 4 世南 布法 拉富， 大阴 地和 风布 林卡 全为 二处 汉大 过者 肌精 间污 戏二 全二 去世界咀 产一 布达 拉宫 图 6 一 1 中国的 世界遗产为 一处 世界遗产一 一主 色选 址 (资料截至 2021 年 7 月 ) 30 b 第具 章中 国的 地方 文化特色和 旅游资源 K 在我 国众多的 旅游资源中， 有 56 处 〈 截至 2021 年 7 月， 其中 1 项是 和哈萨克斯 坦 、 吉尔 吉斯 斯坦 联合 申报 ) 由于 具有人 鲜明的 自然和 地方 文化特色， 已列 人 《世界遗产名 录 》， 数量 居世 界第 2 位。 世界遗产的 确认， 为人 类文化遗产和 自然环境的 保护确定了 一个 世界各 国共同 遵守的 文明标准， 使我 们能 从全 球的 角度重新审视自己的 文化， 使遗产保护有 了明确而 具体的 要求 和前 所未 有的 激励措施。 保护 世界 遗产 对人 类认识和 传承自身历史文化， 以及 保护自 然环境有 着重要意义。 ., 4 世界遗产世界遗产指 被联合国教科 文组 织和 世界遗产委员会 确闪 的人 类罕见的 、 目前 无法 蔡代 的财富， 是全 人类 公认的 具有突出意义和 普遍价值的 文物古迹及 自然景观狭义的 世界 遗产 包括世界文化遗产世界自然遗产世界文化与 自然遗产和 文化景观四 类 .广义的 世界遗产分 为文化遗产 、 自然 遗产 、 文化 和自然双重遗产 、 记忆 和遗产 、 人类 口述和 非物质遗产 (简称非 物质 文化遗产 ) . 文化景观遗产 .1972 年， 联合 国教科 文",708,0.49413437499999996,medium-low,ocr,"江 se\n西 龙 虎 山 、 江 两 鱼 峰 、 浙 江 江 郎 山货 4 世 南\n@ 布 法 拉 富 ， 大 阴 地 和 风 布 林 卡 全 为 二 处 汉 大 过 者 肌 精 间 污 戏 二 全 二 去\n世界 咀 产 ”一 布 达 拉 宫 图 6 一 1 中国 的 世界 遗产 为 一 处 世界 遗产 一 一 主 色 选 址\n(资料 截至 2021 年 7 月 )\n=== 第 45 页 ===\n30 b * 第 具 章 中 国 的 地 方 文化 特色 和 旅游 资源 K\n在 我 国 众多 的 旅游 资源 中 ， 有 56 处 〈 截 至 2021 年 7 月 ， 其 中 1 项\n是 和 哈萨克 斯 坦 、 吉 尔 吉 斯 斯 坦 联 合 申报 ) 由 于 具有 人 鲜明 的 自然 和\n地 方 文化 特色 ， 已 列 人 《世界 遗产 名 录 》， 数 量 居 世 界 第 2 位 。\n世界 遗产 的 确认 ， 为 人 类 文化 遗产 和 自然 环境 的 保护 确定 了 一\n个 世界 各 国共 同 遵守 的 文明 标准 ， 使 我 们 能 从 全 球 的 角度 重新 审视\n自己 的 文化 ， 使 遗产 保护 有 了 明确 而 具体 的 要 求 和 前 所 未 有 的 激励\n措施 。 保 护 世 界 遗 产 对 人 类 认识 和 传承 自身 历史 文化 ， 以 及 保护 自\n然 环境 有 着 重要 意义 。\n£.,\n#— [4 世界 遗产\n世界 遗产 指 被 联合 国教 科 文 组 织 和 世界 遗产 委员 会 确 闪 的 人 类 罕见 的 、 目 前 无 法 蔡\n代 的 财富 ， 是 全 人 类 公认 的 具有 突出 意义 和 普遍 价值 的 文物 古迹 及 自然 景观 狭义 的 世\n界 遗 产 包括 “世界 文化 遗产 ”世界 自然 遗产 “世界 文化 与 自然 遗产 ”和 “文化 景观\n四 类 .广义 的 世界 遗产 分 为 文化 遗产 、 自 然 遗 产 、 文 化 和 自然 双重 遗产 、 记 忆 和 遗产 、 人\n类 口述 和 非 物质 遗产 (简称 非 物 质 文化 遗产 ) . 文化 景观 遗产 .1972 年 ， 联 合 国教 科 文",2.0,70,中图版（主编_钟作慈）_七年级_义务教育教科书·地理七年级下册（主编_钟作慈）,35,2025-07-21T14:23:03.013Z,2.0,义务教育教科书·地理七年级下册（主编：钟作慈）,/Users/LeoQin/Documents/GitHub/PDFconvertor/training_data/初中/地理/中图版（主编：钟作慈）-中国地图出版社/七年级/义务教育教科书·地理七年级下册（主编：钟作慈）.pdf,七年级,tesseract.js-parallel,中图版,0.8793103448275862,0.5,1,70,,,,true,,,mathematics,下册,中图版（主编：钟作慈）_七年级_义务教育教科书·地理七年级下册（主编：钟作慈）.json,地理,112,初中_地理_中图版（主编：钟作慈）_七年级_义务教育教科书·地理七年级下册（主编：钟作慈）
中图版（主编_钟作慈）_七年级_义务教育教科书·地理七年级下册（主编_钟作慈）_chunk_8,8,"自然景观狭义的 世界 遗产 包括世界文化遗产世界自然遗产世界文化与 自然遗产和 文化景观四 类 .广义的 世界遗产分 为文化遗产 、 自然 遗产 、 文化 和自然双重遗产 、 记忆 和遗产 、 人类 口述和 非物质遗产 (简称非 物质 文化遗产 ) . 文化景观遗产 .1972 年， 联合 国教科 文组 织在 巴黎通过 《保护世界文化和 自然遗产公约 》, 后来 根据该 公约设立了 世界遗产委 员会， 定期 评选世界各 地的 文化遗产和 自然遗产 . 地方 文化对 旅游业 的影响地 方文化是 重要的 旅游资源， 对旅游业 的发 展具 有潜在的 推动作用。 能充分体现一 个地 方 、 一个 民族的 文化特征， 并具有独特的 审美价值的 景观， 都有 一定 的旅游价值。 修一阅读以 下三 段资 料， 讨论 并归纳一 下， 地方 文化 对旅游业 起着 什么样 的作用。 山西的 大院 文化旅游山西的 大院 文化旅游具有较 高的 知名度。 从乔 家大 院开始， 王家 大院 、 常家 大 w 第二 节旅游资源 X b ) 31 院 、 渠家 大院 、 曹家 大院 加上 平遥 ae Ge 古城， 一系列以 近代商 宦住 宅为 依托下 和有 汪汪 Se 的民俗文化旅游十 分红火。 每年 春节二 多全 二都 有大 批中 外游客到 山西欢度春节或 IaaSS ERNNNSE2 探古 寻幽。 在传统上 以煤炭 、 电力 等 SS Nm 重工业 为主 的山西省， 如今 旅游 业正 一逐步成 为其 重要的 支柱产业。 山西王家大 院间 西奇 苑一 土楼下 福建西部山区至 今保存着 一些 人造型独特的 民居一 土楼。 土楼 多为 人",714,0.3105149737302977,low,ocr,"自然 景观 狭义 的 世\n界 遗 产 包括 “世界 文化 遗产 ”世界 自然 遗产 “世界 文化 与 自然 遗产 ”和 “文化 景观\n四 类 .广义 的 世界 遗产 分 为 文化 遗产 、 自 然 遗 产 、 文 化 和 自然 双重 遗产 、 记 忆 和 遗产 、 人\n类 口述 和 非 物质 遗产 (简称 非 物 质 文化 遗产 ) . 文化 景观 遗产 .1972 年 ， 联 合 国教 科 文\n组 织 在 巴黎 通过 《保护 世界 文化 和 自然 遗产 公约 》, 后 来 根据 该 公约 设立 了 世界 遗产 委\n员 会 ， 定 期 评选 世界 各 地 的 文化 遗产 和 自然 遗产 .\n地 方 文化 对 旅游 业 的 影响\n地 方 文化 是 重要 的 旅游 资源 ， 对 旅游 业 的 发 展 具 有 潜在 的 推动\n作用 。 能 充分 体现 一 个 地 方 、 一 个 民族 的 文化 特征 ， 并 具有 独特 的\n审美 价值 的 景观 ， 都 有 一 定 的 旅游 价值 。\n修一 # 阅读 以 下 三 段 资 料 ， 讨 论 并 归纳 一 下 ， 地 方 文 化 对 旅游 业 起 着 什么\n样 的 作用 。\n® 山西 的 “大 院 文化 ”旅游\n山西 的 “大 院 文化 ”旅游 具有 较 高 的 知名 度 。 从 乔 家 大 院 开始 ， 王 家 大 院 、 常 家 大\n=== 第 46 页 ===\nw 第 二 节 旅游 资源 X b ) 31\n院 、 渠 家 大 院 、 曹 家 大 院 …… 加 上 平遥\nae Ge 古城 ， 一 系列 以 近代 商 宦 住 宅 为 依托\n下 和 有 汪汪 Se 的 民俗 文化 旅游 十 分 红火 。 每 年 春节\n二 多 全 < 二 都 有 大 批 中 外 游客 到 山西 欢度 春节 或\nIaaSS=ERNNNSE2 探 古 寻 幽 。 在 传统 上 以 煤炭 、 电 力 等\nUN SS Nm 重工 业 为 主 的 山西 省 ， 如 今 旅 游 业 正\n= RE 一 逐步 成 为 其 重要 的 支柱 产业 。\n山西 王家 大 院\n® 间 西 奇 苑 一 土楼 下\n福建 西部 山区 至 今 保存 着 一 些 人\n造型 独特 的 民居 一 土楼 。 土 楼 多 为 人",2.0,70,中图版（主编_钟作慈）_七年级_义务教育教科书·地理七年级下册（主编_钟作慈）,36,2025-07-21T14:23:03.013Z,2.0,义务教育教科书·地理七年级下册（主编：钟作慈）,/Users/LeoQin/Documents/GitHub/PDFconvertor/training_data/初中/地理/中图版（主编：钟作慈）-中国地图出版社/七年级/义务教育教科书·地理七年级下册（主编：钟作慈）.pdf,七年级,tesseract.js-parallel,中图版,0.8722222222222222,0.5,1,70,,,,true,,,unknown,下册,中图版（主编：钟作慈）_七年级_义务教育教科书·地理七年级下册（主编：钟作慈）.json,地理,112,初中_地理_中图版（主编：钟作慈）_七年级_义务教育教科书·地理七年级下册（主编：钟作慈）
中图版（主编_钟作慈）_七年级_义务教育教科书·地理七年级下册（主编_钟作慈）_chunk_9,9,食作物的 种植 和饮食习惯有 什候 一么 影响。 自然环境对 生产和 生活的 影响四 天地 理区 域的 自然环境对 生产和 生活方式有 很大 影啊。 对农业生产的 影响北方地 区的 农作物一 年一 熟或 两年 三熟， 是小 麦 、 杂粮 以及 温带水 果的 主要产 区。 南方 地区 的农作物一 年两 熟或 一年 三熟， 是水 稻 、 棉花 、 茶叶 以及 亚热带和 热带水 果的 主要产 区。 青藏 地区 是高 寒畜牧区， 适宜 放牧 憩牛 和藏 绵羊等 牧畜， 在高 原上 水热 条件 较好 的一 些河 谷和 盆地， 可以 种植 青生 和吏 豆等 农作物。 西北 地区 有成 片的 草原， 还有 高山 草场， 适宜 放牧 马 、 牛和 羊等 牲畜， 在有 高山 雪水 和地 下水 浇溉 的绿洲， 可以 种植 粮食和 瓜果。 对生活方式的 影响北方地 区的 传统民居以 砖瓦 和泥土为 原料， 屋项 和墙壁厚实， 以防寒保 瞬 ;北方居民喜欢吃 面食， 出行 多走 旱路。 南方 一些 地区 的传统民居以 竹木 为原料， 便于 通风散 热， 南方 居民 喜欢 吃大 米饭， 传统 出行 可走 水路。 青藏 地区 的传统民居有 木房 、 克房 和帐篷等， 藏族 同胞 喜欢吃 糙码， 喝酥油茶。 西北 地区 的传统民居有 窄洞 和蒙古包 等， 许多 少数民族同胞喜欢吃 手扒 肉， 喝奶茶。 38 for ) 第七 章让 5 i AF)e Aa 1. 运用地 图， 回答 以下 问题。 (1) 青藏地 区的 界线与 我国 地条 第几 级阶梯的 界线大 致重合 ? 青藏地 区与 其他 地区 的地 形地 势有 什么差异 ?,710,0.4062876363636364,medium-low,ocr,食 作物 的 种 植 和 饮食 习惯 有 什 候 一 #\n么 影响 。\n自然 环境 对 生产 和 生活 的 影响\n四 天 地 理 区 域 的 自然 环境 对 生产 和 生活 方式 有 很 大 影 啊 。\n©® ”对 农业 生产 的 影响 “北方 地 区 的 农作物 一 年 一 熟 或 两 年\n三 熟 ， 是 小 麦 、 杂 粮 以 及 温带 水 果 的 主要 产 区 。 南 方 地 区 的 农作物\n一 年 两 熟 或 一 年 三 熟 ， 是 水 稻 、 棉 花 、 茶 叶 以 及 亚热带 和 热带 水 果\n的 主要 产 区 。 青 藏 地 区 是 高 寒 畜牧 区 ， 适 宜 放 牧 憩 牛 和 藏 绵羊 等 牧\n畜 ， 在 高 原 上 水 热 条 件 较 好 的 一 些 河 谷 和 盆地 ， 可 以 种 植 青 生 和 吏\n豆 等 农作物 。 西 北 地 区 有 成 片 的 草原 ， 还 有 高 山 草 场 ， 适 宜 放 牧\n马 、 牛 和 羊 等 牲畜 ， 在 有 高 山 雪 水 和 地 下 水 浇 溉 的 绿洲 ， 可 以 种 植\n粮食 和 瓜 果 。\n©® ”对 生活 方式 的 影响 ”北方 地 区 的 传统 民居 以 砖 瓦 和 泥土\n为 原料 ， 屋 项 和 墙壁 厚实 ， 以 防寒 保 瞬 ;北方 居民 喜欢 吃 面食 ， 出\n行 多 走 旱 路 。 南 方 一 些 地 区 的 传统 民居 以 竹 木 为 原料 ， 便 于 通风 散\n热 ， 南 方 居 民 喜 欢 吃 大 米饭 ， 传 统 出 行 可 走 水 路 。 青 藏 地 区 的 传统\n民居 有 木 房 、 克 房 和 帐篷 等 ， 藏 族 同 胞 喜欢 吃 糙 码 ， 喝 酥油 茶 。 西\n北 地 区 的 传统 民居 有 窄 洞 和 蒙古 包 等 ， 许 多 少数 民族 同胞 喜欢 吃 手\n扒 肉 ， 喝 奶茶 。\n=== 第 54 页 ===\n38 for ) * 第 七 章 FTOWREELF 让\n5\ni AF)e——————\nAa& 1. 运用 地 图 ， 回 答 以 下 问题 。\n(1) 青藏 地 区 的 界线 与 我 国 地 条 第 几 级 阶梯 的 界线 大 致 重合 ? 青藏 地 区 与 其 他 地\n区 的 地 形 地 势 有 什么 差异 ?,2.0,70,中图版（主编_钟作慈）_七年级_义务教育教科书·地理七年级下册（主编_钟作慈）,42,2025-07-21T14:23:03.013Z,2.0,义务教育教科书·地理七年级下册（主编：钟作慈）,/Users/LeoQin/Documents/GitHub/PDFconvertor/training_data/初中/地理/中图版（主编：钟作慈）-中国地图出版社/七年级/义务教育教科书·地理七年级下册（主编：钟作慈）.pdf,七年级,tesseract.js-parallel,中图版,0.8871595330739299,0.5,1,70,,,,true,true,,biology,下册,中图版（主编：钟作慈）_七年级_义务教育教科书·地理七年级下册（主编：钟作慈）.json,地理,112,初中_地理_中图版（主编：钟作慈）_七年级_义务教育教科书·地理七年级下册（主编：钟作慈）
