Chunk_ID,Chunk_Index,Content,Content_Length,Quality_Score,Reliability,Source_Type,Original_Content,Enhancement_Version,averageConfidence,book_name,chunkIndex,enhancementTimestamp,enhancementVersion,fileName,filePath,grade,ocrMethod,publisher,qualityMetrics_chineseCharRatio,qualityMetrics_coherenceScore,qualityMetrics_lengthScore,qualityMetrics_ocrConfidence,semanticFeatures_hasDefinition,semanticFeatures_hasExperiment,semanticFeatures_hasFormulas,semanticFeatures_hasNumbers,semanticFeatures_hasQuestion,semanticFeatures_isTableContent,semanticFeatures_subjectArea,semester,source_file,subject,totalPages,uniqueId
中图版（主编_钟作慈）_七年级_义务教育教科书·地理七年级下册（主编_钟作慈）_chunk_0,0,. me Tod A aed y H 新疆 的风力发 电西北地 区历史上 长期 处于 交通不 便 、 环境 闭赛 的状态。 新中 国成 立以 后， 先后 修建了 包兰 、 兰新 等铁路和 多条 高等 级公路， 开辟 了多 条航空线， 改善 了西北地 区的 交通状况。 交通 运输 业的 迅速发 展， 加强 了西北地 区和 中部 、 东部 地区， 特别 是沿海地 区的 区际 联系， 也加 强了 西北地 区与 中亚 各国 和俄罗斯的 经济 往来， 促进 了西 北地 区经 济的 发展。 西北地 区的 人口 和城市主要分 布在 平原 、 绿洲 和一 些矿产地。 铁路和 公路连接起 沿途城市， 人们 的出 行和 物资的 运输日 益便利。 并和 随着 社会经 济的 发展， 西北 地区 出现 了一 些新 兴城市。 阅读 以下 资料， 在地 图上 找到 资料中 介绍的 5 座城市， 讨论 一下 它们兴起的 原因。 甘肃的 金昌是 一座 新兴工业 城市， 那里 的镍 矿储量居 世界 第二 位， 现已 成为 我国 最大 的镍 、 钼生产基地和 铂族 金属提炼中 心， 称为 我国 的镍 都。 内蒙古的 自云 哪博， 蒙古语的 意思是 富饶的 圣山 . 那里有 世界最 大的 稀土丰， 储量约 占全 世界稀土总 储量的 3626。 包头依托这 一宝贵资源， 成为 全球 最大 的稀土生产和 科研基地。 100 b ) 第履 章 REFO RIPEH k 1950 年， 中国人民 解放 军在 新疆 石河 子地 区拉动了 军垦第 一梨， 从此， 石河 子新 城平地而 起。 经过 60 多年 的建设， 石河 子已 经成 为工农结合， 城乡 结合农工贸 一体,722,0.42002431444241306,medium-low,ocr,.\nme § Tod A aed y\n= H== | |\n新 疆 的 风力 发 电\n西北 地 区 历史 上 长 期 处 于 交通 不 便 、 环 境 闭 赛 的 状态 。 新 中 国\n成 立 以 后 ， 先 后 修建 了 包 兰 、 兰 新 等 铁路 和 多 条 高 等 级 公路 ， 开 辟\n了 多 条 航空 线 ， 改 善 了 西北 地 区 的 交通 状况 。 交 通 运 输 业 的 迅速 发\n展 ， 加 强 了 西北 地 区 和 中 部 、 东 部 地 区 ， 特 别 是 沿海 地 区 的 区 际 联\n系 ， 也 加 强 了 西北 地 区 与 中 亚 各 国 和 俄罗斯 的 经 济 往来 ， 促 进 了 西\n北 地 区 经 济 的 发 展 。\n西北 地 区 的 人 口 和 城市 主要 分 布 在 平原 、 绿 洲 和 一 些 矿产 地 。\n铁路 和 公路 连接 起 沿途 城市 ， 人 们 的 出 行 和 物资 的 运输 日 益 便利 。\n并 和\n随 着 社会 经 济 的 发 展 ， 西 北 地 区 出 现 了 一 些 新 兴 城市 。 阅 读 以 下 资料 ， 在 地 图 上 找\n到 资料 中 介绍 的 5 座 城市 ， 讨 论 一 下 它们 兴起 的 原因 。\n甘肃 的 金昌 是 一 座 新 兴工 业 城 市 ， 那 里 的 镍 矿 储量 居 世 界 第 二 位 ， 现 已 成 为 我 国 最\n大 的 镍 、 钼 生产 基地 和 铂 族 金属 提炼 中 心 ， 称 为 我 国 的 “ 镍 都 ”。\n内 蒙古 的 自 云 哪 博 ， 蒙 古语 的 意思 是 “富饶 的 圣 山 . 那里 有 世界 最 大 的 稀土 丰 ，\n储量 约 占 全 世界 稀土 总 储量 的 3626。 包头 依托 这 一 宝贵 资源 ， 成 为 全 球 最 大 的 稀土 生产\n和 科研 基地 。\n=== 第 11 页 ===\n100 b ) * 第 履 章 REFO@RIPEH k\n1950 年 ， 中 国人 民 解 放 军 在 新 疆 石 河 子 地 区 拉动 了 “军垦 第 一 梨 ”， 从 此 ， 石 河 子\n新 城 平地 而 起 。 经 过 60 多 年 的 建设 ， 石 河 子 已 经 成 为 工农 结合 ， 城 乡 结合 农工 贸 一 体,2.0,70,中图版（主编_钟作慈）_七年级_义务教育教科书·地理七年级下册（主编_钟作慈）,6,2025-07-21T14:23:03.013Z,2.0,义务教育教科书·地理七年级下册（主编：钟作慈）,/Users/LeoQin/Documents/GitHub/PDFconvertor/training_data/初中/地理/中图版（主编：钟作慈）-中国地图出版社/七年级/义务教育教科书·地理七年级下册（主编：钟作慈）.pdf,七年级,tesseract.js-parallel,中图版,0.8530534351145038,0.5,1,70,,,,true,,,geography,下册,中图版（主编：钟作慈）_七年级_义务教育教科书·地理七年级下册（主编：钟作慈）.json,地理,112,初中_地理_中图版（主编：钟作慈）_七年级_义务教育教科书·地理七年级下册（主编：钟作慈）
中图版（主编_钟作慈）_七年级_义务教育教科书·地理七年级下册（主编_钟作慈）_chunk_1,1,水稻 的生长习性小 麦是 一种 温带作物， 适应 范围广， 根据 对温度的 要求 不同， 可以 分为 冬小麦和 春小 麦。 冬小麦秋季播种， 第二 年夏季收获 ;春小麦春季播种， 当年 秋季收获 . 水稳 分为 籼稻和 粳稻两 大类。 籼稻米粒 狭长， 黏性 较小， 耐湿 、 耐热， 不耐寒， 适宜 在低 纬度 湿热地 区种 植。 粳稳 米粒 短圆， 竹性 较大， 不耐 高温， 适宜 在中 纬度地 区和 低纬度海拔较 高地 区种 植 . W 第一 节 Ardb2HIeLA 充 D 5 我国 的经 济作物种 类繁多， 有纤维 、 油料 、 糖料 和饮料作物等。 纤维 作物中 的棉花主要种 植在 长江 中下 游地 区 、 黄河中下 游地 区和 新疆。 油料 作物 中的 油菜主要种 植在 长江 流域 和西北部 分地 区， 花生 种植 以山东 、 河南 最为 集中。 狂料 作物 中的 甘芒 主要种 植在 广东 、 广西 、 海南 、 福建 和云南， 醋菜 主要 种植 在黑龙江 、 内蒙 古和 新疆。 饮料 作物中 的茶叶主要种 植在 南方的 丘陵 、 山地。 11 69 局一 803 560 A 明史 4 P 六单位 : 万吨 2 人 19784F 棉花油菜籽 花生甘蔗甜菜茶叶 ES5 3 中国主要经 济作 物产量 1 oo i 从二 二 P: 中上 及有 ia 人本 油菜种 植甘蔗收割纤维 、 油料 、 糖料 和饮料作物 2 纤维作物包括棉花 、 黄麻 、 芦苇 和棕榈等， 主要 利用各 自的 纤维作为生产布匹 、 纸张 、 地毯 等的 工业原料 . 油料作物包括油菜 、 大豆 、 花生 、 向日 葵和 芝麻等， 主要 用来 榨取食用油， 或作为工业原料 .,738,0.3500025408348457,low,ocr,水 稻 的 生长 习性\n小 麦 是 一 种 温带 作物 ， 适 应 范围 广 ， 根 据 对 温度 的 要 求 不 同 ， 可 以 分 为 冬小麦 和 春\n小 麦 。 冬小麦 秋季 播种 ， 第 二 年 夏季 收获 ;春小麦 春季 播种 ， 当 年 秋季 收获 .\n水 稳 分 为 籼稻 和 粳稻 两 大 类 。 籼 稻米 粒 狭长 ， 黏 性 较 小 ， 耐 湿 、 耐 热 ， 不 耐寒 ， 适\n宜 在 低 纬 度 湿热 地 区 种 植 。 粳 稳 米 粒 短 圆 ， 竹 性 较 大 ， 不 耐 高 温 ， 适 宜 在 中 纬度 地 区 和\n低 纬度 海拔 较 高 地 区 种 植 .\n=== 第 18 页 ===\nW 第 一 节 Ardb2HIeLA 充 D 5\n我 国 的 经 济 作物 种 类 繁多 ， 有 纤维 、 油 料 、 糖 料 和 饮料 作物\n等 。 纤 维 作物 中 的 棉花 主要 种 植 在 长 江 中 下 游 地 区 、 黄 河中 下 游 地\n区 和 新 疆 。 油 料 作 物 中 的 油菜 主要 种 植 在 长 江 流 域 和 西北 部 分 地\n区 ， 花 生 种 植 以 山东 、 河 南 最 为 集中 。 狂 料 作 物 中 的 甘 芒 主要 种 植\n在 广东 、 广 西 、 海 南 、 福 建 和 云南 ， 醋 菜 主 要 种 植 在 黑龙 江 、 内 蒙\n古 和 新 疆 。 饮 料 作物 中 的 茶叶 主要 种 植 在 南方 的 丘陵 、 山 地 。\n11 69\n局 一\n803\n560 A\n明史 4 P 六\n单位 : 万 吨 2 人 19784F\n棉花 油菜 籽 花生 甘蔗 甜菜 茶叶\nES5—3 中国 主要 经 济 作 物产 量\n1 oo IR \\ni 从 二 二\nP: 中 上 及 有\nia\n人\n本\n油菜 种 植 甘蔗 收割\n纤维 、 油 料 、 糖 料 和 饮料 作物 #*— £2\n纤维 作物 包括 棉花 、 黄 麻 、 芦 苇 和 棕榈 等 ， 主 要 利用 各 自 的 纤维 作为 生产 布匹 、 纸\n张 、 地 毯 等 的 工业 原料 .\n油料 作物 包括 油菜 、 大 豆 、 花 生 、 向 日 葵 和 芝麻 等 ， 主 要 用 来 榨取 食用 油 ， 或 作为\n工业 原料 .,2.0,70,中图版（主编_钟作慈）_七年级_义务教育教科书·地理七年级下册（主编_钟作慈）,11,2025-07-21T14:23:03.013Z,2.0,义务教育教科书·地理七年级下册（主编：钟作慈）,/Users/LeoQin/Documents/GitHub/PDFconvertor/training_data/初中/地理/中图版（主编：钟作慈）-中国地图出版社/七年级/义务教育教科书·地理七年级下册（主编：钟作慈）.pdf,七年级,tesseract.js-parallel,中图版,0.8180112570356473,0.5,1,70,,,,true,,,mathematics,下册,中图版（主编：钟作慈）_七年级_义务教育教科书·地理七年级下册（主编：钟作慈）.json,地理,112,初中_地理_中图版（主编：钟作慈）_七年级_义务教育教科书·地理七年级下册（主编：钟作慈）
中图版（主编_钟作慈）_七年级_义务教育教科书·地理七年级下册（主编_钟作慈）_chunk_2,2,人本 油菜种 植甘蔗收割纤维 、 油料 、 糖料 和饮料作物 2 纤维作物包括棉花 、 黄麻 、 芦苇 和棕榈等， 主要 利用各 自的 纤维作为生产布匹 、 纸张 、 地毯 等的 工业原料 . 油料作物包括油菜 、 大豆 、 花生 、 向日 葵和 芝麻等， 主要 用来 榨取食用油， 或作为工业原料 . 糖料 作物包括甜菜 、 甘芒 等， 主要 作为工业制 糖的 原料 . 饮料作物包括茶叶 、 咖啡 和可 可等， 经过 加工 供人 饮用， 能够 提神醒 脑 . 6 动 x 第五 素中 国的 经济 发展 妇做 一运用地 图， 说出 你家 乡种 植的 主要粮食作物和 经济 作物， 并简要说 明为 什么适宜种 植这 些农作物。 我国 西部地 区有 大面积的 草场， 以放牧牛 、 羊 、 马等 畜牧业 为主， 内和 蒙古 、 新疆 、 青海 和西藏是 我国 的四 大牧区。 我国 东部地 区有 丰富的 饲料来 源， 大量 饲养生猪 、 奶牛 和禽类等。 一一 sa 有 7 区 Se 区二 3 草原收场养 鸡声 进入 21 世纪 以后， 我国 大力 建设 粮食 、 油料 、 棉花 、 糖料 、 水果 、 乳 、 肉等 农产品的 生产基地， 改变 优质 农产品生产比较分 散的 状况， 取得 了明显成 效。 从 2008 年开始， 我国 北方的 粮食产量超过南方， 增产 粮食中 的一 半来 自黑龙江 省。 历史上长 期存在的 南粮 北运 已经 变为 北粮 南运。 因地制宜发 展农业一 个地 区的 农业生产与 该地 区的 自然条 件和 社会经 济条 件有 着十 分密切的 联系。 农业生产需要适宜的 温度 、 光照 、 水分 、 地形 、 土壤 等自然条,728,0.45252572992700724,medium-low,ocr,人\n本\n油菜 种 植 甘蔗 收割\n纤维 、 油 料 、 糖 料 和 饮料 作物 #*— £2\n纤维 作物 包括 棉花 、 黄 麻 、 芦 苇 和 棕榈 等 ， 主 要 利用 各 自 的 纤维 作为 生产 布匹 、 纸\n张 、 地 毯 等 的 工业 原料 .\n油料 作物 包括 油菜 、 大 豆 、 花 生 、 向 日 葵 和 芝麻 等 ， 主 要 用 来 榨取 食用 油 ， 或 作为\n工业 原料 .\n糖 料 作物 包括 甜菜 、 甘 芒 等 ， 主 要 作为 工业 制 糖 的 原料 .\n饮料 作物 包括 茶叶 、 咖 啡 和 可 可 等 ， 经 过 加 工 供 人 饮用 ， 能 够 提神 醒 脑 .\n=== 第 19 页 ===\n6 动 *x 第 五 素 “中 国 的 经 济 发 展 “ 妇\n做 一 # 运用 地 图 ， 说 出 你 家 乡 种 植 的 主要 粮食 作物 和 经 济 作物 ， 并 简要 说\n明 为 什么 适宜 种 植 这 些 农作物 。\n我 国 西部 地 区 有 大 面积 的 草场 ， 以 放牧 牛 、 羊 、 马 等 畜牧 业 为\n主 ， 内 和 蒙 古 、 新 疆 、 青 海 和 西藏 是 我 国 的 四 大 牧区 。 我 国 东部 地 区\n有 丰富 的 饲料 来 源 ， 大 量 饲养 生猪 、 奶 牛 和 禽类 等 。\nER 一 一 sa 有\n7 区\nSe 区 二\n3\n草原 收场 养 鸡 声\n进入 21 世 纪 以 后 ， 我 国 大 力 建 设 粮 食 、 油 料 、 棉 花 、 糖 料 、 水\n果 、 乳 、 肉 等 农产品 的 生产 基地 ， 改 变 优 质 农产品 生产 比较 分 散 的\n状况 ， 取 得 了 明显 成 效 。 从 2008 年 开始 ， 我 国 北方 的 粮食 产量 超过\n南方 ， 增 产 粮食 中 的 一 半 来 自 黑龙 江 省 。 历 史上 长 期 存在 的 “ 南 粮\n北 运 ”已 经 变 为 “ 北 粮 南 运 ”。\n因地制宜 发 展 农业\n一 个 地 区 的 农业 生产 与 该 地 区 的 自然 条 件 和 社会 经 济 条 件 有 着\n十 分 密切 的 联系 。\n农业 生产 需要 适宜 的 温度 、 光 照 、 水 分 、 地 形 、 土 壤 等 自然 条,2.0,70,中图版（主编_钟作慈）_七年级_义务教育教科书·地理七年级下册（主编_钟作慈）,12,2025-07-21T14:23:03.013Z,2.0,义务教育教科书·地理七年级下册（主编：钟作慈）,/Users/LeoQin/Documents/GitHub/PDFconvertor/training_data/初中/地理/中图版（主编：钟作慈）-中国地图出版社/七年级/义务教育教科书·地理七年级下册（主编：钟作慈）.pdf,七年级,tesseract.js-parallel,中图版,0.8702290076335878,0.5,1,70,,,,true,,,unknown,下册,中图版（主编：钟作慈）_七年级_义务教育教科书·地理七年级下册（主编：钟作慈）.json,地理,112,初中_地理_中图版（主编：钟作慈）_七年级_义务教育教科书·地理七年级下册（主编：钟作慈）
中图版（主编_钟作慈）_七年级_义务教育教科书·地理七年级下册（主编_钟作慈）_chunk_3,3,"技术培育的 山羊袁隆平与 超级杂交水 稻 Rs R E 本， 人 a. Bv, Ret a 9 : iiia Tim REd 人 ra 飞机田间作业机 械化 收割棉花智能大 棚终端助 推武山蔬菜生产误 一 753 甘肃省 天水 市武山县 在一 些村庄为 蔬菜种 植户 的冬 暖棚 安装 了智能大 棚终端设备。 一位 菜农初次收 到你 的大 棚温度超过预 设范围， 请采取措施的 短信后， 感到 既新 奇又 高兴。 智能大 棚环 境监 测系统利用互联网 等技术， 将大 棚内 温度 、 湿度 等信息通过短信平 合传递到 用户 的手机上。 农户 足不 出户， 靠一 部手机就 能随时了 解大 棚内 的环境状况， 节省了 时间 和精力， 让农户切身体验到 信息化 带来 的便捷和 高效。 8 b ) x 第五 章中 国的 经济 发展 让 2012 年， 智能 大棚 环境 监测系统已 经测试成 功， 进入 推广应 用阶段。 这项 技术将 极大 地改善农户的 生产条 件， 提高 农业生产效率， 进一 步提升蔬菜产业现代化 、 信息 化发 展水 平。 随着 人口 数量和 饲料用 量的 增加， 我国 对粮食的 需求量 正在 不断 扩大， 粮食 生产 面临巨大的 压力。 必须 通过提高农业现代化 水平 等途径， 变农业大 国为 农业强国， 以保证我 国的 粮食安全。 本枉 汪凡 轴一 na 1. 运用图 5 一 1， 说出 北方和 南方的 主要粮食作物有 什么不 同， 分析 造成 这种 差异的 因素有 哪些。 2. 运用图 5 1， 说出 畜牧业 的主要分 布地区， 分析 影响 其分 布的 主要原因。 3. 举例说 明科学 技术对 我国 农业现代化 的重要作用。",730,0.37160173310225303,low,ocr,"技术 培育 的 山羊 NA 袁隆平 与 超级 杂交 水 稻\nRs  R\nRAR E\n本，\n人\na. Bv, Ret a 9\n: €iiia Tim REd\n人 ra\n飞机 田间 作业 机 械 化 收割 棉花\n智能 大 棚 终端 助 推 武山 蔬菜 生产 误 一 753\n甘肃 省 天 水 市 武山 县 在 一 些 村庄 为 蔬菜 种 植 户 的 冬 暖 棚 安 装 了 智能 大 棚 终端 设备 。\n一 位 菜农 初次 收 到 “你 的 大 棚 温度 超过 预 设 范围 ， 请 采取 措施 ”的 短信 后 ， 感 到 既 新 奇\n又 高 兴 。\n智能 大 棚 环 境 监 测 系统 利用 互联 网 等 技术 ， 将 大 棚 内 温度 、 湿 度 等 信息 通过 短信 平\n合 传递 到 用 户 的 手机 上 。 农 户 足 不 出 户 ， 靠 一 部 手机 就 能 随时 了 解 大 棚 内 的 环境 状况 ，\n节省 了 时 间 和 精力 ， 让 农户 切身 体验 到 信息 化 带 来 的 便捷 和 高 效 。\n=== 第 21 页 ===\n8 b ) *x 第 五 章 中 国 的 经 济 发 展 让\n2012 年 ， 智 能 大 棚 环 境 监测 系统 已 经 测试 成 功 ， 进 入 推广 应 用 阶段 。 这 项 技术 将 极\n大 地 改善 农户 的 生产 条 件 ， 提 高 农业 生产 效率 ， 进 一 步 提升 蔬菜 产业 现代 化 、 信 息 化 发\n展 水 平 。\n随 着 人 口 数量 和 饲料 用 量 的 增加 ， 我 国 对 粮食 的 需求 量 正 在 不\n断 扩 大 ， 粮 食 生 产 面临 巨大 的 压力 。 必 须 通过 提高 农业 现代 化 水 平\n等 途径 ， 变 农业 大 国 为 农业 强国 ， 以 保证 我 国 的 粮食 安全 。\n本\n枉 -\n汪 凡 轴 一\nna 1. 运用 图 5 一 1， 说 出 北方 和 南方 的 主要 粮食 作物 有 什么 不\n同 ， 分 析 造 成 这 种 差异 的 因素 有 哪些 。\n2. 运用 图 5-1， 说 出 畜牧 业 的 主要 分 布地 区 ， 分 析 影 响 其 分 布 的 主要 原因 。\n3. 举例 说 明科 学 技术 对 我 国 农业 现代 化 的 重要 作用 。\n=== 第 22 页 ===",2.0,70,中图版（主编_钟作慈）_七年级_义务教育教科书·地理七年级下册（主编_钟作慈）,14,2025-07-21T14:23:03.013Z,2.0,义务教育教科书·地理七年级下册（主编：钟作慈）,/Users/LeoQin/Documents/GitHub/PDFconvertor/training_data/初中/地理/中图版（主编：钟作慈）-中国地图出版社/七年级/义务教育教科书·地理七年级下册（主编：钟作慈）.pdf,七年级,tesseract.js-parallel,中图版,0.8498168498168498,0.5,1,70,,true,,true,,,biology,下册,中图版（主编：钟作慈）_七年级_义务教育教科书·地理七年级下册（主编：钟作慈）.json,地理,112,初中_地理_中图版（主编：钟作慈）_七年级_义务教育教科书·地理七年级下册（主编：钟作慈）
中图版（主编_钟作慈）_七年级_义务教育教科书·地理七年级下册（主编_钟作慈）_chunk_4,4,凡轴 一 na 1. 运用图 5 一 1， 说出 北方和 南方的 主要粮食作物有 什么不 同， 分析 造成 这种 差异的 因素有 哪些。 2. 运用图 5 1， 说出 畜牧业 的主要分 布地区， 分析 影响 其分 布的 主要原因。 3. 举例说 明科学 技术对 我国 农业现代化 的重要作用。 w 第二 节工业的 分市 和发 展次 D 0 一一 诊一 和工业本 仿而 击总 导学 习标准 : 一一 运用资料说 出我 国工 业的 分布 特氮。 一一 了解 我国 高新 技术产业的 发展 状况。 工业 (industry) 指开 采各 种自然资源， 以及 对各 种原材料进行加 工， 制造 生产资料和 生活资料的 过程。 工业 是国民经 济的 主导产 业， 工业 发展 水平 是衡量一 个国家经 济发 达程 度的 重要标志。 我们 学习 和生活中 用到 的许多物品都 是工业产品。 这些 产品 既满足了 我们 学习 的需要， 也为 人们 的生活提供了 便利。 Ke 7o A 在家 和学 校中， 我们 随处可 见各 种工业产品， 如计算机 、 钟表 、 家具 、 灯具 、 服装 等等。 请你 任选 一种， 了解 其生产过 程。 es 7 六一 1 二 Fi 加则 则由 把于 四 Viaa fb C fee eet L 4 5 a 站 10 动 x 第五 章中 国的 经济 发展 工业的 分布 新中 国成 立以 前， 我国 工业 基础 薄弱， 只有 煤炭 、 纺织 、 火力 发电 、 食品 加工 等部 门， 火车 、 汽车 等工业品 都不 能自己制造。 当时 我国 工业 的分 布很 不均衡， 大部 分集中在 洛海 的辽宁 、 山东 、 上,720,0.30544042933810367,low,ocr,凡 轴 一\nna 1. 运用 图 5 一 1， 说 出 北方 和 南方 的 主要 粮食 作物 有 什么 不\n同 ， 分 析 造 成 这 种 差异 的 因素 有 哪些 。\n2. 运用 图 5-1， 说 出 畜牧 业 的 主要 分 布地 区 ， 分 析 影 响 其 分 布 的 主要 原因 。\n3. 举例 说 明科 学 技术 对 我 国 农业 现代 化 的 重要 作用 。\n=== 第 22 页 ===\nw 第 二 节 工业 的 分 市 和 发 展 次 D 0\n-一 一-\n诊 一 和 工业 本 仿 而 击 总 导\n学 习 标准 :\n一 一 运用 资料 说 出 我 国 工 业 的 分 布 特 氮 。\n一 一 了 解 我 国 高 新 技术 产业 的 发 展 状况 。\n工业 (industry) 指 开 采 各 种 自然 资源 ， 以 及 对 各 种 原材料 进行\n加 工 ， 制 造 生产 资料 和 生活 资料 的 过 程 。 工 业 是 国民 经 济 的 主导 产\n业 ， 工 业 发 展 水 平 是 衡量 一 个 国家 经 济 发 达 程 度 的 重要 标志 。 我 们\n学 习 和 生活 中 用 到 的 许多 物品 都 是 工业 产品 。 这 些 产 品 既 满足 了 我\n们 学 习 的 需要 ， 也 为 人 们 的 生活 提供 了 便利 。\nRD\nKe 7o\nA ——\n在 家 和 学 校 中 ， 我 们 随处 可 见 各 种 工业 产品 ， 如 计算 机 、 钟 表 、 家 具 、 灯 具 、 服\n装 等 等 。 请 你 任 选 一 种 ， 了 解 其 生产 过 程 。\nSS es =\n7 六- 一 | |] 1\n二 Fi 加 则 则 | 由\n把 于\n四  | — Viaa ~ JLL fb\n| C fee eet\nEL L 4 “ 5 a 站\n=== 第 23 页 ===\n10 动 *x 第 五 章 中 国 的 经 济 发 展 *\n工业 的 分 布\n新 中 国 成 立 以 前 ， 我 国 工 业 基 础 薄弱 ， 只 有 煤炭 、 纺 织 、 火 力\n发 电 、 食 品 加 工 等 部 门 ， 火 车 、 汽 车 等 工业 品 都 不 能 自己 制造 。 当\n时 我 国 工 业 的 分 布 很 不 均衡 ， 大 部 分 集中 在 洛 海 的 辽宁 、 山 东 、 上,2.0,70,中图版（主编_钟作慈）_七年级_义务教育教科书·地理七年级下册（主编_钟作慈）,15,2025-07-21T14:23:03.013Z,2.0,义务教育教科书·地理七年级下册（主编：钟作慈）,/Users/LeoQin/Documents/GitHub/PDFconvertor/training_data/初中/地理/中图版（主编：钟作慈）-中国地图出版社/七年级/义务教育教科书·地理七年级下册（主编：钟作慈）.pdf,七年级,tesseract.js-parallel,中图版,0.81640625,0.5,1,70,,,,true,,,unknown,下册,中图版（主编：钟作慈）_七年级_义务教育教科书·地理七年级下册（主编：钟作慈）.json,地理,112,初中_地理_中图版（主编：钟作慈）_七年级_义务教育教科书·地理七年级下册（主编：钟作慈）
