Chunk_ID,Chunk_Index,Content,Content_Length,Quality_Score,Reliability,Source_Type,Original_Content,Enhancement_Version,averageConfidence,book_name,chunkIndex,enhancementTimestamp,enhancementVersion,fileName,filePath,grade,ocrMethod,publisher,qualityMetrics_chineseCharRatio,qualityMetrics_coherenceScore,qualityMetrics_lengthScore,qualityMetrics_ocrConfidence,semanticFeatures_hasDefinition,semanticFeatures_hasExperiment,semanticFeatures_hasFormulas,semanticFeatures_hasNumbers,semanticFeatures_hasQuestion,semanticFeatures_isTableContent,semanticFeatures_subjectArea,semester,source_file,subject,totalPages,uniqueId
中图版（主编_钟作慈）_七年级_义务教育教科书·地理七年级下册（主编_钟作慈）_chunk_10,10,民族同胞喜欢吃 手扒 肉， 喝奶茶。 38 for ) 第七 章让 5 i AF)e Aa 1. 运用地 图， 回答 以下 问题。 (1) 青藏地 区的 界线与 我国 地条 第几 级阶梯的 界线大 致重合 ? 青藏地 区与 其他 地区 的地 形地 势有 什么差异 ? (2) 西北地 区与 北方地 区之 间的 界线， 与哪 一条 年等 降水量 线大 致重合 ? 西北地 区与 北方地 区的 千湿 状况有 什么差异 ? (5) 秦岭一 淮河一 线与 哪一 条年 等降水量 线和 哪一 条 1 月平均气温等 温线 大致 重合 ? 南方地 区和 北方地 区的 降水量 及冬季和 气温有 什么差异 ? 2. 说出 南米 北面和 南船 北马 分别 说的 是南北方 居民 哪方面生活方式的 差异， 你还 知道哪些差异。 3. 说出 你的 家乡 位于 四大 地理 区域 中的 哪个地 区， 举例 说明 当地 自然环境对 生产和 生活方式有 什么影响。 名 4 p 外呆 认识中 国的 地理 区域 第一 节北方地 区第 三节 青藏地 区自然环境和 农业发 展 40 藏族文化的 发源 地 79 能源 矿产和 工业基地 43 世界屋 肴 81 环境问题的 防治 ( 选等) 45 高原 气候 和农 牧业 82 黄土高 原 47 能源 和矿产 〈 选学 ) 84 华北平原 49 三江 源地 区 86 首都北京 51 第四 节西北地 区第 二节。 南方地 区多 民族聚居的 广阔地 域 89 自然环境和 农业发 展 58 温带大 陆性 气候区 91 主要自然灾害和 环境问题 ( 选学 ) 61 灌溉农业和 畜牧业 93 长江 三角 浏 63 能源 基地 〈 选学 ) 97 珠江三 角浏 67 沙漠治理和 草场保护 100,752,0.3806367066895368,low,ocr,民族 同胞 喜欢 吃 手\n扒 肉 ， 喝 奶茶 。\n=== 第 54 页 ===\n38 for ) * 第 七 章 FTOWREELF 让\n5\ni AF)e——————\nAa& 1. 运用 地 图 ， 回 答 以 下 问题 。\n(1) 青藏 地 区 的 界线 与 我 国 地 条 第 几 级 阶梯 的 界线 大 致 重合 ? 青藏 地 区 与 其 他 地\n区 的 地 形 地 势 有 什么 差异 ?\n(2) 西北 地 区 与 北方 地 区 之 间 的 界线 ， 与 哪 一 条 年 等 降水 量 线 大 致 重合 ? 西北 地\n区 与 北方 地 区 的 千 湿 状况 有 什么 差异 ?\n(5) 秦岭 一 淮河 一 线 与 哪 一 条 年 等 降水 量 线 和 哪 一 条 1 月 平均 气温 等 温 线 大 致 重\n合 ? 南方 地 区 和 北方 地 区 的 降水 量 及 冬季 和 气温 有 什么 差异 ?\n2. 说 出 “ 南 米 北面 ”和 “ 南 船 北 马 ”分 别 说 的 是 南北 方 居 民 哪 方面 生活 方式 的 差\n异 ， 你 还 知道 哪些 差异 。\n3. 说 出 你 的 家 乡 位 于 四 大 地 理 区 域 中 的 哪个 地 区 ， 举 例 说 明 当 地 自然 环境 对 生产\n和 生活 方式 有 什么 影响 。\n=== 第 55 页 ===\n名 4 p— 外\n呆\n认识 中 国 的 地 理 区 域\n第 一 节 ”北方 地 区 第 三 节 ”青藏 地 区\n自然 环境 和 农业 发 展 40 藏族 文化 的 发 源 地 79\n能 源 矿产 和 工业 基地 43 世界 屋 肴 81\n环境 问题 的 防治 ( 选 等) 45 高 原 气 候 和 农 牧 业 82\n黄土 高 原 47 能 源 和 矿产 〈 选 学 ) 84\n华北 平原 49 三 江 源 地 区 86\n首都 北京 51\n第 四 节 ”西北 地 区\n第 二 节 。 南方 地 区 多 民族 聚居 的 广阔 地 域 ”89\n自然 环境 和 农业 发 展 58 温带 大 陆 性 气候 区 91\n主要 自然 灾害 和 环境 问题 ( 选 学 ) 61 灌溉 农业 和 畜牧 业 93\n长 江 三 角 浏 63 能 源 基地 〈 选 学 ) 97\n珠江 三 角 浏 67 沙漠 治理 和 草场 保护 100,2.0,70,中图版（主编_钟作慈）_七年级_义务教育教科书·地理七年级下册（主编_钟作慈）,43,2025-07-21T14:23:03.013Z,2.0,义务教育教科书·地理七年级下册（主编：钟作慈）,/Users/LeoQin/Documents/GitHub/PDFconvertor/training_data/初中/地理/中图版（主编：钟作慈）-中国地图出版社/七年级/义务教育教科书·地理七年级下册（主编：钟作慈）.pdf,七年级,tesseract.js-parallel,中图版,0.819366852886406,0.5,1,70,,,,true,true,,geography,下册,中图版（主编：钟作慈）_七年级_义务教育教科书·地理七年级下册（主编：钟作慈）.json,地理,112,初中_地理_中图版（主编：钟作慈）_七年级_义务教育教科书·地理七年级下册（主编：钟作慈）
中图版（主编_钟作慈）_七年级_义务教育教科书·地理七年级下册（主编_钟作慈）_chunk_11,11,和图 像外， 还配置有 以下 栏目 : 5 明确学 习该 节内 容时 应掌握的 基础知识和 基本技能， 以及 相应的 学习 方法。 老师组 织同 学们 自己演示 、 绘制。 量算 、 填写的 活动内 容与 要求。 老师指导同学们 自己阅读的 有关 背景 资料 、 知识拓展 、 名词 解释等 内容 与要 求。 起二 超老师引导同学们 质疑启 思 、 深入 思考的 问题与 要求。 spgee 帮助同学们 学会 判读地 理图 像和 掌握学 习区 域地 理基本方法的 内容 与要 求。 黄画 练司 促使同学们 对该 节内 容加 以巩固和 应用 的练习题 或实际操作要 求。 实或 活动需要同学们 利用一 定时间 合作完成的 主题性 、 研究 性 、 实万 性调查或 考察活动要 求。 同学们 在学 习过 程中， 要注意以 下三 个方面 : 做好 准备工作积极主动学 习课 后复习实践课 前预习翻阅教科 e 文图 对照 除了重视回想反思对 照教科书 中将 要学 习的 内容， 根课文内 容， 还要 重视地 图书 内容， 把课 上的 学习 内据 学习 标准 明确 学习。 内容， 在学 习时 反复阅读容 全面 地回想一 遍， 通过 任务和 目标。 有关 地图， 掌握 读图 方法， 反思， 明确应 该掌握的 知提出问题从 新的 学把 知识落实在 地图 上。 识与 方法。 习内 容中 理出 自己有 疑 e 积极活动按照各 个 e 巩固练习按照老师间 、 难理解的 问题， 准备 栏目的 要求， 积极 认真的 要求， 认真 做好 练习在 课堂上 加以 解决。 地做 一做 、 读一 读 、 想一 题， 巩国 所学 的已 有知识备 齐用 品除了教科， 想 、 练习 、 实践。 和新 内容。,739,0.5396912028725313,medium-low,ocr,和 图 像 外 ， 还 配置 有 以 下 栏目 :\n5 明确 学 习 该 节 内 容 时 应 掌握 的 基础 知识 和\n基本 技能 ， 以 及 相应 的 学 习 方 法 。\n老师 组 织 同 学 们 自己 演示 、 绘 制 。 量 算 、\n填写 的 活动 内 容 与 要 求 。\n老师 指导 同学 们 自己 阅读 的 有 关 背 景 资料 、\n知识 拓展 、 名 词 解释 等 内 容 与 要 求 。\n起 二 超 老师 引导 同学 们 质疑 启 思 、 深 入 思考 的\n问题 与 要 求 。\nspgee 帮助 同学 们 学 会 判读 地 理 图 像 和 掌握 学 习\n区 域 地 理 基本 方法 的 内 容 与 要 求 。\n黄 画 练 司 促使 同学 们 对 该 节 内 容 加 以 巩固 和 应 用 的\n练习 题 或 实际 操作 要 求 。\n实 或 活动 需要 同学 们 利用 一 定时 间 合作 完成 的 主题\n性 、 研 究 性 、 实 万 性 调查 或 考察 活动 要 求 。\n同学 们 在 学 习 过 程 中 ， 要 注意 以 下 三 个 方面 :\n做 好 准备 工作 积极 主动 学 习 课 后 复习 实践\n@ 课 前 预习 翻阅 教科 e 文 图 对 照 “除了 重视 @ 回想 反思 ”对 照 教科\n书 中 将 要 学 习 的 内 容 ， 根 “课文 内 容 ， 还 要 重视 地 图 书 内 容 ， 把 课 上 的 学 习 内\n据 “学 习 标 准 ” 明 确 学 习 。 内容， 在 学 习 时 反复 阅读 容 全 面 地 回想 一 遍 ， 通 过\n任务 和 目标 。 有 关 地 图 ， 掌 握 读 图 方法 ， 反思， 明确 应 该 掌握 的 知\n@ 提出 问题 “从 新 的 学 “把 知识 落实 在 地 图 上 。 识 与 方法 。\n习 内 容 中 理 出 自己 有 疑  e 积极 活动 ”按照 各 个 e 巩固 练习 按照 老师\n间 、 难 理解 的 问题 ， 准 备 ”栏目 的 要 求 ， 积 极 认真 ”的 要 求 ， 认 真 做 好 练习\n在 课堂 上 加 以 解决 。 地 做 一 做 、 读 一 读 、 想 一 题 ， 巩 国 所 学 的 已 有 知识\n@ 备 齐 用 品 “除了 教科 ， 想 、 练 习 、 实 践 。 和 新 内 容 。,2.0,70,中图版（主编_钟作慈）_七年级_义务教育教科书·地理七年级下册（主编_钟作慈）,47,2025-07-21T14:23:03.013Z,2.0,义务教育教科书·地理七年级下册（主编：钟作慈）,/Users/LeoQin/Documents/GitHub/PDFconvertor/training_data/初中/地理/中图版（主编：钟作慈）-中国地图出版社/七年级/义务教育教科书·地理七年级下册（主编：钟作慈）.pdf,七年级,tesseract.js-parallel,中图版,0.9003690036900369,0.6,1,70,,,,true,,,general,下册,中图版（主编：钟作慈）_七年级_义务教育教科书·地理七年级下册（主编：钟作慈）.json,地理,112,初中_地理_中图版（主编：钟作慈）_七年级_义务教育教科书·地理七年级下册（主编：钟作慈）
中图版（主编_钟作慈）_七年级_义务教育教科书·地理七年级下册（主编_钟作慈）_chunk_12,12,"效由 于过 度开 垦 、 过度 使用 化肥 和农药 、 土壤 盐碱 化等 原因， 北方 地区 的部 分农田退化， 土壤 肥力 下降。 为了 提高和 保护农田的 土夜 第一 节北方地 区六 b ) 47 壤肥 力， 各地 农业科技人 员指 导农 民科 学耕种， 多施 有机 肥， 多使 用生物杀 虫剂， 完善 灌溉和 排水设施， 取得 了良好的 效果。 北大荒 "" 和 ""北大仓 "" 天北大荒 是人 们对 松嫩 平原 北部 和三 江平原 的俗称。 这里 属于世界三 大黑土带 之一 的我 国东北黑土区， 生态 环境优越。 早年，' 北大 荒处 于未 开星 的荒凉状态， 有棒 打犯 子飘 盏鱼， 野鸡 飞到 饭锅 里的 说法。 经过 半个 多世纪的 开垦， 这里 已成 为国 家重要的 商品粮 基地， 年产 粮食 150 亿二 克以 上，"" 北大 荒成 了北大仓 . 但是 由于 过度 开星 、 排水 和狸猫， 当地 的生态环境过 浙亚 化， 湿地面积缩小了 1 2， 黑 Re 土表层的 有机 质含 昌流 失了 1 3， 土地 沙 Se。 化严重， 多种 动物绝迹 .黑龙江 省于 1999 _T 年全 面停止开荒， 实施大 规模退耕还 林 、 恢复植被下 策， 一批 农民转 而经 营生态农 东北的 因土 地业 旅游 . 位于 北方地 区的 东北林 区一 直是 我国 主要的 木材生产基地， 商品 木材产量长 期占 全国 的 1Z3 以上。20 世纪 以来， 由于 过量 采伐 、 占用林地， 东北林区 的天 然林 资源 大幅度减少， 加上 非法捕猎和 采摘， 林区 生态环境日 益恶 化。 从 1998 年起， 国家 开始实施天 然林 资",721,0.3605570652173913,low,ocr,"效\n由 于 过 度 开 垦 、 过 度 使 用 化 肥 和 农药 、 土 壤 盐 碱 化 等 原因 ， 北\n方 地 区 的 部 分 农田 退化 ， 土 壤 肥 力 下 降 。 为 了 提高 和 保护 农田 的 土\n=== 第 64 页 ===\n夜 第 一 节 北方 地 区 六 b ) 47\n壤 肥 力 ， 各 地 农业 科技 人 员 指 导 农 民 科 学 耕种 ， 多 施 有 机 肥 ， 多 使\n用 生物 杀 虫 剂 ， 完 善 灌溉 和 排水 设施 ， 取 得 了 良好 的 效果 。\n“北大 荒 "" 和 ""北大 仓 "" #*— 天\n“北大 荒 ” 是 人 们 对 松 嫩 平 原 北 部 和 三 江平 原 的 俗称 。 这 里 属于 世界 三 大 黑土 带\n之 一 的 我 国 东北 黑土 区 ， 生 态 环境 优越 。 早 年 ，' 北 大 荒 ” 处 于 未 开 星 的 荒凉 状态 ， 有\n“ 棒 打 犯 子 飘 盏 鱼 ， 野 鸡 飞 到 饭 锅 里 ”的 说 法 。 经 过 半 个 多 世纪 的 开垦 ， 这 里 已 成 为 国\n家 重要 的 商品 粮 基 地 ， 年 产 粮食 150 亿 二\n克 以 上 ，"" 北 大 荒 ” 成 了 “北大 仓 . 但 是\nSS 由 于 过 度 开 星 、 排 水 和 狸猫 ， 当 地 的 生态\n环境 过 浙 亚 化 ， 湿地 面积 缩小 了 1/2 ， 黑\nRe 土 表层 的 有 机 质 含 昌 流 失 了 1/3， 土 地 沙\nSe 。 化 严重 ， 多 种 动物 绝迹 .黑龙 江 省 于 1999\n_T SS > 年 全 面 停止 开荒， 实施 大 规模 退耕 还 林 、\nES 恢复 植被 下 策 ， 一 批 农民 转 而 经 营 生态 农\n东北 的 因 土 地 业 旅 游 .\n位 于 北方 地 区 的 东北 林 区 一 直 是 我 国 主要 的 木材 生产 基地 ， 商\n品 木材 产量 长 期 占 全 国 的 1Z3 以 上 。20 世 纪 以 来 ， 由 于 过 量 采 伐 、\n占用 林地 ， 东 北林 区 的 天 然 林 资 源 大 幅度 减少 ， 加 上 非法 捕猎 和 采\n摘 ， 林 区 生态 环境 日 益 恶 化 。 从 1998 年 起 ， 国 家 开始 实施 天 然 林 资",2.0,70,中图版（主编_钟作慈）_七年级_义务教育教科书·地理七年级下册（主编_钟作慈）,54,2025-07-21T14:23:03.013Z,2.0,义务教育教科书·地理七年级下册（主编：钟作慈）,/Users/LeoQin/Documents/GitHub/PDFconvertor/training_data/初中/地理/中图版（主编：钟作慈）-中国地图出版社/七年级/义务教育教科书·地理七年级下册（主编：钟作慈）.pdf,七年级,tesseract.js-parallel,中图版,0.8505747126436781,0.5,1,70,,,,true,,,chemistry,下册,中图版（主编：钟作慈）_七年级_义务教育教科书·地理七年级下册（主编：钟作慈）.json,地理,112,初中_地理_中图版（主编：钟作慈）_七年级_义务教育教科书·地理七年级下册（主编：钟作慈）
中图版（主编_钟作慈）_七年级_义务教育教科书·地理七年级下册（主编_钟作慈）_chunk_13,13,区的 东北林 区一 直是 我国 主要的 木材生产基地， 商品 木材产量长 期占 全国 的 1Z3 以上。20 世纪 以来， 由于 过量 采伐 、 占用林地， 东北林区 的天 然林 资源 大幅度减少， 加上 非法捕猎和 采摘， 林区 生态环境日 益恶 化。 从 1998 年起， 国家 开始实施天 然林 资源 保护 工程， 禁伐 或限 伐林木， 同时 大力 植树 造林， 遏制 了东北林 区的 环境恶化趋势， 生态 环境明显好 转。 黄土高 原黄土高 原位 于长 城以 南， 太行 山脉 以西， 泰岭 以北， 海拔 1 000 一 2 000 米， 面积 30 多万 平方千 米。 黄土 高原 西高 东低， 边缘 和内 部分 布着 一些 高低 不同 的山地， 沿着 黄河及 其文 流分 布着 面积不 等的 谷地和 和从 地。 高原 的黄土厚度为 30 一 80 米， 部分 地方 超过 100 米， 是世界上 黄士 分布 最广 、 最厚 的地 区。 48 b ) 第儿 章 Kk 次茫茫黄土何 处来 ? 黄土高 原的 黄土是 从哪里来 的一 般认 为是 在以 风力为 主的 综合作用下， 经过 长时 期的 搬运 、 堆积 而形成的。 中亚 、 蒙古 和我 国西北部 的沙漠 、 戈壁 是黄土的 来源 地。 那里 的大 量细 砂和 人尘土被 强劲的 偏北 风向东南吹 送， 逐渐 堆积 、 加厚， 形成 了黄土高 原上 广泛履 盖的 黄土层 . 黄土土 质焉 松， 很容易遭受流水的 侵蚀。 在流水的 长期 作用下， 黄土 高原 地表 文离 破碎 、 沟餐 纵横， 形成 了 、 如 、 骨等 多种 多样 的黄 十地 貌。 黄土高 原特 有的 地貌 sm 2 本人 二 F 2,736,0.43512890909090907,medium-low,ocr,区 的 东北 林 区 一 直 是 我 国 主要 的 木材 生产 基地 ， 商\n品 木材 产量 长 期 占 全 国 的 1Z3 以 上 。20 世 纪 以 来 ， 由 于 过 量 采 伐 、\n占用 林地 ， 东 北林 区 的 天 然 林 资 源 大 幅度 减少 ， 加 上 非法 捕猎 和 采\n摘 ， 林 区 生态 环境 日 益 恶 化 。 从 1998 年 起 ， 国 家 开始 实施 天 然 林 资\n源 保 护 工 程 ， 禁 伐 或 限 伐 林木 ， 同 时 大 力 植 树 造 林 ， 遏 制 了 东北 林\n区 的 环境 恶化 趋势 ， 生 态 环境 明显 好 转 。\n黄土 高 原\n黄土 高 原 位 于 长 城 以 南 ， 太 行 山 脉 以 西 ， 泰 岭 以 北 ， 海 拔\n1 000 一 2 000 米 ， 面 积 30 多 万 平方 千 米 。 黄 土 高 原 西 高 东 低 ， 边 缘\n和 内 部 分 布 着 一 些 高 低 不 同 的 山地 ， 沿 着 黄河 及 其 文 流 分 布 着 面积\n不 等 的 谷地 和 和 从 地 。 高 原 的 黄土 厚度 为 30 一 80 米 ， 部 分 地 方 超过 100\n米 ， 是 世界 上 黄 士 分 布 最 广 、 最 厚 的 地 区 。\n=== 第 65 页 ===\n48 b ) * 第 儿 章 REPOBRIIZEIE Kk\n#*— 次 茫茫 黄土 何 处 来 ?\n黄土 高 原 的 黄土 是 从 哪里 来 的 一 般 认 为 是 在 以 风力 为 主 的 综合 作用 下 ， 经 过 长 时\n期 的 搬运 、 堆 积 而 形成 的 。 中 亚 、 蒙 古 和 我 国 西北 部 的 沙漠 、 戈 壁 是 黄土 的 来 源 地 。 那\n里 的 大 量 细 砂 和 人 尘土 被 强劲 的 偏 北 风向 东南 吹 送 ， 逐 渐 堆 积 、 加 厚 ， 形 成 了 黄土 高 原 上\n广泛 履 盖 的 黄土 层 .\n黄土 土 质 焉 松 ， 很 容易 遭受 流水 的 侵蚀 。 在 流水 的 长 期 作用\n下 ， 黄 土 高 原 地 表 文 离 破 碎 、 沟 餐 纵 横 ， 形 成 了 、 如 、 骨 等 多 种\n多 样 的 黄 十 地 貌 。\n黄土 高 原 特 有 的 地 貌 ”\nsm 2\n=\n本 人 二\nF 2,2.0,70,中图版（主编_钟作慈）_七年级_义务教育教科书·地理七年级下册（主编_钟作慈）,55,2025-07-21T14:23:03.013Z,2.0,义务教育教科书·地理七年级下册（主编：钟作慈）,/Users/LeoQin/Documents/GitHub/PDFconvertor/training_data/初中/地理/中图版（主编：钟作慈）-中国地图出版社/七年级/义务教育教科书·地理七年级下册（主编：钟作慈）.pdf,七年级,tesseract.js-parallel,中图版,0.842911877394636,0.5,1,70,,,,true,true,,biology,下册,中图版（主编：钟作慈）_七年级_义务教育教科书·地理七年级下册（主编：钟作慈）.json,地理,112,初中_地理_中图版（主编：钟作慈）_七年级_义务教育教科书·地理七年级下册（主编：钟作慈）
中图版（主编_钟作慈）_七年级_义务教育教科书·地理七年级下册（主编_钟作慈）_chunk_14,14,"以后， 北京 从一 个消费型 城市转变为 生产型 城市， 工业以 钢铁 、 煤炭 、 石油 化学 、 机械 等部 门为 主， 经济 实力迅速提 高， 但消耗大 量能 源和 水源， 造成 了环境污染。 改革 开放以 后， 北京 一方面把 高耗 能 、 重污染的 工厂或 停产 、 或外 廷， 大力 发展 高新 技术产业， 另一 方面把 农业生产转向发 展都 市型 现代农业， 依托 和服务城市， 与保护生态环境和 旅游观光相 结合。 为了 落实北京城市战略定位， 玻解 非首 都功能， 促进 京津 旨协 同发 展， 充分 考虑延续古都历史格局， 治理 大城市病 的现实需要和 面向未 来的 可持续发 展， 北京 要形成一 核一 主一 副 、 两轴 多点 一区 的城市空间结构。 一核 一主 一副 、 两轴 多点 一区 "" 一核 : 首都功能核心区。 一主 : 中心 城区 即城 六区， 包括 东城区 、 丁城区、 朝阳区 、 海淀区 、 丰人 台区 和石景山区。 一副 : 北京城市副 中心， 规划 范围 为原 通州 新城 规划建设区。 两轴 : 中轴线及 其延长线， 是南 起永定门 北至 钟鼓楼的 传统中 轴线及 其南北向 延伸， 向北 延伸至 燕山山脉， 向南 延伸 至北京新 机场 、 永定 河水系。 长安 街及 其延长线， 以天 安门 广场为 中心 东西向延伸， 向西 延伸 至首钢地 区 、 永定 河水系 、 西山山脉， 向东 延伸 至北京城市副 中心 和北 运河 、 潮和 白河水 系。 多点 : 5 个位 于平原地 区的 新城， 包括 顺义 、 大兴 、 亦庄 、 昌平和房山新 城。 一区 : 生态涵养区， 包括 门头 沟区 、 平谷 区 、 怀骤 区、 密云",738,0.520350553505535,medium-low,ocr,"以 后 ， 北 京 从 一 个 消费 型 城市 转变 为 生产 型 城市 ，\n工业 以 钢铁 、 煤 炭 、 石 油 化 学 、 机 械 等 部 门 为 主 ， 经 济 实力 迅速 提\n高 ， 但 消耗 大 量 能 源 和 水 源 ， 造 成 了 环境 污染 。 改 革 开放 以 后 ， 北\n京 一 方面 把 高 耗 能 、 重 污染 的 工厂 或 停产 、 或 外 廷 ， 大 力 发 展 高 新\n技术 产业 ， 另 一 方面 把 农业 生产 转向 发 展 都 市 型 现代 农业 ， 依 托 和\n服务 城市 ， 与 保护 生态 环境 和 旅游 观光 相 结合 。\n为 了 落实 北京 城市 战略 定位 ， 玻 解 非 首 都 功能 ， 促 进 京 津 旨 协\n同 发 展 ， 充 分 考虑 延续 古都 历史 格局 ， 治 理 “大 城市 病 ” 的 现实 需要\n和 面向 未 来 的 可 持续 发 展 ， 北 京 要 形成 “一 核 一 主 一 副 、 两 轴 多 点 一\n区 ”的 城市 空间 结构 。\n“一 核 一 主 一 副 、 两 轴 多 点 一 区 ""\n一 核 : 首都 功能 核心 区 。 一 主 : 中 心 城 区 即 城 六 区 ， 包 括 东 城区 、 丁 城区、 朝阳 区 、\n海淀 区 、 丰 人 台 区 和 石景山 区 。 一 副 : 北京 城市 副 中 心 ， 规 划 范 围 为 原 通 州 新 城 规划 建设\n区 。 两 轴 : 中 轴线 及 其 延长 线 ， 是 南 起 永定 门 北 至 钟 鼓楼 的 传统 中 轴线 及 其 南北 向 延伸 ，\n向 北 延伸 至 燕山 山脉 ， 向 南 延 伸 至 北京 新 机 场 、 永 定 河水 系 。 长 安 街 及 其 延长 线 ， 以 天 安\n门 广场 为 中 心 东 西向 延伸 ， 向 西 延 伸 至 首钢 地 区 、 永 定 河水 系 、 西山 山脉 ， 向 东 延 伸 至\n北京 城市 副 中 心 和 北 运 河 、 潮 和 白河 水 系 。 多 点 : 5 个 位 于 平原 地 区 的 新 城 ， 包 括 顺 义 、 大\n兴 、 亦 庄 、 昌 平和 房山 新 城 。 一 区 : 生态 涵养 区 ， 包 括 门 头 沟 区 、 平 谷 区 、 怀 骤 区、 密云",2.0,70,中图版（主编_钟作慈）_七年级_义务教育教科书·地理七年级下册（主编_钟作慈）,64,2025-07-21T14:23:03.013Z,2.0,义务教育教科书·地理七年级下册（主编：钟作慈）,/Users/LeoQin/Documents/GitHub/PDFconvertor/training_data/初中/地理/中图版（主编：钟作慈）-中国地图出版社/七年级/义务教育教科书·地理七年级下册（主编：钟作慈）.pdf,七年级,tesseract.js-parallel,中图版,0.88268156424581,0.5,1,70,,,,true,,,geography,下册,中图版（主编：钟作慈）_七年级_义务教育教科书·地理七年级下册（主编：钟作慈）.json,地理,112,初中_地理_中图版（主编：钟作慈）_七年级_义务教育教科书·地理七年级下册（主编：钟作慈）
