Chunk_ID,Chunk_Index,Content,Content_Length,Quality_Score,Reliability,Source_Type,Original_Content,Enhancement_Version,averageConfidence,book_name,chunkIndex,enhancementTimestamp,enhancementVersion,fileName,filePath,grade,ocrMethod,publisher,qualityMetrics_chineseCharRatio,qualityMetrics_coherenceScore,qualityMetrics_lengthScore,qualityMetrics_ocrConfidence,semanticFeatures_hasDefinition,semanticFeatures_hasExperiment,semanticFeatures_hasFormulas,semanticFeatures_hasNumbers,semanticFeatures_hasQuestion,semanticFeatures_isTableContent,semanticFeatures_subjectArea,semester,source_file,subject,totalPages,uniqueId
中图版（主编_钟作慈）_八年级_义务教育教科书·地理八年级下册（主编_钟作慈）_chunk_20,20,"本 E : 人二 全下 人 500 上一 : 2 y L 2 o Prit 本二 访巴 基斯 坦实 际控制区 "" 国二 降 aaaesr。 印度 实际 控制区 图 7 5。 印放 64 b 第七 章不 印度 (mdia) 是南亚次 大陆 面积最 大的 国家， 位于 亚洲南部， 西北 与巴基斯坦相 接， 北与 中国 、 尼泊 尔 、 不丹 紫邻， 东北 与重 加拉 国 、 缅匈 接壤， 西南 、 东南 分别 与马尔代 夫 、 斯里 兰卡 隔海 相望。 E 南亚次 大陆， 又称 印度 次大 陆， 指喜马拉雅山脉以 南的 陆地， 属于 亚洲大 陆的 南延 部分， 占亚洲总 面积的 8.926。 南亚 次大 陆大 体位于 北纬 8"" 一 37 和东经 61"" 97 , 北有 喜马拉雅山脉和 喀喇 昆仑山脉， 东临 孟加 拉湾， 丁临 阿拉伯 海和 伊朗高 原， 南面 是广阔的 印度洋， 自成 一个 相对独立的 地理 单元 . 由于 南亚次 大陆 面积 小于 一般 大陆 的面积， 所以 称为 次大 陆。 印度的 人口 总数 已超过 13 亿， 是世界第 二人 口大 国。 印度的 首都新 德里 (New Delhi) , 是全 国的 政治中 心 、 工商业中 心和 交通枢纽。 v 本了 ea 用 y 三 wea 新德里的 纪念碑 和印度门 快速发 展的 经济 印度最 北部是 高大 的喜马拉雅山脉， 中部 是平坦的 恒河 平原， 南部是 低绥 的德 干高 原。 印度大 部分 地区 位于 热带季风和 气候区， 年平均气温 24 一 27?7C， 年降水量 约 1 200 毫米， 热量 充足， 降水 丰沛， 但降水量 的年 内和 年际 变化 较大， 洪涂 和干旱灾害频 发。",740,0.3661601314426315,low,ocr,"| 本 E »:\n人 二 全 下 人”\n500 上 一 : 2 y L- 2\no Prit 本 二 访 | @ 巴 基 斯 坦 实 际 控制 区\n"" 国 二 降 aaaesr。 @ 印 度 实 际 控制 区\n图 7-5。 印 放\n=== 第 79 页 ===\n64 b * 第 七 章 HKPEBE 不\n印度 (mdia) 是 南亚 次 大 陆 面积 最 大 的 国家 ， 位 于 亚洲 南部 ， 西\n北 与 巴基斯坦 相 接 ， 北 与 中 国 、 尼 泊 尔 、 不 丹 紫 邻 ， 东 北 与 重 加 拉\n国 、 缅 匈 接 壤 ， 西 南 、 东 南 分 别 与 马尔 代 夫 、 斯 里 兰 卡 隔 海 相 望 。\n—E —\n南亚 次 大 陆 ， 又 称 印 度 次 大 陆 ， 指 喜马拉雅 山脉 以 南 的 陆地 ， 属 于 亚洲 大 陆 的 南 延\n部 分 ， 占 亚洲 总 面积 的 8.926。 南 亚 次 大 陆 大 体位 于 北纬 8"" 一 37” 和 东经 61"" ~97”, 北 有\n喜马拉雅 山脉 和 喀 喇 昆仑 山脉 ， 东 临 孟 加 拉 湾 ， 丁 临 阿拉 伯 海 和 伊朗 高 原 ， 南 面 是 广阔\n的 印度 洋 ， 自 成 一 个 相对 独立 的 地 理 单元 . 由 于 南亚 次 大 陆 面 积 小 于 一 般 大 陆 的 面积 ，\n所 以 称 为 “次 大 陆 。\n印度 的 人 口 总 数 已 超过 13 亿 ， 是 世界 第 二 人 口 大 国 。\n印度 的 首都 新 德里 (New Delhi) , 是 全 国 的 政治 中 心 、 工 商业\n中 心 和 交通 枢纽 。\nv 本\n了\nea 用\ny —\nLE 三\n[wea\n新 德里 的 纪念 碑 和 印度 门\n快速 发 展 的 经 济\n印度 最 北部 是 高 大 的 喜马拉雅 山脉 ， 中 部 是 平坦 的 恒 河 平原 ，\n南部 是 低 绥 的 德 干 高 原 。\n印度 大 部 分 地 区 位 于 热带 季风 和 气候 区 ， 年 平均 气温 24 一 27?7C ，\n年 降水 量 约 1 200 毫 米 ， 热 量 充 足 ， 降 水 丰沛 ， 但 降水 量 的 年 内 和 年\n际 变 化 较 大 ， 洪 涂 和 干旱 灾害 频 发 。\n=== 第 80 页 ===",2.0,72.93518518518519,中图版（主编_钟作慈）_八年级_义务教育教科书·地理八年级下册（主编_钟作慈）,68,2025-07-21T14:23:03.022Z,2.0,义务教育教科书·地理八年级下册（主编：钟作慈）,/Users/LeoQin/Documents/GitHub/PDFconvertor/training_data/初中/地理/中图版（主编：钟作慈）-中国地图出版社/八年级/义务教育教科书·地理八年级下册（主编：钟作慈）.pdf,八年级,tesseract.js-parallel,中图版,0.7741935483870968,0.5,1,72.93518518518519,,,,true,true,,geography,下册,中图版（主编：钟作慈）_八年级_义务教育教科书·地理八年级下册（主编：钟作慈）.json,地理,108,初中_地理_中图版（主编：钟作慈）_八年级_义务教育教科书·地理八年级下册（主编：钟作慈）
中图版（主编_钟作慈）_八年级_义务教育教科书·地理八年级下册（主编_钟作慈）_chunk_21,21,Is bm 趟 sk at 入用 天大 本可 本医 l 了一， I 4 民印度宗教建筑红 全身 穿纱 丽的 印度妇女人 A Aa 1. 水稿 和棉花是 印度重要的 农作物， 试分 析这 两种 农作物的 分布 与地 形 、 气候 条件 的关系， 填写 表 7 一 1。 表 7 一 ! 农作物分 布地区 地形 气候水 入棉花 2. 试比 较加 尔各 答和 重买 这两 个工业城市在 地理 位置 、 工业 部门 和发 展工业的 优势 条件 等方面的 异同。 3. 阅读以 下资料， 说明 印度 发展 信息技术产业有 哪些成 功经 验。 印度建立了 多所 高水 平的 理工学 院， 从世界各 国聘请专家讲课， 毕业 生的 质量可 以与 欧美一 些一 流的 大学 媲美， 这些 毕业生 是发 展本 国信息 技术产业的 精英， 印度 信息技 术领 域的 人才 培养 从小 抓起， 形成 从理论研究到 实际应 用的 梯形人 才结构 ; 软件人 员的 工资远 高于 其他 行业， 但又 大大 低于 欧美各 国相同职业， 印度 向美国的 硅谷派 遗大 量人 才接受培养， 又利用本 国的 英语使 用广 、 劳动力价格低 和投资风险小 等优势吸引美国的 信息技术产业在 印度建立基地， 重视 产品 的质量， 开发 的软件适用性 强 、 性能 稳定 . (AT A f d 到 AiTill l1 学习 标准 : 一一 在地 图上 指出澳大利亚的 地理 位置 、 领土 组成 和首都。 一一 根据地 图和 资料概括澳大利亚自然环境的 基本特点。 一一 运用地 图和 资料， 联系 澳大利亚自然条 件特点， 简要 分析 该国 因地制宜发 展经 济的 实例。 、 、 读图 7_7， hh,732,0.328660945298135,low,ocr,Is bm 趟 sk\nat 入 用 天 大 本 CA\n可 [本 | 医 NS\n= l | 了 一 ， I [4 |\n| 民\n印度 宗教 建筑 红 全 身 穿 “ 纱 丽 ” 的 印度 妇女\n人 =\nA¥\nAa@ 1. 水 稿 和 棉花 是 印度 重要 的 农作物 ， 试 分 析 这 两 种 农作物 的\n分 布 与 地 形 、 气 候 条 件 的 关系 ， 填 写 表 7 一 1。\n表 7 一 !\n农作物 分 布地 区 地 形 气候\n水 入\n棉花\n2. 试 比 较 加 尔 各 答 和 重 买 这 两 个 工业 城市 在 地 理 位 置 、 工 业 部 门 和 发 展 工业 的 优\n势 条 件 等 方面 的 异同 。\n3. 阅读 以 下 资料 ， 说 明 印 度 发 展 信息 技术 产业 有 哪些 成 功 经 验 。\n印度 建立 了 多 所 高 水 平 的 理工 学 院 ， 从 世界 各 国 聘请 专家 讲课 ， 毕 业 生 的 质量 可 以\n与 欧美 一 些 一 流 的 大 学 媲美 ， 这 些 毕业 生 是 发 展 本 国信 息 技术 产业 的 精英 ， 印 度 信息 技\n术 领 域 的 人 才 培 养 从 小 抓 起 ， 形 成 从 理论 研究 到 实际 应 用 的 梯形 人 才 结构 ; 软件 人 员 的\n工资 远 高 于 其 他 行业 ， 但 又 大 大 低 于 欧美 各 国 相同 职业 ， 印 度 向 美国 的 “硅谷 ” 派 遗 大\n量 人 才 接受 培养 ， 又 利用 本 国 的 英语 使 用 广 、 劳 动力 价格 低 和 投资 风险 小 等 优势 吸引\n美国 的 信息 技术 产业 在 印度 建立 基地 ， 重 视 产 品 的 质量 ， 开 发 的 软件 适用 性 强 、 性 能\n稳定 .\n=== 第 84 页 ===\n(AT A f d 到\nSE AiTill l1\n学 习 标准 :\n一 一 在 地 图 上 指出 澳大利亚 的 地 理 位 置 、 领 土 组 成 和 首都 。\n一 一 根据 地 图 和 资料 概括 澳大利亚 自然 环境 的 基本 特点 。\n一 一 运用 地 图 和 资料 ， 联 系 澳大利亚 自然 条 件 特点 ， 简 要 分 析\n该 国 因地制宜 发 展 经 济 的 实例 。\n、 、 读 图 7_7， hh,2.0,72.93518518518519,中图版（主编_钟作慈）_八年级_义务教育教科书·地理八年级下册（主编_钟作慈）,73,2025-07-21T14:23:03.022Z,2.0,义务教育教科书·地理八年级下册（主编：钟作慈）,/Users/LeoQin/Documents/GitHub/PDFconvertor/training_data/初中/地理/中图版（主编：钟作慈）-中国地图出版社/八年级/义务教育教科书·地理八年级下册（主编：钟作慈）.pdf,八年级,tesseract.js-parallel,中图版,0.8576779026217228,0.5,1,72.93518518518519,,,,true,,,physics,下册,中图版（主编：钟作慈）_八年级_义务教育教科书·地理八年级下册（主编：钟作慈）.json,地理,108,初中_地理_中图版（主编：钟作慈）_八年级_义务教育教科书·地理八年级下册（主编：钟作慈）
中图版（主编_钟作慈）_八年级_义务教育教科书·地理八年级下册（主编_钟作慈）_chunk_22,22,"品， 是世界上 唯一独占一 个天 陆的 国家。 澳大利亚的 人口 密度每 平方千 米不 到 3 人， 是世界上 人口 密度最 小的 国家之 一。 澳大 利亚 居民 绝大 部分 为白色人 种的 移民， 而属于黑色人 种的 原住 居民现在仪 有 30 多万 人。 独特的 自然环境读 图 7 一 ""和图 7 一 8 : 1， 说出 澳大利亚东 部 、 中部 和西部的 主要地 形类 型。 2. 说出 澳大利亚的 主要气候类 型， 试分 析哪 些地 区降水较 多 、 哪些 地区 降水较 少及 其原因。 却 N 00 热带两 林气 候 l 3 热带草原气候村 we 国国 热带沙漠气候 、 和二 国国 亚热带湿润气候 p 二状 地中 海气候人 国国 温带海洋性 气候办 图 7 一 8 澳大利亚气候类 型局 受 x 概括某 一国家或 地区 自然环境的 基本特点， 需要 运用哪些地 图， 从哪 些方面进行分 析和 综合 ? 澳大利亚大 陆的 地形 自东 向西 可分 为三 个部 分 : 东部是 山地， 中部 是平原和 盆地， 西部 是高 原。 第三 节澳大利亚次 bo ) 可东部山地受 来自 太平 详的 暖湿 气流 影响， 年降水量 多在 1 000 毫米 以上， 生长 着繁茂的 森林。 因东 部山脉的 阻挡， 中部 平原受 来自 太平洋 的暖 湿气 流影响较 小， 年降水量 多在 500 毫米 以下， 地表 河流 较少， 却有 着丰富的 地下 水。 位于 中部 平原的 大自流盆地， 约占 全国 总面积的 1 5， 是世界上 最大 的自流盆地。 在这 里玄 井， 地下 水很 容易涌 出地 表， 是发 展畜 牧业 的可 靠水 源。",716,0.4320356213991769,medium-low,ocr,"品 ， 是 世界 上 唯一 独占 一 个 天 陆 的\n国家 。\n澳大利亚 的 人 口 密度 每 平方 千 米 不 到 3 人 ， 是 世界 上 人 口 密度 最\n小 的 国家 之 一 。 澳 大 利 亚 居 民 绝 大 部 分 为 白色 人 种 的 移民 ， 而 属于\n黑色 人 种 的 原 住 居民 现在 仪 有 30 多 万 人 。\n独特 的 自然 环境\n读 图 7 一 ""和 图 7 一 8 :\n1， 说 出 澳大利亚 东 部 、 中 部 和 西部 的 主要 地 形 类 型 。\n2. 说 出 澳大利亚 的 主要 气候 类 型 ， 试 分 析 哪 些 地 区 降水 较\n多 、 哪 些 地 区 降水 较 少 及 其 原因 。\n却 OORS N\n[00 热带 两 林 气 候 l | 3-\n热带 草原 气候 村 we |\n国 国 热带 沙漠 气候 、 和 二 |\n国 国 亚热带 湿润 气候 p 二\n状 地 中 海 气候 人\n国 国 温带 海洋 性 气候 ~ 办- |\n图 7 一 8 ”澳大利亚 气候 类 型 局\n受\nx\n概括 某 一 国家 或 地 区 自然 环境 的 基本 特点 ， 需 要 运用 哪些 地 图 ， 从 哪\n些 方面 进行 分 析 和 综合 ?\n澳大利亚 大 陆 的 地 形 自 东 向 西 可 分 为 三 个 部 分 : 东部 是 山\n地 ， 中 部 是 平原 和 盆地 ， 西 部 是 高 原 。\n=== 第 86 页 ===\nYW 第 三 节 澳大利亚 次 bo ) 可\n东部 山地 受 来 自 太 平 详 的 暖 湿 气 流 影响 ， 年 降水 量 多 在 1 000 毫\n米 以 上 ， 生 长 着 繁茂 的 森林。\n因 东 部 山脉 的 阻挡 ， 中 部 平原 受 来 自 太平 洋 的 暖 湿 气 流 影响 较\n小 ， 年 降水 量 多 在 500 毫 米 以 下 ， 地 表 河 流 较 少 ， 却 有 着 丰富 的 地 下\n水 。 位 于 中 部 平原 的 大 自流 盆地 ， 约 占 全 国 总 面积 的 1/5， 是 世界 上\n最 大 的 自流 盆地 。 在 这 里 玄 井 ， 地 下 水 很 容易 涌 出 地 表 ， 是 发 展 畜\n牧 业 的 可 靠 水 源 。",2.0,72.93518518518519,中图版（主编_钟作慈）_八年级_义务教育教科书·地理八年级下册（主编_钟作慈）,75,2025-07-21T14:23:03.022Z,2.0,义务教育教科书·地理八年级下册（主编：钟作慈）,/Users/LeoQin/Documents/GitHub/PDFconvertor/training_data/初中/地理/中图版（主编：钟作慈）-中国地图出版社/八年级/义务教育教科书·地理八年级下册（主编：钟作慈）.pdf,八年级,tesseract.js-parallel,中图版,0.867704280155642,0.5,1,72.93518518518519,,,,true,true,,geography,下册,中图版（主编：钟作慈）_八年级_义务教育教科书·地理八年级下册（主编：钟作慈）.json,地理,108,初中_地理_中图版（主编：钟作慈）_八年级_义务教育教科书·地理八年级下册（主编：钟作慈）
中图版（主编_钟作慈）_八年级_义务教育教科书·地理八年级下册（主编_钟作慈）_chunk_23,23,洋的 暖湿 气流 影响较 小， 年降水量 多在 500 毫米 以下， 地表 河流 较少， 却有 着丰富的 地下 水。 位于 中部 平原的 大自流盆地， 约占 全国 总面积的 1 5， 是世界上 最大 的自流盆地。 在这 里玄 井， 地下 水很 容易涌 出地 表， 是发 展畜 牧业 的可 靠水 源。 西部高 原气 温高， 玉发 量大， 年降水量 多在 200 毫米 以下， 气候 干燥， 分布 着大 面积的 沙漠。 d Te 艾尔 斯巨石和 大自流盆地姓 一 7 ; 艾尔 斯巨石， 又名 艾尔 斯山， 位于 澳大利亚中 部的 艾丽 斯斯 普林 斯西 南方向 约 340 干米 处， 高约 350 米， 长约 3 000 米， 周长 约 8 500 米。 大约 在 3 a 亿年 前， 由于 地壳 运动， 这一 带的 地层 露出 了海面。 经过 几亿 年的 风雨侵 蚀， 大片 砂岩已 经风化为 沙砾， 只有 这块 巨石没有出 现断 裂和 缝隙。 艾尔 斯巨石是 世界上 最大 的整体岩石， 众称 地球 的肚脐 . 大自流盆地， 也叫 澳大利亚大 盆地， 位于 澳大利亚大 陆中 部偏 东。 澳大 利亚 东部山 地降下的 雨水渗入地 下以 后， 沿着 含水层 移向 山地西 面的 大自流盆地。 在盆地钻井， 承受 压力 的地 下水 会通过钻井涌 出地 表， 所以 叫做大 自流盆地。 井水 的盐分略 高， 虽然 不适合人 饮用和 农田灌溉， 但是 可以 供牲 畜饮 用。. 2 _ 狗大 利亚 大盆地节 : : 3 ghes 下图 7 一 9 澳天 利亚 和有 自流井地 攻医 例 x 中国 首都一 一一， 中国 省 、 自治 区 、 直辖 市界 X 2A 湖泊,731,0.4523676549211249,medium-low,ocr,洋 的 暖 湿 气 流 影响 较\n小 ， 年 降水 量 多 在 500 毫 米 以 下 ， 地 表 河 流 较 少 ， 却 有 着 丰富 的 地 下\n水 。 位 于 中 部 平原 的 大 自流 盆地 ， 约 占 全 国 总 面积 的 1/5， 是 世界 上\n最 大 的 自流 盆地 。 在 这 里 玄 井 ， 地 下 水 很 容易 涌 出 地 表 ， 是 发 展 畜\n牧 业 的 可 靠 水 源 。\n西部 高 原 气 温 高 ， 玉 发 量 大 ， 年 降水 量 多 在 200 毫 米 以 下 ， 气 候\n干燥 ， 分 布 着 大 面积 的 沙漠 。\nd\nTe\n艾 尔 斯 巨石 和 大 自流 盆地 姓 一 7%;\n艾 尔 斯 巨石 ， 又 名 艾 尔 斯 山 ， 位\n于 澳大利亚 中 部 的 艾 丽 斯 斯 普 林 斯 西\n南方 向 约 340 干 米 处 ， 高 约 350 米 ， 长\n约 3 000 米 ， 周 长 约 8 500 米 。 大 约 在 3\na 亿 年 前 ， 由 于 地 壳 运 动 ， 这 一 带 的 地\n层 露 出 了 海面 。 经 过 几 亿 年 的 风雨 侵\n蚀 ， 大 片 砂岩 已 经 风化 为 沙砾 ， 只 有\n这 块 巨石 没有 出 现 断 裂 和 缝隙 。 艾 尔\n斯 巨石 是 世界 上 最 大 的 整体 岩石 ， 众\nRIHE 称 “ 地 球 的 肚脐 * .\n大 自流 盆地 ， 也 叫 澳大利亚 大 盆地 ， 位 于 澳大利亚 大 陆 中 部 偏 东 。 澳 大 利 亚 东部 山\n地 降下 的 雨水 渗入 地 下 以 后 ， 沿 着 含水 层 移 向 山地 西 面 的 大 自流 盆地 。 在 盆地 钻井 ， 承\n受 压 力 的 地 下 水 会 通过 钻井 涌 出 地 表 ， 所 以 叫做 大 自流 盆地 。 井 水 的 盐分 略 高 ， 虽 然 不\n适合 人 饮用 和 农田 灌溉 ， 但 是 可 以 供 牲 畜 饮 用 。.\n2 _ 狗 大 利 亚 大 盆地 节 : :\n3 ghes 下\n图 7 一 9  ” 澳 天 利 亚 和 有 自流井\n=== 第 87 页 ===\n地 攻 医 [ 例\n*x 中 国 首都 一 一 一 ， 中 国 省 、 自 治 区 、 直 辖 市 界  X 2A 湖泊,2.0,72.93518518518519,中图版（主编_钟作慈）_八年级_义务教育教科书·地理八年级下册（主编_钟作慈）,76,2025-07-21T14:23:03.022Z,2.0,义务教育教科书·地理八年级下册（主编：钟作慈）,/Users/LeoQin/Documents/GitHub/PDFconvertor/training_data/初中/地理/中图版（主编：钟作慈）-中国地图出版社/八年级/义务教育教科书·地理八年级下册（主编：钟作慈）.pdf,八年级,tesseract.js-parallel,中图版,0.8304431599229287,0.5,1,72.93518518518519,true,,,true,,,chemistry,下册,中图版（主编：钟作慈）_八年级_义务教育教科书·地理八年级下册（主编：钟作慈）.json,地理,108,初中_地理_中图版（主编：钟作慈）_八年级_义务教育教科书·地理八年级下册（主编：钟作慈）
中图版（主编_钟作慈）_八年级_义务教育教科书·地理八年级下册（主编_钟作慈）_chunk_24,24,古老的 大陆， 又长 期被 海详 包围， 与其 他大 陆阻隔， 保留 下许多古老而 独特的 动植物。 澳大 利亚 的国徽上 就绘 有两 种特有的 动物一 一袋鼠和 了酌 毅。 SSERANRLHS 袋鼠是 早期哺乳动物的 代表， 以多 种植物为 食， 已经 在地 球上 至少 生活了 1 亿年， 现在只 分布 在澳大利亚。 澳大 利亚 约有 6 000 万只 野生袋鼠， 它们 大多 在夜间活动， 但也 有些 在清晨或 傍晚活动。 大型 袋鼠喜欢以 树， 洞穴和 岩石裂缝作为遮蔽处。 雌性 袋鼠腹部有 一个 育儿袋， 育儿 袋里 有四 个乳头， 小袋鼠就 在育儿袋 里被 抚养长 大， 直到 它们能 在外 部世界独立生存。 酌竟 独产 于澳大利亚， 体型 似皇 乌， 也称 为澳洲通 鸟， 身高 1.5 一 2 米， 成年 雌性酌 交比 雄性还 要大， 是世界上 除了非洲能 乌以 外体型最 大的 乌类。 了酌 竟喜欢生活在 草原和 沙漠地 区， 擅长 奔跑， 虽然 长有 双兽， 但功能已 完全退化 . 本一 壮志人 Ni ae 了 8 mses 澳大利亚还 有许多古老的 哺乳动物， 如树 袋驴 〈 考拉 ) 、 鸭路 兽等。 核树 在澳大利亚分 布很 广， 木质 坚硬， 生长 快，10 年左右就 可以 成材。 w 第三 节澳大利亚六 D 73 南半球的 发达 国家农 牧业 、 采矿业 、 制造 业和 服务业 是澳大利亚的 四大 主导产业。 澳大利亚盛产小 麦， 人均 产量 居世 界前 列， 主要 产区 在达 令河 和墨 累河 流域。 澳大 利亚 有大 面积的 天然 牧场和 丰富的 地下 水， 有利于畜牧业 的发 展， 主要实行牛 羊露天转 栏和 分区 放牧。 澳大,740,0.4435104703375943,medium-low,ocr,古老 的 大 陆 ， 又 长 期 被 海 详 包围 ， 与 其 他 大 陆\n阻隔 ， 保 留 下 许多 古老 而 独特 的 动 植物 。 澳 大 利 亚 的 国徽 上 就 绘 有\n两 种 特有 的 动物 一 一 袋鼠 和 了 酌 毅 。\n#— ES SSERANRLHS\n袋鼠 是 早期 哺乳 动物 的 代表 ， 以 多 种 植物 为 食 ， 已 经 在 地 球 上 至 少 生活 了 1 亿 年 ，\n现在 只 分 布 在 澳大利亚 。 澳 大 利 亚 约 有 6 000 万 只 野生 袋鼠 ， 它 们 大 多 在 夜间 活动 ， 但\n也 有 些 在 清晨 或 傍晚 活动 。 大 型 袋鼠 喜欢 以 树 ， 洞穴 和 岩石 裂缝 作为 遮蔽 处 。 雌 性 袋鼠\n腹部 有 一 个 育儿 袋 ， 育 儿 袋 里 有 四 个 乳头 ， 小 袋鼠 就 在 育儿 袋 里 被 抚养 长 大 ， 直 到 它们\n能 在 外 部 世界 独立 生存 。\n酌 竟 独 产 于 澳大利亚 ， 体 型 似 皇 乌 ， 也 称 为 澳洲 通 鸟 ， 身 高 1.5 一 2 米 ， 成 年 雌性 酌\n交 比 雄性 还 要 大 ， 是 世界 上 除了 非洲 能 乌 以 外 体型 最 大 的 乌 类 。 了 酌 竟 喜欢 生活 在 草原 和\n沙漠 地 区 ， 擅 长 奔跑 ， 虽 然 长 有 双 兽 ， 但 功能 已 完全 退化 .\n本 一 壮志\n人\nNi\nae 了 ~\n&£8 mses\n澳大利亚 还 有 许多 古老 的 哺乳 动物 ， 如 树 袋 驴 〈 考 拉 ) 、 鸭 路\n兽 等 。\n核 树 在 澳大利亚 分 布 很 广 ， 木 质 坚 硬 ， 生 长 快 ，10 年 左右 就 可\n以 成 材 。\n=== 第 89 页 ===\nw 第 三 节 澳大利亚 六 D 73\n南半球 的 发 达 国家\n农 牧 业 、 采 矿业 、 制 造 业 和 服务 业 是 澳大利亚 的 四 大 主导\n产业 。\n澳大利亚 盛产 小 麦 ， 人 均 产 量 居 世 界 前 列 ， 主 要 产 区 在 达 令 河\n和 墨 累 河 流域 。 澳 大 利 亚 有 大 面积 的 天 然 牧场 和 丰富 的 地 下 水 ， 有\n利于 畜牧 业 的 发 展 ，\n主要 实行 牛 羊 露天 转\n栏 和 分 区 放牧 。 澳 大,2.0,72.93518518518519,中图版（主编_钟作慈）_八年级_义务教育教科书·地理八年级下册（主编_钟作慈）,78,2025-07-21T14:23:03.022Z,2.0,义务教育教科书·地理八年级下册（主编：钟作慈）,/Users/LeoQin/Documents/GitHub/PDFconvertor/training_data/初中/地理/中图版（主编：钟作慈）-中国地图出版社/八年级/义务教育教科书·地理八年级下册（主编：钟作慈）.pdf,八年级,tesseract.js-parallel,中图版,0.8540145985401459,0.5,1,72.93518518518519,,,,true,,,biology,下册,中图版（主编：钟作慈）_八年级_义务教育教科书·地理八年级下册（主编：钟作慈）.json,地理,108,初中_地理_中图版（主编：钟作慈）_八年级_义务教育教科书·地理八年级下册（主编：钟作慈）
