Chunk_ID,Chunk_Index,Content,Content_Length,Quality_Score,Reliability,Source_Type,Original_Content,Enhancement_Version,averageConfidence,book_name,chunkIndex,enhancementTimestamp,enhancementVersion,fileName,filePath,grade,ocrMethod,publisher,qualityMetrics_chineseCharRatio,qualityMetrics_coherenceScore,qualityMetrics_lengthScore,qualityMetrics_ocrConfidence,semanticFeatures_hasDefinition,semanticFeatures_hasExperiment,semanticFeatures_hasFormulas,semanticFeatures_hasNumbers,semanticFeatures_hasQuestion,semanticFeatures_isTableContent,semanticFeatures_subjectArea,semester,source_file,subject,totalPages,uniqueId
中图版（主编_钟作慈）_八年级_义务教育教科书·地理八年级下册（主编_钟作慈）_chunk_5,5,西伯利 亚的 蓝眼睛 . 世界降水最 多的 地方 一乞 拉朋 齐。 位于 印度东北部。 这里 年降水量 11 500 毫米， 在 1960 年 8 月至 1961 年 7 月创下了 26 461 毫米 的降水记录， 有世界雨 极之 称 . 10 D 友第 五章 KpZM 不 a F A) 1. 运用图 5 一 2， 说出 亚洲的 主要河流和 湖泊， 并说 明亚 洲的 地形 和地 势对 其河流的 分布 及走向有 什么影响。 2. 运用图 5 5， 说出 亚洲东部 、 南部 和中 部的 主要气候类 型。 5. 按照本 节学 法指导的 要求， 说明 亚洲 地形 、 水系 和气候的 特点及 其相互关系 5 侨焉 G0 认识其 他大 洲选择以 下一 项内 容进行实践活动 : 1.， 分组 收集欧洲 、 非洲 和北美洲 地形 、 水系 和和 气候类 型的 资料， 按本 节的 学法 指导加 以整理和 说明 . 2 从亚洲 、 欧洲 、 非洲 和北美洲 中任 选两 大洲， 对它们的 位置 和自然概况列表进 行比较， 并向 全班 同学展示。 人 4 只地 区第 一节 东南亚单一经 济为 主的 地区 34 重要的 地理 位置 12 黑色人 种的 故乡 37 山河相间的 地形 和众多的 岛屿 14 湿热的 气候和 丰富的 物产 15 第四 节欧洲西部稠密的 人口 18 优良的 自然环境 41 便利的 海陆运输 42 第二 节西亚发 达的 工业和 繁荣的 旅游业 43 五海 三洲 之地 21 干燥的 气候和 有限 的水 资源 22 第五 节南极地 区和 北极地 区世界石油宝库 24 地球 上最 南的 地区 48 阿拉伯 国家 为主 的地 区 27 地球 上最 北的 地区 51,738,0.38193640153726405,low,ocr,“西伯 利 亚 的 蓝 眼睛 .\n世界 降水 最 多 的 地 方 -一 乞 拉 朋 齐 。 位 于 印度 东北 部 。 这 里 年 降水 量 11 500 毫 米 ，\n在 1960 年 8 月 至 1961 年 7 月 创下 了 26 461 毫 米 的 降水 记录 ， 有 世界 “ 雨 极 ”之 称 .\n=== 第 19 页 ===\n10 D 友 第 五 章 KpZM 不\n\=\na #F\nA)\n1. 运用 图 5 一 2， 说 出 亚洲 的 主要 河流 和 湖泊 ， 并 说 明 亚 洲 的 地 形 和 地 势 对 其 河流\n的 分 布 及 走向 有 什么 影响 。\n2. 运用 图 5-5， 说 出 亚洲 东部 、 南 部 和 中 部 的 主要 气候 类 型 。\n5. 按照 本 节 “ 学 法 指导 ”的 要 求 ， 说 明 亚 洲 地 形 、 水 系 和 气候 的 特点 及 其 相互\n关系 5\n侨 焉  G0 认识 其 他 大 洲\n选择 以 下 一 项 内 容 进行 实践 活动 :\n1.， 分 组 收集 欧洲 、 非 洲 和 北美 洲 地 形 、 水 系 和 和 气候 类 型 的 资料 ， 按 本 节 的 “学 法\n指导 ”加 以 整理 和 说 明 .\n2 从 亚洲 、 欧 洲 、 非 洲 和 北美 洲 中 任 选 两 大 洲 ， 对 它们 的 位 置 和 自然 概况 列表 进\n行 比较 ， 并 向 全 班 同学 展示 。\n=== 第 20 页 ===\n人 4 —\n只 地\nATR 区\n第 一 节 东南亚 单一 经 济 为 主 的 地 区 34\n重要 的 地 理 位 置 12 黑色 人 种 的 故乡 37\n山河 相间 的 地 形 和 众多 的 岛屿 “14\n湿热 的 气候 和 丰富 的 物产 15 第 四 节 ”欧洲 西部\n稠密 的 人 口 18 优良 的 自然 环境 41\n便利 的 海陆 运输 42\n第 二 节 ”西亚 发 达 的 工业 和 繁荣 的 旅游 业 43\n“五 海 三 洲 ” 之 地 21\n干燥 的 气候 和 有 限 的 水 资源 “22 第 五 节 ”南极 地 区 和 北极 地 区\n世界 石油 宝库 24 地 球 上 最 南 的 地 区 48\n阿拉 伯 国 家 为 主 的 地 区 27 地 球 上 最 北 的 地 区 51,2.0,72.93518518518519,中图版（主编_钟作慈）_八年级_义务教育教科书·地理八年级下册（主编_钟作慈）,14,2025-07-21T14:23:03.021Z,2.0,义务教育教科书·地理八年级下册（主编：钟作慈）,/Users/LeoQin/Documents/GitHub/PDFconvertor/training_data/初中/地理/中图版（主编：钟作慈）-中国地图出版社/八年级/义务教育教科书·地理八年级下册（主编：钟作慈）.pdf,八年级,tesseract.js-parallel,中图版,0.8049242424242424,0.5,1,72.93518518518519,,true,,true,,,geography,下册,中图版（主编：钟作慈）_八年级_义务教育教科书·地理八年级下册（主编：钟作慈）.json,地理,108,初中_地理_中图版（主编：钟作慈）_八年级_义务教育教科书·地理八年级下册（主编：钟作慈）
中图版（主编_钟作慈）_八年级_义务教育教科书·地理八年级下册（主编_钟作慈）_chunk_6,6,太平 洋和 印度洋 之间 的十 字路 口。 位于 该地 区的 马六甲海峡是 沟通太平洋 和印度洋 的咽喉之 一， 也是 东西方 交通 的要 冲。 新加 坡撮 守马六甲海峡东 端， 新加 坡港 是世界最 大的 集装箱海港之 一。 1. 读图 6 2， 按照 要求 找出 最便捷的 航海线。 修一 (1) 从波斯湾 向我 国上 海运输 石油。 (2) 从日 本东京向 非洲东部的 达累 斯萨 拉姆 运输机 械设备。 有要 2 党 of AS) 4 天本 攻 A 2 马和 看一 人 emg 2 es ra 2 和 re En 汪光 多和 2 人图 6 2 马六甲海峡的 重要性 2. 阅读以 下资料， 进一 步了 解马六甲海峡的 重要性。 马六甲海峡位 于马 来半 岛和 苏门答腊岛 之间， 全长 1 080 干米， 西北部宽 370 干米， 东南部 宽 37 干米。 主航道水 深 25 一 150 米， 可供 26 万吨 级的 轮船满载通过 . 每年 通过马 六甲 海峡的 各类 船舶在 10 万艘 以上， 其中 18 万吨 级以 上的 巨轮在 2 000 艘以上. 马六甲海峡与 英吉利 海峡并 列为 世界上 最繁忙的 海峡通道 . 14 D 第卢 章 KigrRE Kk 山河相间的 地形 和众多的 岛屿读 图 6 一 1， 1， 说出 中南 半岛 山脉的 走向与 河流的 流向， 以及 山脉与 河流的 分布 特点。 2. 说明 中南 半岛 上的 平原为 什么主要分 布在 河流的 下游。 3. 说明 中南 半岛 各国 首都 为什么多 沿河流闸 布。 中南 半吕 的地 势北 高南 低， 山脉 与河流多 南北走向 、 相间 排列。 发源 于中 国境内 的湄公河 〈 在中 国境内 称澜沧江 ) 是东南亚 最,755,0.33967543643819564,low,ocr,太 平 洋 和\n印度 洋 之 间 的 “十 字 路 口 ” 。 位 于 该 地 区 的 马六甲 海峡 是 沟通 太平 洋\n和 印度 洋 的 咽喉 之 一 ， 也 是 东西 方 交 通 的 要 冲 。 新 加 坡 撮 守 马六甲\n海峡 东 端 ， 新 加 坡 港 是 世界 最 大 的 集装箱 海港 之 一 。\n1. 读 图 6--2， 按 照 要 求 找 出 最 便捷 的 航海 线 。 修一 #%\n(1) 从 波斯 湾 向 我 国 上 海运 输 石 油 。\n(2) 从 日 本 东京 向 非洲 东部 的 达 累 斯 萨 拉 姆 运输 机 械 设备 。\nES\n有\n= 要 2 党 of AS) 4 “天 本\n攻 >A 2 马 和 看\n一 人\nemg 2 es - ra\n2 和 re En 汪 光 -\n£ 多 \ 和\n2 人\n图 6-2 ”马六甲 海峡 的 重要 性\n2. 阅读 以 下 资料 ， 进 一 步 了 解 马六甲 海峡 的 重要 性 。\n马六甲 海峡 位 于 马 来 半 岛 和 苏门答腊 岛 之 间 ， 全 长 1 080 干 米 ， 西 北部 宽 370 干 米 ，\n东南 部 宽 37 干 米 。 主 航道 水 深 25 一 150 米 ， 可 供 26 万 吨 级 的 轮船 满载 通过 . 每 年 通过 马\n六 甲 海峡 的 各 类 船舶 在 10 万 艘 以 上 ， 其 中 18 万 吨 级 以 上 的 巨轮 在 2 000 艘 以上. 马六甲\n海峡 与 英吉 利 海峡 并 列 为 世界 上 最 繁忙 的 海峡 通道 .\n=== 第 24 页 ===\n14 D * 第 卢 章 KigrRE Kk\n山河 相间 的 地 形 和 众多 的 岛屿\n读 图 6 一 1 ，\n1， 说 出 中 南 半 岛 山脉 的 走向 与 河流 的 流\n向 ， 以 及 山脉 与 河流 的 分 布 特点 。\n2. 说 明 中 南 半 岛 上 的 平原 为 什么 主要 分 布\n在 河流 的 下 游 。\n3. 说 明 中 南 半 岛 各 国 首 都 为 什么 多 沿 河流\n闸 布 。\n中 南 半 吕 的 地 势 北 高 南 低 ， 山 脉 与 河流 多 南北 走向 、 相 间 排\n列 。 发 源 于 中 国境 内 的 湄公河 〈 在 中 国境 内 称 澜沧江 ) 是 东南 亚 最,2.0,72.93518518518519,中图版（主编_钟作慈）_八年级_义务教育教科书·地理八年级下册（主编_钟作慈）,17,2025-07-21T14:23:03.021Z,2.0,义务教育教科书·地理八年级下册（主编：钟作慈）,/Users/LeoQin/Documents/GitHub/PDFconvertor/training_data/初中/地理/中图版（主编：钟作慈）-中国地图出版社/八年级/义务教育教科书·地理八年级下册（主编：钟作慈）.pdf,八年级,tesseract.js-parallel,中图版,0.7966728280961183,0.5,1,72.93518518518519,,,,true,,,geography,下册,中图版（主编：钟作慈）_八年级_义务教育教科书·地理八年级下册（主编：钟作慈）.json,地理,108,初中_地理_中图版（主编：钟作慈）_八年级_义务教育教科书·地理八年级下册（主编：钟作慈）
中图版（主编_钟作慈）_八年级_义务教育教科书·地理八年级下册（主编_钟作慈）_chunk_7,7,流的 分布 特点。 2. 说明 中南 半岛 上的 平原为 什么主要分 布在 河流的 下游。 3. 说明 中南 半岛 各国 首都 为什么多 沿河流闸 布。 中南 半吕 的地 势北 高南 低， 山脉 与河流多 南北走向 、 相间 排列。 发源 于中 国境内 的湄公河 〈 在中 国境内 称澜沧江 ) 是东南亚 最长 的河流。 在各 大河流的 下游 有较 大面积的 平原， 土壤 肥沃， 灌溉 便利， 是该 地区 重要的 农业区。 中南 半岛 上的 许多城市， 包括 一些国家的 首都， 如曼谷 、 金边 、 万象 和河内等， 都位 于河流沿岸。 充足 的水 源和 便利的 水运， 为沿 河城市的 发展 提供了 有利 条件。 2 T Wa : Te 湄公河漏 公河流经 东南亚 5 个国家， 是一 条重要的 国际通航河流。 马来 群岛 又称 南洋 群铝， 有大 小岛屿 2 万多 个。 马来 群岛地 处环 太平详 火山 、 地震 带和 地中 海一 喜马拉雅火山 、 地震 带的 交接处， 火山活动和 地震 频繁。 家第 一节 东南亚 X D 15 印度尼 西亚 一座 火山 的火山口 印度尼西亚是 世界上 火山景 多的 国家之 一， 有火山国 之称。 分析 某一 地区 河流对 城市分 布及 发展 影响的 基本方法是 : 学成 15 5 1. 阅读该 地区 地形 图， 找出 该地 区的 主要河流， 并说 明这 些河 流的 发源 地和 流向， 以及 流经 地区 的地 形特 点。 2 从图 中找 出该 地区 的主要城市， 说出 这些 城市是 否临 近河 流及 所临近河流的 名称。 3， 从水 源和 水运 等方面说 明河 流对 该地 区城市发 展的 作用。 湿热的 气候和 丰富的 物产,740,0.4432579622907844,medium-low,ocr,流 的 分 布 特点 。\n2. 说 明 中 南 半 岛 上 的 平原 为 什么 主要 分 布\n在 河流 的 下 游 。\n3. 说 明 中 南 半 岛 各 国 首 都 为 什么 多 沿 河流\n闸 布 。\n中 南 半 吕 的 地 势 北 高 南 低 ， 山 脉 与 河流 多 南北 走向 、 相 间 排\n列 。 发 源 于 中 国境 内 的 湄公河 〈 在 中 国境 内 称 澜沧江 ) 是 东南 亚 最\n长 的 河流 。 在 各 大 河流 的 下 游 有 较 大 面积 的 平原 ， 土 壤 肥 沃 ， 灌 溉\n便利 ， 是 该 地 区 重要 的 农业 区 。 中 南 半 岛 上 的 许多 城市 ， 包 括 一些\n国家 的 首都 ， 如 曼谷 、 金 边 、 万 象 和 河内 等 ， 都 位 于 河流 沿岸 。 充\n足 的 水 源 和 便利 的 水 运 ， 为 沿 河 城市 的 发 展 提供 了 有 利 条 件 。\n2  T Wa\n: Te = AR £\nRE\n湄公河 “” 漏 公 河流 经 东南 亚 5 个 国家 ， 是 一 条 重要 的 国际 通航\n河流 。\n马 来 群 岛 又 称 南 洋 群 铝 ， 有 大 小 岛屿 2 万 多 个 。 马 来 群岛 地 处 环\n太平 详 火 山 、 地 震 带 和 地 中 海 一 喜马拉雅 火山 、 地 震 带 的 交接 处 ，\n火山 活动 和 地 震 频 繁 。\n=== 第 25 页 ===\n家 第 一 节 东南 亚 X D 15\n印度 尼 西 亚 一 座 火 山 的 火山 口 印度尼西亚 是 世界 上 火山 景\n多 的 国家 之 一 ， 有 “火山 国 ” 之 称 。\n分 析 某 一 地 区 河流 对 城市 分 布 及 发 展 影响 的 基本 方法 是 : 学 成 15 5\n1. 阅读 该 地 区 地 形 图 ， 找 出 该 地 区 的 主要 河流 ， 并 说 明 这 些 河 流 的 发 源 地 和 流\n向 ， 以 及 流 经 地 区 的 地 形 特 点 。\n2 从 图 中 找 出 该 地 区 的 主要 城市 ， 说 出 这 些 城市 是 否 临 近 河 流 及 所 临近 河流\n的 名 称 。\n3， 从 水 源 和 水 运 等 方面 说 明 河 流 对 该 地 区 城市 发 展 的 作用 。\n湿热 的 气候 和 丰富 的 物产,2.0,72.93518518518519,中图版（主编_钟作慈）_八年级_义务教育教科书·地理八年级下册（主编_钟作慈）,18,2025-07-21T14:23:03.021Z,2.0,义务教育教科书·地理八年级下册（主编：钟作慈）,/Users/LeoQin/Documents/GitHub/PDFconvertor/training_data/初中/地理/中图版（主编：钟作慈）-中国地图出版社/八年级/义务教育教科书·地理八年级下册（主编：钟作慈）.pdf,八年级,tesseract.js-parallel,中图版,0.879472693032015,0.5,1,72.93518518518519,,,,true,,,geography,下册,中图版（主编：钟作慈）_八年级_义务教育教科书·地理八年级下册（主编：钟作慈）.json,地理,108,初中_地理_中图版（主编：钟作慈）_八年级_义务教育教科书·地理八年级下册（主编：钟作慈）
中图版（主编_钟作慈）_八年级_义务教育教科书·地理八年级下册（主编_钟作慈）_chunk_8,8,出渭 公河， 运用所 学的 知识填写表 6 1。 更力 表 6 一 1 5 、， 流经 地区 的河流沿岸的 河流对 这些 城市地 形特点主要城市发 展的 作用湄公河 2. 阅读以 下资料并 结合本 节内 容， 说明 华人 在东南亚 的分 布情况， 以及 华人在 东南亚开发和 建设中 的重要作用。 据不 完全统计，2014 年东南亚 部分 国家的 华人数量是， 印度 尼西亚约 1 600 万 、 泰国 约 1 020 万 、 马来 西亚约 655 万 、 缅甸 约 300 万 、 新加 坡约 284 万。 新加坡华人数量约 占全 国总 人口 的 7496， 是海外华人占 所在 国人口 比重最 高的 国家。 20 D 第上 章 KiEmd 让东南亚 的华人大 部分 是清朝末年到 南洋进行开拓的 华人后 代。 他们 为所 在国 的经 济发 展做 出了 重要贡献， 对当地的 生产和 生活都 产生了 巨大的 影响。 许多 华人在 所在 国从 事商业活动及 进出口 贸易， 形成 了一 个中 国与 海外之 间的 贸易网 络。 此外， 从事 农业 、 园艺业 和渔业的 华人数量也 很多 还有 相当一 部分 华人成 为手工业者， 如裁缝 、 膨刻 师和 画家等。 5. 运用地 图， 说出 天然 橡胶 、 油棕 在东南亚 的主要分 布地区。 4. 运用地 图和 以下 资料， 说出 世界著名的 东南亚 锡矿 带的 地理 位置， 说明 锡的 重要 作用。 锡是 人类 最早 发现 和使 用的 金属之 一。 锡质 柔软， 有延展性， 化学 性质 稳定， 可作 为防腐蚀 材料和 食品包装材料， 还可 作为陶 资釉 和印染剂 、 杀虫 剂等 的原料。 锡和 锡合 金在 现代国防和 工业中 也有 广泛的 应用。,751,0.4646556578646548,medium-low,ocr,出 渭 公 河 ， 运用 所 学 的 知识 填写 表 6-1。 ”更 力\n表 6 一 1\n5 、， 流 经 地 区 的 河流 沿岸 的 河流 对 这 些 城市\n| ARYR 地 形 特点 主要 城市 发 展 的 作用\n湄公河\n2. 阅读 以 下 资料 并 结合 本 节 内 容 ， 说 明 华 人 在 东南 亚 的 分 布 情况 ， 以 及 华人 在 东\n南亚 开发 和 建设 中 的 重要 作用 。\n据 不 完全 统计 ，2014 年 东南 亚 部 分 国家 的 华人 数量 是 ， 印 度 尼 西亚 约 1 600 万 、 泰\n国 约 1 020 万 、 马 来 西亚 约 655 万 、 缅 甸 约 300 万 、 新 加 坡 约 284 万 。 新加坡 华人 数量 约 占\n全 国 总 人 口 的 7496， 是 海外 华人 占 所 在 国人 口 比重 最 高 的 国家 。\n=== 第 30 页 ===\n20 D * 第 上 章 KiEmd 让\n东南 亚 的 华人 大 部 分 是 清朝 末年 到 南洋 进行 开拓 的 华人 后 代 。 他 们 为 所 在 国 的 经 济\n发 展 做 出 了 重要 贡献 ， 对 当地 的 生产 和 生活 都 产生 了 巨大 的 影响 。 许 多 华人 在 所 在 国 从\n事 商业 活动 及 进出 口 贸 易 ， 形 成 了 一 个 中 国 与 海外 之 间 的 贸易 网 络 。 此 外 ， 从 事 农业 、\n园艺 业 和 渔业 的 华人 数量 也 很 多 还 有 相当 一 部 分 华人 成 为 手工 业者 ， 如 裁缝 、 膨 刻 师\n和 画家 等 。\n5. 运用 地 图 ， 说 出 天 然 橡胶 、 油 棕 在 东南 亚 的 主要 分 布地 区 。\n4. 运用 地 图 和 以 下 资料 ， 说 出 世界 著名 的 东南 亚 锡 矿 带 的 地 理 位 置 ， 说 明 锡 的 重\n要 作用 。\n锡 是 人 类 最 早 发 现 和 使 用 的 金属 之 一 。 锡 质 柔 软 ， 有 延展 性 ， 化 学 性 质 稳 定 ， 可 作\n为 防腐 蚀 材料 和 食品 包装 材料 ， 还 可 作为 陶 资 釉 和 印染 剂 、 杀 虫 剂 等 的 原料 。 锡 和 锡 合\n金 在 现代 国防 和 工业 中 也 有 广泛 的 应 用 。,2.0,72.93518518518519,中图版（主编_钟作慈）_八年级_义务教育教科书·地理八年级下册（主编_钟作慈）,23,2025-07-21T14:23:03.021Z,2.0,义务教育教科书·地理八年级下册（主编：钟作慈）,/Users/LeoQin/Documents/GitHub/PDFconvertor/training_data/初中/地理/中图版（主编：钟作慈）-中国地图出版社/八年级/义务教育教科书·地理八年级下册（主编：钟作慈）.pdf,八年级,tesseract.js-parallel,中图版,0.8469945355191257,0.5,1,72.93518518518519,,,,true,,,mathematics,下册,中图版（主编：钟作慈）_八年级_义务教育教科书·地理八年级下册（主编：钟作慈）.json,地理,108,初中_地理_中图版（主编：钟作慈）_八年级_义务教育教科书·地理八年级下册（主编：钟作慈）
中图版（主编_钟作慈）_八年级_义务教育教科书·地理八年级下册（主编_钟作慈）_chunk_9,9,"国和 地站 Coniee 区的 生产和 生活用 水几乎全 部依赖约旦河水。 在过 全有 去的 几十 年间， 沿岸 各国 和地 区从 约旦河 及其 支流人 ee 引出大 约 98 6 的水 量用 于饮用和 灌溉。20 世纪 30 年旧 忆代， 约旦 河的 年流量曾 达到 13 亿立方米， 而目前仅 芽有 2 000 万一 3 000 万立方米。 如此 珍贵的 水资源必然区 成为 沿岸各 国和 地区 间争 夺的 焦点 . ss 一一 一 1947 年 11 月联合国安理会决议所 规定的 犹太国 ( 以色 列 ) 疆域。 1949 年巴勒斯坦地 区以 色列 和 : 阿拉伯 国家 的停战界线。 斯坦 分治 决议， 了路 指冷 应由 联会 国托 ee 约目 河约旦河 是西亚干旱土地的 生命之 河。 图 6 一 9 巴勒斯坦地 区 2 D 第具 章 KiERE 让干燥的 气候和 有限 的水 资源对 西亚的 农业发 展不 利。 但是， 在幼发拉底河和底格里斯河流域 (简称两 河流域 ) , 以及 沙漠中 的绿 洲， 通过 灌溉可 以种 植棉 花 、 小麦 和香料作物等。 在广阔的 高原 地区 主要发 展畜 牧业， 为当地居民提供肉 类 、 乳品 和毛皮。 0 2 2N : h : ee 2 kal 一 An As y . 有 y 二 , 语证 . Koy 交沙特阿拉伯 的绿洲农业在 阿拉伯 半岛 的沙 土耳其的 安卡拉羊 毛用 羊， 所产 羊毛 称汉 环境 里， 绿洲 是发 展农业的 重要地 区。 马海 狠， 以质地软 细 、 美如 绢丝 著称。 世界石油宝库读 图 6 6 和图 6 一 10:",702,0.3077485080457477,low,ocr,"国 和 地\n站 Coniee | | “区 的 生产 和 生活 用 水 几乎 全 部 依赖 约旦 河水 。 在 过\n全 有 去 的 几 十 年 间 ， 沿 岸 各 国 和 地 区 从 约旦 河 及 其 支流\n人 ee 引出 大 约 98%6 的 水 量 用 于 饮用 和 灌溉 。20 世 纪 30 年\nSA 旧 忆 代 ， 约 旦 河 的 年 流量 曾 达到 13 亿 立方 米 ， 而 目前 仅\nSN 芽 -= 有 2 000 万 一 3 000 万 立方 米 。 如 此 珍贵 的 水 资源 必然\n区 | 成 为 沿岸 各 国 和 地 区 间 争 夺 的 焦点 .\n=\nss\n一 一 一 1947 年 11 月 联合 国安 理会 决议 所\n规定 的 “犹太 国 ”( 以 色 列 ) 疆 域 。\n+++++ 1949 年 巴勒斯坦 地 区 以 色 列 和 :\n阿拉 伯 国 家 的 停战 界线 。\n斯 坦 分 治 决议 ， 了 路 指 冷 应 由 联 会 国 托\nee 约 目 河 ”约旦 河 是 西亚 干旱 土地 的 生命 之 河 。\n图 6 一 9 巴勒斯坦 地 区\n=== 第 35 页 ===\n2% D * 第 具 章 KiERE 让\n干燥 的 气候 和 有 限 的 水 资源 对 西亚 的 农业 发 展 不 利 。 但 是 ， 在\n幼发拉底 河和 底格里斯 河流 域 (简称 “两 河流 域 ” ) , 以 及 沙漠 中 的 绿\n洲 ， 通 过 灌溉 可 以 种 植 棉 花 、 小 麦 和 香料 作物 等 。 在 广阔 的 高 原 地\n区 主要 发 展 畜 牧 业 ， 为 当地 居民 提供 肉 类 、 乳 品 和 毛皮 。\nFRL == 0\n2 - ‘\n2N : h : ee | — 2\nkal 一 > An As\ny . ”| ”有\ny | = 二 , 语 证 & . Koy\n| 交\n沙特 阿拉 伯 的 绿洲 农业 ”在 阿拉 伯 半 岛 的 沙 土耳其 的 安卡拉 羊 毛 用 羊 ， 所 产 羊 毛 称\n汉 环 境 里 ， 绿 洲 是 发 展 农业 的 重要 地 区 。 “ 马 海 狠 ， 以 质地 软 细 、 美 如 绢 丝 著 称 。\n世界 石油 宝库\n读 图 6-6 和 图 6 一 10:",2.0,72.93518518518519,中图版（主编_钟作慈）_八年级_义务教育教科书·地理八年级下册（主编_钟作慈）,27,2025-07-21T14:23:03.021Z,2.0,义务教育教科书·地理八年级下册（主编：钟作慈）,/Users/LeoQin/Documents/GitHub/PDFconvertor/training_data/初中/地理/中图版（主编：钟作慈）-中国地图出版社/八年级/义务教育教科书·地理八年级下册（主编：钟作慈）.pdf,八年级,tesseract.js-parallel,中图版,0.7813121272365805,0.5,1,72.93518518518519,,,,true,,,geography,下册,中图版（主编：钟作慈）_八年级_义务教育教科书·地理八年级下册（主编：钟作慈）.json,地理,108,初中_地理_中图版（主编：钟作慈）_八年级_义务教育教科书·地理八年级下册（主编：钟作慈）
