Chunk_ID,Chunk_Index,Content,Content_Length,Quality_Score,Reliability,Source_Type,Original_Content,Enhancement_Version,averageConfidence,book_name,chunkIndex,enhancementTimestamp,enhancementVersion,fileName,filePath,grade,ocrMethod,publisher,qualityMetrics_chineseCharRatio,qualityMetrics_coherenceScore,qualityMetrics_lengthScore,qualityMetrics_ocrConfidence,semanticFeatures_hasDefinition,semanticFeatures_hasExperiment,semanticFeatures_hasFormulas,semanticFeatures_hasNumbers,semanticFeatures_hasQuestion,semanticFeatures_isTableContent,semanticFeatures_subjectArea,semester,source_file,subject,totalPages,uniqueId
中图版（主编_钟作慈）_八年级_义务教育教科书·地理八年级上册（主编_钟作慈）_chunk_10,10,"世界的 和气候不 城市人 口众多， 建筑 物密集， 生产 和生活中 排放的 热量难以散 发， 使得 市区 的气温明显高 于郊区， 局部 气候和 恶化。 必须通过大 力植树造林， 保护 地面 水系， 来改善城市的 局部 气候。 许多国家都 在加 强对 空气质量的 监测。 我国 在 2012 年颁布了 新的 《环境空气质量标准 》, 增加了 PM2?.5、 臭氧 、 一氧化碳 三种 污染物 指标， 制定 了空气质量指数分 级标准， 并把 发布 次数 从每 天一 次变 成每 小时 一次。 F2 4 空气质量指数 (AQI) 分级 表指数指数级 别指数类 别对 健康的 影响 0 30 一级 优空气质量令 人油 意， 基本 无空气污染 _ _ 空气质量可 接受， 但某 些污染物 可能 对极 少数异常敏 1100 3 感人群 的健康有 较弱 影响 101 150 三级 轻度 污染易 感人群 的症状有 轻度 加剧， 健康 人群 出现 刺激 症状 进一步加 剧易 感人群 的症状， 可能 对健康人 群的 心脏 、 让心脏病 和脏 病患者症状显著加 剧， 运动 耐受 力降低， 201 300 五级 重度党 染健康人 群普遍出 现症状 _ 运动耐 受， 有明显强烈症状， 提前 出现 六级 pmig 健康人 这动 受力 降低， 有明显强烈征 状， 提前 出现 家第 三节 气候对 生产和 生活的 影响 X 45 上四 天 53) 1。 阅读以 下资料， 说明 尼罗 河三 角洲 和下 游两 岸成 为长 线棉 观图 产区 的气候条 件。 长绒 棉在 生长期 内需要充足的 光照和 热量 、 较少 的降水， 还需要肥沃的 土壤和 便利",712,0.402085213405159,medium-low,ocr,"世界 的 和 气候 不\n城市 人 口 众多 ， 建 筑 物 密集 ， 生 产 和 生活 中 排放 的 热量 难以 散\n发 ， 使 得 市 区 的 气温 明显 高 于 郊区 ， 局 部 气候 和 恶化。 必须 通过 大 力\n植树 造林 ， 保 护 地 面 水 系 ， 来 改善 城市 的 局 部 气候 。\n许多 国家 都 在 加 强 对 空气 质量 的 监测 。 我 国 在 2012 年 颁布 了 新\n的 《环境 空气 质量 标准 》, 增加 了 PM2?.5、 臭 氧 、 一 氧化 碳 三 种 污染\n物 指标 ， 制 定 了 空气 质量 指数 分 级 标准 ， 并 把 发 布 次 数 从 每 天 一 次\n变 成 每 小 时 一 次 。\nF2—4 空气 质量 指数 (AQI) 分 级 表\n指数 指数 级 别 ”指数 类 别 对 健康 的 影响\n0~30 一 级 优 空气 质量 令 人 油 意 ， 基 本 无 空气 污染\n_ _- 空气 质量 可 接受 ， 但 某 些 污染 物 可 能 对 极 少数 异常 敏\n1100 —= /3 感人 群 的 健康 有 较 弱 影响\n101-150 三 级 轻 度 污染 易 感人 群 的 症状 有 轻 度 加 剧 ， 健 康 人 群 出 现 刺 激 症 状\n= 进一步 加 剧 易 感人 群 的 症状 ， 可 能 对 健康 人 群 的 心脏 、\n让 心脏 病 和 脏 病 患者 症状 显著 加 剧 ， 运 动 耐 受 力 降低 ，\n201-300 五 级 重度 党 染 健康 人 群 普遍 出 现 症状\n_ 运动 耐 受 ， 有 明显 强烈 症状 ， 提 前 出 现\n六 级 pmig 健康 人 这 动 受 力 降低 ， 有 明显 强烈 征 状 ， 提 前 出 现\n=== 第 49 页 ===\n家 第 三 节 气候 对 生产 和 生活 的 影响 X < 45\n€\n--------------------------------------- 上 四 天 53)\n1。 阅读 以 下 资料 ， 说 明 尼 罗 河 三 角 洲 和 下 游 两 岸 成 为 长 线 棉 观 图\n产 区 的 气候 条 件 。\n长 绒 棉 在 生长 期 内 需要 充足 的 光照 和 热量 、 较 少 的 降水 ， 还 需要 肥沃 的 土壤 和 便利",2.0,72.72448979591837,中图版（主编_钟作慈）_八年级_义务教育教科书·地理八年级上册（主编_钟作慈）,39,2025-07-21T14:23:03.006Z,2.0,义务教育教科书·地理八年级上册（主编：钟作慈）,/Users/LeoQin/Documents/GitHub/PDFconvertor/training_data/初中/地理/中图版（主编：钟作慈）-中国地图出版社/八年级/义务教育教科书·地理八年级上册（主编：钟作慈）.pdf,八年级,tesseract.js-parallel,中图版,0.839622641509434,0.5,1,72.72448979591837,,,,true,true,,physics,上册,中图版（主编：钟作慈）_八年级_义务教育教科书·地理八年级上册（主编：钟作慈）.json,地理,98,初中_地理_中图版（主编：钟作慈）_八年级_义务教育教科书·地理八年级上册（主编：钟作慈）
中图版（主编_钟作慈）_八年级_义务教育教科书·地理八年级上册（主编_钟作慈）_chunk_11,11,口增长 48 第三 素刀 界的 居民表 3 一 1 每增加 10 亿人 的人 口数 亿人 出现年份 和 10 和 30 40 50 60 70 阅读人 口增长图 的基本方法是 : 1， 和确定纵 坐标 和横 坐标所 表示的 事物及 单位。 如图 3 一 1， 纵坐标表示人 口数量， 单位为 亿人， 横坐标表示时 间， 单位 为年。 2. 计算相同数量人 口增 长时 间的 变化， 说明 人口 增长的 特点及 趋势， 如缓慢 、 快速 、 趋缓 等 3. 根据折线变化， 大致说 明某 一时 间段 内人 口增 长的 幅度。 如图 3 1 反映 出 1930 年以 后世界人 口增长幅度明显加 大 . 19 世纪 30 年代 以前， 世界 人口 增长比较缓慢。 第二 次世界大 战以 后， 由于 生产力 的发 展， 全球 经济 状况可 以满足更 多人 口的 生活需要， 医疗 技术的 提高使 得人 口的 寿命大 大延长， 战争 所造成的 人口 非正常死亡大 大减少， 世界 人口 迅儿 增长。 从近 些年 的趋势看， 世界人 口还 将继续增长。 第一 节人 口和 人种 广 49 世界人 口数 量预测 5 联合国 在 2011 年预测， 依照 目前生育率 推算， 到 2050 年世界人 口总 数可 能达到 93 亿， 到 2100 年可 能达到 101 亿。 如果 生育 率比 目前略 高， 到 2050 年世界人 口总 数可 能达 到 106 亿， 到 2100 年可 能达到 158 亿。 如果 生育 率比 目前略 低， 到 2050 年世界人 口总 数可 能达到 81 亿， 到 2100 年就 会降 到 62 亿。,711,0.4077794734468373,medium-low,ocr,口 增长\n=== 第 52 页 ===\n48 < * 第 三 素 刀 界 的 居民 *\n表 3 一 1\n每 增加 10 亿 人 的\n人 口 数 / 亿 人 出 现年 份 和\n10\n和\n30\n40\n50\n60\n70\n&& 阅读 人 口 增长 图 的 基本 方法 是 :\n1， 和 确定 纵 坐 标 和 横 坐标 所 表示 的 事物 及 单位 。 如 图 3 一 1， 纵 坐标 表示 人 口 数量 ，\n单位 为 亿 人 ， 横 坐标 表示 时 间 ， 单 位 为 年 。\n2. 计算 相同 数量 人 口 增 长 时 间 的 变化 ， 说 明 人 口 增长 的 特点 及 趋势 ， 如 缓慢 、 快\n速 、 趋 缓 等\n3. 根据 折线 变化 ， 大致 说 明 某 一 时 间 段 内 人 口 增 长 的 幅度 。 如 图 3-1 反 映 出 1930\n年 以 后 世界 人 口 增长 幅度 明显 加 大 .\n19 世 纪 30 年 代 以 前 ， 世 界 人 口 增长 比较 缓慢 。 第 二 次 世界 大 战\n以 后 ， 由 于 生产 力 的 发 展 ， 全 球 经 济 状况 可 以 满足 更 多 人 口 的 生活\n需要 ， 医 疗 技术 的 提高 使 得 人 口 的 寿命 大 大 延长 ， 战 争 所 造成 的 人\n口 非 正常 死亡 大 大 减少 ， 世 界 人 口 迅 儿 增 长 。 从 近 些 年 的 趋势 看 ，\n世界 人 口 还 将 继续 增长 。\n=== 第 53 页 ===\n* 第 一 节 人 口 和 人 种 广 < 49\n世界 人 口 数 量 预测 @®— #5\n联合 国 在 2011 年 预测 ， 依 照 目前 生育 率 推算 ， 到 2050 年 世界 人 口 总 数 可 能 达到 93\n亿 ， 到 2100 年 可 能 达到 101 亿 。 如 果 生 育 率 比 目前 略 高 ， 到 2050 年 世界 人 口 总 数 可 能 达\n到 106 亿 ， 到 2100 年 可 能 达到 158 亿 。 如 果 生 育 率 比 目前 略 低 ， 到 2050 年 世界 人 口 总 数 可\n能 达到 81 亿 ， 到 2100 年 就 会 降 到 62 亿 。,2.0,72.72448979591837,中图版（主编_钟作慈）_八年级_义务教育教科书·地理八年级上册（主编_钟作慈）,42,2025-07-21T14:23:03.006Z,2.0,义务教育教科书·地理八年级上册（主编：钟作慈）,/Users/LeoQin/Documents/GitHub/PDFconvertor/training_data/初中/地理/中图版（主编：钟作慈）-中国地图出版社/八年级/义务教育教科书·地理八年级上册（主编：钟作慈）.pdf,八年级,tesseract.js-parallel,中图版,0.7725490196078432,0.5,1,72.72448979591837,,,,true,,,unknown,上册,中图版（主编：钟作慈）_八年级_义务教育教科书·地理八年级上册（主编：钟作慈）.json,地理,98,初中_地理_中图版（主编：钟作慈）_八年级_义务教育教科书·地理八年级上册（主编：钟作慈）
中图版（主编_钟作慈）_八年级_义务教育教科书·地理八年级上册（主编_钟作慈）_chunk_12,12,数可 能达到 93 亿， 到 2100 年可 能达到 101 亿。 如果 生育 率比 目前略 高， 到 2050 年世界人 口总 数可 能达 到 106 亿， 到 2100 年可 能达到 158 亿。 如果 生育 率比 目前略 低， 到 2050 年世界人 口总 数可 能达到 81 亿， 到 2100 年就 会降 到 62 亿。 数据显示， 欧洲 人口 可能 在 2020 年达到 7.44 亿的 最高 值， 中国人口 可能 在 2030 年达 到 14.5 亿的 最高 值， 印度 人口 可能 在 2060 年达到 17 亿的 最高 值。 读图 3 一 2 : 1. 运用图 中数据进行计算， 将结果填 入表 3 一 2 中。 2. 说出 人口 增长最 快和 最慢 的大 洲。 43.9 t 1 1s00 36.8 y 5 F1 ss0s F1 2000 年医 避 2015 年 15 注 ; 欧洲人 口包括俄罗斯全 部人 口。 六 13.8 11.9 吕 10 9.5 7.37.4 了 5.7 5.7 5 4.2 二 4.2 3.5 1.7 1.7 2.2， 0 070 12.310.39 0.6 0.8 1.1 大洋 洲南美洲 北美洲 欧洲非洲亚洲图 3 一 2 世界各 洲人 口增长 50 第三 章世界的 居民表 3 一 2 1950 年 20154F 人口 增长大 洲名 称人 口数 亿人 人口 数亿 人百分比 8 亚洲非洲欧洲北美洲 南美洲 大洋 洲在 资本主义发 展初 期， 欧洲 、 北美洲和 大洋洲人 口增长非常迅 速，1900 年的 人口 总数 比 1700 年的 大口 总数 增加近 3 倍。20 世纪 以来， 由于 社会经 济的 变化和 两次 世界大 战的 影响， 这三 大洲 的人 口增长速度放 慢。 亚洲 和非洲在 20 世纪 以来 有了 不同 程度的 发展， 社,799,0.34433699168556303,low,ocr,数 可 能 达到 93\n亿 ， 到 2100 年 可 能 达到 101 亿 。 如 果 生 育 率 比 目前 略 高 ， 到 2050 年 世界 人 口 总 数 可 能 达\n到 106 亿 ， 到 2100 年 可 能 达到 158 亿 。 如 果 生 育 率 比 目前 略 低 ， 到 2050 年 世界 人 口 总 数 可\n能 达到 81 亿 ， 到 2100 年 就 会 降 到 62 亿 。\n数据 显示 ， 欧 洲 人 口 可 能 在 2020 年 达到 7.44 亿 的 最 高 值 ， 中 国人 口 可 能 在 2030 年 达\n到 14.5 亿 的 最 高 值 ， 印 度 人 口 可 能 在 2060 年 达到 17 亿 的 最 高 值 。\n读 图 3 一 2 :\n1. 运用 图 中 数据 进行 计算 ， 将 结果 填 入 表 3 一 2 中 。\n2. 说 出 人 口 增长 最 快 和 最 慢 的 大 洲 。\n43.9\nt\n[1 1s00 36.8\n£y\n5 F1 ss0s\nF1 2000 年\n医 避 2015 年\n15 注 ; 欧洲 人 口 包括 俄罗斯 全 部 人 口 。\n六 13.8\n% 11.9\n吕\n<10 9.5\n7.37.4 了\n5.7 5.7\n5 4.2 二 4.2\n3.5\n1.7 1.7 2.2\n， 0 070 12.310.39 0.6 0.8 1.1\n大 洋 洲 南美 洲 北美 洲 欧洲 非洲 亚洲\n图 3 一 2 ”世界 各 洲 人 口 增长\n=== 第 54 页 ===\n50 < * 第 三 章 世界 的 居民 *\n表 3 一 2\n1950 年 20154F 人 口 增长\n大 洲 名 称 人 口 数 / 亿 人 人 口 数 / 亿 人 百分比 /8%\n亚洲\n非洲\n欧洲\n北美 洲\n南美 洲\n大 洋 洲\n在 资本 主义 发 展 初 期 ， 欧 洲 、 北 美洲 和 大洋洲 人 口 增长 非常 迅\n速 ，1900 年 的 人 口 总 数 比 1700 年 的 大 口 总 数 增加 近 3 倍 。20 世 纪 以\n来 ， 由 于 社会 经 济 的 变化 和 两 次 世界 大 战 的 影响 ， 这 三 大 洲 的 人 口\n增长 速度 放 慢 。 亚 洲 和 非洲 在 20 世 纪 以 来 有 了 不 同 程度 的 发 展 ， 社,2.0,72.72448979591837,中图版（主编_钟作慈）_八年级_义务教育教科书·地理八年级上册（主编_钟作慈）,43,2025-07-21T14:23:03.006Z,2.0,义务教育教科书·地理八年级上册（主编：钟作慈）,/Users/LeoQin/Documents/GitHub/PDFconvertor/training_data/初中/地理/中图版（主编：钟作慈）-中国地图出版社/八年级/义务教育教科书·地理八年级上册（主编：钟作慈）.pdf,八年级,tesseract.js-parallel,中图版,0.6118881118881119,0.5,1,72.72448979591837,,,,true,,,physics,上册,中图版（主编：钟作慈）_八年级_义务教育教科书·地理八年级上册（主编：钟作慈）.json,地理,98,初中_地理_中图版（主编：钟作慈）_八年级_义务教育教科书·地理八年级上册（主编：钟作慈）
中图版（主编_钟作慈）_八年级_义务教育教科书·地理八年级上册（主编_钟作慈）_chunk_13,13,". . 0 本黄色人 种寿 驮黑色人 种上 白色人 种图 3 一 5 世界三 大人 种分 布 46 第三 章世界的 居民 K 三大 人种 祖先的 原分 布地区 不同。 黄色 人种 原分 布在 亚洲的 中东部， 黑色 人种 原分 布在 非洲的 赤道附近， 白色 人种 原分 布在 欧洲。 随着 新航路的 开尽， 以及 16 世纪 到 19 世纪 来西方的 奴隶贸易， 出现 了世界性 的人 种迁移。 现在 三大 人种 在世界各 地都 有分 布， 黄色 人种 主要分 布在 亚洲 、 北美洲和 南美洲， 黑色 人种 主要分 布在 非洲， 以及 北美洲 、 南美洲和 大洋 洲的 部分 地区， 白色 人种 主要分 布在 欧洲 、 北美洲 、 南美洲， 以及 亚洲 、 非洲 和大 洋洲 的部 分地 区。 不同人种 之间 的通婚， 形成 了混血人 种。 混血 人种 主要分 布在 南 、 北美洲， 主要 是由 于早先迁移来 的欧洲白色人 种 、 非洲 黑色 人种， 与当地黄色人 种长 期共同生活， 通婚 较为 普遍而 形成的。 在人 类发 展史 上， 不同人种 尽管生活的 地理 环境有 所不 同， 但都 经历 了大 体相 同的 历史发 展道路， 都对 人类 文明做 出了 自己的 贡献。 我们 不能 以人 种在 体质 、 体狐 特征 上的 某些 区别 来否认人 类种 属上 的统一性， 也不 能把 人种 按优 劣进行划分， 所有 人种 都是 平等的。 d o 5 这 Y e "" W .'s Se Rs ""YY 咱 、 人 4 了要 y 34 il 人 ; ss il 人种 没有优 劣之 分和 o Y",699,0.3937191993720565,low,ocr,".\n&.\n0 本\n黄色 人 种 寿 驮 黑色 人 种 上 白色 人 种\n图 3 一 5 ”世界 三 大 人 种 分 布\n=== 第 61 页 ===\n46 < * 第 三 章 世界 的 居民 K\n三 大 人 种 祖先 的 原 分 布地 区 不 同 。 黄 色 人 种 原 分 布 在 亚洲 的 中\n东部 ， 黑 色 人 种 原 分 布 在 非洲 的 赤道 附近 ， 白 色 人 种 原 分 布 在 欧\n洲 。 随 着 新 航路 的 开 尽 ， 以 及 16 世 纪 到 19 世 纪 来 西方 的 奴隶 贸易 ，\n出 现 了 世界 性 的 人 种 迁移 。 现 在 三 大 人 种 在 世界 各 地 都 有 分 布 ， 黄\n色 人 种 主要 分 布 在 亚洲 、 北 美洲 和 南美 洲 ， 黑 色 人 种 主要 分 布 在 非\n洲 ， 以 及 北美 洲 、 南 美洲 和 大 洋 洲 的 部 分 地 区 ， 白 色 人 种 主要 分 布\n在 欧洲 、 北 美洲 、 南 美洲 ， 以 及 亚洲 、 非 洲 和 大 洋 洲 的 部 分 地 区 。\n不 同人 种 之 间 的 通婚 ， 形 成 了 混血 人 种 。 混 血 人 种 主要 分 布 在\n南 、 北 美洲 ， 主 要 是 由 于 早先 迁移 来 的 欧洲 白色 人 种 、 非 洲 黑 色 人\n种 ， 与 当地 黄色 人 种 长 期 共同 生活 ， 通 婚 较 为 普遍 而 形成 的 。\n在 人 类 发 展 史 上 ， 不 同人 种 尽管 生活 的 地 理 环境 有 所 不 同 ， 但\n都 经 历 了 大 体 相 同 的 历史 发 展 道路 ， 都 对 人 类 文明 做 出 了 自己 的 贡\n献 。 我 们 不 能 以 人 种 在 体质 、 体 狐 特 征 上 的 某 些 区 别 来 否认 人 类\n种 属 上 的 统一 性 ， 也 不 能 把 人 种 按 优 劣 进行 划分 ， 所 有 人 种 都 是\n平等 的 。\nd o 5 这\nY e MPOTLY &£""% W\n¥.'s Se\nRs ""YY 咱 、\n人 4 了\n| 要 y & > 34 il |\n| 人\n;| ss il\n人 种 没有 优 劣 之 分\n和\no # Y",2.0,72.72448979591837,中图版（主编_钟作慈）_八年级_义务教育教科书·地理八年级上册（主编_钟作慈）,49,2025-07-21T14:23:03.006Z,2.0,义务教育教科书·地理八年级上册（主编：钟作慈）,/Users/LeoQin/Documents/GitHub/PDFconvertor/training_data/初中/地理/中图版（主编：钟作慈）-中国地图出版社/八年级/义务教育教科书·地理八年级上册（主编：钟作慈）.pdf,八年级,tesseract.js-parallel,中图版,0.8425357873210634,0.5,1,72.72448979591837,,,,true,,,biology,上册,中图版（主编：钟作慈）_八年级_义务教育教科书·地理八年级上册（主编：钟作慈）.json,地理,98,初中_地理_中图版（主编：钟作慈）_八年级_义务教育教科书·地理八年级上册（主编：钟作慈）
中图版（主编_钟作慈）_八年级_义务教育教科书·地理八年级上册（主编_钟作慈）_chunk_14,14,"的一 个表现是 城市人 口的 迅速增长。 到 2011 年， 世界 城市 人口 总数 已经 超过世界人 口总 数的 一半。 现在 城市人 口超过乡村人 口的 国家已 经有 100 多个。 城市化 的另 一个 表现是 大城市的 发展。2015 年， 世界 上人 口 100 万以 上的 特大城市超过 500 座。 城市化 过程 促进 了乡村人 口向 城市的 流动， 大量 的农民进入城 市从 事建筑 、 服务 、 物资 回收 等工作。 城市 化过 程还 使得 城市范围不 断扩 大， 交通 运输 设施 不断 发展， 加强 了城市之 间的 联系和 城市与 乡村的 联系。 时人 1. 以你 家乡 为例， 说明 城市 景观和 乡村景观的 差异。 ne 2. MBEATEA, LRANE THA EL, 美国首都华盛顿位 于美国东海岸 中部 的波 托马 克河北岸。 这一 带在 建都 以前 是大 面积的 森林， 只有 一两 个村 镇， 地势 平坦， 中央 有一 座小 山。 在规划和 建设全 城时， 以小 山为 中心 ,西部保留了 一大 片绿地， 山上 修建了 国会。 国会 与白宫之 间有 一条 大道 相连。 从小 山向 西是 城市的 中轴线， 中间 是华盛顿纪念碑， 尽头 是林肯纪念堂， 中轴线两 侧分 布着 国家航天航空博物馆 、 美术 馆等 众多的 科技 、 文化 展馆。 市区 内分 布的 主要是 机关 、 学校 和商店， 住宅 分布 在市 区的 周围。 74 第三 章世界的 居民 K 3. 阅读以 下有 关日 本京都古城和 意大利威尼斯古城的 资料， 说出 保护传统聚落有 什么意义。",697,0.3056183066486262,low,ocr,"的 一 个 表现 是 城市 人 口 的 迅速 增长 。 到 2011 年 ， 世 界 城\n市 人 口 总 数 已 经 超过 世界 人 口 总 数 的 一 半 。 现 在 城市 人 口 超过 乡村\n人 口 的 国家 已 经 有 100 多 个 。\n城市 化 的 另 一 个 表现 是 大 城市 的 发 展 。2015 年 ， 世 界 上 人 口 100\n万 以 上 的 特大 城市 超过 500 座 。\n城市 化 过 程 促 进 了 乡村 人 口 向 城市 的 流动 ， 大 量 的 农民 进入 城\n市 从 事 建筑 、 服 务 、 物 资 回 收 等 工作 。 城 市 化 过 程 还 使 得 城市 范围\n不 断 扩 大 ， 交 通 运 输 设 施 不 断 发 展 ， 加 强 了 城市 之 间 的 联系 和 城市\n与 乡村 的 联系 。\n时\n人\n1. 以 你 家 乡 为 例 ， 说 明 城 市 景观 和 乡村 景观 的 差异 。 ne\n2. MBEATEA, AALEIER LRANE RERYEAIAA THA EL,\n美国 首都 华盛顿 位 于 美国 东海 岸 中 部 的 波 托 马 克 河北 岸 。 这 一 带 在 建 都 以 前 是 大\n面积 的 森林 ， 只 有 一 两 个 村 镇 ， 地 势 平坦 ， 中 央 有 一 座 小 山 。 在 规划 和 建设 全 城 时 ， 以\n小 山 为 中 心 ,西部 保留 了 一 大 片 绿地 ， 山 上 修建 了 国会 。 国 会 与 白宫 之 间 有 一 条 大 道 相\n连 。 从 小 山 向 西 是 城市 的 中 轴线 ， 中 间 是 华盛顿 纪念 碑 ， 尽 头 是 林肯 纪念 堂 ， 中 轴线 两\n侧 分 布 着 国家 航天 航空 博物 馆 、 美 术 馆 等 众多 的 科技 、 文 化 展 馆 。 市 区 内 分 布 的 主要 是\n机 关 、 学 校 和 商店 ， 住 宅 分 布 在 市 区 的 周围 。\n=== 第 81 页 ===\n74 < * 第 三 章 世界 的 居民 K\n3. 阅读 以 下 有 关 日 本 京都 古城 和 意大利 威尼斯 古城 的 资料 ， 说 出 保护 传统 聚落 有\n什么 意义 。",2.0,72.72448979591837,中图版（主编_钟作慈）_八年级_义务教育教科书·地理八年级上册（主编_钟作慈）,63,2025-07-21T14:23:03.006Z,2.0,义务教育教科书·地理八年级上册（主编：钟作慈）,/Users/LeoQin/Documents/GitHub/PDFconvertor/training_data/初中/地理/中图版（主编：钟作慈）-中国地图出版社/八年级/义务教育教科书·地理八年级上册（主编：钟作慈）.pdf,八年级,tesseract.js-parallel,中图版,0.8368932038834952,0.5,1,72.72448979591837,,,,true,,,geography,上册,中图版（主编：钟作慈）_八年级_义务教育教科书·地理八年级上册（主编：钟作慈）.json,地理,98,初中_地理_中图版（主编：钟作慈）_八年级_义务教育教科书·地理八年级上册（主编：钟作慈）
