Chunk_ID,Chunk_Index,Content,Content_Length,Quality_Score,Reliability,Source_Type,Original_Content,Enhancement_Version,averageConfidence,book_name,chunkIndex,enhancementTimestamp,enhancementVersion,fileName,filePath,grade,ocrMethod,publisher,qualityMetrics_chineseCharRatio,qualityMetrics_coherenceScore,qualityMetrics_lengthScore,qualityMetrics_ocrConfidence,semanticFeatures_hasDefinition,semanticFeatures_hasExperiment,semanticFeatures_hasFormulas,semanticFeatures_hasNumbers,semanticFeatures_hasQuestion,semanticFeatures_isTableContent,semanticFeatures_subjectArea,semester,source_file,subject,totalPages,uniqueId
中图版（主编_钟作慈）_八年级_义务教育教科书·地理八年级上册（主编_钟作慈）_chunk_0,0,两洲 的陆 上分 界线。 亚洲 和非洲的 分界线是 苏伊 士运 河。 亚洲 和北美洲 隔白 令海峡相 望。 欧洲 和非洲隔 直布 罗陀 海峡 相望。 北美洲和 南美洲 则以 巴拿马运河为 界。 时读 图 1 5， 比较 七大 洲面 积的 大小， 描述 一下 各大 洲的 轮廊 特征。 候一 i5a 亚洲非洲北美洲 上及 8 南美洲 南极洲 欧洲大 洋洲 We 3 3 四 5 面积单位 :万千 米图 1 一 3 二大 洲面 积和 轮麻 七大 洲按 面积从 大到 小排序， 依次 是亚洲 、 非洲 、 北美洲 、 南美洲 、 南极 洲 、 欧洲 和大 洋洲。 亚洲是 跨纬度最 多 、 东西 距离 最长 的大 洲。 非洲 大部 分位 于南 、 北回归线 之间， 中部 有赤道横 穿。 北美洲最 南部临近赤道， 最北部在 北极圈 内。 南美洲北部有 赤道横 穿， 最南部接近南极圈。 南极 洲大 部分 位于 南极圈 内， 是唯一无 人定居的 大济。 欧洲 北 、 西 、 南三 面被 海洋环绕， 像一 个大 的半岛。 大洋 洲包括澳大利亚大 陆和 太平洋 上的 许多岛屿。 办 or 误一 5 苏伊士运河 、 巴拿 马运河和 直布罗陀海峡苏伊士运河沟通了 地中 海和 红海， 连接着大 西洋和 印度洋， 使欧洲通 往亚洲各 国的 航程比 绕道非洲南端好 望角 缩短 了 8 000 10 000 于米。 书拿 马运河连接着 大西洋和 太平洋， 缩短 了南 、 北美洲东西两 岸之 问的 航程。 直布 罗陀 海峡 是地 中海 沿岸 各国 通往 大西 洋的 必经 之地， 具有 重要的 战略地 位。 N 苏伊士运河直布罗陀海峡,709,0.49710987816021934,medium-low,ocr,两 洲 的 陆 上 分 界线 。 亚 洲 和 非洲 的 分 界线 是 苏 伊\n士 运 河 。 亚 洲 和 北美 洲 隔 白 令 海峡 相 望 。 欧 洲 和 非洲 隔 直 布 罗 陀 海\n峡 相 望 。 北 美洲 和 南美 洲 则 以 巴拿马 运河 为 界 。\n时\n读 图 1--5， 比 较 七 大 洲 面 积 的 大 小 ， 描 述 一 下 各 大 洲 的 轮 廊 特 征 。 ” 候 一 i5a\n亚洲 < 非洲 北美 洲\n»\n上 及 8\n南美 洲 南极 洲 欧洲 大 洋 洲\n- We\n3 3 四 5\n- 面积 单位 :万 千 米 ”\n图 1 一 3 二 大 洲 面 积 和 轮 麻\n七 大 洲 按 面积 从 大 到 小 排序 ， 依 次 是 亚洲 、 非 洲 、 北 美洲 、 南\n美洲 、 南 极 洲 、 欧 洲 和 大 洋 洲 。\n亚洲 是 跨 纬度 最 多 、 东 西 距 离 最 长 的 大 洲 。 非 洲 大 部 分 位 于\n南 、 北 回归 线 之 间 ， 中 部 有 赤道 横 穿 。 北 美洲 最 南部 临近 赤道 ， 最\n北部 在 北极 圈 内 。 南 美洲 北部 有 赤道 横 穿 ， 最 南部 接近 南极 圈 。 南\n极 洲 大 部 分 位 于 南极 圈 内 ， 是 唯一 无 人 定居 的 大 济 。 欧 洲 北 、 西 、\n南 三 面 被 海洋 环绕 ， 像 一 个 大 的 半岛 。 大 洋 洲 包括 澳大利亚 大 陆 和\n太平 洋 上 的 许多 岛屿 。\n=== 第 6 页 ===\n| 办 -or\n误 一 #5 苏伊士 运河 、 巴 拿 马 运河 和 直布罗陀 海峡\n苏伊士 运河 沟通 了 地 中 海 和 红海 ， 连 接着 大 西洋 和 印度 洋 ， 使 欧洲 通 往 亚洲 各 国 的\n航程 比 绕道 非洲 南端 好 望 角 缩 短 了 8 000~10 000 于 米 。 书 拿 马 运河 连接 着 大 西洋 和 太平\n洋 ， 缩 短 了 南 、 北 美洲 东西 两 岸 之 问 的 航程 。 直 布 罗 陀 海 峡 是 地 中 海 沿 岸 各 国 通 往 大 西\n洋 的 必 经 之 地 ， 具 有 重要 的 战略 地 位 。\nN »\n苏伊士 运河 直布罗陀 海峡,2.0,72.72448979591837,中图版（主编_钟作慈）_八年级_义务教育教科书·地理八年级上册（主编_钟作慈）,3,2025-07-21T14:23:03.006Z,2.0,义务教育教科书·地理八年级上册（主编：钟作慈）,/Users/LeoQin/Documents/GitHub/PDFconvertor/training_data/初中/地理/中图版（主编：钟作慈）-中国地图出版社/八年级/义务教育教科书·地理八年级上册（主编：钟作慈）.pdf,八年级,tesseract.js-parallel,中图版,0.8696498054474708,0.5,1,72.72448979591837,,,,true,,,geography,上册,中图版（主编：钟作慈）_八年级_义务教育教科书·地理八年级上册（主编：钟作慈）.json,地理,98,初中_地理_中图版（主编：钟作慈）_八年级_义务教育教科书·地理八年级上册（主编：钟作慈）
中图版（主编_钟作慈）_八年级_义务教育教科书·地理八年级上册（主编_钟作慈）_chunk_1,1,"年前 下 sovoxirn 时 Asew i AEw l Cs 现在 、 Ra 2 000 多年 前图 1 一 10 华北平原的 形成现代科学研究表明， 海洋 和陆地处 于不 断的 运动变化之 中。 造成 海陆变迁的 原因主要是 地达 运动 和海平面 升降， 填海造陆 等人 类活动也 是原因之 一。 地球 表面的 海陆分 布是 怎样变化的 呢 ? 地球 上高 答的 山脉和 辽阔 的海洋又 是怎样形成的 呢 ? 14 D 妇第 一章， 世界 的海 评和 陆地 K L e 次魏 格纳 和大 陆漂移学 说魏 格纳 (1880 一 1930) , 德国地 球物理学 家和 气象学 家。1910 年， 魏格 纳决定对 大西洋两 岸的 大陆 轮廓 基本吻合这 一问题进行认真研究。 他想， 这些 大陆 原来是 不是 连在 一起， 后来 才分 离开来 的 ;经过 长时 期对 地质 学 、 古气候学 和古生物学 等方 面的 研究， 他发 现大 西洋两 岸的 地层 和岩石都 有相似之 处， 南美洲和 非洲的 一些 地区 在远古时 期气候特征和 生物种 类基本相同。1912 年， 他大 胆地 提出了 帮动 科学界 的大 陆漂移学 说 . 大陆 漂移学 说 "" 认为， 在大 约 2 亿年 前， 各个 大陆 还是 一个 相互连接的 整体， 周围 是一 片海洋。 其后， 原始 大陆 逐步 分裂 成几 块， 并极其缓慢地 向着 不同方向 漂移分 离， 最终 形成了 今天七 大洲 、 四大 洋的 海陆分 布状态。 大陆漂 移学 说 "" 一经 提出， 立即 遭到 许多人 的嘲笑和 读讽。 魏格 纳却 始终坚信自己的 想法， 又花费数 年时 间， 历尽 艰",721,0.4231624789041299,medium-low,ocr,"年 前 下 sovoxirn 时\n— Asew  i AEw l\nUS —— Cs\n&/\n现在 、 Ra 2 000 多 年 前\n图 1 一 10 ”华北 平原 的 形成\n现代 科学 研究 表明 ， 海 洋 和 陆地 处 于 不 断 的 运动 变化 之 中 。 造\n成 海陆 变迁 的 原因 主要 是 地 达 运 动 和 海平 面 升 降 ， 填 海造 陆 等 人 类\n活动 也 是 原因 之 一 。\n地 球 表面 的 海陆 分 布 是 怎样 变化 的 呢 ? 地 球 上 高 答 的 山脉 和 辽\n阔 的 海洋 又 是 怎样 形成 的 呢 ?\n=== 第 15 页 ===\n14 D 妇 第 一 章 ， 世 界 的 海 评 和 陆地 K\nL e 次 魏 格 纳 和 “大 陆 漂移 学 说 ”\n魏 格 纳 (1880 一 1930) , 德国 地 球 物理 学 家 和 气象 学 家 。1910 年 ， 魏 格 纳 决定 对\n“大 西洋 两 岸 的 大 陆 轮 廓 基本 吻合 ”这 一 问题 进行 认真 研究 。 他 想 ， 这 些 大 陆 原来 是\n不 是 连 在 一 起 ， 后 来 才 分 离开 来 的 ;经 过 长 时 期 对 地 质 学 、 古 气候 学 和 古生物 学 等 方\n面 的 研究 ， 他 发 现 大 西洋 两 岸 的 地 层 和 岩石 都 有 相似 之 处 ， 南 美洲 和 非洲 的 一 些 地 区\n在 远古 时 期 气候 特征 和 生物 种 类 基本 相同 。1912 年 ， 他 大 胆 地 提出 了 帮 动 科学 界 的\n“大 陆 漂移 学 说 ”.\n“大 陆 漂移 学 说 "" 认为 ， 在 大 约 2 亿 年 前 ， 各 个 大 陆 还 是 一 个 相互 连接 的 整体 ， 周\n围 是 一 片 海洋 。 其 后 ， 原 始 大 陆 逐 步 分 裂 成 几 块 ， 并 极其 缓慢 地 向 着 不 同方 向 漂移 分\n离 ， 最 终 形成 了 今天 七 大 洲 、 四 大 洋 的 海陆 分 布 状态 。 大陆 漂 移 学 说 "" 一 经 提出 ， 立 即\n遭 到 许多 人 的 嘲笑 和 读 讽 。 魏 格 纳 却 始终 坚信 自己 的 想法 ， 又 花费 数 年 时 间 ， 历 尽 艰",2.0,72.72448979591837,中图版（主编_钟作慈）_八年级_义务教育教科书·地理八年级上册（主编_钟作慈）,11,2025-07-21T14:23:03.006Z,2.0,义务教育教科书·地理八年级上册（主编：钟作慈）,/Users/LeoQin/Documents/GitHub/PDFconvertor/training_data/初中/地理/中图版（主编：钟作慈）-中国地图出版社/八年级/义务教育教科书·地理八年级上册（主编：钟作慈）.pdf,八年级,tesseract.js-parallel,中图版,0.8301526717557252,0.5,1,72.72448979591837,,,,true,true,,physics,上册,中图版（主编：钟作慈）_八年级_义务教育教科书·地理八年级上册（主编：钟作慈）.json,地理,98,初中_地理_中图版（主编：钟作慈）_八年级_义务教育教科书·地理八年级上册（主编：钟作慈）
中图版（主编_钟作慈）_八年级_义务教育教科书·地理八年级上册（主编_钟作慈）_chunk_2,2,"片海洋。 其后， 原始 大陆 逐步 分裂 成几 块， 并极其缓慢地 向着 不同方向 漂移分 离， 最终 形成了 今天七 大洲 、 四大 洋的 海陆分 布状态。 大陆漂 移学 说 "" 一经 提出， 立即 遭到 许多人 的嘲笑和 读讽。 魏格 纳却 始终坚信自己的 想法， 又花费数 年时 间， 历尽 艰辛， 寻找 各种 新的 证据，1930 年， 魏格 纳在 前往 格陵兰探险考察时 不幸 遇难 . 20 世纪 50 一 60 年代， 一系列新 的科学研究成 果证 明， 大陆 确实 是在 缓慢地 移动， 大陆 漂移学 说 "" 能够 成立。 魏格 纳为 了探索自然 、 追求 真理而 勇于献身的 精神， 值得 后人 学习 . 2 亿年 前 1.35 亿年 前 Cr . 和 aAH .一多 下南极大 陆现在 0.65 亿年 前图 1 一 11 世界海陆分 布变化示意 N 第二 节海洋和 陆地的 变秆 广 15 LY! 为什么以 下地 理现 象能 够证 明大陆漂 移学 说 ? 审一 南美洲 东北部和 非洲西南部 的大 陆转 廊形 状基本吻合。 3E J, 1 部和 非洲西部有 济古老地 层顺序大 致相同。 四在 南美洲 东。。 南部和 非洲南部。 发现 的 3 .5 亿年 前舌 羊齿 植物化 Er 古老地 层 B 石相 似。 W eteper PE1 12 南美浏 和非洲的 古老地 层及 植物化 石相 似性 板块构造学 说 20 世纪 60 年代 初期， 科学 家提出了 海底扩张学 说， 认为 大陆 漂移 的动力来 自于 地球 内部 的物质运动， 地球 深处 的岩浆从 大洋 中部 的裂 阶中 喷发出 来， 把靠近裂隙的 岩层逐渐向 两边 推移， 使得 海底",733,0.3347530303030303,low,ocr,"片 海洋 。 其 后 ， 原 始 大 陆 逐 步 分 裂 成 几 块 ， 并 极其 缓慢 地 向 着 不 同方 向 漂移 分\n离 ， 最 终 形成 了 今天 七 大 洲 、 四 大 洋 的 海陆 分 布 状态 。 大陆 漂 移 学 说 "" 一 经 提出 ， 立 即\n遭 到 许多 人 的 嘲笑 和 读 讽 。 魏 格 纳 却 始终 坚信 自己 的 想法 ， 又 花费 数 年 时 间 ， 历 尽 艰\n辛 ， 寻 找 各 种 新 的 证 据 ，1930 年 ， 魏 格 纳 在 前 往 格陵兰 探险 考察 时 不 幸 遇 难 .\n20 世 纪 50 一 60 年 代 ， 一 系列 新 的 科学 研究 成 果 证 明 ， 大 陆 确 实 是 在 缓慢 地 移动 ，\n大 陆 漂移 学 说 "" 能 够 成 立 。 魏 格 纳 为 了 探索 自然 、 追 求 真理 而 勇于 献身 的 精神 ， 值 得\n后 人 学 习 .\n-\n2 亿 年 前 1.35 亿 年 前 }\nCr\n. 和 aAH \ .一 多\n下 南极 大 陆 =- —\n现在 0.65 亿 年 前\n图 1 一 11 世界 海陆 分 布 变化 示意\n=== 第 16 页 ===\nN 第 二 节 海洋 和 陆地 的 变 秆 ” 广 < 15\nLY!\n为 什么 以 下 地 理 现 象 能 够 证 明 “大陆 漂 移 学 说 ”? 审 一\n南美 洲 东 北部 和\n非洲 西南 部 的 大 陆 转\n廊 形 状 基本 吻合 。\n3E\nJ, LESES\n[ [1 部 和 非洲 西部\n| 有 济 古老 地 层 顺序\n\ 大 致 相同 。\n四\n在 南美 洲 东 。 。 &\n南部 和 非洲 南部 。\n发 现 的 3 .5 亿 年\n前 舌 羊 齿 植 物化 Er\n古老 地 层 B\n石 相 似 。 W eteper\nPE1—12 ”南美 浏 和 非洲 的 古老 地 层 及 植物 化 石 相 似 性\n板块 构造 学 说\n20 世 纪 60 年 代 初期 ， 科 学 家 提出 了 海底 扩张 学 说 ， 认 为 大 陆 漂\n移 的 动力 来 自 于 地 球 内 部 的 物质 运动 ， 地 球 深 处 的 岩浆 从 大 洋 中 部\n的 裂 阶 中 喷发 出 来 ， 把 靠近 裂隙 的 岩层 逐渐 向 两 边 推移 ， 使 得 海底",2.0,72.72448979591837,中图版（主编_钟作慈）_八年级_义务教育教科书·地理八年级上册（主编_钟作慈）,12,2025-07-21T14:23:03.006Z,2.0,义务教育教科书·地理八年级上册（主编：钟作慈）,/Users/LeoQin/Documents/GitHub/PDFconvertor/training_data/初中/地理/中图版（主编：钟作慈）-中国地图出版社/八年级/义务教育教科书·地理八年级上册（主编：钟作慈）.pdf,八年级,tesseract.js-parallel,中图版,0.8166351606805293,0.5,1,72.72448979591837,,,,true,true,,physics,上册,中图版（主编：钟作慈）_八年级_义务教育教科书·地理八年级上册（主编：钟作慈）.json,地理,98,初中_地理_中图版（主编：钟作慈）_八年级_义务教育教科书·地理八年级上册（主编：钟作慈）
中图版（主编_钟作慈）_八年级_义务教育教科书·地理八年级上册（主编_钟作慈）_chunk_3,3,落， 树上 缠绕着 蕨本 植物， 一些 成年 乔木有 巨大的 板状 根。 ReR s Ci 可 k ee 人晤 信人二 户 ai 和概 状根 热带雨林中 一些 高大 乔木长 出的 板状 根， 形成一 个稳固的 基座， 支撑 着巨 树。 名修一 i3a 读图 2 一 7， 说出 非洲分 布面积最 广的 气候类 型。 热带草原气候主要分 布在 热带雨林气候的 南北两 侧， 全年 高温， 一年 中有 明显的 二、 湿季 之分。 干季 降水 少， 草原 一片 枯黄， 湿季 降水 多， 草原 一片 葱绿。 恋一 热带草原的 动物大 迁徙东非马赛马 拉地 区是 非洲著名的 野生动物保护区， 生活着种 类繁多的 野生动物 .一望 无拭 的草原上 有数 不清 的斑马 、 长颈 记 、 瞪次 和角 马， 大象 和非洲水 牛在 宽广的 沼泽地 里打 着滚， 河马 和鳄鱼在 河中游 乓。 这里 一年 一度 的动物大 迁徙是 世界上 最壮观的 自然 盛景。 每年 的 7 一 9 月， 保护 区南面的 坦桑尼亚塞 伦盖 蒂国 家公园进入干 季， 干枯草原 无法 满足众多食 草动物的 需要， 而保护区 正值 湿季， 生长 的新 鲜青 草对 动物们 形成巨大的 诱惑。 成群 结队 的角 马 、 隆次 和斑马， 浩浩荡荡 地向 北迁徙， 穿越坦桑尼亚和 肯尼亚国境， 经过 马拉 河， 历经 艰险到 达北 面的 马赛马 拉保护区， 来追逐丰美的 水草。 每年 的 w 第二 节主要的 气候类 型六 动 29 11 月， 随着 马赛马 拉保 护区 于季 的开始和 赛伦 盖蒂 国家公园湿 季的 来临， 食草 的野生动 物们 又会 向南 迁徙。 人 2 W Wir srz 有会 人 JANE 所人 任,742,0.4084179879055939,medium-low,ocr,落 ， 树\n上 缠绕 着 蕨 本 植物 ， 一 些 成 年 乔木 有 巨大 的 板 状 根 。\nReR s Ci 可 k\nSN ee\n人 晤 信人 二 户\nai 和\n概 状 根 热带 雨林 中 一 些 高 大 乔木 长 出 的 板 状 根 ， 形成 一 个\n稳固 的 基 座 ， 支 撑 着 巨 树 。\n名\n修一 i3a 读 图 2 一 7， 说 出 非洲 分 布 面积 最 广 的 气候 类 型 。\n热带 草原 气候 主要 分 布 在 热带 雨林 气候 的 南北 两 侧 ， 全 年 高\n温 ， 一 年 中 有 明显 的 二、 湿 季 之 分 。 干 季 降 水 少 ， 草 原 一 片 枯黄 ，\n湿 季 降 水 多 ， 草 原 一 片 葱 绿 。\n恋 一 & 热带 草原 的 动物 大 迁徙\n东非 马赛 马 拉 地 区 是 非洲 著名 的 野生 动物 保护 区 ， 生 活着 种 类 繁多 的 野生 动物 .一\n望 无 拭 的 草原 上 有 数 不 清 的 斑马 、 长 颈 记 、 瞪 次 和 角 马 ， 大 象 和 非洲 水 牛 在 宽广 的 沼泽\n地 里 打 着 滚 ， 河 马 和 鳄鱼 在 河中 游 乓 。 这 里 一 年 一 度 的 动物 大 迁徙 是 世界 上 最 壮观 的 自\n然 盛 景 。 每 年 的 7 一 9 月 ， 保 护 区 南面 的 坦桑尼亚 塞 伦 盖 蒂 国 家 公园 进入 干 季 ， 干 枯草 原\n无 法 满足 众多 食 草 动物 的 需要 ， 而 保护 区 正 值 湿 季 ， 生 长 的 新 鲜 青 草 对 动物 们 形成 巨大\n的 诱惑 。 成 群 结 队 的 角 马 、 隆 次 和 斑马 ， 浩 浩荡 荡 地 向 北 迁徙， 穿越 坦桑尼亚 和 肯尼亚\n国境 ， 经 过 马 拉 河 ， 历 经 艰险 到 达 北 面 的 马赛 马 拉 保护 区 ， 来 追逐 丰美 的 水 草 。 每 年 的\n=== 第 31 页 ===\nw 第 二 节 主要 的 气候 类 型 六 动 29\n11 月 ， 随 着 马赛 马 拉 保 护 区 于 季 的 开始 和 赛 伦 盖 蒂 国家 公园 湿 季 的 来 临 ， 食 草 的 野生 动\n物 们 又 会 向 南 迁 徙 。\n人 2\nW~= Wir= srz {\n有 会 人 NE\nJANE 所 人 任,2.0,72.72448979591837,中图版（主编_钟作慈）_八年级_义务教育教科书·地理八年级上册（主编_钟作慈）,23,2025-07-21T14:23:03.006Z,2.0,义务教育教科书·地理八年级上册（主编：钟作慈）,/Users/LeoQin/Documents/GitHub/PDFconvertor/training_data/初中/地理/中图版（主编：钟作慈）-中国地图出版社/八年级/义务教育教科书·地理八年级上册（主编：钟作慈）.pdf,八年级,tesseract.js-parallel,中图版,0.8621973929236499,0.5,1,72.72448979591837,,,,true,,,geography,上册,中图版（主编：钟作慈）_八年级_义务教育教科书·地理八年级上册（主编：钟作慈）.json,地理,98,初中_地理_中图版（主编：钟作慈）_八年级_义务教育教科书·地理八年级上册（主编：钟作慈）
中图版（主编_钟作慈）_八年级_义务教育教科书·地理八年级上册（主编_钟作慈）_chunk_4,4,yveah.net 印刷 发行 成品 规格 184mm x 260mm 印张 6 版次 2013 牛 6 万第 1 版印 次 2021 和牛 6 月第 7 次印刷书 号 978 一 7 一 5031 一 6599 一 3 元审 网号 GS(2012)1410 号本 书小 国国界线 系按照中 国地 图出 妥社 1989 年出 版的 1 400 万 《中华人民 共种 国地 形图 》 绘人 制给 第二 章世界的 气候 K 2 亚热带常 绿硬 叶林 地中 海气候适宜亚热带常 绿硬 叶林 生长。 亚热带常 绿硬 叶林 由常 绿乔 木和 灌木组 成。 树叶 的叶片不 大或 呈尖 刺状， 常披 昔毛， 有分 泌芳 香油的 腺体， 以适应夏季高 温少 雨的 气候。 亚热带常 绿硬 叶林 景观 温带气候类 型温带气候类 型主要有 温带季风气候、 温带海洋性 气候和 温带大 陆性 气候。 修一 2 读图 2 一 7， 说出 亚欧 大陆 东岸 和西岸气候类 型的 差异。 温带季风气候主要分 布在 亚欧 大陆 东岸， 位于 亚热带季风气候以 北， 四季 分明， 冬季 寒冷 干燥， 夏季 高温 多两 且雨 热同 期。 温带海洋性 气候主要分 布在 南北纬 40 60 的大 陆西 岸， 冬无 严寒， 夏无 酷暑， 各月 降水量 比较均匀。 温带落叶冰 叶林 温带季风气候和 温带海洋性 气候适宜温带落叶阔 叶林 生长。 温带 落叶 阔叶 林主 要由 冬季落叶的 乔木及 其下 的灌木等 组成， 夏季 树叶 鲜绿， 秋季 叶片 变色并 开始凋落， 冬季树 上完全无 叶。 第二 节主要的 气候类 型次 33 温带落叶阅 叶林 景观,709,0.34915505491717114,low,ocr,@yveah.net\n印 刷\n发 行\n成 品 规格 184mm x 260mm\n印 张 6\n版 次 2013 牛 6 万 第 1 版\n印 次 2021 和 牛 6 月 ”第 7 次 印刷\n书 号 ISBN 978 一 7 一 5031 一 6599 一 3\n定 价 元\n审 网 号 GS(2012)1410 号\n本 书 小 国 国界 线 系 按照 中 国 地 图 出 妥 社 1989 年 出 版 的\n1 400 万 《中 华人 民 共 种 国 地 形 图 》 绘 人 制\n=== 第 35 页 ===\n”给 * 第 二 章 世界 的 气候 K\n% 2 亚热带 常 绿 硬 叶 林\n地 中 海 气候 适宜 亚热带 常 绿 硬 叶 林 生长 。 亚 热带 常 绿 硬 叶 林 由 常 绿 乔 木 和 灌木 组\n成 。 树 叶 的 叶片 不 大 或 呈 尖 刺 状 ， 常 披 昔 毛 ， 有 分 泌 芳 香油 的 腺 体 ， 以 适应 夏季 高 温 少\n雨 的 气候 。\n亚热带 常 绿 硬 叶 林 景 观\n温带 气候 类 型\n温带 气候 类 型 主要 有 温带 季风 气候、 温带 海洋 性 气候 和 温带 大\n陆 性 气候 。\n修一 2 读 图 2 一 7， 说 出 亚 欧 大 陆 东 岸 和 西岸 气候 类 型 的 差异 。\n温带 季风 气候 主要 分 布 在 亚 欧 大 陆 东 岸 ， 位 于 亚热带 季风 气候\n以 北 ， 四 季 分 明 ， 冬 季 寒 冷 干 燥 ， 夏 季 高 温 多 两 且 雨 热 同 期 。\n温带 海洋 性 气候 主要 分 布 在 南北 纬 40* ~60° 的 大 陆 西 岸 ， 冬 无\n严寒 ， 夏 无 酷暑 ， 各 月 降水 量 比较 均匀 。\n#— LE 温带 落叶 冰 叶 林\n温带 季风 气候 和 温带 海洋 性 气候 适宜 温带 落叶 阔 叶 林 生长 。 温 带 落 叶 阔 叶 林 主 要\n由 冬季 落叶 的 乔木 及 其 下 的 灌木 等 组 成 ， 夏 季 树 叶 鲜 绿 ， 秋 季 叶 片 变色 并 开始 凋落 ，\n冬季 树 上 完全 无 叶 。\n=== 第 36 页 ===\n* 第 二 节 主要 的 气候 类 型 ”次 < 33\n温带 落叶 阅 叶 林 景 观\n=,2.0,72.72448979591837,中图版（主编_钟作慈）_八年级_义务教育教科书·地理八年级上册（主编_钟作慈）,27,2025-07-21T14:23:03.006Z,2.0,义务教育教科书·地理八年级上册（主编：钟作慈）,/Users/LeoQin/Documents/GitHub/PDFconvertor/training_data/初中/地理/中图版（主编：钟作慈）-中国地图出版社/八年级/义务教育教科书·地理八年级上册（主编：钟作慈）.pdf,八年级,tesseract.js-parallel,中图版,0.8030592734225621,0.5,1,72.72448979591837,,,,true,,,geography,上册,中图版（主编：钟作慈）_八年级_义务教育教科书·地理八年级上册（主编：钟作慈）.json,地理,98,初中_地理_中图版（主编：钟作慈）_八年级_义务教育教科书·地理八年级上册（主编：钟作慈）
