Chunk_ID,Chunk_Index,Content,Content_Length,Quality_Score,Reliability,Source_Type,Original_Content,Enhancement_Version,averageConfidence,book_name,chunkIndex,enhancementTimestamp,enhancementVersion,fileName,filePath,grade,ocrMethod,publisher,qualityMetrics_chineseCharRatio,qualityMetrics_coherenceScore,qualityMetrics_lengthScore,qualityMetrics_ocrConfidence,semanticFeatures_hasDefinition,semanticFeatures_hasExperiment,semanticFeatures_hasFormulas,semanticFeatures_hasNumbers,semanticFeatures_hasQuestion,semanticFeatures_isTableContent,semanticFeatures_subjectArea,semester,source_file,subject,totalPages,uniqueId
中图版（主编_钟作慈）_八年级_义务教育教科书·地理八年级下册（主编_钟作慈）_chunk_0,0,巨大的 经济 效益和 生态效益。 它能 够提供多 种经 济价值很 高的 木材 、 药材， 还能 保护土壤， 涵养 水源。 尤其 是它 能够 吸收大 量的 二氧化碳， 释放出大 量的 氧气， 并且 把大 量水 分蒸腾到 大气 中， 调节 全球 气候， 因此 被称 为地 球之 肺和 绿色心脏。 从 20 世纪 60 年代 起， 随着 亚马 孙河 流域的 不断 开发， 大面积的 雨林被 砍伐， 在巴西热带雨林地 区出 现了 农场 、 牧场 、 工厂 、 矿山 、 铁路 和城镇， 使热带雨林遭 到严重破坏。 与开发前 相比， 巴西 热带雨林的 面积已 经减少了 大约 一半。 如果 不制止对 热带雨林的 乱砍 小伐， 实行 合理的 开发和 严格的 保护， 不仅 会使 得这 片大 面积的 森林最 终消失， 而且 会导致全 球环境的 恶化。 96 b ) 第七 章认 积国家 ee 站 p 天二 本和 os 巴西热带雨林中 的公路在 巴西热带雨林中 虎林 开荒为 了保护热带雨林， 巴西 政府 先后颁布了 《和气候变化和 环境法 》 和 《和亚 马孙 地区 生态保护法 》， 规定 了政府和 公民在 保护热带雨林方面的 权利与 义务， 明确 将对 给热带雨林造成严重破坏的 个人 或机 构予 以严厉的 法律 制裁和 巨额罚款。2005 年以 来， 巴西 热带雨 林被 毁坏的 面积在 逐年减少。 发展 中的 工农业 em iq 上从 Is 全铁 要 A 人玉米各 请人 及 wahon kt 和 8 甘蔗 o 铀 _ . bd 棉花 a 稀土的 多可 可明石油 读图 7 一 23 : . 内天 然橡胶 1 说出 巴西的 ) ES ae 主要农产品， 以及 咖 mn 2,733,0.32386314880251277,low,ocr,巨大 的 经 济 效益 和 生态 效益 。 它 能 够 提供 多 种\n经 济 价值 很 高 的 木材 、 药 材 ， 还 能 保护 土壤 ， 涵 养 水 源 。 尤 其 是\n它 能 够 吸收 大 量 的 二 氧化 碳 ， 释 放出 大 量 的 氧气 ， 并 且 把 大 量 水\n分 蒸腾 到 大 气 中 ， 调 节 全 球 气 候 ， 因 此 被 称 为 “地 球 之 肺 ”和\n“绿色 心脏 ” 。\n从 20 世 纪 60 年 代 起 ， 随 着 亚 马 孙 河 流域 的 不 断 开 发 ， 大 面积 的\n雨林 被 砍伐 ， 在 巴西 热带 雨林 地 区 出 现 了 农场 、 牧 场 、 工 厂 、 矿\n山 、 铁 路 和 城镇 ， 使 热带 雨林 遭 到 严重 破坏 。 与 开发 前 相 比 ， 巴 西\n热带 雨林 的 面积 已 经 减少 了 大 约 一 半 。 如 果 不 制止 对 热带 雨林 的 乱\n砍 小 伐 ， 实 行 合理 的 开发 和 严格 的 保护 ， 不 仅 会 使 得 这 片 大 面积 的\n森林 最 终 消失 ， 而 且 会 导致 全 球 环境 的 恶化 。\n=== 第 7 页 ===\n96 b ) * 第 七 章 认 积 国家 *\nee 站 - CA\np 天 < 二\n本 ER 和 = os\n巴西 热带 雨林 中 的 公路 在 巴西 热带 雨林 中 虎 林 开荒\n为 了 保护 热带 雨林 ， 巴 西 政 府 先后 颁布 了 《和 气候 变化 和 环境\n法 》 和 《和 亚 马 孙 地 区 生态 保护 法 》， 规 定 了 政府 和 公民 在 保护 热带\n雨林 方面 的 权利 与 义务 ， 明 确 将 对 给 热带 雨林 造成 严重 破坏 的 个 人\n或 机 构 予 以 严厉 的 法 律 制裁 和 巨额 罚款 。2005 年 以 来 ， 巴 西 热带 雨\n林 被 毁坏 的 面积 在 逐年 减少 。\n发 展 中 的 工农 业\nem\niq 上 TY 从 Is 全 铁\n要 A # 人 玉米 各 请\n人 及 wahon “kt\n和 8 甘蔗 o 铀\n_- . bd 棉花 a 稀土\n- < 的 多 > 可 可 明石 油\n读 图 7 一 23 : . 内 ”天 然 橡胶\n1 说 出 巴西 的 ) ”ES ae\n主要 农产品 ， 以 及 咖 mn 2,2.0,72.93518518518519,中图版（主编_钟作慈）_八年级_义务教育教科书·地理八年级下册（主编_钟作慈）,4,2025-07-21T14:23:03.021Z,2.0,义务教育教科书·地理八年级下册（主编：钟作慈）,/Users/LeoQin/Documents/GitHub/PDFconvertor/training_data/初中/地理/中图版（主编：钟作慈）-中国地图出版社/八年级/义务教育教科书·地理八年级下册（主编：钟作慈）.pdf,八年级,tesseract.js-parallel,中图版,0.8352059925093633,0.5,1,72.93518518518519,,,,true,,,chemistry,下册,中图版（主编：钟作慈）_八年级_义务教育教科书·地理八年级下册（主编：钟作慈）.json,地理,108,初中_地理_中图版（主编：钟作慈）_八年级_义务教育教科书·地理八年级下册（主编：钟作慈）
中图版（主编_钟作慈）_八年级_义务教育教科书·地理八年级下册（主编_钟作慈）_chunk_1,1,热带雨 林被 毁坏的 面积在 逐年减少。 发展 中的 工农业 em iq 上从 Is 全铁 要 A 人玉米各 请人 及 wahon kt 和 8 甘蔗 o 铀 _ . bd 棉花 a 稀土的 多可 可明石油 读图 7 一 23 : . 内天 然橡胶 1 说出 巴西的 ) ES ae 主要农产品， 以及 咖 mn 2 啡的 主要种 植区。 本 cs ga 2. 说出 巴西的 e 人飞机制造工业主要矿产， 以及 铁矿 人癌 阳 6 里化 学工业的 主要分 布区。 图 7 一 23 巴西工农业 w 第和 节巴西六 o 97 由于 巴西大 部分 地区 位于 热带和 亚热带， 年平均气温高， 降水 充沛， 适宜 种植 多种 热带和 亚热带农作物。 巴西 的咖啡 、 甘蔗 和禁 橘的 产量长 期居 世界 第一 位， 大豆 、 香共 和可 可等 的产量也 居世 界前 列。 巴西 是世界上 最大 的咖啡豆 、 砂糖 和烟草出 口国， 还是 世界上 重要的 肉类 生产国 和出 口国。 巴西的 矿产资源丰富， 铁 、 锰 、 铝土 、 铀和 稀土等 矿产资源的 草藏 量都 居世 界前 列。 巴西 的铁 矿石 主要 产于 巴西东南部 和北部， 多为 品质优良的 富矿。 区巴西是 南美洲 工业产值较 高的 国家， 有着 较为完整的 工业体 系， 钢铁 、 汽车 和化 学等 部门 在世界上 有较 重要的 地位， 核电 、 飞机 制造和 电子等 部门 已进入世界先进行列。 机巴西的 旅游业 发展 迅速， 有阳光海岸旅游 、 热带 雨林 探险和 民族风情表 演等 特色项 目。 旧 0 20 世纪 90 年代 以后， 巴西政府进一步实行对 外 of 车二 开放， 吸引 了大 量外 国资,739,0.3656252618192699,low,ocr,热带 雨\n林 被 毁坏 的 面积 在 逐年 减少 。\n发 展 中 的 工农 业\nem\niq 上 TY 从 Is 全 铁\n要 A # 人 玉米 各 请\n人 及 wahon “kt\n和 8 甘蔗 o 铀\n_- . bd 棉花 a 稀土\n- < 的 多 > 可 可 明石 油\n读 图 7 一 23 : . 内 ”天 然 橡胶\n1 说 出 巴西 的 ) ”ES ae\n主要 农产品 ， 以 及 咖 mn 2\n啡 的 主要 种 植 区 。 本 cs ga\n2. 说 出 巴西 的 e/ -人 飞机 制造 工业\n主要 矿产 ， 以 及 铁 矿 人 癌 阳 6 里 & 化 学 工业\n的 主要 分 布 区 。 @ GRIW\n图 7 一 23 巴西 工农 业\n=== 第 8 页 ===\nw 第 和 节 巴西 六 o 97\n由 于 巴西 大 部 分 地 区 位 于 热带 和 亚热带 ， 年 平均 气温 高 ， 降 水\n充沛 ， 适 宜 种 植 多 种 热带 和 亚热带 农作物 。 巴 西 的 咖啡 、 甘 蔗 和 禁\n橘 的 产量 长 期 居 世 界 第 一 位 ， 大 豆 、 香 共 和 可 可 等 的 产量 也 居 世\n界 前 列 。 巴 西 是 世界 上 最 大 的 咖啡 豆 、 砂 糖 和 烟草 出 口 国 ， 还 是\n世界 上 重要 的 肉 类 生产 国 和 出 口 国 。\n巴西 的 矿产 资源 丰富 ， 铁 、 锰 、 铝 土 、 铀 和 稀土 等 矿产 资源 的\n草 藏 量 都 居 世 界 前 列 。 巴 西 的 铁 矿 石 主 要 产 于 巴西 东南 部 和 北部 ，\n多 为 品质 优良 的 富矿 。\n区\n巴西 是 南美 洲 工业 产值 较 高 的 国家 ， 有 着 较为 完整 的 工业 体\n系 ， 钢 铁 、 汽 车 和 化 学 等 部 门 在 世界 上 有 较 重要 的 地 位 ， 核 电 、 飞\n机 制造 和 电子 等 部 门 已 进入 世界 先进 行列 。\n机 巴西 的 旅游 业 发 展 迅\n速 ， 有 阳光 海岸 旅游 、 热\n“| | 带 雨 林 探险 和 民族 风情 表\n演 等 特色 项 目 。\n旧 0 20 世 纪 90 年 代 以 后 ，\n巴西 政府 进一步 实行 对 外\nof 车 二 开放 ， 吸 引 了 大 量 外 国资,2.0,72.93518518518519,中图版（主编_钟作慈）_八年级_义务教育教科书·地理八年级下册（主编_钟作慈）,5,2025-07-21T14:23:03.021Z,2.0,义务教育教科书·地理八年级下册（主编：钟作慈）,/Users/LeoQin/Documents/GitHub/PDFconvertor/training_data/初中/地理/中图版（主编：钟作慈）-中国地图出版社/八年级/义务教育教科书·地理八年级下册（主编：钟作慈）.pdf,八年级,tesseract.js-parallel,中图版,0.8273244781783681,0.5,1,72.93518518518519,,,,true,,,unknown,下册,中图版（主编：钟作慈）_八年级_义务教育教科书·地理八年级下册（主编：钟作慈）.json,地理,108,初中_地理_中图版（主编：钟作慈）_八年级_义务教育教科书·地理八年级下册（主编：钟作慈）
中图版（主编_钟作慈）_八年级_义务教育教科书·地理八年级下册（主编_钟作慈）_chunk_2,2,"的青藏高 原 、 世界 上最 高的 山脉一 一喜 马拉 和雅 山脉 、 世界 最高 峰一 一珠穆朗玛峰 都位 于亚洲。 亚洲 的地 表起 伏大， 既有 世界上 最高 的高 原 、 山脉 和山峰， 也有 海拔较 低的 平原和 低地。 西西伯利 亚平原大 部分 海拔在 150 米以 下。 死海 湖面的 海拔低 于海平面 415 米， 是世界上 陆地最 低的 地方。 珠穆朗玛峰 so ric 8 000 7000 迪纳 利山 人 enmpy ow 类 6 000 尼尔 机售 士山 5895 可六 和时 sooo 4 000 3 000 2 000 1000 国时 最高 海拔国 昌平均海拔亚洲欧洲非洲北美洲 南美洲大洋洲 南极洲图 5 一 3 世界七 天洲 海拔 比较 W 第一 节地 理位 置和 地形 交动 5 亚洲的 地势 特点是 中部 高 、 四周 低， 中部 多高 大的 山脉和 高原， 四周 多中 低山 地 、 丘陵 和和 平原。 平原大 多分 布在 大河 的中 下游。 有 Po 西西伯 利亚 平原 景观死海景观 CRES 村 1. 运用图 5 2， 说出 亚浏 的纬度位 置和 海陆位 置。 ne 2. 运用图 5 2， 说出 亚洲主要高 原 、 山脉 、 平原 的分 布特点。 ,给第 五章 认积 亚洲真 一一 有全 一人 二学 习标准一 一运用地 图和 其他 资料， 归纳 亚洲 气候 和水 系的 特点， 简要 分析 地形 、 水系 和和 气候的 相互关系。 辐射状 分布 的水 系读 图 5 一 2 1. 分别 找出 流入太平洋 、 印度 洋和 北冰洋的 主要河流。 2. 说明 亚洲 的大 河发 源于 亚洲的 哪一 部分， 与地 形有 什么关系。",734,0.3204181235895393,low,ocr,"” 的 青藏 高 原 、 世 界 上 最 高 的 山脉 一 一 喜 马\n拉 和 雅 山 脉 、 世 界 最 高 峰 一 一 珠穆朗玛 峰 都 位 于 亚洲 。 亚 洲 的 地 表 起\n伏 大 ， 既 有 世界 上 最 高 的 高 原 、 山 脉 和 山峰 ， 也 有 海拔 较 低 的 平原\n和 低地 。 西 西伯 利 亚 平原 大 部 分 海拔 在 150 米 以 下 。 死 海 湖面 的 海拔\n低 于 海平 面 415 米 ， 是 世界 上 陆地 最 低 的 地 方 。\n珠穆朗玛 峰\nso] ric\n8 000\n7000 迪 纳 利 山 人\nenmpy ow\n类 6 000 尼 尔 机 售 士 山 5895 可 六 和\n时 sooo\n4 000\n3 000\n2 000\n1000 国 时 最 高 海拔\n国 昌 平均 海拔\n亚洲 ”欧洲 非洲 北美 洲 ” 南 美洲 大洋 洲 南极洲\n图 5 一 3 世界 七 天 洲 海 拔 比 较\n=== 第 14 页 ===\nW 第 一 节 地 理 位 置 和 地 形 “” 交 动 5\n亚洲 的 地 势 特点 是 中 部 高 、 四 周 低 ， 中 部 多 高 大 的 山脉 和 高\n原 ， 四 周 多 中 低 山 地 、 丘 陵 和 和 平原。 平原 大 多 分 布 在 大 河 的 中 下 游 。\n有\nER Po\n西西 伯 利 亚 平 原 景观 死海 景观\nCRES”\n村\n1. 运用 图 5-2， 说 出 亚 浏 的 纬度 位 置 和 海陆 位 置 。 ne\n2. 运用 图 5-2， 说 出 亚洲 主要 高 原 、 山 脉 、 平 原 的 分 布 特点 。\n=== 第 15 页 ===\n,给 * 第 五 章 认 积 亚洲 真\nFT 一 一 有 全 一 人 二\nDERER\n学 习 标准\n一 一 运用 地 图 和 其 他 资料 ， 归 纳 亚 洲 气 候 和 水 系 的 特点 ， 简 要\n分 析 地 形 、 水 系 和 和 气候 的 相互 关系 。\n辐射 状 分 布 的 水 系\n读 图 5 一 2\n1. 分 别 找 出 流入 太平 洋 、 印 度 洋 和 北冰洋 的 主要 河流 。\n2. 说 明 亚 洲 的 大 河 发 源 于 亚洲 的 哪 一 部 分 ， 与 地 形 有 什么\n关系 。",2.0,72.93518518518519,中图版（主编_钟作慈）_八年级_义务教育教科书·地理八年级下册（主编_钟作慈）,9,2025-07-21T14:23:03.021Z,2.0,义务教育教科书·地理八年级下册（主编：钟作慈）,/Users/LeoQin/Documents/GitHub/PDFconvertor/training_data/初中/地理/中图版（主编：钟作慈）-中国地图出版社/八年级/义务教育教科书·地理八年级下册（主编：钟作慈）.pdf,八年级,tesseract.js-parallel,中图版,0.7861271676300579,0.5,1,72.93518518518519,,,,true,,,geography,下册,中图版（主编：钟作慈）_八年级_义务教育教科书·地理八年级下册（主编：钟作慈）.json,地理,108,初中_地理_中图版（主编：钟作慈）_八年级_义务教育教科书·地理八年级下册（主编：钟作慈）
中图版（主编_钟作慈）_八年级_义务教育教科书·地理八年级下册（主编_钟作慈）_chunk_3,3,本到 上本 人有 E off _ IA t JEE r n N n 4 二站 qd 国到 jw 旺 4 本村 Fa Fa 亚洲大 陆与 太平详 和印度洋 之间 的海陆热力差异很 大。 与其 他大 洲相 比， 亚洲 的季风强度最 大， 影响 范围 最广， 季风气候 最典型。 7 学学 氏归纳某 一大 洲的 地形 、 水系和 气候特点， 并分 析其 相互关系的 基本方法是 : 1， 阅读该 大洲 的地 形图， 根据 等高 线和 陆高 表， 说明 地表 起伏 状况 、 主要 的地 形类 型和 主要的 地形 区， 并指出各 主要地 形区 的位 置， 再与 其他 大洲 进行 比较， 说明 该大 洲在 高低 起伏 、 地形 类型 、 地形 区分 布等 方面的 特点 . 第二 节水 系和 和气候 K aD . 2， 阅读 该大 洲的 水系 图， 先找 出主要河流的 名称 、 发源 地 、 长度 、 流向 和位 置， 以及 该大 洲外 流区 与内 流区 的分 布， 再与 其他 大洲 进行 比较， 说明 该大 洲在 河流数量， 长度 、 流向， 分布 等方面的 特点 . 3， 阅读 该大 洲的 气候类 型图， 根据 图例， 先说 出有 哪些主要的 气候类 型及 其分 布特点， 进一 步说 明气候类 型较为多 样还 是较为单一， 哪种 气候类 型分 布较 广， 再与 其他 大洲 进行 比较， 说明 该大 洲在 冷热， 干昌， 季节 变化 等方面的 特点。 4 分析该 大洲 的地 形 、 水系 与气候之 间的 相互关系， 包括 根据地 形和 地势 特点判 断河流流向， 根据 河流流向判断地 形变化， 根据 经纬度位 置和 地形 分布 分析 气温和 降,726,0.3590855865921788,low,ocr,本 到 上 本\n人 有 E NS off| | _\n IA— t JEE—r n N | | n®\n4 [二 | 站  - qd 国 到 | jw 旺\n4 本 村\nFE Fa Fa\n亚洲 大 陆 与 太平 详 和 印度 洋 之 间 的 海陆 热力 差异 很 大 。 与 其\n他 大 洲 相 比 ， 亚 洲 的 季风 强度 最 大 ， 影 响 范 围 最 广 ， 季 风气 候 最\n典型 。\n$7 学\n学 氏 归纳 某 一 大 洲 的 地 形 、 水系 和 气候 特点 ， 并 分 析 其 相互 关系 的\n基本 方法 是 :\n1， 阅读 该 大 洲 的 地 形 图 ， 根 据 等 高 线 和 “ 陆 高 ” 表 ， 说 明 地 表 起 伏 状 况 、 主 要 的\n地 形 类 型 和 主要 的 地 形 区 ， 并 指出 各 主要 地 形 区 的 位 置 ， 再 与 其 他 大 洲 进 行 比较 ， 说 明\n该 大 洲 在 高 低 起 伏 、 地 形 类 型 、 地 形 区 分 布 等 方面 的 特点 .\n=== 第 18 页 ===\n* 第 二 节 水 系 和 和 气候 K aD .\n2， 阅 读 该 大 洲 的 水 系 图 ， 先 找 出 主要 河流 的 名 称 、 发 源 地 、 长 度 、 流 向 和 位 置 ，\n以 及 该 大 洲 外 流 区 与 内 流 区 的 分 布 ， 再 与 其 他 大 洲 进 行 比较 ， 说 明 该 大 洲 在 河流 数量 ，\n长 度 、 流 向 ， 分 布 等 方面 的 特点 .\n3， 阅 读 该 大 洲 的 气候 类 型 图 ， 根 据 图 例 ， 先 说 出 有 哪些 主要 的 气候 类 型 及 其 分 布\n特点 ， 进 一 步 说 明 气候 类 型 较为 多 样 还 是 较为 单一 ， 哪 种 气候 类 型 分 布 较 广 ， 再 与 其 他\n大 洲 进 行 比较 ， 说 明 该 大 洲 在 冷 热 ， 干 昌 ， 季 节 变 化 等 方面 的 特点 。\n4 分析 该 大 洲 的 地 形 、 水 系 与 气候 之 间 的 相互 关系 ， 包 括 根据 地 形 和 地 势 特点 判\n断 河流 流向 ， 根 据 河流 流向 判断 地 形变 化 ， 根 据 经 纬度 位 置 和 地 形 分 布 分 析 气温 和 降,2.0,72.93518518518519,中图版（主编_钟作慈）_八年级_义务教育教科书·地理八年级下册（主编_钟作慈）,12,2025-07-21T14:23:03.021Z,2.0,义务教育教科书·地理八年级下册（主编：钟作慈）,/Users/LeoQin/Documents/GitHub/PDFconvertor/training_data/初中/地理/中图版（主编：钟作慈）-中国地图出版社/八年级/义务教育教科书·地理八年级下册（主编：钟作慈）.pdf,八年级,tesseract.js-parallel,中图版,0.8464566929133859,0.5,1,72.93518518518519,,,,true,,,geography,下册,中图版（主编：钟作慈）_八年级_义务教育教科书·地理八年级下册（主编：钟作慈）.json,地理,108,初中_地理_中图版（主编：钟作慈）_八年级_义务教育教科书·地理八年级下册（主编：钟作慈）
中图版（主编_钟作慈）_八年级_义务教育教科书·地理八年级下册（主编_钟作慈）_chunk_4,4,较广， 再与 其他 大洲 进行 比较， 说明 该大 洲在 冷热， 干昌， 季节 变化 等方面的 特点。 4 分析该 大洲 的地 形 、 水系 与气候之 间的 相互关系， 包括 根据地 形和 地势 特点判 断河流流向， 根据 河流流向判断地 形变化， 根据 经纬度位 置和 地形 分布 分析 气温和 降水 的变化以 及气候类 型， 根据 气候类 型的 分布 分析 河流的 水量 、 汛期的 变化和 结冰期长 短等 . 亚洲的 世界之 最将 世界最 大的 半岛一 阿拉伯 半岛 位于 亚洲西南部， 面积 约 300 万平方千 米， 是世 界最 大的 半岛 . 世界最 高峰 一一 珠穆朗玛峰 位于 中国 与尼泊尔的 边界， 海拔 8 848.86 米， 是世界第 一高 峰， 被称 为地 球的 第三 极。 世界陆地最 低的 地方 一一 死海位 于巴勒斯坦 、 以色 列和 约旦之 间， 湖面 低于 海平面 415 米， 是世界陆地的 最低 点。 世界最 大的 湖泊一 一里 海位 于亚洲与 欧洲交界处， 面积 约 37 万平方千 米， 是世界面积最 大的 湖泊， 也是 面积最 大的 咸水湖。 世界最 深的 湖泊一 一贝加尔湖 位于 俄罗斯的 西伯利 亚南 部， 湖水 最深 处 1 620 米， 是世界最 深的 湖泊， 被称 为西伯利 亚的 蓝眼睛 . 世界降水最 多的 地方 一乞 拉朋 齐。 位于 印度东北部。 这里 年降水量 11 500 毫米， 在 1960 年 8 月至 1961 年 7 月创下了 26 461 毫米 的降水记录， 有世界雨 极之 称 . 10 D 友第 五章 KpZM 不 a F A),707,0.4464903247637768,medium-low,ocr,较 广 ， 再 与 其 他\n大 洲 进 行 比较 ， 说 明 该 大 洲 在 冷 热 ， 干 昌 ， 季 节 变 化 等 方面 的 特点 。\n4 分析 该 大 洲 的 地 形 、 水 系 与 气候 之 间 的 相互 关系 ， 包 括 根据 地 形 和 地 势 特点 判\n断 河流 流向 ， 根 据 河流 流向 判断 地 形变 化 ， 根 据 经 纬度 位 置 和 地 形 分 布 分 析 气温 和 降\n水 的 变化 以 及 气候 类 型 ， 根 据 气候 类 型 的 分 布 分 析 河流 的 水 量 、 汛期 的 变化 和 结 冰期\n长 短 等 .\n亚洲 的 世界 之 最 #*— 将\n世界 最 大 的 半岛 一 “阿拉 伯 半 岛 ”位 于 亚洲 西南 部 ， 面 积 约 300 万 平方 千 米 ， 是 世\n界 最 大 的 半岛 .\n世界 最 高 峰 一 一 珠穆朗玛 峰 位 于 中 国 与 尼泊尔 的 边界 ， 海 拔 8 848.86 米 ， 是 世界\n第 一 高 峰 ， 被 称 为 “地 球 的 第 三 极 ” 。\n世界 陆地 最 低 的 地 方 一 一 死海 ”位 于 巴勒斯坦 、 以 色 列 和 约旦 之 间 ， 湖 面 低 于 海平\n面 415 米 ， 是 世界 陆地 的 最 低 点 。\n世界 最 大 的 湖泊 一 一 里 海 “位 于 亚洲 与 欧洲 交界 处 ， 面 积 约 37 万 平方 千 米 ， 是 世界\n面积 最 大 的 湖泊 ， 也 是 面积 最 大 的 咸水湖 。\n世界 最 深 的 湖泊 一 一 贝加尔 湖 ”位 于 俄罗斯 的 西伯 利 亚 南 部 ， 湖 水 最 深 处 1 620\n米 ， 是 世界 最 深 的 湖泊 ， 被 称 为 “西伯 利 亚 的 蓝 眼睛 .\n世界 降水 最 多 的 地 方 -一 乞 拉 朋 齐 。 位 于 印度 东北 部 。 这 里 年 降水 量 11 500 毫 米 ，\n在 1960 年 8 月 至 1961 年 7 月 创下 了 26 461 毫 米 的 降水 记录 ， 有 世界 “ 雨 极 ”之 称 .\n=== 第 19 页 ===\n10 D 友 第 五 章 KpZM 不\n\=\na #F\nA),2.0,72.93518518518519,中图版（主编_钟作慈）_八年级_义务教育教科书·地理八年级下册（主编_钟作慈）,13,2025-07-21T14:23:03.021Z,2.0,义务教育教科书·地理八年级下册（主编：钟作慈）,/Users/LeoQin/Documents/GitHub/PDFconvertor/training_data/初中/地理/中图版（主编：钟作慈）-中国地图出版社/八年级/义务教育教科书·地理八年级下册（主编：钟作慈）.pdf,八年级,tesseract.js-parallel,中图版,0.8294117647058824,0.5,1,72.93518518518519,,true,,true,,,geography,下册,中图版（主编：钟作慈）_八年级_义务教育教科书·地理八年级下册（主编：钟作慈）.json,地理,108,初中_地理_中图版（主编：钟作慈）_八年级_义务教育教科书·地理八年级下册（主编：钟作慈）
