Chunk_ID,Chunk_Index,Content,Content_Length,Quality_Score,Reliability,Source_Type,Original_Content,Enhancement_Version,averageConfidence,book_name,chunkIndex,enhancementTimestamp,enhancementVersion,fileName,filePath,grade,ocrMethod,publisher,qualityMetrics_chineseCharRatio,qualityMetrics_coherenceScore,qualityMetrics_lengthScore,qualityMetrics_ocrConfidence,semanticFeatures_hasDefinition,semanticFeatures_hasExperiment,semanticFeatures_hasFormulas,semanticFeatures_hasNumbers,semanticFeatures_hasQuestion,semanticFeatures_isTableContent,semanticFeatures_subjectArea,semester,source_file,subject,totalPages,uniqueId
中图版（主编_钟作慈）_八年级_义务教育教科书·地理八年级上册（主编_钟作慈）_chunk_5,5,"季风气候和 温带海洋性 气候适宜温带落叶阔 叶林 生长。 温带 落叶 阔叶 林主 要由 冬季落叶的 乔木及 其下 的灌木等 组成， 夏季 树叶 鲜绿， 秋季 叶片 变色并 开始凋落， 冬季树 上完全无 叶。 第二 节主要的 气候类 型次 33 温带落叶阅 叶林 景观 读图 2 一 ?， 说出 亚欧 大陆 和北美大 陆分 布最 广的 气候类 型。 修一温带大 陆性 气候主要分 布在 亚欧 大陆 和北美大 陆， 冬冷 夏热， 年温差大， 降水 集中在 夏季， 年降水量 较小。 由于 上距离海洋远近和 降水量 多少 不同， 自然 景观有 和森林、 草原和 荒漠的 变化。 温带草原毫 一次 温带草原分 布在 半湿 润 . 半干 旱的 温带大 陆性 气候区。 草原 上的 植物主要是 多种 草类 和人 小灌木。 为了 适应干燥的 气候， 这里 植物的 叶面 较小 、 叶片 内卷。 温带草原景观第 二世界的 气候 K 倍修一读 图 2 一 9， 完成 以下 各题。 1. 说出 以下 五地 的最 高和 最低 月平均气温各 是多 少摄氏度， 以及 哪个季节气温高， 哪个 季节气温会。 2. 说出 以下 五地 的年 降水量 有什么差异， 以及 冬季和 夏季的 降水状况有 什么差异。 3. 说出 以下 五种 气候类 型的 主要分 布地区。 希腊 : 雅典中 国 : 上海 (北纬 37 54 海拔 15 米 ) (北纬 37 24 海拔 5.5 米 E , ee 1 是 0 0 人 00 p 用 Zi 4 7 10 4 7 10 月份 月份 英国 : 伦敦蒙古 : 名兰 巴托 中国 : 北京",695,0.4096442568972033,medium-low,ocr,"季风 气候 和 温带 海洋 性 气候 适宜 温带 落叶 阔 叶 林 生长 。 温 带 落 叶 阔 叶 林 主 要\n由 冬季 落叶 的 乔木 及 其 下 的 灌木 等 组 成 ， 夏 季 树 叶 鲜 绿 ， 秋 季 叶 片 变色 并 开始 凋落 ，\n冬季 树 上 完全 无 叶 。\n=== 第 36 页 ===\n* 第 二 节 主要 的 气候 类 型 ”次 < 33\n温带 落叶 阅 叶 林 景 观\n=\n读 图 2 一 ?， 说 出 亚 欧 大 陆 和 北美 大 陆 分 布 最 广 的 气候 类 型 。 修一\n温带 大 陆 性 气候 主要 分 布 在 亚 欧 大 陆 和 北美 大 陆 ， 冬 冷 夏 热 ，\n年 温差 大 ， 降 水 集中 在 夏季 ， 年 降水 量 较 小 。 由 于 上 距离 海洋 远近 和\n降水 量 多 少 不 同 ， 自 然 景观 有 和 森林、 草原 和 荒漠 的 变化 。\n温带 草原 毫 一 次\n温带 草原 分 布 在 半 湿 润 . 半 干 旱 的 温带 大 陆 性 气候 区 。 草 原 上 的 植物 主要 是 多 种 草\n类 和 人 小 灌木 。 为 了 适应 干燥 的 气候 ， 这 里 植物 的 叶 面 较 小 、 叶 片 内 卷 。\n温带 草原 景观\n=== 第 37 页 ===\n* 第 二 世界 的 气候 K\n倍\n修一 读 图 2 一 9， 完 成 以 下 各 题 。\n1. 说 出 以 下 五 地 的 最 高 和 最 低 月 平均 气温 各 是 多 少 摄氏 度 ， 以 及 哪个 季节 气温\n高 ， 哪 个 季节 气温 会 。\n2. 说 出 以 下 五 地 的 年 降水 量 有 什么 差异 ， 以 及 冬季 和 夏季 的 降水 状况 有 什么 差异 。\n3. 说 出 以 下 五 种 气候 类 型 的 主要 分 布地 区 。\n希腊 : 雅典 中 国 : 上 海\n(北纬 37”54”′ 海拔 15 米 )} (北纬 37 24”′ 海拔 5.5 米 }\nER E—,\nee 1\n是 0 0® 人 00%\np— 用\nZi 4 7 10 =% 4 7 10\n月 份 月 份\n英国 : 伦敦 蒙古 : 名 兰 巴 托 中 国 : 北京",2.0,72.72448979591837,中图版（主编_钟作慈）_八年级_义务教育教科书·地理八年级上册（主编_钟作慈）,28,2025-07-21T14:23:03.006Z,2.0,义务教育教科书·地理八年级上册（主编：钟作慈）,/Users/LeoQin/Documents/GitHub/PDFconvertor/training_data/初中/地理/中图版（主编：钟作慈）-中国地图出版社/八年级/义务教育教科书·地理八年级上册（主编：钟作慈）.pdf,八年级,tesseract.js-parallel,中图版,0.834,0.5,1,72.72448979591837,,,,true,true,,geography,上册,中图版（主编：钟作慈）_八年级_义务教育教科书·地理八年级上册（主编：钟作慈）.json,地理,98,初中_地理_中图版（主编：钟作慈）_八年级_义务教育教科书·地理八年级上册（主编：钟作慈）
中图版（主编_钟作慈）_八年级_义务教育教科书·地理八年级上册（主编_钟作慈）_chunk_6,6,"， 寒带 获得 的太阳热量最 少， 平均 气温 较低 ;， 温带获得的 太阳热量少 于热带 、 多于 寒带， 平均 气温 比热 带低 、 比寒带高。 赤道附近地 区终年高 温， 空气 中有 充足的 水汽， 对流 旺盛， 容易 阔云 致十， 是世界上 年降水量 最大 的地 区。 两极地区 终年寒冷， 气流下 沉， 蒜发 量小， 不容易形成降水， 是世界上 年降水量 较小 的地 区。 海陆分 布对 气候也 有显著的 影响。 一般 来说， 同纬度地 区夏季陆地气温高 、 海洋气温 低， 冬季 陆地 和气温低 、 海洋气温 高。 家第 二节 主要的 气候类型让 D 37 读图 3 一 13， 说出 人伦敦、 布鲁塞尔、 柏林、 华沙、 基辅五 城市 1 月 、7 月平均气温的 差异， 分析 这种 差异与 其海陆位 置有 什么关系。 E7y 二 s E 一和 M iK 一扩 全全 和 E 六 、 生 4 一有 Acey 计 _ w gy 有可 ee _ "" ia y a e 于 1 er N Oh 人司 隐要 订本 二 15 气温低 夏季气温高 R 图 2 一 12 海陆位 置对 气温的 影响沿海地 区的 降水一 般比 内陆地区 多。 亚欧 大陆 、 北美 大陆 和省 大利 亚大 陆东 部的 中纬度沿海地 区， 受来 自海 详水 汽的 影响较 大， 年降水量 较大。 各大 洲的 中纬度内 陆地区， 距海洋较 远， 来自 海洋 的水 汽难 以到 达， 年降水量 较小。 地形 对气候也 有影响。 海拔 越高， 气温 越低。 山地 的迎风坡 往往 比背风坡 的降水量 大。 海拔每 上升 1 000 米， 气温 平均降低约 6 图 2 一 13 海拔与 气刘 的变化",736,0.34266457328385896,low,ocr,"， 寒 带 获 得 的 太阳 热量 最 少 ， 平 均 气 温 较\n低 ;， 温带 获得 的 太阳 热量 少 于 热带 、 多 于 寒带 ， 平 均 气 温 比 热 带\n低 、 比 寒带 高 。\n赤道 附近 地 区 终年 高 温 ， 空 气 中 有 充足 的 水 汽 ， 对 流 旺盛 ， 容\n易 阔 云 致 十 ， 是 世界 上 年 降水 量 最 大 的 地 区 。 两 极地 区 终年 寒冷 ，\n气流 下 沉 ， 蒜 发 量 小 ， 不 容易 形成 降水 ， 是 世界 上 年 降水 量 较 小 的\n地 区 。\n海陆 分 布 对 气候 也 有 显著 的 影响 。 一 般 来 说 ， 同 纬度 地 区 夏季\n陆地 气温 高 、 海 洋气 温 低 ， 冬 季 陆 地 和 气温 低 、 海 洋气 温 高 。\n=== 第 40 页 ===\n家 第 二 节 主要 的 气候 类型 “让 D 37\n读 图 3 一 13，\n说 出 人 伦敦、 布鲁塞尔、 柏林、 华沙、 基辅 五 城市 1 月 、7 月 平均 气温 的 差\n异 ， 分 析 这 种 差异 与 其 海陆 位 置 有 什么 关系 。\nE7y 二 s E 一\n和 M iK 一\n扩 全 全 和 E\n六 、 生 4 一\nNE 有\nAcey 计 _ w-——\ngy 有 < 可 ee _—\n"" ia\ny  a @e 于 TAN\n1 er % N Oh 人\n司 隐 要 订\n本 二\n15\n气温 低 夏季 气温 高 R\n图 2 一 12 ”海陆 位 置 对 气温 的 影响\n沿海 地 区 的 降水 一 般 比 内 陆地 区 多 。 亚 欧 大 陆 、 北 美 大 陆 和 省\n大 利 亚 大 陆 东 部 的 中 纬度 沿海 地 区 ， 受 来 自 海 详 水 汽 的 影响 较 大 ，\n年 降水 量 较 大 。 各 大 洲 的 中 纬度 内 陆地 区 ， 距 海洋 较 远 ， 来 自 海 洋\n的 水 汽 难 以 到 达 ， 年 降水 量 较 小 。\n地 形 对 气候 也 有 影响 。 海 拔 越 高 ， 气 温 越 低 。 山 地 的 迎风 坡 往\n往 比 背风 坡 的 降水 量 大 。\n海拔 每 上 升 1 000 米 ， 气 温 平均 降低 约 6\nAR\n图 2 一 13 ”海拔 与 气 刘 的 变化\n=== 第 41 页 ===",2.0,72.72448979591837,中图版（主编_钟作慈）_八年级_义务教育教科书·地理八年级上册（主编_钟作慈）,31,2025-07-21T14:23:03.006Z,2.0,义务教育教科书·地理八年级上册（主编：钟作慈）,/Users/LeoQin/Documents/GitHub/PDFconvertor/training_data/初中/地理/中图版（主编：钟作慈）-中国地图出版社/八年级/义务教育教科书·地理八年级上册（主编：钟作慈）.pdf,八年级,tesseract.js-parallel,中图版,0.8053435114503816,0.5,1,72.72448979591837,,,,true,,,geography,上册,中图版（主编：钟作慈）_八年级_义务教育教科书·地理八年级上册（主编：钟作慈）.json,地理,98,初中_地理_中图版（主编：钟作慈）_八年级_义务教育教科书·地理八年级上册（主编：钟作慈）
中图版（主编_钟作慈）_八年级_义务教育教科书·地理八年级上册（主编_钟作慈）_chunk_7,7,地中 海气候， 夏季 高温 干燥， 光照 强烈， 冬季 温和 湿润， 有利于柑橘等 水果 和油 橄槛 等油料作物的 生长。 但是 该气候区 夏季降水较 少， 需要 引水灌溉来 满足农作物生长的 需要。 温带海洋性 气候， 全年 降水均匀， 有利于多 汁牧草生长， 适合 发展 乳畜 业。 例如， 欧洲西部是 世界重要的 乳畜 产品生产地 区。 但是 受光 照和 温度的 限制， 该气候区 的粮食作物主要是 麦类。 工业生产 、 城镇 和交通建设都 必须考虑气候因素。 建筑 物的 朝向 、 门窗 的大 小 、 地基 的深浅和 建筑材料的 选择等 都必须适合当地的 气候条 件。 在一 些地 区， 和气候还 是重要的 生产和 旅游资源。 ES 全和 Is 民 7 in 5 风力发 电观赏雾 准气候对 生活的 影响一 个地 区的 气候条 件对 于人 们的 生活方式有 着直接的 影响。 例如， 同样 是春节期 间， 哈尔 滨的 市民 会制作和 观赏冰 灯， 而广州的 市民 则喜欢流连于 花市。 受气候 因素 的影响， 各地 居民的 服饰 、 饮食 、 民居 和交通工具等 也有 明显差异。 了一 让全 义务教育地 理教科书 根据 《义务教育地 理课程标准 》 (2011 年版 ) 纺写， 共四 册。 七年 级上 册主 要讲述地 球 、 地图 、 中国 的疆域与 人口 、 中国 的自然环境与 自然资源 ;七年 级下 册主 要讲述中 国的 经济 与文化 、 中国 的地 域差异 、 中国 的地 理区 域， 八年 级上 册主 要讲述世界的 海洋与 陆地 、 世界 的气 外 、 世界 的居民 、 世界 的地 域发 展差异 ; 八年 级下 册主 要讲述世界的 地理 区域。,734,0.4227071870199693,medium-low,ocr,地 中 海 气候 ， 夏 季 高 温 干 燥 ， 光 照 强烈 ， 冬 季 温 和 湿润 ， 有 利于 柑橘 等 水 果 和 油 橄\n槛 等 油料 作物 的 生长 。 但 是 该 气候 区 夏季 降水 较 少 ， 需 要 引水 灌溉 来 满足 农作物 生长 的\n需要 。\n温带 海洋 性 气候 ， 全 年 降水 均匀 ， 有 利于 多 汁 牧草 生长 ， 适 合 发 展 乳 畜 业 。 例 如 ，\n欧洲 西部 是 世界 重要 的 乳 畜 产品 生产 地 区 。 但 是 受 光 照 和 温度 的 限制 ， 该 气候 区 的 粮食\n作物 主要 是 麦 类 。\n工业 生产 、 城 镇 和 交通 建设 都 必须 考虑 气候 因素 。 建 筑 物 的 朝\n向 、 门 窗 的 大 小 、 地 基 的 深浅 和 建筑 材料 的 选择 等 都 必须 适合 当地\n的 气候 条 件 。\n在 一 些 地 区 ， 和 气候 还 是 重要 的 生产 和 旅游 资源 。\nSEE\nES\nES 全 和\nIs 民 7\nin = 5\n风力 发 电 观赏 雾 准\n气候 对 生活 的 影响\n一 个 地 区 的 气候 条 件 对 于 人 们 的 生活 方式 有 着 直接 的 影响 。 例\n如 ， 同 样 是 春节 期 间 ， 哈 尔 滨 的 市 民 会 制作 和 观赏 冰 灯 ， 而 广州 的\n市 民 则 喜欢 流连 于 花市 。\n受气 候 因 素 的 影响 ， 各 地 居民 的 服饰 、 饮 食 、 民 居 和 交通 工具\n等 也 有 明显 差异 。\n=== 第 45 页 ===\n了 一\n让 全\n义务 教育 地 理 教科 书 根据 《义务 教育 地 理 课程 标准 》 (2011 年 版 ) 纺\n写 ， 共 四 册 。 七 年 级 上 册 主 要 讲述 地 球 、 地 图 、 中 国 的 疆域 与 人 口 、 中 国\n的 自然 环境 与 自然 资源 ;七 年 级 下 册 主 要 讲述 中 国 的 经 济 与 文化 、 中 国 的\n地 域 差异 、 中 国 的 地 理 区 域 ， 八 年 级 上 册 主 要 讲述 世界 的 海洋 与 陆地 、 世\n界 的 气 外 、 世 界 的 居民 、 世 界 的 地 域 发 展 差异 ; 八 年 级 下 册 主 要 讲述 世界\n的 地 理 区 域 。,2.0,72.72448979591837,中图版（主编_钟作慈）_八年级_义务教育教科书·地理八年级上册（主编_钟作慈）,34,2025-07-21T14:23:03.006Z,2.0,义务教育教科书·地理八年级上册（主编：钟作慈）,/Users/LeoQin/Documents/GitHub/PDFconvertor/training_data/初中/地理/中图版（主编：钟作慈）-中国地图出版社/八年级/义务教育教科书·地理八年级上册（主编：钟作慈）.pdf,八年级,tesseract.js-parallel,中图版,0.8874538745387454,0.5,1,72.72448979591837,,,,true,,,geography,上册,中图版（主编：钟作慈）_八年级_义务教育教科书·地理八年级上册（主编：钟作慈）.json,地理,98,初中_地理_中图版（主编：钟作慈）_八年级_义务教育教科书·地理八年级上册（主编：钟作慈）
中图版（主编_钟作慈）_八年级_义务教育教科书·地理八年级上册（主编_钟作慈）_chunk_8,8,与人 口 、 中国 的自然环境与 自然资源 ;七年 级下 册主 要讲述中 国的 经济 与文化 、 中国 的地 域差异 、 中国 的地 理区 域， 八年 级上 册主 要讲述世界的 海洋与 陆地 、 世界 的气 外 、 世界 的居民 、 世界 的地 域发 展差异 ; 八年 级下 册主 要讲述世界的 地理 区域。 教科书 的内 容以 多种 形式呈现， 除正文和 图像 外， 还配置有 以下 栏目 : 5 明确学 习该 节内 容时 应掌握的 基础知识和 基本技能， 以及 相应的 学习 方法。 老师组 织同 学们 自己演示 、 绘制。 量算 、 填写的 活动内 容与 要求。 老师指导同学们 自己阅读的 有关 背景 资料 、 知识拓展 、 名词 解释等 内容 与要 求。 起二 超老师引导同学们 质疑启 思 、 深入 思考的 问题与 要求。 spgee 帮助同学们 学会 判读地 理图 像和 掌握学 习区 域地 理基本方法的 内容 与要 求。 黄画 练司 促使同学们 对该 节内 容加 以巩固和 应用 的练习题 或实际操作要 求。 实或 活动需要同学们 利用一 定时间 合作完成的 主题性 、 研究 性 、 实万 性调查或 考察活动要 求。 同学们 在学 习过 程中， 要注意以 下三 个方面 : 做好 准备工作积极主动学 习课 后复习实践课 前预习翻阅教科 e 文图 对照 除了重视回想反思对 照教科书 中将 要学 习的 内容， 根课文内 容， 还要 重视地 图书 内容， 把课 上的 学习 内据 学习 标准 明确 学习。 内容， 在学 习时 反复阅读容 全面 地回想一 遍， 通过 任务和 目标。 有关 地图， 掌握 读图 方法， 反思， 明确应 该掌握的 知,729,0.5746718867138692,medium-low,ocr,与 人 口 、 中 国\n的 自然 环境 与 自然 资源 ;七 年 级 下 册 主 要 讲述 中 国 的 经 济 与 文化 、 中 国 的\n地 域 差异 、 中 国 的 地 理 区 域 ， 八 年 级 上 册 主 要 讲述 世界 的 海洋 与 陆地 、 世\n界 的 气 外 、 世 界 的 居民 、 世 界 的 地 域 发 展 差异 ; 八 年 级 下 册 主 要 讲述 世界\n的 地 理 区 域 。\n教科 书 的 内 容 以 多 种 形式 呈现 ， 除 正文 和 图 像 外 ， 还 配置 有 以 下 栏目 :\n5 明确 学 习 该 节 内 容 时 应 掌握 的 基础 知识 和\n基本 技能 ， 以 及 相应 的 学 习 方 法 。\n老师 组 织 同 学 们 自己 演示 、 绘 制 。 量 算 、\n填写 的 活动 内 容 与 要 求 。\n老师 指导 同学 们 自己 阅读 的 有 关 背 景 资料 、\n知识 拓展 、 名 词 解释 等 内 容 与 要 求 。\n起 二 超 老师 引导 同学 们 质疑 启 思 、 深 入 思考 的\n问题 与 要 求 。\nspgee 帮助 同学 们 学 会 判读 地 理 图 像 和 掌握 学 习\n区 域 地 理 基本 方法 的 内 容 与 要 求 。\n黄 画 练 司 促使 同学 们 对 该 节 内 容 加 以 巩固 和 应 用 的\n练习 题 或 实际 操作 要 求 。\n实 或 活动 需要 同学 们 利用 一 定时 间 合作 完成 的 主题\n性 、 研 究 性 、 实 万 性 调查 或 考察 活动 要 求 。\n同学 们 在 学 习 过 程 中 ， 要 注意 以 下 三 个 方面 :\n做 好 准备 工作 积极 主动 学 习 课 后 复习 实践\n@ 课 前 预习 翻阅 教科 e 文 图 对 照 “除了 重视 @ 回想 反思 ”对 照 教科\n书 中 将 要 学 习 的 内 容 ， 根 “课文 内 容 ， 还 要 重视 地 图 书 内 容 ， 把 课 上 的 学 习 内\n据 “学 习 标 准 ” 明 确 学 习 。 内容， 在 学 习 时 反复 阅读 容 全 面 地 回想 一 遍 ， 通 过\n任务 和 目标 。 有 关 地 图 ， 掌 握 读 图 方法 ， 反思， 明确 应 该 掌握 的 知,2.0,72.72448979591837,中图版（主编_钟作慈）_八年级_义务教育教科书·地理八年级上册（主编_钟作慈）,35,2025-07-21T14:23:03.006Z,2.0,义务教育教科书·地理八年级上册（主编：钟作慈）,/Users/LeoQin/Documents/GitHub/PDFconvertor/training_data/初中/地理/中图版（主编：钟作慈）-中国地图出版社/八年级/义务教育教科书·地理八年级上册（主编：钟作慈）.pdf,八年级,tesseract.js-parallel,中图版,0.9097744360902256,0.6,1,72.72448979591837,,,,true,,,geography,上册,中图版（主编：钟作慈）_八年级_义务教育教科书·地理八年级上册（主编：钟作慈）.json,地理,98,初中_地理_中图版（主编：钟作慈）_八年级_义务教育教科书·地理八年级上册（主编：钟作慈）
中图版（主编_钟作慈）_八年级_义务教育教科书·地理八年级上册（主编_钟作慈）_chunk_9,9,"候影响的 同时， 又反 过来 对气候和 空气质 量产生一 定的 影响。 人们 长期 燃烧煤炭 、 石油 和天 然气， 并且 大量 砍伐森林， 使大 气中 的二 氧化碳 含量越 来越 多， 使温室效应增强， 全球 气温升 高， 造成 气候异常变化。 同时， 人类 活动还 会排放出 大量 的有 害气 体， 造成 大气 污染， 产生 上氧 层空 油和 雾所 天气 等环境问题。 B 7 a . 0 汪汪 y 本， Er 二洪 机上 过有 2 辐自 呈 i5e 和 p Yol g 有害 气体排放城市雾 禁天气人 臭氧层 空洞 的危害多 由于 人类 大量 使用 氧氟 化合物 作为制冷剂 和雾 化剂， 这些 物质不 断排放到 大气 中，， 使得 大气 中的 臭氧层 逐年 变薄， 南极地区 上空 出现 了臭氧层 空洞 . 大气 中的 臭氧含 量每 减少 1， 地面 接受太阳紫外线 的辐射量 就会 增加 226。 这就 会使 皮肤瘤 患者 增加 、 某些 物种灭绝 ,气温也 会升 高。 受此 影响， 距南极洲 较近 的智利南部的 羊群 多患 有和 白内 障疾病， 甚至 全言。 那里 的居民一 走出家 门， 就要 在皮肤表面涂 上防晒油， 戴上 太阳镜。 否则 约半 小时 以后， 皮肤 就可 能会 被栖 成粉红色 并伴 有痒 痛现 象。 x 第二 章世界的 和气候不 城市人 口众多， 建筑 物密集， 生产 和生活中 排放的 热量难以散 发， 使得 市区 的气温明显高 于郊区， 局部 气候和 恶化。 必须通过大 力植树造林， 保护 地面 水系， 来改善城市的 局部 气候。 许多国家都 在加 强对 空气质量的 监测。 我国 在 2012 年颁布了 新",725,0.511070690909091,medium-low,ocr,"候 影响 的 同时 ， 又 反 过 来 对 气候 和 空气 质\n量 产生 一 定 的 影响 。\n人 们 长 期 燃烧 煤炭 、 石 油 和 天 然 气 ， 并 且 大 量 砍伐 森林 ， 使 大\n气 中 的 二 氧化 碳 含量 越 来 越 多 ， 使 “温室 效应 ”增强 ， 全 球 气温 升\n高 ， 造 成 气候 异常 变化 。 同 时 ， 人 类 活动 还 会 排放 出 大 量 的 有 害 气\n体 ， 造 成 大 气 污 染 ， 产 生 上 氧 层 空 油 和 雾 所 天 气 等 环境 问题 。\nB 7 a\n. 0 汪汪 |\ny 本， Er 二 洪\n机\n上 过 有 2 辐 自 呈 [i5e\n和 p  Yol | [g\n有 害 气体 排放 城市 雾 禁 天气\n人\n臭氧 层 空 洞 的 危害 #— 多\n由 于 人 类 大 量 使 用 氧 氟 化合 物 作为 制冷 剂 和 雾 化 剂 ， 这 些 物质 不 断 排放 到 大 气 中 ，，\n使 得 大 气 中 的 臭氧 层 逐 年 变 薄 ， 南 极地 区 上 空 出 现 了 臭氧 层 “ 空 洞 . 大 气 中 的 臭氧 含\n量 每 减少 1% ， 地 面 接受 太阳 紫外 线 的 辐射 量 就 会 增加 226。 这 就 会 使 皮肤 瘤 患 者 增加 、\n某 些 物种 灭绝 ,气温 也 会 升 高 。 受 此 影响 ， 距 南极 洲 较 近 的 智利 南部 的 羊 群 多 患 有 和 白 内\n障 疾病 ， 甚 至 全 言 。 那 里 的 居民 一 走出 家 门 ， 就 要 在 皮肤 表面 涂 上 防晒 油 ， 戴 上 太阳\n镜 。 否 则 约 半 小 时 以 后 ， 皮 肤 就 可 能 会 被 栖 成 粉红 色 并 伴 有 痒 痛 现 象 。\n=== 第 48 页 ===\n*x 第 二 章 世界 的 和 气候 不\n城市 人 口 众多 ， 建 筑 物 密集 ， 生 产 和 生活 中 排放 的 热量 难以 散\n发 ， 使 得 市 区 的 气温 明显 高 于 郊区 ， 局 部 气候 和 恶化。 必须 通过 大 力\n植树 造林 ， 保 护 地 面 水 系 ， 来 改善 城市 的 局 部 气候 。\n许多 国家 都 在 加 强 对 空气 质量 的 监测 。 我 国 在 2012 年 颁布 了 新",2.0,72.72448979591837,中图版（主编_钟作慈）_八年级_义务教育教科书·地理八年级上册（主编_钟作慈）,38,2025-07-21T14:23:03.006Z,2.0,义务教育教科书·地理八年级上册（主编：钟作慈）,/Users/LeoQin/Documents/GitHub/PDFconvertor/training_data/初中/地理/中图版（主编：钟作慈）-中国地图出版社/八年级/义务教育教科书·地理八年级上册（主编：钟作慈）.pdf,八年级,tesseract.js-parallel,中图版,0.8733459357277883,0.5,1,72.72448979591837,,,,true,,,physics,上册,中图版（主编：钟作慈）_八年级_义务教育教科书·地理八年级上册（主编：钟作慈）.json,地理,98,初中_地理_中图版（主编：钟作慈）_八年级_义务教育教科书·地理八年级上册（主编：钟作慈）
