Chunk_ID,Chunk_Index,Content,Content_Length,Quality_Score,Reliability,Source_Type,Original_Content,Enhancement_Version,book_name,chunkIndex,chunkSize,enhancementTimestamp,enhancementVersion,extractedAt,grade,loc_lines,method,publisher,qualityMetrics_chineseCharRatio,qualityMetrics_coherenceScore,qualityMetrics_lengthScore,qualityMetrics_ocrConfidence,semanticFeatures_hasDefinition,semanticFeatures_hasExperiment,semanticFeatures_hasFormulas,semanticFeatures_hasNumbers,semanticFeatures_hasQuestion,semanticFeatures_isTableContent,semanticFeatures_subjectArea,semester,source,source_file,subject,textLength
义务教育教科书·道德与法治一年级上册_chunk_0,0,务 DAODE YU FAZHI 义 YIWU JIAOYU JIAOKESHU 教育 全国优秀教材特等奖教 科书 道德与法治义务教育教科书一年级上册道德与 法治道 德与 法一年级治 上册一年级上 册 产品道德与法治一上封面.indd 1 2022 7 15 下午1:48 义务教育教科书道德与法治一年级上册教育部组织编写总主编鲁 北京 洁总 主编：鲁洁 本册主编：孙彩平编写人员：（以姓氏笔画为序） 方丽敏方峥嵘左兆军责任编辑：郭雯霞美术编辑：王喆 义务教育教科书曹 孙民 易森林高军玉洋 道德与法治一年级上册教育部组织编写出 版 （北京市海淀区中关村南大街 17 号院 1 号楼网 址邮编：100081） http: www.pep.com.cn 版权所有未经许可不得采用任何方式擅自复制或使用本产品任何部分违者必究如发现内容质量问题，请登录中小学教材意见反馈平台：jcyjfk.pep.com.cn 如发现印、装质量问题，影响阅读，请与联系调换。电话： mM lM 目录 dK yU dQn yuWn wG shK xiAo xuR shEng la 第一单元我是小学生 啦 kQi kQi xUn xUn shSng xuR qM 1 开开 心心 上学 去 2 拉拉 手， 交朋 友 lQ wG 3 la shGu rFn dK jiQo pRng you nIn 6 le 我认 识您 了 shSng xuR 4 shi 2 10 lM shSng 上学 路上 Fr dQn yuWn 14 xiSo yuWn shEng huY zhEn kuSi lF 第二单元校园生 活真快乐 wG men de xiSo yuWn 5 我们 的校 园 xiSo yuWn 6 jiQn shI 24 fEn zhTng 课间 十分 钟 shSng kF 8 de hSo lKng,791,0.3774300441826215,medium,text-extracted,®\n\n务\n\nDAODE YU FAZHI\n\n义\n\nYIWU JIAOYU JIAOKESHU\n\n教\n育\n\n全国优秀教材特等奖\n\n教\n科\n书\n\n道德与法治\n\n义务教育教科书\n\n一年级 上册\n\n道德\n与\n法治\n\n道\n德\n与\n法\n\n一年级\n\n治\n\n上册\n一年级\n上 册\n\n绿色印刷产品\n\n道德与法治一上封面.indd 1\n\n2022/7/15 下午1:48\n\n义务教育教科书\n\n道德与法治\n一年级\n上册\n教育部组织编写\n总主编\n\n鲁\n\n·北 京·\n\n洁\n\n总 主 编：鲁 洁\n本册主编：孙彩平\n编写人员：（以姓氏笔画为序）\n方丽敏 方峥嵘 左兆军\n责任编辑：郭雯霞\n美术编辑：王 喆\n\n义务教育教科书\n\n曹\n\n孙\n\n民\n\n易森林\n\n高军玉\n\n洋\n\n道德与法治\n\n一年级\n\n上册\n\n教育部组织编写\n出\n\n版\n（北京市海淀区中关村南大街 17 号院 1 号楼\n\n网\n\n址\n\n邮编：100081）\n\nhttp://www.pep.com.cn\n\n版权所有·未经许可不得采用任何方式擅自复制或使用本产品任何部分·违者必究\n如发现内容质量问题，请登录中小学教材意见反馈平台：jcyjfk.pep.com.cn\n如发现印、装质量问题，影响阅读，请与 ××× 联系调换。电话：×××-××××××××\n\nmM\n\nlM\n\n目录\ndK\n\nyU dQn yuWn\n\nwG shK xiAo xuR shEng la\n\n第一单元 我是小学 生 啦\nkQi\n\nkQi\n\nxUn\n\nxUn shSng xuR\n\nqM\n\n1\n\n开 开 心 心 上 学 去 		\n\n2\n\n拉 拉 手 ， 交 朋 友 		\n\nlQ\n\nwG\n\n3\n\nla shGu\n\nrFn\n\ndK\n\njiQo pRng you\n\nnIn\n\n6\n\nle\n\n我 认 识 您 了 		\nshSng xuR\n\n4\n\nshi\n\n2\n\n10\n\nlM shSng\n\n上 学 路 上 		\nFr dQn yuWn\n\n14\n\nxiSo yuWn shEng huY zhEn kuSi lF\n\n第二单元 校园 生 活真快乐\nwG men de xiSo yuWn\n\n5\n\n我 们 的 校 园 		\nxiSo yuWn\n\n6\n\njiQn shI\n\n24\n\nfEn zhTng\n\n课 间 十 分 钟 		\nshSng kF\n\n8\n\nde hSo lKng,2.0,义务教育教科书·道德与法治一年级上册,0,985,2025-07-21T14:24:39.614Z,2.0,2025-07-18T13:53:58.285Z,一年级,[object Object],node-poppler,unknown,0.5114503816793893,0.5,1,,,,,true,,,physics,上册,/Users/LeoQin/Documents/GitHub/PDFconvertor/training_data/小学/道德与法治/统编版/义务教育教科书·道德与法治一年级上册.pdf,义务教育教科书·道德与法治一年级上册.json,道德与法治,14271
义务教育教科书·道德与法治一年级上册_chunk_1,1,人不学，不知道。 你现在是小学生了上学啦， 真高兴 学校里什么样儿呢？ 小妹，快走，上学啦！ 2 第一单元我是小学生啦你是王晓吗？ 3 Si xUn shO Si shO bQo 爱新书， 爱书包要爱护它们哟！ 谢谢！ 这是什么书啊？ shO kD zhEn hAo kSn zDn ySng 书可 真好 看，怎样 bA tQ men bAo hM hAo ne 把它们保护好呢？ 4 第一单元我是小学生啦我的书包是奶奶亲手做的弹弓也能带吗？ xiAo shO bQo biR zhWo jI 我会把它们装整齐。 yHng pJn wRn jM xiAng zJ xK 小书 包， 别着 急，用品 文具 想仔 细。 dS dS xiAo xiAo pWi gF duK ySng ySng bM shAo dTu Si xU 大大 小小 排个 队，样样 不少 都爱 惜。 wG men dTu shK hAo huG bSn tiQn tiQn yK qJ shSng xuR qM 我们 都是 好伙 伴，天天 一起 上学 去。 5 lQ la shGu jiQo pRng you 2 拉拉手，交朋友 wG de hAo huG bSn 我的好伙 伴是我的好伙伴， 我们是认识的， 我们喜欢一起交 朋友 一起玩就成了好朋友。 1 6。 我不认识他们。 2 第一单元 wAng dSo yI gF 我是小学生啦 xUn pRng you 网到一个新 朋友 yK wAng bM lQo yP Fr wAng xiS xiAo yL 一网 不捞 鱼， 二网 下小 雨， sQn wAng wAng zhM tiWo xiAo lC yP 三网 网住 条小 绿鱼 我叫李明，喜欢吃，最爱，我们一起做朋友吧！ 3 4 7 hAo yGu dS sTu suG 好友大搜 索,783,0.3236538461538461,medium,text-extracted,“人不学，不知道。”\n你现在是小学生了……\n\n上学 啦， 真高 兴\n学校里什\n么样儿呢？\n\n①\n\n小妹，快走，上学啦！\n\n②\n\n2\n\n第一单元\n\n我是小学生啦\n\n你是王晓吗？\n\n⑤\n④\n\n③\n\n3\n\nSi\n\nxUn\n\nshO\n\nSi\n\nshO bQo\n\n爱新书 ， 爱书包\n\n要爱护它们哟！\n谢谢！\n\n这是什么书啊？\n\nshO kD zhEn hAo kSn\n\nzDn ySng\n\n   书 可 真 好 看 ，怎 样\nbA tQ men bAo hM hAo ne\n\n把它们保护好呢？\n4\n\n第一单元\n\n我是小学生啦\n\n我的书包是奶奶亲手做的……\n\n弹弓也能带吗？\n\nxiAo shO bQo\n\nbiR zhWo\n\njI\n\n我会把它们装整齐。\n\nyHng pJn wRn\n\njM xiAng zJ\n\nxK\n\n小 书 包 ， 别 着 急 ，用 品 文 具 想 仔 细 。\ndS\n\ndS xiAo xiAo pWi\n\ngF\n\nduK\n\nySng ySng bM shAo dTu\n\nSi\n\nxU\n\n大 大 小 小 排 个 队 ，样 样 不 少 都 爱 惜 。\nwG men dTu\n\nshK\n\nhAo huG bSn\n\ntiQn tiQn\n\nyK\n\nqJ shSng xuR\n\nqM\n\n我 们 都 是 好 伙 伴 ，天 天 一 起 上 学 去 。\n\n5\n\nlQ\n\nla\n\nshGu\n\njiQo pRng you\n\n2 拉拉手，交朋友\nwG\n\nde\n\nhAo huG bSn\n\n我的好 伙 伴\n\n  \n\n是我的好伙伴，\n\n我们是\n\n认识的，\n\n我们喜欢一起\n\n交 朋 友\n\n   一起玩就\n成了好朋友。\n\n1\n6\n\n。\n\n   我不认识\n他们。\n\n2\n\n第一单元\n\nwAng\n\ndSo\n\nyI\n\ngF\n\n我是小学生啦\n\nxUn pRng you\n\n“ 网” 到一个 新 朋友\nyK wAng bM\n\nlQo\n\nyP\n\nFr wAng xiS xiAo\n\nyL\n\n一 网 不 捞 鱼 ， 二 网 下 小 雨 ，\nsQn wAng wAng zhM tiWo xiAo\n\nlC\n\nyP\n\n三 网 网 住 条 小 绿 鱼 ……\n\n   我叫李明，喜欢吃\n，最爱\n\n，我们\n\n一起做朋友吧！\n\n3\n\n4\n7\n\nhAo yGu\n\ndS\n\nsTu\n\nsuG\n\n好友大 搜 索,2.0,义务教育教科书·道德与法治一年级上册,2,984,2025-07-21T14:24:39.614Z,2.0,2025-07-18T13:53:58.285Z,一年级,[object Object],node-poppler,unknown,0.43349753694581283,0.5,1,,,,,true,true,,general,上册,/Users/LeoQin/Documents/GitHub/PDFconvertor/training_data/小学/道德与法治/统编版/义务教育教科书·道德与法治一年级上册.pdf,义务教育教科书·道德与法治一年级上册.json,道德与法治,14271
义务教育教科书·道德与法治一年级上册_chunk_2,2,shK kD 遇到 这些 事， 可 yJ qJng shuI lWi bQng mWng ne 以请谁来帮 忙呢？ 12 第一单元 zhF ySng zuH duK 我是小学生啦 ma 这样 做对吗哈哈，我抓住你了！ 哼，你又不是我们班的老师！ 谢谢您！ 老师再见！ wG gQi zDn me zuH ne 我该怎么做呢？ 13 shSng xuR lM shSng 4 上学路上 bM tYng de shSng xuR lM 不同的上 学路妈妈，再见！ 我和妈妈走路来学校我上学路上要经过一个铁路道口。 14 第一单元我是小学生啦 lWi xuR xiSo lM shSng jUng 王蕾，等等我！ 我们上学路上要过一条小河，老师 wG 我来 学校， 路上 经 guH shSng xuR lM bM yI ySng pIng 过。 上学 路不 一样， 平 pIng Qn Qn jKn kF tWng 平安安进课堂。 施工重地， 请绕行。 15 zhF ySng Qn quWn ma 这样安全 吗过马路，不要跑！ 小心！ zDn ySng cWi Qn quWn ne 怎样 才安全 呢？ 16 第一单元 lM shSng de 我是小学生啦 wEn nuAn 路上的温暖 姥姥，您也别淋着。 爸爸！ 姐姐带我上学校。 lM shSng yGu wEn nuAn 路上有温暖， wG yD fQ xiSn le 我也发现了 17 jiQo tTng xKn hSo ySo zhU dSo 交通信 号要 知道嘀！嘀！ wG hWi zhU dSo 我还 知道 18 第一单元敏而好学我是小学生啦行成于思注意！ xiAo xuR shEng shSng xuR xiSo jiQo tTng xKn hSo ySo zhU dSo 小学 生， 上学 校， 交通 信号 要知 道。 hYng dEng tIng lC,812,0.30249618320610683,medium,text-extracted,shK\n\nkD\n\n   遇 到 这 些 事 ， 可\nyJ qJng shuI lWi bQng mWng ne\n\n以请谁来 帮 忙 呢？\n\n12\n\n第一单元\n\nzhF ySng zuH\n\nduK\n\n我是小学生啦\n\nma\n\n这 样 做 对吗\n\n   哈哈，我\n抓住你了！\n\n哼，你又不是\n我们班的老师！\n\n谢谢您！\n\n老师再见！\n\nwG gQi zDn me zuH ne\n\n我该怎么做呢？\n\n13\n\nshSng xuR\n\nlM\n\nshSng\n\n4 上学路上\nbM tYng de shSng xuR\n\nlM\n\n不同的 上 学路\n\n妈妈，再见！\n\n   我和妈妈走路\n来学校……\n\n   我上学路上要经过\n一个铁路道口。\n\n14\n\n第一单元\n\n我是小学生啦\n\nlWi xuR xiSo\n\nlM shSng jUng\n\n王蕾，等等我！\n\n   我们上学路上要过\n一条小河，老师……\n\nwG\n\n   我 …… 来 学 校 ， 路 上 经\nguH\n\nshSng xuR lM\n\nbM\n\nyI ySng\n\npIng\n\n过 …… 。 上 学 路 不 一 样 ， 平\npIng Qn Qn jKn kF tWng\n\n平安安进课堂。\n\n施工重地，\n请绕行。\n\n15\n\nzhF ySng Qn quWn ma\n\n这样安 全 吗\n\n过马路，不要跑！\n\n小心！\n\nzDn ySng cWi Qn quWn ne\n\n怎 样 才安 全 呢？\n\n16\n\n第一单元\n\nlM shSng de\n\n我是小学生啦\n\nwEn nuAn\n\n路上 的温 暖\n姥姥，您也\n别淋着。\n\n爸爸！\n\n姐姐带我上学校。\n\nlM shSng yGu wEn nuAn\n\n路上有温暖，\nwG yD fQ xiSn le\n\n我也发现了……\n17\n\njiQo tTng\n\nxKn\n\nhSo\n\nySo\n\nzhU\n\ndSo\n\n交通 “ 信 号” 要 知道\n嘀！嘀！\n\nwG hWi zhU dSo\n\n我 还 知 道 ……\n\n18\n\n第一单元\n\n敏而好学\n\n我是小学生啦\n\n行成于思\n\n注意！\n\nxiAo xuR shEng\n\nshSng xuR xiSo\n\njiQo tTng\n\nxKn hSo\n\nySo\n\nzhU\n\ndSo\n\n小 学 生 ， 上 学 校 ， 交 通“信 号”要 知 道 。\nhYng dEng tIng\n\nlC,2.0,义务教育教科书·道德与法治一年级上册,4,989,2025-07-21T14:24:39.614Z,2.0,2025-07-18T13:53:58.285Z,一年级,[object Object],node-poppler,unknown,0.405320813771518,0.5,1,,,,,true,true,,general,上册,/Users/LeoQin/Documents/GitHub/PDFconvertor/training_data/小学/道德与法治/统编版/义务教育教科书·道德与法治一年级上册.pdf,义务教育教科书·道德与法治一年级上册.json,道德与法治,14271
义务教育教科书·道德与法治一年级上册_chunk_3,3,wG hWi zhU dSo 我还 知道 18 第一单元敏而好学我是小学生啦行成于思注意！ xiAo xuR shEng shSng xuR xiSo jiQo tTng xKn hSo ySo zhU dSo 小学 生， 上学 校， 交通 信号 要知 道。 hYng dEng tIng lC dEng xIng guH lM kGu shI zuG yHu qiWo 红灯 停， 绿灯 行， 过路 口时 左右 瞧。 kSo yHu xIng bM zhuU pAo zhuQ jJn shI jiQn bM chI dSo 靠右 行， 不追 跑， 抓紧 时间 不迟 到。 19 wG men de xiSo yuWn 5 我们的校园 xiSo yuWn tSn mK 校园探秘 wG fQ xiSnxiSoyuWn lJ hWi yGu 我发现校园 里还有教学楼 20 第二单元 zhF ge dK fang hDn tF 校园生活真快乐 biR 这个地方很 特别 shSo xiQn jiSn duK jiM shK zhTng guY shSo niWn xiQn fEng duK 少先 队就 是中 国少 年先 锋队， lK yP niWn yuF rK 建立 于 1949 年 10 月 13 日。 中国少年先锋队队歌 （我们是共产主义接班人） 周郁辉作词寄明作曲我们是共产主义接班人， 继承革命先辈的光荣传统， 爱祖国，爱人民， 鲜艳的红领巾飘扬在前胸。 不怕困难，不怕敌人， 顽强学习，坚决斗争。 向着胜利勇敢前进， 向着胜利勇敢前进前进， 向着胜利勇敢前进， 我们是共产主义接班人。 红领巾是红旗的一角。我在六一儿童节戴上了它。 我也要戴上红领巾，做个好学生。 21 wG zuK xJ huan de dK fang 我最喜欢 的地 方 wG zuK xJ huan de dK fang 我最 喜欢 的地 方 shK yUn wFi,827,0.3286838124054463,medium,text-extracted,wG hWi zhU dSo\n\n我 还 知 道 ……\n\n18\n\n第一单元\n\n敏而好学\n\n我是小学生啦\n\n行成于思\n\n注意！\n\nxiAo xuR shEng\n\nshSng xuR xiSo\n\njiQo tTng\n\nxKn hSo\n\nySo\n\nzhU\n\ndSo\n\n小 学 生 ， 上 学 校 ， 交 通“信 号”要 知 道 。\nhYng dEng tIng\n\nlC\n\ndEng xIng\n\nguH\n\nlM\n\nkGu\n\nshI\n\nzuG yHu qiWo\n\n红 灯 停 ， 绿 灯 行 ， 过 路 口 时 左 右 瞧 。\nkSo yHu xIng\n\nbM\n\nzhuU pAo\n\nzhuQ jJn\n\nshI\n\njiQn\n\nbM\n\nchI\n\ndSo\n\n靠 右 行 ， 不 追 跑 ， 抓 紧 时 间 不 迟 到 。\n\n19\n\nwG\n\nmen\n\nde\n\nxiSo yuWn\n\n5 我们的校园\nxiSo yuWn tSn\n\nmK\n\n校 园探秘\n\nwG fQ xiSnxiSoyuWn lJ hWi yGu\n\n我发现校 园 里还有……\n教学楼\n\n20\n\n第二单元\n\nzhF\n\nge\n\ndK\n\nfang hDn\n\ntF\n\n校园生活真快乐\n\nbiR\n\n这个 地方 很 特 别\nshSo xiQn\n\n  \njiSn\n\nduK\n\njiM\n\nshK zhTng guY shSo niWn xiQn fEng\n\nduK\n\n少 先 队 就 是 中 国 少 年 先 锋 队 ，\nlK\n\nyP\n\nniWn\n\nyuF\n\nrK\n\n建 立 于 1949 年 10 月 13 日 。\n\n中国少年先锋队队歌\n（我们是共产主义接班人）\n周郁辉 作词\n\n寄明 作曲\n\n我们是共产主义接班人，\n继承革命先辈的光荣传统，\n爱祖国，爱人民，\n鲜艳的红领巾飘扬在前胸。\n不怕困难，不怕敌人，\n顽强学习，坚决斗争。\n向着胜利勇敢前进，\n向着胜利勇敢前进前进，\n向着胜利勇敢前进，\n我们是共产主义接班人。\n……\n\n   红领巾是红旗\n的一角。我在六一\n儿童节戴上了它。\n\n   我也要戴上红\n领巾，做个好学生。\n\n21\n\nwG\n\nzuK\n\nxJ\n\nhuan de\n\ndK\n\nfang\n\n我 最喜 欢 的 地 方\nwG zuK\n\nxJ huan de\n\ndK fang\n\n   我 最 喜 欢 的 地 方\nshK\n\nyUn wFi,2.0,义务教育教科书·道德与法治一年级上册,5,989,2025-07-21T14:24:39.614Z,2.0,2025-07-18T13:53:58.285Z,一年级,[object Object],node-poppler,unknown,0.4349157733537519,0.5,1,,,,,true,,,general,上册,/Users/LeoQin/Documents/GitHub/PDFconvertor/training_data/小学/道德与法治/统编版/义务教育教科书·道德与法治一年级上册.pdf,义务教育教科书·道德与法治一年级上册.json,道德与法治,14271
义务教育教科书·道德与法治一年级上册_chunk_4,4,红领巾是红旗的一角。我在六一儿童节戴上了它。 我也要戴上红领巾，做个好学生。 21 wG zuK xJ huan de dK fang 我最喜欢 的地 方 wG zuK xJ huan de dK fang 我最 喜欢 的地 方 shK yUn wFi 是，因为 22 第二单元图书角卫生角板报区生物角 xiSo yuWn lJ yGu hDn duT wG 校园生活真快乐 xJ huan de 校园 里有 很多 我喜 欢的 dK fang nJ xJ huan nA xiE dK fang ne 地方。你喜 欢哪 些地 方呢？ 23 xiSo yuWn lJ de hSo lKng 6 校园里的号令 shRn mK de zhJ huU 我猜到啦！ 神秘的指 挥 xiAo xiAo zhJ huU jiQ wEi lK fEi chWng dS 小小 指挥 家， 威力 非常 大。 zhJ ySo tQ shuT huS wG men dTu tUng tQ 只要 它说 话， 我们 都听 它。 dS jiQ zhAo yi zhAo cWng zSi nA lJ ya 大家 找一 找， 藏在 哪里 呀？ wFi shRn me ySo tUng tQ de huS 为什么要听它的话？ 24 第二单元 lIng shEng gSo su 校园生活真快乐 wG 铃声 告诉我听听这是什么铃声？ 25 shEng guY qI le 升国旗 了升国旗时，听到国歌声响起，我停止走动，不说话，向国旗行注目礼。 我是中国人我爱你中国我国是社会主义国家我 们每 个人都要会唱 国歌， 一起来学唱国歌吧！ 起来！不愿做奴隶的人们 26 第二单元 bAo jiSn jiR 校园生活真快乐 pQi 保健 节拍 眼保健操开始了我怎么总做不好呢？ 听好节奏， 慢慢学,781,0.34884000000000004,medium,text-extracted,红领巾是红旗\n的一角。我在六一\n儿童节戴上了它。\n\n   我也要戴上红\n领巾，做个好学生。\n\n21\n\nwG\n\nzuK\n\nxJ\n\nhuan de\n\ndK\n\nfang\n\n我 最喜 欢 的 地 方\nwG zuK\n\nxJ huan de\n\ndK fang\n\n   我 最 喜 欢 的 地 方\nshK\n\nyUn wFi\n\n是 ……，因 为 ……\n\n22\n\n第二单元\n\n图书角\n\n卫生角\n\n板报区\n\n生物角\n\nxiSo yuWn lJ\n\nyGu hDn duT wG\n\n校园生活真快乐\n\nxJ huan de\n\n   校 园 里 有 很 多 我 喜 欢 的\ndK fang\n\nnJ\n\nxJ huan nA xiE dK fang ne\n\n地 方 。你 喜 欢 哪 些 地 方 呢 ？\n23\n\nxiSo yuWn\n\nlJ\n\nde\n\nhSo\n\nlKng\n\n6 校园里的号令\nshRn\n\nmK\n\nde\n\nzhJ\n\nhuU\n\n我猜到啦！\n\n神秘的 指 挥\n\nxiAo xiAo\n\nzhJ\n\nhuU\n\njiQ\n\nwEi\n\nlK\n\nfEi chWng dS\n\n小 小 “ 指 挥 家 ”， 威 力 非 常 大 。\nzhJ\n\nySo\n\ntQ\n\nshuT huS\n\nwG men dTu tUng\n\ntQ\n\n只 要 它 说 话 ， 我 们 都 听 它 。\ndS\n\njiQ zhAo\n\nyi\n\nzhAo\n\ncWng zSi\n\nnA\n\nlJ\n\nya\n\n大 家 找 一 找 ， 藏 在 哪 里 呀 ？\n\nwFi shRn me ySo tUng tQ de huS\n\n为什么要听它的话？\n\n24\n\n第二单元\n\nlIng shEng gSo\n\nsu\n\n校园生活真快乐\n\nwG\n\n铃 声 告 诉我\n\n   听听这是\n什么铃声？\n\n25\n\nshEng guY\n\nqI\n\nle\n\n升国 旗 了\n\n   升国旗时，听到国歌声响起，我\n停止走动，不说话，向国旗行注目礼。\n\n我是中国人\n我爱你中国\n我国是社会主义国家\n\n   我 们 每\n个人都要会\n唱 国 歌， 一\n起来学唱国\n歌吧！\n\n起来！不愿做奴隶的人们……\n26\n\n第二单元\n\nbAo jiSn\n\njiR\n\n校园生活真快乐\n\npQi\n\n保 健 节 拍\n   眼保健操\n开始了……\n\n我怎么总\n做不好呢？\n\n听好节奏，\n慢慢学……,2.0,义务教育教科书·道德与法治一年级上册,6,977,2025-07-21T14:24:39.614Z,2.0,2025-07-18T13:53:58.285Z,一年级,[object Object],node-poppler,unknown,0.46492659053833607,0.5,1,,,,,true,true,,biology,上册,/Users/LeoQin/Documents/GitHub/PDFconvertor/training_data/小学/道德与法治/统编版/义务教育教科书·道德与法治一年级上册.pdf,义务教育教科书·道德与法治一年级上册.json,道德与法治,14271
义务教育教科书·道德与法治一年级上册_chunk_5,5,升国旗时，听到国歌声响起，我停止走动，不说话，向国旗行注目礼。 我是中国人我爱你中国我国是社会主义国家我 们每 个人都要会唱 国歌， 一起来学唱国歌吧！ 起来！不愿做奴隶的人们 26 第二单元 bAo jiSn jiR 校园生活真快乐 pQi 保健 节拍 眼保健操开始了我怎么总做不好呢？ 听好节奏， 慢慢学 zDn ySng cWi nRng zuH de hAo ne 怎样 才能做得好呢？ 27 kF jiQn shI fEn zhTng 7 课间十分钟 wG xJ huan de kF jiQn yYu xK 我喜欢的 课间游戏 wG xJ huan de kF jiQn 我喜 欢的 课间 yYu xK shK 游戏 是 28 第二单元 wWn gF kF jiQn xiAo yYu 校园生活真快乐 xK 玩个 课间小游 戏我闪！ 接住喽！ 你中弹喽， 该我上了！ wG men yK qJ wWn ba 我们 一起 玩吧！ ySo zhM yK zhAo qiSo mRn a 要注意找窍门啊！ 29 kF jiQn hWi ySo zuH shRn me 课间还要 做什么 12 2 9 3 8 4 6 30 5 第二单元校园生活真快乐 zhF ySng zuH hAo ma 这样 做好吗 xiS kF lIng 下课 铃， dUng lIng lIng 丁零 零。 yAn jing wSng wang yuAn 眼睛 望望 远， dS nAo fSng fang sTng 大脑 放放 松。 kQi xUn zuH yYu xK 开心 做游 戏， Qn quWn jK xUn zhTng 安全 记心 中。 31 shSng kF le 8 上课了 kF qiWn zhLn bFi hAo 课前 准备好 xiS jiR ySo shSng shRn me kF 下节要上 什么课？ 课程 表星期一 二三 四五 1,819,0.3105564263322884,medium,text-extracted,升国旗时，听到国歌声响起，我\n停止走动，不说话，向国旗行注目礼。\n\n我是中国人\n我爱你中国\n我国是社会主义国家\n\n   我 们 每\n个人都要会\n唱 国 歌， 一\n起来学唱国\n歌吧！\n\n起来！不愿做奴隶的人们……\n26\n\n第二单元\n\nbAo jiSn\n\njiR\n\n校园生活真快乐\n\npQi\n\n保 健 节 拍\n   眼保健操\n开始了……\n\n我怎么总\n做不好呢？\n\n听好节奏，\n慢慢学……\n\nzDn ySng cWi nRng zuH de hAo ne\n\n怎 样 才能做得好呢？\n27\n\nkF\n\njiQn\n\nshI\n\nfEn zhTng\n\n7 课间十分钟\nwG\n\nxJ\n\nhuan de\n\nkF\n\njiQn yYu\n\nxK\n\n我喜欢 的 课间游 戏\nwG xJ huan de kF jiQn\n\n   我 喜 欢 的 课 间\nyYu xK\n\nshK\n\n游 戏 是 ……\n\n28\n\n第二单元\n\nwWn\n\ngF\n\nkF\n\njiQn xiAo yYu\n\n校园生活真快乐\n\nxK\n\n玩 个 课 间小 游 戏\n我闪！\n\n接住喽！\n\n你中弹喽，\n该我上了！\n\nwG men\n\nyK\n\nqJ wWn ba\n\n   我 们 一 起 玩 吧 ！\nySo zhM\n\nyK zhAo qiSo mRn\n\na\n\n要注意找窍门啊！\n29\n\nkF\n\njiQn hWi ySo zuH shRn me\n\n课间还 要 做什么\n\n12\n2\n9\n\n3\n8\n\n4\n6\n\n30\n\n5\n\n第二单元\n\n校园生活真快乐\n\nzhF ySng zuH hAo ma\n\n这 样 做 好吗\n\nxiS\n\nkF\n\nlIng\n\n下 课 铃 ，\ndUng\n\nlIng\n\nlIng\n\n丁 零 零 。\nyAn\n\njing wSng wang yuAn\n\n眼 睛 望 望 远 ，\ndS\n\nnAo fSng fang sTng\n\n大 脑 放 放 松 。\nkQi\n\nxUn\n\nzuH\n\nyYu\n\nxK\n\n开 心 做 游 戏 ，\nQn\n\nquWn\n\njK\n\nxUn zhTng\n\n安 全 记 心 中 。\n\n31\n\nshSng\n\nkF\n\nle\n\n8 上课了\nkF\n\nqiWn zhLn bFi hAo\n\n课 前 准备好\n\nxiS jiR ySo shSng shRn me kF\n\n下节要 上 什么课？\n\n课 程 表\n星期\n\n一\n\n二\n\n三\n\n四\n\n五\n\n1,2.0,义务教育教科书·道德与法治一年级上册,7,995,2025-07-21T14:24:39.614Z,2.0,2025-07-18T13:53:58.285Z,一年级,[object Object],node-poppler,unknown,0.4111111111111111,0.5,1,,,,,true,true,,unknown,上册,/Users/LeoQin/Documents/GitHub/PDFconvertor/training_data/小学/道德与法治/统编版/义务教育教科书·道德与法治一年级上册.pdf,义务教育教科书·道德与法治一年级上册.json,道德与法治,14271
