Chunk_ID,Chunk_Index,Content,Content_Length,Quality_Score,Reliability,Source_Type,Original_Content,Enhancement_Version,book_name,chunkIndex,chunkSize,enhancementTimestamp,enhancementVersion,extractedAt,grade,loc_lines,method,publisher,qualityMetrics_chineseCharRatio,qualityMetrics_coherenceScore,qualityMetrics_lengthScore,qualityMetrics_ocrConfidence,semester,source,source_file,subject,textLength
义务教育教科书·英语九年级全一册_chunk_107,107,"1e\n\nMake a conversation about the\ninvention of potato chips. Use the\ninformation in 1c and 1d.\n\nwere invented by mistake?\n\nB: Wow, I didn’t know that.\n\nWho invented them?\nA: ...\n45 UNIT 6\n2a\n\nDo you like basketball? Do you watch basketball games? How much do\nyou know about this sport? Discuss the sport with your partner and\nshare your ideas with the class.\n\n2b\n\nRead the passage quickly. What is the main idea of each paragraph?\nMIND-MAPPING\n\nDo You Know When Basketball\nWas Invented?\n\nChanging the information you\nread into a mind map may\nhelp you remember it more\neasily.",575,0,unknown,text-extracted,,2.0,义务教育教科书·英语九年级全一册,107,577,2025-07-21T14:24:27.198Z,2.0,2025-07-20T03:42:09.872Z,九年级,[object Object],node-poppler,unknown,,0.5,0.575,1,全一册,/Users/LeoQin/Documents/GitHub/PDFconvertor/training_data/初中/英语/人教版-人民教育出版社/九年级/义务教育教科书·英语九年级全一册.pdf,义务教育教科书·英语九年级全一册.json,英语,290800
义务教育教科书·英语九年级全一册_chunk_108,108,"Basketball is a much-loved and active sport\nthat is enjoyed by many for fun and exercise. It is over 100 years old and is played by\nmore than 100 million people in over 200 countries. It is believed that the first basketball\ngame in history was played on December 21, 1891. Then in 1936 in Berlin, it became an\nevent at the Olympics.\nBasketball was invented by a Canadian doctor named James Naismith, who was\nborn in 1861. When he was a college teacher, he was asked to think of a game that\ncould be played in the winter. Dr. Naismith created a game to be played inside on\na hard floor. Dr. Naismith divided the men in his class into two teams and taught\nthem to play his new game. Players on the same team must work together to get the\nball in the other team’s basket. At the same time, they need to stop the competing\nteam from getting the ball into their own basket.\nToday, the popularity of basketball has risen around the world, with many young",949,0,unknown,text-extracted,,2.0,义务教育教科书·英语九年级全一册,108,949,2025-07-21T14:24:27.198Z,2.0,2025-07-20T03:42:09.872Z,九年级,[object Object],node-poppler,unknown,,0.5,0.949,1,全一册,/Users/LeoQin/Documents/GitHub/PDFconvertor/training_data/初中/英语/人教版-人民教育出版社/九年级/义务教育教科书·英语九年级全一册.pdf,义务教育教科书·英语九年级全一册.json,英语,290800
义务教育教科书·英语九年级全一册_chunk_109,109,"team from getting the ball into their own basket.\nToday, the popularity of basketball has risen around the world, with many young\npeople dreaming of becoming famous players. In China, you can sometimes see\npeople playing basketball in parks, schools and\neven factories. Basketball has not only become\na popular sport to play, but it has also become a\npopular sport to watch. Although America’s NBA\ngames are the most famous, the CBA games are\nbecoming more popular in China. The number of\nforeign players, including Chinese players, in the\nNBA has increased. There are also more and more\nforeign players in the CBA. Many young people\nlook up to these basketball heroes and want to\nbecome like them. These stars encourage young\npeople to work hard to achieve their dreams.\n46",774,0,unknown,text-extracted,,2.0,义务教育教科书·英语九年级全一册,109,774,2025-07-21T14:24:27.199Z,2.0,2025-07-20T03:42:09.872Z,九年级,[object Object],node-poppler,unknown,,0.5,0.774,1,全一册,/Users/LeoQin/Documents/GitHub/PDFconvertor/training_data/初中/英语/人教版-人民教育出版社/九年级/义务教育教科书·英语九年级全一册.pdf,义务教育教科书·英语九年级全一册.json,英语,290800
义务教育教科书·英语九年级全一册_chunk_110,110,UNIT 6\n\nWhen was it invented?\n2c\n\nComplete the mind map with the information in the passage. What else\ncan you add to the mind map?\nGame\n\nDevelopment\n\n• played inside on a hard\n\n• invented by\n• first game on\n• became an Olympic event\nin\nin the year\n\n•\nteams\n• get\ninto the other team’s\nPopularity\n\n• played by\n• over\n2d\n\npeople\ncountries\n\n• most famous games:\n• popular games in China:\n\nUse the mind map to summarize what you and your partner remember\nabout the development of basketball. Use the following questions to\nhelp you.\n1. Who invented basketball and how is it played?\n2. When was the first basketball game in history played?\n3. Why were the Berlin Olympics important for basketball?\n4. What are the professional basketball groups in America and China?\n5. How popular is basketball?\n\n2e\n\nWhat do you think of famous basketball players? Make a list of good\nand difficult things about being a famous basketball player.\n\n3a,930,0,unknown,text-extracted,,2.0,义务教育教科书·英语九年级全一册,110,930,2025-07-21T14:24:27.199Z,2.0,2025-07-20T03:42:09.872Z,九年级,[object Object],node-poppler,unknown,,0.5,0.93,1,全一册,/Users/LeoQin/Documents/GitHub/PDFconvertor/training_data/初中/英语/人教版-人民教育出版社/九年级/义务教育教科书·英语九年级全一册.pdf,义务教育教科书·英语九年级全一册.json,英语,290800
义务教育教科书·英语九年级全一册_chunk_111,111,2e\n\nWhat do you think of famous basketball players? Make a list of good\nand difficult things about being a famous basketball player.\n\n3a\n\nThink of something that you do not like to do. Then think of an\ninvention that could help you. Make notes.\nProblem: quickly taking notes in class\nNew invention: a special pen\nWhat it is used for:\n47 UNIT 6\n3b\n\nImagine you are a business person. Write a description of your new\ninvention. Try to sell the invention to the class.\nThis special pen was invented by Liu Jie. It has\nthree colors and is used for ...\n\nSelf Check\n1 Complete the passage with the correct forms of the words in\n\nthe box.,631,0,unknown,text-extracted,,2.0,义务教育教科书·英语九年级全一册,111,633,2025-07-21T14:24:27.199Z,2.0,2025-07-20T03:42:09.872Z,九年级,[object Object],node-poppler,unknown,,0.5,0.631,1,全一册,/Users/LeoQin/Documents/GitHub/PDFconvertor/training_data/初中/英语/人教版-人民教育出版社/九年级/义务教育教科书·英语九年级全一册.pdf,义务教育教科书·英语九年级全一册.json,英语,290800
义务教育教科书·英语九年级全一册_chunk_112,112,Self Check\n1 Complete the passage with the correct forms of the words in\n\nthe box.\n\ninvent doubt mention website all of a sudden\nIt is often difficult to decide on the inventor of certain inventions.\nthings\nThis is because sometimes a few people may\nwhich are nearly the same. It’s hard to tell who came up with the\nidea first. Some inventions can also lead to other inventions\n. So some people\nwhether the inventor\ncame up with the idea himself or herself. They think that the\ninventor used someone else’s idea to create his or her invention.\nusually\nmore\nThat is why books or\nthan one inventor when giving information about inventions.\n2 Rewrite these sentences using the passive voice.\n1. Someone stole my watch.\n2. They used five eggs to make this big cake.\n3. When did they invent the personal computer?\n4. They asked us not to run in the hallway.\n5. Someone took the video back to the store.\n3 Find out information about an invention you would like to,957,0,unknown,text-extracted,,2.0,义务教育教科书·英语九年级全一册,112,957,2025-07-21T14:24:27.199Z,2.0,2025-07-20T03:42:09.872Z,九年级,[object Object],node-poppler,unknown,,0.5,0.957,1,全一册,/Users/LeoQin/Documents/GitHub/PDFconvertor/training_data/初中/英语/人教版-人民教育出版社/九年级/义务教育教科书·英语九年级全一册.pdf,义务教育教科书·英语九年级全一册.json,英语,290800
义务教育教科书·英语九年级全一册_chunk_113,113,know more about and write sentences below.\nInvention:\nWhen:\nWho:\nPurpose:\n\n48 UNIT 7\nSection\n\nLanguage Goals:\nTalk about what\nyou are allowed\nto do;\nAgree and\ndisagree\n\nTeenagers should be allowed\nto choose their own clothes.\n1a\n\nRead the statements below. Circle A for agree or\nD for disagree.\n\nNo way!\nI don‛t think\nsixteen-year-olds\nshould be\nallowed to drive.\nI‛m worried about\nyour safety.\n\nCan I go to\nthe shopping\ncenter with John?\nHe just got\nhis driver‛s\nlicense.\n\n1. Teenagers should not be allowed to smoke.\n2. Sixteen-year-olds should be allowed to drive.\n3. Students should not be allowed to have part-time jobs.\n4. Sixteen-year-olds should be allowed to get their ears pierced.\n5. Teenagers should be allowed to choose their own clothes.\n1b\n\n\n\n\n\n\n\n\n\nListen and circle T for true or F for false.\n1. Anna can go to the shopping center by bus.\n2. Anna wants to get her ears pierced.\n3. Anna wants to choose her own clothes.,934,0,unknown,text-extracted,,2.0,义务教育教科书·英语九年级全一册,113,967,2025-07-21T14:24:27.199Z,2.0,2025-07-20T03:42:09.872Z,九年级,[object Object],node-poppler,unknown,,0.5,0.934,0.95,全一册,/Users/LeoQin/Documents/GitHub/PDFconvertor/training_data/初中/英语/人教版-人民教育出版社/九年级/义务教育教科书·英语九年级全一册.pdf,义务教育教科书·英语九年级全一册.json,英语,290800
义务教育教科书·英语九年级全一册_chunk_114,114,"Listen and circle T for true or F for false.\n1. Anna can go to the shopping center by bus.\n2. Anna wants to get her ears pierced.\n3. Anna wants to choose her own clothes.\n\n\n\n\n\nA: I don’t think sixteen-year-olds\n\n1c\n\nLook at the statements in 1a and\nmake conversations.\n\nshould be allowed to drive.\nB: I agree. They aren’t serious\nenough.\n49 UNIT 7\n2a\n\nWhat does Molly think of Kathy’s\nstatements? Listen and circle A for\nAgree, D for Disagree or DK for Don’t\nKnow.\n\nKathy\n\nMolly\n\n1. Sixteen-year-olds should not be allowed to work at night.\n2. Larry shouldn’t work every night.\n3. He should cut his hair.\n4. He should stop wearing that silly earring.\n5. He doesn’t seem to have many friends.\n\n\n\n\n\n\n\n\n\nDK\nDK\nDK\nDK\nDK\n\n2b\n\nListen again. What are\nKathy’s and Molly’s\nreasons? Number their\nreasons in the correct\norder.\n\nIt looks cool.\nYoung people need to sleep.\nHe needs to spend time with friends.\nHe needs time to do homework.\nIt doesn’t look clean.\n\n2c",953,0,unknown,text-extracted,,2.0,义务教育教科书·英语九年级全一册,114,990,2025-07-21T14:24:27.199Z,2.0,2025-07-20T03:42:09.872Z,九年级,[object Object],node-poppler,unknown,,0.5,0.953,0.9,全一册,/Users/LeoQin/Documents/GitHub/PDFconvertor/training_data/初中/英语/人教版-人民教育出版社/九年级/义务教育教科书·英语九年级全一册.pdf,义务教育教科书·英语九年级全一册.json,英语,290800
义务教育教科书·英语九年级全一册_chunk_115,115,"It looks cool.\nYoung people need to sleep.\nHe needs to spend time with friends.\nHe needs time to do homework.\nIt doesn’t look clean.\n\n2c\n\nMake a list of things teenagers\nshould and should not be allowed\nto do. Discuss your list with your\npartner.\n\nA: Do you think teenagers should ...?\nB: Yes, I ... / No, I ...\n\n2d\n\nRole-play the conversation.\nSandy: I’m really excited about seeing the famous paintings by Picasso.\nWu Lan: Me, too! I’m glad Mr. Smith chose the art museum for our school trip\n\nthis year.\n\nSandy: I’m going to bring my new camera to take lots of photos!\nWu Lan: Oh, no. Mr. Smith says we must not take photos. It’s not allowed in the\n\nmuseum.\nSandy: That’s too bad! Do you think we may be allowed to take photos if we\ndon’t use a flash?\nWu Lan: Hmm ... I think they just want to\nprotect the paintings. So if you don’t\nuse a flash, then it may be OK.\nSandy: Yeah. I think we should be allowed\nto do that. I’ll bring my camera\nanyway.\n50",952,0,unknown,text-extracted,,2.0,义务教育教科书·英语九年级全一册,115,952,2025-07-21T14:24:27.199Z,2.0,2025-07-20T03:42:09.872Z,九年级,[object Object],node-poppler,unknown,,0.5,0.952,1,全一册,/Users/LeoQin/Documents/GitHub/PDFconvertor/training_data/初中/英语/人教版-人民教育出版社/九年级/义务教育教科书·英语九年级全一册.pdf,义务教育教科书·英语九年级全一册.json,英语,290800
义务教育教科书·英语九年级全一册_chunk_116,116,Teenagers should be allowed to choose their own clothes.\n3a\n\nUNIT 7\n\nRead the poem aloud and discuss what the title means with your partner.,140,0,unknown,text-extracted,,2.0,义务教育教科书·英语九年级全一册,116,140,2025-07-21T14:24:27.199Z,2.0,2025-07-20T03:42:09.872Z,九年级,[object Object],node-poppler,unknown,,0.5,0.14,1,全一册,/Users/LeoQin/Documents/GitHub/PDFconvertor/training_data/初中/英语/人教版-人民教育出版社/九年级/义务教育教科书·英语九年级全一册.pdf,义务教育教科书·英语九年级全一册.json,英语,290800
义务教育教科书·英语九年级全一册_chunk_117,117,"Mom Knows Best\nWhen I was a tiny baby crying all night, my mom sang to me and stayed by my side.\nWhen I was tired and hungry, she gave me food and warm arms to sleep in.\nWhen I was two running through the field, she made sure I was safe and kept me from\ndanger.\nWhen I fell and hurt myself, she gave me a hug and lifted me up.\nWhen I was seven coughing badly, she said no ice-cream for me.\nBut I talked back loudly, “I should be allowed to eat some! Give it to me now!”\nWhen I was nine watching scary movies, she said it’d give me awful dreams.\nBut I shouted back angrily, “I should be allowed to watch it! I’m not a baby!”\nWhen I was a teen going out with friends, she said, “Please be\nback by ten!”\nBut I talked back again — “I should not be told what to do!\nI’m seventeen now!”\nNow I’m an adult, thinking back to those times.\nI coughed for days after eating that ice-cream\nAnd had scary dreams after watching that film.\nI was late for school from staying out past ten.",971,0,unknown,text-extracted,,2.0,义务教育教科书·英语九年级全一册,117,971,2025-07-21T14:24:27.199Z,2.0,2025-07-20T03:42:09.872Z,九年级,[object Object],node-poppler,unknown,,0.5,0.971,1,全一册,/Users/LeoQin/Documents/GitHub/PDFconvertor/training_data/初中/英语/人教版-人民教育出版社/九年级/义务教育教科书·英语九年级全一册.pdf,义务教育教科书·英语九年级全一册.json,英语,290800
义务教育教科书·英语九年级全一册_chunk_118,118,"Now I’m an adult, thinking back to those times.\nI coughed for days after eating that ice-cream\nAnd had scary dreams after watching that film.\nI was late for school from staying out past ten.\nI regret talking back, not listening to Mom.\nMom knows best, and for me she wanted only the best!\n3b",291,0,unknown,text-extracted,,2.0,义务教育教科书·英语九年级全一册,118,291,2025-07-21T14:24:27.199Z,2.0,2025-07-20T03:42:09.872Z,九年级,[object Object],node-poppler,unknown,,0.5,0.291,1,全一册,/Users/LeoQin/Documents/GitHub/PDFconvertor/training_data/初中/英语/人教版-人民教育出版社/九年级/义务教育教科书·英语九年级全一册.pdf,义务教育教科书·英语九年级全一册.json,英语,290800
义务教育教科书·英语九年级全一册_chunk_119,119,"Read the poem again and answer the questions.\n1. What did the mom do when the writer was a baby and a small child?\n2. Why do you think the writer talked back to his mom when he was seven and\nnine years old?\n3. How did the writer feel when he was a teenager and his mom said “Please be\nback by ten”?\n4. After reading the whole poem, how do you think the writer feels about his mom?\n\n3c\n\nThink about a time you did something even though your mom or dad\ntold you not to do it. Share your story with your partner.\n51 UNIT 7\n\nGrammar\nFocus\n\nI don’t think sixteen-year-olds should be\nallowed to drive.\nDo you think teenagers should be\nencouraged to make their own decisions?\nTeenagers should not be allowed to have\npart-time jobs.\nDo you think we may be allowed to take\nphotos if we don’t use a flash?\n4a",798,0,unknown,text-extracted,,2.0,义务教育教科书·英语九年级全一册,119,800,2025-07-21T14:24:27.199Z,2.0,2025-07-20T03:42:09.872Z,九年级,[object Object],node-poppler,unknown,,0.5,0.798,1,全一册,/Users/LeoQin/Documents/GitHub/PDFconvertor/training_data/初中/英语/人教版-人民教育出版社/九年级/义务教育教科书·英语九年级全一册.pdf,义务教育教科书·英语九年级全一册.json,英语,290800
义务教育教科书·英语九年级全一册_chunk_120,120,"I agree. They aren’t serious enough.\nNo, I don’t agree with this. Teenagers are\ntoo young to make their own decisions.\nI disagree. They can learn a lot from\nworking.\nIf you don’t use a flash, then it may be\nOK.\n\nRewrite the sentences according to the example.\n1. You must clean your bedroom every day.\nYour bedroom must be cleaned every day\n.\n2. I will do the housework in the afternoon.\nThe housework will be done in the afternoon\n.\n3. Parents will encourage their children to do social work for their community.\nChildren\n.\n4. Do you think we must keep teenagers away from the Internet?\nDo you think teenagers\n?\n5. Parents should give teenagers chances to make their own decisions.\nTeenagers\n.\n\n4b\n\nFill in the blanks with the correct forms of the words in brackets.",767,0,unknown,text-extracted,,2.0,义务教育教科书·英语九年级全一册,120,767,2025-07-21T14:24:27.199Z,2.0,2025-07-20T03:42:09.872Z,九年级,[object Object],node-poppler,unknown,,0.5,0.767,1,全一册,/Users/LeoQin/Documents/GitHub/PDFconvertor/training_data/初中/英语/人教版-人民教育出版社/九年级/义务教育教科书·英语九年级全一册.pdf,义务教育教科书·英语九年级全一册.json,英语,290800
义务教育教科书·英语九年级全一册_chunk_121,121,"4b\n\nFill in the blanks with the correct forms of the words in brackets.\n\nShould teenagers\n(ask) to move out when they start working? In many\nWestern countries, teenagers\n(allow) to move out at eighteen. Their\nparents believe that they should be educated to take care of themselves from a\nyoung age. This way, when they\n(start) working they can manage their\nown lives. However, in most Asian societies, it is not common for teenagers to\n(move) out. Chinese parents believe that it is better for children to\nlive with parents who can\n(take) care of them. But the young should\nthen look after their parents as they get older. That is why many Chinese adults\n(continue) to live with their parents.\n\n4c\n\nYou and your friend are starting an\nEnglish club. Make a list of rules\nabout what should and should not be\nallowed.\n52\n\nA: Members should be allowed\n\nto use dictionaries.\n\nB: Yes, but they should only use\n\nEnglish-English dictionaries. Teenagers should be allowed to choose their own clothes.",991,0,unknown,text-extracted,,2.0,义务教育教科书·英语九年级全一册,121,993,2025-07-21T14:24:27.199Z,2.0,2025-07-20T03:42:09.872Z,九年级,[object Object],node-poppler,unknown,,0.5,0.991,1,全一册,/Users/LeoQin/Documents/GitHub/PDFconvertor/training_data/初中/英语/人教版-人民教育出版社/九年级/义务教育教科书·英语九年级全一册.pdf,义务教育教科书·英语九年级全一册.json,英语,290800
义务教育教科书·英语九年级全一册_chunk_122,122,"A: Members should be allowed\n\nto use dictionaries.\n\nB: Yes, but they should only use\n\nEnglish-English dictionaries. Teenagers should be allowed to choose their own clothes.\n\nSection\n\n1a\n\nUNIT 7\n\nRead the questions. How often do you do these\nthings? Write A for always, U for usually, S for\nsometimes and N for never. Then talk with a partner\nabout other things you do.\n\nDo you ever ...\n\n1. get to class late?\n2. study with friends?\n3. finish a test early?\n4. worry about failing a test?\n5. ...\nA: Do you ever get to class late?\nB: Yes, I sometimes get to class late.\n\n1b\n\nTalk about your answers in 1a.\n\n1c\n\nListen and circle the things in 1a that Peter talks about.\n\n1d\n\nListen again. Match these sentence parts.\n1. Peter is going to ...\n2. He isn’t allowed to ...\n3. Peter wasn’t allowed to ...\n4. He could ...\n5. He should be allowed to ...\n\n1e\n\na. take the test.\nb. pass the test.\nc. fail a math test.\nd. take the test later.\ne. get to class late.",951,0,unknown,text-extracted,,2.0,义务教育教科书·英语九年级全一册,122,959,2025-07-21T14:24:27.199Z,2.0,2025-07-20T03:42:09.872Z,九年级,[object Object],node-poppler,unknown,,0.5,0.951,1,全一册,/Users/LeoQin/Documents/GitHub/PDFconvertor/training_data/初中/英语/人教版-人民教育出版社/九年级/义务教育教科书·英语九年级全一册.pdf,义务教育教科书·英语九年级全一册.json,英语,290800
义务教育教科书·英语九年级全一册_chunk_123,123,"1e\n\na. take the test.\nb. pass the test.\nc. fail a math test.\nd. take the test later.\ne. get to class late.\n\nRead the statements. Then discuss them with your group.\n1. Peter should be allowed to take the test later.\n2. Students need strict rules.\n3. Parents should not be too strict with teenagers.\n\nA: I think Peter should ...\nB: I don’t agree.\nC: I think ...\n\n53 UNIT 7\n2a\n\nDiscuss the questions\nin your groups.\n\n2b\n\nFirst, look at the title of the passage. Answer “yes” or “no”. Find out\nhow many in your group agree with you. Then read the passage. Does\nyour answer change?\n\nAre you allowed to make your own decisions\nat home? What kinds of decisions?\n\nLEARNING ACTIVELY\n\nShould I Be Allowed to Make\nMy Own Decisions?\n\nWhen you learn any new\nlanguage, actively use it in\nnew sentences of your own.",800,0,unknown,text-extracted,,2.0,义务教育教科书·英语九年级全一册,123,805,2025-07-21T14:24:27.199Z,2.0,2025-07-20T03:42:09.872Z,九年级,[object Object],node-poppler,unknown,,0.5,0.8,1,全一册,/Users/LeoQin/Documents/GitHub/PDFconvertor/training_data/初中/英语/人教版-人民教育出版社/九年级/义务教育教科书·英语九年级全一册.pdf,义务教育教科书·英语九年级全一册.json,英语,290800
义务教育教科书·英语九年级全一册_chunk_124,124,"Many teenagers have hobbies. But sometimes these can get in the way of their\nschoolwork, and parents might worry about their success at school. Teenagers\noften think they should be allowed to practice their hobbies as much as they want.\nDo you agree?\nLiu Yu, a fifteen-year-old boy from Shandong, is\na running star. He is on his school team and has\nalways wanted to be a professional runner when\nhe grows up. However, his parents won’t allow\nhim to train so much. “Of course we want to\nsee him achieve his dreams,” says Mr. Liu. “And\nwe know how much he loves running. My wife\nand I have supported every one of his races. We\nhave nothing against running! But we think our\nson needs to think about other possible jobs. He’s getting older now, so he needs\nto think about what will happen if he doesn’t end up as a professional runner.”\nLiu Yu doesn’t really agree. “Well, I think I should be allowed to decide for myself,”",920,0,unknown,text-extracted,,2.0,义务教育教科书·英语九年级全一册,124,920,2025-07-21T14:24:27.199Z,2.0,2025-07-20T03:42:09.872Z,九年级,[object Object],node-poppler,unknown,,0.5,0.92,1,全一册,/Users/LeoQin/Documents/GitHub/PDFconvertor/training_data/初中/英语/人教版-人民教育出版社/九年级/义务教育教科书·英语九年级全一册.pdf,义务教育教科书·英语九年级全一册.json,英语,290800
