Chunk_ID,Chunk_Index,Content,Content_Length,Quality_Score,Reliability,Source_Type,Original_Content,Enhancement_Version,averageConfidence,book_name,chunkIndex,enhancementTimestamp,enhancementVersion,fileName,filePath,grade,ocrMethod,publisher,qualityMetrics_chineseCharRatio,qualityMetrics_coherenceScore,qualityMetrics_lengthScore,qualityMetrics_ocrConfidence,semanticFeatures_hasDefinition,semanticFeatures_hasExperiment,semanticFeatures_hasFormulas,semanticFeatures_hasNumbers,semanticFeatures_hasQuestion,semanticFeatures_isTableContent,semanticFeatures_subjectArea,semester,source_file,subject,totalPages,uniqueId
义务教育教科书·数学八年级上册_chunk_24,24,"这 4 个点 的离散程度小 〈 即散 度小 ) 者为 胜 . 你能 设计一 种用 数刻 画这 4 个点 的离散程度的 方法吗 ? 试一 试 . C C B 四图 4 3 大刚 设计 的方法是 : 分别 量出 4 个点 中每 两点 之间 的距离， 用这 些距离的 最大 值刻 画该 同学投 镖的 离散程度 . 小亮 设计了 一种 方法 : 分别 量出 4 个点 中每 两点 之间 的距离， 用这 些距离之 和刻画该 同学投 镖的 离散程度 . 小莹 设计了 另一 种方法 : 分别 量出 4 个点 中每 两点 之间 的距离， 用这 些距离的 平均数 刻画 该同学投 镖的 离散程度 . 小亮 、 大刚 、 小莹 设计的 方法都 有一 定的 道理 . y 你还 能设计出 新的 方法吗 ? 李老 师设 计了 一种 方法 : 在图 4 4 中， 以点 0 为 T TTTTTTIALeH 原点， 分别 以 O4，OC 所在 直线为 坐标轴， 以 1 厘米中 为单位长 度， 建立 直角坐标系 . 可 x 如图 4 4， 设某 同学 扎出 的 4 个点 的坐标分 别为 图 4 4 fis7 137 第 4 章数据分 析 Pi (2 31), Py xz， 芒 )，P (x35, 3), Py (2， 蕊 )， 分别 求出 各点 横坐 标的平均数 无与 纵坐 标的平均数， 再计算 po (Bm ) Ge )7 () (2 一丈 ) 4 ( 3) ( y) (yy) (p, y) 的值， 然后 用 〈 开 7) WEZEZEFRENEHREE, (k 1) 的值 最小 者获胜 . 你能 解释这 种方法的 合理性 吗 ? 人冻 习 1. 一组 数据 2，4，5，1，a 的平均数 为 wa， 这组 数据的 方差是 多少 ?",759,0.30244563180020884,low,ocr,"这 4 个 点 的 离散 程度 小 〈 即 散 度 小 ) 者 为 胜 . 你 能 设计 一 种 用 “ 数 ” 刻 画\n这 4 个 点 的 离散 程度 的 方法 吗 ? 试 一 试 .\nC C B\n® 四\n图 4-3\n大 刚 设 计 的 方法 是 : 分 别 量 出 4 个 点 中 每 两 点 之 间 的 距离 ， 用 这 些 距离 的 最 大 值 刻\n画 该 同学 投 镖 的 离散 程度 .\n小 亮 设计 了 一 种 方法 : 分 别 量 出 4 个 点 中 每 两 点 之 间 的 距离 ， 用 这 些 距离 之 和 刻画\n该 同学 投 镖 的 离散 程度 .\n小 莹 设计 了 另 一 种 方法 : 分 别 量 出 4 个 点 中 每 两 点 之 间 的 距离 ， 用 这 些 距离 的 平均\n数 刻 画 该 同学 投 镖 的 离散 程度 .\n小 亮 、 大 刚 、 小 莹 设计 的 方法 都 有 一 定 的 道理 . y\n你 还 能 设计 出 新 的 方法 吗 ?\n李 老 师 设 计 了 一 种 方法 : 在 图 4-4 中 ， 以 点 0 为  T[TTTTTTIALeH\n原点 ， 分 别 以 O4，OC 所 在 直线 为 坐标 轴 ， 以 1 厘米 中\n为 单位 长 度 ， 建 立 直角 坐标 系 . 可 x ’\n如 图 4-4， 设 某 同 学 扎 出 的 4 个 点 的 坐标 分 别 为 图 4-4 fis7\n137\n=== 第 50 页 ===\n第 4 章 ”数据 分 析\nPi (2 31), Py xz， 芒 )，P (x35, ¥3), Py (2， 蕊 ) ， 分 别 求 出 各 点 横 坐 标的 平均 数\n无 与 纵 坐 标的 平均 数 ， 再 计算\npo (Bm ®) Ge — ®)7+ ()* (2 一 丈 )\n4\n(»=3)+(=y)+(yy)+(p,—y)°\n的 值 ， 然 后 用 〈 开 +7) WEZEZEFRENEHREE, (k+1) 的 值 最 小 者 获胜 .\n你 能 解释 这 种 方法 的 合理 性 吗 ?\n人 冻 习\n1. 一 组 数据 2，4，5，1，a 的 平均 数 为 wa， 这 组 数据 的 方差 是 多 少 ?",2.0,75.45226130653266,义务教育教科书·数学八年级上册,54,2025-07-21T14:23:32.493Z,2.0,义务教育教科书·数学八年级上册,/Users/LeoQin/Documents/GitHub/PDFconvertor/training_data/初中/数学/青岛版-青岛出版社/八年级/义务教育教科书·数学八年级上册.pdf,八年级,tesseract.js-parallel,unknown,0.6679316888045541,0.5,1,75.45226130653266,,,,true,true,,unknown,上册,义务教育教科书·数学八年级上册.json,数学,199,初中_数学_青岛版_八年级_义务教育教科书·数学八年级上册
义务教育教科书·数学八年级上册_chunk_25,25,"数据 (单位 : 辆 ) 填和 人下 面的 表中， 再分 别求 出它们的 平均数 、 方差 、 中位 数和 众数 : 一三 三查 互六 所入 克十 平者 数方 差中 信数 从雪 ?ass lal77 7 nll se s2 s zs3 4 5 s plslslalalsle 1o s s (2 ) 从平均数 分析， 两家 公司的 月平均销售量 都是 9 辆， 但是 二者 的方差相差很 大， 后者 约为 前者 的 3 倍， 造成 这种 差异的 原因是 乙公 司的 数据比较分 散， 有较 多的 数据 (如 3，4，5，13，13，16 ) 偏离平均数 9 的程度大 ; (3 ) 从折线图 看， 年初 乙公 司的 销售情况明显低 于甲 公司， 从三 月份 开始甲 、 乙两 公司的 销售水 平开始接近， 从六 月份 开始超过甲 公司， 以后 各月 销售量 均比 甲公司高， 这表明在 该品牌汽车的 销售情况乙 公司 较有 洪力 . )) rr 哪个班 的成 绩好 在一 次科技知识竞赛中， 甲 、 乙两 个班 学生 的成 绩统 计如 下 : ra lwlelw : Tile 你能 运用学 过的 统计知识对 这两 个班 的成 绩作出评价吗 ? 分别 计算 两个 班成 绩的 平均分 及方差， 得元 80,， 苞 v， 80; s3a 172，s2 256 . 两个 班的 平均分 相同 . 但是 s 和 sz， 所以 甲班 成绩 的波动比 乙班 要小 . 这是 否意味着 甲班 的成 绩优于 乙班 呢 ? 如果 竞赛 的目的是 比较各 个班 的科技知识普及与 掌握的 情况， 那么 答案是 肯定的， 甲班 的成 绩优于 乙班 .",715,0.3435772613065327,low,ocr,"数据 (单位 : 辆 ) 填 和 人 下 面 的 表 中 ， 再 分 别 求 出 它们 的 平均\n数 、 方 差 、 中 位 数 和 众 数 :\n一 | 三 | 三 | 查 | 互 | 六 | 所 | 入 | 克 | 十 | 平 者 数 | 方 差 | 中 信 数 | 从 雪\n?ass lal77|7|nll se [s2]s |\nzs3|4|5|s|plslslalalsle [1o] s |s\n=== 第 52 页 ===\n(2 ) 从 平均 数 分 析 ， 两 家 公司 的 月 平均 销售 量 都 是 9 辆 ， 但 是 二 者 的 方差\n相差 很 大 ， 后 者 约 为 前 者 的 3 倍 ， 造 成 这 种 差异 的 原因 是 乙 公 司 的 数据 比较 分\n散 ， 有 较 多 的 数据 (如 3，4，5，13，13，16 ) 偏离 平均 数 9 的 程度 大 ;\n(3 ) 从 折线 图 看 ， 年 初 乙 公 司 的 销售 情况 明显 低 于 甲 公 司 ， 从 三 月 份 开始\n甲 、 乙 两 公司 的 销售 水 平 开始 接近 ， 从 六 月 份 开始 超过 甲 公 司 ， 以 后 各 月 销售\n量 均 比 甲 公司 高 ， 这 表明 在 该 品牌 汽车 的 销售 情况 乙 公 司 较 有 洪 力 .\n)) rr\n哪个 班 的 成 绩 好\n在 一 次 科技 知识 竞赛 中 ， 甲 、 乙 两 个 班 学 生 的 成 绩 统 计 如 下 :\nEECIERECIEREIEET\nra | lwlelw|:\nZK | Tile\n你 能 运用 学 过 的 统计 知识 对 这 两 个 班 的 成 绩 作出 评价 吗 ?\n分 别 计 算 两 个 班 成 绩 的 平均 分 及 方差 ， 得\n元 =80,， 苞 v， = 80; s3a=172，s2 = 256 .\n两 个 班 的 平均 分 相同 . 但 是 s 和 < sz ， 所 以 甲 班 成 绩 的 波动 比 乙 班 要 小 .\n这 是 否 意味 着 甲 班 的 成 绩优 于 乙 班 呢 ?\n如 果 竞 赛 的 目的 是 比较 各 个 班 的 科技 知识 普及 与 掌握 的 情况 ， 那 么 答案 是 肯定 的 ，\n甲 班 的 成 绩优 于 乙 班 .",2.0,75.45226130653266,义务教育教科书·数学八年级上册,57,2025-07-21T14:23:32.493Z,2.0,义务教育教科书·数学八年级上册,/Users/LeoQin/Documents/GitHub/PDFconvertor/training_data/初中/数学/青岛版-青岛出版社/八年级/义务教育教科书·数学八年级上册.pdf,八年级,tesseract.js-parallel,unknown,0.7270955165692008,0.5,1,75.45226130653266,,,,true,true,,mathematics,上册,义务教育教科书·数学八年级上册.json,数学,199,初中_数学_青岛版_八年级_义务教育教科书·数学八年级上册
义务教育教科书·数学八年级上册_chunk_26,26,"80; s3a 172，s2 256 . 两个 班的 平均分 相同 . 但是 s 和 sz， 所以 甲班 成绩 的波动比 乙班 要小 . 这是 否意味着 甲班 的成 绩优于 乙班 呢 ? 如果 竞赛 的目的是 比较各 个班 的科技知识普及与 掌握的 情况， 那么 答案是 肯定的， 甲班 的成 绩优于 乙班 . 从以 下几 个角度也 可以 得到 这个 结论 : (1 ) 甲班 的众 数为 90 分， 乙班 的众 数为 70 分， 所以 甲班 成绩 好 ; (2 ) 以 60 分为 及格 分数 线， 甲班 的及 格率 为 96， 乙班 的及 格率 为 92 6， 所以 甲班 成绩 好 ; (3 ) 若规定成 绩为 100 分获 一等 奖，90 分获 二等 奖，80 分获 三等 奖， 则甲 班的 获奖 率为 66， 乙班 的获奖率 为 S2， 所以 甲班 的成 绩好 . 如果 竞赛 的目的是 为了 选拔骨干， 由于 乙班 的方差较 大， 说明 乙班 得高 分 、 低分 极端 分数 的人 数比 甲班 多 . 甲班 得分 高于 平均分 80 分的 有 20 人， 乙班 高于 平均分 80 分的 有 24 人， 所以 乙班 优于 甲班 . 从以 下几 个角度也 可以 得到 这个 结论 : (1 ) 如果 按上 述 (3 ) 的规定设置一 、 二 、 三等 奖， 那么 甲班 获一 等奖 的人 数为 6 人， 乙班 为 12 人， 所以 乙班 优于 甲班 ; 4.5 方 (2 ) 如果 以 90 分为 选拔骨干的 分数 线， 那么 甲班 有 20 人入 选， 乙班 有 24 人入 选， 所以 乙班 优于 甲班 . sa 1. 八年 级一 班和 二班 各有 10 名同学参加电脑绘图技能测试 , 成绩 如下 (满分 30 分 ) : 人 w w",775,0.3671463294734542,low,ocr,"= 80; s3a=172，s2 = 256 .\n两 个 班 的 平均 分 相同 . 但 是 s 和 < sz ， 所 以 甲 班 成 绩 的 波动 比 乙 班 要 小 .\n这 是 否 意味 着 甲 班 的 成 绩优 于 乙 班 呢 ?\n如 果 竞 赛 的 目的 是 比较 各 个 班 的 科技 知识 普及 与 掌握 的 情况 ， 那 么 答案 是 肯定 的 ，\n甲 班 的 成 绩优 于 乙 班 .\n从 以 下 几 个 角度 也 可 以 得 到 这 个 结论 :\n(1 ) 甲 班 的 众 数 为 90 分 ， 乙 班 的 众 数 为 70 分 ， 所 以 甲 班 成 绩 好 ;\n(2 ) 以 60 分 为 及 格 分 数 线 ， 甲 班 的 及 格 率 为 96%， 乙 班 的 及 格 率 为 92%6， 所 以 甲\n班 成 绩 好 ;\n(3 ) 若 规定 成 绩 为 100 分 获 一 等 奖 ，90 分 获 二 等 奖 ，80 分 获 三 等 奖 ， 则 甲 班 的 获\n奖 率 为 66%， 乙 班 的 获奖 率 为 $S2%， 所 以 甲 班 的 成 绩 好 .\n如 果 竞 赛 的 目的 是 为 了 选拔 骨干 ， 由 于 乙 班 的 方差 较 大 ， 说 明 乙 班 得 高 分 、 低 分 极\n端 分 数 的 人 数 比 甲 班 多 . 甲 班 得 分 高 于 平均 分 80 分 的 有 20 人 ， 乙 班 高 于 平均 分 80 分 的\n有 24 人 ， 所 以 乙 班 优 于 甲 班 .\n从 以 下 几 个 角度 也 可 以 得 到 这 个 结论 :\n(1 ) 如 果 按 上 述 (3 ) 的 规定 设置 一 、 二 、 三 等 奖 ， 那 么 甲 班 获 一 等 奖 的 人 数 为 6\n人 ， 乙 班 为 12 人 ， 所 以 乙 班 优 于 甲 班 ;\n=== 第 53 页 ===\n4.5 方 =\n(2 ) 如 果 以 90 分 为 选拔 骨干 的 分 数 线 ， 那 么 甲 班 有 20 人 入 选 ， 乙 班 有 24 人 入 选 ，\n所 以 乙 班 优 于 甲 班 .\n< sa\n1. 八 年 级 一 班 和 二 班 各 有 10 名 同学 参加 电脑 绘图 技能 测试 , 成 绩 如 下 (满分 30 分 ) :\nRS 人 TT [w [ w",2.0,75.45226130653266,义务教育教科书·数学八年级上册,58,2025-07-21T14:23:32.493Z,2.0,义务教育教科书·数学八年级上册,/Users/LeoQin/Documents/GitHub/PDFconvertor/training_data/初中/数学/青岛版-青岛出版社/八年级/义务教育教科书·数学八年级上册.pdf,八年级,tesseract.js-parallel,unknown,0.7485714285714286,0.5,1,75.45226130653266,,true,,true,true,,mathematics,上册,义务教育教科书·数学八年级上册.json,数学,199,初中_数学_青岛版_八年级_义务教育教科书·数学八年级上册
义务教育教科书·数学八年级上册_chunk_27,27,"第 53 页 4.5 方 (2 ) 如果 以 90 分为 选拔骨干的 分数 线， 那么 甲班 有 20 人入 选， 乙班 有 24 人入 选， 所以 乙班 优于 甲班 . sa 1. 八年 级一 班和 二班 各有 10 名同学参加电脑绘图技能测试 , 成绩 如下 (满分 30 分 ) : 人 w w aa Ti ad li Ta 试利 用平均分 和方差， 对两 个班 同学 的测试成 绩进 行比较分 析 . 习题 4.5 复习与 巩固 1. 分别 计算习题 44 第 1 题中 甲 、 乙两 人射击成 绩的 平均数 和方差， 根据 计算 结果 验证 习题 44 得到 的结论 . 2. 某果 品公司准备对 收购的 两批 苹果进行分 级， 从中 各任意抽取了 20 个， 测得 它们最 大横 截面 的直径如 下 (单位 : mm ) : 第一 批 : 81 85 80 75 78 76 83 82 78 84 79 76 85 79 76 83 82 81 78 79 第二 批 : 80 81 78 74 83 88 76 75 84 83 82 80 78 84 8 78 76 77 83 77 哪一 批苹果的 大小 更为 整齐 ? 3. 为了 缓解市 区道路交通高 峰的 压力， 某市 实行了 有关 部门 错时上 下班 的制度 . 下表 是随机抽取的 在实行该 制度前 后两 个星期三 同一路 段上 班高 峰期 间每 30 min 的汽 车流量 : 是 5 到实行前 的汽 人实行后 的汽 分别 计算两 组数据的 方差 . 你认为该 市实行该 制度对 于缓解交通高 峰的 压力是 否有 效 ? 四哆 和民 与还 伸 4 解答本 章情 境导 航中 的问题 . 旧了 探索与 创新",743,0.30035894707914573,low,ocr,"== 第 53 页 ===\n4.5 方 =\n(2 ) 如 果 以 90 分 为 选拔 骨干 的 分 数 线 ， 那 么 甲 班 有 20 人 入 选 ， 乙 班 有 24 人 入 选 ，\n所 以 乙 班 优 于 甲 班 .\n< sa\n1. 八 年 级 一 班 和 二 班 各 有 10 名 同学 参加 电脑 绘图 技能 测试 , 成 绩 如 下 (满分 30 分 ) :\nRS 人 TT [w [ w\n-aa Ti RN\nad li Ta\n试 利 用 平均 分 和 方差 ， 对 两 个 班 同 学 的 测试 成 绩 进 行 比较 分 析 .\n习题 4.5\n< 复习 与 巩固\n1. 分 别 计算 习题 44 第 1 题 中 甲 、 乙 两 人 射击 成 绩 的 平均 数 和 方差 ， 根 据 计 算 结 果 验\n证 习题 44 得 到 的 结论 .\n2. 某 果 品 公司 准备 对 收购 的 两 批 苹果 进行 分 级 ， 从 中 各 任意 抽取 了 20 个 ， 测 得 它们\n最 大 横 截 面 的 直径 如 下 (单位 : mm ) :\n第 一 批 : 81 85 80 75 78 76 83 82 78 84\n79 76 85 79 76 83 82 81 78 79\n第 二 批 : 80 81 78 74 83 88 76 75 84 83\n82 80 78 84 8 78 76 77 83 77\n哪 一 批 苹果 的 大 小 更 为 整齐 ?\n3. 为 了 缓解 市 区 道路 交通 高 峰 的 压力 ， 某 市 实行 了 有 关 部 门 错时 上 下 班 的 制度 . 下 表\n是 随机 抽取 的 在 实行 该 制度 前 后 两 个 星期 三 同一 路 段 上 班 高 峰 期 间 每 30 min 的 汽\n车 流量 :\n是 5 到\n实行 前 的 汽\n人\n实行 后 的 汽\n|\n分 别 计算 两 组 数据 的 方差 . 你 认为 该 市 实行 该 制度 对 于 缓解 交通 高 峰 的 压力 是 否 有 效 ? 四\n=== 第 54 页 ===\n哆 -和 民 与 还 伸\n4 解答 本 章 “ 情 境 导 航 ” 中 的 问题 .\n旧 了 探索 与 创新",2.0,75.45226130653266,义务教育教科书·数学八年级上册,59,2025-07-21T14:23:32.493Z,2.0,义务教育教科书·数学八年级上册,/Users/LeoQin/Documents/GitHub/PDFconvertor/training_data/初中/数学/青岛版-青岛出版社/八年级/义务教育教科书·数学八年级上册.pdf,八年级,tesseract.js-parallel,unknown,0.6764132553606238,0.5,1,75.45226130653266,,true,,true,true,,unknown,上册,义务教育教科书·数学八年级上册.json,数学,199,初中_数学_青岛版_八年级_义务教育教科书·数学八年级上册
义务教育教科书·数学八年级上册_chunk_28,28,段上 班高 峰期 间每 30 min 的汽 车流量 : 是 5 到实行前 的汽 人实行后 的汽 分别 计算两 组数据的 方差 . 你认为该 市实行该 制度对 于缓解交通高 峰的 压力是 否有 效 ? 四哆 和民 与还 伸 4 解答本 章情 境导 航中 的问题 . 旧了 探索与 创新 5. 某县 统计局 对甲 、 乙两 村分 别随机抽取 10 户居 民调 查去 年的 收入情况， 得到 下表 : 千村被 调查户 人 p 数人 3 5 4 3 4 5 4 4 3 3s ctwmar AngA 56175153 3 3 3 被调查户 人均 纯收 入千 元 39 42 43 44 45 46 48 5 52 54 计算甲 、 乙两 村被 调查户 去年 人均 纯收入和 方差， 由此 你能 得到 什么结论 ? 在科学计算器 的键盘上， 平均 数的 按键为 性汪， 方差 的按键为 慌天 . 使用 科学计算器 计算平均数 及方差的 操作程序如 下 (不同计 算器 的操作程 序可 能有 所不 同 ) : (1 ) 按键国 四， 打开 计算 器 ; (2 ) 按键 E 属国直入统计状态， 计算 器显示 stat x 符号 ; (3 ) 按键看 三天， 清除 计算 央中原有 寄存器 的统计数据 ; (4 ) 输入统计数据， 按键 顺序 为 : 第 1 个数据，E 国 ;第 2 个数据， 上全 ; 最后 一个 数据， 上全 ; (5 ) 按键配 国故国， 计算 吕显示出 输入的 所有 统计数据的 平均数 ; (6 ) 按键访 故国， 计算器 显示出 输入的 所有 统计数据的 方差 ; (7) 如果 不准 备保留数据， 可按键 Eee 属国， 退出 求平 均数 及方差的 运算 .,738,0.4331522675544686,medium-low,ocr,段 上 班 高 峰 期 间 每 30 min 的 汽\n车 流量 :\n是 5 到\n实行 前 的 汽\n人\n实行 后 的 汽\n|\n分 别 计算 两 组 数据 的 方差 . 你 认为 该 市 实行 该 制度 对 于 缓解 交通 高 峰 的 压力 是 否 有 效 ? 四\n=== 第 54 页 ===\n哆 -和 民 与 还 伸\n4 解答 本 章 “ 情 境 导 航 ” 中 的 问题 .\n旧 了 探索 与 创新\n5. 某 县 统计 局 对 甲 、 乙 两 村 分 别 随机 抽取 10 户 居 民 调 查 去 年 的 收入 情况 ， 得 到 下 表 :\n千村 被 调查 户 人 p 数 /人 | 3 | 5 | 4 | 3 | 4 | 5 |4|4|3|3s\nctwmar AngA | 56175153 3|3|3\n被 调查 户 人 均 纯 收 入 / 千 元 | 39 | 42 | 43 | 44 | 45 | 46 | 48 | 5 | 52 | 54\n计算 甲 、 乙 两 村 被 调查 户 去 年 人 均 纯 收入 和 方差 ， 由 此 你 能 得 到 什么 结论 ?\n在 科学 计算 器 的 键盘 上 ， 平 均 数 的 按键 为 性 汪 ， 方 差 的 按键 为 慌 天 .\n使 用 科学 计算 器 计算 平均 数 及 方差 的 操作 程序 如 下 (不同 计 算 器 的 操作 程\n序 可 能 有 所 不 同 ) :\n(1 ) 按键 国 四 ， 打 开 计 算 器 ;\n(2 ) 按键 E@ 属国 直入 统计 状态 ， 计 算 器 显示 “stat x” 符 号 ;\n(3 ) 按键 看 三 天 ， 清 除 计 算 央 中原 有 寄存 器 的 统计 数据 ;\n(4 ) 输入 统计 数据 ， 按 键 顺 序 为 : 第 1 个 数据 ，E 国 ;第 2 个 数据 ， 上 全 ;\n…… 最 后 一 个 数据 ， 上 全 ;\n(5 ) 按键 配 国 故国 ， 计 算 吕 显示 出 输入 的 所 有 统计 数据 的 平均 数 ;\n(6 ) 按键 访 故国， 计算 器 显示 出 输入 的 所 有 统计 数据 的 方差 ;\n(7) 如 果 不 准 备 保留 数据 ， 可 按键 Eee 属国 ， 退 出 求 平 均 数 及 方差 的 运算 .,2.0,75.45226130653266,义务教育教科书·数学八年级上册,60,2025-07-21T14:23:32.493Z,2.0,义务教育教科书·数学八年级上册,/Users/LeoQin/Documents/GitHub/PDFconvertor/training_data/初中/数学/青岛版-青岛出版社/八年级/义务教育教科书·数学八年级上册.pdf,八年级,tesseract.js-parallel,unknown,0.74373795761079,0.5,1,75.45226130653266,,,,true,true,,mathematics,上册,义务教育教科书·数学八年级上册.json,数学,199,初中_数学_青岛版_八年级_义务教育教科书·数学八年级上册
义务教育教科书·数学八年级上册_chunk_29,29,"3.43, 3.41, 3.70, 3.60 试问该 生产线 是否 需要 关闭检修 ? 4 本习题 4.6 复习与 巩固 1. 用计算器 分别 计算 习题 45 第 5 题中 的甲 、 乙两 村的 人均 收入 及方差 . 2. 质检 部门 从甲 、 乙两 种饮料中 各抽取 10 L 250 mL 的果汁饮料， 检测 其中 维生素 C 的含量 . 检测数据如 下 (单位 : mg ) : 甲 120 123 119 121 122 124 119 122 121 119 Z 121 119 124 119 123 124 123 122 123 122 哪种 饮料维生素 C 的含量高 ? 哪种 饮料维生素 C 的含量比较稳定 ? 吕拓展与 延促 3. 某校 要从 两名 跳远选手中 挑选一 人参加市 中学 生运 动会 . 在 7 次选拔赛 中， 他们 的成 绩如 下表单位 : m) : em s om s9 on om aon a 5 5ms 5o6 am m oa (1) 把上 表中 所空 各项 数据填写完整 ; (2) A, 也两 人的 跳远成 绩分 别有 什么 特点 ? (3 ) 经查阅历届市 中学 生运 动会 记录， 成绩 若达到 6.00 mm， 就很 可能 夺冠， 你认 为选 谁参赛更 有把 握 ? (4) 历届市 中学 生运 动会 上该 项最 高记录为 6.15 m， 为打破这 一记录， 你认为应 选派哪 位选手参赛 ? 回顾与 总结 1. 本章 主要 学习 了哪些内 容 ? 总结 一下， 与同学交流 . 2. 什么是 加权 平均 数 ? 怎样理解权 的意义 ? 在具体问题中， 权有 哪几 种不 同的 表现形式 ? 写出 加权 平均 数的 计算公式， 并说 明它 与过 去学 过的 平均数 有什么联系 . (3 ) 观察图 1 8D， 在 4 和",790,0.33068307627452787,low,ocr,"3.43, 3.41, 3.70, 3.60\n试问 该 生产 线 是 否 需 要 关闭 检修 ?\n4 本 习题 4.6\n-复习 与 巩固\n1. 用 计算 器 分 别 计 算 习 题 45 第 5 题 中 的 甲 、 乙 两 村 的 人 均 收 入 及 方差 .\n2. 质 检 部 门 从 甲 、 乙 两 种 饮料 中 各 抽取 10 #L 250 mL 的 果汁 饮料 ， 检 测 其 中 维生素 C\n的 含量 . 检测 数据 如 下 (单位 : mg ) :\n甲 120 123 119 121 122 124 119 122 121 119\nZ 121 119 124 119 123 124 123 122 123 122\n哪 种 饮料 维生素 C 的 含量 高 ? 哪 种 饮料 维生素 C 的 含量 比较 稳定 ?\n吕 拓展 与 延 促\n3. 某 校 要 从 两 名 跳远 选手 中 挑选 一 人 参加 市 中 学 生 运 动 会 . 在 7 次 选拔 赛 中 ， 他 们 的\n成 绩 如 下 表单 位 : m) :\nTAR\n»|em [s® [om [s9 [on [om [aon | |\na | 5% [5ms [5o6 [am [m [oa | | |\n(1) 把 上 表 中 所 空 各 项 数据 填写 完整 ;\n(2) A, 也 两 人 的 跳远 成 绩 分 别 有 什 么 特点 ?\n(3 ) 经 查阅 历届 市 中 学 生 运 动 会 记录 ， 成 绩 若 达到 6.00 mm， 就 很 可 能 夺冠 ， 你 认\n为 选 谁 参赛 更 有 把 握 ?\n(4) 历届 市 中 学 生 运 动 会 上 该 项 最 高 记录 为 6.15 m， 为 打破 这 一 记录 ， 你 认为 应\n选派 哪 位 选手 参赛 ?\n< 回顾 与 总 结\n1. 本 章 主 要 学 习 了 哪些 内 容 ? 总 结 一 下 ， 与 同学 交流 .\n2. 什么 是 加 权 平 均 数 ? 怎样 理解 权 的 意义 ? 在 具体 问题 中 ， 权 有 哪 几 种 不 同 的 表现\n形式 ? 写 出 加 权 平 均 数 的 计算 公式 ， 并 说 明 它 与 过 去 学 过 的 平均 数 有 什么 联系 .\n=== 第 57 页 ===\n(3 ) 观察 图 1-8D@， 在 4 和",2.0,75.45226130653266,义务教育教科书·数学八年级上册,62,2025-07-21T14:23:32.493Z,2.0,义务教育教科书·数学八年级上册,/Users/LeoQin/Documents/GitHub/PDFconvertor/training_data/初中/数学/青岛版-青岛出版社/八年级/义务教育教科书·数学八年级上册.pdf,八年级,tesseract.js-parallel,unknown,0.6303571428571428,0.5,1,75.45226130653266,,true,,true,true,,unknown,上册,义务教育教科书·数学八年级上册.json,数学,199,初中_数学_青岛版_八年级_义务教育教科书·数学八年级上册
