Chunk_ID,Chunk_Index,Content,Content_Length,Quality_Score,Reliability,Source_Type,Original_Content,Enhancement_Version,book_name,chunkIndex,chunkSize,enhancementTimestamp,enhancementVersion,extractedAt,grade,loc_lines,method,publisher,qualityMetrics_chineseCharRatio,qualityMetrics_coherenceScore,qualityMetrics_lengthScore,qualityMetrics_ocrConfidence,semanticFeatures_hasDefinition,semanticFeatures_hasExperiment,semanticFeatures_hasFormulas,semanticFeatures_hasNumbers,semanticFeatures_hasQuestion,semanticFeatures_isTableContent,semanticFeatures_subjectArea,semester,source,source_file,subject,textLength
义务教育教科书·美术四年级上册_chunk_0,0,义务 教育 教科 书四年级上册辽 海出 版社 义务教育教科书美术四年级上册辽 海出 版社 目录 2 第二单元感知与模仿课题的拓展第1课 1 第5课感觉肌理 12 第6课美妙的拼贴画 14 我爱我家乡 2 3 第一单元形色体验第三单元丰富多彩的剪纸艺术第7课学学剪纸 16 第8课安徒生与剪纸 18 第2课冷色与暖色 6 第3课色彩的对比与和谐 8 第4课四季的感受 10 第9课变化的剪纸 20 4 第四单元生活中学设计 6 第六单元巧用材料再创造第15课经纬纸编 32 第16课软陶乐趣 34 第10课识别公共标志 22 第11课环保标志设计 24 第17课彩泥面塑 36 第18课泥板浮雕 38 第12课生活提示卡 26 7 5 第七单元感受中国传统文化第五单元绘画与印刷第13课黑白纸版画第19课龙舞神州 42 第20课彩狮呈祥 44 28 第14课彩色纸版画 30 世界遗产之旅孔庙孔林孔府 46 第课题的拓展 1 课我爱我家乡我的家乡四季分明，春天野花遍地，夏天绿荫如盖， 秋天红叶似火，冬天是一片白茫茫的冰雪世界四季风光各不相同，我们就是在这里一天天长大的。 独特的自然景观长白山天池吉林雾凇古老的建筑黑龙江扎龙自然保护区的丹顶鹤,521,0.6583771551724138,medium,text-extracted,义 务 教 育 教 科 书\n\n四年级上册\n\n辽 海 出 版 社\n\n义务教育教科书\n\n美术\n\n四年级上册\n\n辽\n海\n出\n版\n社\n\n目录\n\n2\n\n第二单元\n\n感知与模仿\n\n课题的拓展\n\n第1课\n\n1\n\n第5课 感觉肌理\n\n12\n\n第6课 美妙的拼贴画\n\n14\n\n我爱我家乡 ①②       2\n\n3\n\n第一单元\n\n形色体验\n\n第三单元\n\n丰富多彩的\n剪纸艺术\n\n第7课 学学剪纸                         16\n第8课 安徒生与剪纸                  18\n第2课 冷色与暖色\n\n6\n\n第3课 色彩的对比与和谐\n\n8\n\n第4课 四季的感受\n\n10\n\n第9课 变化的剪纸                  20\n\n4\n\n第四单元\n\n生活中学设计\n\n6\n\n第六单元\n\n巧用材料再\n创造\n\n第15课 经纬纸编                           32\n第16课 软陶乐趣                              34\n第10课 识别公共标志                          22\n第11课 环保标志设计                          24\n\n第17课 彩泥面塑                             36\n第18课 泥板浮雕 ①②                             38\n\n第12课 生活提示卡                         26\n\n7\n5\n\n第七单元\n\n感受中国传统\n文化\n\n第五单元\n\n绘画与印刷\n\n第13课 黑白纸版画	 \n\n第19课 龙舞神州                          42\n第20课 彩狮呈祥                         44\n\n28\n\n第14课 彩色纸版画                      30\n\n世界遗产之旅\n孔庙  孔林  孔府                46\n\n第\n课题的拓展\n\n1\n\n课\n\n我爱我家乡①\n\n我的家乡四季分明，春天野花遍地，夏天绿荫如盖，\n秋天红叶似火，冬天是一片白茫茫的冰雪世界——四季风\n光各不相同，我们就是在这里一天天长大的。\n\n独特的自然景观\n\n长白山天池\n\n吉林雾凇\n\n古老的建筑\n\n黑龙江扎龙自然保护区的丹顶鹤,2.0,义务教育教科书·美术四年级上册,0,991,2025-07-21T14:23:56.257Z,2.0,2025-07-18T13:45:37.947Z,四年级,[object Object],node-poppler,unknown,0.8161925601750547,0.5,1,,,,,true,,,general,上册,/Users/LeoQin/Documents/GitHub/PDFconvertor/training_data/小学/美术/辽海版/义务教育教科书·美术四年级上册.pdf,义务教育教科书·美术四年级上册.json,美术,9070
义务教育教科书·美术四年级上册_chunk_1,1,世界遗产之旅孔庙孔林孔府 46 第课题的拓展 1 课我爱我家乡我的家乡四季分明，春天野花遍地，夏天绿荫如盖， 秋天红叶似火，冬天是一片白茫茫的冰雪世界四季风光各不相同，我们就是在这里一天天长大的。 独特的自然景观长白山天池吉林雾凇古老的建筑黑龙江扎龙自然保护区的丹顶鹤丰富的自然和文化遗产辽阳白塔 2 沈阳清福陵北方绿色森林城市沈阳（摄影） 刘亚东学习建议 1 去寻找家乡独特的美丽，拍摄下来或用绘画的方式表现出来。 2 用收集到的图片、自己拍摄的摄影作品、绘画作品，举办一个家乡风光展。 每天都在变化的社区环境学生作品学生摄影作品每一个地方都有独特的自然风光，这是由该地区地表形态和气候特征形成的。了解家乡的景色，体验生活中的美好事物，是美术学习的重要手段。 农家乐 3 课题的拓展第 1 课我爱我家 乡有朋自远方来， 不亦乐乎? 请你做导游，并设计家乡一日游的参观路线图。 自选图片最好玩的地方 （摄影或绘画作品） 自选图片最_______的地方最美丽的地方 （摄影或绘画作品） 最_______的地方如图所示，在图下标出最 的地方。一定要注明你认为有污染的地方。 自选图片 （摄影或绘画作品） 你认为有污染的地方 4 学习建议 1 以保护古代文物或现代生存环境为主题，请你向市长提一条市民建议。 2 参考例图，按照坐标方向，根发现王国夜景据提示和建议设计旅游路线， 力求简洁、顺畅。 酷乐城堡特色演出游乐园路标指示牌幻影之魅疯狂小镇疯狂眼镜蛇水上大冲撞发现王国导游图拓展ABC 这些公共设施的标志，你能说出它们都代表什么含义吗？ 5 第一单元形色体验 2 第课 冷色与暖色造型表现我们生活在一个色彩缤纷的世界里，对色彩像老朋友一样熟悉。但是，你能说出什么是冷色和暖色吗？认识了这些，我们会更加敏锐地感受到色彩的美，解读色彩的秘密，并且能够更加自如地运用它们。 蓝色交响曲你知道色相环中哪些是冷色，哪些是暖色吗？ 拓展ABC 温暖的小屋 6 色彩的明度、纯度、色相,834,0.6631902985074626,medium,text-extracted,世界遗产之旅\n孔庙  孔林  孔府                46\n\n第\n课题的拓展\n\n1\n\n课\n\n我爱我家乡①\n\n我的家乡四季分明，春天野花遍地，夏天绿荫如盖，\n秋天红叶似火，冬天是一片白茫茫的冰雪世界——四季风\n光各不相同，我们就是在这里一天天长大的。\n\n独特的自然景观\n\n长白山天池\n\n吉林雾凇\n\n古老的建筑\n\n黑龙江扎龙自然保护区的丹顶鹤\n\n丰富的自然和文化遗产\n\n辽阳白塔\n\n2\n\n沈阳清福陵\n\n北方绿色森林城市沈阳（摄影） 刘亚东\n学习建议\n\n1 去寻找家乡独特的美丽，拍摄下来或用绘画\n的方式表现出来。\n2 用收集到的图片、自己拍摄的摄影作品、绘\n画作品，举办一个家乡风光展。\n\n每天都在变化的社区环境\n\n学生作品\n\n学生摄影作品\n\n每一个地方都有独特的自然风光，这是由该地区地\n表形态和气候特征形成的。了解家乡的景色，体验生活\n中的美好事物，是美术学习的重要手段。\n农家乐\n\n3\n\n课题的拓展\n\n第\n\n1\n\n课\n\n我爱我 家 乡 ②\n\n“有朋自远方来，\n不亦乐乎?”请你做导\n游，并设计家乡一日游\n的参观路线图。\n\n自选图片\n\n●最好玩的地方\n\n（摄影或绘画作品）\n自选图片\n●最_______的地方\n\n●最美丽的地方\n\n（摄影或绘画作品）\n\n●最_______的地方\n\n如图所示，在图下标出“最⋯⋯的地\n方”。一定要注明你认为有污染的地方。\n\n自选图片\n（摄影或绘画作品）\n\n●你认为有污染的地方\n\n4\n\n学习建议\n\n1 以保护古代文物或现代生存环\n境为主题，请你向市长提一条\n市民建议。\n2 参考例图，按照坐标方向，根\n\n“发现王国”夜景\n\n据提示和建议设计旅游路线，\n力求简洁、顺畅。\n\n酷乐城堡\n\n特色演出\n\n游乐园路标指示牌\n\n幻影之魅\n\n疯狂小镇\n\n疯狂眼镜蛇\n水上大冲撞\n\n“发现王国”导游图\n\n拓展ABC\n这些公共设施的标\n志，你能说出它们都代表\n什么含义吗？\n\n5\n\n第一单元 形色体验\n\n2\n\n第\n\n课 冷色与暖色\n\n造型·表现\n\n我们生活在一个色彩缤纷的世界里，对色彩像老朋\n友一样熟悉。但是，你能说出什么是冷色和暖色吗？认\n识了这些，我们会更加敏锐地感受到色彩的美，解读色\n彩的秘密，并且能够更加自如地运用它们。\n\n蓝色交响曲\n\n你知道色相环中哪些是\n冷色，哪些是暖色吗？\n\n拓展ABC\n\n温暖的小屋\n\n6\n\n色彩的明度、纯度、色相,2.0,义务教育教科书·美术四年级上册,1,993,2025-07-21T14:23:56.257Z,2.0,2025-07-18T13:45:37.947Z,四年级,[object Object],node-poppler,unknown,0.889030612244898,0.5,1,,,,,true,true,,geography,上册,/Users/LeoQin/Documents/GitHub/PDFconvertor/training_data/小学/美术/辽海版/义务教育教科书·美术四年级上册.pdf,义务教育教科书·美术四年级上册.json,美术,9070
义务教育教科书·美术四年级上册_chunk_2,2,5 第一单元形色体验 2 第课 冷色与暖色造型表现我们生活在一个色彩缤纷的世界里，对色彩像老朋友一样熟悉。但是，你能说出什么是冷色和暖色吗？认识了这些，我们会更加敏锐地感受到色彩的美，解读色彩的秘密，并且能够更加自如地运用它们。 蓝色交响曲你知道色相环中哪些是冷色，哪些是暖色吗？ 拓展ABC 温暖的小屋 6 色彩的明度、纯度、色相明度：色彩的明暗、深浅程度称为明度。 纯度：色彩的饱和程度称为纯度。 用冷色调装饰的房间红色和蓝色交织的点点冷暖的颜色是相对的，是与周围环境的颜色相比较而言的。 用暖色调装饰的房间学生作品学习建议 1 观察并举例说明自然和生活中的冷色和暖色。 色相：指色彩所呈现出来的相貌，如红、黄、蓝。 2 用水粉色或水彩、蜡笔等绘画工具做色彩的冷暖练习。 7 第一单元形色体验 3 色彩的对比与和 谐第 造型表现课 世界上没有完全孤立的色彩，色彩因对比而存在，因和谐而美好。 红和绿、黄和紫，都是最强烈的对比色。对比的色彩，给人鲜明、强烈的感觉。 蓝和绿、红和橙，则是色相比较接近、关系比较和谐的色彩。和谐的色彩，给人温馨、层次丰富的感觉。 彩塑卧虎中国民间装饰不同色彩风格的家居设计无论是生活用品上的色彩还是绘画和设计上的色彩，对比与和谐都必不可少。 2012 年伦敦奥运会吉祥物 8 假面舞会的化装 1 （漫画） 卜劳恩（德国） 填色练习教师示范作品学习建议 1 说一说本课范例中，哪些是对比色，哪些是和谐色。 2 任意选择一幅漫画，做色彩填色练习。 彩绘汽车 3 任意选择图形，做色彩对比与和谐练习。 学生作品电脑填色作品 9 第一单元形色体验 4 四季的感受第 造型表现课 现代生活越来越离不开电脑，电脑绘画也广泛地应用于更多的领域。 现在，把你对四季的感受用简单、鲜明的色彩来画一下吧，一定会有新的体验。 方法导引 1 运行画图程序， 单击开始程序附件画 图。 2 选择铅笔工具，画出单色稿，确定画面景物的位置。 用电脑绘画前，先在图画纸 4 3 10 用铅笔工具，填画其他画面内容。,857,0.6850260223048327,medium,text-extracted,5\n\n第一单元 形色体验\n\n2\n\n第\n\n课 冷色与暖色\n\n造型·表现\n\n我们生活在一个色彩缤纷的世界里，对色彩像老朋\n友一样熟悉。但是，你能说出什么是冷色和暖色吗？认\n识了这些，我们会更加敏锐地感受到色彩的美，解读色\n彩的秘密，并且能够更加自如地运用它们。\n\n蓝色交响曲\n\n你知道色相环中哪些是\n冷色，哪些是暖色吗？\n\n拓展ABC\n\n温暖的小屋\n\n6\n\n色彩的明度、纯度、色相\n\n明度：色彩的明暗、深\n浅程度称为明度。\n\n纯度：色彩的饱和\n程度称为纯度。\n\n用冷色调装饰的房间\n\n红色和蓝色交织的点点\n\n冷暖的颜色是\n相对的，是与周围\n环境的颜色相比较\n而言的。\n\n用暖色调装饰的房间\n\n学生作品\n\n学习建议\n\n1 观察并举例说明自然和生活\n中的冷色和暖色。\n色相：指色彩所呈现出\n来的相貌，如红、黄、蓝。\n\n2 用水粉色或水彩、蜡笔等绘\n画工具做色彩的冷暖练习。\n\n7\n\n第一单元 形色体验\n\n3 色 彩的对比与 和 谐\n\n第\n\n造型·表现\n\n课\n\n世界上没有完全孤立的色\n彩，色彩因对比而存在，因和谐\n而美好。\n红和绿、黄和紫，都是最强\n烈的对比色。对比的色彩，给人\n鲜明、强烈的感觉。\n蓝和绿、红和橙，则是色\n相比较接近、关系比较和谐的色\n彩。和谐的色彩，给人温馨、层\n次丰富的感觉。\n\n彩塑卧虎 中国民间装饰\n不同色彩风格的家居设计\n\n无论是生活用品上的色彩还是绘\n画和设计上的色彩，对比与和谐都必\n不可少。\n2012 年伦敦奥运会吉祥物\n\n8\n\n假面舞会的化装 1\n（漫画）\n卜劳恩（德国）\n\n填色练习\n教师示范\n作品\n\n学习建议\n\n1 说一说本课范例中，哪些是对比色，哪\n些是和谐色。\n2 任意选择一幅漫画，做色彩填色练习。\n彩绘汽车\n\n3 任意选择图形，做色彩对比与和谐练习。\n\n学生作品\n\n电脑填色作品\n\n9\n\n第一单元 形色体验\n\n4 四 季的感受\n\n第\n\n造型·表现\n\n课\n\n现代生活越来越离不开电脑，电\n脑绘画也广泛地应用于更多的领域。\n现在，把你对四季的感受用简单、鲜\n明的色彩来画一下吧，一定会有新的\n体验。\n\n方法导引\n\n1\n\n运行“画图”程序，\n单击开始—程序—附件—画\n图。\n\n2\n\n选择“铅笔”工具，画\n出单色稿，确定画面景物的\n位置。\n\n用电脑绘画\n前，先在图画纸\n\n4\n3\n\n10\n\n用“铅笔”工具，填画\n其他画面内容。,2.0,义务教育教科书·美术四年级上册,2,984,2025-07-21T14:23:56.257Z,2.0,2025-07-18T13:45:37.947Z,四年级,[object Object],node-poppler,unknown,0.8779874213836478,0.6,1,,true,true,,true,true,,biology,上册,/Users/LeoQin/Documents/GitHub/PDFconvertor/training_data/小学/美术/辽海版/义务教育教科书·美术四年级上册.pdf,义务教育教科书·美术四年级上册.json,美术,9070
义务教育教科书·美术四年级上册_chunk_3,3,第造型表现课 现代生活越来越离不开电脑，电脑绘画也广泛地应用于更多的领域。 现在，把你对四季的感受用简单、鲜明的色彩来画一下吧，一定会有新的体验。 方法导引 1 运行画图程序， 单击开始程序附件画 图。 2 选择铅笔工具，画出单色稿，确定画面景物的位置。 用电脑绘画前，先在图画纸 4 3 10 用铅笔工具，填画其他画面内容。 使用刷子工具， 把需要加粗的线画粗，调整刷子的大小可在下部的选区内，选择合适的笔刷。 上画好图样。 电脑示范图例：春、夏、秋、冬学习建议想一想，哪个季节的景色给你的印象最深刻呢？在心里先把它概括为简单的色彩，然后用电脑表现出来。 拓展 ABC 春、夏、秋、冬学生作品 11 第二单元感知与模仿 5 感觉肌理第 造型表现课 肌理是指各种物质表面粗细不同的纹理。你周围的各种物质表面具有怎样特殊的肌理？你注意到没有？去观察寻找，并且摸一摸，感受一下它们的不同之处。 人工肌理肌理在基础设计中应纺织品用广泛，表现方法很多， 主要分为视觉肌理和触觉肌理两类。 自然肌理木材 12 贝壳杨树松树学习建议拓展ABC 1 观察并亲手触摸各种物质的肌理，谈谈各自的感受。 2 尝试用画、印等不同方法去感知与模仿物体肌理的奇妙。 纸艺二号杨 沃斯（美国） 具有独特肌理效果的纸艺作品。 方法导引 1 准备颜料、盛水的容器。 2 把颜料挤在水里，融合。 3 用宣纸上蘸染融合的颜色。 13 13 第二单元感知与模仿 6 美妙的拼贴画第 设计应用课 不同 的物体表 面有 着不同 的纹 理，有的粗糙，有的细腻，有的轻薄，有的厚重，千变万化。除了观察了解，还可以利用它们设计并制作出美妙的作品。 海关检查官切玛耶夫（捷克） 选择材料时要注意颜色教师示范作品（金属铝） 教师示范作品（金属、瓦楞纸） 14 的对比，整体和局部搭配要和谐、明快。 教师示范作品（金属铝） 快乐的课堂学习建议 1 用多种不同的材料， 完成一件平面或半立体拼贴作品。 2 看看谁的作品材料选用得巧妙、谁的构思新奇。 方法导引,851,0.6469385194479297,medium,text-extracted,第\n\n造型·表现\n\n课\n\n现代生活越来越离不开电脑，电\n脑绘画也广泛地应用于更多的领域。\n现在，把你对四季的感受用简单、鲜\n明的色彩来画一下吧，一定会有新的\n体验。\n\n方法导引\n\n1\n\n运行“画图”程序，\n单击开始—程序—附件—画\n图。\n\n2\n\n选择“铅笔”工具，画\n出单色稿，确定画面景物的\n位置。\n\n用电脑绘画\n前，先在图画纸\n\n4\n3\n\n10\n\n用“铅笔”工具，填画\n其他画面内容。\n\n使用“刷子”工具，\n把需要加粗的线画粗，调整\n“刷子”的大小可在下部的\n选区内，选择合适的笔刷。\n\n上画好图样。\n\n电脑示范图例：春、夏、秋、冬\n\n学习建议\n\n想一想，哪个季节的景色给你的印象最深刻\n呢？在心里先把它概括为简单的色彩，然后用电脑\n表现出来。\n\n拓展 ABC\n\n春、夏、秋、冬\n\n学生作品\n\n11\n\n第二单元\n\n感知与模仿\n\n5 感 觉肌理\n\n第\n\n造型·表现\n\n课\n\n肌理是指各种物质表面\n粗细不同的纹理。你周围的各\n种物质表面具有怎样特殊的肌\n理？你注意到没有？去观察寻\n找，并且摸一摸，感受一下它\n们的不同之处。\n\n人工肌理\n\n肌理在基础设计中应\n纺织品\n\n用广泛，表现方法很多，\n主要分为视觉肌理和触觉\n肌理两类。\n\n自然肌理\n\n木材\n\n12\n\n贝壳\n\n杨树\n\n松树\n\n学习建议\n\n拓展ABC\n\n1 观察并亲手触摸各种\n物质的肌理，谈谈各\n自的感受。\n2 尝试用画、印等不同\n方法去感知与模仿物\n体肌理的奇妙。\n\n纸艺二号 杨·沃斯（美国）\n具有独特肌理效果的纸\n艺作品。\n\n方法导引\n\n1\n\n准备颜料、盛水的容器。\n\n2\n\n把颜料挤在水里，融合。\n\n3 用宣纸上蘸染融合的颜色。\n13\n13\n\n第二单元\n\n感知与模仿\n\n6 美 妙的拼贴画\n\n第\n\n设计·应用\n\n课\n\n不 同 的 物体 表 面 有 着不 同 的 纹\n理，有的粗糙，有的细腻，有的轻\n薄，有的厚重，千变万化。除了观察\n了解，还可以利用它们设计并制作出\n美妙的作品。\n\n海关检查官 切玛耶夫（捷克）\n\n选择材料时要注意颜色\n教师示范作品（金属铝）\n\n教师示范作品（金属、瓦楞纸）\n\n14\n\n的对比，整体和局部搭配要\n和谐、明快。\n\n教师示范作品（金属铝）\n\n快乐的课堂\n学习建议\n\n1 用多种不同的材料，\n完成一件平面或半立\n体拼贴作品。\n2 看看谁的作品材料选\n用得巧妙、谁的构思\n新奇。\n\n方法导引,2.0,义务教育教科书·美术四年级上册,3,995,2025-07-21T14:23:56.257Z,2.0,2025-07-18T13:45:37.947Z,四年级,[object Object],node-poppler,unknown,0.8641025641025641,0.5,1,,true,true,,true,true,,general,上册,/Users/LeoQin/Documents/GitHub/PDFconvertor/training_data/小学/美术/辽海版/义务教育教科书·美术四年级上册.pdf,义务教育教科书·美术四年级上册.json,美术,9070
