Chunk_ID,Chunk_Index,Content,Content_Length,Quality_Score,Reliability,Source_Type,Original_Content,Enhancement_Version,book_name,chunkIndex,chunkSize,enhancementTimestamp,enhancementVersion,extractedAt,grade,loc_lines,method,publisher,qualityMetrics_chineseCharRatio,qualityMetrics_coherenceScore,qualityMetrics_lengthScore,qualityMetrics_ocrConfidence,semanticFeatures_hasDefinition,semanticFeatures_hasExperiment,semanticFeatures_hasFormulas,semanticFeatures_hasNumbers,semanticFeatures_hasQuestion,semanticFeatures_isTableContent,semanticFeatures_subjectArea,semester,source,source_file,subject,textLength
义务教育教科书·音乐（简谱）五年级下册_chunk_0,0,义务 教育 教科 书五年级下册简谱义 务教 育教 科书 设计制作南京山石卡通艺术有限公司封面设计程国庆制 南京凯建图文制作有限公司谱 责任编辑陈静星音 乐孙 旭五 年级 下册 简谱 江苏 凤凰 少年 儿童 出版 社 产品定价：7.61元江苏凤凰少年儿童出版社少年，少年，祖国的春天李幼容词 寄明 曲中速、稍快 1. 2. 3. 3. 1.2. 2. 3. 义务 教育 教科 书简谱五年级下册江苏凤凰少年儿童出版社目 第一单元录 童声中国娃 1 童声里的中国草原小姐妹（一）草原放牧好一个土娃子草原赞歌律动（童声里的中国） 综合表演（好一个土娃子） 律动（草原赞歌） 竖笛练习（一） 成长的足迹第二单元绿海林涛声 8 美丽的喀纳斯湖（选段） 森林狂想曲银色的桦树林绿色的祖国集体舞（绿色的祖国） 竖笛练习（二） 成长的足迹第三单元梨园英秀 14 京调急急风梨园英秀谁说女子不如男露一手竖笛练习（三） 成长的足迹第四单元田园交响曲 20 F大调第六（田园）交响曲第一乐章 （选段） 踩花山致春天田野在召唤红蜻蜓竖笛练习（四） 成长的足迹第五单元荡漾的深情 26 蓝色多瑙河海滨音诗划船歌外婆的澎湖湾竖笛练习（五） 成长的足迹第六单元情系江淮 32 情系江淮花鼓拔根芦柴花凤阳花鼓我的编创（花鼓） 竖笛练习（六） 成长的足迹第七单元左手与右手 38 爱的喜悦第一交响曲第三乐章（选段） 左手右手萤火虫律动（爱的喜悦） 竖笛练习（七） 成长的足迹第八单元百鸟朝凤 44 百鸟朝凤一只鸟仔未孵化的鸟雏的舞蹈一只鸟仔斑鸠调综合表演（一只鸟仔） 律动（斑鸠调） 竖笛练习（八） 成长的足迹口琴音乐小书夹旋转舞台补充歌曲配乐故事 52 54 56 58 59 童声里的中国童 声合 唱充满朝气地杨德祥词 戚建波曲 第一单元童声中国娃别笑我们土， 脚下踩着文明的高坡； 别说我们小， 口中唱着英雄的赞歌。 童声里的中国娃， 是祖国未来的寄托。,812,0.6819400544959128,medium,text-extracted,义 务 教 育 教 科 书\n\n五年级\n\n下册\n\n简谱\n\n义\n务\n教\n育\n教\n科\n书\n\n设计制作\n\n南京山石卡通艺术有限公司\n\n封面设计\n\n程国庆\n\n制\n\n南京凯建图文制作有限公司\n\n谱\n\n责任编辑\n\n陈静星\n\n音\n乐\n\n孙 旭\n\n五\n年\n级\n下\n册\n\n简\n谱\n\n江\n苏\n凤\n凰\n少\n年\n儿\n童\n出\n版\n社\n\n绿色印刷产品\n定价：7.61元\n\n江苏凤凰少年儿童出版社\n\n少年，少年，祖国的春天\n李幼容 词\n寄 明 曲\n\n中速、稍快\n\n1.\n2.\n3.\n\n3.\n\n1.2.\n\n2.\n3.\n\n义 务 教 育 教 科 书\n\n简谱\n五年级 下册\n\n江苏凤凰少年儿童出版社\n\n目\n第一单元\n\n录\n童声中国娃 1\n\n童声里的中国\n草原小姐妹（一）草原放牧\n好一个土娃子 草原赞歌\n律动（童声里的中国）\n综合表演（好一个土娃子）\n律动（草原赞歌）\n竖笛练习（一）\n成长的足迹\n\n第二单元\n\n绿海林涛声\n\n8\n\n美丽的喀纳斯湖（选段） 森林狂想曲\n银色的桦树林 绿色的祖国\n集体舞（绿色的祖国）\n竖笛练习（二）\n成长的足迹\n\n第三单元 梨园英秀\n\n14\n\n京调 急急风\n梨园英秀 谁说女子不如男\n露一手\n竖笛练习（三）\n成长的足迹\n\n第四单元 田园交响曲\n\n20\n\nF大调第六（田园）交响曲第一乐章 （选段）\n踩花山 致春天\n田野在召唤 红蜻蜓\n竖笛练习（四）\n成长的足迹\n\n第五单元\n\n荡漾的深情 26\n蓝色多瑙河 海滨音诗\n划船歌 外婆的澎湖湾\n竖笛练习（五）\n成长的足迹\n\n第六单元\n\n情系江淮 32\n情系江淮 花鼓\n拔根芦柴花 凤阳花鼓\n我的编创（花鼓）\n竖笛练习（六）\n成长的足迹\n\n第七单元\n\n左手与右手 38\n爱的喜悦 第一交响曲第三乐章（选段）\n左手右手 萤火虫\n律动（爱的喜悦）\n竖笛练习（七）\n成长的足迹\n\n第八单元\n\n百鸟朝凤\n\n44\n\n百鸟朝凤\n\n一只鸟仔\n\n未孵化的鸟雏的舞蹈\n\n一只鸟仔 斑鸠调\n综合表演（一只鸟仔）\n律动（斑鸠调）\n竖笛练习（八）\n成长的足迹\n口琴\n音乐小书夹\n旋转舞台\n补充歌曲\n配乐故事\n\n52\n54\n56\n58\n59\n\n童声里的中国\n童 声 合 唱\n\n充满朝气地\n\n杨德祥 词\n戚建波 曲\n\n第一单元\n童声中国娃\n别笑我们土，\n脚下踩着\n文明的高坡；\n别说我们小，\n口中唱着\n英雄的赞歌。\n童声里的中国娃，\n是祖国\n未来的寄托。,2.0,义务教育教科书·音乐（简谱）五年级下册,0,991,2025-07-21T14:24:43.079Z,2.0,2025-07-18T13:55:50.989Z,五年级,[object Object],node-poppler,unknown,0.8669410150891632,0.6,1,,,,,true,,,unknown,下册,/Users/LeoQin/Documents/GitHub/PDFconvertor/training_data/小学/音乐/苏少版（简谱）/义务教育教科书·音乐（简谱）五年级下册.pdf,义务教育教科书·音乐（简谱）五年级下册.json,音乐,9936
义务教育教科书·音乐（简谱）五年级下册_chunk_1,1,一只鸟仔斑鸠调综合表演（一只鸟仔） 律动（斑鸠调） 竖笛练习（八） 成长的足迹口琴音乐小书夹旋转舞台补充歌曲配乐故事 52 54 56 58 59 童声里的中国童 声合 唱充满朝气地杨德祥词 戚建波曲 第一单元童声中国娃别笑我们土， 脚下踩着文明的高坡； 别说我们小， 口中唱着英雄的赞歌。 童声里的中国娃， 是祖国未来的寄托。 跟着音乐轻声哼唱，体会歌曲的情绪。 律动 童声里的中国听到部分的音乐时，和着音乐做下面的律动。当乐句重复时变换动作与方向。 左右 左右 左右 左右 为歌曲的第二部分音乐设计动作，随音乐律动。 1 好一个土娃子魏 岚词 王原平曲 调皮地 1. 2. 1. 2 2. 综合表演好一个土娃子唱 选择合适的声音和演唱形式表现歌曲调皮、天真的情绪。 念按节奏有表情地念歌词，并配上合适的打击乐器伴奏。 创 1. 了解土娃子的生活，为歌曲设计合适的动作。 2. 在歌曲中四分休止符处设计动作或衬词，加入表演。 按上面的形式，和同学合作设计一个表演顺序，唱一唱，演一演。 3 草原赞歌中速、稍快 4 巴布林贝赫词 吴应 炬曲 草原小姐妹 （一）草原放牧琵琶协奏曲主题一活跃地吴祖强王艳樵刘德海曲 主题二行板 1. 通过演唱和聆听，你发现《草原赞歌》和《草原小姐妹》 主题一之间的联系了吗？说说你的感受。 2. 聆听并区分乐曲主题一和主题二，它们在速度和节奏上分别有什么特点？试着用体态或线条把心中的感受表现出来。 5 律动 草原赞歌学习几个蒙古族舞蹈的典型动作，再根据《草原小姐妹》主题一、主题二音乐的特点，随音乐舞动起来。 6 竖笛练习（一） 慢板悠扬地王和声《草原牧歌》 略说琵琶成长的足迹一、先跟琴视唱下面的旋律，再听辨它在《草原小姐妹》第一部分中出现了几次？分别以怎样的形式出现的？ 琵琶主奏琵琶是我国代表性民族乐器之一。音域广，演奏技巧丰富，表现力强。南北朝时经西域传入的曲项琵琶到唐代定 型。 《草原小姐妹》开创了琵琶与管弦乐队协奏之先河。 乐队协奏,839,0.6836748387096774,medium,text-extracted,一只鸟仔 斑鸠调\n综合表演（一只鸟仔）\n律动（斑鸠调）\n竖笛练习（八）\n成长的足迹\n口琴\n音乐小书夹\n旋转舞台\n补充歌曲\n配乐故事\n\n52\n54\n56\n58\n59\n\n童声里的中国\n童 声 合 唱\n\n充满朝气地\n\n杨德祥 词\n戚建波 曲\n\n第一单元\n童声中国娃\n别笑我们土，\n脚下踩着\n文明的高坡；\n别说我们小，\n口中唱着\n英雄的赞歌。\n童声里的中国娃，\n是祖国\n未来的寄托。\n\n跟着音乐轻声哼唱，体会歌曲的情绪。\n\n律  动 童声里的中国\n听到\n部分的音乐时，和着音乐做下面的律动。当乐句\n重复时变换动作与方向。\n\n左 右 左 右\n\n左 右\n\n左 右\n\n为歌曲的第二部分音乐设计动作，随音乐律动。\n\n1\n\n好一个土娃子\n魏 岚 词\n王原平 曲\n\n调皮地\n\n1.\n2.\n\n1.\n\n2\n\n2.\n\n综合表演 好一个土娃子\n\n唱\n\n选择合适的声\n音和演唱形式\n\n表现歌曲调皮、天真\n的情绪。\n\n念\n\n按节奏有表情\n地念歌词，并\n\n配上合适的打击乐器\n伴奏。\n\n创\n\n1. 了解土娃子\n的生活，为歌\n\n曲设计合适的动作。\n2. 在歌曲中四分\n休止符处设计动作或\n衬词，加入表演。\n\n按上面的形式，和同学合作设计一个表演顺序，唱一唱，演\n一演。\n\n3\n\n草原赞歌\n中速、稍快\n\n4\n\n巴·布林贝赫 词\n吴\n应 炬 曲\n\n草原小姐妹\n（一）草原放牧\n琵琶协奏曲\n主题一\n\n活跃地\n\n吴祖强 王艳樵 刘德海 曲\n\n主题二\n\n行板\n\n1. 通过演唱和聆听，你发现《草原赞歌》和《草原小姐妹》\n主题一之间的联系了吗？说说你的感受。\n2. 聆听并区分乐曲主题一和主题二，它们在速度和节奏上分\n别有什么特点？试着用体态或线条把心中的感受表现出来。\n\n5\n\n律  动 草原赞歌\n学习几个蒙古族舞蹈的典型动作，再根据《草原小姐妹》主\n题一、主题二音乐的特点，随音乐舞动起来。\n\n6\n\n竖笛练习（一）\n慢板 悠扬地\n\n王和声《草原牧歌》\n\n略说琵琶\n\n成长的足迹\n一、先跟琴视唱下面的旋律，再听辨它在《草原小姐\n妹》第一部分中出现了几次？分别以怎样的形式出现的？\n\n琵琶主奏\n\n琵琶是我\n国代表性\n民族乐器\n之一。音\n域广，演\n奏技巧丰\n富，表现\n力强。南\n北朝时经\n西域传入\n的曲项琵\n琶到唐代\n定 型 。\n《草原小\n姐妹》开\n创了琵琶\n与管弦乐\n队协奏之\n先河。\n\n乐队协奏,2.0,义务教育教科书·音乐（简谱）五年级下册,1,987,2025-07-21T14:24:43.079Z,2.0,2025-07-18T13:55:50.989Z,五年级,[object Object],node-poppler,unknown,0.8699609882964889,0.6,1,,,,,true,true,,physics,下册,/Users/LeoQin/Documents/GitHub/PDFconvertor/training_data/小学/音乐/苏少版（简谱）/义务教育教科书·音乐（简谱）五年级下册.pdf,义务教育教科书·音乐（简谱）五年级下册.json,音乐,9936
义务教育教科书·音乐（简谱）五年级下册_chunk_2,2,竖笛练习（一） 慢板悠扬地王和声《草原牧歌》 略说琵琶成长的足迹一、先跟琴视唱下面的旋律，再听辨它在《草原小姐妹》第一部分中出现了几次？分别以怎样的形式出现的？ 琵琶主奏琵琶是我国代表性民族乐器之一。音域广，演奏技巧丰富，表现力强。南北朝时经西域传入的曲项琵琶到唐代定 型。 《草原小姐妹》开创了琵琶与管弦乐队协奏之先河。 乐队协奏二、听辨录音片段的曲名，说一说音乐情绪的特点。 1 2 3 4 7 美丽的喀纳斯湖（选段） 交响 音画 选自《喀纳斯湖》组曲中速、稍慢龚耀年曲 第二单元绿海林涛声遥望银色的桦树林， 泛舟美丽的喀纳斯。 绿海涛声奏响了森林的狂想： 我们要让绿色的祖国更绿！更美！ 1. 完整地欣赏乐曲，听一听，主题旋律出现了几次，随音乐轻声哼唱。 2. 主题每次出现时有什么变化？谈谈你的感受。 在我国新疆北端，中、俄、蒙三国接壤的边境，有一个美丽的高山湖喀 纳斯湖。这里悬崖耸立，森林茂密，湖水湛蓝，如诗如画，还流传着许多神奇的传说，令人神往。 8 银色的桦树林深情地加 拿大 民歌小 麦译配陆 斯配歌 1. 2. 3. 1. 跟老师的琴声，划拍视唱歌谱。 2. 用下面的方式为全曲伴唱。 9 绿色的祖国中板优美、活泼地 1. 2. 3. 在色块处用不同的力度重复唱一唱前一小节。 10 管桦 词郑律成曲 集体 舞绿色的祖国按歌曲中的色块提示，边唱边和同伴合作跳集体舞。 左右左右左右点左 右左点右左右点 内圈原地踏步， 外圈走，交换舞伴。 11 森林狂想曲器 乐合 奏主题一中速、稍快活跃地当主题一出现时，随音乐做上面的声势动作。 主题二舒展地 1. 模唱主题二，说说和主题一有什么不同。 2. 请用合适的动作表现主题二。 12 吴金黛曲 竖笛练习（二） 中速塔塔尔族民歌《在银色的月光下》片段绿色的文化含义成长的足迹一、完整地聆听《森林狂想曲》，用图形、色块等你喜欢的方式记录乐曲主题一和主题二出现的顺序。,813,0.672512683578104,medium,text-extracted,竖笛练习（一）\n慢板 悠扬地\n\n王和声《草原牧歌》\n\n略说琵琶\n\n成长的足迹\n一、先跟琴视唱下面的旋律，再听辨它在《草原小姐\n妹》第一部分中出现了几次？分别以怎样的形式出现的？\n\n琵琶主奏\n\n琵琶是我\n国代表性\n民族乐器\n之一。音\n域广，演\n奏技巧丰\n富，表现\n力强。南\n北朝时经\n西域传入\n的曲项琵\n琶到唐代\n定 型 。\n《草原小\n姐妹》开\n创了琵琶\n与管弦乐\n队协奏之\n先河。\n\n乐队协奏\n\n二、听辨录音片段的曲名，说一说音乐情绪的特点。\n1\n\n2\n\n3\n\n4\n\n7\n\n美丽的喀纳斯湖（选段）\n交 响 音 画\n选自《喀纳斯湖》组曲\n\n中速、稍慢\n\n龚耀年 曲\n\n第二单元\n绿海林涛声\n遥望\n银色的桦树林，\n泛舟\n美丽的喀纳斯。\n绿海涛声\n奏响了森林的狂想：\n我们要让绿色的祖国\n更绿！更美！\n\n1. 完整地欣赏乐曲，听一听，主题旋律\n出现了几次，随音乐轻声哼唱。\n2. 主题每次出现时有什么变化？谈谈你\n的感受。\n在我国新疆北端，中、俄、蒙三国\n接壤的边境，有一个美丽的高山湖——喀\n纳斯湖。这里悬崖耸立，森林茂密，湖水\n湛蓝，如诗如画，还流传着许多神奇的传\n说，令人神往。\n\n8\n\n银色的桦树林\n深情地\n\n加 拿 大 民歌\n小 麦 译配\n陆 斯 配歌\n\n1.\n2.\n3.\n\n1. 跟老师的琴声，划拍视唱歌谱。\n2. 用下面的方式为全曲伴唱。\n\n9\n\n绿色的祖国\n中板 优美、活泼地\n1.\n2.\n3.\n\n在色块处用不同的力度重复唱一唱前一小节。\n\n10\n\n管 桦 词\n郑律成 曲\n\n集 体 舞 绿色的祖国\n按歌曲中的色块提示，边唱边和同伴合作跳集体舞。\n\n左 右左 右左 右点\n\n左 右左 点右 左右 点\n\n内圈原地踏步，\n外圈走，交换舞伴。\n\n11\n\n森林狂想曲\n器 乐 合 奏\n主题一\n中速、稍快 活跃地\n\n当主题一出现时，随音乐做上面的声势动作。\n主题二\n舒展地\n\n1. 模唱主题二，说说和主题一有什么不同。\n2. 请用合适的动作表现主题二。\n12\n\n吴金黛 曲\n\n竖笛练习（二）\n\n中速\n\n塔塔尔族民歌《在银色的月光下》片段\n\n绿色的文\n化含义\n\n成长的足迹\n一、完整地聆听《森林狂想曲》，用图形、色块等你喜\n欢的方式记录乐曲主题一和主题二出现的顺序。,2.0,义务教育教科书·音乐（简谱）五年级下册,2,938,2025-07-21T14:24:43.079Z,2.0,2025-07-18T13:55:50.989Z,五年级,[object Object],node-poppler,unknown,0.8514056224899599,0.6,1,,,true,,true,true,,general,下册,/Users/LeoQin/Documents/GitHub/PDFconvertor/training_data/小学/音乐/苏少版（简谱）/义务教育教科书·音乐（简谱）五年级下册.pdf,义务教育教科书·音乐（简谱）五年级下册.json,音乐,9936
义务教育教科书·音乐（简谱）五年级下册_chunk_3,3,当主题一出现时，随音乐做上面的声势动作。 主题二舒展地 1. 模唱主题二，说说和主题一有什么不同。 2. 请用合适的动作表现主题二。 12 吴金黛曲 竖笛练习（二） 中速塔塔尔族民歌《在银色的月光下》片段绿色的文化含义成长的足迹一、完整地聆听《森林狂想曲》，用图形、色块等你喜欢的方式记录乐曲主题一和主题二出现的顺序。 绿色既有生命的含义， 也是春季的象征。绿色还代表和平、宁静 、 自然、成长与希望。 在当代， 绿色又成了生态文明建设的代名词。 二、选择合适的打击乐器，与同伴合作唱一唱、奏一奏 《银色的桦树林》。 13 京调 笛子与乐队主题一中速、稍快顾冠仁曲 第三单元梨园英秀梨园英秀， 誉满全球。 唱念做打， 生旦净丑。 文场武场， 粉墨春秋。 主题二中速、稍快 1. 请用图形、线条表现主题一和主题二。 2. 聆听全曲，上面两个主题是按照怎样的顺序出现的？它们在节奏、旋律上有什么不同？ 14 梨园英秀中速、稍快孟庆华词曲学几个戏曲的基本动作，练一练数板的技巧，边唱边表演。 15 谁说女子不如男朝气、潇洒地选自豫剧《花木兰》 16 仔细聆听范唱，模仿豫剧的唱腔和身段表演动作，随音乐唱一唱，演一演。 标此记号的音自然向下滑动到比它低的音。 下滑音记号 17 急急 风京 剧锣 鼓慢起渐快板鼓大大大 大大 大大 大大 大大 大大大大 匡匡 匡匡 匡匡 匡台 台台 台台 台台 台台 台台 七七 七七 七七 大锣匡 小锣钹 七七 在老师的指挥下念一念《急急风》。 大锣钹 小锣露 一手 跟着《急急风》学走圆场。 18 板鼓竖笛练习（三） 京调《西皮流水》 梨园故事成长的足迹一、划拍视唱下面的旋律。 二、说出下列京剧中常用打击乐器的名称，并和同学合作奏一奏《急急风》。,738,0.6778378378378378,medium,text-extracted,当主题一出现时，随音乐做上面的声势动作。\n主题二\n舒展地\n\n1. 模唱主题二，说说和主题一有什么不同。\n2. 请用合适的动作表现主题二。\n12\n\n吴金黛 曲\n\n竖笛练习（二）\n\n中速\n\n塔塔尔族民歌《在银色的月光下》片段\n\n绿色的文\n化含义\n\n成长的足迹\n一、完整地聆听《森林狂想曲》，用图形、色块等你喜\n欢的方式记录乐曲主题一和主题二出现的顺序。\n\n绿色既有\n生命的含\n义 ， 也\n是春季的\n象征。绿\n色还代表\n和平、宁\n静 、 自\n然、成长\n与希望。\n在当代，\n绿色又成\n了生态文\n明建设的\n代名词。\n\n二、选择合适的打击乐器，与同伴合作唱一唱、奏一奏\n《银色的桦树林》。\n\n13\n\n京\n\n调\n\n笛子与乐队\n主题一\n中速、稍快\n\n顾冠仁 曲\n\n第三单元\n梨园英秀\n梨园英秀，\n誉满全球。\n唱念做打，\n生旦净丑。\n文场武场，\n粉墨春秋。\n\n主题二\n中速、稍快\n\n1. 请用图形、线条表现主题一和主题二。\n2. 聆听全曲，上面两个主题是按照怎样\n的顺序出现的？它们在节奏、旋律上有什么\n不同？\n\n14\n\n梨园英秀\n中速、稍快\n\n孟庆华 词曲\n\n学几个戏曲的基本动作，练一练数板的技巧，边唱边表演。\n\n15\n\n谁说女子不如男\n朝气、潇洒地\n\n选自豫剧《花木兰》\n\nʽ\n\n16\n\nʽ\n\n仔细聆听范唱，模仿豫剧的唱腔和身段表演动作，随音乐唱\n一唱，演一演。\n\n标此记号的音自然向下滑动到比它低的音。\n\n下滑音记号\n\n17\n\n急 急 风\n京 剧 锣 鼓\n慢起渐快\n\n板鼓\n大大\n\n大 大 大 大 大 大\n\n大 大 大 大 大大\n\n大\n\n匡\n\n匡  \n\n匡 匡 匡 匡\n\n   \n\n匡\n\n  \n\n台 台 台 台 台 台\n\n台 台 台 台\n\n  \n\n台\n\n  \n\n  七\n\n七 七 七 七\n\n  \n\n七\n\n大锣\n匡  \n\n小锣\n钹\n七\n\n  七\n\n在老师的指挥下念一念《急急风》。\n\n大锣\n\n钹\n\n小锣\n\n露 一 手\n跟着《急急风》学走圆场。\n\n18\n\n板鼓\n\n竖笛练习（三）\n京调《西皮流水》\n\n梨园故事\n\n成长的足迹\n一、划拍视唱下面的旋律。\n\n二、说出下列京剧中常用打击乐器的名称，并和同学合\n作奏一奏《急急风》。,2.0,义务教育教科书·音乐（简谱）五年级下册,3,911,2025-07-21T14:24:43.079Z,2.0,2025-07-18T13:55:50.989Z,五年级,[object Object],node-poppler,unknown,0.858433734939759,0.6,1,,,true,,true,true,,mathematics,下册,/Users/LeoQin/Documents/GitHub/PDFconvertor/training_data/小学/音乐/苏少版（简谱）/义务教育教科书·音乐（简谱）五年级下册.pdf,义务教育教科书·音乐（简谱）五年级下册.json,音乐,9936
