Chunk_ID,Chunk_Index,Content,Content_Length,Quality_Score,Reliability,Source_Type,Original_Content,Enhancement_Version,book_name,chunkIndex,chunkSize,enhancementTimestamp,enhancementVersion,extractedAt,grade,loc_lines,method,publisher,qualityMetrics_chineseCharRatio,qualityMetrics_coherenceScore,qualityMetrics_lengthScore,qualityMetrics_ocrConfidence,semanticFeatures_hasDefinition,semanticFeatures_hasExperiment,semanticFeatures_hasFormulas,semanticFeatures_hasNumbers,semanticFeatures_hasQuestion,semanticFeatures_isTableContent,semanticFeatures_subjectArea,semester,source,source_file,subject,textLength
义务教育教科书·体育与健康教师用书六年级全一册_chunk_0,0,"义务教育教科书体育与健康 （第二版） 前言 《基础教育课程改革纲要（试行） 》指出：要积极鼓励高等院校、科研院所的专家、学者和优秀的中小学教师投身中小学课程教材改革。2008 年全国中小学体育教学指导委员会的部分委员，参与了对全国部分省、市的体育卫生专项督导工作，在与第一线的中小学体育教师的交往中，很多小学体育教师，特别是兼职的小学体育教师，反映在学校看不到小学体育教师用书，给他们的教学工作和业务提高带来了很多困难，迫切希望能编写一套能指导他们进行体育教学的教师用书。全国中小学体育教学指导委员会针对此种情况，组织部分专家和优秀体育教师，结合小学兼职体育教师的实际情况，编写了本套《小学体育教师教学用书》。2014 年根据义务教育《体育与健康课程标准》（2011 年版）进行了修订。 一、编写目的本书的编写目的，是为了帮助农村兼职小学体育教师上好体育课 , 不断提高小学体育教学质量。 二、编写指导思想本书编写的指导思想包括以下几个方面： 1．要贯彻落实健康第一的指导思想。体现现代教育和体育教学改革、发展的要求。促进小学生身心健康地发展，保证学生的运动安全。教学内容要活泼、健康，反映时代精神，具有创造性，激励学生积极向上，培养学生对体育的情感、态度和价值观。 2．要根据小学生的认知规律和身心发展的特点设计、组织和实施小学体育教学过程。 将《体育与健康课程标准》的理念、领域、不同水平目标寓小学体育教学教师用书的各篇教案之中。要根据教学内容的层次和系统以及学生年龄的逐步增长，有针对性地扬长补短， 促进学生身心的和谐发展。 3．要以义务教育《体育与健康课程标准》（2011 年版）的基本精神为依据。选择其中与小学特别是农村小学场地、器材和师资水平相适应的教学内容；各个学期各项教材内容的安排要相对集中并留有余地；文字表述，图例演示要顺应兼职小学体育教师对体育教学的实际需要；对小学兼职体育教师可能出现的困惑和必须的教学注意事项要给予明晰的提示，力争使每篇教案都能起到指导兼职体育教师上课的作用。 4．要促进发展，逐步形成教师的个性和特色。本书每篇教案所设定的教学目标、内 1",891,0.6759246575342466,medium,text-extracted,"义务教育教科书\n\n体育与健康\n（第二版）\n\n前\n\n言\n\n《基础教育课程改革纲要（试行）\n》指出 ：要“积极鼓励高等院校、科研院所的专家、学\n者和优秀的中小学教师投身中小学课程教材改革”\n。2008 年全国中小学体育教学指导委员会\n的部分委员，参与了对全国部分省、市的体育卫生专项督导工作，在与第一线的中小学体育\n教师的交往中，很多小学体育教师，特别是兼职的小学体育教师，反映在学校看不到小学体\n育教师用书，给他们的教学工作和业务提高带来了很多困难，迫切希望能编写一套能指导他\n们进行体育教学的教师用书。全国中小学体育教学指导委员会针对此种情况，组织部分专\n家和优秀体育教师，结合小学兼职体育教师的实际情况，编写了本套《小学体育教师教学用\n书》\n。2014 年根据义务教育《体育与健康课程标准》（2011 年版）进行了修订。\n一、编写目的\n本书的编写目的，是为了帮助农村兼职小学体育教师上好体育课 , 不断提高小学体育\n教学质量。\n二、编写指导思想\n本书编写的指导思想包括以下几个方面 ：\n1．要贯彻落实“健康第一”的指导思想。体现现代教育和体育教学改革、发展的要\n求。促进小学生身心健康地发展，保证学生的运动安全。教学内容要活泼、健康，反映时\n代精神，具有创造性，激励学生积极向上，培养学生对体育的情感、态度和价值观。\n2．要根据小学生的认知规律和身心发展的特点设计、组织和实施小学体育教学过程。\n将《体育与健康课程标准》的理念、领域、不同水平目标寓小学体育教学教师用书的各篇\n教案之中。要根据教学内容的层次和系统以及学生年龄的逐步增长，有针对性地扬长补短，\n促进学生身心的和谐发展。\n3．要以义务教育《体育与健康课程标准》（2011 年版）的基本精神为依据。选择其\n中与小学特别是农村小学场地、器材和师资水平相适应的教学内容 ；各个学期各项教材内\n容的安排要相对集中并留有余地 ；文字表述，图例演示要顺应兼职小学体育教师对体育教\n学的实际需要 ；对小学兼职体育教师可能出现的困惑和必须的教学注意事项要给予明晰的\n提示，力争使每篇教案都能起到指导兼职体育教师上课的作用。\n4．要促进发展，逐步形成教师的个性和特色。本书每篇教案所设定的教学目标、内\n\n1",2.0,义务教育教科书·体育与健康教师用书六年级全一册,0,927,2025-07-21T14:23:13.939Z,2.0,2025-07-18T13:35:16.460Z,六年级,[object Object],node-poppler,unknown,0.8876146788990825,0.5,1,,,,,true,,,physics,全一册,/Users/LeoQin/Documents/GitHub/PDFconvertor/training_data/小学/体育与健康/科学社版/义务教育教科书·体育与健康教师用书六年级全一册.pdf,义务教育教科书·体育与健康教师用书六年级全一册.json,体育,133375
义务教育教科书·体育与健康教师用书六年级全一册_chunk_1,1,容、组织教法、措施等都是示例性的，主要是为小学体育教师提供可操作的基本教学过程和思路，帮助他们上好体育课。随着教师教学实践经验的不断积累和丰富，授课教师在各个教学环节上都可发展和调整原有的教学策略，逐步形成教师个人的教学个性和教学特色。 另外，教案中所安排的教学内容，如小篮球、小足球或技巧和器材练习等，没有条件实施的学校，可根据学校的实际情况进行置换或调整。 三、本书的主要特点 1．本书是以课时计划（教案）的形式出现的。之所以采取这种形式，主要是因为 2001 年新的课程改革以来，小学体育课的教学时数有了很大的增加（小学 1、2 年级体育课时增加 1 倍，3 至 6 年级增加 1 课时），但专职体育教师没能得到及时补充，使得一大批爱好体育的文化课教师为了适应素质教育的要求，服从学校教育的整体需要，满怀热情地走进了兼职体育教师的行列，肩负起了体育教学的重任。为了帮助这些没有接受过专业体育培训的兼职体育教师，提高体育专业化水平，特编辑出版这套教案式的农村小学体育教师用书。 2．本书的作者，除部分教研员和院校的教师外，全部是北京市、天津市包括部分郊区县长期在第一线从事体育教学工作的体育教师撰写的。他们有着比较丰富的体育教学经验， 经过总结，把各个教学环节上需要注意的事项，把兼职体育教师在教学过程中可能出现的某些困惑，通过教学提示的办法，撰写在每一篇教案之中；把一些教学过程中必需掌握的体育基础知识，通过小知识栏目加以注明，使兼职体育教师可以边教边学，边学边教， 以不断提高小学体育教学的质量。 3．本书是结合全国广大小学体育教学的一般情况进行设计和编写的普适性教材，没有为学校留有自主安排的教材和课时。为了给地方留有一定的时间和空间，本册（六年级） 仅编写了 60％的教案，还有 40％的课时可作为各地自主安排的教材和课时（除节假日和风雨天外，每学期安排 15 周的体育实践课）没有编写教案。（如果有的地方感到地域性教材时数较多，也可以自行增加普适性教材的课时。） 4．每课教案教学步骤清晰，教法手段实用、简洁，对场地器材要求不高，针对兼职教师特点，随着教学过程进展，开发辅栏以提供必要的帮助，解除教师的困惑，启发教师的思路，开阔教师的眼界。 5．本册书对各项运动技能与体能的考核评价，都有明显、具体的标准，可操作性强， 以供教师参考。,974,0.7267547368421052,medium-high,text-extracted,容、组织教法、措施等都是示例性的，主要是为小学体育教师提供可操作的基本教学过程\n和思路，帮助他们上好体育课。随着教师教学实践经验的不断积累和丰富，授课教师在各\n个教学环节上都可发展和调整原有的教学策略，逐步形成教师个人的教学个性和教学特色。\n另外，教案中所安排的教学内容，如小篮球、小足球或技巧和器材练习等，没有条件实施\n的学校，可根据学校的实际情况进行置换或调整。\n三、本书的主要特点\n1．本书是以课时计划（教案）的形式出现的。之所以采取这种形式，主要是因为\n2001 年新的课程改革以来，小学体育课的教学时数有了很大的增加（小学 1、2 年级体育\n课时增加 1 倍，3 至 6 年级增加 1 课时），但专职体育教师没能得到及时补充，使得一大\n批爱好体育的文化课教师为了适应素质教育的要求，服从学校教育的整体需要，满怀热情\n地走进了兼职体育教师的行列，肩负起了体育教学的重任。为了帮助这些没有接受过专业\n体育培训的兼职体育教师，提高体育专业化水平，特编辑出版这套教案式的农村小学体育\n教师用书。\n2．本书的作者，除部分教研员和院校的教师外，全部是北京市、天津市包括部分郊区\n县长期在第一线从事体育教学工作的体育教师撰写的。他们有着比较丰富的体育教学经验，\n经过总结，把各个教学环节上需要注意的事项，把兼职体育教师在教学过程中可能出现的\n某些困惑，通过教学提示的办法，撰写在每一篇教案之中 ；把一些教学过程中必需掌握的\n体育基础知识，通过“小知识”栏目加以注明，使兼职体育教师可以边教边学，边学边教，\n以不断提高小学体育教学的质量。\n3．本书是结合全国广大小学体育教学的一般情况进行设计和编写的普适性教材，没\n有为学校留有自主安排的教材和课时。为了给地方留有一定的时间和空间，本册（六年级）\n仅编写了 60％的教案，还有 40％的课时可作为各地自主安排的教材和课时（除节假日和\n风雨天外，每学期安排 15 周的体育实践课）没有编写教案。（如果有的地方感到地域性教\n材时数较多，也可以自行增加普适性教材的课时。）\n4．每课教案教学步骤清晰，教法手段实用、简洁，对场地器材要求不高，针对兼职\n教师特点，随着教学过程进展，开发辅栏以提供必要的帮助，解除教师的困惑，启发教师\n的思路，开阔教师的眼界。\n5．本册书对各项运动技能与体能的考核评价，都有明显、具体的标准，可操作性强，\n以供教师参考。,2.0,义务教育教科书·体育与健康教师用书六年级全一册,1,993,2025-07-21T14:23:13.939Z,2.0,2025-07-18T13:35:16.460Z,六年级,[object Object],node-poppler,unknown,0.8892405063291139,0.7,1,,,,,true,,,physics,全一册,/Users/LeoQin/Documents/GitHub/PDFconvertor/training_data/小学/体育与健康/科学社版/义务教育教科书·体育与健康教师用书六年级全一册.pdf,义务教育教科书·体育与健康教师用书六年级全一册.json,体育,133375
义务教育教科书·体育与健康教师用书六年级全一册_chunk_2,2,材时数较多，也可以自行增加普适性教材的课时。） 4．每课教案教学步骤清晰，教法手段实用、简洁，对场地器材要求不高，针对兼职教师特点，随着教学过程进展，开发辅栏以提供必要的帮助，解除教师的困惑，启发教师的思路，开阔教师的眼界。 5．本册书对各项运动技能与体能的考核评价，都有明显、具体的标准，可操作性强， 以供教师参考。 6．为弘扬民族传统体育运动与文化，本书设立了资源库，以供教师结合本地区，本族特点，参考选用。,206,0.6551732673267326,medium,text-extracted,材时数较多，也可以自行增加普适性教材的课时。）\n4．每课教案教学步骤清晰，教法手段实用、简洁，对场地器材要求不高，针对兼职\n教师特点，随着教学过程进展，开发辅栏以提供必要的帮助，解除教师的困惑，启发教师\n的思路，开阔教师的眼界。\n5．本册书对各项运动技能与体能的考核评价，都有明显、具体的标准，可操作性强，\n以供教师参考。\n6．为弘扬民族传统体育运动与文化，本书设立了资源库，以供教师结合本地区，本\n族特点，参考选用。,2.0,义务教育教科书·体育与健康教师用书六年级全一册,2,209,2025-07-21T14:23:13.939Z,2.0,2025-07-18T13:35:16.460Z,六年级,[object Object],node-poppler,unknown,0.8564356435643564,0.5,1,,,,,true,,,physics,全一册,/Users/LeoQin/Documents/GitHub/PDFconvertor/training_data/小学/体育与健康/科学社版/义务教育教科书·体育与健康教师用书六年级全一册.pdf,义务教育教科书·体育与健康教师用书六年级全一册.json,体育,133375
义务教育教科书·体育与健康教师用书六年级全一册_chunk_3,3,2 四、教材的体系结构全套书共分为六册，每个年级一册。每个年级按上、下两个学期编写，每学期按上课的次数，逐课编写课时计划（教案）。 课时计划分为两个部分：第一部分，包括教材内容、教学目标和场地器材。第二部分，包括并列的主栏和辅栏，两个相互补充、相互依存的栏目。主栏：主要写教学过程： 包括：一般的上课常规、准备活动、主要教材、辅助教材、放松活动、结束语。辅栏：是配合和补充主栏写一些教学过程中教师可能注意不够的基本提示、教师遇到困惑时的解决建议和小知识等，使各个教学环节更加实用、活泼、有效。 3 目录 第一学期第1课体育与健康基础知识青春期卫生与科学锻炼：青春期卫生......................... 1 第2课技巧：有人扶持手倒立奔跑游戏：迎面接力跑. ............................................................................................. 4 第3课技巧：有人扶持手倒立奔跑游戏：障碍跑....................................................................................................... 8 第4课技巧：有人扶持手倒立篮球游戏：截空中球 ................................................................................................ 11 第5课技巧：有人扶持手倒立奔跑游戏：十字接力跑. ........................................................................................... 14 第6课技巧：有人扶持手倒立（考核） 篮球游戏：截空中球................................................................................................. 17 第7课,934,0.30645295404814,medium,text-extracted,2\n\n四、教材的体系结构\n全套书共分为六册，每个年级一册。每个年级按上、下两个学期编写，每学期按上课\n的次数，逐课编写课时计划（教案）。\n课时计划分为两个部分 ：第一部分，包括教材内容、教学目标和场地器材。第二部\n分，包括并列的主栏和辅栏，两个相互补充、相互依存的栏目。主栏 ：主要写教学过程 ：\n包括 ：一般的上课常规、准备活动、主要教材、辅助教材、放松活动、结束语。辅栏 ：是\n配合和补充主栏写一些教学过程中教师可能注意不够的基本提示、教师遇到困惑时的解决\n建议和小知识等，使各个教学环节更加实用、活泼、有效。\n\n3\n\n目\n\n录\n\n第一学期\n第1课\n\n体育与健康基础知识——青春期卫生与科学锻炼：青春期卫生......................... 1\n\n第2课\n\n技巧：有人扶持手倒立\n奔跑游戏：迎面接力跑. ............................................................................................. 4\n\n第3课\n\n技巧：有人扶持手倒立\n奔跑游戏：障碍跑....................................................................................................... 8\n\n第4课\n\n技巧：有人扶持手倒立\n篮球游戏：截空中球 ................................................................................................ 11\n\n第5课\n\n技巧：有人扶持手倒立\n奔跑游戏：十字接力跑. ........................................................................................... 14\n\n第6课\n\n技巧：有人扶持手倒立（考核）\n篮球游戏：截空中球................................................................................................. 17\n\n第7课,2.0,义务教育教科书·体育与健康教师用书六年级全一册,3,977,2025-07-21T14:23:13.939Z,2.0,2025-07-18T13:35:16.460Z,六年级,[object Object],node-poppler,unknown,0.375,0.5,1,,,,,true,,,general,全一册,/Users/LeoQin/Documents/GitHub/PDFconvertor/training_data/小学/体育与健康/科学社版/义务教育教科书·体育与健康教师用书六年级全一册.pdf,义务教育教科书·体育与健康教师用书六年级全一册.json,体育,133375
义务教育教科书·体育与健康教师用书六年级全一册_chunk_4,4,请大家共同回忆上学期学习的内容。 青春期是指人体生长发育成熟前一个迅速发育的阶段，大致可分为以下三个时期。 13 14 岁开始，一般持续 2 3 年。 2. 青春发育中期：女生从 12 15 岁开始，男生从 14 16 岁开始，以性器官及第二性征发育为主，女生 【教学提示】 本课开始要着重复习青春期的生理特征，为后面的学习奠定基础。然后进行分组教学。 出现月经，男生出现遗精，一般持续 2 4 年。 3. 青春发育后期：女生从 16 17 岁开始，男生从 17 18 岁开始，主要表现为身体各系统继续缓慢发育，逐渐成熟。 青春期发育的开始年龄、持续时间和发育状况既有种族、环境和社会条件的差异， 也有明显的个体差异。青春期是人体各系统、各组织器官迅速变化，趋于完善定型的关键时期，对我们的心理、情绪和行为都有很大的影响。如何平稳度过青春期也就显得尤青春期卫生与科学锻炼（ 1. 青春发育前期：女生从 11 12 岁开始，男生从引导学生了解青春期的卫生要求，以及需要注意的事项。 体育与健康基础知识教 学过 程 1 课教学准备：复习五年级学习内容，进一步掌握青春期生长发育的特点。 1 为重要。 1 2 ） 青春期是人体生长发育的第二个高峰期。这个时期，少男、少女的身体各部分在形第一学期 3. 树立关爱自身健康的意识。 年级 2. 能够把学到的相关知识应用于实际，用以解决青春期中遇到的问题及烦恼。 第 6 小学体 育教学教师用书态、机能方面，不断发生变化，尤其是生殖系统的迅速发育成熟，使脑垂体、性腺和甲状腺等内分泌活动 【注意事项】 增强，从而促进全身各组织（肌肉、骨骼等）、器官活动二：青春期男生需要注意什么？,709,0.6311538461538462,medium,text-extracted,请大家共同回忆上学期学习的内容。\n青春期是指人体生长发育成熟前一个迅速发育的\n阶段，大致可分为以下三个时期。\n13~14 岁开始，一般持续 2~3 年。\n2. 青春发育中期 ：女生从 12~15 岁开始，男生从\n14~16 岁开始，以性器官及第二性征发育为主，女生\n\n【教学提示】\n本课开始要着重复习青春期的\n生理特征，为后面的学习奠定基\n础。然后进行分组教学。\n\n出现月经，男生出现遗精，一般持续 2~4 年。\n3. 青春发育后期 ：女生从 16~17 岁开始，男生从 17~18 岁开始，主要表现为身体各系\n统继续缓慢发育，逐渐成熟。\n青春期发育的开始年龄、持续时间和发育状况既有种族、环境和社会条件的差异，\n也有明显的个体差异。青春期是人体各系统、各组织器官迅速变化，趋于完善定型的关\n键时期，对我们的心理、情绪和行为都有很大的影响。如何平稳度过青春期也就显得尤\n\n青春期卫生与科学锻炼（\n——\n\n1. 青春发育前期 ：女生从 11~12 岁开始，男生从\n\n引导学生了解青春期的卫生要\n求，以及需要注意的事项。\n\n体育与健康基础知识\n\n教 学 过 程\n\n1\n\n课\n\n教学准备 ：复习五年级学习内容，进一步掌握青春期生长发育的特点。\n\n1\n\n为重要。\n\n1\n\n2\n\n/）\n\n青春期是人体生长发育的第二个高峰期。这个时期，少男、少女的身体各部分在形\n\n第一学期\n\n3. 树立关爱自身健康的意识。\n\n年级\n\n2. 能够把学到的相关知识应用于实际，用以解决青春期中遇到的问题 及烦恼。\n\n第\n\n		\n\n6\n\n小学 体 育 教学教师用书\n\n态、机能方面，不断发生变化，尤其是生殖系统的迅\n\n◎\n\n速发育成熟，使脑垂体、性腺和甲状腺等内分泌活动\n\n【注意事项】\n\n增强，从而促进全身各组织（肌肉、骨骼等）、器官\n\n活动二 ：青春期男生需要注意什么？,2.0,义务教育教科书·体育与健康教师用书六年级全一册,15,772,2025-07-21T14:23:13.939Z,2.0,2025-07-18T13:35:16.460Z,六年级,[object Object],node-poppler,unknown,0.8402457757296466,0.5,1,,true,,,true,true,,biology,全一册,/Users/LeoQin/Documents/GitHub/PDFconvertor/training_data/小学/体育与健康/科学社版/义务教育教科书·体育与健康教师用书六年级全一册.pdf,义务教育教科书·体育与健康教师用书六年级全一册.json,体育,133375
