Chunk_ID,Chunk_Index,Content,Content_Length,Quality_Score,Reliability,Source_Type,Original_Content,Enhancement_Version,book_name,chunkIndex,chunkSize,enhancementTimestamp,enhancementVersion,extractedAt,grade,loc_lines,method,publisher,qualityMetrics_chineseCharRatio,qualityMetrics_coherenceScore,qualityMetrics_lengthScore,qualityMetrics_ocrConfidence,semanticFeatures_hasDefinition,semanticFeatures_hasExperiment,semanticFeatures_hasFormulas,semanticFeatures_hasNumbers,semanticFeatures_hasQuestion,semanticFeatures_isTableContent,semanticFeatures_subjectArea,semester,source,source_file,subject,textLength
义务教育教科书·美术四年级上册_chunk_8,8,快乐的娃娃学生作品电动小汽车学生作品学习建议 1 学习掌握彩色纸版画的基本制作方法。 2 任意选择题材，创作一幅彩色纸版画。 大黄蜂学生作品拓展ABC 花（套色木版画） 安迪沃霍尔（美国） 31 第六单元巧用材料再创造 15 经纬纸编第 设计应用课 生活中有很多编织的日常用品，你见过的有哪些？ 认真构思设计，用纸条编织的方法制作一幅好看的作品。 学习建议 1 用颜色不同的纸条穿编一个自己想象的纹样。 2 试着根据书中的方法，做一个有变化的动物纹样。 无题（手工纸、竹） 安当恩（美国） 方法导引底色纸 32 穿编纸条底托纸编纹样时，要注意色彩的变化。 学生作品在设计好的动物形象上组合一个局部穿编，既好看，又简单。 纸编是利用纸条的色彩对比，通过经纬穿编而形成的纹样。 用生活中常见的玉米皮和竹子编的日用品 33 第六单元巧用材料再创造 16 软陶乐趣第 设计应用课 琳琅满目的小饰品足以让我们了解软陶的魅力，不过，在动手制作之前，还是要了解软陶材料的特性、制作方法哟！ 童年的梦（陶） 印焕堂多彩的兔子（综合材料） 佚名软陶小工艺品，是靠手掌体温逐渐把软陶搓揉变软后，捏塑、切割、排列组合而成的。 如果买不到软陶材料，可以用彩泥捏塑作品。 34 方法导引 1 组织软陶优秀作品展示活动。 2 3 学习建议 1 用软陶组合混色，设计并制作一两件有创意的小饰品。 2 和老师一起研究烤制，使小饰品坚硬不变形。 4 3 比比看，谁的小饰品设计得最有创意。 学生作品 35 第六单元巧用材料再创造 17 彩泥面塑第 设计应用课 面塑艺术是我国重要的民间艺术，从下面的作品可以看出民间各地不同的面塑艺术风格。我们用彩泥学做面塑，来体会一下其中的乐趣吧！ 民间面塑制作手法巧妙多样，一些名家在继承传统的过程中不断创新，极大地丰富了这一艺术形式，汤子博就是面塑艺术中一个承前启后的重要人物。 关羽（面塑） 李金城爬娃（面塑） 山西猪八戒（面塑） 河北鱼娃娃（面塑） 陕西戴铃虎花馍（面塑） 陕西 36 方法导引学习建议 1,857,0.6638350125944584,medium,text-extracted,快乐的娃娃 学生作品\n\n电动小汽车 学生作品\n\n学习建议\n\n1 学习掌握彩色纸版画的基本制作方法。\n2 任意选择题材，创作一幅彩色纸版画。\n大黄蜂 学生作品\n\n拓展ABC\n\n花（套色木版画） 安迪·沃霍尔（美国）\n\n31\n\n第六单元\n\n巧用材料再创造\n\n15 经纬纸编\n\n第\n\n设计·应用\n\n课\n\n生活中有很多编织的日\n常用品，你见过的有哪些？\n认真构思设计，用纸条编织\n的方法制作一幅好看的作\n品。\n\n学习建议\n\n1 用颜色不同的纸条穿编一个自己\n想象的纹样。\n2 试着根据书中的方法，做一个有\n变化的动物纹样。\n\n无题（手工纸、竹） 安·当恩（美国）\n\n方法导引\n\n底色纸\n\n32\n\n穿编纸条\n\n底托\n\n纸编纹样时，要注意色彩\n的变化。\n\n学生作品\n\n在设计好的动物形\n象上组合一个局部穿\n编，既好看，又简单。\n\n纸编是利用纸条的\n色彩对比，通过经纬穿\n编而形成的纹样。\n\n用生活中常见的玉米皮和竹子编的日用品\n\n33\n\n第六单元\n\n巧用材料再创造\n\n16 软陶乐趣\n\n第\n\n设计·应用\n\n课\n\n琳琅满目的小饰品足以让我们了解软陶的\n魅力，不过，在动手制作之前，还是要了解软\n陶材料的特性、制作方法哟！\n\n童年的梦（陶） 印焕堂\n\n多彩的兔子（综合材料） 佚名\n\n软陶小工艺品，是靠手掌体温逐渐把软陶\n搓揉变软后，捏塑、切割、排列组合而成的。\n如果买不到软陶材料，可以用彩泥捏塑作品。\n\n34\n\n方法导引\n\n1\n\n组织软陶优秀作品展示活动。\n\n2\n\n3\n\n学习建议\n\n1 用软陶组合混色，设计并制作\n一两件有创意的小饰品。\n2 和老师一起研究烤制，使小饰\n品坚硬不变形。\n\n4\n\n3 比比看，谁的小饰品设计得最\n有创意。\n\n学生作品\n\n35\n\n第六单元\n\n巧用材料再创造\n\n17 彩泥面塑\n\n第\n\n设计·应用\n\n课\n\n面塑艺术是我国重要的民\n间艺术，从下面的作品可以看\n出民间各地不同的面塑艺术风\n格。我们用彩泥学做面塑，来\n体会一下其中的乐趣吧！\n\n民间面塑制作手法巧妙\n多样，一些名家在继承传统的\n过程中不断创新，极大地丰富\n了这一艺术形式，汤子博就是\n面塑艺术中一个承前启后的重\n要人物。\n\n关羽（面塑） 李金城\n\n爬娃（面塑） 山西\n\n猪八戒（面塑） 河北\n\n鱼娃娃（面塑） 陕西\n戴铃虎花馍（面塑） 陕西\n\n36\n\n方法导引\n\n学习建议\n\n1,2.0,义务教育教科书·美术四年级上册,8,984,2025-07-21T14:23:56.257Z,2.0,2025-07-18T13:45:37.947Z,四年级,[object Object],node-poppler,unknown,0.8732572877059569,0.5,1,,,,,true,true,,biology,上册,/Users/LeoQin/Documents/GitHub/PDFconvertor/training_data/小学/美术/辽海版/义务教育教科书·美术四年级上册.pdf,义务教育教科书·美术四年级上册.json,美术,9070
义务教育教科书·美术四年级上册_chunk_9,9,"民间面塑制作手法巧妙多样，一些名家在继承传统的过程中不断创新，极大地丰富了这一艺术形式，汤子博就是面塑艺术中一个承前启后的重要人物。 关羽（面塑） 李金城爬娃（面塑） 山西猪八戒（面塑） 河北鱼娃娃（面塑） 陕西戴铃虎花馍（面塑） 陕西 36 方法导引学习建议 1 1 学习民间面塑制作的基本方法， 用彩泥制作一两件作品。 2 比一比，看谁制作的彩泥作品更生动、更耐人寻味。 团泥，用彩泥捏出鳄鱼的大体形状。 2 学生作品教师示范作品将浅绿色彩泥捏出片状，贴在鳄鱼肚上。 3 根据需要，用镊子轻轻将嘴巴张大。 4 捏好的眼睛备用， 用镊子小心粘牢。 5 整理局部形状，添加鳄鱼爪和鳄鱼牙齿。 拓展ABC 北京面人汤作品面人汤是 指面塑艺术家汤子博，其作品造型大气、形神兼备、设色雅致， 是我国民间面塑艺术的精品。 37 第六单元巧用材料再创造 18 泥板浮雕第 造型表现课 人们通常把在平面上雕塑凸起的形象称作浮雕。用黄泥或橡皮泥做成泥条、泥块在泥板上塑起自己喜爱的形象，再用手中的工具稍加处理，一幅泥板上的浮雕就完成了。 汉代瓦当中的四神瓦当 很多，这里介绍的四神瓦当是汉代常见的一种。 现收藏于上海博物馆。 四神瓦当汉代 （佚名） 方法导引制作步骤： 1 做一个合适的泥板 （约1厘米厚),用竹片勾勒出雕刻的图形。 2 沿着图形边缘，用竹片挖刻出大体形状。 38 3 通过 压 、 刻等 手段， 4 做适当的修饰、整认真细致地雕刻形象。 理，放在通风处阴干。 1 . 选择适用的工具能方便制作。 2. 学习中应注意保持环境卫生。 教师示范作品 1 可以临摹本课图例或自选题材，制作一幅泥板浮雕作品。 学生作品 2 把你的泥板浮雕作品用漂亮的包装盒装饰起来，就可以变成一件精美的工艺品。 3 用橡皮泥制作泥板浮雕作品。 小知识中国古代的瓦分为板瓦和筒瓦两种。瓦当是屋檐最前面的圆形瓦，位于筒瓦之前，主要用于保护木制飞檐，美化屋面轮廊。 所谓四神 （或叫四 灵 ）是指青龙、白虎、朱雀、玄武。青龙，东方神兽； 白虎，西方神兽；朱雀，南方神兽；玄武，北方神兽。",879,0.6463736263736263,medium,text-extracted,"民间面塑制作手法巧妙\n多样，一些名家在继承传统的\n过程中不断创新，极大地丰富\n了这一艺术形式，汤子博就是\n面塑艺术中一个承前启后的重\n要人物。\n\n关羽（面塑） 李金城\n\n爬娃（面塑） 山西\n\n猪八戒（面塑） 河北\n\n鱼娃娃（面塑） 陕西\n戴铃虎花馍（面塑） 陕西\n\n36\n\n方法导引\n\n学习建议\n\n1\n\n1 学习民间面塑制作的基本方法，\n用彩泥制作一两件作品。\n2 比一比，看谁制作的彩泥作品更\n生动、更耐人寻味。\n\n团泥，用彩泥捏出\n鳄鱼的大体形状。\n\n2\n\n学生作品\n\n教师示范作品\n\n将浅绿色彩泥捏出\n片状，贴在鳄鱼肚上。\n\n3\n\n根据需要，用镊子\n轻轻将嘴巴张大。\n\n4\n\n捏好的眼睛备用，\n用镊子小心粘牢。\n\n5\n\n整理局部形状，添\n加鳄鱼爪和鳄鱼牙齿。\n\n拓展ABC\n\n北京“面人汤”作品\n\n“面人汤”是\n指面塑艺术家汤\n子博，其作品造\n型大气、形神兼\n备、设色雅致，\n是我国民间面塑\n艺术的精品。\n\n37\n\n第六单元\n\n巧用材料再创造\n\n18 泥板浮雕 ①\n\n第\n\n造型·表现\n\n课\n\n人们通常把在平面上雕塑凸起的\n形象称作浮雕。用黄泥或橡皮泥做成泥\n条、泥块在泥板上塑起自己喜爱的形\n象，再用手中的工具稍加处理，一幅泥\n板上的浮雕就完成了。\n\n汉代瓦当中的“四神瓦\n当”很多，这里介绍的“四神\n瓦当”是汉代常见的一种。\n现收藏于上海博物馆。\n\n四神瓦当 汉代 （佚名）\n\n方法导引\n制作步骤：\n\n1 做一个\n合适的泥板\n（约1厘米\n厚),用竹片\n勾勒出雕刻\n的图形。\n\n2 沿着图形边缘，用竹\n\n片挖刻出大体形状。\n\n38\n\n3\n\n通 过 压 、 刻 等 手 段 ， 4 做适当的修饰、整\n认真细致地雕刻形象。\n理，放在通风处阴干。\n\n1 . 选择适用的工具\n能方便制作。\n2. 学习中应注意保\n持环境卫生。\n\n教师示范作品\n\n1 可以临摹本课图例或自选题材，制\n作一幅泥板浮雕作品。\n\n学生作品\n\n2 把你的泥板浮雕作品用漂亮的包装\n盒装饰起来，就可以变成一件精美\n的工艺品。\n3 用橡皮泥制作泥板浮雕作品。\n\n小知识\n中国古代的瓦分为板瓦和\n筒瓦两种。瓦当是屋檐最前面\n的圆形瓦，位于筒瓦之前，主\n要用于保护木制飞檐，美化屋\n面轮廊。\n所谓“四神”（或叫“四\n灵”）是指青龙、白虎、朱\n雀、玄武。青龙，东方神兽；\n白虎，西方神兽；朱雀，南方\n神兽；玄武，北方神兽。",2.0,义务教育教科书·美术四年级上册,9,995,2025-07-21T14:23:56.257Z,2.0,2025-07-18T13:45:37.947Z,四年级,[object Object],node-poppler,unknown,0.8596273291925466,0.5,1,,true,,,true,,,mathematics,上册,/Users/LeoQin/Documents/GitHub/PDFconvertor/training_data/小学/美术/辽海版/义务教育教科书·美术四年级上册.pdf,义务教育教科书·美术四年级上册.json,美术,9070
义务教育教科书·美术四年级上册_chunk_10,10,学生作品 2 把你的泥板浮雕作品用漂亮的包装盒装饰起来，就可以变成一件精美的工艺品。 3 用橡皮泥制作泥板浮雕作品。 小知识中国古代的瓦分为板瓦和筒瓦两种。瓦当是屋檐最前面的圆形瓦，位于筒瓦之前，主要用于保护木制飞檐，美化屋面轮廊。 所谓四神 （或叫四 灵 ）是指青龙、白虎、朱雀、玄武。青龙，东方神兽； 白虎，西方神兽；朱雀，南方神兽；玄武，北方神兽。 39 第六单元巧用材料再创造 18 泥板浮雕第 造型表现课 在这一课中，中国民间建筑艺术中的石雕和木雕作品看起来有点复杂。我们可以通过临摹和借鉴，用最简单的泥塑手法，深入地体会传统浮雕的魅力所在。 动手尝试一下吧！ 方法导引常用雕刻工具麒麟（石雕） 清早期 1 在堆好的泥板上，用竹片勾勒出大形。 福寿双全（木雕） 清早期 40 2 将泥条通过堆捏、挖刻等手段，塑造形象。 安居乐业（木雕） 清中期中国民间常用刻有花纹和人物故事的木刻作品来装饰建筑。 在我国建筑艺术宝库中，石雕和木雕纹饰大都浅显易懂、一学生作品目了然，以福、寿、喜庆、吉祥等寓意为主要内容。 如意玉兔（木雕） 清早期 1 欣赏本课图例作品，说说你的感受。 2 临摹图例作品，还可以用刀或泥工工具雕刻出不同图案或用泥条、泥皮做浅浮雕作品。 双狮戏球（石雕） 山西王家大院 41 第七单元感受中国传统文化 19 龙舞神州第 综合探索课 龙，是中华民族的象征，是古代人民借助想象力创造的一种富有寓意的形象。舞龙是民间传统的艺术表演活动，场面隆重、热烈。那豪迈的气势、欢腾的激情，表现了我们中华民族旺盛的生命活力。 服饰上的龙纹龙在中国传统文化中占有很重要的位置，只要用心去观察，就会发现我们的生活中到处都有它的踪迹。 舞龙（摄影） 民间艺人用纸扎的长龙 42 1 通过多种方式（网络、图书），收集龙的相关资料。 2 选择自己喜欢的形式，画一幅表现舞龙场面的记忆画。 风筝学生作品舞龙形象生动，令人叹为观止的北京北海九龙壁。 43 第七单元感受中国传统文化 20 彩狮呈祥第 设计应用课,851,0.6591209476309228,medium,text-extracted,学生作品\n\n2 把你的泥板浮雕作品用漂亮的包装\n盒装饰起来，就可以变成一件精美\n的工艺品。\n3 用橡皮泥制作泥板浮雕作品。\n\n小知识\n中国古代的瓦分为板瓦和\n筒瓦两种。瓦当是屋檐最前面\n的圆形瓦，位于筒瓦之前，主\n要用于保护木制飞檐，美化屋\n面轮廊。\n所谓“四神”（或叫“四\n灵”）是指青龙、白虎、朱\n雀、玄武。青龙，东方神兽；\n白虎，西方神兽；朱雀，南方\n神兽；玄武，北方神兽。\n\n39\n\n第六单元\n\n巧用材料再创造\n\n18 泥板浮雕 ②\n\n第\n\n造型·表现\n\n课\n\n在这一课中，中国民间建筑\n艺术中的石雕和木雕作品看起来\n有点复杂。我们可以通过临摹和\n借鉴，用最简单的泥塑手法，深\n入地体会传统浮雕的魅力所在。\n动手尝试一下吧！\n\n方法导引\n常用雕刻工具\n\n麒麟（石雕） 清早期\n\n1\n\n在堆好的泥板上，用\n竹片勾勒出大形。\n\n福寿双全（木雕） 清早期\n\n40\n\n2\n\n将泥条通过堆捏、挖\n刻等手段，塑造形象。\n\n安居乐业（木雕） 清中期\n\n中国民间常用刻有花纹和人物故事的木刻作品来装饰建筑。\n\n在我国建筑艺术宝库中，石\n雕和木雕纹饰大都浅显易懂、一\n\n学生作品\n\n目了然，以福、寿、喜庆、吉祥\n等寓意为主要内容。\n\n如意玉兔（木雕） 清早期\n\n1 欣赏本课图例作品，说说你的感受。\n2 临摹图例作品，还可以用刀或泥工工具\n雕刻出不同图案或用泥条、泥皮做浅浮\n雕作品。\n\n双狮戏球（石雕） 山西王家大院\n\n41\n\n第七单元\n\n感受中国传统文化\n\n19 龙舞神州\n\n第\n\n综合·探索\n\n课\n\n龙，是中华民族的象征，是古代人民借\n助想象力创造的一种富有寓意的形象。舞龙\n是民间传统的艺术表演活动，场面隆重、热\n烈。那豪迈的气势、欢腾的激情，表现了我\n们中华民族旺盛的生命活力。\n\n服饰上的龙纹\n\n龙在中国传统文化中占有很重要\n的位置，只要用心去观察，就会发现\n我们的生活中到处都有它的踪迹。\n舞龙（摄影）\n\n民间艺人用纸扎的长龙\n\n42\n\n1 通过多种方式（网络、图书），收\n集龙的相关资料。\n2 选择自己喜欢的形式，画一幅表现\n舞龙场面的记忆画。\n风筝\n\n学生作品\n\n舞龙\n\n形象生动，令人叹为观止的北京北海九龙壁。\n\n43\n\n第七单元\n\n感受中国传统文化\n\n20 彩狮呈祥\n\n第\n\n设计·应用\n\n课,2.0,义务教育教科书·美术四年级上册,10,957,2025-07-21T14:23:56.257Z,2.0,2025-07-18T13:45:37.947Z,四年级,[object Object],node-poppler,unknown,0.8702770780856424,0.5,1,,true,true,,true,,,mathematics,上册,/Users/LeoQin/Documents/GitHub/PDFconvertor/training_data/小学/美术/辽海版/义务教育教科书·美术四年级上册.pdf,义务教育教科书·美术四年级上册.json,美术,9070
义务教育教科书·美术四年级上册_chunk_11,11,民间艺人用纸扎的长龙 42 1 通过多种方式（网络、图书），收集龙的相关资料。 2 选择自己喜欢的形式，画一幅表现舞龙场面的记忆画。 风筝学生作品舞龙形象生动，令人叹为观止的北京北海九龙壁。 43 第七单元感受中国传统文化 20 彩狮呈祥第 设计应用课 狮子神勇、威猛，在民间被认为是可以保护小孩子健康和招财纳福的吉祥动物。每逢节日， 民间都会举行扎纸狮子、舞狮等娱乐活动，以求吉祥快乐。 北京故宫乾清门前鎏金铜狮民间纸扎双狮聂方俊叫狮（民间玩具） 民间布玩具 44 红绿彩狮球纹瓷瓶（元代） 方法导引用简练、概括的手法，把狮子头部的特征大 1 胆夸张地表现出来。 选择软硬合适的纸做狮子身体。 坐狮（面塑） 山西运城 2 用多层卫生纸制作狮子胡须。 学生作品 3 粘狮子头时，胶水要涂匀粘牢。 教师学生合作作品拓展ABC 学习建议 1 学习和了解中国民间狮子的各种类型和造型特点。 2 用卷、剪、添画、粘贴等方法制作一个可爱的小狮子。 舞狮是最有特色的民间娱乐活动之一。 45 世界 遗产 之旅 孔庙孔林孔 府 （世界文化遗产） 孔庙、孔林、孔府，合称为三 孔，位于山东省曲阜市，是中国历代为纪念孔子、推崇儒学而发展起来的，以丰厚的文化积淀、悠久的历史、宏大的规模、丰富的文物珍藏以及科学艺术价值而著称。 1994年，被联合国教科文组织世界遗产委员会评为文化遗产，列入《世界遗产名录》。 中国最早且至今规格最大的曲阜孔庙修建于公元前478年，即孔子逝世的第二年。孔庙的主殿大成殿高31 . 89米，宽54米，进深34 米。廊下有28根古龙柱，每根柱子都用整块石材雕成。前廊下的10根石柱用高浮雕手法形成双龙对舞，衬以云朵、山石、波涛，造型优美生动，是罕见的艺术瑰宝。 孔庙大成殿龙柱孔庙大成殿 46 孔林孔庙杏坛孔庙杏坛，是一个形式奇特、寓意深远的建筑，相传是孔子讲学的地方。 孔林占地3000多亩，是孔子及其后裔的家族墓地，又称圣林，是世界上延时最久、规模最大的家族墓地。 孔宅故井和鲁壁,846,0.6424468085106383,medium,text-extracted,民间艺人用纸扎的长龙\n\n42\n\n1 通过多种方式（网络、图书），收\n集龙的相关资料。\n2 选择自己喜欢的形式，画一幅表现\n舞龙场面的记忆画。\n风筝\n\n学生作品\n\n舞龙\n\n形象生动，令人叹为观止的北京北海九龙壁。\n\n43\n\n第七单元\n\n感受中国传统文化\n\n20 彩狮呈祥\n\n第\n\n设计·应用\n\n课\n\n狮子神勇、威猛，在民间被\n认为是可以保护小孩子健康和招\n财纳福的吉祥动物。每逢节日，\n民间都会举行扎纸狮子、舞狮等\n娱乐活动，以求吉祥快乐。\n\n北京故宫乾清门前鎏金铜狮\n\n民间纸扎双狮 聂方俊\n\n叫狮（民间玩具）\n\n民间布玩具\n\n44\n\n红绿彩狮球纹瓷瓶（元代）\n\n方法导引\n\n用简练、概括的手\n法，把狮子头部的特征大\n\n1\n\n胆夸张地表现出来。\n\n选择软硬合适的纸做狮子身体。\n\n坐狮（面塑） 山西运城\n\n2\n用多层卫生纸制作狮子胡须。\n\n学生作品\n\n3\n粘狮子头时，胶水要涂匀粘牢。\n教师学生合作作品\n\n拓展ABC\n\n学习建议\n\n1 学习和了解中国民间狮子\n的各种类型和造型特点。\n2 用卷、剪、添画、粘贴等\n方法制作一个可爱的小\n狮子。\n\n舞狮是最有特色的民间娱\n乐活动之一。\n\n45\n\n世 界 遗 产 之 旅\n\n孔庙 孔林 孔 府\n\n（世界文化遗产）\n\n孔庙、孔林、孔府，合称为“三\n孔”，位于山东省曲阜市，是中国历代为\n纪念孔子、推崇儒学而发展起来的，以丰\n厚的文化积淀、悠久的历史、宏大的规\n模、丰富的文物珍藏以及科学艺术价值而\n著称。\n1994年，被联合国教科文组织世界遗产\n委员会评为文化遗产，列入《世界遗产名\n录》。\n\n中国最早且至今规格最大的曲阜孔庙修\n建于公元前478年，即孔子逝世的第二年。孔\n庙的主殿大成殿高31 .  89米，宽54米，进深34\n米。廊下有28根古龙柱，每根柱子都用整块\n石材雕成。前廊下的10根石柱用高浮雕手法\n形成双龙对舞，衬以云朵、山石、波涛，造\n型优美生动，是罕见的艺术瑰宝。\n孔庙大成殿龙柱\n\n孔庙大成殿\n\n46\n\n孔林\n孔庙杏坛\n\n孔庙杏坛，是一个形式奇\n特、寓意深远的建筑，相传是孔\n子讲学的地方。\n\n孔林占地3000多亩，是孔子及其后裔的\n家族墓地，又称“��圣林”，是世界上延时\n最久、规模最大的家族墓地。\n\n孔宅故井和鲁壁,2.0,义务教育教科书·美术四年级上册,11,947,2025-07-21T14:23:56.257Z,2.0,2025-07-18T13:45:37.947Z,四年级,[object Object],node-poppler,unknown,0.8472222222222222,0.5,1,,true,,,true,,,biology,上册,/Users/LeoQin/Documents/GitHub/PDFconvertor/training_data/小学/美术/辽海版/义务教育教科书·美术四年级上册.pdf,义务教育教科书·美术四年级上册.json,美术,9070
义务教育教科书·美术四年级上册_chunk_12,12,孔庙大成殿 46 孔林孔庙杏坛孔庙杏坛，是一个形式奇特、寓意深远的建筑，相传是孔子讲学的地方。 孔林占地3000多亩，是孔子及其后裔的家族墓地，又称圣林，是世界上延时最久、规模最大的家族墓地。 孔宅故井和鲁壁孔府位于曲阜城内，孔庙东侧， 是孔子嫡长子孙的府第，即衍圣公府。1377年始建， 1503年重修拓广， 1838年扩修。占地面积约200亩，有各类建筑约170座，是一座典型的封建贵族庄园。 47,201,0.5747208121827412,medium,text-extracted,孔庙大成殿\n\n46\n\n孔林\n孔庙杏坛\n\n孔庙杏坛，是一个形式奇\n特、寓意深远的建筑，相传是孔\n子讲学的地方。\n\n孔林占地3000多亩，是孔子及其后裔的\n家族墓地，又称“��圣林”，是世界上延时\n最久、规模最大的家族墓地。\n\n孔宅故井和鲁壁\n\n孔府位于曲阜\n城内，孔庙东侧，\n是孔子嫡长子孙的\n府第，即衍圣公\n府。1377年始建，\n1503年重修拓广，\n1838年扩修。占地\n面积约200亩，有各\n类建筑约170座，是\n一座典型的封建贵\n族庄园。\n\n47,2.0,义务教育教科书·美术四年级上册,12,227,2025-07-21T14:23:56.257Z,2.0,2025-07-18T13:45:37.947Z,四年级,[object Object],node-poppler,unknown,0.7668393782383419,0.5,1,,,,,true,,,unknown,上册,/Users/LeoQin/Documents/GitHub/PDFconvertor/training_data/小学/美术/辽海版/义务教育教科书·美术四年级上册.pdf,义务教育教科书·美术四年级上册.json,美术,9070
