Chunk_ID,Chunk_Index,Content,Content_Length,Quality_Score,Reliability,Source_Type,Original_Content,Enhancement_Version,book_name,chunkIndex,chunkSize,enhancementTimestamp,enhancementVersion,extractedAt,grade,loc_lines,method,publisher,qualityMetrics_chineseCharRatio,qualityMetrics_coherenceScore,qualityMetrics_lengthScore,qualityMetrics_ocrConfidence,semanticFeatures_hasDefinition,semanticFeatures_hasExperiment,semanticFeatures_hasFormulas,semanticFeatures_hasNumbers,semanticFeatures_hasQuestion,semanticFeatures_isTableContent,semanticFeatures_subjectArea,semester,source,source_file,subject,textLength
义务教育教科书·道德与法治一年级上册_chunk_6,6,xUn zuH yYu xK 开心 做游 戏， Qn quWn jK xUn zhTng 安全 记心 中。 31 shSng kF le 8 上课了 kF qiWn zhLn bFi hAo 课前 准备好 xiS jiR ySo shSng shRn me kF 下节要上 什么课？ 课程 表星期一 二三 四五 1 数学语文数学语文数学 2 地方与校本课程数学语文数学语文 3 语文美术 4 体育与健康音乐课次大课间体育活动地方与校本课程体育与健康道德与法治道德与法治音乐体育与健康午间休息 5 品德与生活 6 少先队活动课体育与健康一小时活动 32 语文美术活动课前一起唱首歌。 我有个好主意语文还可以第二单元 duT tI wFn tI qIn jL 校园生活真快乐 shGu 多提 问题勤举 手积极举手非常好， 别人讲时要先听我的问题是老师我也想提问，可是认真听好好想把问题说清楚 33 dS jiQ yK qJ xuR 大家一起 学没意思抢着大声说， 什么也听不清！ 我才不跟你一起背呢！ wG de bSn fA shK 我的 办法 是 34 第二单元 kF tWng zuH yF 校园生活真快乐 rFn zhEn zuH 课堂 作业认真 做你写得真好！ 我写的时候 zhF yD shK zuH yF ma 这也是作业吗？ 35 wWn de zhEn kQi xUn 9 玩得真开心 fSng xuR huI jiQ wWn shRn me 放学回家 玩什 么今天，我在学校 wG zSi jiQ lJ xJ huan wWn 我在 家里 喜欢 玩 36 第三单元家中的安全与健康 zhF ySng wWn hAo ma 这样玩 好吗 请不要这么大声说话！ 眼睛有点儿疼。 呀，我还有作业！,753,0.4148746081504703,medium,text-extracted,xUn\n\nzuH\n\nyYu\n\nxK\n\n开 心 做 游 戏 ，\nQn\n\nquWn\n\njK\n\nxUn zhTng\n\n安 全 记 心 中 。\n\n31\n\nshSng\n\nkF\n\nle\n\n8 上课了\nkF\n\nqiWn zhLn bFi hAo\n\n课 前 准备好\n\nxiS jiR ySo shSng shRn me kF\n\n下节要 上 什么课？\n\n课 程 表\n星期\n\n一\n\n二\n\n三\n\n四\n\n五\n\n1\n\n数学\n\n语文\n\n数学\n\n语文\n\n数学\n\n2\n\n地方与校本课程\n\n数学\n\n语文\n\n数学\n\n语文\n\n3\n\n语文\n\n美术\n\n4\n\n体育与健康\n\n音乐\n\n课次\n\n大课间体育活动\n地方与校本课程 体育与健康 道德与法治\n道德与法治\n\n音乐\n\n体育与健康\n\n午间休息\n5\n\n品德与生活\n\n6\n\n少先队活动课\n\n体育与健康\n\n一小时活动\n\n32\n\n语文\n美术\n\n活动\n\n课前一起唱首歌。\n我有个好主意……\n\n语文\n\n还可以……\n\n第二单元\n\nduT\n\ntI\n\nwFn\n\ntI\n\nqIn\n\njL\n\n校园生活真快乐\n\nshGu\n\n多 提 问 题勤 举 手\n积极举手非常好，\n别人讲时要先听……\n我的问题是……\n老师……\n\n我也想提问，可是……\n\n认真听……\n\n①\n\n好好想……\n\n③\n\n②\n\n把问题说清楚……\n\n④\n33\n\ndS\n\njiQ\n\nyK\n\nqJ\n\nxuR\n\n大家一 起 学\n\n没意思……\n\n抢着大声说，\n什么也听不清！\n\n我才不跟你\n一起背呢！\n\nwG de bSn fA shK\n\n我 的 办 法 是 ……\n\n34\n\n第二单元\n\nkF\n\ntWng zuH\n\nyF\n\n校园生活真快乐\n\nrFn zhEn zuH\n\n课 堂 作 业认 真 做\n\n你写得真好！\n\n我写的时候……\n\nzhF yD shK zuH yF ma\n\n这也是作业吗？\n\n35\n\nwWn\n\nde\n\nzhEn\n\nkQi\n\nxUn\n\n9 玩得真开心\nfSng xuR\n\nhuI\n\njiQ wWn shRn me\n\n放 学回 家 玩 什 么\n\n今天，我\n在学校……\n\nwG zSi jiQ\n\nlJ\n\nxJ huan wWn\n\n我 在 家 里 喜 欢 玩 ……\n\n36\n\n第三单元\n\n家中的安全与健康\n\nzhF ySng wWn hAo ma\n\n这样 玩 好 吗\n\n请不要这么大声说话！\n\n眼睛有点儿疼。\n\n呀，我还有作业！,2.0,义务教育教科书·道德与法治一年级上册,8,989,2025-07-21T14:24:39.614Z,2.0,2025-07-18T13:53:58.285Z,一年级,[object Object],node-poppler,unknown,0.570957095709571,0.5,1,,,,,true,true,,mathematics,上册,/Users/LeoQin/Documents/GitHub/PDFconvertor/training_data/小学/道德与法治/统编版/义务教育教科书·道德与法治一年级上册.pdf,义务教育教科书·道德与法治一年级上册.json,道德与法治,14271
义务教育教科书·道德与法治一年级上册_chunk_7,7,我是 健康 的冬 宝宝。 好冷！ 56 第四单元 dTng tiQn de 天气虽冷有温暖 bAo jiSn 冬天的保 健怎么开窗通风才好？ 怎么穿衣服才合适？ dTng tiQn hWi yGu nA xiE ySo 冬天 还有 哪些 要 zhM yK de bAo jiSn wFn tI 要不要抹点儿护肤品？ ne 注意的保健问题呢 ? 57 kuSi kuSi hAo qJ lWi 快快 好起 来冻疮好得慢，再抹点儿药。 好好休息。 多喝点儿水。 wG hWi yM dSo guo zhF ySng de qIng kuSng 我还 遇到 过这 样的 情况 流行 病应 对冬 季 1 不去人群密集的地方。 58 2 勤洗手。 第四单元天气虽冷有温暖 dTng tiQn yGu wEn nuAn 冬天有 温暖 雪太大了， 学校停课了！ 你们也要注意保暖。 奶奶，出门记得戴围巾啊！ 发布暴雪蓝色预警了。 wG men yD yGu gDi tQ rRn tiQn wEn nuAn de 我们 也有 给他 人添 温暖 的 gM shi yGu yI cK 故事。有一 次 3 锻炼身体。 4 按时作息。 5 保持良好情绪。 59 kuSi lF guH xUn niWn 15 快乐过新年 huQn dM yuWn dSn 欢度 元旦 zSi hDn duT guY jiQ yuWn dSn 在很 多国 家，元旦 shK xUn niWn de dK yU tiQn 是新年的 第一 天。 在中国 yuWn dSn zhF tiQn zhEn rF nao 在德国 yGu 元旦 这天 真热 闹，有 gF zhGng gF ySng de qKng zhM huY dHng 各种各样的庆祝活动！ 在巴西 60 第四单元 kQi 天气虽冷有温暖 gF yuWn dSn liWn huQn huK 开个元旦联 欢会 我请妈妈帮我们剪拉花。 我们演个小节目。 还可以,839,0.3358536585365854,medium,text-extracted,我 是 健 康 的 冬 宝 宝。\n\n好冷！\n\n56\n\n第四单元\n\ndTng tiQn\n\nde\n\n天气虽冷有温暖\n\nbAo jiSn\n\n冬天的 保 健\n\n怎么开窗通风才好？\n\n怎么穿衣服才合适？\n\ndTng tiQn hWi yGu nA\n\nxiE ySo\n\n   冬 天 还 有 哪 些 要\nzhM yK\n\nde bAo jiSn wFn tI\n\n要不要抹点儿护肤品？\n\nne\n\n注意的保健问题呢 ?\n\n57\n\nkuSi kuSi hAo\n\nqJ\n\nlWi\n\n快 快 好 起 来\n冻疮好得慢，再抹点儿药。\n\n好好休息。\n\n多喝点儿水。\n\nwG hWi yM dSo guo zhF ySng de qIng kuSng\n\n我 还 遇 到 过 这 样 的 情 况 ……\n流 行 病\n\n应 对 冬 季\n\n1\n不去人群密集的地方。\n\n58\n\n2\n勤洗手。\n\n第四单元\n\n天气虽冷有温暖\n\ndTng tiQn yGu wEn nuAn\n\n冬天 有 温 暖\n   雪太大了，\n学校停课了！\n\n你们也要注意保暖。\n   奶奶，出门\n记得戴围巾啊！\n\n发布暴雪蓝色预警了。\n\nwG men yD yGu gDi tQ rRn tiQn wEn nuAn de\n\n   我 们 也 有 给 他 人 添 温 暖 的\ngM shi\n\nyGu yI\n\ncK\n\n故 事 。有 一 次 ……\n\n3\n锻炼身体。\n\n4\n按时作息。\n\n5\n保持良好情绪。\n59\n\nkuSi\n\nlF\n\nguH\n\nxUn\n\nniWn\n\n15 快乐过新年\nhuQn dM yuWn dSn\n\n欢 度 元旦\nzSi hDn duT guY jiQ\n\nyuWn dSn\n\n   在 很 多 国 家，元 旦\nshK xUn niWn de dK\n\nyU tiQn\n\n是新年 的 第 一 天。\n\n在中国\n\nyuWn dSn zhF tiQn zhEn rF nao\n\n在德国\n\nyGu\n\n   元 旦 这 天 真 热 闹，有\ngF zhGng gF ySng de qKng zhM huY dHng\n\n各种各样的庆祝活动！\n在巴西\n\n60\n\n第四单元\n\nkQi\n\n天气虽冷有温暖\n\ngF yuWn dSn liWn huQn huK\n\n开 个元旦 联 欢 会\n   我请妈妈帮\n我们剪拉花。\n\n我们演个小节目。\n还可以……,2.0,义务教育教科书·道德与法治一年级上册,15,986,2025-07-21T14:24:39.614Z,2.0,2025-07-18T13:53:58.285Z,一年级,[object Object],node-poppler,unknown,0.4430769230769231,0.5,1,,,,,true,true,,general,上册,/Users/LeoQin/Documents/GitHub/PDFconvertor/training_data/小学/道德与法治/统编版/义务教育教科书·道德与法治一年级上册.pdf,义务教育教科书·道德与法治一年级上册.json,道德与法治,14271
义务教育教科书·道德与法治一年级上册_chunk_8,8,在德国 yGu 元旦 这天 真热 闹，有 gF zhGng gF ySng de qKng zhM huY dHng 各种各样的庆祝活动！ 在巴西 60 第四单元 kQi 天气虽冷有温暖 gF yuWn dSn liWn huQn huK 开个元旦联 欢会 我请妈妈帮我们剪拉花。 我们演个小节目。 还可以 wG wFi liWn huQn huK zuH de zhLn bFi shK 我为 联欢 会作 的准 备是 61 dS jiQ yK qJ guH chOn jiR 大家 一起 过春 节春节是中华民族的传统节日，全世界的华人用各种方式来庆祝。 过年了， 穿新衣。 团圆 1 过年了，爸爸回来了！ 我戴着心爱的小星星发卡来迎接爸爸。 62 2 除夕夜，包饺子， 奶奶包进去一块硬糖。 第四单元天气虽冷有温暖春联要从右边读 guH chOn jiR yGu hDn duT lJ jiR hR 过春 节有 很多 礼节 和 jiAng jiu ne nJ zhU dSo nA xiE ne 讲究呢！你知道哪些呢？ 3 呀！我吃到了包着糖块的好运饺！ 4 初一，全家人都穿上了爸爸买回来的新衣服。 63 duT ySng de chuWn tGng xUn niWn 多样 的传 统新 年 hDn duT mIn zP hWi yGu zK jJ de chuWn tGng 很多 民族 还有 自己 的传 统 xUn niWn dS jiQ de guH fA yD bM yI ySng ne 新年，大家的过法也不一样 呢！ 泼水节是傣族的新年。 跳锅庄舞，庆祝藏历新年。 5 吃完饭，我跟着爸爸妈妈去拜年，两只手被握得很暖和。 64 6 过了初五，爸爸修了桌椅， 换了灯泡。家里焕然一新了。 第四单元天气虽冷有温暖 zhF xiE qKng zhM xUn niWn de fQng shK 这些 庆祝 新年 的方 式 zhEn yGu yK si wG hWi zhU dSo,844,0.37179675994108985,medium,text-extracted,在德国\n\nyGu\n\n   元 旦 这 天 真 热 闹，有\ngF zhGng gF ySng de qKng zhM huY dHng\n\n各种各样的庆祝活动！\n在巴西\n\n60\n\n第四单元\n\nkQi\n\n天气虽冷有温暖\n\ngF yuWn dSn liWn huQn huK\n\n开 个元旦 联 欢 会\n   我请妈妈帮\n我们剪拉花。\n\n我们演个小节目。\n还可以……\n\nwG wFi liWn huQn huK zuH de zhLn bFi shK\n\n我 为 联 欢 会 作 的 准 备 是 ……\n\n61\n\ndS\n\njiQ\n\nyK\n\nqJ\n\nguH chOn jiR\n\n大 家 一 起 过 春 节\n   春节是中华民族\n的传统节日，全世界\n的华人用各种方式来\n庆祝。\n\n   过年了，\n穿新衣。\n\n团 圆\n1\n   过年了，爸爸回来了！\n我戴着心爱的小星星发卡来\n迎接爸爸。\n62\n\n2\n   除夕夜，包饺子，\n奶奶包进去一块硬糖。\n\n第四单元\n\n天气虽冷有温暖\n\n   春联要从\n右边读……\n\nguH chOn jiR yGu hDn duT\n\nlJ\n\njiR hR\n\n   过 春 节 有 很 多 礼 节 和\njiAng jiu ne\n\nnJ zhU dSo nA xiE ne\n\n讲 究呢！你知道哪些呢？\n\n3\n   呀！我吃到了包着糖\n块的好运饺！\n\n4\n   初一，全家人都穿上了\n爸爸买回来的新衣服。\n63\n\nduT ySng de chuWn tGng xUn niWn\n\n多 样 的 传 统 新 年\nhDn duT mIn zP hWi yGu zK\n\njJ\n\nde chuWn tGng\n\n   很 多 民 族 还 有 自 己 的 传 统\nxUn niWn\n\ndS jiQ de guH fA yD bM yI ySng ne\n\n新 年 ，大家的过法也不一 样 呢！\n\n泼水节是傣族的新年。\n\n跳锅庄舞，庆祝藏历新年。\n\n5\n   吃完饭，我跟着爸爸妈妈去\n拜年，两只手被握得很暖和。\n64\n\n6\n   过了初五，爸爸修了桌椅，\n换了灯泡。家里焕然一新了。\n\n第四单元\n\n天气虽冷有温暖\n\nzhF xiE qKng zhM xUn niWn de fQng shK\n\n   这 些 庆 祝 新 年 的 方 式\nzhEn yGu yK\n\nsi\n\nwG hWi zhU dSo,2.0,义务教育教科书·道德与法治一年级上册,16,996,2025-07-21T14:24:39.614Z,2.0,2025-07-18T13:53:58.285Z,一年级,[object Object],node-poppler,unknown,0.4903417533432392,0.5,1,,,,,true,true,,mathematics,上册,/Users/LeoQin/Documents/GitHub/PDFconvertor/training_data/小学/道德与法治/统编版/义务教育教科书·道德与法治一年级上册.pdf,义务教育教科书·道德与法治一年级上册.json,道德与法治,14271
义务教育教科书·道德与法治一年级上册_chunk_9,9,"跳锅庄舞，庆祝藏历新年。 5 吃完饭，我跟着爸爸妈妈去拜年，两只手被握得很暖和。 64 6 过了初五，爸爸修了桌椅， 换了灯泡。家里焕然一新了。 第四单元天气虽冷有温暖 zhF xiE qKng zhM xUn niWn de fQng shK 这些 庆祝 新年 的方 式 zhEn yGu yK si wG hWi zhU dSo 真有 意思， 我还 知道 云南白族人过春节时讲究全家喝米花糖水，预示着新年过上甜美的生活。 内蒙古的蒙古族小姑娘给长者献上哈达。 贵州苗家女挑着稻花鱼回家看望父母，欢度苗族新年。 7 8 爸爸 又要 去外 地工 作了，我们都舍不得爸爸走。 我把心爱的小星星发卡送给了爸爸，希望他在外面平安、好运！ 65 xUn niWn de lJ wM 16 新年的礼物 xUn niWn de shTu huH 新年的收 获我又长高了， 体重也增加了！ 我学洗衣服了。 我能读很多书了。 wG de shTu huH shK 我的 收获 是 66 第四单元 shTu huH nA lJ lWi 收获 哪里来 wG zK 天气虽冷有温暖 jJ hDn nL 你已经能跳五个了，慢慢来， 一定能跳得更多！ lK 我自己很努力。 hWi yGu hDn duT rRn 还有 很多 人 bQng guo wG 帮过 我遇到难题的时候，老师同桌帮我我生病的时候 67 xUn niWn xUn yuSn 新年 心愿自己做张贺卡，写上几句心里话。 贺卡贺卡送给 chP le sHng hF kA 除了 送贺 卡 , wG hWi kD yJ 我还 可以 68 第四单元 xiD gF xUn yuSn cPn qJ 天气虽冷有温暖 lWi 写个 心愿 存起 来， mIng niWn zSi dA kQi 明年再打开！ xiAo shM shuT 小树 说， xUn niWn shK lC de nFn yW",813,0.40754464285714287,medium,text-extracted,"跳锅庄舞，庆祝藏历新年。\n\n5\n   吃完饭，我跟着爸爸妈妈去\n拜年，两只手被握得很暖和。\n64\n\n6\n   过了初五，爸爸修了桌椅，\n换了灯泡。家里焕然一新了。\n\n第四单元\n\n天气虽冷有温暖\n\nzhF xiE qKng zhM xUn niWn de fQng shK\n\n   这 些 庆 祝 新 年 的 方 式\nzhEn yGu yK\n\nsi\n\nwG hWi zhU dSo\n\n真 有 意 思 ， 我 还 知 道 ……\n\n   云南白族人过春节时讲究全家喝米花\n糖水，预示着新年过上甜美的生活。\n\n   内蒙古的蒙古族小姑娘给\n长者献上哈达。\n\n   贵州苗家女挑着稻花鱼回家看望\n父母，欢度苗族新年。\n\n7\n\n8\n\n   爸 爸 又 要 去 外 地 工 作\n了，我们都舍不得爸爸走。\n\n   我把心爱的小星星发卡送给了\n爸爸，希望他在外面平安、好运！\n65\n\nxUn\n\nniWn\n\nde\n\nlJ\n\nwM\n\n16 新年的礼物\nxUn niWn\n\nde shTu huH\n\n新年的 收 获\n我又长高了，\n体重也增加了！\n\n我学洗衣服了。\n\n我能读很多书了。\n\nwG de shTu huH shK\n\n我 的 收 获 是 ……\n\n66\n\n第四单元\n\nshTu huH\n\nnA\n\nlJ\n\nlWi\n\n收 获 哪 里来\n\nwG zK\n\n天气虽冷有温暖\n\njJ hDn nL\n\n你已经能跳五个了，慢慢来，\n一定能跳得更多！\n\nlK\n\n我自己很努力。\n\nhWi yGu hDn duT rRn\n\n   还 有 很 多 人\nbQng guo wG\n\n帮 过 我 ……\n遇到难题的\n时候，老师……\n\n同桌帮我……\n   我生病\n的时候……\n\n67\n\nxUn niWn xUn yuSn\n\n新 年 心愿\n   自己做张\n贺卡，写上几\n句心里话。\n\n贺卡\n\n贺卡送给……\n\nchP le sHng hF kA\n\n   除 了 送 贺 卡 ,\nwG hWi kD\n\nyJ\n\n我 还 可 以 ……\n68\n\n第四单元\n\nxiD gF xUn yuSn cPn qJ\n\n天气虽冷有温暖\n\nlWi\n\n   写 个 心 愿 存 起 来 ，\nmIng niWn zSi dA kQi\n\n明年再打开！\n\nxiAo shM shuT\n\n小 树 说 ，\nxUn niWn\n\nshK\n\nlC\n\nde\n\nnFn\n\nyW",2.0,义务教育教科书·道德与法治一年级上册,17,993,2025-07-21T14:24:39.614Z,2.0,2025-07-18T13:53:58.285Z,一年级,[object Object],node-poppler,unknown,0.5457317073170732,0.5,1,,,,,true,,,general,上册,/Users/LeoQin/Documents/GitHub/PDFconvertor/training_data/小学/道德与法治/统编版/义务教育教科书·道德与法治一年级上册.pdf,义务教育教科书·道德与法治一年级上册.json,道德与法治,14271
义务教育教科书·道德与法治一年级上册_chunk_10,10,shK lC de nFn yW 新年 是绿 的嫩 芽。 xiAo niAo shuT 小鸟 说， xUn niWn shK gFng qiWng de chK bAng 新年 是更 强的 翅膀。 xiAo pRng you shuT 小朋 友说， 69 后记 《义务教育教科书道德与法治》（一〜六年级）由教育部组织编写，南京师范大学鲁洁教授担任总主编。 本册教科书的撰写者包括方丽敏（第15、16 课）、方峥嵘（第2、3 课）、左兆军（第10、12课） 、孙民（第6、8课） 、高军玉（第7、9、11课） 、孙彩平（第1、4、 5、13、14课；其中，王俊杰参加了第1、4课初稿的编写，孟云虎参加了第13、14 课初稿的编写）；易森林参与了全册书的编写研讨工作；方晓春、王雅丽、邱彩兰、 彭文超、郭琴等为教科书编写做了大量的服务工作。李旻为本书封面绘制插图。 林德、韩震、万俊人、夏学銮、成尚荣、朱明光、韩小明、赵聪、伍新春、 赵景欣、周晓超等审查专家提出了很多宝贵的修改意见，对教科书的修改完善给予了悉心指导和倾力帮助。在教育部的组织下，广大一线优秀教师反馈了很多意见和建议，保证了教学的适切性。在试教和试用过程中，我们得到了北京市、 江苏省、浙江省、安徽省、福建省、河南省、湖北省、重庆市、四川省以及新疆维吾尔自治区等地教育科学研究院（所）、教研室及一线教师的大力支持，他们的意见和建议为教科书的进一步完善提供了保障。 人民教育出版社承担了教科书的编辑出版工作，在组织编写、试教试用方面给予了全方面的协助。此外，对教科书的编写、出版提供过帮助的同仁和社会各界朋友还有很多，在此一并表示诚挚感谢！ 期盼使用本套教科书的广大师生和家长提出宝贵意见，我们将集思广益，不断修订，使教科书趋于完善。 联系方式电 话：010 58758553 电子邮箱：jcfk pep.com.cn 编者 2016年7月,800,0.5330585106382978,medium,text-extracted,shK\n\nlC\n\nde\n\nnFn\n\nyW\n\n新 年 是 绿 的 嫩 芽 。\nxiAo niAo shuT\n\n小 鸟 说 ，\nxUn niWn\n\nshK gFng qiWng de\n\nchK bAng\n\n新 年 是 更 强 的 翅 膀 。\nxiAo pRng you shuT\n\n小 朋 友 说 ，\n……\n\n69\n\n后 记\n《义务教育教科书\n\n道德与法治》（一〜六年级）由教育部组织编写，南京师\n\n范大学鲁洁教授担任总主编。\n本册教科书的撰写者包括方丽敏（第15、16 课）、方峥嵘（第2、3 课）、左兆\n军（第10、12课）\n、孙民（第6、8课）\n、高军玉（第7、9、11课）\n、孙彩平（第1、4、\n5、13、14课；其中，王俊杰参加了第1、4课初稿的编写，孟云虎参加了第13、14\n课初稿的编写）；易森林参与了全册书的编写研讨工作；方晓春、王雅丽、邱彩兰、\n彭文超、郭琴等为教科书编写做了大量的服务工作。李旻为本书封面绘制插图。\n林���德、韩震、万俊人、夏学銮、成尚荣、朱明光、韩小明、赵聪、伍新春、\n赵景欣、周晓超等审查专家提出了很多宝贵的修改意见，对教科书的修改完善给\n予了悉心指导和倾力帮助。在教育部的组织下，广大一线优秀教师反馈了很多\n意见和建议，保证了教学的适切性。在试教和试用过程中，我们得到了北京市、\n江苏省、浙江省、安徽省、福建省、河南省、湖北省、重庆市、四川省以及新疆\n维吾尔自治区等地教育科学研究院（所）、教研室及一线教师的大力支持，他们\n的意见和建议为教科书的进一步完善提供了保障。\n人民教育出版社承担了教科书的编辑出版工作，在组织编写、试教试用方面\n给予了全方面的协助。此外，对教科书的编写、出版提供过帮助的同仁和社会各\n界朋友还有很多，在此一并表示诚挚感谢！\n期盼使用本套教科书的广大师生和家长提出宝贵意见，我们将集思广益，不\n断修订，使教科书趋于完善。\n联系方式\n电\n话：010-58758553\n电子邮箱：jcfk@pep.com.cn\n\n编者\n2016年7月,2.0,义务教育教科书·道德与法治一年级上册,19,849,2025-07-21T14:24:39.614Z,2.0,2025-07-18T13:53:58.285Z,一年级,[object Object],node-poppler,unknown,0.7033557046979866,0.5,1,,,,,true,,,general,上册,/Users/LeoQin/Documents/GitHub/PDFconvertor/training_data/小学/道德与法治/统编版/义务教育教科书·道德与法治一年级上册.pdf,义务教育教科书·道德与法治一年级上册.json,道德与法治,14271
义务教育教科书·道德与法治一年级上册_chunk_11,11,编者 2016年7月谨向为本书提供照片和资料的单位及人士致谢孟 世刚（p20 左下 图、 右下 图，p23 左下 图、p27 右上 图、p27 下图 ）； 郭雯 霞 （p20 下中图、p27 左上图）；安徽芜湖育红小学（p21 上图）；张雪敬（p23 上图、右上图）；浙江杭州余杭区时代小学（p23 左上图、右下图）；东方 IC 网（p60 左上图、右上图、右下图，p65 左上图）；中国新闻图片网（p64 上图、下图，p65 左下图）；民族画报社（p65 右中图）。 务 DAODE YU FAZHI 义 YIWU JIAOYU JIAOKESHU 教育 全国优秀教材特等奖教 科书 道德与法治义务教育教科书一年级上册道德与 法治道 德与 法一年级治 上册一年级上 册 产品道德与法治一上封面.indd 1 2022 7 15 下午1:48,371,0.4478048780487805,medium,text-extracted,编者\n2016年7月\n\n谨向为本书提供照片和资料的单位及人士致谢\n孟 世 刚（p20 左 下 图、 右 下 图，p23 左 下 图、p27 右 上 图、p27 下 图 ）； 郭 雯 霞\n（p20 下中图、p27 左上图）；安徽芜湖育红小学（p21 上图）；张雪敬（p23 上图、右上\n图）；浙江杭州余杭区时代小学（p23 左上图、右下图）；东方 IC 网（p60 左上图、右\n上图、右下图，p65 左上图）；中国新闻图片网（p64 上图、下图，p65 左下图）；民族\n画报社（p65 右中图）。\n\n®\n\n务\n\nDAODE YU FAZHI\n\n义\n\nYIWU JIAOYU JIAOKESHU\n\n教\n育\n\n全国优秀教材特等奖\n\n教\n科\n书\n\n道德与法治\n\n义务教育教科书\n\n一年级 上册\n\n道德\n与\n法治\n\n道\n德\n与\n法\n\n一年级\n\n治\n\n上册\n一年级\n上 册\n\n绿色印刷产品\n\n道德与法治一上封面.indd 1\n\n2022/7/15 下午1:48,2.0,义务教育教科书·道德与法治一年级上册,20,426,2025-07-21T14:24:39.614Z,2.0,2025-07-18T13:53:58.285Z,一年级,[object Object],node-poppler,unknown,0.5907692307692308,0.5,1,,,,,true,,,general,上册,/Users/LeoQin/Documents/GitHub/PDFconvertor/training_data/小学/道德与法治/统编版/义务教育教科书·道德与法治一年级上册.pdf,义务教育教科书·道德与法治一年级上册.json,道德与法治,14271
