Chunk_ID,Chunk_Index,Content,Content_Length,Quality_Score,Reliability,Source_Type,Original_Content,Enhancement_Version,averageConfidence,book_name,chunkIndex,enhancementTimestamp,enhancementVersion,fileName,filePath,grade,ocrMethod,publisher,qualityMetrics_chineseCharRatio,qualityMetrics_coherenceScore,qualityMetrics_lengthScore,qualityMetrics_ocrConfidence,semanticFeatures_hasDefinition,semanticFeatures_hasExperiment,semanticFeatures_hasFormulas,semanticFeatures_hasNumbers,semanticFeatures_hasQuestion,semanticFeatures_isTableContent,semanticFeatures_subjectArea,semester,source_file,subject,totalPages,uniqueId
义务教育教科书·数学八年级上册_chunk_0,0,"的问题， (1 ) 在这 个问题中， 哪些 是已 知量， 哪些 是未 知量 ? (2 ) 如果 选取 某一 个未 知量 用 x 表示， 那么 其他 未知 量怎样用 关于 x 的代数式 表示 ? (3 ) 这个 问题中 的等 量关系是 什么 ? (4 ) 选择哪个等 量关 系， 可以 得到 关于未 知数 x 的方程 ? 设采用新 工艺前， 王师傅每 天焊接个 工件 . 采用新 工艺前 王师 传工作了 了天， 采用新 工艺后， 王师傅工作了 310 二 100 天 . 根据等 量关系采用新 工艺前 工作的 天数 采用新 工艺后 工作的 天数 8 得 Jan0 l00 8 (5 ) 观察 (4) 中得 到的 方程， 你发 现它 有什么特征 ? 这个 方程的 分母 中， 全人 二请 含有未 知数 . 量和: 像这 样， 分母 中含有未 知数 的方程叫做分 式方 程 〈fractional equation ) . (6 ) 怎样解 分式 方程 220 二 100 8 呢 ? 想一 想， 与同学交流 . 方程两 边都 乘最 简公 分母 1 sx， 得 150 210 12x . 如果 能把 这个 方程解 这个 一元 一次 方程， 得的 分母 去返， 就可 以把 30 它化 成整 式方程了 . 检验 : 把 x 30 代入 原方程， 左边 右边 . o 所以 ,xz 30 是原 方程的 根 . A 代入本 节开始时 提出的 问题检验， 符合 题意 . ig 所以 采用新 工艺前 王师傅每 天焊接 30 个工件 . 浊一 般地， 解分 式方程的 思路是， 先将 方程的 y 两边 同乘 一个 适当的 整式 ( 通常是 各分 式的 最简 公分母 )， 化去 方程中 的分 母， 从而 把解 分式 方程转化成 解整 式方程的 问题 3 2 1",773,0.44815056576898565,medium-low,ocr,"的 问题 ，\n(1 ) 在 这 个 问题 中 ， 哪 些 是 已 知 量 ， 哪 些 是 未 知 量 ?\n(2 ) 如 果 选 取 某 一 个 未 知 量 用 x 表 示 ， 那 么 其 他 未 知 量 怎样 用 关于 x 的 代数\n式 表示 ?\n(3 ) 这 个 问题 中 的 等 量 关系 是 什么 ?\n(4 ) 选择 哪个 等 量 关 系 ， 可 以 得 到 关于 未 知 数 x 的 方程 ?\n设 采用 新 工艺 前 ， 王 师傅 每 天 焊接 * 个 工件 . 采用 新 工艺 前 王 师 传 工作 了\n了 天， 采用 新 工艺 后 ， 王 师傅 工作 了 310 二 100 天 . 根据 等 量 关系\n采用 新 工艺 前 工作 的 天 数 + 采用 新 工艺 后 工作 的 天 数 = 8\n得 Jan0=l00 -8\n(5 ) 观察 (4) 中 得 到 的 方程 ， 你 发 现 它 有 什么 特征 ?\n这 个 方程 的 分 母 中 ， 全 人 二 请 |\n含有 未 知 数 . | 量\n和:\n像 这 样 ， 分 母 中 含有 未 知 数 的 方程 叫做 分 式 方 程 〈fractional equation ) .\n(6 ) 怎样 解 分 式 方程 + 220 二 100 - 8 呢 ? 想 一 想 ， 与 同学 交流 .\n=== 第 11 页 ===\n方程 两 边 都 乘 最 简 公 分 母 1 sx， 得\n150 + 210 = 12x . 如 果 能 把 这 个 方程\n解 这 个 一 元 一 次 方程 ， 得 的 分 母 去 返 ， 就 可 以 把\n30 它 化 成 整 式 方程 了 .\n检验 : 把 x = 30 代 入 原 方程 ， 左 边 = 右边 . o\n所 以 ,xz = 30 是 原 方程 的 根 . -A\n代入 本 节 开始 时 提出 的 问题 检验 ， 符 合 题 意 . ig\n所 以 采用 新 工艺 前 王 师傅 每 天 焊接 30 个 工件 . 浊\n一 般 地 ， 解 分 式 方程 的 思路 是 ， 先 将 方程 的 y\n两 边 同 乘 一 个 适当 的 整 式 ( 通常 是 各 分 式 的 最 简\n公分 母 ) ， 化 去 方程 中 的 分 母 ， 从 而 把 解 分 式 方程 转化 成 解 整 式 方程 的 问题\n3 2 1",2.0,75.45226130653266,义务教育教科书·数学八年级上册,9,2025-07-21T14:23:32.492Z,2.0,义务教育教科书·数学八年级上册,/Users/LeoQin/Documents/GitHub/PDFconvertor/training_data/初中/数学/青岛版-青岛出版社/八年级/义务教育教科书·数学八年级上册.pdf,八年级,tesseract.js-parallel,unknown,0.7421731123388582,0.5,1,75.45226130653266,true,true,,true,true,,mathematics,上册,义务教育教科书·数学八年级上册.json,数学,199,初中_数学_青岛版_八年级_义务教育教科书·数学八年级上册
义务教育教科书·数学八年级上册_chunk_1,1,"增根， 必须 舍去 . 由上 面的 例 1， 例 2 和例 3， 你能 总结 一下 解分 式方程的 主要步骤吗 ? 与同 学交流 . Q suaa 当疡 为何 值时， 解分 式方程 xz 3 六 x 2 2 x 会出 现增 根 ? (CA ) 方程两 边分 式的 最简 公分 母是 (x 1) (x l ) (B) 方程两 边都 乘 (x 1) (x 1l )， 得整 式方式 2 (x 1) 3 (x 1) 6 (C) 解这 个整 式方程 , 得 x 1 (D) 原方 程的 解为 x 1 2. 解下 列方程 : 1 J 3 1 ()35 3 5 (2) 去 5 二 1 2 6x 3 2 1 x (3) 7 (4) 755 22x 1 C 斧有 甲乙两 地相 上距 360 km， 张老师 、 王老师分 别从 甲地 乘蛙 7 时出 发的 普通客车和 8 时 15 分出 发的 豪华客车去 乙地， 两车 恰好同时到 达 . 已知 豪华客 车与 普通客车的 平均速度的 比是 4 : 3， 两车 的平均速度分 别是 多少 ? 这个 问题中 的等 量关系是 : 下 o 下普通客车所 用时 间豪华客车所 用时 间 2 h, 5 同业解。。 设豪华客车的 平均速度为 4x kmmh, 普通客车的 平均速度为 3r km， 于是， 豪华 客车 从甲 地到 乙地 所用 的时 间为 2 h， 普通 客车从 甲地 到乙 地所 用的 时间 为 :ee b. _ 根据题 意， 得 r 加油 站一 一一 a 1 360 360 _5 1 有些 实际问题需要通过列 上 3x 4 人 〖 出分 式方程加 以解决， 这就 是解 这个 方程， 得， 说， 分式 方程也 是刻画现实世 ) 2 界数 量关系的 有效 模型， 根， 并符合题 意 .",763,0.363662936309244,low,ocr,"增 根 ， 必 须 舍 去 .\n由 上 面 的 例 1， 例 2 和 例 3， 你 能 总 结 一 下 解 分 式 方程 的 主要 步骤 吗 ? 与 同\n学 交流 .\nQ suaa\n当 疡 为 何 值 时 ， 解 分 式 方程\nxz-3 六\nx—2 2-x\n会 出 现 增 根 ?\n=== 第 15 页 ===\n(CA ) 方程 两 边 分 式 的 最 简 公 分 母 是 (x—1) (x+l )\n(B) 方程 两 边 都 乘 (x-1) (x+1l )， 得 整 式 方式 2 (x-1)+3 (x+1)=6\n(C) 解 这 个 整 式 方程 , 得 x= 1\n(D) 原 方 程 的 解 为 x= 1\n2. 解 下 列 方程 :\n1 J= 3 1\n()35+3=5 (2) 去 5 二 1\n2 6x 3 2 1-x\n(3) 7 + (4) 755 22x 1\nC 斧 有 甲乙 两 地 相 上 距 360 km， 张 老师 、 王 老师 分 别 从 甲 地 乘 蛙 7 时 出 发\n的 普通 客车 和 8 时 15 分 出 发 的 豪华 客车 去 乙 地 ， 两 车 恰好 同时 到 达 . 已 知 豪华 客\n车 与 普通 客车 的 平均 速度 的 比 是 4 : 3， 两 车 的 平均 速度 分 别 是 多 少 ?\n这 个 问题 中 的 等 量 关系 是 : 下 o° 下\n普通 客车 所 用 时 间 -豪华 客车 所 用 时 间 = 2 h, 5\n同业\n解 。 。 设 豪华 客车 的 平均 速度 为 4x kmmh, 普通 客车 的 平均 速度 为 3r km ，\n于 是 ， 豪 华 客 车 从 甲 地 到 乙 地 所 用 的 时 间 为 2 h， 普 通 客车 从 甲 地 到 乙 地 所 用\n的 时 间 为 :ee b. _\n根据 题 意 ， 得 r - 加 油 站 一 一 一 a\n1 |\n360 360 _5 1 有 些 实际 问题 需要 通过 列 上\n3x 4 人 〖 出 分 式 方程 加 以 解决 ， 这 就 是 |\n解 这 个 方程 ， 得 ， 说 ， 分 式 方程 也 是 刻画 现实 世 )\n2 ‖ 界 数 量 关系 的 有 效 模型 ，\n根 ， 并 符合 题 意 .",2.0,75.45226130653266,义务教育教科书·数学八年级上册,13,2025-07-21T14:23:32.492Z,2.0,义务教育教科书·数学八年级上册,/Users/LeoQin/Documents/GitHub/PDFconvertor/training_data/初中/数学/青岛版-青岛出版社/八年级/义务教育教科书·数学八年级上册.pdf,八年级,tesseract.js-parallel,unknown,0.6468330134357005,0.5,1,75.45226130653266,,,,true,true,,physics,上册,义务教育教科书·数学八年级上册.json,数学,199,初中_数学_青岛版_八年级_义务教育教科书·数学八年级上册
义务教育教科书·数学八年级上册_chunk_2,2,"所用 的时 间为 :ee b. _ 根据题 意， 得 r 加油 站一 一一 a 1 360 360 _5 1 有些 实际问题需要通过列 上 3x 4 人 〖 出分 式方程加 以解决， 这就 是解 这个 方程， 得， 说， 分式 方程也 是刻画现实世 ) 2 界数 量关系的 有效 模型， 根， 并符合题 意 . 由 4x 4x24 96,3x 3x24 72 可知 , 豪华客车的 平均速度为 96 km h, 普通客车的 平均速度为 72 kmmh . 上僻 5 阳光小 区有 入型 和 B 型两 种户型的 ra 住宅出 售，A 型与 B 型住宅每 平方米 的价格分 别乓 和是 全楼 每平方米 平均价格的 1.1 倍与 0.9 倍， 而人 和日 且一 套 A 型比 一套 B 型的 面积少 40 m:. 如果 d 型与 B 型两 种住宅的 售价 分别 为 6 万元 与 81 万元， 求全 楼每 平方米 的平均价格 . 图 3 6 同和俩 则和 设全 楼每 平方米 的平均价格为 x 万元 , 则 A 型住宅每 平方米 的价格为 1.1z 万元，B 型住宅每 平方米 的价格为 0.9x 万元 . 于是，A 型住宅的 面积为 了 om， 也型 住宅的 面积为，Oc mn 、 这个 问题中 的等 量关系是 : 属 o 人妃 型住宅的 面积 4 型住宅的 面积 40 . 根据题 意， 得 81 66 0or 10 整理 ,得 90 60 40. 解这 个方程， 得 x 0.75. 经检验可 知，x 0.75 是原 分式 方程的 根， 并符合题 意 . 所以， 全楼 每平方米 的平均价格为 0.75 万元， 即 7 500 元 . 根据例 5 提供的 信息， 你还 能编制出 一个 用分 式方程解决的 问题吗 ?与同 学交流 .",767,0.34619364347510745,low,ocr,"所 用\n的 时 间 为 :ee b. _\n根据 题 意 ， 得 r - 加 油 站 一 一 一 a\n1 |\n360 360 _5 1 有 些 实际 问题 需要 通过 列 上\n3x 4 人 〖 出 分 式 方程 加 以 解决 ， 这 就 是 |\n解 这 个 方程 ， 得 ， 说 ， 分 式 方程 也 是 刻画 现实 世 )\n2 ‖ 界 数 量 关系 的 有 效 模型 ，\n根 ， 并 符合 题 意 .\n由 4x=4x24=96,3x=3x24=72 可 知 , 豪华 客车 的 平均 速度 为 96 km/h,\n普通 客车 的 平均 速度 为 72 kmmh .\n=== 第 16 页 ===\n上 僻 5 阳光 小 区 有 入 型 和 B 型 两 种 户型 的 ra\n住宅 出 售 ，A 型 与 B 型 住宅 每 平方 米 的 价格 分 别 | 乓 和\n是 全 楼 每 平方 米 平均 价格 的 1.1 倍 与 0.9 倍 ， 而 人 | 和 日\n且 一 套 A 型 比 一 套 B 型 的 面积 少 40 m:. 如 果 ^  d  SECHE\n型 与 B 型 两 种 住宅 的 售 价 分 别 为 6 万 元 与 81 万\n元 ， 求 全 楼 每 平方 米 的 平均 价格 . 图 3-6\n同和 俩 则 和 设 全 楼 每 平方 米 的 平均 价格 为 x 万 元 , 则 A 型 住宅 每 平方 米 的 价格\n为 1.1z 万 元 ，B 型 住宅 每 平方 米 的 价格 为 0.9x 万 元 . 于 是 ，A 型 住宅 的 面积 为\n了 om， 也 型 住宅 的 面积 为 ，Oc mn\n、 这 个 问题 中 的 等 量 关系 是 : 属 o° 人\n妃 型 住宅 的 面积 -4 型 住宅 的 面积 =40 .\n根据 题 意 ， 得\n81 66\n0or IT 10\n整理 ,得\n90 60\n—— —40.\n解 这 个 方程 ， 得\nx=0.75.\n经 检验 可 知 ，x = 0.75 是 原 分 式 方程 的 根 ， 并 符合 题 意 .\n所 以 ， 全 楼 每 平方 米 的 平均 价格 为 0.75 万 元 ， 即 7 500 元 .\n根据 例 5 提供 的 信息 ， 你 还 能 编制 出 一 个 用 分 式 方程 解决 的 问题 吗 ?与 同\n学 交流 .",2.0,75.45226130653266,义务教育教科书·数学八年级上册,14,2025-07-21T14:23:32.492Z,2.0,义务教育教科书·数学八年级上册,/Users/LeoQin/Documents/GitHub/PDFconvertor/training_data/初中/数学/青岛版-青岛出版社/八年级/义务教育教科书·数学八年级上册.pdf,八年级,tesseract.js-parallel,unknown,0.6838235294117647,0.5,1,75.45226130653266,,,,true,true,,physics,上册,义务教育教科书·数学八年级上册.json,数学,199,初中_数学_青岛版_八年级_义务教育教科书·数学八年级上册
义务教育教科书·数学八年级上册_chunk_3,3,"整理 ,得 90 60 40. 解这 个方程， 得 x 0.75. 经检验可 知，x 0.75 是原 分式 方程的 根， 并符合题 意 . 所以， 全楼 每平方米 的平均价格为 0.75 万元， 即 7 500 元 . 根据例 5 提供的 信息， 你还 能编制出 一个 用分 式方程解决的 问题吗 ?与同 学交流 . .时 as7 改人 复习与 巩固 1. 解下 列方程 ; 殖 J。 二 2 _q. (1)Z 1 (2) 冯二 1 axt2 _ 3 1 1 S 下 0 2 解下 列方程: x _1 _1_ (1) 55 对 3 (2) 5 1 1 由了 X3 十 2X2 十 X 一 X2 二 2x 二 1 2x 2x : 4 当 x 为何 值时， 分式 过与 二互 为相反数 ? 5. 小亮 从图 书馆借 了一 本书， 共 280 页， 借期 是两 周 . 当他 读完 书的 一半 时， 发现 以后 平均每 天读书的 页数 必须增加 1 售才能在 借期 内读 完 . 小亮 读前 半本 书时 平均每 天读 多少 页 ? 6. 某地 对一 段长 达 4 800 mm 的河 提进行加 固 . 在加 固 600 mm 后， 采用 新的 加固 模式， 每天 的加 国长 度是 原来的 2 售 . 用 9 天完成了 全部 加固 任务 . 原来每 天加 固河 堤多 少米 ? 7 A， 也两 城市间 新建 一条 城际 铁路， 建成 后， 铁路 运行里 程由 目前的 312 km 缩短至 154 km . 旅客列车的 设计时 速是 现行时 速的 2.5 倍， 运行 时间 将因此缩短约 3.13 小时 . 求城 际铁路列车的 设计时 速 . 勋后 发与 延伸 8. 如果等 式二 二二 成立， 用关于 a， 局的 代数式 表示 c。",764,0.3873216080402009,low,ocr,"整理 ,得\n90 60\n—— —40.\n解 这 个 方程 ， 得\nx=0.75.\n经 检验 可 知 ，x = 0.75 是 原 分 式 方程 的 根 ， 并 符合 题 意 .\n所 以 ， 全 楼 每 平方 米 的 平均 价格 为 0.75 万 元 ， 即 7 500 元 .\n根据 例 5 提供 的 信息 ， 你 还 能 编制 出 一 个 用 分 式 方程 解决 的 问题 吗 ?与 同\n学 交流 .\n=== 第 17 页 ===\n.时 as7\n- 改 人 复习 与 巩固\n1. 解 下 列 方程 ;\n殖 -=J。 二 -2 _q.\n(1)Z==1 (2) 冯 + 二 = 1\naxt2 -_ 3 1 1 S\n下 0\n2 解 下 列 方程:\nx _1 ® _1_\n(1) 55 对 3 (2) == 5 1\n1 由\n了 X3 十 2X2 十 X 一 X2 二 2x 二 1 2x%+2x :\n4 当 x 为 何 值 时 ， 分 式 过 与 二 - 互 为 相反 数 ?\n5. 小 亮 从 图 书馆 借 了 一 本 书 ， 共 280 页 ， 借 期 是 两 周 . 当 他 读 完 书 的 一 半 时 ， 发 现 以\n后 平均 每 天 读书 的 页 数 必须 增加 1 售 才能 在 借 期 内 读 完 . 小 亮 读 前 半 本 书 时 平均 每\n天 读 多 少 页 ?\n6. 某 地 对 一 段 长 达 4 800 mm 的 河 提 进行 加 固 . 在 加 固 600 mm 后 ， 采 用 新 的 加 固 模 式 ，\n每 天 的 加 国 长 度 是 原来 的 2 售 . 用 9 天 完成 了 全 部 加 固 任 务 . 原来 每 天 加 固 河 堤 多 少\n米 ?\n7 A， 也 两 城市 间 新 建 一 条 城 际 铁路 ， 建 成 后 ， 铁 路 运行 里 程 由 目前 的 312 km 缩短 至\n154 km . 旅客 列车 的 设计 时 速 是 现行 时 速 的 2.5 倍 ， 运 行 时 间 将 因此 缩短 约 3.13 小\n时 . 求 城 际 铁路 列车 的 设计 时 速 .\n=== 第 18 页 ===\n勋 后 发 与 延伸\n8. 如果 等 式 二 = 二 + 二 成 立 ， 用 关于 a， 局 的 代数 式 表示 c。",2.0,75.45226130653266,义务教育教科书·数学八年级上册,15,2025-07-21T14:23:32.492Z,2.0,义务教育教科书·数学八年级上册,/Users/LeoQin/Documents/GitHub/PDFconvertor/training_data/初中/数学/青岛版-青岛出版社/八年级/义务教育教科书·数学八年级上册.pdf,八年级,tesseract.js-parallel,unknown,0.6628352490421456,0.6,1,75.45226130653266,,,,true,true,,mathematics,上册,义务教育教科书·数学八年级上册.json,数学,199,初中_数学_青岛版_八年级_义务教育教科书·数学八年级上册
义务教育教科书·数学八年级上册_chunk_4,4,铁路 运行里 程由 目前的 312 km 缩短至 154 km . 旅客列车的 设计时 速是 现行时 速的 2.5 倍， 运行 时间 将因此缩短约 3.13 小时 . 求城 际铁路列车的 设计时 速 . 勋后 发与 延伸 8. 如果等 式二 二二 成立， 用关于 a， 局的 代数式 表示 c。 9 一个 二位 数的 十位 数字与 个位 数字的 和是 12. 如果 交的 十位 数字与 个位 数字的 位置， 并把 所得 到的 新的 二位 数作为分 子， 把原来的 二位 数作为分 母， 所得 的分 数约 分后 为了 了求 这个 二位 数 . 10. 一项 工程， 若由 甲队 单独去 做， 刚好 能如 期完成 ; 若由 乙队 单独去 做， 要比 规定时 间多 用 5 天才能完成 . 若甲 、 乙两 队合 做 4 天， 余下 的工程由 乙队 单独去 做也 正好如 期完成 . 这项 工程预期几 天完成 ? 后人 探索与 创新 11. 如果 解关于 x 的分 式方程二 本 1 时出 现增 根， 求丸 的值 . x 3 x 4 12. 某自来水公司水 费的 计费 办法 是 : 若每 户用 水当月不 超 5 mm， 则每 mm 收费 1.5 元 . 若每 户用 水超过 5 my， 则超出部 分接 加高 定领 收费 . 1 月份， 小亮 家用 水量 是小 莹家 用水 量的 Z. 小亮 家当月水 费为 17.5 元， 小莹 家当月水 费是 27.5 元 . 超过 5 mm 的部 分每 ms 收费多 少元 ? 回顾与 总结 1. 本章 学习 了哪些主要内 容 ? 总结 一下， 与同学交流 2. 什么是 分式 的基本性 质 ?本章的 哪些内 容用 到了 分式 的基本性 质 ?,737,0.4873687488288901,medium-low,ocr,铁 路 运行 里 程 由 目前 的 312 km 缩短 至\n154 km . 旅客 列车 的 设计 时 速 是 现行 时 速 的 2.5 倍 ， 运 行 时 间 将 因此 缩短 约 3.13 小\n时 . 求 城 际 铁路 列车 的 设计 时 速 .\n=== 第 18 页 ===\n勋 后 发 与 延伸\n8. 如果 等 式 二 = 二 + 二 成 立 ， 用 关于 a， 局 的 代数 式 表示 c。\n9 一 个 二 位 数 的 十 位 数字 与 个 位 数字 的 和 是 12. 如 果 交 的 十 位 数字 与 个 位 数字 的 位\n置 ， 并 把 所 得 到 的 新 的 二 位 数 作为 分 子 ， 把 原来 的 二 位 数 作为 分 母 ， 所 得 的 分 数\n约 分 后 为 了 了 求 这 个 二 位 数 .\n10. 一 项 工程 ， 若 由 甲 队 单独 去 做 ， 刚 好 能 如 期 完成 ; 若 由 乙 队 单独 去 做 ， 要 比 规定\n时 间 多 用 5 天 才能 完成 . 若 甲 、 乙 两 队 合 做 4 天 ， 余 下 的 工程 由 乙 队 单独 去 做 也\n正好 如 期 完成 . 这 项 工程 预期 几 天 完成 ?\n-后 人 探索 与 创新\n11. 如 果 解 关于 x 的 分 式 方程 二 本 -- - 1 时 出 现 增 根 ， 求 丸 的 值 .\nx—3 x+4\n12. 某 自来水 公司 水 费 的 计 费 办 法 是 : 若 每 户 用 水 当月 不 超 5 mm， 则 每 mm 收费 1.5 元 .\n若 每 户 用 水 超过 5 my， 则 超出 部 分 接 加 高 定 领 收 费 . 1 月 份 ， 小 亮 家 用 水 量 是 小 莹\n家 用 水 量 的 Z. 小 亮 家 当月 水 费 为 17.5 元 ， 小 莹 家 当月 水 费 是 27.5 元 . 超过 5 mm\n的 部 分 每 ms 收费 多 少 元 ?\n< 回顾 与 总 结\n1. 本 章 学 习 了 哪些 主要 内 容 ? 总 结 一 下 ， 与 同学 交流\n2. 什么 是 分 式 的 基本 性 质 ?本章 的 哪些 内 容 用 到 了 分 式 的 基本 性 质 ?,2.0,75.45226130653266,义务教育教科书·数学八年级上册,16,2025-07-21T14:23:32.492Z,2.0,义务教育教科书·数学八年级上册,/Users/LeoQin/Documents/GitHub/PDFconvertor/training_data/初中/数学/青岛版-青岛出版社/八年级/义务教育教科书·数学八年级上册.pdf,八年级,tesseract.js-parallel,unknown,0.7890625,0.6,1,75.45226130653266,,,,true,true,,mathematics,上册,义务教育教科书·数学八年级上册.json,数学,199,初中_数学_青岛版_八年级_义务教育教科书·数学八年级上册
义务教育教科书·数学八年级上册_chunk_5,5,"家用 水量 的 Z. 小亮 家当月水 费为 17.5 元， 小莹 家当月水 费是 27.5 元 . 超过 5 mm 的部 分每 ms 收费多 少元 ? 回顾与 总结 1. 本章 学习 了哪些主要内 容 ? 总结 一下， 与同学交流 2. 什么是 分式 的基本性 质 ?本章的 哪些内 容用 到了 分式 的基本性 质 ? 3. 用语言和 符号分 别叙述分 式的 加法 、 减法 、 乘法 与除法的 法则， 并各 举一 个说 明 . 4 什么是 比 ? 什么是 比例 ? 比与 比例有 什么区 别和 联系 ? 5. 什么是 比例的 基本性 质 ? 本章 中的 哪些内 容用 到了 比例的 基本性 质 . 6. 举出 生活中 应用 比和 比例的 几个 实际例子， 与同学交流 . 7 什么是 分式 方程解 分式 方程的 基本思路是 什么 ? 8. 为什么解 分式 方程必须验 根 ? 9 你能 概括出 解分 式方程的 一般 步骤吗 ? 10 同一元 一次 方程 、 一次 不等 式组 一样， 分式 方程也 是一 种重要的 数学模型 . 你能 通过一 个实例， 说明 建立和 求解分 式方程模型的 过程 吗 ? 11. 在本 章的 学习 内容 中， 体现 了哪些数学思想 ? 与同学交流全 一综合练习量 人复习与 巩固 1. 填空 : (1 ) 55X2 的值 为 0 时，x 的值 是 ; x2t 4 (2) 已知 1，2，3 三个 数， 请你 添加一 个数， 写出 一个 比例式 . 2. 选择题 : 太阳能 热水器安装有 一个 进水 管 (冷水管 ) 和一 个出 水管 ( 热水 管 ). 单独打开进 水管 , x h 可以 将空 的热水器注 满水 ; 单独打开出 水管，y h 可以 把注 满水 的",749,0.48634371859296477,medium-low,ocr,"家 用 水 量 的 Z. 小 亮 家 当月 水 费 为 17.5 元 ， 小 莹 家 当月 水 费 是 27.5 元 . 超过 5 mm\n的 部 分 每 ms 收费 多 少 元 ?\n< 回顾 与 总 结\n1. 本 章 学 习 了 哪些 主要 内 容 ? 总 结 一 下 ， 与 同学 交流\n2. 什么 是 分 式 的 基本 性 质 ?本章 的 哪些 内 容 用 到 了 分 式 的 基本 性 质 ?\n3. 用 语言 和 符号 分 别 叙述 分 式 的 加 法 、 减 法 、 乘 法 与 除法 的 法 则 ， 并 各 举 一 个 说 明 .\n4 什么 是 比 ? 什么 是 比例 ? 比 与 比例 有 什么 区 别 和 联系 ?\n5. 什么 是 比例 的 基本 性 质 ? 本 章 中 的 哪些 内 容 用 到 了 比例 的 基本 性 质 .\n6. 举 出 生活 中 应 用 比 和 比例 的 几 个 实际 例子 ， 与 同学 交流 .\n7 什么 是 分 式 方程 解 分 式 方程 的 基本 思路 是 什么 ?\n8. 为 什么 解 分 式 方程 必须 验 根 ?\n9 你 能 概括 出 解 分 式 方程 的 一 般 步骤 吗 ?\n10 同一 元 一 次 方程 、 一 次 不 等 式 组 一 样 ， 分 式 方程 也 是 一 种 重要 的 数学 模型 . 你 能\n通过 一 个 实例 ， 说 明 建立 和 求解 分 式 方程 模型 的 过 程 吗 ?\n11. 在 本 章 的 学 习 内 容 中 ， 体 现 了 哪些 数学 思想 ? 与 同学 交流\n=== 第 19 页 ===\n全 一 综合 练习\n< 量 人 复习 与 巩固\n1. 填空 :\n(1 ) 55X2 的 值 为 0 时 ，x 的 值 是 ;\nx2t+4 -\n(2) 已 知 1，2，3 三 个 数 ， 请 你 添加 一 个 数 ， 写 出 一 个 比例 式 .\n2. 选择 题 : 太阳 能 热水器 安装 有 一 个 进 水 管 (冷水 管 ) 和 一 个 出 水 管 ( 热 水 管 ). 单独\n打开 进 水 管 , x h 可 以 将 空 的 热水器 注 满 水 ; 单独 打开 出 水 管 ，y h 可 以 把 注 满 水 的",2.0,75.45226130653266,义务教育教科书·数学八年级上册,17,2025-07-21T14:23:32.492Z,2.0,义务教育教科书·数学八年级上册,/Users/LeoQin/Documents/GitHub/PDFconvertor/training_data/初中/数学/青岛版-青岛出版社/八年级/义务教育教科书·数学八年级上册.pdf,八年级,tesseract.js-parallel,unknown,0.7961904761904762,0.6,1,75.45226130653266,,,,true,true,,mathematics,上册,义务教育教科书·数学八年级上册.json,数学,199,初中_数学_青岛版_八年级_义务教育教科书·数学八年级上册
