Chunk_ID,Chunk_Index,Content,Content_Length,Quality_Score,Reliability,Source_Type,Original_Content,Enhancement_Version,averageConfidence,book_name,chunkIndex,enhancementTimestamp,enhancementVersion,fileName,filePath,grade,ocrMethod,publisher,qualityMetrics_chineseCharRatio,qualityMetrics_coherenceScore,qualityMetrics_lengthScore,qualityMetrics_ocrConfidence,semanticFeatures_hasDefinition,semanticFeatures_hasExperiment,semanticFeatures_hasFormulas,semanticFeatures_hasNumbers,semanticFeatures_hasQuestion,semanticFeatures_isTableContent,semanticFeatures_subjectArea,semester,source_file,subject,totalPages,uniqueId
义务教育教科书·数学八年级上册_chunk_42,42,亮在 上台阶时 发现， 如果 只上 一个 台阶， 有一 种走 法 ;上两 个台阶时， 可以 每步 都上 一个 台阶或 者一 步上 两个 台阶 . 这样 就有 两种 不同 的走 法， 如果 规定 一步 至多 上两 个台阶， 那么 上三 个台阶， 共有 1 1 1，1 2 和 2 1 三种 不同 的走 法 . 按照上 述规律， 他猜想上 ) 个台阶， 有六 种不 同的 走法 . 他的 猜想正确吗 ? 如果 正确， 说明 你的 理由 ;如果 不正确， 举出 一个 反例怎样运用推理的 方法证 实一 个命题是 真命题呢 ? 首先， 我们 需要从 已经 了解 的数学命题中， 挑选 出一 部分 人们 通过长 期实 践总 结出 来， 被大 家所 公认的 命题作为基本事实， 用基本事实作为证 实所 有其 他几何命题的 起始 依据 . 在已 学过 的几何命题中， 本书 确定 下列 命题作为基本事实 ?: ( 1 ) 两点 确定一 条直线 ; ( 2 ) 两点 之间， 线段 最短 ; ( 3 ) 过一 点有 且只 有一 条直线与 这条 直线垂直 ; (4) 两条 直线被 第三 条直线所 截， 如果 同位 角相 等， 那么 两直线平行 ; ( 5 ) 过直线外 一点 有且 只有 一条 直线与 这条 直线平行 ; ( 6 ) 两边 及其 夹角 分别 相等的 两个 三角形全 等 ; (7) 两角 及其 夹边 分别 相等的 两个 三角形全 等 ; ( 8 ) 三边 分别 相等的 两个 三角形全 等 . 鲜本 书中 还有 一条 基本事实， 在九 (上 ) 学习 相似 形时 再提出 . 等式 的基本性 质和 将来 要学 到的 不等 式的 基本性 质也 看做 基本事实 .,730,0.5243630351758793,medium-low,ocr,亮 在 上 台阶 时 发 现 ， 如 果 只 上 一 个 台阶 ， 有 一 种 走 法 ;上 两 个 台阶 时 ， 可 以 每\n步 都 上 一 个 台阶 或 者 一 步 上 两 个 台阶 . 这 样 就 有 两 种 不 同 的 走 法 ， 如 果 规 定 一 步 至\n多 上 两 个 台阶 ， 那 么 上 三 个 台阶 ， 共 有 1+1+1，1+2 和 2+1 三 种 不 同 的 走 法 . 按照\n上 述 规律 ， 他 猜想 上 ) 个 台阶 ， 有 六 种 不 同 的 走 法 . 他 的 猜想 正确 吗 ?” 如 果 正 确 ，\n说 明 你 的 理由 ;如 果 不 正确 ， 举 出 一 个 反例\n怎样 运用 推理 的 方法 证 实 一 个 命题 是 真 命题 呢 ?\n首先 ， 我 们 需要 从 已 经 了 解 的 数学 命题 中 ， 挑 选 出 一 部 分 人 们 通过 长 期 实\n践 总 结 出 来 ， 被 大 家 所 公认 的 命题 作为 基本 事实 ， 用 基本 事实 作为 证 实 所 有 其\n他 几何 命题 的 起 始 依据 .\n在 已 学 过 的 几何 命题 中 ， 本 书 确 定 下 列 命题 作为 基本 事实 ?:\n( 1 ) 两 点 确定 一 条 直线 ;\n( 2 ) 两 点 之 间 ， 线 段 最 短 ;\n( 3 ) 过 一 点 有 且 只 有 一 条 直线 与 这 条 直线 垂直 ;\n(4) 两 条 直线 被 第 三 条 直线 所 截 ， 如 果 同 位 角 相 等 ， 那 么 两 直线 平行 ;\n( 5 ) 过 直线 外 一 点 有 且 只 有 一 条 直线 与 这 条 直线 平行 ;\n( 6 ) 两 边 及 其 夹 角 分 别 相等 的 两 个 三 角形 全 等 ;\n(7) 两 角 及 其 夹 边 分 别 相等 的 两 个 三 角形 全 等 ;\n( 8 ) 三 边 分 别 相等 的 两 个 三 角形 全 等 .\n鲜 本 书 中 还 有 一 条 基本 事实 ， 在 九 (上 ) 学 习 相 似 形 时 再 提出 .\n=== 第 76 页 ===\n等 式 的 基本 性 质 和 将 来 要 学 到 的 不 等 式 的 基本 性 质 也 看 做 基本 事实 .,2.0,75.45226130653266,义务教育教科书·数学八年级上册,86,2025-07-21T14:23:32.493Z,2.0,义务教育教科书·数学八年级上册,/Users/LeoQin/Documents/GitHub/PDFconvertor/training_data/初中/数学/青岛版-青岛出版社/八年级/义务教育教科书·数学八年级上册.pdf,八年级,tesseract.js-parallel,unknown,0.8549019607843137,0.5,1,75.45226130653266,,,,true,true,,mathematics,上册,义务教育教科书·数学八年级上册.json,数学,199,初中_数学_青岛版_八年级_义务教育教科书·数学八年级上册
义务教育教科书·数学八年级上册_chunk_43,43,"(等式 的基本性 质 ). LA1 2 (等量 代换 ). 观察与 思考回顾并 分析 上面 两个 定理的 证明 过程， 它们 都包括了 哪几 个步骤 ? 你认为今后在 定理证 明的 书写格式上 有哪些应 当注 意的 问题 ? 几何证 明的 过程 一般 包括 三个 步骤 : (1) 根据题 意， 画出 图形 . 例如， 在上 面证 明对 顶角 的性 质定 理时， 命题 条件 中的 对项 角， 是指 任意两 条直线相交时 所成 的一 对对 项角 . 因此画图时 应任意画 出两 条相交直线， 不能 画成 两条 直线垂直的 特殊情况 . 为了 随后书写已 知 、 求证 和证 明时 叙述的 方便， 在图 中要 标出 必要的 字母和 符号， 如图 5 2，5 3. (2) 结合图 形， 根据 条件 、 结论， 写出 已知 、 求证 . 其中 , 已知 是命题的 条件 , 求证 是命题的 结论 . 书写时， 应把 图形 所表达的 数学涵义 〈 即图 形语言 ) 根据命题中 的文字语言转化为 符号语言 . (3) 找出 由已 知推出求证的 途径， 写出 证明 . 证明 是由 条件 〈 已知 ) 出发， 经过 一步 步的 推理， 最后 证实 结论 〈 求证 ) 正确的 全部 过程 . 证明 过程 应按照前 因后 果的 次序 书写， 其中 的每 一步 推理都 要有 依据 . 推理的 依据只 能是 命题给 出的 已知 条件 、 已经 学过 的定义 、 基本 事实和 已经 证明 过的 定理 . 不能 任想 当然， 把未 被证 实的 命题作为推理的 依据 . 史海 漫游 《原本 》 与欧 民几何几何学 (geometry ) 是数学最 古老的 分支 之一 . 公元前 3 世纪， 古希腊数学家 欧",747,0.43471732616571224,medium-low,ocr,"(等 式 的 基本 性 质 ).\nLA1=~2 (等 量 代 换 ).\nSR 观察 与 思考\n回顾 并 分 析 上 面 两 个 定理 的 证 明 过 程 ， 它 们 都 包括 了 哪 几 个 步骤 ? 你 认为\n今后 在 定理 证 明 的 书写 格式 上 有 哪些 应 当 注 意 的 问题 ?\n几何 证 明 的 过 程 一 般 包 括 三 个 步骤 :\n(1) 根据 题 意 ， 画 出 图 形 .\n例如 ， 在 上 面 证 明 对 顶 角 的 性 质 定 理 时 ， 命 题 条 件 中 的 对 项 角 ， 是 指 任意\n两 条 直线 相交 时 所 成 的 一 对 对 项 角 . 因此 画图 时 应 任意 画 出 两 条 相交 直线 ， 不 能\n画 成 两 条 直线 垂直 的 特殊 情况 . 为 了 随后 书写 已 知 、 求 证 和 证 明 时 叙述 的 方便 ，\n在 图 中 要 标 出 必要 的 字母 和 符号 ， 如 图 5-2，5-3.\n(2) 结合 图 形 ， 根 据 条 件 、 结 论 ， 写 出 已 知 、 求 证 .\n其 中 ,“ 已 知 ”是 命题 的 条 件 ,“ 求 证 ”是 命题 的 结论 . 书写 时 ， 应 把 图 形 所\n表达 的 数学 涵义 〈 即 图 形 语言 ) 根据 命题 中 的 文字 语言 转化 为 符号 语言 .\n(3) 找 出 由 已 知 推出 求证 的 途径 ， 写 出 “证 明 ”.\n“证 明 ” 是 由 条 件 〈 已 知 ) 出 发 ， 经 过 一 步 步 的 推理 ， 最 后 证 实 结 论 〈 求\n证 ) 正确 的 全 部 过 程 . 证 明 过 程 应 按照 “前 因 后 果 ” 的 次 序 书写 ， 其 中 的 每 一 步\n推理 都 要 有 依据 . 推理 的 依据 只 能 是 命题 给 出 的 已 知 条 件 、 已 经 学 过 的 定义 、 基\n本 事实 和 已 经 证 明 过 的 定理 . 不 能 任 “ 想 当然 ”， 把 未 被 证 实 的 命题 作为 推理 的\n依据 .\n=== 第 78 页 ===\nSI 史 海 漫游\n《原本 》 与 欧 民 几何\n几何 学 (geometry ) 是 数学 最 古老 的 分 支 之 一 . 公元 前 3 世纪 ， 古 希腊 数学 家 欧",2.0,75.45226130653266,义务教育教科书·数学八年级上册,89,2025-07-21T14:23:32.493Z,2.0,义务教育教科书·数学八年级上册,/Users/LeoQin/Documents/GitHub/PDFconvertor/training_data/初中/数学/青岛版-青岛出版社/八年级/义务教育教科书·数学八年级上册.pdf,八年级,tesseract.js-parallel,unknown,0.8431001890359168,0.7,1,75.45226130653266,true,true,,true,true,,mathematics,上册,义务教育教科书·数学八年级上册.json,数学,199,初中_数学_青岛版_八年级_义务教育教科书·数学八年级上册
义务教育教科书·数学八年级上册_chunk_44,44,"的已 知条 件 、 已经 学过 的定义 、 基本 事实和 已经 证明 过的 定理 . 不能 任想 当然， 把未 被证 实的 命题作为推理的 依据 . 史海 漫游 《原本 》 与欧 民几何几何学 (geometry ) 是数学最 古老的 分支 之一 . 公元前 3 世纪， 古希腊数学家 欧几 里得 在前 人积累的 大量 成果 的基础上， 搜集 了当时所 知道的 几何事实， 按照 逻辑 推理的 方法， 整理 成一 部有 着严密逻辑体系的 数学巨著 《原本 》( Elements ). 今天我 们在 初中数学教科书 中所 学的 图形 与几何知识， 绝大 部分 都是 从 《原本 》 中选 出来 的 . 欧几 里得 在 《原本 》 中把 逻辑学 的思想方法引入到 几何学， 把当时的 几何学 内容 按照逻辑要 求进行了 编写 . 所谓 逻辑 要求， 指的 就是 从很 少的 几个 定义 、 公设 、 公理 出发， 利用 演绎的 方法证 明了其 他的 结论 ( 定理 ). 而证 明所 需的 定义 、 公理 和其 他定理， 必须 编写在 这个 定理的 前面， 也就 是必须按照前 因后 果排 列几 何命题的 先后 次序 . 欧几 里得 所说 的公设 、 公理， 是指 一些 原始的 、 明显 成立 的， 而且 不可 能证 明的 基本原理， 把它们以 及几 个基本定义作为进行逻辑推理的 基础 . 牛顿曾 称赞 《原本 》 是几何学 的光荣 ,《 原本 》 的出 现标志着 演绎数学的 成熟 . 《原本 》 是一 部具有划时代意义的 著作， 是至 今流传最 广 、 影响 最大 的一 部世界数学名 著， 它所 提出的 公理化 方法是 人类 思维的 一场 革命， 它主导了 其后 数学发 展的",742,0.48392959146265135,medium-low,ocr,"的 已 知 条 件 、 已 经 学 过 的 定义 、 基\n本 事实 和 已 经 证 明 过 的 定理 . 不 能 任 “ 想 当然 ”， 把 未 被 证 实 的 命题 作为 推理 的\n依据 .\n=== 第 78 页 ===\nSI 史 海 漫游\n《原本 》 与 欧 民 几何\n几何 学 (geometry ) 是 数学 最 古老 的 分 支 之 一 . 公元 前 3 世纪 ， 古 希腊 数学 家 欧\n几 里 得 在 前 人 积累 的 大 量 成 果 的 基础 上 ， 搜 集 了 当时 所 知道 的 几何 事实 ， 按 照 逻 辑\n推理 的 方法 ， 整 理 成 一 部 有 着 严密 逻辑 体系 的 数学 巨著 《原本 》( Elements ). 今天\n我 们 在 初中 数学 教科 书 中 所 学 的 “图 形 与 几何 ”知识 ， 绝 大 部 分 都 是 从 《原本 》 中\n选 出 来 的 .\n欧 几 里 得 在 《原本 》 中 把 逻辑 学 的 思想 方法 引入 到 几何 学 ， 把 当时 的 几何 学 内 容\n按照 逻辑 要 求 进行 了 编写 . 所 谓 逻 辑 要 求 ， 指 的 就 是 从 很 少 的 几 个 定义 、 公 设 、 公 理 出\n发 ， 利 用 演绎 的 方法 证 明了 其 他 的 结论 ( 定理 ). 而 “证 明 ” 所 需 的 定义 、 公 理 和 其 他\n定理 ， 必 须 编写 在 这 个 定理 的 前 面 ， 也 就 是 必须 按照 “前 因 后 果 ” 排 列 几 何 命题 的 先\n后 次 序 . 欧 几 里 得 所 说 的 “公设 ”、“ 公 理 ”， 是 指 一 些 原始 的 、 明 显 成 立 的 ， 而 且 不 可\n能 证 明 的 基本 原理 ， 把 它们 以 及 几 个 基本 定义 作为 进行 逻辑 推理 的 基础 . 牛顿 曾 称赞\n《原本 》* 是 几何 学 的 光荣 ,《 原 本 》 的 出 现 标志 着 演绎 数学 的 成 熟 .\n《原本 》 是 一 部 具有 划时代 意义 的 著作 ， 是 至 今 流传 最 广 、 影 响 最 大 的 一 部 世界\n数学 名 著 ， 它 所 提出 的 公理 化 方法 是 人 类 思维 的 一 场 革命 ， 它 主导 了 其 后 数学 发 展 的",2.0,75.45226130653266,义务教育教科书·数学八年级上册,90,2025-07-21T14:23:32.493Z,2.0,义务教育教科书·数学八年级上册,/Users/LeoQin/Documents/GitHub/PDFconvertor/training_data/初中/数学/青岛版-青岛出版社/八年级/义务教育教科书·数学八年级上册.pdf,八年级,tesseract.js-parallel,unknown,0.8640595903165735,0.5,1,75.45226130653266,true,,,true,,,mathematics,上册,义务教育教科书·数学八年级上册.json,数学,199,初中_数学_青岛版_八年级_义务教育教科书·数学八年级上册
义务教育教科书·数学八年级上册_chunk_45,45,"法要 用到 反证 法， 本教科书 安排在 九 (上 ) 第 3 章中 学习 你会 证明 平行 线的 性质 定理 3: 两条 平行直线被 第三 条直线所 截， 同旁 内角 互补 吗 ? 试一 试 . 例 2 证明和平行线 的判定定理 1: 两条 直线被 第三 条直线所 截， 如果 内错 角相 等， 那么 两直线平行 . 已知 : 如图 5 5, 直线 4B，CD 被玖 所堆，A1 和 2. 求证 : AB CD. 大 (sm 和 )， 4 A1 2( 已知 )， 5 3 P z LA1 3( 等量 代换 ). 图 5 5 LI A3( 已证 ) 9， 4BVACD (两条 直线被 第三 条直线所 堆， 如果 同位 角相 等， 那么 两直 线平行 ) . 你会 证明 平行 线的 判定定理 2: 两条 直线被 第三 条直线所 截， 如果 同旁 内角 互补， 那么 两直线平行吗 ? 与同学交流 . Pa 交流与 发现 分析 下面 的两 个命题， 你发 现它 们的 条件 和结论之 间有 什么关系 ? (1 ) 两条 平行直线被 第三 条直线所 截， 内错 角相等 . (2) 两条 直线被 第三 条直线所 截， 如果 内错 角相等， 那么 两直线平行 . 多两 个命题的 条件 和结 95 : 论正好互相交换 . 在两 个命题中， 如果 第一 个命题的 条件 是第 二个 命题的 结论， 而第 一个 命题 的结论是 第二 个命题的 条件， 那么 这两 个命题叫做互 逆命 题 . 如果 把其 中一 个命题叫做原 命题， 那么 另一 命题叫做它 的逆 命题 . 上面 所说 的两 个命题是 互逆 命题 . 如果 把命题 (1 ) 叫做原 命题， 那么 命题",729,0.32483543326388037,low,ocr,"法 要 用 到 反 证 法 ， 本 教科 书 安排 在 九 (上 ) 第 3 章 中 学 习\n=== 第 82 页 ===\n你 会 证 明 “ 平 行 线 的 性 质 定 理 3: 两 条 平行 直线 被 第 三 条 直线 所 截 ， 同 旁 内\n角 互 补 ” 吗 ? 试 一 试 .\n例 2 证 明和 平行 线 的 判定 定理 1: 两 条 直线 被 第 三 条 直线 所 截 ， 如 果 内 错\n角 相 等 ， 那 么 两 直线 平行 .\n已 知 : 如 图 5-5, 直线 4B，CD 被 玖 所 堆 ，A1= 和 2.\n求证 : AB//CD.\n大 (sm 和 )， 4\nA1= 2( 已 知 )， 5 3 P\nz\nLA1= 3( 等 量 代 换 ). 图 5-5\nLI= A3( 已 证 ) 9 ，\n…4BVACD (两 条 直线 被 第 三 条 直线 所 堆 ， 如 果 同 位 角 相 等 ， 那 么 两 直\n线 平行 ) .\n你 会 证 明 “ 平 行 线 的 判定 定理 2: 两 条 直线 被 第 三 条 直线 所 截 ， 如 果 同 旁 内\n角 互 补 ， 那 么 两 直线 平行 ” 吗 ? 与 同学 交流 .\nPa 交流 与 发 现\n分 析 下 面 的 两 个 命题 ， 你 发 现 它 们 的 条 件 和 结论 之 间 有 什么 关系 ?\n(1 ) 两 条 平行 直线 被 第 三 条 直线 所 截 ， 内 错 角 相等 .\n(2) 两 条 直线 被 第 三 条 直线 所 截 ， 如 果 内 错 角 相等 ， 那 么 两 直线 平行 .\n多 两 个 命题 的 条 件 和 结\n95 : 论 正好 互相 交换 .\n在 两 个 命题 中 ， 如 果 第 一 个 命题 的 条 件 是 第 二 个 命题 的 结论 ， 而 第 一 个 命\n题 的 结论 是 第 二 个 命题 的 条 件 ， 那 么 这 两 个 命题 叫做 互 逆 命 题 . 如 果 把 其 中 一 个\n命题 叫做 原 命题 ， 那 么 另 一 命题 叫做 它 的 逆 命题 .\n上 面 所 说 的 两 个 命题 是 互 逆 命 题 . 如 果 把 命题 (1 ) 叫做 原 命 题 ， 那 么 命题",2.0,75.45226130653266,义务教育教科书·数学八年级上册,95,2025-07-21T14:23:32.493Z,2.0,义务教育教科书·数学八年级上册,/Users/LeoQin/Documents/GitHub/PDFconvertor/training_data/初中/数学/青岛版-青岛出版社/八年级/义务教育教科书·数学八年级上册.pdf,八年级,tesseract.js-parallel,unknown,0.7745098039215687,0.5,1,75.45226130653266,true,,,true,true,,unknown,上册,义务教育教科书·数学八年级上册.json,数学,199,初中_数学_青岛版_八年级_义务教育教科书·数学八年级上册
义务教育教科书·数学八年级上册_chunk_46,46,有也 于所 本 (第 14 题 ) (第 15 题 ) 回顾与 总结 1. 本章 学习 的主要内 容是 什么 ? 总结 一下， 与同学交流 . 2. 什么是 定义 、 命题 、 定理 和推论 ? 请说 出你 学过 的基本事实 . 在本 章中， 从这 些基 本事实和 相关的 定义出 发， 推出 了哪些定理和 推论 ? 3. 举例说 明 : 要判定一 个命题是 假命 题， 只要 能举 出一 个反例就 可以 了 . 4. 举例说 明 : 为什么要 证明 ? 几何证 明一 般分 为哪儿个 步骤 ? 5. 什么是 逆命题 ? 如果 原命题是 真命题， 那么 它的 逆命 题也 是真 命题吗 ? 举例说 明 . 6. 三角形内 角和 定理是 怎样证 明的 ? 它有 哪些推论 ? 7. 利用全 等三 角形的 三个 基本事实及 判定定理， 判定 两个 三角形全 等， 是探求和 证明 几何 图形 中角 或线段相等的 重要途径 . 在证 明有 关线 段或 角的 相等的 问题时， 有时 需要添加辅助线， 在原 有的 图形 中， 构造 出全 等三 角形， 使要 证明 相等 的线段或 角， 是全 等三 角形的 对应 边或 对应 角 . 想一 想， 在本 章中， 利用 全等 三角形证 明了 哪些定理 ? 学过 以上 定理后， 可以 帮助你 解决哪些问题 ? 8. 等腰 三角形以 及等 边三 角形有 哪些性 质定理及 判定定理 ? 它们分 别是 怎样证 明的 ? 9. 线段的 垂直平分线 的性 质定理及 其递 定理是 怎样证 明的 ? 角的 平分线 的性 质定理及 其逆 定理 呢 ? 学过 以上 定理后， 可以 帮助你 解决哪些问题 ? 10. 什么是 定理 ? 判定两 个直角三 角形全 等有 哪几 种方法 ?,752,0.4422578431462616,medium-low,ocr,有\n也 于\n所 本\nAN\n(第 14 题 ) (第 15 题 )\n< 回顾 与 总 结\n1. 本 章 学 习 的 主要 内 容 是 什么 ? 总 结 一 下 ， 与 同学 交流 .\n2. 什么 是 定义 、 命 题 、 定 理 和 推论 ? 请 说 出 你 学 过 的 基本 事实 . 在 本 章 中 ， 从 这 些 基\n本 事实 和 相关 的 定义 出 发 ， 推 出 了 哪些 定理 和 推论 ?\n3. 举例 说 明 : 要 判定 一 个 命题 是 假 命 题 ， 只 要 能 举 出 一 个 反例 就 可 以 了 .\n4. 举例 说 明 : 为 什么 要 证 明 ? 几何 证 明 一 般 分 为 哪儿 个 步骤 ?\n5. 什么 是 逆 命题 ? 如 果 原 命题 是 真 命题 ， 那 么 它 的 逆 命 题 也 是 真 命题 吗 ? 举例 说 明 .\n6. 三 角形 内 角 和 定理 是 怎样 证 明 的 ? 它 有 哪些 推论 ?\n7. 利用 全 等 三 角形 的 三 个 基本 事实 及 判定 定理 ， 判 定 两 个 三 角形 全 等 ， 是 探求 和 证\n明 几 何 图 形 中 角 或 线段 相等 的 重要 途径 . 在 证 明 有 关 线 段 或 角 的 相等 的 问题 时 ， 有\n时 需要 添加 辅助 线 ， 在 原 有 的 图 形 中 ， 构 造 出 全 等 三 角形 ， 使 要 证 明 相 等 的 线段\n或 角 ， 是 全 等 三 角形 的 对 应 边 或 对 应 角 . 想 一 想 ， 在 本 章 中 ， 利 用 全 等 三 角形 证 明\n了 哪些 定理 ? 学 过 以 上 定理 后 ， 可 以 帮助 你 解决 哪些 问题 ?\n8. 等 腰 三 角形 以 及 等 边 三 角形 有 哪些 性 质 定理 及 判定 定理 ? 它们 分 别 是 怎样 证 明\n的 ?\n=== 第 107 页 ===\n9. 线段 的 垂直 平分 线 的 性 质 定理 及 其 递 定理 是 怎样 证 明 的 ? 角 的 平分 线 的 性 质 定理\n及 其 逆 定 理 呢 ? 学 过 以 上 定理 后 ， 可 以 帮助 你 解决 哪些 问题 ?\n10. 什么 是 HL 定理 ? 判定 两 个 直角 三 角形 全 等 有 哪 几 种 方法 ?,2.0,75.45226130653266,义务教育教科书·数学八年级上册,121,2025-07-21T14:23:32.493Z,2.0,义务教育教科书·数学八年级上册,/Users/LeoQin/Documents/GitHub/PDFconvertor/training_data/初中/数学/青岛版-青岛出版社/八年级/义务教育教科书·数学八年级上册.pdf,八年级,tesseract.js-parallel,unknown,0.8625235404896422,0.5,1,75.45226130653266,true,,,true,true,,mathematics,上册,义务教育教科书·数学八年级上册.json,数学,199,初中_数学_青岛版_八年级_义务教育教科书·数学八年级上册
