Chunk_ID,Chunk_Index,Content,Content_Length,Quality_Score,Reliability,Source_Type,Original_Content,Enhancement_Version,book_name,chunkIndex,chunkSize,enhancementTimestamp,enhancementVersion,extractedAt,grade,loc_lines,method,publisher,qualityMetrics_chineseCharRatio,qualityMetrics_coherenceScore,qualityMetrics_lengthScore,qualityMetrics_ocrConfidence,semester,source,source_file,subject,textLength
义务教育教科书·英语九年级全一册_chunk_217,217,"Do you often throw away things you\nRecognize how preﬁxes and sufﬁxes\ndon’t need anymore? Have you ever\nmay change the meanings of words\nthought about how these things can\nand how they are used.\nactually be put to good use? Nothing is a\nwaste if you have a creative mind.\nYou have probably never heard of Amy Hayes, but\nshe is a most unusual woman. She lives in a house\nin the UK that she built herself out of rubbish.\nThe windows and doors come from old buildings\naround her town that were pulled down. The top\nof the house is an old boat turned upside down.\nAnd the gate in front of her house is made of\nrocks and old glass bottles. Amy recently won a\nprize from the Help Save Our Planet Society. The president said, “Amy is an\ninspiration to us all.”\nAmy isn’t the only one who is good at recycling.\nJessica Wong from Hong Kong uses old clothes that\npeople don’t wear anymore to make bags. She has\nbeen doing this for a few years now. She opened a",949,0,unknown,text-extracted,,2.0,义务教育教科书·英语九年级全一册,217,949,2025-07-21T14:24:27.201Z,2.0,2025-07-20T03:42:09.872Z,九年级,[object Object],node-poppler,unknown,,0.5,0.949,1,全一册,/Users/LeoQin/Documents/GitHub/PDFconvertor/training_data/初中/英语/人教版-人民教育出版社/九年级/义务教育教科书·英语九年级全一册.pdf,义务教育教科书·英语九年级全一册.json,英语,290800
义务教育教科书·英语九年级全一册_chunk_218,218,"Amy isn’t the only one who is good at recycling.\nJessica Wong from Hong Kong uses old clothes that\npeople don’t wear anymore to make bags. She has\nbeen doing this for a few years now. She opened a\nsmall shop where she sells her bags, and she has also\nset up a website to sell them online. She especially\nlikes to use old jeans to make handbags. Her bags are\ncute and useful. “I plan to write a book about new\nways to use old clothes,” she said. “I hope people can read my book and enjoy it!”\nWang Tao set up a small business in Shanghai four years ago. He is known for using\niron and other materials from old cars to make beautiful art pieces.\nSome are large pieces that look like animals or humans, and\nsome are smaller pieces you can put at home. The more popular\nworks can even be seen in art shops around the city. Wang Tao\nhopes to set up a “metal art” theme park to show people the\nimportance of environmental protection. Not only can the art",948,0,unknown,text-extracted,,2.0,义务教育教科书·英语九年级全一册,218,948,2025-07-21T14:24:27.201Z,2.0,2025-07-20T03:42:09.872Z,九年级,[object Object],node-poppler,unknown,,0.5,0.948,1,全一册,/Users/LeoQin/Documents/GitHub/PDFconvertor/training_data/初中/英语/人教版-人民教育出版社/九年级/义务教育教科书·英语九年级全一册.pdf,义务教育教科书·英语九年级全一册.json,英语,290800
义务教育教科书·英语九年级全一册_chunk_219,219,"works can even be seen in art shops around the city. Wang Tao\nhopes to set up a “metal art” theme park to show people the\nimportance of environmental protection. Not only can the art\nbring happiness to others, but it also shows that even cold, hard\niron can be brought back to life with a little creativity.\nNames",313,0,unknown,text-extracted,,2.0,义务教育教科书·英语九年级全一册,219,313,2025-07-21T14:24:27.201Z,2.0,2025-07-20T03:42:09.872Z,九年级,[object Object],node-poppler,unknown,,0.5,0.313,1,全一册,/Users/LeoQin/Documents/GitHub/PDFconvertor/training_data/初中/英语/人教版-人民教育出版社/九年级/义务教育教科书·英语九年级全一册.pdf,义务教育教科书·英语九年级全一册.json,英语,290800
义务教育教科书·英语九年级全一册_chunk_220,220,"102\n\nWhat materials did they use?\n\nWhat did they make? UNIT 13\n\nWe’re trying to save the earth!\n2c\n\nFill in the blanks with the correct forms of the phrases in the box.\nput to good use\nset up\n\nbuild ... out of\nknown for\n\npull down\nnot only ... but also\n\n1. Amy Hayes lives in the UK. Many of the old buildings in her neighborhood\n.\nwere\n2. All the rubbish and old things in Amy’s neighborhood were then\nwhen Amy built her house.\nher front gate\n3. Amy is very creative. She\nrocks and old glass bottles. She put an old boat on top of her house.\n4. Jessica Wong sells her bags in a small shop, but she has also\nan online business to sell them.\n5. Though Jessica’s bags are made from old clothes, her bags are\nbeing cute and useful.\nmakes large pieces of metal art that look like\n6. Wang Tao\nmakes smaller pieces for the home.\nanimals or humans,\n2d\n\nUnderline the words in the passage based on the words below. What are\nthe diﬀerences?\nthink\nspecial\n\nuse\nrecent\n\nusual\nenvironment\n\nrecycle\nimportant",995,0,unknown,text-extracted,,2.0,义务教育教科书·英语九年级全一册,220,997,2025-07-21T14:24:27.201Z,2.0,2025-07-20T03:42:09.872Z,九年级,[object Object],node-poppler,unknown,,0.5,0.995,1,全一册,/Users/LeoQin/Documents/GitHub/PDFconvertor/training_data/初中/英语/人教版-人民教育出版社/九年级/义务教育教科书·英语九年级全一册.pdf,义务教育教科书·英语九年级全一册.json,英语,290800
义务教育教科书·英语九年级全一册_chunk_221,221,"Underline the words in the passage based on the words below. What are\nthe diﬀerences?\nthink\nspecial\n\nuse\nrecent\n\nusual\nenvironment\n\nrecycle\nimportant\n\nbuild\nprotect\n\ncreate\ninspire\n\n2e\n\nMake a list of things that need to be done to save the environment.\nWhich things can be done by common people every day? Which things\nhave to be done by governments and organizations? Discuss these with\nyour group.\n\n3a\n\nThink about the environment in your town/city and complete the chart\nbelow.\nWhich parts of the town/city have a nice environment? Why are they nice?\nWhich parts need to be improved? Why?\nGood environment\n\nWhy?\n\nBad environment\n\nWhy?\n\n103 UNIT 13\n3b\n\nWrite a letter to the city mayor about the problems and your suggestions.\nIn your letter, describe the environmental problems in your town/city.\nWhat are the problems?\nWhere are they?\n● What or who is causing these problems?\n●\n●",884,0,unknown,text-extracted,,2.0,义务教育教科书·英语九年级全一册,221,886,2025-07-21T14:24:27.201Z,2.0,2025-07-20T03:42:09.872Z,九年级,[object Object],node-poppler,unknown,,0.5,0.884,1,全一册,/Users/LeoQin/Documents/GitHub/PDFconvertor/training_data/初中/英语/人教版-人民教育出版社/九年级/义务教育教科书·英语九年级全一册.pdf,义务教育教科书·英语九年级全一册.json,英语,290800
义务教育教科书·英语九年级全一册_chunk_222,222,"Then, give suggestions or possible ways to solve the problems.\nI think that ...\nWe should/could ...\nI suggest ...\n\nSelf Check\n1 Write diﬀerent forms of the words. Then add more to each\n\ngroup.\n\nv. — n.\npollute—\nact—\nprotect—\ninspire—\nbuild—\ncreate—\n\nn. — adj.\nfame—\nwood—\nscience—\nhealth—\nsouth—\ncare—\n\nadj. — n.\ndiﬀerent—\nimportant—\n\nadj. — adv.\nslow—\nwide—\nsudden—\nreal—\n\n2 Match each statement with the grammar structure.\nStatement\n\nGrammar\n\nThe river used to be so clean.\nWe have seen many changes in the environment.\nPeople should take public transportation more.\nThe river is polluted by factories.\nThe air pollution is getting worse and worse.\n\nPresent progressive\nModal verbs\nPassive voice\nused to\nPresent perfect\n\n3 Write ways to cut down on these kinds of pollution.\nKinds of pollution\n\nwater pollution\nland pollution\nnoise pollution\nair pollution\n104\n\nWays to cut down UNIT 14\nSection\n\nLanguage Goals:\nShare past\nmemories and\nexperiences;\nLook ahead to\nthe future",974,0,unknown,text-extracted,,2.0,义务教育教科书·英语九年级全一册,222,979,2025-07-21T14:24:27.201Z,2.0,2025-07-20T03:42:09.872Z,九年级,[object Object],node-poppler,unknown,,0.5,0.974,1,全一册,/Users/LeoQin/Documents/GitHub/PDFconvertor/training_data/初中/英语/人教版-人民教育出版社/九年级/义务教育教科书·英语九年级全一册.pdf,义务教育教科书·英语九年级全一册.json,英语,290800
义务教育教科书·英语九年级全一册_chunk_223,223,"water pollution\nland pollution\nnoise pollution\nair pollution\n104\n\nWays to cut down UNIT 14\nSection\n\nLanguage Goals:\nShare past\nmemories and\nexperiences;\nLook ahead to\nthe future\n\nI remember meeting all of you\nin Grade 7.\n1a\n\nCheck (✔) the things you remember doing at junior\nhigh school. Add more to the list.\nWell, junior high\nschool days are over.\nDo you have any\nspecial memories?\n\nAt junior high school,\nI remember:\nwinning a prize\nbeing a volunteer\ndoing a school survey\na friend helping me with\na problem\nI remember\nmeeting all of you\nin Grade 7.\n\n1b\n\nListen and match the memory with the person.\nMary\nFrank\nSarah\nPeter\n\na. did homework carefully to meet the standards of a strict teacher\nb. remembers losing a schoolbag\nc. remembers meeting this group of friends\nd. has enjoyed every year of junior high school\nMemories and experiences\n\n1c\n\nList some\nmemories and\nexperiences\nfrom junior\nhigh school.\nShare your lists\nwith your\npartner.\n\nI remember ...",959,0,unknown,text-extracted,,2.0,义务教育教科书·英语九年级全一册,223,964,2025-07-21T14:24:27.201Z,2.0,2025-07-20T03:42:09.872Z,九年级,[object Object],node-poppler,unknown,,0.5,0.959,1,全一册,/Users/LeoQin/Documents/GitHub/PDFconvertor/training_data/初中/英语/人教版-人民教育出版社/九年级/义务教育教科书·英语九年级全一册.pdf,义务教育教科书·英语九年级全一册.json,英语,290800
义务教育教科书·英语九年级全一册_chunk_224,224,1c\n\nList some\nmemories and\nexperiences\nfrom junior\nhigh school.\nShare your lists\nwith your\npartner.\n\nI remember ...\n\nscoring two goals in a row during a soccer competition.\n\nI have ...\n\nlearned to play the keyboard in music class.\n\n105 UNIT 14\n2a\n\nListen to the conversation. Check (✔) the facts you hear.\nSomeone didn’t like P.E.\nSomeone was advised to take a break from running by a teacher.\nSomeone had a health problem.\nSomeone joined the school band.\nSomeone liked Mr. Hunt’s teaching methods.\n\n2b\n\nListen again. Match each question with the name of the person.\nQuestion\n\n2c\n\n2d\n\nAnswer\n\n1. Who wants to study medicine?\n\na. Luke\n\n2. Who told someone to take a break from running?\n\nb. Brian\n\n3. Who hurt his or her knee?\n\nc. Mr. Hunt\n\n4. Who thinks the That’s Life concert is the best memory?\n\nd. Lisa\n\nRole-play a conversation\nin your group using the\ninformation in 2a and 2b.\n\nA: Do you remember Mr. Hunt?\nB: Of course! He’s a great teacher. He gave,955,0,unknown,text-extracted,,2.0,义务教育教科书·英语九年级全一册,224,957,2025-07-21T14:24:27.201Z,2.0,2025-07-20T03:42:09.872Z,九年级,[object Object],node-poppler,unknown,,0.5,0.955,1,全一册,/Users/LeoQin/Documents/GitHub/PDFconvertor/training_data/初中/英语/人教版-人民教育出版社/九年级/义务教育教科书·英语九年级全一册.pdf,义务教育教科书·英语九年级全一册.json,英语,290800
义务教育教科书·英语九年级全一册_chunk_225,225,"d. Lisa\n\nRole-play a conversation\nin your group using the\ninformation in 2a and 2b.\n\nA: Do you remember Mr. Hunt?\nB: Of course! He’s a great teacher. He gave\n\nreally clear instructions during P.E. class.\nC: Yeah, he ...\n\nRole-play the conversation.\nJudy: Which teachers will you miss the most after junior high school, Clara?\nClara: Ms. Lee and Mr. Brown.\nJudy: I know that Ms. Lee was always patient with you in math class. She\n\nhelped you to work out the answers yourself no matter how diﬃcult they\nwere.\nClara: Yes, and Mr. Brown guided me to do a lot better in science. He always\ntook the time to explain things to me clearly whenever I couldn’t understand\nanything. Who will you miss?\nJudy: Ms. Griﬃn. She encouraged me in English\nclass. She always told me, “You can do it!”\nBecause of her, I put in more eﬀort and my\nexam scores doubled.\nClara: Shall we get each of them a card and gift to\nsay thank you?\nJudy: Good idea. Let’s go shopping tomorrow!\n106 UNIT 14",967,0,unknown,text-extracted,,2.0,义务教育教科书·英语九年级全一册,225,969,2025-07-21T14:24:27.201Z,2.0,2025-07-20T03:42:09.872Z,九年级,[object Object],node-poppler,unknown,,0.5,0.967,1,全一册,/Users/LeoQin/Documents/GitHub/PDFconvertor/training_data/初中/英语/人教版-人民教育出版社/九年级/义务教育教科书·英语九年级全一册.pdf,义务教育教科书·英语九年级全一册.json,英语,290800
义务教育教科书·英语九年级全一册_chunk_226,226,UNIT 14\n\nI remember meeting all of you in Grade 7.\n3a\n\nRead the passage and answer the questions.\n1. What kind of writing is this?\n2. What is the main subject of this writing?\n3. Who do you think the writer is?\n\nI Remember\nLooking back at these past three years\nI remember many things\nTrying to be on time for morning readings\nRunning when the lunch bell rings\n\nPreparing for art festivals\nAnd making a great big mess\nHaving fun at New Year’s parties\nWishing everyone the best\n\nI remember the excitement\nOf the school sports day each year\nThe many long hours of training\nPride of overcoming fear\n\nWe have learned a different language\nThat is from a foreign land\nEnglish brings many challenges\nWe work hard to understand\n\nI remember starting day one\nThe shyest in my whole class\nNever speaking to anyone\nAnd thinking I would not pass\n\nAnd now it’s time to graduate\nWe will leave our lovely school\nI can’t believe it’s been three years\nI’m trying to keep my cool,960,0,unknown,text-extracted,,2.0,义务教育教科书·英语九年级全一册,226,960,2025-07-21T14:24:27.201Z,2.0,2025-07-20T03:42:09.872Z,九年级,[object Object],node-poppler,unknown,,0.5,0.96,1,全一册,/Users/LeoQin/Documents/GitHub/PDFconvertor/training_data/初中/英语/人教版-人民教育出版社/九年级/义务教育教科书·英语九年级全一册.pdf,义务教育教科书·英语九年级全一册.json,英语,290800
义务教育教科书·英语九年级全一册_chunk_227,227,And now it’s time to graduate\nWe will leave our lovely school\nI can’t believe it’s been three years\nI’m trying to keep my cool\n\nThen slowly I made some new friends\nTo remember forever\nHelping each other with homework\nGetting better together\n\nBut it’s difficult not to cry\nI’ll miss the school trees and flowers\nAnd our kind and caring teachers\nWonderful memories of ours\n\n3b\n\nRead the poem again. Write the words that rhyme with the words below.\nthings\nland\n\n3c\n\nrings\n\nyear\nschool\n\nclass\nflowers\n\nHave you experienced any of the following things? How did you feel?\nHow does the writer feel about them?\n1. trying to be on time for morning readings\n2. running to the dining hall when the lunch bell rings\n3. training for sports day\n4. starting the first day in Grade 7\n5. slowly making some new friends\n6. helping classmates with homework\n7. preparing for art festivals\n8. going to New Year’s parties\n9. learning English\n107 UNIT 14\n\nGrammar\nFocus,946,0,unknown,text-extracted,,2.0,义务教育教科书·英语九年级全一册,227,948,2025-07-21T14:24:27.201Z,2.0,2025-07-20T03:42:09.872Z,九年级,[object Object],node-poppler,unknown,,0.5,0.946,1,全一册,/Users/LeoQin/Documents/GitHub/PDFconvertor/training_data/初中/英语/人教版-人民教育出版社/九年级/义务教育教科书·英语九年级全一册.pdf,义务教育教科书·英语九年级全一册.json,英语,290800
义务教育教科书·英语九年级全一册_chunk_228,228,"UNIT 14\n\nGrammar\nFocus\n\nWhat happened in Grade 7 that was\nspecial?\nHow have you changed since you started\njunior high school?\nHow do you think things will be different\nin senior high school?\nWhat are your plans for next year?\nWhat do you remember about Grade 8?\nWhat did you use to do that you don’t\ndo now?\nWhat are you looking forward to?\n\nOur team won the school basketball\ncompetition.\nI’ve become much better at speaking\nEnglish.\nI think that I’ll have to study much harder\nfor exams.\nI’m going to join the school volleyball\nteam.\nI remember being a volunteer.\nI used to take dance lessons, but I don’t\nanymore.\nI’m looking forward to going to senior\nhigh school.\n\n4a\n\nNumber the sentences to make a paragraph.\n\n4b",719,0,unknown,text-extracted,,2.0,义务教育教科书·英语九年级全一册,228,719,2025-07-21T14:24:27.201Z,2.0,2025-07-20T03:42:09.872Z,九年级,[object Object],node-poppler,unknown,,0.5,0.719,1,全一册,/Users/LeoQin/Documents/GitHub/PDFconvertor/training_data/初中/英语/人教版-人民教育出版社/九年级/义务教育教科书·英语九年级全一册.pdf,义务教育教科书·英语九年级全一册.json,英语,290800
义务教育教科书·英语九年级全一册_chunk_229,229,"4a\n\nNumber the sentences to make a paragraph.\n\n4b\n\nWhen I get to senior high, I will join the school swim team.\nMy time in junior high school has been enjoyable.\nIn Grade 8, I studied harder but I still got poor grades in English. I\nhad problems with pronunciation and reading texts. So the next year, I\nworked much harder and got better grades.\nNext year, I will be in senior high school. I can’t believe how fast the\ntime went by!\nThis year, with Mr. Trent’s help, my English level has been improving\nand I hope to get good grades at the end of the year.\nIn the first year, I didn’t work very hard in class, but I joined many\ndiﬀerent school clubs and had a lot of fun.\nWrite your own answers to the questions.",712,0,unknown,text-extracted,,2.0,义务教育教科书·英语九年级全一册,229,714,2025-07-21T14:24:27.201Z,2.0,2025-07-20T03:42:09.872Z,九年级,[object Object],node-poppler,unknown,,0.5,0.712,1,全一册,/Users/LeoQin/Documents/GitHub/PDFconvertor/training_data/初中/英语/人教版-人民教育出版社/九年级/义务教育教科书·英语九年级全一册.pdf,义务教育教科书·英语九年级全一册.json,英语,290800
义务教育教科书·英语九年级全一册_chunk_230,230,1. What do you remember about Grade 7?\n2. What happened in Grade 8 that was special?\n3. What did you use to do that you don’t do now?\n4. How have you changed since you started junior high school?\n5. How do you think things will be diﬀerent in senior high school?\n6. What are your plans for next year?\n7. What are you looking forward to?\n108 I remember meeting all of you in Grade 7.\n\nSection\n\n1b\n\n1a\n\nUNIT 14\n\nWrite about what you would like to do in the future.\n\n1. get a business degree and become a manager\n2.\n3.\n\nTalk about what you hope to do in the future.\nA: What do you hope to do in the future?\nB: I hope to get a business degree and become a manager.\n\n1c\n\nListen to a class discussion. Check (✔) the hopes you hear.\n\n✔\n1d,731,0,unknown,text-extracted,,2.0,义务教育教科书·英语九年级全一册,230,736,2025-07-21T14:24:27.201Z,2.0,2025-07-20T03:42:09.872Z,九年级,[object Object],node-poppler,unknown,,0.5,0.731,1,全一册,/Users/LeoQin/Documents/GitHub/PDFconvertor/training_data/初中/英语/人教版-人民教育出版社/九年级/义务教育教科书·英语九年级全一册.pdf,义务教育教科书·英语九年级全一册.json,英语,290800
义务教育教科书·英语九年级全一册_chunk_231,231,"1c\n\nListen to a class discussion. Check (✔) the hopes you hear.\n\n✔\n1d\n\nListen again. Complete the passage.\nToday is the students’ last class. Bob feels\nabout it and\nthinks Mrs. Chen’s classes have been\n. The students talk\nabout what they want to do in the future. Bob hopes to\nthe exam to get into senior high school. Shirley wants to get into a\nschool. Ken is good at\nand he won a\nfor it. So he wants to be a(n)\n.\nMrs. Chen believes in all of them and tells them to “\n”. To\ncelebrate the end of junior high, they are having a\n. They\nask Mrs. Chen to come, and she is happy to accept the invitation.\n\n1e\n\nPrepare a speech for your graduation. Use the questions to help you.\nPresent your speech to your group.\nHow have you changed since you started junior high school?\nWho has helped you most?\nWhat advice have your parents given you?\nWhat will you do after you graduate?\nWhat are you looking forward to?\n109 UNIT 14\n2a",918,0,unknown,text-extracted,,2.0,义务教育教科书·英语九年级全一册,231,920,2025-07-21T14:24:27.201Z,2.0,2025-07-20T03:42:09.872Z,九年级,[object Object],node-poppler,unknown,,0.5,0.918,1,全一册,/Users/LeoQin/Documents/GitHub/PDFconvertor/training_data/初中/英语/人教版-人民教育出版社/九年级/义务教育教科书·英语九年级全一册.pdf,义务教育教科书·英语九年级全一册.json,英语,290800
义务教育教科书·英语九年级全一册_chunk_232,232,"UNIT 14\n2a\n\nWhat is the most important thing you have learned in junior high\nschool? Discuss the question with a partner.\n\n2b\n\nRead the passage and answer the questions.\n1. What kind of text is this? Is it a story, a speech or a notice?\n2. Who do you think wrote it?\n3. Who is it for?\nIDENTIFYING TEXT TYPE AND PURPOSE\n\nLadies and gentlemen,\n\nQuickly read through a text to see what\nkind of writing it is, who wrote it and\nwhy it was written.",442,0,unknown,text-extracted,,2.0,义务教育教科书·英语九年级全一册,232,442,2025-07-21T14:24:27.201Z,2.0,2025-07-20T03:42:09.872Z,九年级,[object Object],node-poppler,unknown,,0.5,0.442,1,全一册,/Users/LeoQin/Documents/GitHub/PDFconvertor/training_data/初中/英语/人教版-人民教育出版社/九年级/义务教育教科书·英语九年级全一册.pdf,义务教育教科书·英语九年级全一册.json,英语,290800
义务教育教科书·英语九年级全一册_chunk_233,233,"Thank you for coming today to\nattend the graduation ceremony at\nNo. 3 Junior High School. First of all, I’d like to congratulate all the students who\nare here today. I remember meeting all of you when you were just starting Grade\n7 at this school. You were all so full of energy and thirsty for knowledge. And yes,\nsome of you were a little diﬃcult to deal with! But today I see a room full of talented\nyoung adults who are full of hope for the future. You’ve all grown up so much and I’m\nso proud of you.\nAlthough you’ve all worked very hard over the last three\nyears, none of you did it alone. I hope you’ll remember the\nimportant people in your lives who helped and supported\nyou — your parents, your teachers and your friends.\nPlease consider what they’ve done for you and what\nthey mean to you. Never fail to be thankful to the people\naround you.\nLastly, the end of junior high school is the beginning of\na new life. I don’t need to tell you that life in senior high",971,0,unknown,text-extracted,,2.0,义务教育教科书·英语九年级全一册,233,971,2025-07-21T14:24:27.201Z,2.0,2025-07-20T03:42:09.872Z,九年级,[object Object],node-poppler,unknown,,0.5,0.971,1,全一册,/Users/LeoQin/Documents/GitHub/PDFconvertor/training_data/初中/英语/人教版-人民教育出版社/九年级/义务教育教科书·英语九年级全一册.pdf,义务教育教科书·英语九年级全一册.json,英语,290800
义务教育教科书·英语九年级全一册_chunk_234,234,"they mean to you. Never fail to be thankful to the people\naround you.\nLastly, the end of junior high school is the beginning of\na new life. I don’t need to tell you that life in senior high\nschool will be harder and that you have many diﬃcult\ntasks ahead of you. You’ll make mistakes along the way,\nbut the key is to learn from your mistakes and never give up. But along with\ndiﬃculties, there will also be many exciting things waiting for you. Behind each\ndoor you open are chances to learn new things, and you have the ability to make\nyour own choices. Choose wisely and be responsible for your decisions and\nactions. Although you have to go your separate ways now, I hope that in a few years’\ntime, you’ll come back to visit our school. As you set out on your new journey, you\nshouldn’t forget where you came from. The future is yours.\nGood luck and hope to see you again sometime soon!",889,0,unknown,text-extracted,,2.0,义务教育教科书·英语九年级全一册,234,889,2025-07-21T14:24:27.201Z,2.0,2025-07-20T03:42:09.872Z,九年级,[object Object],node-poppler,unknown,,0.5,0.889,1,全一册,/Users/LeoQin/Documents/GitHub/PDFconvertor/training_data/初中/英语/人教版-人民教育出版社/九年级/义务教育教科书·英语九年级全一册.pdf,义务教育教科书·英语九年级全一册.json,英语,290800
