Chunk_ID,Chunk_Index,Content,Content_Length,Quality_Score,Reliability,Source_Type,Original_Content,Enhancement_Version,averageConfidence,book_name,chunkIndex,enhancementTimestamp,enhancementVersion,fileName,filePath,grade,ocrMethod,publisher,qualityMetrics_chineseCharRatio,qualityMetrics_coherenceScore,qualityMetrics_lengthScore,qualityMetrics_ocrConfidence,semanticFeatures_hasDefinition,semanticFeatures_hasExperiment,semanticFeatures_hasFormulas,semanticFeatures_hasNumbers,semanticFeatures_hasQuestion,semanticFeatures_isTableContent,semanticFeatures_subjectArea,semester,source_file,subject,totalPages,uniqueId
人教版_九年级_义务教育教科书·美术九年级下册_chunk_0,0,"本动漫和 色的 动态设计 ( 以人 物动态为 例 ) 人 1. 和光色 动态产生的 关键是 把握 关节点 ""， 也就 是图 例 2 过中 粉色国 国处 后 2. 关节点可 以让 它所 过接 的两 边产生曲折或 适当前 二、 A 旋革 机站 生蝇 : 划扩 泡各 无下 局村 况下 只能 而王 证栾 涉大 贱转 变化。 但是 曲折 这化 在正常情况下 只能 向一 这变化及 (WBAFRERTERERENSE ), 由 3， 角色动态可 以随 郑角色的 特点进行寺 张。 如旋转的 本本: 头 、 可拆 色的 本能 等了 Y, 4， 根据 动漫角色的 造型特点。 也可 以自己设计关节 3 4 第 2 课动漫形象役 计 23 Vos 一一 第 3 课动画作品设计制作导 学 : 动漫创作是 一个 包含多 个重要环节的 系统工程。 其中 脚本 、， 和角色、 道具与 背景设计是 设计阶段的 重要环节 :动画是 动漫 中多 种表现形式中 的一 个主要形式， 我们 借助设计一 个小 动画， 体验一 下动漫的 这几 个重要环节 : 有政事情节的 动漫作品都 需要脚本。 动漫 作品是 用形象来 讲。 司动 故事的， 它与 一般 的文字描述不 一样， 是用 形象语言直接给 观众。。 TeseR, 视觉上 的感受。 动漫 脚本 分为 文本脚本和 绘图脚本， 绘图 脚本是 1. 了解 并学 习动画软件的 简文本脚本的 视觉转化 ,一般 包括 分镜 草稿 、 角色 设定 、 背景 ( 包间捷 作方法。 括场景和 道具 ) 设定 三部 分。 2 尝试将 一个 小故事制 成一 外小 动画片。 保证发 展方向的 脚本绘图脚本动画片 称拍摄脚本 "" ) 首先要 做的 是依据文本脚",733,0.3078952712418301,low,ocr,"本 动漫 和 色 的 动态 设计 ( 以 人 物 动态 为 例 )\nME 人 1. 和光 色 动态 产生 的 关键 是 把 握 “ 关 节点 ""， 也 就 是 图 例\n2 过 中 粉色 国 国 处\n& 后 ~ 2.“ 关 节点 ”可 以 让 它 所 过 接 的 两 边 产生 曲折 或 适当 前\n二、 A 旋 革 机 站 生 蝇 : 划 扩 泡 各 无 下 局 村 况 下 只 能 而 王 证 栾 涉\n大 贱 转 变化 。 但 是 曲 折 这 化 在 正常 情况 下 只 能 向 一 这 变化\nIN 及 (WBAFRERTERERENSE &),\n| 由 3， 角色 动态 可 以 随 郑 角色 的 特点 进行 寺 张 。 如 旋转 的\n本本: 头 、 可 拆 色 的 本 能 等\n了 =Y,\n— 4， 根 据 动漫 角色 的 造型 特点 。 也 可 以 自己 设计 “关节\n3 4 #\n第 2 课 动漫 形象 役 计 23\n=== 第 21 页 ===\nVos - -一 -一 - ~\n第 3 课 动画 作品 设计 制作\n导 学 : 动漫 创作 是 一 个 包含 多 个 重要 环节 的 系统 工程 。 其 中\n脚本 、， 和 角色、 道具 与 背景 设计 是 设计 阶段 的 重要 环节 :动画 是 动\n漫 中 多 种 表现 形式 中 的 一 个 主要 形式 ， 我 们 借助 设计 一 个 小 动画 ，\n体验 一 下 动漫 的 这 几 个 重要 环节 :\n有 政事 情节 的 动漫 作品 都 需要 脚本 。 动 漫 作品 是 用 形象 来 讲 。” 司 动\n故事 的 ， 它 与 一 般 的 文字 描述 不 一 样 ， 是 用 形象 语言 直接 给 观众 。。 TeseR,\n视觉 上 的 感受 。 动 漫 脚 本 分 为 文本 脚本 和 绘图 脚本 ， 绘 图 脚本 是 1. 了 解 并 学 习 动画 软件 的 简\n文本 脚本 的 视觉 转化 ,一 般 包 括 分 镜 草 稿 、 角 色 设 定 、 背 景 ( 包间 捷 作 方法 。\n括 场景 和 道具 ) 设 定 三 部 分 。 2 尝试 将 一 个 小 故事 制 成 一\n外 小 动画 片 。\n保证 发 展 方向 的 脚本\n绘图 脚本 动画 片 称 “拍摄 脚本 "" ) 首先 要 做 的 是 依据 文本 脚",2.0,57.48888888888889,人教版_九年级_义务教育教科书·美术九年级下册,31,2025-07-21T14:24:43.759Z,2.0,义务教育教科书·美术九年级下册,/Users/LeoQin/Documents/GitHub/PDFconvertor/training_data/初中/美术/人教版-人民教育出版社/九年级/义务教育教科书·美术九年级下册.pdf,九年级,tesseract.js-parallel,人教版,0.8406593406593407,0.5,1,57.48888888888889,,,,true,,,unknown,下册,人教版_九年级_义务教育教科书·美术九年级下册.json,美术,45,初中_美术_人教版_九年级_义务教育教科书·美术九年级下册
人教版_九年级_义务教育教科书·美术九年级下册_chunk_1,1,"等竺 吉。 :。 方向， 有家 喻户 晓的 水黑 动同学们， 请结合自己喜欢的 动漫作品来 具体谈 一下。 :。 画芭 水晴 时找 妈始 》、 皮影 动作品客 和 0 ( I0 0 ) : 本 《 措八 戒吃 西瓜 》、 未个 动喜欢的 理由 1 画 《 入来 了》 等 ,都是 非常优 造型特点 : 秀的 作品。 表现形式第 3 课动画作品设计划 作 25 写给 同学的 话小 时候， 描描画画， 人入手涂 鸦。 伴随我 们度 过了 每一 天的 快乐时 光， 借此 我们 不仅 表达着 自己的 意愿， 也同时探索着 外面 的世界。 通过学 习美 术这 门课程， 我们 会发 现， 美术 不仅 有趣 、 好玩， 也能 打开我 们探索世界的 窗户， 为我 们展现出 一片 神奇 、 美丽 的天 地。 在这 个新 天地 里， 我们 会发 现， 从人 类诞生的 那一 刻起， 美术 就随 之而 生， 并伴 欧人 类发 展到 今天。 美术 不仅 可以 表现我 们生活的 世界， 还能 表达我 们的 内心 感受， 它能 滋润我 们的 心田， 改变 我们 的生活， 美化 我们 的环境， 提高我 们生活的 品质。 通过学 习美 术这 门课 程， 我们 还会 发现在我 们生存的 地球 家园， 世界 各国 、 各民族都 孕育出 了具有自己特色的 美术文化 ,它们和 我们 的中 华文明 一道 丰富 、 生动 了人 类的 历史， 共同 构筑了 美的精神家 园。 让我 位学 好美术这 门课程， 学会 用美的眼光去 观察世 界， 半创造美的双手去 提升 、 改造 我们 的生活， 并在 这个 过程 中， 创造 美好的 人生 ! 区 ar 2 十所 电第 四单元 20 世纪中 国美术 巡礼",735,0.39007460869565214,low,ocr,"等 竺 吉 。 : 。 方向， 有 家 喻 户 晓 的 水 黑 动\n同学 们 ， 请 结合 自己 喜欢 的 动漫 作品 来 具体 谈 一 下 。 : 。 画 芭 水 晴 时 找 妈 始 》、 皮 影 动\n作品 客 和 0 (  I0 0 )  : 本 《 措 八 戒 吃 西瓜 》、 未 个 动\n喜欢 的 理由 1 画 《 入 来 了》 等 ,都 是 非常 优\n造型 特点 : ” 秀 的 作品 。\n表现 形式\n第 3 课 动画 作品 设计 划 作 25\n=== 第 23 页 ===\n写 给 同学 的 话\n小 时 候 ， 描 描画 画 ， 人 入手 涂 鸦 。 伴随 我 们 度 过 了 每 一\n天 的 快乐 时 光 ， 借 此 我 们 不 仅 表达 着 自己 的 意愿 ， 也 同时\n探索 着 外 面 的 世界 。\n通过 学 习 美 术 这 门 课程 ， 我 们 会 发 现 ， 美 术 不 仅 有\n趣 、 好 玩 ， 也 能 打开 我 们 探索 世界 的 窗户 ， 为 我 们 展现 出\n一 片 神 奇 、 美 丽 的 天 地 。\n在 这 个 新 天 地 里 ， 我 们 会 发 现 ， 从 人 类 诞生 的 那 一 刻\n起 ， 美 术 就 随 之 而 生 ， 并 伴 欧 人 类 发 展 到 今天 。 美 术 不 仅\n可 以 表现 我 们 生活 的 世界 ， 还 能 表达 我 们 的 内 心 感受 ， 它\n能 滋润 我 们 的 心田 ， 改 变 我 们 的 生活 ， 美 化 我 们 的 环境 ，\n提高 我 们 生活 的 品质 。\n通过 学 习 美 术 这 门 课 程 ， 我 们 还 会 发 现在 我 们 生存\n的 地 球 家 园 ， 世 界 各 国 、 各 民族 都 孕育 出 了 具有 自己 特色\n的 美术 文化 ,它们 和 我 们 的 中 华文 明 一 道 丰 富 、 生 动 了 人\n类 的 历史 ， 共 同 构筑 了 美的 精神 家 园 。\n让 我 位 学 好 美术 这 门 课程 ， 学 会 用 美的 眼光 去 观察 世\n界 ， 半 创造 美的 双手 去 提升 、 改 造 我 们 的 生活 ， 并 在 这 个\n过 程 中 ， 创 造 美好 的 人 生 !\n=== 第 24 页 ===\n区 ~ ar -~2 十 所 电 -\n第 四 单元 ”20 世纪 中 国美 术 巡 礼",2.0,57.48888888888889,人教版_九年级_义务教育教科书·美术九年级下册,34,2025-07-21T14:24:43.759Z,2.0,义务教育教科书·美术九年级下册,/Users/LeoQin/Documents/GitHub/PDFconvertor/training_data/初中/美术/人教版-人民教育出版社/九年级/义务教育教科书·美术九年级下册.pdf,九年级,tesseract.js-parallel,人教版,0.8650190114068441,0.5,1,57.48888888888889,,true,,true,,,biology,下册,人教版_九年级_义务教育教科书·美术九年级下册.json,美术,45,初中_美术_人教版_九年级_义务教育教科书·美术九年级下册
人教版_九年级_义务教育教科书·美术九年级下册_chunk_2,2,"人类 的历史， 共同 构筑了 美的精神家 园。 让我 位学 好美术这 门课程， 学会 用美的眼光去 观察世 界， 半创造美的双手去 提升 、 改造 我们 的生活， 并在 这个 过程 中， 创造 美好的 人生 ! 区 ar 2 十所 电第 四单元 20 世纪中 国美术 巡礼 导学 : 20 世纪 是中 国社会大 变动时 期。 新中 国建立后， 特别 是实行改革开放以 来， 中国美术 在题 村内容、 艺术形式和 艺术风 烙等 方面， 都发 生了 很大 的变化。 术课 选用的 20 世纪 中国美术 部分 代表作品， 在一 定程 度上 体现了 近百 年中 国美林 的新 面貌 、 新成 就 20 世纪 上半期的 中国美术 1949 年 10 月 1 日中 华人民 共和国 成立， 是划分中 国 20 世纪 上人 sc 半期和 下半期的 历史分 界线。20 世纪 上半期的 中国， 发生 了一 系列 影响 历史 进程 的重大事件 : 1911 年的 辛亥革命，1919 年的 五四 运动，1921 年的 中国共产 党诞生，1931 一 1945 年的 搞虐 钙，1946 一 1949 年的 解放战争。 与此 同时， 西方 文化艺术直接或 间接地 大量 《号三 二一 地进 和中国， 中国 传统文化艺术和 到了 巨大的 冲击。 所有 这些 , 都条 一 ; 对这 阶段的 中国美术 产生了 重要的 影响。 这阶段中 国美术 的突出成 22 下: 一人 . 有 rs 4 ee 就， 主要 表现在 中国画的 改革与 创新 、 新兴 木刻 的崛起。 Fe 中国画的 改革与 创新此 兽煌 图平 中区 青， 动与 都。 笔墨当 随时代。 具有 悠久历史和 优良传统的 中国画， 在一 EEXNTIAL, BLTPES",753,0.3252977501439263,low,ocr,"人\n类 的 历史 ， 共 同 构筑 了 美的 精神 家 园 。\n让 我 位 学 好 美术 这 门 课程 ， 学 会 用 美的 眼光 去 观察 世\n界 ， 半 创造 美的 双手 去 提升 、 改 造 我 们 的 生活 ， 并 在 这 个\n过 程 中 ， 创 造 美好 的 人 生 !\n=== 第 24 页 ===\n区 ~ ar -~2 十 所 电 -\n第 四 单元 ”20 世纪 中 国美 术 巡 礼\n导 学 : 20 世 纪 是 中 国 社会 大 变动 时 期 。 新 中 国 建立 后 ， 特 别\n是 实行 改革 开放 以 来 ， 中 国美 术 在 题 村 内容、 艺术 形式 和 艺术 风\n烙 等 方面 ， 都 发 生 了 很 大 的 变化 。 术 课 选用 的 20 世 纪 中 国美 术\n部 分 代表 作品 ， 在 一 定 程 度 上 体现 了 近 百 年 中 国美 林 的 新 面貌 、\n新 成 就\n20 世 纪 上 半期 的 中 国美 术\n1949 年 10 月 1 日 中 华人 民 共和 国 成 立 ， 是 划分 中 国 20 世 纪 上 ”人 sc\n半期 和 下 半期 的 历史 分 界线 。20 世 纪 上 半期 的 中 国 ， 发 生 了 一 系\n列 影 响 历 史 进 程 的 重大 事件 : 1911 年 的 辛亥 革命 ，1919 年 的 五 四 运\n动 ，1921 年 的 中 国共 产 党 诞生 ，1931 一 1945 年 的 搞 虐 钙 ，1946 一 |\n1949 年 的 解放 战争 。 与 此 同时 ， 西 方 文化 艺术 直接 或 间接 地 大 量 《号 三 二 一\n地 进 和 中国， 中 国 传统 文化 艺术 和 到 了 巨大 的 冲击 。 所 有 这 些 , 都 ”条 一 ;\n对 这 阶段 的 中 国美 术 产生 了 重要 的 影响 。 这 阶段 中 国美 术 的 突出 成 “22 下: 一 -人\n. 有 rs 4- = ee\n就 ， 主 要 表现 在 中 国画 的 改革 与 创新 、 新 兴 木 刻 的 崛起 。 Fe\n中 国画 的 改革 与 创新 “此 兽 煌 图 平 中 区 青 ， 动 与 都。\n“笔墨 当 随时 代 ”。 具 有 悠久 历史 和 优良 传统 的 中 国画 ， 在 一 EEXNTIAL, BLTPES",2.0,57.48888888888889,人教版_九年级_义务教育教科书·美术九年级下册,35,2025-07-21T14:24:43.759Z,2.0,义务教育教科书·美术九年级下册,/Users/LeoQin/Documents/GitHub/PDFconvertor/training_data/初中/美术/人教版-人民教育出版社/九年级/义务教育教科书·美术九年级下册.pdf,九年级,tesseract.js-parallel,人教版,0.7870036101083032,0.5,1,57.48888888888889,,true,,true,,,general,下册,人教版_九年级_义务教育教科书·美术九年级下册.json,美术,45,初中_美术_人教版_九年级_义务教育教科书·美术九年级下册
人教版_九年级_义务教育教科书·美术九年级下册_chunk_3,3,绘制在 校园走 序墙 恪上 的一 名以 青春的 活力和 生机， 该画 采用 象征的 手法， 红形 的线条组 成了 画面主要形，， 壁画。 形象 单纯且 富有变化， 色调明 尔， 估水 的波纹旋 荡不 岛。 绿色调的 变奏。 象征青春 、 生命 和活力。 避画 与。 快， 绍人 以有 方向 、 秩序 的美原校园环境和 谐 、 融治 留下 疹恋， 带走 真情 35 目 Xx 第一 单元外国美术名 作邀 礼 2 第 1 课丰富多 彩的 亚非 拉美术 作了 了第 2 课各 有具 特色的 欧美美术作品 4 美术作品是 大类 物质文明与 精神文明的 重要组 成部 分。 了解 不同文化 所产生的 不同 美术特色， 能帮助我 们认识美术的 多妊 性， 扩大 我们 的艺术视野。 等重 理解多 元文化第 二单元保护世界踪 产 12 2 了二 世界送 产是 人类 的伟大创造或 大自然的 下奇迹了 解电 界适 产及 其类 别， 认识 世界 造产 中艺术的 独宪 价值和 大自然的 鬼共 神工， 增弓 我们 珍惜与 保护世界遗产的 意识 3 第三 单元动 膛艺术 18 R 和 BARAREEOHE 18 n 第 2 课， 动漫 形象设计 22 第 3 课动画作品设计制作 24 动漫作为一 种艺术形式， 件随 苦我们的 成长， 丰富 了我 们的 生活。 通过 学司 与了 解动漫的 创作手法， 学会 运用动漫的 艺术 表现形式， 设计 一个 属于自己的 动漫形 象。 编绘 动漫放 事， 表达 铺不 摄影和 摄像常识摄影是 以现代摄影术 为其 造型工具的 一种 艺术。 摄影 十分 讲究,687,0.30791576309887875,low,ocr,绘制 在 校园 走 序 墙 恪 上 的 一 名\n以 青春 的 活力 和 生机 ， 该 画 采 用 象征 的 手法 ， 红 形 的 线条 组 成 了 画面 主要 形 ，，” 壁画 。 形 象 单纯 且 富有 变化 ， 色调 明\n尔 ， 估 水 的 波纹 旋 荡 不 岛 。 绿 色调 的 变奏 。 象征 青春 、 生 命 和 活力 。 避 画 与 。 快 ， 绍 人 以 有 方向 、 秩 序 的 美原\n校园 环境 和 谐 、 融 治\n留 下 疹 恋 ， 带 走 真情 “35\n=== 第 34 页 ===\n目 Xx\n第 一 单元 ”外国 美术 名 作 邀 礼 2\n第 1 课 ”丰富 多 彩 的 亚 非 拉美 术 作 了 了\n第 2 课 ”各 有 具 特色 的 欧美 美术 作品 4\n美术 作品 是 大 类 物质 文明 与 精神 文明\n的 重要 组 成 部 分 。 了 解 不 同文 化 所 产生 的\n不 同 美术 特色 ， 能 帮助 我 们 认识 美术 的 多\n妊 性 ， 扩 大 我 们 的 艺术 视野 。 等 重 理解 多\n元 文化-\n第 二 单元 ”保护 世界 踪 产 12\n2 了\n二 世界 送 产 是 人 类 的 伟大 创造 或 大 自然 的\n下 奇迹 了 解 电 界 适 产 及 其 类 别 ， 认 识 世 界 造\n产 中 艺术 的 独 宪 价值 和 大 自然 的 鬼 共 神 工 ，\n增 弓 我 们 珍惜 与 保护 世界 遗产 的 意识\n3 第 三 单元 ” 动 膛 艺术 18\nR’ 和 - FUR BARAREEOHE 18\nn £\nRS 第 2 课 ， 动 漫 形象 设计 22\n“ 第 3 课 ”动画 作品 设计 制作 24\n动漫 作为 一 种 艺术 形式 ， 件 随 苦 我们\n的 成 长 ， 丰 富 了 我 们 的 生活 。 通 过 学 司 与\n了 解 动漫 的 创作 手法 ， 学 会 运用 动漫 的 艺\n术 表 现形 式 ， 设 计 一 个 属于 自己 的 动漫 形\n象 。 编 绘 动漫 放 事 ， 表 达 铺 不\n=== 第 35 页 ===\n摄影 和 摄像 常识\n摄影 是 以 现代 摄影 术 为 其 造型 工具 的 一 种 艺术 。 摄 影 十 分 讲究,2.0,57.48888888888889,人教版_九年级_义务教育教科书·美术九年级下册,51,2025-07-21T14:24:43.759Z,2.0,义务教育教科书·美术九年级下册,/Users/LeoQin/Documents/GitHub/PDFconvertor/training_data/初中/美术/人教版-人民教育出版社/九年级/义务教育教科书·美术九年级下册.pdf,九年级,tesseract.js-parallel,人教版,0.8717948717948718,0.5,1,57.48888888888889,,,,true,,,biology,下册,人教版_九年级_义务教育教科书·美术九年级下册.json,美术,45,初中_美术_人教版_九年级_义务教育教科书·美术九年级下册
人教版_九年级_义务教育教科书·美术九年级下册_chunk_4,4,苦我们的 成长， 丰富 了我 们的 生活。 通过 学司 与了 解动漫的 创作手法， 学会 运用动漫的 艺术 表现形式， 设计 一个 属于自己的 动漫形 象。 编绘 动漫放 事， 表达 铺不 摄影和 摄像常识摄影是 以现代摄影术 为其 造型工具的 一种 艺术。 摄影 十分 讲究画面的 立意构图和 光线色调的 综合表现， 要求 在纷 此复杂是 瞬息万 人) 知识点 变的 社会生活和 大自然中， 敏捷 地发 现 、 选择 和捕捉其 中具有审美纪实性 摄影 ; 意义的 事物， 并及 时掌握对 象富有个 性表现力 的方面和 瞬间。 以摄影的 方式对 事情或 事件摄影常识所 做的 现场报道。 要求 通过人 物光圈 : 用来 控制光线真情实感的 形和 象来 表现生活表 现人 物玉 真实生活动态的 肯间 碍人 pe 透过 镜头， 进入机 身内 aZ 向 ) 型形 彰， 要自然、 上真实。 生动光 面的 光量的 装置。 我们 拍妥 时要 在不 二涉 拍摄对 象活动用 7 值表示光圈大 小。 Afil6 Afi56 Afi2 的情况下 拍摄， 让拍摄对 象处 于测 光 : 测定被 摄对 象反 射回 来的 光亮度。 自然状态， 要拖 握外 摄对 象圣 点 、 对焦 : 调整焦点， 使拍摄出 来的 照片获得清晰的 效果。 特定环境所 围等。 ee 本 aa 本时 4 8 x 4 天人 知识点 站 or 摄影的 构图 wrapyra 地摄影画面要 处理 好主体， 陷体 及环境物体之 间的 关系， 通过本 大小 、 整体 与局 部 、 近与 远等 关系 突出主体， 并达到陪 体呼应的,689,0.3403903089430894,low,ocr,苦 我们\n的 成 长 ， 丰 富 了 我 们 的 生活 。 通 过 学 司 与\n了 解 动漫 的 创作 手法 ， 学 会 运用 动漫 的 艺\n术 表 现形 式 ， 设 计 一 个 属于 自己 的 动漫 形\n象 。 编 绘 动漫 放 事 ， 表 达 铺 不\n=== 第 35 页 ===\n摄影 和 摄像 常识\n摄影 是 以 现代 摄影 术 为 其 造型 工具 的 一 种 艺术 。 摄 影 十 分 讲究\n画面 的 立意 构图 和 光线 色调 的 综合 表现 ， 要 求 在 纷 此 复杂 是 瞬息 万 人) 知识 点\n变 的 社会 生活 和 大 自然 中 ， 敏 捷 地 发 现 、 选 择 和 捕捉 其 中 具有 审美 纪实 性 摄影 ;\n意义 的 事物 ， 并 及 时 掌握 对 象 富有 个 性 表现 力 的 方面 和 瞬间 。 以 摄影 的 方式 对 事情 或 事件\n摄影 常识 所 做 的 现场 报道 。 要 求 通过 人 物\n光圈 : 用 来 控制 光线 真情 实感 的 形 和 象 来 表现 生活 表\n现 人 物 玉 真实 生活 动态 的 肯 间 碍\n人 pe\n透 过 镜头 ， 进入 机 身 内 aZ 向 @) 型 形 彰 ， 要 自然、 上 真实。 生动\n光 面 的 光量 的 装置 。 我 们 拍 妥 时 要 在 不 二 涉 拍摄 对 象 活动\n用 7 值 表示 光圈 大 小 。 Afil6 Afi56 Afi2 的 情况 下 拍摄 ， 让 拍摄 对 象 处 于\n测 光 : 测定 被 摄 对 象 反 射 回 来 的 光亮 度 。 自然 状态 ， 要 拖 握 外 摄 对 象 圣 点 、\n对 焦 : 调整 焦点 ， 使 拍摄 出 来 的 照片 获得 清晰 的 效果 。 特定 环境 所 围 等 。\nee 本 aa\n本 — 时 4\n8 x 4 天 人 知识 点\n站 or IE 摄影 的 构图\n= wrapyra 地 - - 摄影 画面 要 处 理 好 主体 ， 陷\nFT | 体 及 环境 物体 之 间 的 关系 ， 通过\n本 大 小 、 整 体 与 局 部 、 近 与 远 等 关\n系 突出 主体 ， 并 达到 陪 体 呼应 的,2.0,57.48888888888889,人教版_九年级_义务教育教科书·美术九年级下册,52,2025-07-21T14:24:43.759Z,2.0,义务教育教科书·美术九年级下册,/Users/LeoQin/Documents/GitHub/PDFconvertor/training_data/初中/美术/人教版-人民教育出版社/九年级/义务教育教科书·美术九年级下册.pdf,九年级,tesseract.js-parallel,人教版,0.8576998050682261,0.5,1,57.48888888888889,,,,true,,,biology,下册,人教版_九年级_义务教育教科书·美术九年级下册.json,美术,45,初中_美术_人教版_九年级_义务教育教科书·美术九年级下册
