Chunk_ID,Chunk_Index,Content,Content_Length,Quality_Score,Reliability,Source_Type,Original_Content,Enhancement_Version,averageConfidence,book_name,chunkIndex,enhancementTimestamp,enhancementVersion,fileName,filePath,grade,ocrMethod,publisher,qualityMetrics_chineseCharRatio,qualityMetrics_coherenceScore,qualityMetrics_lengthScore,qualityMetrics_ocrConfidence,semanticFeatures_hasDefinition,semanticFeatures_hasExperiment,semanticFeatures_hasFormulas,semanticFeatures_hasNumbers,semanticFeatures_hasQuestion,semanticFeatures_isTableContent,semanticFeatures_subjectArea,semester,source_file,subject,totalPages,uniqueId
人教版_八年级_义务教育教科书·生物学八年级下册_chunk_20,20,"鳃呼吸， 只能 生活在 水中。 慢慢 地， 遇时 先长 出和 本 N 后肢， 再长 出前 肢， 尾 、 鳃都 逐渐萎缩消失 , 还形 成了 能与 空气进行气体交换的 肺， 发育 为能 上陆地生活的 成峙。 两栖 动物的 生殖发 育与 环境条 件与 青购 一样， 蟾妈 、 大鳃 和暴 时等 其他 两栖 动物 的生殖和 幼体的 发育 也必须在 水中 进行， 幼体 要经 过变态发 育才能 上陆地生活。 图 7 6 青峙 的生殖和 发育 na Je 二和 一外 一一 Ah 一一 一一 一本 有和 一到 亲四 a 一 L i d F . E pos 15 时时 e， 主编 : 朱正 威赵 占良 主要编写人 员 : 朱正 威赵 占良 葛平 秋， 李新 花包 春董 章保 义张 怡吴 成军 谭永 平卢 f E O k 军周 凯责任编辑 : 包春 莹美术编辑 : 王请 封面设计: 虽县 张 fF 版式 设计 : 李狐 (北京气 和宇宙艺术设计有 限公 司 ) 播图 : 王仿 溪 (封面文人剖 工作室 图片 提供 : 朱京 宗标 鲍平 秋姬 谦龙 黎志 诚方 晨刘 方明 徐永春颜 小勤 王名 光王 颖衣 玉赵 问邢 立达 于正 国， 峪晶 伪业 公司义务教育教科书 生物学 八年 级下 册大 民救 育出 版社 课程教材研究所 钨普 生物课程教材人 研究开发中 心出 版 AARAdemizt 【北京市 海演 区中 关村 南天街 17 号院 上号 楼邮编 : 100081 ) httpeffwww.pep.com.on 重车 x xx 出版 社发 行 xxx 新华 书店 引剧 xx 印刷厂 版次， 2013 年 9 月第 T 版印 次年 月第 次印 剧",725,0.3518717264362657,low,ocr,"鳃 呼吸 ， 只 能 生活 在 水 中 。 慢 慢 地 ， 遇 时 先 长 出 和 本 N\n后 肢 ， 再 长 出 前 肢 ， 尾 、 鳃 都 逐渐 萎缩 消失 , 还 形\n成 了 能 与 空气 进行 气体 交换 的 肺 ， 发 育 为 能 上 陆地\n生活 的 成 峙 。\n两 栖 动物 的 生殖 发 育 与 环境 条 件\n与 青 购 一样， 蟾 妈 、 大 鳃 和 暴 时 等 其 他 两 栖 动\n物 的 生殖 和 幼体 的 发 育 也 必须 在 水 中 进行 ， 幼 体 要\n经 过 变态 发 育才 能 上 陆地 生活 。\n图 7-6 青 峙 的 生殖 和 发 育 na -\nJe 二 = = —\n和 一 外\n-一 一 Ah\n一 一 一 一 一 本 有\n和 一\n到 亲 四 a 一 -\nL\ni d F\n. E pos 15\n时 [时\ne ，\n=== 第 33 页 ===\n主 编 : 朱 正 威 ” 赵 占 良\n主要 编写 人 员 : 朱 正 威 ” 赵 占 良 “ 葛 平 秋 ，” 李 新 花 ” 包 春 董 章 保 义 张 怡\n吴 成 军 谭 永 平 卢 f& E O#@ k 军 周 凯\n责任 编辑 : 包 春 莹\n美术 编辑 : 王 请\n封面 设计: 虽 县 张 fF\n版 式 设计 : 李 ” 狐 (北京 气 和 宇宙 艺术 设计 有 限 公 司 )\n播 图 : 王 仿 溪 (封面 ”文人 剖 工作 室\n图 片 提供 : 朱 京 宗 标 EHEER 鲍 平 秋 姬 谦 龙 黎 志 诚 方 ” 晨\n刘 方 明 ” 徐 永春 ” 颜 小 勤 ” 王 名 光 王 颖 衣 玉 赵 问\n邢 立 达 ”于 正 国 ， 峪 晶 伪 业 公司\n义务 教育 教科 书 ”生物 学 八 年 级 下 册\n大 民 救 育 出 版 社 ”课程 教材 研究 所 钨 普\n生物 课程 教材 人 研究 开发 中 心\n出 版 AARAdemizt\n【北京 市 海 演 区 中 关 村 南天 街 17 号 院 上 号 楼 邮编 : 100081 )\n[] HE httpeffwww.pep.com.on\n重 车 x xx 出 版 社\n发 行 xxx 新 华 书 店\n引 剧 xx 印刷 厂\n版 次 ， 2013 年 9 月 第 T 版\n印 次 年 月 第 次 印 剧",2.0,72.425,人教版_八年级_义务教育教科书·生物学八年级下册,31,2025-07-21T14:24:46.041Z,2.0,义务教育教科书·生物学八年级下册,/Users/LeoQin/Documents/GitHub/PDFconvertor/training_data/初中/生物学/人教版-人民教育出版社/八年级/义务教育教科书·生物学八年级下册.pdf,八年级,tesseract.js-parallel,人教版,0.7816764132553606,0.5,1,72.425,,,,true,,,biology,下册,人教版_八年级_义务教育教科书·生物学八年级下册.json,生物,120,初中_生物学_人教版_八年级_义务教育教科书·生物学八年级下册
人教版_八年级_义务教育教科书·生物学八年级下册_chunk_21,21,"根据地 理学和 生物学 的相关知识推 岂， 两栖 动物 在生物圈 中的 发展 经历 了由 盛到 赛的 过程， 如下 表。 距今 大概 的年 数环境条 件 FAFESL, 气候温暖潮 温， 站是 两栖 动物 发展 的繁 恕时 期水 域密布， 食物 丰富 两梧 动物 走向 衰退， 部分 地区 出现 了于 时让 ss 种类 减少 ,分布范 围小 和沙漠， 气候 干燥 1995 和车， 美国明尼苏达州 的中 学生 在河流和 沼泽中 发现 了呈 形蛙 : 一些 蛙有 弯昌 、 残缺 不全 的腊， 一些 些有 多余 的妥。 这引起科学家 的注意。 后经 调查， 在美国南部 、 东部 、 中部 和加 拿大 都发 现了 畸形蛙。 从历史情况看， 呈形 峙的 比例很 低， 而在 调查的 某些 地方， 畸形 蛙的 比例竞 高达 96。 在外 形畸 形的 同时， 这些 峙的 生殖条 怖汪 1 统和 清化 系统常常也 有严重缺陷， 很少 能活 过其 出册 生后 的第 一个 笠天。2010 年， 有些 科学家 认为， 近 RATEELRR, 而 1 向河流和 池塘排 放生活 污水则 可能 增加寄生下 的数量。 村讨论 H 生上 述事实说 明环境的 变迁对 两梧 动物 的繁 行有 什么影响 ? 16 第七 单元生物圈中 生命的 延续和 发展 各某 些地 区出 现畸 形蛙， 可能 是什么原因造成的 ? 夸环 境因素分 为非 生物 因素和 生物因素。 资料 3 可以 说明 这两 种因素之 间有 什么关系 ? 夸从 上述 事实 中你 受到哪些启示 ? 在你 的家 乡， 还常 能听 到那 阵阵 峙鸣 . 见到 在水 中游 动的 果时 吗 ? 怎样才能让 两栖 动物 拥有 良好的 栖息环境呢 ?",741,0.42471252765957435,medium-low,ocr,"根据 地 理学 和 生物 学 的 相关 知识 推 岂 ， 两 栖 动 物 在 生物 圈 中\n的 发 展 经 历 了 由 盛 到 赛 的 过 程 ， 如 下 表 。\n距 今 大 概 的 年 数 环境 条 件\nFAFESL, 气候 温暖 潮 温 ，\n站 是 两 栖 动 物 发 展 的 繁 恕 时 期 水 域 密布 ， 食 物 丰 富\n两 梧 动 物 走 向 衰退 ， 部 分 地 区 出 现 了 于 时\n让 ss 种 类 减少 ,分布 范 围 小 和 沙漠 ， 气 候 干燥\n@1995 和 车， 美国 明尼苏达 州 的 中 学 生 在 河流 和 沼泽 中 发 现 了 呈 形 蛙 :\n一 些 蛙 有 弯 昌 、 残 缺 不 全 的 腊 ， 一 些 些 有 多 余 的 妥 。 这 引起\n科学 家 的 注意 。 后 经 调查 ， 在 美国 南部 、 东 部 、 中 部\n和 加 拿 大 都 发 现 了 畸形 蛙 。 从 历史 情况 看 ， 呈 形 峙\n的 比例 很 低 ， 而 在 调查 的 某 些 地 方 ， 畸 形 蛙 的 比例\n竞 高 达 96%。 在 外 形 畸 形 的 同时 ， 这 些 峙 的 生殖 条 怖 汪 % 1\n统 和 清 化 系统 常常 也 有 严重 缺陷 ， 很 少 能 活 过 其 出 册\n生 后 的 第 一 个 笠 天。2010 年 ， 有 些 科学 家 认为 ， 近\nFRRAMKEADERWT RATEELRR, 而 1\n向 河流 和 池塘 排 放生 活 污水 则 可 能 增加 寄生 下 的 数量 。” ”村\n讨论 H\n生 上 述 事实 说 明 环境 的 变迁 对 两 梧 动 物 的 繁 行 有 什么 影响 ?\n16 ”第 七 单元 ”生物圈 中 生命 的 延续 和 发 展\n=== 第 35 页 ===\n各 某 些 地 区 出 现 畸 形 蛙 ， 可 能 是 什么 原因 造成 的 ?\n夸 环 境 因素 分 为 非 生 物 因素 和 生物 因素 。 资 料 3 可 以 说 明 这 两 种 因素 之\n间 有 什么 关系 ?\n夸 从 上 述 事 实 中 你 受到 哪些 启示 ?\n在 你 的 家 乡 ， 还 常 能 听 到 那 阵 阵 峙 鸣 . 见 到 在\n水 中 游 动 的 果 时 吗 ? 怎样 才能 让 两 栖 动 物 拥 有 良好\n的 栖息 环境 呢 ?",2.0,72.425,人教版_八年级_义务教育教科书·生物学八年级下册,33,2025-07-21T14:24:46.041Z,2.0,义务教育教科书·生物学八年级下册,/Users/LeoQin/Documents/GitHub/PDFconvertor/training_data/初中/生物学/人教版-人民教育出版社/八年级/义务教育教科书·生物学八年级下册.pdf,八年级,tesseract.js-parallel,人教版,0.8651685393258427,0.6,1,72.425,,,,true,true,,geography,下册,人教版_八年级_义务教育教科书·生物学八年级下册.json,生物,120,初中_生物学_人教版_八年级_义务教育教科书·生物学八年级下册
人教版_八年级_义务教育教科书·生物学八年级下册_chunk_22,22,"上有 没有一 个乳 儿黄 隘白色小 丽点 鸡旷 的结构 18 第七 单元生物圈中 生命的 延续和 发展 讨论加 请推 浏卵 壳 、 孵壳 膜 、 卵白 和卵黄各 有什么功能。 各外 的缉 一部 分将 来可 以发 育成纵 鸡 ? 卵黄 ( 蛋黄 ) 是鸡 卵的 主要营养部 分， 外面包庄 着卵黄膜。 卵黄 表面中 央有 一盘 状的 小白 点， 称为 胚的 盘， 里面 含有细胞核。 卵黄 外面 的孵 白 (蛋清 ),， 也。 个十 儿的 而天 上人 下含有营养物质和 水分， 供胚胎发 育的 需要。 卵壳 和卵。。。 7 oo0 修气孔请 你设 壳膜 起保护作用。 卯壳 上还 有许多肉眼看 不见 的气。。。 计一 个简单的 实验， 孔， 以保证胚胎发 育时 能够 进行气体交换。 其他 岛稣。。 床证 明外 过上 有许多虽然大 小各 异 、 外表 差异 较大 (图 7 8)， 但基本结 构与 鸡卵 一样。 想一 想， 鸟卵 为什么具有这 么复杂的 结构呢 ? 这对 它们适应环境有 什么好 处 ? ( 0 o 8dp Bz g dp 酌议 卯鸡 卵 Ay 38 j fap (长轴 药 34 愿米 ) 图 7 8 从象 乌即 到蜂 乌卵 总的 来看， 乌卵 既可 贮存丰富的 营养物质供 胚胎 发育 需要 ; 又有 卵壳 、 卵壳 膜的 保护， 能减少水 分的 委失。 这都 有利于鸟 类在 陆地上 繁殖后 代。 7 《 ) 本从 商场买 回家 的鸡蛋鸟 的生殖和 发育 过程 一般 都不 能钴 化出 小鸡， 请观察下 页的 图片 (图 7.9)， 结合 自己已 有的。。 这是 为什么呢 ? 知识， 你能 概括出 鸟类 生殖和 发育 的基本过 程吗 ? 第一 章生物的 生殖和 发育 10",747,0.4600196320143884,medium-low,ocr,"上 有 没有 一 个 乳 儿 黄 隘\n白色 小 丽 点 = 鸡 旷 的 结构\n18 第 七 单元 ”生物圈 中 生命 的 延续 和 发 展\n=== 第 37 页 ===\n讨论\n加 请 推 浏 卵 壳 、 孵 壳 膜 、 卵 白 和 卵黄 各 有 什么 功能 。\n各 外 的 缉 一 部 分 将 来 可 以 发 育成 纵 鸡 ?\n卵黄 ( 蛋黄 ) 是 鸡 卵 的 主要 营养 部 分 ， 外 面包 庄\n着 卵黄 膜 。 卵 黄 表面 中 央 有 一 盘 状 的 小 白 点 ， 称 为 胚 的\n盘 ， 里 面 含有 细胞 核 。 卵 黄 外 面 的 孵 白 (蛋清 ),， 也。 | 个 十 儿 的 而 天 上 人 下 |\n含有 营养 物质 和 水 分 ， 供 胚胎 发 育 的 需要 。 卵 壳 和 卵 。。 。 7 oo0 修 气孔 请 你 设 |\n壳 膜 起 保护 作用 。 卯 壳 上 还 有 许多 肉眼 看 不 见 的 气 。。 。 计 一 个 简单 的 实验 ， |\n孔 ， 以 保证 胚胎 发 育 时 能 够 进行 气体 交换 。 其 他 岛 稣 。 。 床 证 明 外 过 上 有 许多\n虽然 大 小 各 异 、 外 表 差 异 较 大 (图 7-8)， 但 基本 结\n构 与 鸡 卵 一 样 。 想 一 想 ， 鸟 卵 为 什么 具有 这 么 复杂 的\n结构 呢 ? 这 对 它们 适应 环境 有 什么 好 处 ?\n# ( 0  o\n£8dp Bz g dp 酌 议 卯 鸡 卵 Ay 38 j EE fap\n(长 轴 药 34 愿 米 )\n图 7-8 从 象 乌 即 到 蜂 乌 卵\n总 的 来 看 ， 乌 卵 既 可 贮存 丰富 的 营养 物质 供 胚\n胎 发 育 需要 ; 又 有 卵 壳 、 卵 壳 膜 的 保护 ， 能 减少 水\n分 的 委 失 。 这 都 有 利于 鸟 类 在 陆地 上 繁殖 后 代 。 7\n《#)\n本 从 商场 买 回 家 的 鸡蛋\n鸟 的 生殖 和 发 育 过 程 一 般 都 不 能 钴 化 出 小 鸡 ，\n请 观察 下 页 的 图 片 (图 7.9)， 结 合 自己 已 有 的 。。 这 是 为 什么 呢 ?\n知识 ， 你 能 概括 出 鸟 类 生殖 和 发 育 的 基本 过 程 吗 ?\n第 一 章 生物 的 生殖 和 发 育 10",2.0,72.425,人教版_八年级_义务教育教科书·生物学八年级下册,36,2025-07-21T14:24:46.042Z,2.0,义务教育教科书·生物学八年级下册,/Users/LeoQin/Documents/GitHub/PDFconvertor/training_data/初中/生物学/人教版-人民教育出版社/八年级/义务教育教科书·生物学八年级下册.pdf,八年级,tesseract.js-parallel,人教版,0.8236397748592871,0.6,1,72.425,,true,,true,true,,biology,下册,人教版_八年级_义务教育教科书·生物学八年级下册.json,生物,120,初中_生物学_人教版_八年级_义务教育教科书·生物学八年级下册
人教版_八年级_义务教育教科书·生物学八年级下册_chunk_23,23,"ranuauna w "" 4 吉图 所示 的五 头寺 ,是我 国呈 份和 人 ; 首例 用成 年牛 体细 胞克隆出 来的， _ i 它们几乎一 楼一 样。 为什么它们外 i V i 证长 得如 此相像呢 ? 通过本 节学 习， 你将 知道， 通俗地 说， 遗传 heredity ) 是指 亲子 间的 相和 什芭 是性 状， 件笃 基相对似 性， 变异 〈variation ) 是指 亲子 间及 子代 个体 间性 状 ? 的差异。 人们 对遗传和 变异的 认识， 最初 是从 性状 性尖 过基因壹 间的 关系 (trait) 开始的， 后来 随着 科学的 发展， 才逐 浙深入惩 怎样的 ? 到基因 ( gene ) 水平。 24 第七 单元生物图 中生命的 延续和 发展 生物的 性状 什么是 生物的 性状 ? 子代 的性 状与 亲代 的性 状有 关吗 ? Rh 观察与 思考司 观察 下图 中表示的 几种 生物性 状 s 吝豆 的圆 粒和 争粒 番茄的 红果和 黄果 免的 黑毛 与白 毛鸡 的玫瑰冠 与单 冠和 小组 成员 间相 互观 察对 方的 下列 性状 z (1) 耳条 有没有耳 重 ? (2) 眼睛是 单眼皮的 还是 双眼皮 的 ? (3 ) 天能 否由 两个 向中 间卷 曲 ? (4) 大拇指能 秋向 背侧 弯曲 ? ; 有耳 妇和 无耳 符本 单眼皮 和双眼皮 第二 章生物的 遵屠 与变 措。 25 目系 第上 单元 ABEBPEGIELEFok J S 2F 作息的 绅消 和内 闪 atasaaaaamaaaaaeiaaaaatinaaasaianana 明二 本附 生三 Secsaaarmaersatsearmearareroitaaaacantaaatriysaaag2",753,0.3544865602716468,low,ocr,"ranuauna w "" 4 |\n吉 图 所 示 的 五 头 寺 ,是 我 国 呈 份 和 » 人\n; 首 例 用 成 年 牛 体 细 胞 克隆 出 来 的 ， _— i- -\n| 它们 几乎 一 楼 一 样 。 为 什么 它们 外 i V i 证\n| 长 得 如 此 相像 呢 ?\n通过 本 节 学 习 ， 你 将 知道 ， 通俗 地 说 ， 遗传 heredity ) 是 指 亲 子 间 的 相\n和 什 芭 是 性 状 ， 件 笃 基 相对 似 性 ， 变 异 〈variation ) 是 指 亲 子 间 及 子 代 个 体 间\n性 状 ? 的 差异 。 人 们 对 遗传 和 变异 的 认识 ， 最 初 是 从 性 状\n性 尖 过 基因 壹 间 的 关系 (trait) 开始 的 ， 后 来 随 着 科学 的 发 展 ， 才 逐 浙 深入\n惩 怎样 的 ? 到 基因 ( gene ) 水 平 。\n24 ”第 七 单元 生物 图 中 生命 的 延续 和 发 展\n=== 第 43 页 ===\n生物 的 性 状\n什么 是 生物 的 性 状 ? 子 代 的 性 状 与 亲 代 的 性 状\n有 关 吗 ?\nRh 观察 与 思考\n司 观 察 下 图 中 表示 的 几 种 生物 性 状 s\n吝 豆 的 圆 粒 和 争 粒 番茄 的 红果 和 黄 果\n免 的 黑 毛 与 白 毛 鸡 的 玫瑰 冠 与 单 冠\n和 小 组 成 员 间 相 互 观 察 对 方 的 下 列 性 状 z\n(1) 耳 条 有 没有 耳 重 ?\n(2) 眼睛 是 单眼皮 的 还 是 双眼 皮 的 ?\n(3 ) 天 能 否 由 两 个 向 中 间 卷 曲 ?\n(4) 大 拇指 能 秋 向 背 侧 弯 曲 ?\n- ’ £\n-\n; |\n有 耳 妇 和 无 耳 符 本 单眼 皮 和 双眼 皮\n第 二 章 生物 的 遵 屠 与 变 措 。 25\n=== 第 44 页 ===\n目 系\n第 上 单元 ABEBPEGIELEFok J\nS—2F 作息 的 绅 消 和 内 闪 atasaaaaamaaaaaeiaaaaatinaaasaianana 明\n二 本 附 生 三 Secsaaarmaersatsearmearareroitaaaacantaaatriysaaag2",2.0,72.425,人教版_八年级_义务教育教科书·生物学八年级下册,42,2025-07-21T14:24:46.042Z,2.0,义务教育教科书·生物学八年级下册,/Users/LeoQin/Documents/GitHub/PDFconvertor/training_data/初中/生物学/人教版-人民教育出版社/八年级/义务教育教科书·生物学八年级下册.pdf,八年级,tesseract.js-parallel,人教版,0.6414414414414414,0.6,1,72.425,,true,,true,true,,mathematics,下册,人教版_八年级_义务教育教科书·生物学八年级下册.json,生物,120,初中_生物学_人教版_八年级_义务教育教科书·生物学八年级下册
人教版_八年级_义务教育教科书·生物学八年级下册_chunk_24,24,生的 超源 recentorerroearreesrnonanad50 科学。 技术。 社会， 探索地 球外 的第 全 55 强生本 浊和 的所 要 Passaaseaoraraararoiaaancataararnisaagr 禹关节和 睹牺 进化的 捧国 220 科学家 的故事达尔文 和他 的进化思想 7 目录 1 能考 和和 不能 疮天 大拇指能 向背 侧弯曲和 大拇 带不 能向 背侧 谊上 曲讨论加 试着 概括什么是 生物的 性状。 局通过观察， 结合 自己的 生活经 验， 举例 说出 同种 生物的 同一性 状常 有哪些不 同的 表现形式。 咎仅 任肉眼的 观察或 简单的 测量， 就能 知道自己所 有的 性状 吗 ? 厨任 选上 述一 种性 状， 看看 你与 父亲或 母亲是 否相 同。 如有 果不 同， 再看 看你 与父母的 父母是 否相 同。 这说 明什么呢 ? 局在 观察和 讨论过 程中， 你还 有哪些问题 ? 请与 同学交流， 并试 着作 出解 大。 通过观 睹和 讨论， 我们 可以 知道， 任何 生物体 都有 许许多多 性状。 有的 是形态结构特征， 有的 是生理特性 (如人 的血型 )， 有的 是行为方式 《如婴儿一 出生 就会 史吸 、 民用 右手等 行为 )， 等等。 可见， 性状 就是 生物体形态 结构 、 生理 和行为等 特征的 统称。 同种 生物的 同一性 状常 常有 不同 的表现形式， 如番茄果实的 红色或 黄色 、 家免 毛的 黑色 或白色 、 人的 双眼皮 或单眼皮 等。 为了 描述方 便， 遗传 学家 把同 种生物同一性 状的 不同 表现形式 称为 相对性 状 (relative trait )。 生物体 所表现出 来的 各种 性状 是由 什么控制的 呢 ?,759,0.4379638962328766,medium-low,ocr,生 的 超 源 recentorerroearreesrnonanad50\n科学 。 技术 。 社 会， 探索 地 球 外 的 第 全 55\n强生 本 浊 和 的 所 要 Passaaseaoraraararoiaaancataararnisaagr\n禹 关节 “和 睹 牺 进化 的 捧 国 220\n科学 家 的 故事 达尔 文 和 他 的 进化 思想 7\n目录 1]\n=== 第 45 页 ===\n能 考 和 和 不 能 疮 天 大 拇指 能 向 背 侧 弯曲 和 大 拇 带 不 能 向 背 侧 谊 上 曲\n讨论\n加 试 着 概括 什么 是 生物 的 性 状 。\n局 通过 观察 ， 结 合 自己 的 生活 经 验 ， 举 例 说 出 同 种 生物 的 同一 性 状 常\n有 哪些 不 同 的 表现 形式 。\n咎 仅 任 肉眼 的 观察 或 简单 的 测量 ， 就 能 知道 自己 所 有 的 性 状 吗 ?\n厨 任 选 上 述 一 种 性 状 ， 看 看 你 与 父亲 或 母亲 是 否 相 同 。 如 有 果 不 同 ， 再\n看 看 你 与 父母 的 父母 是 否 相 同 。 这 说 明 什么 呢 ?\n局 在 观察 和 讨论 过 程 中 ， 你 还 有 哪些 问题 ? 请 与 同学 交流 ， 并 试 着 作\n出 解 大 。\n通过 观 睹 和 讨论 ， 我 们 可 以 知道 ， 任 何 生物 体\n都 有 许 许多 多 性 状 。 有 的 是 形态 结构 特征 ， 有 的\n是 生理 特性 (如 人 的 ABO 血型 )， 有 的 是 行为 方式\n《如 婴儿 一 出 生 就 会 史 吸 、 民 用 右手 等 行为 )， 等\n等 。 可 见 ， 性 状 就 是 生物 体形 态 结构 、 生 理 和 行为\n等 特征 的 统称 。 同 种 生物 的 同一 性 状 常 常 有 不 同 的\n表现 形式 ， 如 番茄 果实 的 红色 或 黄色 、 家 免 毛 的 黑\n色 或 白色 、 人 的 双眼 皮 或 单眼 皮 等 。 为 了 描述 方\n便 ， 遗 传 学 家 把 同 种 生物 同一 性 状 的 不 同 表 现形 式\n称 为 相对 性 状 (relative trait )。\n生物 体 所 表现 出 来 的 各 种 性 状 是 由 什么 控制\n的 呢 ?,2.0,72.425,人教版_八年级_义务教育教科书·生物学八年级下册,44,2025-07-21T14:24:46.042Z,2.0,义务教育教科书·生物学八年级下册,/Users/LeoQin/Documents/GitHub/PDFconvertor/training_data/初中/生物学/人教版-人民教育出版社/八年级/义务教育教科书·生物学八年级下册.pdf,八年级,tesseract.js-parallel,人教版,0.7715289982425307,0.6,1,72.425,,true,,true,true,,biology,下册,人教版_八年级_义务教育教科书·生物学八年级下册.json,生物,120,初中_生物学_人教版_八年级_义务教育教科书·生物学八年级下册
