Chunk_ID,Chunk_Index,Content,Content_Length,Quality_Score,Reliability,Source_Type,Original_Content,Enhancement_Version,averageConfidence,book_name,chunkIndex,enhancementTimestamp,enhancementVersion,fileName,filePath,grade,ocrMethod,publisher,qualityMetrics_chineseCharRatio,qualityMetrics_coherenceScore,qualityMetrics_lengthScore,qualityMetrics_ocrConfidence,semanticFeatures_hasDefinition,semanticFeatures_hasExperiment,semanticFeatures_hasFormulas,semanticFeatures_hasNumbers,semanticFeatures_hasQuestion,semanticFeatures_isTableContent,semanticFeatures_subjectArea,semester,source_file,subject,totalPages,uniqueId
人教版_八年级_义务教育教科书·生物学八年级下册_chunk_40,40,为什么 ? 4. 在一 个国家或 地区 的人 口中， 男女 比例 大致 是 11; 而在 一个 多子女家 庭中， 男女 比例 不是 1:1 的情形也 很多。 请你 运用本 节所 学知识， 对此 作出合 理的 解释。 5. 有些 人为 满足家 庭想 要男孩或 女孩的 愿望， 请求 医生为 孕妇做 且胎 性别 诊断， 以决定取 含。 这种 做法 对吗 ? 如果 法规 不禁止这 样做， 对人 类社会将 会产生怎样的 影响 ? 42 第七 单元生物轿 中生命的 延续和 发展 第五 节生物的 变异 (50) 起一 起， 议一 议 o 现代各 品种侈 香是 由其 野生类 型金 鲫鱼人 工培育而 来。 从下 图中 可以 看出， 图中 人金鱼与 金卿 鱼的 外形 差异很 大， 你能 说出 金鱼身体颜色变 化的 原因吗 ? 本加 o 有爹 鲫埋 生物圈 中生物的 种类 繁多 .不同 种类 的生物之。 通辽末 书汪 司， 估可 交道间 千差 万别， 同种 生物之 间也 存在各 种各 样的 差异。 什么是 可次 传的 变异和 (图 7 18， 图 7 19)， 这都 源于 生物的 变异， 至可 和咀 传的 变蜡 ? 引起生物变 乒的 原因有 有哪些 ? 人和 遗传育种的 主要方法有 本哪些 ? 全区， 是者 本有 生 ay ARYR 以六 四所 A 和图 7 18 不同 品种 的菊花图 7 19 不同 品种 的玉米果 种第 二章 生物的 站导 与变 并 43 你肯定还 能举 出许多生物变异的 例子。 你对 其性 状的 变异做 过较 识入 的探究吗 ? 探究一 种变异现象四 mr 花生果实大 小的 变异,701,0.440017429090909,medium-low,ocr,为\n什么 ?\n4. 在 一 个 国家 或 地 区 的 人 口中 ， 男 女 比 例 大 致 是 11; 而 在 一 个 多 子女 家 庭\n中 ， 男 女 比 例 不 是 1:1 的 情形 也 很 多 。 请 你 运用 本 节 所 学 知识 ， 对 此 作出 合\n理 的 解释 。\n5. 有 些 人 为 满足 家 庭 想 要 男孩 或 女孩 的 愿望 ， 请 求 医生 为 孕妇 做 且 胎 性 别 诊\n断 ， 以 决定 取 含 。 这 种 做 法 对 吗 ? 如 果 法 规 不 禁止 这 样 做 ， 对 人 类 社会 将\n会 产生 怎样 的 影响 ?\n42 ”第 七 单元 生物 轿 中 生命 的 延续 和 发 展\n=== 第 63 页 ===\n第 五 节 ”生物 的 变异\n(50) 起 一 起 ， 议 一 议 o\n| 现代 各 品种 侈 香 是 由 其 野生 类 型 金 鲫鱼 人 工 培育 而 来 。 从 下 图 中 可 |\n| 以 看 出 ， 图 中 人 金鱼 与 金 卿 鱼 的 外 形 差异 很 大 ， 你 能 说 出 金鱼 身体 颜色 变 |\n| 化 的 原因 吗 ?\n本\n加 o\n有 - |\n~ 爹 鲫 埋\n生物 圈 中 生物 的 种 类 繁多 .不 同 种 类 的 生物 之 。 通辽 末 书 汪 司 ， 估 可 交道\n间 千 差 万 别 ， 同 种 生物 之 间 也 存在 各 种 各 样 的 差异 。 * 什么 是 可 次 传 的 变异 和\n(图 7-18， 图 7-19)， 这 都 源 于 生物 的 变异 ， 至 可 和 咀 传 的 变 蜡 ?\n= 引起 生物 变 乒 的 原因 有 有\n哪些 ?\n人 = 和 遗传 育种 的 主要 方法 有\n|\n- 本 哪些 ?\n全 区，\n是 -者\n~ 本 有 生\n ay\n| |\n“ARYR 以\n六 四\n所 A - |\n和 /\n图 7-18 不 同 品 种 的 菊花 图 7-19 不 同 品 种 的 玉米 果 种\n第 二 章 生物 的 站 导 与 变 并 43\n=== 第 64 页 ===\n你 肯定 还 能 举 出 许多 生物 变异 的 例子 。 你 对 其\n-性 状 的 变异 做 过 较 识 入 的 探究 吗 ?\n探究 一 种 变异 现象\n四 mr\n花生 果实 大 小 的 变异,2.0,72.425,人教版_八年级_义务教育教科书·生物学八年级下册,65,2025-07-21T14:24:46.042Z,2.0,义务教育教科书·生物学八年级下册,/Users/LeoQin/Documents/GitHub/PDFconvertor/training_data/初中/生物学/人教版-人民教育出版社/八年级/义务教育教科书·生物学八年级下册.pdf,八年级,tesseract.js-parallel,人教版,0.852589641434263,0.5,1,72.425,,,,true,true,,biology,下册,人教版_八年级_义务教育教科书·生物学八年级下册.json,生物,120,初中_生物学_人教版_八年级_义务教育教科书·生物学八年级下册
人教版_八年级_义务教育教科书·生物学八年级下册_chunk_41,41,"YR 以六 四所 A 和图 7 18 不同 品种 的菊花图 7 19 不同 品种 的玉米果 种第 二章 生物的 站导 与变 并 43 你肯定还 能举 出许多生物变异的 例子。 你对 其性 状的 变异做 过较 识入 的探究吗 ? 探究一 种变异现象四 mr 花生果实大 小的 变异小 熟带 他的 好朋友去 奶奶家 玩。 奶奶 陆续拿 出许多好 吃的 ;其中 有大 小两 种花生奶奶还 说小 花生含油多， 吃起 来更 香。 大家 一边 吃着， 一达 提出 了许多问题 ( 见下 图 )。 花生果实的 大怎样区 分大 花生小 不同， 是四 本一， 这妊 说不 科学 ! 和小 花生 ? 天花 为品种不同。 t 大小 花生是 多它 王量 业让 和沁 下 Riy 们果实大 小的 平的， 小花生里 也均值而 言有 个儿 到的 呀 ! p ev S 站 2 Aad f e, s 人小 花生也 会长 虑天 花生。 anl o 约略有) 所二 开本 要中 .4 上达 其实， 这确实是 两个 路种 的花生。 花生果实大 小存在着 变异， 建议 用取样 、 测量 、 整理 数据 、 画出 曲线图 的办 法进行探究。 提出问题你 们小 组的 问题是 : 5 44。 第七 单元生物圈 中生命的 延续和 发展 作出假设你 们小 组的 假设是 制订计划并 实施提示加 要做 到随机取 禅。 全样品要 有尾 够的 数量， 建议 不要 少于 30 枚。 加建议测量果实的 长轴 的长 短， 长短 以毫米计。 加选择和 设计适当的 测量工具和 测量方法。 和用 坐标纸 绘制曲线图 ,水平抽 为果实的 长度， 纵轴 为样品的 个数，",703,0.330208322202166,low,ocr,"YR 以\n六 四\n所 A - |\n和 /\n图 7-18 不 同 品 种 的 菊花 图 7-19 不 同 品 种 的 玉米 果 种\n第 二 章 生物 的 站 导 与 变 并 43\n=== 第 64 页 ===\n你 肯定 还 能 举 出 许多 生物 变异 的 例子 。 你 对 其\n-性 状 的 变异 做 过 较 识 入 的 探究 吗 ?\n探究 一 种 变异 现象\n四 mr\n花生 果实 大 小 的 变异\n小 熟 带 他 的 好 朋友 去 奶奶 家 玩 。 奶 奶 陆续 拿 出 许多 好 吃 的 ;其 中 有\n大 小 两 种 花生 =* 奶奶 还 说 小 花生 含油 多 ， 吃 起 来 更 香 。 大 家 一 边 吃 着 ，\n一 达 提 出 了 许多 问题 ( 见 下 图 )。\n花生 果实 的 大\n怎样 区 分 大 花生 小 不 同 ， 是 四 本 一 ， 这 妊 说 不 科学 !\n和 小 花生 ? 天 花 为 品种 不同 。 t 大 小 花生 是 多 它\n王 量 业 让 和 沁 下 Riy 们 果实 大 小 的 平\n的 ， 小 花生 里 也 均值 而 言\n有 个 儿 到 的 呀 ! BA ¥\np ev S\n站 SR\n2 NAN & Aad\n’ f  e, s\n人 小 花生 也 会\n长 虑 天 花生 。\nanl & o¢\n约略 有)\n所 二 开 本 要 中\n.4 = | 上 达\n其 实 ， 这 确实 是 两 个 路 种 的 花生 。 花生 果实 大 小 存在 着 变异 ， 建 议\n用 取样 、 测 量 、 整 理 数据 、 画 出 曲线 图 的 办 法 进行 探究 。\n提出 问题\n你 们 小 组 的 问题 是 : 5\n44 。 第 七 单元 “生物 圈 中 生命 的 延续 和 发 展\n=== 第 65 页 ===\n作出 假设\n你 们 小 组 的 假设 是\n制订 计划 并 实施\n提示\n加 要 做 到 随机 取 禅 。\n全 样品 要 有 尾 够 的 数量 ， 建 议 不 要 少 于 30 枚 。\n加 建议 测量 果实 的 长 轴 的 长 短 ， 长 短 以 毫米 计 。\n加 选择 和 设计 适当 的 测量 工具 和 测量 方法 。\n和 @ 用 坐标 纸 绘制 曲线 图 ,水平 抽 为 果实 的 长 度 ， 纵 轴 为 样品 的 个 数 ，",2.0,72.425,人教版_八年级_义务教育教科书·生物学八年级下册,66,2025-07-21T14:24:46.042Z,2.0,义务教育教科书·生物学八年级下册,/Users/LeoQin/Documents/GitHub/PDFconvertor/training_data/初中/生物学/人教版-人民教育出版社/八年级/义务教育教科书·生物学八年级下册.pdf,八年级,tesseract.js-parallel,人教版,0.8490196078431372,0.5,1,72.425,,,,true,true,,biology,下册,人教版_八年级_义务教育教科书·生物学八年级下册.json,生物,120,初中_生物学_人教版_八年级_义务教育教科书·生物学八年级下册
人教版_八年级_义务教育教科书·生物学八年级下册_chunk_42,42,"的假设是 制订计划并 实施提示加 要做 到随机取 禅。 全样品要 有尾 够的 数量， 建议 不要 少于 30 枚。 加建议测量果实的 长轴 的长 短， 长短 以毫米计。 加选择和 设计适当的 测量工具和 测量方法。 和用 坐标纸 绘制曲线图 ,水平抽 为果实的 长度， 纵轴 为样品的 个数， 依据两 数的 相交点。 连成 曲线。 人测 量的 结果也 可以 用柱 形图 表示。 得出 结论并 进行交流把 本小 组绽 制的 结果图 由在 下方 左侧， 在右 侧写 上本 组的 结论 : Hiigs . 贴图处 一要 认真听取小 组代表的 交流， 因为 小组 间探 究的 问题有 差别。 讨论 各用 语言指 述两 个品种花生果实在 不同 长度 范围内 的数量分 布状况， 你能 得出 什么结论 ? 计算 并比较两 个品种花生果实长 度各 自的 平均值， 你能 得出 什么结 7 Of KlEk WRTRERKNLES, 壤中， 它们 结出 的果实会 怎样呢 ? 你作出推测的 依握 是什么 ? 加从 大花生让 选择一 粒爷 满粒 大的 种子 种下 去， 所收获的 种子 一定 都是 大的 吗 ? 为什么 ? 第二 章生物的 址伟 与变 并。 45 员大 一第 元单元生物圈 中生命的 续和 发展 延续和 qu sw 下 1 : A nm 夺了 w E ns ws 古井 oF ) oa 学了 六 Eee 一一 : 梁上 有双 菩， 裔裔 共与 肉 , 青下 不易 捕， 黄口 无包 期须 史十 来往， 犹恶 涌中 饥 . 唐伐 诗人白居易 (772 846) 这脸 交人 口的 诗名， 撕写 了着 子生 儿青 女的 艰辛， 反",711,0.365183087633452,low,ocr,"的 假设 是\n制订 计划 并 实施\n提示\n加 要 做 到 随机 取 禅 。\n全 样品 要 有 尾 够 的 数量 ， 建 议 不 要 少 于 30 枚 。\n加 建议 测量 果实 的 长 轴 的 长 短 ， 长 短 以 毫米 计 。\n加 选择 和 设计 适当 的 测量 工具 和 测量 方法 。\n和 @ 用 坐标 纸 绘制 曲线 图 ,水平 抽 为 果实 的 长 度 ， 纵 轴 为 样品 的 个 数 ，\n依据 两 数 的 相交 点 。 连 成 曲线 。\n人 @ 测 量 的 结果 也 可 以 用 柱 形 图 表示 。\n得 出 结论 并 进行 交流\n把 本 小 组 绽 制 的 结果 图 由 在 下 方 左 侧 ， 在 右 侧 写 上 本 组 的 结论 :\nHiigs .\n贴图 处 一\n要 认真 听取 小 组 代表 的 交流 ， 因 为 小 组 间 探 究 的 问题 有 差别 。\n讨 论\n各 用 语言 指 述 两 个 品种 花生 果实 在 不 同 长 度 范围 内 的 数量 分 布 状况 ，\n你 能 得 出 什么 结论 ?\n@ 计 算 并 比较 两 个 品种 花生 果实 长 度 各 自 的 平均 值 ， 你 能 得 出 什么 结\n#7\nOf KlEk WRTRERKNLES, BAEENHTRHIABKYL\n壤 中 ， 它 们 结 出 的 果实 会 怎样 呢 ? 你 作出 推测 的 依 握 是 什么 ?\n加 从 大 花生 让 选择 一 粒 爷 满 粒 大 的 种 子 种 下 去 ， 所 收获 的 种 子 一 定 都\n是 大 的 吗 ? 为 什么 ?\n第 二 章 生物 的 址 伟 与 变 并 。 45\n=== 第 66 页 ===\n员 大 ~ -一\n第 元 单元\n生物 圈 中 生命 的\n续 和 发 展\n延续 和\nqu sw\n下 1 :\n A\n- nm 夺 ”\n了 w & E] ns\nws\n古井\n& &oF )\noa UN 学 了\n六 Eee 一 一 :\n——\n“ 梁 上 有 双 菩 ， 裔 裔 共 与 肉 ,…… 青 下 不 易 捕 ， 黄 口 无 包\n期 …… 须 史 十 来 往 ， 犹 恶 涌 中 饥 .” 唐 伐 诗人 白居易 (772-\n846) 这 脸 交 人 口 的 诗 名 ， 撕 写 了 着 子 生 儿 青 女 的 艰辛 ， 反",2.0,72.425,人教版_八年级_义务教育教科书·生物学八年级下册,67,2025-07-21T14:24:46.042Z,2.0,义务教育教科书·生物学八年级下册,/Users/LeoQin/Documents/GitHub/PDFconvertor/training_data/初中/生物学/人教版-人民教育出版社/八年级/义务教育教科书·生物学八年级下册.pdf,八年级,tesseract.js-parallel,人教版,0.8171206225680934,0.5,1,72.425,,,,true,true,,biology,下册,人教版_八年级_义务教育教科书·生物学八年级下册.json,生物,120,初中_生物学_人教版_八年级_义务教育教科书·生物学八年级下册
人教版_八年级_义务教育教科书·生物学八年级下册_chunk_43,43,"夺了 w E ns ws 古井 oF ) oa 学了 六 Eee 一一 : 梁上 有双 菩， 裔裔 共与 肉 , 青下 不易 捕， 黄口 无包 期须 史十 来往， 犹恶 涌中 饥 . 唐伐 诗人白居易 (772 846) 这脸 交人 口的 诗名， 撕写 了着 子生 儿青 女的 艰辛， 反喘 了生物繁衍后 代的 本能。 从个 体水 平看， 生物体的 寿命都 是有 限的， 死亡 意味 着生命的 结束。 而从 整个生物图 来看， 生命 总是 在不 断地 延续和 发展 着， 通过 生殖和 发育 、 遗传 和变异， 并与 环境的 变化相互作用， 演奏 着延绵不 绝 、 跌宕 起伏 的生命乐章， 通过以 上学 习， 你会 认识到 生物性 状的 变异是 ws 人普遍存在的， 引起 变异的 原因也 是多 种多 样的。 不在 中生 的同 种类 之间， 不同 个体 之间 的差异， 首先 取决于 遗。 发生 赤化 ,或者 业色，， 传物质的 不同， 其次 与环境也 有关系。 由遗传物质。 休结 构和 堵生 发生变的 变化引起的 变异是 可和 遗传 的变异 ; 单纯由 环境引 作用全 了作 引十 坟。。 起的 变异， 如果 没有 影响到 遗传物质， 就不 会站 人本， 给后 代， 是不 遗传的 变异。 对此， 你还 能举 出一 些人 类应 用遗传变异原理培育新 品种悠悠五 千年的 文明史， 中华 民族 创造过 无数 的辉煌。 世界 上栽培植物和 饲养动物的 优良品种中， 有许多都 源自我国， 如水 稻 、 家猪 等。 现代 育种 工作 的杰出代表袁隆平院士和 他的 超级杂交水 稻更 是亭 翟世界。",698,0.3832329528084714,low,ocr,"夺 ”\n了 w & E] ns\nws\n古井\n& &oF )\noa UN 学 了\n六 Eee 一 一 :\n——\n“ 梁 上 有 双 菩 ， 裔 裔 共 与 肉 ,…… 青 下 不 易 捕 ， 黄 口 无 包\n期 …… 须 史 十 来 往 ， 犹 恶 涌 中 饥 .” 唐 伐 诗人 白居易 (772-\n846) 这 脸 交 人 口 的 诗 名 ， 撕 写 了 着 子 生 儿 青 女 的 艰辛 ， 反\n喘 了 生物 繁衍 后 代 的 本 能 。\n从 个 体 水 平 看 ， 生 物体 的 寿命 都 是 有 限 的 ， 死 亡 意 味\n着 生命 的 结束 。 而 从 整个 生物 图 来 看 ， 生 命 总 是 在 不 断 地\n延续 和 发 展 着 ， 通 过 生殖 和 发 育 、 遗 传 和 变异 ， 并 与 环境\n的 变化 相互 作用 ， 演 奏 着 延绵 不 绝 、 跌 宕 起 伏 的 生命 乐章 ，\n=== 第 67 页 ===\n- 通过 以 上 学 习 ， 你 会 认识 到 生物 性 状 的 变异 是\nws 人 普遍 存在 的 ， 引 起 变异 的 原因 也 是 多 种 多 样 的 。 不\n在 中 ONRA 生 的 同 种 类 之 间 ， 不 同 个 体 之 间 的 差异 ， 首 先 取决 于 遗\n。 发 生 赤 化 ,或 者 业 色 ，， 传 物质 的 不 同 ， 其 次 与 环境 也 有 关系 。 由 遗传 物质\n。 休 结 构 和 堵 生 发 生变 “的 变化 引起 的 变异 是 可 和 遗 传 的 变异 ; 单纯 由 环境 引\n作用 全 了 作 引 十 坟 。。 起 的 变异 ， 如 果 没 有 影响 到 遗传 物质 ， 就 不 会 站 人\n本， | 给 后 代 ， 是 不 遗传 的 变异 。 对 此 ， 你 还 能 举 出 一 些\nCE\n人 类 应 用 遗传 变异 原理 培育 新 品种\n悠悠 五 千年 的 文明 史 ， 中 华 民 族 创造 过 无 数 的\n辉煌 。 世 界 上 栽培 植物 和 饲养 动物 的 优良 品种 中 ，\n有 许多 都 源 自我 国 ， 如 水 稻 、 家 猪 等 。 现 代 育 种 工\n作 的 杰出 代表 袁隆平 院士 和 他 的 超级 杂交 水 稻 更 是\n亭 翟 世界 。",2.0,72.425,人教版_八年级_义务教育教科书·生物学八年级下册,68,2025-07-21T14:24:46.042Z,2.0,义务教育教科书·生物学八年级下册,/Users/LeoQin/Documents/GitHub/PDFconvertor/training_data/初中/生物学/人教版-人民教育出版社/八年级/义务教育教科书·生物学八年级下册.pdf,八年级,tesseract.js-parallel,人教版,0.860236220472441,0.5,1,72.425,,,,true,,,biology,下册,人教版_八年级_义务教育教科书·生物学八年级下册.json,生物,120,初中_生物学_人教版_八年级_义务教育教科书·生物学八年级下册
人教版_八年级_义务教育教科书·生物学八年级下册_chunk_44,44,"的原理培育新 品种的 方法还 有很 多， 请你 查阅有 关资 料与 大家 交流。 移居一 一 1. 判断了 到说 法是 否正确。 正确的 画 w， 错误 的画 X : (1) 同犯 双生 兄弟 俩， 哥哥 在地 质考察队 工作， 皮肤 史黑 ; 弟弟 ve it 在装配电视机 的流水线 上工作， 3 皮肤和 白净。 他们 的肤色都 能够 遗 Reas 传给 各自 的后 代 ( ) 于 (2) 一对 正常毛色的 孟加拉虎 生下 L N X K 了一 只白色的 幼虎， 这肯定是 基因备 加拉 虎 【 右例 为白化个 体 ) 2. 育种工作者 使用 射线处 理农作物的 种子， 再从 中选 出优质高 产的 新品种。 这种 育种方法能 够成 功， 从根本上 是因为改变了 农作物的 : ( ) A. 性状 ; B. 遗传 物质 ; C. 生活 环境 ; D. 生活 习性 : 3. 某小 组在 测定花生果实长 度时， 提出 下列 四种 取样方法， 其中 正确的 是 : ( ) A. 从大 花生中 取 40 必较 大的， 从小 花生中 取 40 覆较 小的 ; B. 从大 花生中 取 1 救较 大的， 从小 花生中 取 1 玫较 小的 ; C. 从两 种花生中 分别 随机取出 35 枚 ; D. 从两 种花生中 分别 随机取出 1 覆。 4. 用一 种化 学药剂处 理甜菜 ( 右图 ) 的功 苗， 使细胞内 的染色体 数目 加倍， 甜菜 含糖 量提 高。 体认为这 种变异能 道传 吗 ? r. 5. 人类 已经 进入了 基因时 代 ""。 体已 经知道， 用转基因的 方法能 够培育出 高产 、 优质 、 搞病 的新 品种。 你能 为大 家举 一两 个例子吗 ? 举例时 请说 明信 息的 来源。 和钳 菜的 一种",759,0.3533747912408759,low,ocr,"的 原理 培育 新 品种 的 方法 还 有 很\n多 ， 请 你 查阅 有 关 资 料 与 大 家 交流 。\n-移居 一 一\n1. 判断 了 到 说 法 是 否 正确 。 正确 的 画 “w”， 错 误 的 画 “X”-:\n(1) 同 犯 双 生 兄 弟 俩 ， 哥 哥 在 地\n质 考察 队 工 作 ， 皮 肤 史 黑 ; 弟弟 ve it ER\n在 装配 电视 机 的 流水 线 上 工作 ， 3\n皮肤 和 白净 。 他 们 的 肤色 都 能 够 遗 »  Reas\n传 给 各 自 的 后 代 - ( ) 于 AN\n(2) 一 对 正常 毛色 的 孟加拉 虎 生 下 L| N YA X K\n了 一 只 白色 的 幼 虎 ， 这 肯定 是 基因\nRE 备 加 拉 虎 【 右 例 为 白化 个 体 )\n2. 育种 工作 者 使 用 射线 处 理 农作物\n的 种 子 ， 再 从 中 选 出 优质 高 产 的 新 品种 。 这 种 育种 方法 能 够 成 功 ， 从 根本\n上 是 因为 改变 了 农作物 的 : (  )\nA. 性 状 ; B. 遗 传 物质 ;\nC. 生 活 环境 ; D. 生 活 习 性 :\n3. 某 小 组 在 测定 花生 果实 长 度 时 ， 提 出 下 列 四 种 取样 方法 ， 其 中 正确 的 是 : (  )\nA. 从 大 花生 中 取 40 必 较 大 的 ， 从 小 花生 中 取 40 覆 较 小 的 ;\nB. 从 大 花生 中 取 1 救 较 大 的 ， 从 小 花生 中 取 1 玫 较 小 的 ;\nC. 从 两 种 花生 中 分 别 随机 取出 35 枚 ;\nD. 从 两 种 花生 中 分 别 随机 取出 1 覆 。\n4. 用 一 种 化 学 药剂 处 理 甜菜 ( 右 图 ) 的 功 苗 ，\n使 细胞 内 的 染色 体 数 目 加 倍 ， 甜 菜 含 糖 量 提\n高 。 体 认为 这 种 变异 能 道 传 吗 ? r.\n5. 人 类 已 经 进入 了 “基因 时 代 ""。 体 已 经 知道 ，\n用 转基因 的 方法 能 够 培育 出 高 产 、 优 质 、 搞\n病 的 新 品种 。 你 能 为 大 家 举 一 两 个 例子 吗 ?\n举例 时 请 说 明 信 息 的 来 源 。\n和 钳 菜 的 一 种",2.0,72.425,人教版_八年级_义务教育教科书·生物学八年级下册,70,2025-07-21T14:24:46.042Z,2.0,义务教育教科书·生物学八年级下册,/Users/LeoQin/Documents/GitHub/PDFconvertor/training_data/初中/生物学/人教版-人民教育出版社/八年级/义务教育教科书·生物学八年级下册.pdf,八年级,tesseract.js-parallel,人教版,0.7962264150943397,0.6,1,72.425,,,,true,true,,biology,下册,人教版_八年级_义务教育教科书·生物学八年级下册.json,生物,120,初中_生物学_人教版_八年级_义务教育教科书·生物学八年级下册
