Chunk_ID,Chunk_Index,Content,Content_Length,Quality_Score,Reliability,Source_Type,Original_Content,Enhancement_Version,averageConfidence,book_name,chunkIndex,enhancementTimestamp,enhancementVersion,fileName,filePath,grade,ocrMethod,publisher,qualityMetrics_chineseCharRatio,qualityMetrics_coherenceScore,qualityMetrics_lengthScore,qualityMetrics_ocrConfidence,semanticFeatures_hasDefinition,semanticFeatures_hasExperiment,semanticFeatures_hasFormulas,semanticFeatures_hasNumbers,semanticFeatures_hasQuestion,semanticFeatures_isTableContent,semanticFeatures_subjectArea,semester,source_file,subject,totalPages,uniqueId
人教版_八年级_义务教育教科书·生物学八年级下册_chunk_0,0,"7 、 呈人 Y KRE a T VI1I 八年 级类 民教 育出 版社 课程教材研究所 呈呈 生物课 程教材研 开发中 心编著人 天遍 有 xx 鼎社 .北京 : e Hit r 人二 人机 砧木和 砧本 ik 芽接图 7 3 嫁接的 步骤示意图 植物的 无性 生殖需要哪些条 件呢 y 比如持 插， 除光 照 、 水分 、 温度 、 湿度 等环境条 件外 ,用作 托插 的植物茎 段本 身应 具备什么条 件呢 ? 自己动手抒 插薄 和荷 或者 婷接 仙人 掌类 植物都 很有 趣。 试试 吧 ! 建议你 在动手之 前制订一 个行动方案。 一一 一一 gg 一一 一 1. 判断下 列说 法是 否正 确。 正确的 画， 错误 的画 X。 (1) 将马 铃著 的块茎切 成小 块来 种植 时， 不一 定每 块都 要有 芽眼 ( 2 (2) 在种 植萄 和芦荟的 时候， 一株 植株常常会 变成 一企， 这时 可以 把它们分 成很 多株， 这种 繁殖方式属于无 性生殖。 ( ) 2. 在进行嫁接时， 要将 友木 与接生的 形成层 紧密 结合， 目的 是 :( ) A. 让根部吸收的 水分 能运送到 枝条上 去 ; B. 让枝条通过光合作用制造的 养料运送到 根部 ; CC 保持接生与 砧木一 般粗， 利于 观赏 ; D. 利于 两部 分形成层 细胞分 裂出 的新 细胞僵 合在 一起。 3. 被子 植物 的无 性生殖在 农业生产上 有着 广泛的 应用。 除了教材中 讲到 的， 你还 能举 出一 些实例吗 ? 这些 植物是 否也 能进行有 性生殖 ? 6 第七 单元生物阐 中生命的 延续和 发展 人与 生物学 有关 的职业医疗救护员",719,0.30678022916666664,low,ocr,"=== 第 1 页 ===\n7 、 呈 PP\n/人  Y/ | KRE=a\nT-VI1I-\n八 年 级\n类 民 教 育 出 版 社 课程 教材 研究 所 | 呈 呈\n生物 课 程 教材 研 % 开发 中 心 编著\n人 天- 遍 有 xx 鼎 社\n.北京 :\n=== 第 2 页 ===\nAAL\n-e\nHit -\n=\nr 人 二 -\n人 =\n机\n砧木\n和 砧 本\nik 芽接\n图 7-3 嫁接 的 步骤 示意 图\n植物 的 无 性 生殖 需要 哪些 条 件 呢 y 比如 持 插 ，\n除 光 照 、 水 分 、 温 度 、 湿 度 等 环境 条 件 外 ,用 作 托\n插 的 植物 茎 段 本 身 应 具备 什么 条 件 呢 ? 自己 动手 抒\n插 薄 和 荷 或 者 婷 接 仙 人 掌 类 植物 都 很 有 趣 。 试 试 吧 !\n建议 你 在 动手 之 前 制订 一 个 行动 方案 。\n一 一 一 一 gg- 一 一 一\n1. 判断 下 列 说 法 是 否 正 确 。 正确 的 画 “”， 错 误 的 画 “X”。\n(1) 将 马 铃 著 的 块茎 切 成 小 块 来 种 植 时 ， 不 一 定 每 块 都 要 有 芽眼 - ( 2\n(2) 在 种 植 萄 和 芦荟 的 时 候 ， 一 株 植株 常常 会 变 成 一 企 ， 这 时 可 以 把 它们\n分 成 很 多 株 ， 这 种 繁殖 方式 属于 无 性 生殖 。 ( )\n2. 在 进行 嫁接 时 ， 要 将 友 木 与 接生 的 形成 层 紧 密 结合 ， 目 的 是 :(  )\nA. 让 根部 吸收 的 水 分 能 运送 到 枝条 上 去 ;\nB. 让 枝条 通过 光合 作用 制造 的 养料 运送 到 根部 ;\nCC- 保持 接生 与 砧木 一 般 粗 ， 利 于 观赏 ;\nD. 利 于 两 部 分 形成 层 细胞 分 裂 出 的 新 细胞 僵 合 在 一 起 。\n3. 被 子 植 物 的 无 性 生殖 在 农业 生产 上 有 着 广泛 的 应 用 。 除了 教材 中 讲 到 的 ，\n你 还 能 举 出 一 些 实例 吗 ? 这 些 植物 是 否 也 能 进行 有 性 生殖 ?\n6 第 七 单元 生物 阐 中 生命 的 延续 和 发 展\n=== 第 3 页 ===\n人 与 生物 学 有 关 的 职业\n医疗 救护 员",2.0,72.425,人教版_八年级_义务教育教科书·生物学八年级下册,0,2025-07-21T14:24:46.041Z,2.0,义务教育教科书·生物学八年级下册,/Users/LeoQin/Documents/GitHub/PDFconvertor/training_data/初中/生物学/人教版-人民教育出版社/八年级/义务教育教科书·生物学八年级下册.pdf,八年级,tesseract.js-parallel,人教版,0.8352713178294574,0.5,1,72.425,,,,true,true,,biology,下册,人教版_八年级_义务教育教科书·生物学八年级下册.json,生物,120,初中_生物学_人教版_八年级_义务教育教科书·生物学八年级下册
人教版_八年级_义务教育教科书·生物学八年级下册_chunk_1,1,"出的 新细胞僵 合在 一起。 3. 被子 植物 的无 性生殖在 农业生产上 有着 广泛的 应用。 除了教材中 讲到 的， 你还 能举 出一 些实例吗 ? 这些 植物是 否也 能进行有 性生殖 ? 6 第七 单元生物阐 中生命的 延续和 发展 人与 生物学 有关 的职业医疗救护员 医疗救护员 是运用救护知识和 技能， 对各 种急性病症 、 总外 事故 、 创伤 和突 发公共卫生事件中 的伤 病员施行现场初步紧急救护的 人员。 他们 从事 的主要工作包括 : (1) 对常见急性病 莹进行现场初步处 理 5(2) 对伤员进行通气 、 止血 、 包扎 、 骨折 国定 等初步救治 3 43) 搬运 、 护送 伤病员 ;《〈《4) 现场实施心肺复苏 ; (5) 在现场指导群众自救 、 互救 ;(6) 开展群众性 现场救护知识壮 及培训。 现场救 势妆 果及 时 、 处置 恪当， 就能 挽救生命 、 减轻 伤残 w 但是 : 我国 目前专业的 医疗救护员 还比较少， 与实际需求有 较大 差距。2005 年， 我国 将医疗救护员 确立 为一 个职业， 并进一步规范和 提高医 闻救 护人 员的 职业能 力， 这对 于有 效保障广大人 民群 众的 生命安全有 着重要意义。 如果 你想 成为 一名 医池 救护员， 你至 少得 高中 毕业， 并经 过相关谋 程的 专业接 训 ,， 拿到 职业资格证 书 ; 你还 需要有 健康的 身体， 动作 协调， 兵应 灵敏 ,心理素质稳定， 并具有分 析和 判断能 力 、 同情 心和 责任感 以及 良好的 沟通能 力。 医疗救护员 所在 的单位有 : 120 和急救中 心 (站 )，119、122 报警 中心， 社区 卫生服务中 心 、 乡镇 卫生院， 旅游 景",750,0.5039828708406303,medium-low,ocr,"出 的 新 细胞 僵 合 在 一 起 。\n3. 被 子 植 物 的 无 性 生殖 在 农业 生产 上 有 着 广泛 的 应 用 。 除了 教材 中 讲 到 的 ，\n你 还 能 举 出 一 些 实例 吗 ? 这 些 植物 是 否 也 能 进行 有 性 生殖 ?\n6 第 七 单元 生物 阐 中 生命 的 延续 和 发 展\n=== 第 3 页 ===\n人 与 生物 学 有 关 的 职业\n医疗 救护 员\n医疗 救护 员 是 运用 救护 知识 和 技能 ， 对 各 种 急性 病症 、 总 外 事\n故 、 创 伤 和 突 发 公共 卫生 事件 中 的 伤 病员 施行 现场 初步 紧急 救护 的 人\n员 。 他 们 从 事 的 主要 工作 包括 : (1) 对 常见 急性 病 莹 进行 现场 初步 处\n理 5(2) 对 伤员 进行 通气 、 止 血 、 包 扎 、 骨 折 国 定 等 初步 救治 3 43) 搬\n运 、 护 送 伤 病员 ;《〈《4) 现场 实施 心肺 复苏 ; (5) 在 现场 指导 群众 自救 、\n互 救 ;(6) 开展 群众 性 现场 救护 知识 壮 及 培训 。\n现场 救 势 妆 果 及 时 、 处 置 恪 当 ， 就 能 挽救 生命 、 减 轻 伤 残 w 但 是 :\n我 国 目前 专业 的 医疗 救护 员 还 比较 少 ， 与 实际 需求 有 较 大 差距 。2005 年 ，\n我 国 将 医疗 救护 员 确 立 为 一 个 职业 ， 并 进一步 规范 和 提高 医 闻 救 护 人 员\n的 职业 能 力 ， 这 对 于 有 效 保障 广大 人 民 群 众 的 生命 安全 有 着 重要 意义 。\n如 果 你 想 成 为 一 名 医 池 救护 员 ， 你 至 少 得 高 中 毕业 ， 并 经 过 相关\n谋 程 的 专业 接 训 ,， 拿 到 职业 资格 证 书 ; 你 还 需要 有 健康 的 身体 ， 动 作\n协调 ， 兵 应 灵敏 ,心理 素质 稳定 ， 并 具有 分 析 和 判断 能 力 、 同 情 心 和\n责任 感 以 及 良好 的 沟通 能 力 。 医疗 救护 员 所 在 的 单位 有 : 120 和 急救 中 心\n(站 )，119、122 报 警 中 心 ， 社 区 卫生 服务 中 心 、 乡 镇 卫生 院 ， 旅 游 景",2.0,72.425,人教版_八年级_义务教育教科书·生物学八年级下册,1,2025-07-21T14:24:46.041Z,2.0,义务教育教科书·生物学八年级下册,/Users/LeoQin/Documents/GitHub/PDFconvertor/training_data/初中/生物学/人教版-人民教育出版社/八年级/义务教育教科书·生物学八年级下册.pdf,八年级,tesseract.js-parallel,人教版,0.8451957295373665,0.5,1,72.425,,,,true,true,,biology,下册,人教版_八年级_义务教育教科书·生物学八年级下册.json,生物,120,初中_生物学_人教版_八年级_义务教育教科书·生物学八年级下册
人教版_八年级_义务教育教科书·生物学八年级下册_chunk_2,2,"职业资格证 书 ; 你还 需要有 健康的 身体， 动作 协调， 兵应 灵敏 ,心理素质稳定， 并具有分 析和 判断能 力 、 同情 心和 责任感 以及 良好的 沟通能 力。 医疗救护员 所在 的单位有 : 120 和急救中 心 (站 )，119、122 报警 中心， 社区 卫生服务中 心 、 乡镇 卫生院， 旅游 景点 、 游访 场 ( 馆 ) 等 s 医疗救护员 在总 化品 事故救 接演 练现场 el an 0 m J 入: Ni er 了 a use ee se 下让 和 Ts 四 1 天 Te 时局 区下 忆 a _ 过本 记一 立下 一平 77 中了 解自 己， 增进 健康健康是 人们 永远追求的 美好愿望， 是人 生永 恒的 话题。 只有 真正了 解自己的 健康状况， 才能 更好 地了 解自我， 增进 健康。 那么， 究竟 什么 是健康 ? 怎样了 解和 增进自己的 健康呢 ? 第一 节评价自己的 健康状况全 aa， 该一 说 rs 有人 说， 肌肉 发达 、 强健 有力 是健康 ; 也有 人说， 没伤 民， 没病 就是 健康。 你同意上 述说法 吗 ? 请说 说自己的 理由。 闪你 觉得自己健康吗 ? 有什么办 法可 以比较全 面 . 客上 什么是 健素 ? 观地 评价自己的 健康状况呢 y 可以 试一 斌下面这 种怎 社才能判断自己的 健评价方法。 康装 况 ?。 怎禅 才能保持愉快的 心给 你的 健康打分 E 这是 一个 小测试。 请你 根据自己的 实际情况， 在相应的 分数 上画 D， 基中 1 分表示完全不 符合 ""，2 分表示不 太符 合，3 分表示比较符 合 , 4 分表示完全符 台。 如果 有些 情况你 没有",729,0.30223333684210524,low,ocr,"职业 资格 证 书 ; 你 还 需要 有 健康 的 身体 ， 动 作\n协调 ， 兵 应 灵敏 ,心理 素质 稳定 ， 并 具有 分 析 和 判断 能 力 、 同 情 心 和\n责任 感 以 及 良好 的 沟通 能 力 。 医疗 救护 员 所 在 的 单位 有 : 120 和 急救 中 心\n(站 )，119、122 报 警 中 心 ， 社 区 卫生 服务 中 心 、 乡 镇 卫生 院 ， 旅 游 景\n点 、 游 访 场 ( 馆 ) 等 s\n医疗 救护 员 在 总 化 品 事故 救 接 演 练 现场\nel an 0 -m\nJ |\nLEN 入: <\nNi er\n了 a |\nAI \ | use ee\nES se 下 “让 和\nTs | 四 PEBS —1\n天 Te\n时 局 区 | 下 忆\n~a _ 过 本\n=== 第 4 页 ===\n记 一 - 立\n下 一 平\n77 中\n了 解 自 己 ， 增 进 健康\n健康 是 人 们 永远 追求 的 美好 愿望 ， 是 人 生 永 恒\n的 话题 。 只 有 真正 了 解 自己 的 健康 状况 ， 才 能 更 好\n地 了 解 自我 ， 增 进 健 康 。 那 么 ， 究 竟 什 么 是 健康 ?\n怎样 了 解 和 增进 自己 的 健康 呢 ?\n第 一 节 ”评价 自己 的 健康 状况\n全 aa， 该 一 说 | - rs\n有 人 说 ， 肌 肉 发 达 、 强 健 有 力 是 健康 ; 也 有 人 说 ， 没 伤 民 |\n， 没 病 就 是 健康 。 你 同意 上 述说 法 吗 ? 请 说 说 自己 的 理由 。 闪 |\n你 觉得 自己 健康 吗 ?” 有 什么 办 法 可 以 比较 全 面 . 客 上 什么 是 健 素 ?\n观 地 评价 自己 的 健康 状况 呢 y 可 以 试 一 斌 下面 这 种 * 怎 社 才能 判断 自己 的 健\n评价 方法 。 康 装 况 ?\n。 怎 禅 才能 保持 愉快 的 心\n给 你 的 健康 打分 E\n这 是 一 个 小 测试 。 请 你 根据 自己 的 实际 情况 ，\n在 相应 的 分 数 上 画 “D”， 基 中 1 分 表示 “完全 不\n符合 "" ，2 分 表示 “不 太 符 合 ”，3 分 表示 “比较 符\n合 ”, 4 分 表示 “完全 符 台 ”。 如 果 有 些 情况 你 没有",2.0,72.425,人教版_八年级_义务教育教科书·生物学八年级下册,2,2025-07-21T14:24:46.041Z,2.0,义务教育教科书·生物学八年级下册,/Users/LeoQin/Documents/GitHub/PDFconvertor/training_data/初中/生物学/人教版-人民教育出版社/八年级/义务教育教科书·生物学八年级下册.pdf,八年级,tesseract.js-parallel,人教版,0.8084291187739464,0.5,1,72.425,,true,,true,true,,unknown,下册,人教版_八年级_义务教育教科书·生物学八年级下册.json,生物,120,初中_生物学_人教版_八年级_义务教育教科书·生物学八年级下册
人教版_八年级_义务教育教科书·生物学八年级下册_chunk_3,3,"可以 用于 评价你 的健康状况。 打完 分后 , 与同学们 一起 分析 这些 题目， 看看 哪些是 评价 身体 健康的， 哪些 是评价心理健康的， 哪些 是评 价社会适应状态的。 为什么要 从这 几个 方面综合评 价一 个人 的健康呢 ? 长期 以来， 估们 认为健康就 是无 伤无 病， 一个 人生理上 没有疾病就 说明 这个 人是 健康的。 这种 传统 的关于健康的 观点忽略了 人的 心理状态以 及作为社会人 应有 的对 社会的 适应能 力， 因此 这种 观点 是不 完整的。 接照 世界卫生组 织对 健康的 定义， 健康 是指 一种 身体上 、 心理 上和 社会适应方面的 良好状态， 而不 仅仅是 没有疾病或 者不 虚弱。 健康 的生活不 仅需 人要 做到 合理营养， 加强体育锻炼， 搞好 个人 卫生， 人还 要正确地 认识自我， 保持 愉快 的心情和 积极向 上的 心态 ; 同时还 应当 学会 与人 相处， 维持 恨好 的人 际关 系 . 使个 人的 能力 在社会生活中 得到 充分的 发挥 ( 图 8 23 )。 图 8 23 健康的 三个 方面保持愉快的 心情心情偷 快是 儿童青少年心理健康的 核心。 良好 的情绪和 适度的 情绪反应， 表示 儿童 青少年的 身心处 于积极的 健康状态。 但是 ,在日 常生活 中， 每个 人都 会或 多或 少地 出现 一些 情绪 问题， 当你 遇到 挫折或 者不 顺心的 事情时， 生气 、 紧张 、 焦虑 、 抑郁 等损害健康的 情绪便 会随 之而 来。 当出 现这 些问题时， 我们 可以 试着 用以 下三 种方法来 调节自己的 情绪。 方法一 : 有意识地 转移话题， 或者 做点 别的 事",727,0.5573634508348794,medium-low,ocr,"可 以 用 于 评价 你 的 健康 状况 。 打 完\n分 后 , 与 同学 们 一 起 分 析 这 些 题目 ， 看 看 哪些 是 评\n价 身 体 健康 的 ， 哪 些 是 评价 心理 健康 的 ， 哪 些 是 评\n价 社会 适应 状态 的 。 为 什么 要 从 这 几 个 方面 综合 评\n价 一 个 人 的 健康 呢 ?\n长 期 以 来 ， 估 们 认为 健康 就 是 无 伤 无 病 ， 一 个\n人 生理 上 没有 疾病 就 说 明 这 个 人 是 健康 的 。 这 种 传\n统 的 关于 “健康 ”的 观点 忽略 了 人 的 心理 状态 以 及\n作为 社会 人 应 有 的 对 社会 的 适应 能 力 ， 因 此 这 种 观\n点 是 不 完整 的 。\n接 照 世界 卫生 组 织 对 健康 的 定义 ， 健 康 是 指 一\n种 身体 上 、 心 理 上 和 社会 适应 方面 的 良好 状态 ， 而\n不 仅仅 是 没有 疾病 或 者 不 虚弱 。 健 康 的 生活 不 仅 需 人\n要 做 到 合理 营养 ， 加强 体育 锻炼 ， 搞 好 个 人 卫生 ， 人\n还 要 正确 地 认识 自我 ， 保 持 愉 快 的 心情 和 积极 向 上\n的 心态 ; 同时 还 应 当 学 会 与 人 相处 ， 维 持 恨 好 的 人\n际 关 系 . 使 个 人 的 能 力 在 社会 生活 中 得 到 充分 的 发\n挥 ( 图 8-23 )。 图 8-23 健康 的 三 个 方面\n保持 愉快 的 心情\n心情 偷 快 是 儿童 青少年 心理 健康 的 核心 。 良\n好 的 情绪 和 适度 的 情绪 反应 ， 表 示 儿 童 青少年 的\n身心 处 于 积极 的 健康 状态 。 但 是 ,在 日 常生 活 中 ，\n每 个 人 都 会 或 多 或 少 地 出 现 一 些 情 绪 问 题 ， 当 你\n遇 到 挫折 或 者 不 顺心 的 事情 时 ， 生 气 、 紧 张 、 焦\n虑 、 抑 郁 等 损害 健康 的 情绪 便 会 随 之 而 来 。 当 出\n现 这 些 问题 时 ， 我 们 可 以 试 着 用 以 下 三 种 方法 来\n调节 自己 的 情绪 。\n方法 一 : 有 意识 地 转移 话题 ， 或 者 做 点 别 的 事",2.0,72.425,人教版_八年级_义务教育教科书·生物学八年级下册,5,2025-07-21T14:24:46.041Z,2.0,义务教育教科书·生物学八年级下册,/Users/LeoQin/Documents/GitHub/PDFconvertor/training_data/初中/生物学/人教版-人民教育出版社/八年级/义务教育教科书·生物学八年级下册.pdf,八年级,tesseract.js-parallel,人教版,0.9121495327102803,0.5,1,72.425,true,,,true,true,,chemistry,下册,人教版_八年级_义务教育教科书·生物学八年级下册.json,生物,120,初中_生物学_人教版_八年级_义务教育教科书·生物学八年级下册
人教版_八年级_义务教育教科书·生物学八年级下册_chunk_4,4,"找一 个适当的 理由来 安慰自己 (图 8 26)， 这。 二胡岂 此可 以起 盈直 忆样 可以 帮助你 在挫折面前接受现实， 保持 较为乐观。 保持崎 核心铺 的记 法 5 的心态。 这次 没发 挥好， 平次 一定 意你 们 ! 2 人 hag 3 区六 Se Y 有二 图 8 26 自我安 感试 一试 这些 方法， 祝你 天天 拥有好 心情 ! eg oe 1. 当你 受到撞 折时， 采取 的不 恰当措施是 : ( ) A. 向朋友征求意见 ; 了 .向家 长诉说， 寻求 帮助 ; C .向老师讲述， 得到 帮助 ; DABRRE. 2. 当与 同学发 生了 矛盾时， 你如 何解决 ? 当遇 到挫折时， 你如 何调节自己的 心情 ? 3. 与同学们 交流保持心情丛 决的 方法， 相互 学习 和借鉴。 第三 章了 解自 己 , 增进伍 康，101 D) 与生物学 有关 的职业 . 心理咨询师 在日 常生活 中， 有的 人经 常感到心情不 好或 情绪低落 ; 有的 人在 考试 前非常革 张， 几天 唾不 好觉， 根本 没有精力复习动 课 ; 还有 的人 总是 担心自己患 有某 种疾病， 还查阅各 种医学书籍， 认为 书上 所说 某种 疾病的 连状 与自己十 分符合， 因而宫 食难 安这 些问 题属于心理健康问 题， 需要 心理咨询师 帮助 解决。 司理 咨询师 的主要工作是 帮助人 们解决心理健康问题， 治疗 心理 疾病， 促进人 们的 鼻心 健康。 必理 咨询 师往往通过与 咨询者 交谈 ,运用各 种量 表 、 仪器 和测试手段， 发现 咨询 者表面现象之 后的 心理问题， 然后 提出治疗措施。 心理 咨询 师除了要 懂得心理学 和医学的 知识， 掌担 各种",742,0.36855748355263157,low,ocr,"找 一 个 适当 的 理由 来 安慰 自己 (图 8-26)， 这。 二胡 岂 此 可 以 起 盈 直 忆\n样 可 以 帮助 你 在 挫折 面前 接受 现实 ， 保 持 较为 乐观 。 保持 崎 核心 铺 的 记 法 5\n的 心态 。\n这 次 没 发 挥 好 ，\n平 次 一 定 意 你 们 !\n2 人\n“hag ¢\nAOL\n3 区 六 /Se\nSN Y\n有 \\n二 <\n图 8-26 自我 安 感\n试 一 试 这 些 方法 ， 祝 你 天 天 拥有 好 心情 !\n— eg@oe--\n1. 当 你 受到 撞 折 时 ， 采 取 的 不 恰当 措施 是 : (  )\nA. 向 朋友 征求 意见 ; 了 .向 家 长 诉说 ， 寻 求 帮助 ;\nC .向 老师 讲述 ， 得 到 帮助 ;  DABRRE.\n2. 当 与 同学 发 生 了 矛盾 时 ， 你 如 何 解决 ? 当 遇 到 挫折 时 ， 你 如 何 调节 自己 的 心情 ?\n3. 与 同学 们 交流 保持 心情 丛 决 的 方法 ， 相 互 学 习 和 借鉴。\n第 三 章 了 解 自 己 , 增进 伍 康 ，101\n=== 第 9 页 ===\nD) 与 生物 学 有 关 的 职业 .\n心理 咨询 师\n在 日 常生 活 中 ， 有 的 人 经 常 感到 心情 不 好 或 情绪 低落 ; 有 的 人 在 考\n试 前 非常 革 张 ， 几 天 唾 不 好 觉 ， 根 本 没有 精力 复习 动 课 ; 还 有 的 人 总 是\n担心 自己 患 有 某 种 疾病 ， 还 查阅 各 种 医学 书籍 ， 认 为 书 上 所 说 某 种 疾病\n的 连 状 与 自己 十 分 符合， 因而 宫 食 难 安 …… 这 些 问 题 属于 心理 健康 问\n题 ， 需 要 心理 咨询 师 帮 助 解决 。\n司 理 咨询 师 的 主要 工作 是 帮助 人 们 解决 心理 健康 问题 ， 治 疗 心 理 疾\n病 ， 促进 人 们 的 鼻 心 健康 。 必 理 咨 询 师 往往 通过 与 咨询 者 交谈 ,运用 各\n种 量 表 、 仪 器 和 测试 手段 ， 发 现 咨 询 者 表面 现象 之 后 的 心理 问题 ， 然 后\n提出 治疗 措施 。 心 理 咨 询 师 除了 要 懂得 心理 学 和 医学 的 知识 ， 掌 担 各 种",2.0,72.425,人教版_八年级_义务教育教科书·生物学八年级下册,7,2025-07-21T14:24:46.041Z,2.0,义务教育教科书·生物学八年级下册,/Users/LeoQin/Documents/GitHub/PDFconvertor/training_data/初中/生物学/人教版-人民教育出版社/八年级/义务教育教科书·生物学八年级下册.pdf,八年级,tesseract.js-parallel,人教版,0.8342541436464088,0.5,1,72.425,,true,,true,true,,biology,下册,人教版_八年级_义务教育教科书·生物学八年级下册.json,生物,120,初中_生物学_人教版_八年级_义务教育教科书·生物学八年级下册
