Chunk_ID,Chunk_Index,Content,Content_Length,Quality_Score,Reliability,Source_Type,Original_Content,Enhancement_Version,averageConfidence,book_name,chunkIndex,enhancementTimestamp,enhancementVersion,fileName,filePath,grade,ocrMethod,publisher,qualityMetrics_chineseCharRatio,qualityMetrics_coherenceScore,qualityMetrics_lengthScore,qualityMetrics_ocrConfidence,semanticFeatures_hasDefinition,semanticFeatures_hasExperiment,semanticFeatures_hasFormulas,semanticFeatures_hasNumbers,semanticFeatures_hasQuestion,semanticFeatures_isTableContent,semanticFeatures_subjectArea,semester,source_file,subject,totalPages,uniqueId
人教版_八年级_义务教育教科书·生物学八年级下册_chunk_60,60,"的化 石中， 呈有 1 个有 胚胎， 这表 明这 批丽 龙蛋 的受精率 比较 低。 生化石 证据 显示 , 在绝 灭之 前一 段时 期的 丽龙， 肯洛 出现 变形， 蛋壳 变得 很薄， 因此 卵中 的胚胎容易受到威胁。 支持假说 A 和支持假说了 的证 据分 别有 哪些 你对 各证 据对 假说支 持的 广度是 怎样评价的 ? 你更 倾询 于支持哪 种假说 ? go 1. 淹断 下列 说法 是和 否正 确。 正确的 画， 错误 的画 X 5 (1) 化石 是研究生物进化的 唯一证 据。 ( ) (2) 在地 质年 代较 晚近的 地层 中不 可能 找到低 等生物的 化五 ( ) 2. 下列 关于生物进化总 趋势的 叙述， 不合理的 是 :( ) AA. 众单 细胞生物到 多细胞生物 ; B. 从体型小 的生物到 体型大 的生物 ; C. 从结构简单的 生物到 结构复杂的 生物 ; D,. 从低 等生物到 高等 生物 3. 鸡生 蛋， 蛋生 鸡。 先有 鸡还 是先 有蛋， 似乎 很难 回答。 你能 综合运用道 传 、 变异和 齐化 的知识作出合理的 解释吗 ? 4. 在现存的 生物中， 有许多非常简单 、 低等 的生物并 没有在 进化过 程中 绝灭， 而且 分布 还非常广泛， 为什么 ? 5. 如果 有条 件的 话 ; 请参观有 关生 物进 化的 展览， 并和 将自己的 参观感受， 以追寻生命的 足迹为 题， 为班级墙报写 一篇 小论文。 第三 章生命起 源和 生物进化 61 第三 节生物进化的 原因例。。 oreommmsemssssss Le 在某 个经 常副 大风 的海岛上， 有许多无 超和 残址 的昆虫 ( 右图 )。 请分 析， 在这 个海岛",735,0.4106331152826854,medium-low,ocr,"的 化 石 中 ， 呈 有 1 个 有 胚胎 ， 这 表\n明 这 批 丽 龙 蛋 的 受精 率 比 较 低 。\n生化 石 证 据 显 示 , 在 绝 灭 之 前 一 段 时 期 的 丽 龙 ， 肯 洛 出 现 变形 ， 蛋 壳\n变 得 很 薄 ， 因 此 卵 中 的 胚胎 容易 受到 威胁 。\n支持 假说 A 和 支持 假说 了 的 证 据 分 别 有 哪 些 ” 你 对 各 证 据 对 假说 支\n持 的 广度 是 怎样 评价 的 ? 你 更 倾 询 于 支持 哪 种 假说 ?\n--- go\n1. 淹 断 下 列 说 法 是 和 否 正 确 。 正确 的 画 “”， 错 误 的 画 “X ”5\n(1) 化 石 是 研究 生物 进化 的 唯一 证 据 。 ( )\n(2) 在 地 质 年 代 较 晚近 的 地 层 中 不 可 能 找到 低 等 生物 的 化 五- ( )\n2. 下 列 关于 生物 进化 总 趋势 的 叙述 ， 不 合理 的 是 :(  )\nAA. 众 单 细胞 生物 到 多 细胞 生物 ;\nB. 从 体型 小 的 生物 到 体型 大 的 生物 ;\nC. 从 结构 简单 的 生物 到 结构 复杂 的 生物 ;\nD,. 从 低 等 生物 到 高 等 生物 -\n3. 鸡 生 蛋 ， 蛋 生 鸡 。 先 有 鸡 还 是 先 有 蛋 ， 似 乎 很 难 回答 。 你 能 综合 运用 道 传 、\n变异 和 齐 化 的 知识 作出 合理 的 解释 吗 ?\n4. 在 现存 的 生物 中 ， 有 许多 非常 简单 、 低 等 的 生物 并 没有 在 进化 过 程 中 绝 灭 ，\n而 且 分 布 还 非常 广泛 ， 为 什么 ?\n5. 如 果 有 条 件 的 话 ; 请 参观 有 关 生 物 进 化 的 展览 ， 并 和 将 自己 的 参观 感受 ， 以\n“追寻 生命 的 足迹 ”为 题 ， 为 班级 墙报 写 一 篇 小 论文 。\n第 三 章 - 生命 起 源 和 生物 进化 61\n=== 第 84 页 ===\n第 三 节 ”生物 进化 的 原因\n例 。-。 BB oreommmsemssssss Le\n| 在 某 个 经 常 副 大 风 的 海岛 上 ， 有 许多 无 超 |\n| 和 残 址 的 昆虫 ( 右 图 )。 请 分 析 ， 在 这 个 海岛",2.0,72.425,人教版_八年级_义务教育教科书·生物学八年级下册,86,2025-07-21T14:24:46.043Z,2.0,义务教育教科书·生物学八年级下册,/Users/LeoQin/Documents/GitHub/PDFconvertor/training_data/初中/生物学/人教版-人民教育出版社/八年级/义务教育教科书·生物学八年级下册.pdf,八年级,tesseract.js-parallel,人教版,0.8152985074626866,0.5,1,72.425,,,,true,true,,biology,下册,人教版_八年级_义务教育教科书·生物学八年级下册.json,生物,120,初中_生物学_人教版_八年级_义务教育教科书·生物学八年级下册
人教版_八年级_义务教育教科书·生物学八年级下册_chunk_61,61,"a S 秋冬过 渡阶 段的 雷乌 冬天的 雷包 图中 置急 的体 色与 周围环境的 色彩非常相似， 大们 把这 种体 色称 为保护色。 许多 动物都 具有人 保护色， 您可 以举 出一 些例子吗 ? 具有保护色 的动物不 易被 其他 动物所 发现 ,这对 它躲 避敌 害或 者捕食猎物是 十分 有利 的。 那么， 动物 的这 种保护色 是怎样形成的 呢 ? 第三 章生命起 源和 生物进化 63 作出假设你 的假设是 : 制订计划你 可以 参考下 面的 方案制订适合自己的 探究计划。 各准备一 块面积为 0.8 米 0.8 米的 彩色纸 〈 或布 ) 和 100 张各 种凑 色的 小纸 片 【小纸 片的 颜色代表某 种动物不 同体色 的变异类 型 )。 自以 小组 为单位，5 一 6 个同学为 一组， 推举 一人 为组 长。 向组 长在 桌子上 展开彩 纸， 作为 生物的 生活环境， 并检查小 纸片， 记下 纸片 的颜色和 数量。 本组 长是 监督人， 其他 同学都 是捕食者， 他们 的猎物是 小纸 片， 组长 时刻 注意捕 食者 取出的 猎物数 和翻 下的 猎物数。 四捕食者 事先背 对桌子， 组长 将小 纸片 均匀 地撒 在彩 纸上， 不要 使小 纸片 粘在 一起。 矶小 纸片 是捕食者 的猎物， 彩纸 的背景是 捕食者 的生活环 境。 捕食 者每 转向桌子一 次， 快速 选一 张小 纸片 《只用 眼睛判定它 的位 置 )， 把它 拿出 来放 在为 一只 手中， 伏后 继续转身选取， 直到 大彩 纸土 只剩 下 25 张小 纸片， 组长 通知不 再竹 择时 为止。8。 注意 : 捕",702,0.49962525274223035,medium-low,ocr,"“ a  S |\n秋冬 过 渡 阶 段 的 雷 乌 冬天 的 雷 包\n图 中 置 急 的 体 色 与 周围 环境 的 色彩 非常 相似 ， 大 们 把 这 种 体 色 称 为\n保护 色 。 许 多 动物 都 具有 人 保护色， 您 可 以 举 出 一 些 例子 吗 ? 具有 保护 色\n的 动物 不 易 被 其 他 动物 所 发 现 ,这 对 它 躲 避 敌 害 或 者 捕食 猎物 是 十 分 有\n利 的 。 那 么 ， 动 物 的 这 种 保护 色 是 怎样 形成 的 呢 ?\n第 三 章 - 生命 起 源 和 生物 进化 63\n=== 第 86 页 ===\n作出 假设\n你 的 假设 是 : °\n制订 计划\n你 可 以 参考 下 面 的 方案 制订 适合 自己 的 探究 计划 。\n各 准备 一 块 面积 为 0.8 米 0.8 米 的 彩色 纸 〈 或 布 ) 和 100 张 各 种 凑 色\n的 小 纸 片 【小 纸 片 的 颜色 代表 某 种 动物 不 同体 色 的 变异 类 型 )。\n自 以 小 组 为 单位 ，5 一 6 个 同学 为 一 组 ， 推 举 一 人 为 组 长 。\n向 组 长 在 桌子 上 展开 彩 纸 ， 作 为 生物 的 “生活 环境 ”， 并 检查 小 纸 片 ，\n记 下 纸 片 的 颜色 和 数量 。\n本 组 长 是 监督 人 ， 其 他 同学 都 是 “捕食 者 ”， 他 们 的 “猎物 ”是 小 纸 片 ，\n组 长 时 刻 注意 “ 捕 食 者 ”取出 的 “猎物 ” 数 和 翻 下 的 “猎物 ” 数 。\n四 “捕食 者 ”事先 背 对 桌子 ， 组 长 将 小 纸 片 均 匀 地 撒 在 彩 纸 上 ， 不 要 使\n小 纸 片 粘 在 一 起 。\n矶 小 纸 片 是 “捕食 者 ”的 “猎物 ”， 彩 纸 的 背景 是 “捕食 者 ”的 生活 环\n境 。“ 捕 食 者 ”每 转向 桌子 一 次 ， 快 速 选 一 张 小 纸 片 《只 用 眼睛 判定\n它 的 位 置 )， 把 它 拿 出 来 放 在 为 一 只 手中 ， 伏 后 继续 转身 选取 ， 直 到\n大 彩 纸 土 只 剩 下 25 张 小 纸 片 ， 组 长 通知 不 再 竹 择 时 为 止 。8。 注意 :“ 捕",2.0,72.425,人教版_八年级_义务教育教科书·生物学八年级下册,89,2025-07-21T14:24:46.043Z,2.0,义务教育教科书·生物学八年级下册,/Users/LeoQin/Documents/GitHub/PDFconvertor/training_data/初中/生物学/人教版-人民教育出版社/八年级/义务教育教科书·生物学八年级下册.pdf,八年级,tesseract.js-parallel,人教版,0.884313725490196,0.5,1,72.425,,,,true,true,,biology,下册,人教版_八年级_义务教育教科书·生物学八年级下册.json,生物,120,初中_生物学_人教版_八年级_义务教育教科书·生物学八年级下册
人教版_八年级_义务教育教科书·生物学八年级下册_chunk_62,62,"猎物， 彩纸 的背景是 捕食者 的生活环 境。 捕食 者每 转向桌子一 次， 快速 选一 张小 纸片 《只用 眼睛判定它 的位 置 )， 把它 拿出 来放 在为 一只 手中， 伏后 继续转身选取， 直到 大彩 纸土 只剩 下 25 张小 纸片， 组长 通知不 再竹 择时 为止。8。 注意 : 捕食 者不 要特意寻找某 种颜色的 小纸 片。 感统计幸存者 中各 种颜色的 小纸 片的 数目。 息假 设每 个幸存者 都产生 3 个后 代， 而且 体色 与自己的 相同。 在每 个幸存者 下面 放上 3 个从 老师那儿拿 来的 备用小 纸片。 加将 幸存者 和它们的 后代 充分 混合， 重复 上面 的第 4 一 8 步， 重复 至少 4 次。 每轮 开始 记录各 种颜色的 小纸 片的 数目。 同学活动情景 ve 这 1 1 I iAN , : Eee、 在一 2 实施计划接 上面 的步 又实施计划并 将数据统计在 下表 中 : 人 h 4 A 8 46 E A4 EE 颜色数目数目数目数目数目数目数目数目数目数目 el ll ll El 得出 结论你 得出 的结论是 :。 讨论 各在 第一 代和 第五 代中， 分别 是哪 种颜色的 幸存者 最多 ? 这与 彩纸 的颜色有 什么关系 ? 加第 一代 和第 三代 之间 幸存 者的 数目有 什么变化 ? 第一 代和 第五 代之 闻又 有什么变化四 比较 第一 代和 第五 代的 幸存者 ""， 是否 所有 颜色都 有幸存着 ""? 为什么 ? 加授 过上 面的 模拟实验， 你能 推测保护色 的形成过 程吗 从中 你能 和",685,0.33660773001776195,low,ocr,"“猎物 ”， 彩 纸 的 背景 是 “捕食 者 ”的 生活 环\n境 。“ 捕 食 者 ”每 转向 桌子 一 次 ， 快 速 选 一 张 小 纸 片 《只 用 眼睛 判定\n它 的 位 置 )， 把 它 拿 出 来 放 在 为 一 只 手中 ， 伏 后 继续 转身 选取 ， 直 到\n大 彩 纸 土 只 剩 下 25 张 小 纸 片 ， 组 长 通知 不 再 竹 择 时 为 止 。8。 注意 :“ 捕\n食 者 ”不 要 特意 寻找 某 种 颜色 的 小 纸 片 。\n感 统计 “幸存 者 ”中 各 种 颜色 的 小 纸 片 的 数目 。\n息 假 设 每 个 “幸存 者 ”都 产生 3 个 后 代 ， 而 且 体 色 与 自己 的 相同 。 在 每\n个 “幸存 者 ”下 面 放 上 3 个 从 老师 那儿 拿 来 的 备用 小 纸 片 。\n加 将 “幸存 者 ”和 它们 的 后 代 充 分 混合 ， 重 复 上 面 的 第 4 一 8 步 ， 重 复\n至 少 4 次 。 每 轮 开 始 记录 各 种 颜色 的 小 纸 片 的 数目 。\n* 同学 活动 情景\nve 这\n1 1\n| AWE I\niAN »  ,\n: Eee、\n在 一 2 -\n=== 第 87 页 ===\n实施 计划\n接 上 面 的 步 又 实施 计划 并 将 数据 统计 在 下 表 中 :\n人 | &h |&% |£4| EF |A% |8%|46 |E% |A4[EE\n颜色 | 数目 | 数目 | 数目 | 数目 | 数目 | 数目 | 数目 | 数目 | 数目 | 数目\n[|\n[el\n[ll ll\nEl\n得 出 结论\n你 得 出 的 结论 是 : 。\n讨 论\n各 在 第 一 代 和 第 五 代 中 ， 分 别 是 哪 种 颜色 的 “幸存 者 ”最 多 ? 这 与 彩\n纸 的 颜色 有 什么 关系 ?\n加 第 一 代 和 第 三 代 之 间 “ 幸 存 者 ”的 数目 有 什么 变化 ? 第 一 代 和 第 五 代 之\n闻 又 有 什么 变化\n四 比 较 第 一 代 和 第 五 代 的 “幸存 者 "" ， 是 否 所 有 颜色 都 有 “幸存 着 ""?\n为 什么 ?\n加 授 过 上 面 的 模拟 实验 ， 你 能 推测 保护 色 的 形成 过 程 吗 ” 从 中 你 能 和",2.0,72.425,人教版_八年级_义务教育教科书·生物学八年级下册,90,2025-07-21T14:24:46.043Z,2.0,义务教育教科书·生物学八年级下册,/Users/LeoQin/Documents/GitHub/PDFconvertor/training_data/初中/生物学/人教版-人民教育出版社/八年级/义务教育教科书·生物学八年级下册.pdf,八年级,tesseract.js-parallel,人教版,0.8448979591836735,0.5,1,72.425,,true,,true,true,,mathematics,下册,人教版_八年级_义务教育教科书·生物学八年级下册.json,生物,120,初中_生物学_人教版_八年级_义务教育教科书·生物学八年级下册
人教版_八年级_义务教育教科书·生物学八年级下册_chunk_63,63,"有什么关系 ? 加第 一代 和第 三代 之间 幸存 者的 数目有 什么变化 ? 第一 代和 第五 代之 闻又 有什么变化四 比较 第一 代和 第五 代的 幸存者 ""， 是否 所有 颜色都 有幸存着 ""? 为什么 ? 加授 过上 面的 模拟实验， 你能 推测保护色 的形成过 程吗 从中 你能 和单 分析 生物 进化的 原因吗 ? 自然选择关于生物进化的 原因， 人们 进行了 长期 的控 (E) ,sn es 索， 提出 了各 种解释， 其中 被人 们普遍接受的 是达。 达水 文曾 以象 为尔 文的 自然选择 (natural selection ) 学说。 例来 研究生物的 繁殖达尔文 认为， 在自然界， 生物普遍具有很 强的 全国人 人人 和繁殖能 力， 能够 产生大 量的 后代， 而生物赖 以生存， saook. mak 的食物和 空间都 是非常有 限的。 任何 生物要 生存下 能进行繁殖的 话 , 那去， 就得 为获取足够的 食物和 空间而 进行生存半 和勾 到 750 年以 后， 一争。 例如， 在同一片 森林 里临近的 树木会 相互争夺 Ye 阳光 、 水分 和养料， 食性 相同的 动物会 相互争夺食 第三 章生命起 源和 生物进化 65 本攻 区和 了 1 f 4 EHm 区站 Ps 二人 三本 人 _ 于站 VAl EShE 柱头花柱 a 花丝 G 小资料二 ; 和用。 但急 少开花 , 有疼 7 1 花的 结构与 有性 生将 图解 的谷 几十 年甚至上 百年 才开 一次 花。 科学 桃树 在开花以 后会 结出 果实和 种子。 向日 葛 、 家队 为， 人也 会站，，",701,0.3210940607923497,low,ocr,"有 什么 关系 ?\n加 第 一 代 和 第 三 代 之 间 “ 幸 存 者 ”的 数目 有 什么 变化 ? 第 一 代 和 第 五 代 之\n闻 又 有 什么 变化\n四 比 较 第 一 代 和 第 五 代 的 “幸存 者 "" ， 是 否 所 有 颜色 都 有 “幸存 着 ""?\n为 什么 ?\n加 授 过 上 面 的 模拟 实验 ， 你 能 推测 保护 色 的 形成 过 程 吗 ” 从 中 你 能 和\n单 分 析 生 物 进化 的 原因 吗 ?\n自然 选择\n关于 生物 进化 的 原因 ， 人 们 进行 了 长 期 的 控 (E) ,sn es\n索 ， 提 出 了 各 种 解释 ， 其 中 被 人 们 普遍 接受 的 是 达 。 达 水 文 曾 以 象 为 |\n尔 文 的 自然 选择 (natural selection ) 学 说 。 | 例 来 研究 生物 的 繁殖\n达尔 文 认为 ， 在 自然界， 生物 普遍 具有 很 强 的 全国 人 人 人 和\n繁殖 能 力 ， 能 够 产生 大 量 的 后 代 ， 而 生物 赖 以 生存 |， saook. mak |\n的 食物 和 空间 都 是 非常 有 限 的 。 任 何 生物 要 生存 下 能 进行 繁殖 的 话 , 那\n去 ， 就 得 为 获取 足够 的 食物 和 空间 而 进行 生存 半 和 勾 到 750 年 以 后 ， 一\n争 。 例 如 ， 在 同一 片 森 林 里 临近 的 树木 会 相互 争夺 Ye\n阳光 、 水 分 和 养料 ， 食 性 相同 的 动物 会 相互 争夺 食\n第 三 章 - 生命 起 源 和 生物 进化 65\n=== 第 88 页 ===\n本 攻\nAY 区 | 和 了 |\n1/ f 4 +\n- EHm\n区 站 Ps 二 EEE\n人 三 本\n{ 人 | _— 于 站\nVAl EShE\n| 柱头 | 花柱 a 花丝\n* ©G 小 资料\n二\n; 和 用。 但 急 少 开花 , 有\n疼 7-1 花 的 结构 与 有 性 生 将 图 解 的 谷 几 十 年 甚至 上 百\n年 才 开 一 次 花 。 科 学\n桃 树 在 开花 以 后 会 结 出 果实 和 种 子 。 向 日 葛 、 家 队 为 ， 人 也 会 站 ， ，",2.0,72.425,人教版_八年级_义务教育教科书·生物学八年级下册,91,2025-07-21T14:24:46.043Z,2.0,义务教育教科书·生物学八年级下册,/Users/LeoQin/Documents/GitHub/PDFconvertor/training_data/初中/生物学/人教版-人民教育出版社/八年级/义务教育教科书·生物学八年级下册.pdf,八年级,tesseract.js-parallel,人教版,0.8082191780821918,0.5,1,72.425,,true,,true,true,,biology,下册,人教版_八年级_义务教育教科书·生物学八年级下册.json,生物,120,初中_生物学_人教版_八年级_义务教育教科书·生物学八年级下册
人教版_八年级_义务教育教科书·生物学八年级下册_chunk_64,64,"生存 下来， 并将 这些 变异遗传给 下一 代， 而 wERAT, Ts 在进化论 研究的 历史上， 长颈 廊的 长颈 的形成原因曾经是 人们 争论的 焦点。 按照 达尔 文的 自然先 择学 说是 这样 解释的 (图 7 29 ): 四二 用 1 1 各 i ) i) 图 7 29 CHHENEAE E1H E r 十代 的长 颈鹿， 有颈 长一 些的 和颈 短一 些的， ptmamamny 颈的 长短 是可 以遗传的。 在环境条 件发 生变化， 如。 生物进 化的 原因， 状 】， 缺乏 青草 的时 候， 颈长 的可 以吃 到高 处的 树叶， 就。 而， 限于 当时的 利学 容易生存下 来， 并且 繁殖 后代。 颈得 的吃 不到 足够， 雪质 水下， 对了 半生的 树叶， 活下 来的 可能 性就 很小， 留下 来的 后代 也变 9 原问 王玫 直 ,大天， 和和 "" n 二未 丈并 不生计， 更少。 经过 许多代 以后， 颈短 的就 被淘汰， 颈长 的。 行科学的 解厦 后，， 特征越 来越 显著。 因此， 我们 现在看 到的 长开 庆都。 来， 随着 生物科学研 是颈 长的。 deiaas. bi 像这 样， 自然 界中 的生物， 通过 激烈的 生存斗 是争， 适应 者生存， 不适应者 被淘汰， 这就 是自然选 择。 生物 通过遗传 、 变异 和自然选择， 不断 进化。 66 第七 单元生物圈中 生命的 延续和 发展 一和 攻一 一 1. 判断下 列说 法是 否正 确。 正确 的画， 错误 的画 X。 (1) 自然选择保留的 变异永远都 有利于该 生物的 生存。 ( ) (2) 有些 动物如 薪毒 硅， 它们 在绿色的 森林中 格外约 丽夺目， 很容易被 其",743,0.3255663982300885,low,ocr,"生 存 下 来 ， 并 将 这 些 变异 遗传 给 下 一 代 ， 而\nLETR wERAT, Ts\n在 进化 论 研究 的 历史 上 ， 长 颈 廊 的 长 颈 的 形成\n原因 曾经 是 人 们 争论 的 焦点 。 按 照 达 尔 文 的 自然 先\n择 学 说 是 这 样 解释 的 (图 7-29 ):\nLN 四 二 用 1 1 各 » i ) i)\n图 7=29 [CHHENEAE  E1H\nE&r — 十 代 的 长 颈 鹿 ， 有 颈 长 一 些 的 和 颈 短 一 些 的 ，\nptmamamny | 颈 的 长 短 是 可 以 遗传 的 。 在 环境 条 件 发 生变 化 ， 如\n。 生物 进 化 的 原因 ， 状 】， 缺 乏 青 草 的 时 候 ， 颈 长 的 可 以 吃 到 高 处 的 树叶 ， 就\n。 而 ， 限 于 当时 的 利 学 ”容易 生存 下 来 ， 并 且 繁 殖 后 代 。 颈 得 的 吃 不 到 足够\n， 雪 质 水 下 ， 对 了 半生 的 树叶 ， 活 下 来 的 可 能 性 就 很 小 ， 留 下 来 的 后 代 也\n变 9 原 问 王 玫 直 ,大 天， 和 和 ""\nn 二 未 丈 并 不 生计 ， 更 少 。 经 过 许多 代 以 后 ， 颈 短 的 就 被 淘汰 ， 颈 长 的\n。 行 科学 的 解 厦 后 ，， 特征 越 来 越 显著 。 因 此 ， 我 们 现在 看 到 的 长 开 庆 都\n。 来 ， 随 着 生物 科学 研 是 颈 长 的 。\n| deiaas. bi 像 这 样 ， 自 然 界 中 的 生物 ， 通 过 激烈 的 生存 斗\n是 争 ， 适 应 者 生存 ， 不 适应 者 被 淘汰 ， 这 就 是 自然 选\n择 。 生 物 通过 遗传 、 变 异 和 自然 选择 ， 不 断 进化 。\n66 ”第 七 单元 生物圈 中 生命 的 延续 和 发 展\n=== 第 90 页 ===\n一 和 攻 一 一\n1. 判断 下 列 说 法 是 否 正 确 。 正 确 的 画 “\”， 错 误 的 画 “X ”。\n(1) 自然 选择 保留 的 变异 永远 都 有 利于 该 生物 的 生存 。 ( )\n(2) 有 些 动物 如 薪 毒 硅 ， 它 们 在 绿色 的 森林 中 格外 约 丽 夺目 ， 很 容易 被 其",2.0,72.425,人教版_八年级_义务教育教科书·生物学八年级下册,93,2025-07-21T14:24:46.043Z,2.0,义务教育教科书·生物学八年级下册,/Users/LeoQin/Documents/GitHub/PDFconvertor/training_data/初中/生物学/人教版-人民教育出版社/八年级/义务教育教科书·生物学八年级下册.pdf,八年级,tesseract.js-parallel,人教版,0.7734082397003745,0.5,1,72.425,,,,true,,,biology,下册,人教版_八年级_义务教育教科书·生物学八年级下册.json,生物,120,初中_生物学_人教版_八年级_义务教育教科书·生物学八年级下册
