Chunk_ID,Chunk_Index,Content,Content_Length,Quality_Score,Reliability,Source_Type,Original_Content,Enhancement_Version,averageConfidence,book_name,chunkIndex,enhancementTimestamp,enhancementVersion,fileName,filePath,grade,ocrMethod,publisher,qualityMetrics_chineseCharRatio,qualityMetrics_coherenceScore,qualityMetrics_lengthScore,qualityMetrics_ocrConfidence,semanticFeatures_hasDefinition,semanticFeatures_hasExperiment,semanticFeatures_hasFormulas,semanticFeatures_hasNumbers,semanticFeatures_hasQuestion,semanticFeatures_isTableContent,semanticFeatures_subjectArea,semester,source_file,subject,totalPages,uniqueId
冀教版_七年级_义务教育教科书·体育与健康七年级全一册_chunk_0,0,本全 责编加 下类 由 ane， 2012 义务教育教科书 装央 设计， 巷对 动漫 5 人月 司 5 I 了七 年级 2 f 了 4 6 Re 2 PheRBRLAE: 12315 人一 1 洒表 和第 二章 发展心 肺耐力第 一节 心肺耐力在 进行长 距离的 行走 、 骑自行 A 车 、 跑步 、 游泳 等运动时， 会出 现人 W 心跳加 快和 呼吸加 快的 现象。 Ng 用同样的 速度跑 一段 较长 的距离， 如 1000 米， 有的 人表情自如， 而有 的人 则表情痛苦 、 学上 和气 不接 下气， 还有 个别人可 能跑 不下 来。 1. 为什么用 同样的 速度跑 同样的 距离， 不同 的人 会有 不同 的表现 ? 2. 是哪 种体能的 差异导致了 这些 不同 的表现 ? 一 1. 上述 活动均 属于中 等或 较剧 烈的 体力活动， 进行 这类 活动时， 身体 需要 大量 的氧气。 2. 呼吸加 快是 为了 从空气中 摄取大 量的 氧气， 而心跳加 快是 为了 更多 、 更快 地向 人体 各系统 、 各器 官输送氧气。 因此， 心胜 和肺脏功能好 的人 能够 较轻松地 完成这 类活动。 3. 心脏与 肺脏协同加 快工作， 持续 一定时间 地从 空气中 获得氧气并 加以 输送的 能力， 就是 我们 经常 说的 心肺耐力 ( cardiorespiratory endurance )。 它是 极为重要的 生命和 健康体征， 也是 衡量心脏和 肺脏机 能的 重要指标。 第二 节发展心 肺耐力原 则在 发展 心肺 耐力 中的 应用 频率 : 一周 内应 有 3 5 天进行心肺耐力的 锻炼。,706,0.32566821869658374,low,ocr,=== 第 1 页 ===\n本 全\n责编 加 - 下 类 由 ane\n~ ，\2012/ 义务 教育 教科 书\n装 央 设计 ， 巷 对 动漫 5\n人 月 司\n5\n[\n|]\nI} 了 LA\n七 年 级 2-f\n了 4\n6 Re\n2 PheRBRLAE: 12315 人 一 1\n洒 表 和\n=== 第 2 页 ===\n第 二 章 “发展 心 肺 耐力\n第 一 节 心肺 耐力\n在 进行 长 距离 的 行走 、 骑 自行 = [ A\n车 、 跑 步 、 游 泳 等 运动 时 ， 会 出 现 人 | W\n心跳 加 快 和 呼吸 加 快 的 现象 。\nNg 用 同样 的 速度 跑 一 段 较 长 的 距离 ， 如 1000\nSA 米 ， 有 的 人 表情 自如 ， 而 有 的 人 则 表情 痛苦 、\n学 “上 和 气 不 接 下 气 ”， 还 有 个 别人 可 能 跑 不 下 来 。\n1. 为 什么 用 同样 的 速度 跑 同样 的 距离 ， 不 同 的\n人 会 有 不 同 的 表现 ?\n2. 是 哪 种 体能 的 差异 导致 了 这 些 不 同 的 表现 ?\n一\n1. 上 述 活动 均 属于 中 等 或 较 剧 烈 的 体力 活动 ， 进 行 这 类 活动 时 ， 身 体 需 要 大\n量 的 氧气 。\n2. 呼吸 加 快 是 为 了 从 空气 中 摄取 大 量 的 氧气 ， 而 心跳 加 快 是 为 了 更 多 、 更 快\n地 向 人 体 各 系统 、 各 器 官 输送 氧气 。 因 此 ， 心 胜 和 肺脏 功能 好 的 人 能 够 较\n轻松 地 完成 这 类 活动 。\n3. 心脏 与 肺脏 协同 加 快 工作 ， 持 续 一 定时 间 地 从 空气 中 获得 氧气 并 加 以 输送\n的 能 力 ， 就 是 我 们 经 常 说 的 心肺 耐力 ( cardiorespiratory endurance ) 。 它 是\n极为 重要 的 生命 和 健康 体征 ， 也 是 衡量 心脏 和 肺脏 机 能 的 重要 指标 。\n=== 第 3 页 ===\n第 二 节 ” 发展 心 肺 耐力\n— FITT 原 则 在 发 展 心 肺 耐 力 中 的 应 用\n@ 频率 : 一 周 内 应 有 3 ~ 5 天 进行 心肺 耐力 的 锻炼 。,2.0,80.95890410958904,冀教版_七年级_义务教育教科书·体育与健康七年级全一册,0,2025-07-21T14:24:45.941Z,2.0,义务教育教科书·体育与健康七年级全一册,/Users/LeoQin/Documents/GitHub/PDFconvertor/training_data/初中/体育与健康/冀教版-河北教育出版社/七年级/义务教育教科书·体育与健康七年级全一册.pdf,七年级,tesseract.js-parallel,unknown,0.7805825242718447,0.5,1,80.95890410958904,,,,true,true,,physics,全一册,冀教版_七年级_义务教育教科书·体育与健康七年级全一册.json,体育,73,初中_体育与健康_冀教版_七年级_义务教育教科书·体育与健康七年级全一册
冀教版_七年级_义务教育教科书·体育与健康七年级全一册_chunk_1,1,心肺耐力 ( cardiorespiratory endurance )。 它是 极为重要的 生命和 健康体征， 也是 衡量心脏和 肺脏机 能的 重要指标。 第二 节发展心 肺耐力原 则在 发展 心肺 耐力 中的 应用 频率 : 一周 内应 有 3 5 天进行心肺耐力的 锻炼。 强度 : 一般 用运动速度快慢代表心肺耐力练习的 强度。 时间 : 持续运动 20 30 分钟。 类型 : 采用跑步 、 忠楼梯 、 骑自行车 、 游泳 、 跳绳 等运动形式都 可以， 根据 自己的 条件 选择一 种， 也可 以在 不同 的锻炼时 间里 交替运用不 同的 雏炼 类型。 注意 发展 心肺耐力的 锻炼是 较为剧烈的 运动， 需要 在锻炼前 后做 适当的 准备活动和 整理活动。 二发展心肺耐力的 方法发 展心肺耐力多 选用长 跑 、 较长 时间 的球 类活动 、 健美 操 、 游泳 、 骑自行车 、 登山 、 跳旨 、 划船 等锻炼手段。 选择跑步发 展心肺耐力可 采用如 下的 锻典 方法 : 10 15 分钟定时跑 : 在运动场 上 、 校园 内 、 树林 责里 、 马路 上均 可进行。 量走 跑组 合 : 快走 100 米一 弓步 走 50 米一 左右交叉步 走 50 米一 快速高 抬腿 跑 20 米一 半蹲 走 50 米一 放松跑 50 米。 完成 3 一 4 组。 5 分钟 变速跑 : 在场地内 以 50 米分 段做 变速跑， 如用 50 米快 50 米慢， 或 50 米慢 50 米快。 阶梯式 变速跑 :; 如 50 米快 一 100 米慢 一 100 米快 一 150 米慢 等， 总跑步量 可以 在 1500 米 2000 米之 间。 是站,730,0.45698748611625317,medium-low,ocr,心肺 耐力 ( cardiorespiratory endurance ) 。 它 是\n极为 重要 的 生命 和 健康 体征 ， 也 是 衡量 心脏 和 肺脏 机 能 的 重要 指标 。\n=== 第 3 页 ===\n第 二 节 ” 发展 心 肺 耐力\n— FITT 原 则 在 发 展 心 肺 耐 力 中 的 应 用\n@ 频率 : 一 周 内 应 有 3 ~ 5 天 进行 心肺 耐力 的 锻炼 。\n@ 强度 : 一 般 用 运动 速度 快慢 代表 心肺 耐力 练习 的 强度 。\n@ 时 间 : 持续 运动 20 ~ 30 分 钟 。\n@ 类 型 : 采用 跑步 、 忠 楼梯 、 骑 自行 车 、 游 泳 、 跳 绳 等 运动 形式 都 可 以 ， 根 据 自己 的\n条 件 选择 一 种 ， 也 可 以 在 不 同 的 锻炼 时 间 里 交替 运用 不 同 的 雏 炼 类 型 。\n注 意\n发 展 心肺 耐力 的 锻炼 是 较为 剧烈 的 运动 ， 需 要 在 锻炼 前 后 做 适当 的 准备 活动 和\n整理 活动 。\n二 ”发展 心肺 耐力 的 方法\n发 展 心肺 耐力 多 选用 长 跑 、 较 长 时 间 的 球 类 活动 、 健 美 操 、 游 泳 、 骑 自行\n车 、 登 山 、 跳 旨 、 划 船 等 锻炼 手段 。\n选择 跑步 发 展 心肺 耐力 可 采用 如 下 的 锻 典 方法 :\n@® 10 -15 分钟 定时 跑 : 在 运动 场 上 、 校 园 内 、 树 林 责\n里 、 马 路 上 均 可 进行 。 量\n@ 走 跑 组 合 : 快走 100 米 一 弓 步 走 50 米 一 左右 交叉 步\n走 50 米 一 快速 高 抬 腿 跑 20 米 一 半 蹲 走 50 米 一 放松 跑\n50 米 。 完成 3 一 4 组 。\n@ 5 分 钟 变速 跑 : 在 场地 内 以 50 米 分 段 做 变速 跑 ， 如 用\n50 米 快 50 米 慢 ， 或 50 米 慢 50 米 快 。\n@ 阶梯 式 变速 跑 :; 如 50 米 快 一 100 米 慢 一 100 米 快 一 150\n米 慢 等 ， 总 跑步 量 可 以 在 1500 米 ~ 2000 米 之 间 。 -是 站,2.0,80.95890410958904,冀教版_七年级_义务教育教科书·体育与健康七年级全一册,1,2025-07-21T14:24:45.941Z,2.0,义务教育教科书·体育与健康七年级全一册,/Users/LeoQin/Documents/GitHub/PDFconvertor/training_data/初中/体育与健康/冀教版-河北教育出版社/七年级/义务教育教科书·体育与健康七年级全一册.pdf,七年级,tesseract.js-parallel,unknown,0.758095238095238,0.6,1,80.95890410958904,,,,true,,,physics,全一册,冀教版_七年级_义务教育教科书·体育与健康七年级全一册.json,体育,73,初中_体育与健康_冀教版_七年级_义务教育教科书·体育与健康七年级全一册
冀教版_七年级_义务教育教科书·体育与健康七年级全一册_chunk_2,2,这种 现象的 ? 能擒 动一 小桶 水。 汉 1. 能擒 动一 大桶 水的 同学肌肉力量 (muscular strength ) o! N ) A 有 K(HK)， 只能 擒动 一小 桶水 的同学肌肉力量小 是 Pate 〈 劲小 )。 国有 2. 肌肉力量是 肌肉收缩时 克服或 对抗 阻力 的能 力， 一般 用肌肉最 大力量 (maximum muscular strength ) Sk 1i 量。 如举重比赛就 是运动员 肌肉 最大 力量的 比拼。 注意 用肌肉最 大力量完成动作时 很容易造成身体损伤， 应该 尽量避免。 有的 同学可 以擒 一桶 水一 口气上 到二 楼， 而有 造成这 种现象是 的同学擒 同样 的水 上二 楼， 中途 需要 休息一 两次。 因为他 们的 肌肉最 大力量有 差异吗 ? 1. 这种 现象是 由于 肌肉耐力 (muscular endurance ) 的差异造成的。 他们 虽然能 擒起 同样重量的 水， 但持续的 时间 长短 有差异。 2. 肌肉耐力是 肌肉持续 〈( 尽可 能长 时间或多 次数 ) P. 克服一 定阻力的 能力。 肌肉 耐力 的发 展可 以使 人起 持续高 效地 完成日 常工作。 N _ 第二 节发 展肌 肉力 量一 发展肌肉力量的 原则安全性 原则肌肉力量练习是 强度较 大且 有一 定危 险性 的运动， 最好 在老师的 指导下 进行。 自己或 与同伴一 起练习时， 一定 要注意安全第 一， 避免 使用 大重量的 器械。 全面 平衡发 展原则上 肢肌 肉力量 、 颈干 肌肉力量和 下肢 肌肉力量应 该全 面发 展， 左右 肢体肌肉力 量也 应平衡发 展。 超负荷原则,720,0.33775256608142,low,ocr,这 种 现象 的 ?\n\ 能 擒 动 一 小 桶 水 。\nCN\n汉\n] 1. 能 擒 动 一 大 桶 水 的 同学 肌肉 力量 (muscular strength )\no! =N ) A\n有 K(HK) ， 只 能 擒 动 一 小 桶 水 的 同学 肌肉 力量 小\n是\nPate 〈 劲 小 ) 。\n国有\n| 2. 肌肉 力量 是 肌肉 收缩 时 克服 或 对 抗 阻 力 的 能 力 ， 一 般\n用 肌肉 最 大 力量 (maximum muscular strength ) Sk 1i\n量 。 如 举重 比赛 就 是 运动 员 肌 肉 最 大 力量 的 比拼 。\n注 意\n用 肌肉 最 大 力量 完成 动作 时 很 容易 造成 身体 损伤 ， 应 该 尽量 避免 。\n有 的 同学 可 以 擒 一 桶 水 一 口气 上 到 二 楼 ， 而 有 造成 这 种 现象 是\n的 同学 擒 同 样 的 水 上 二 楼 ， 中 途 需 要 休息 一 两 次 。 因为 他 们 的 肌肉 最 大\n力量 有 差异 吗 ?\n1. 这 种 现象 是 由 于 肌肉 耐力 (muscular endurance )\n的 差异 造成 的 。 他 们 虽然 能 擒 起 同样 重量 的 水 ，\n但 持续 的 时 间 长 短 有 差异 。 \ &\n2. 肌肉 耐力 是 肌肉 持续 〈( 尽 可 能 长 时 间或 多 次 数 ) P.~\n克服 一 定 阻力 的 能 力 。 肌 肉 耐 力 的 发 展 可 以 使 人 AH 起\n持续 高 效 地 完成 日 常 工作 。 N\_\n=== 第 6 页 ===\n第 二 节 ”发 展 肌 肉 力 量\n一 ”发展 肌肉 力量 的 原则\n® 安全 性 原则\n肌肉 力量 练习 是 强度 较 大 且 有 一 定 危 险 性 的 运动 ， 最 好 在 老师 的 指导 下 进行 。\n自己 或 与 同伴 一 起 练习 时 ， 一 定 要 注意 安全 第 一 ， 避 免 使 用 大 重量 的 器 械 。\n® 全 面 平衡 发 展 原则\n上 肢 肌 肉 力量 、 颈 干 肌肉 力量 和 下 肢 肌肉 力量 应 该 全 面 发 展 ， 左 右 肢体 肌肉 力\n量 也 应 平衡 发 展 。\n@® 超 负荷 原则,2.0,80.95890410958904,冀教版_七年级_义务教育教科书·体育与健康七年级全一册,4,2025-07-21T14:24:45.941Z,2.0,义务教育教科书·体育与健康七年级全一册,/Users/LeoQin/Documents/GitHub/PDFconvertor/training_data/初中/体育与健康/冀教版-河北教育出版社/七年级/义务教育教科书·体育与健康七年级全一册.pdf,七年级,tesseract.js-parallel,unknown,0.7726432532347505,0.7,1,80.95890410958904,,,,true,true,,physics,全一册,冀教版_七年级_义务教育教科书·体育与健康七年级全一册.json,体育,73,初中_体育与健康_冀教版_七年级_义务教育教科书·体育与健康七年级全一册
冀教版_七年级_义务教育教科书·体育与健康七年级全一册_chunk_3,3,一定 危险 性的 运动， 最好 在老师的 指导下 进行。 自己或 与同伴一 起练习时， 一定 要注意安全第 一， 避免 使用 大重量的 器械。 全面 平衡发 展原则上 肢肌 肉力量 、 颈干 肌肉力量和 下肢 肌肉力量应 该全 面发 展， 左右 肢体肌肉力 量也 应平衡发 展。 超负荷原则进行肌肉力量练习时， 对某 一负荷基本适应并 巩固一 段时 间后， 适时 适量地 增大 负荷， 使之 超过原 有负荷， 肌肉 力量才能继续增长。 间葡 性原则在 肌肉抗 阻力练习后， 相关 肌肉需要一段时 间作恢复性 生长， 所以， 最好 隔一 天或 两天 锻炼一 次。 注意 发展 肌肉力量和 肌肉耐力的 抗阻力锻炼是 较为剧烈的 运动， 需要 在锻 烧前 后做 充分的 准备活动和 适当的 整理活动。 二发 展肌肉力量的 方法 6 王发 展上 肢肌 肉力量的 方法区 厂 N 的、 量 1 站 2， 双杜 辟届 伸。 3. 单杠引 体向 上。 这项 练习对 双臂 的支撑力量可 采用双手正 握 、 反 1. 颈后 臂届 伸。 要求 较高。 如在 杠上 不能 作握 、 正反 握三 种担 本注意保持身体正直，。 较长 时间 (如 10 秒以 上 ) 的形式进行练习。 向上 实心球 (或旺 铃 ) 稳定支撑， 就应 慎用 或避免引 体的 高度 以下 颌超 下落 的速度要 慢。 此项 练习。 过杜 面为 准。 和 i :， T 三少， 4. 哑铃组 合。 及 f (1 ) 哑铃重量的 选择以 重复次 7 数能 达到 10 20 次为 宜。 (2 ) 动作的 幅度要 大， 速度 不宜 太快。 发展 躯干 肌肉力量的 方法,707,0.48217932715551975,medium-low,ocr,一 定 危 险 性 的 运动 ， 最 好 在 老师 的 指导 下 进行 。\n自己 或 与 同伴 一 起 练习 时 ， 一 定 要 注意 安全 第 一 ， 避 免 使 用 大 重量 的 器 械 。\n® 全 面 平衡 发 展 原则\n上 肢 肌 肉 力量 、 颈 干 肌肉 力量 和 下 肢 肌肉 力量 应 该 全 面 发 展 ， 左 右 肢体 肌肉 力\n量 也 应 平衡 发 展 。\n@® 超 负荷 原则\n进行 肌肉 力量 练习 时 ， 对 某 一 负荷 基本 适应 并 巩固 一 段 时 间 后 ， 适 时 适量 地 增\n大 负荷 ， 使 之 超过 原 有 负荷 ， 肌 肉 力量 才能 继续 增长 。\n@® 间 葡 性 原则\n在 肌肉 抗 阻力 练习 后 ， 相 关 肌肉 需要 -一段 时 间作 恢复 性 生长 ， 所 以 ， 最 好 隔 一\n天 或 两 天 锻炼 一 次 。\n注 意\n发 展 肌肉 力量 和 肌肉 耐力 的 抗 阻力 锻炼 是 较为 剧烈 的 运动 ， 需 要 在 锻 烧 前 后 做\n充分 的 准备 活动 和 适当 的 整理 活动 。\n二 ”发 展 肌肉 力量 的 方法 “6 王\n® 发 展 上 肢 肌 肉 力量 的 方法 区 -\n厂 N 的、 | 量\n1 站\n2， 双 杜 辟 届 伸 。 3. 单杠 引 体 向 上 。\n这 项 练习 对 双 臂 的 支撑 力量 可 采用 双手 正 握 、 反\n1. 颈 后 臂 届 伸 。 要 求 较 高 。 如 在 杠 上 不 能 作 握 、 正 反 握 三 种 担 本\n注意 保持 身体 正直 ，“。 较 长 时 间 (如 10 秒 以 上 ) 的 形式 进行 练习 。 向 上\n实心 球 (或 旺 铃 ) 稳定 支撑 ， 就 应 慎 用 或 避免 引 体 的 高 度 以 下 颌 超\n下 落 的 速度 要 慢 。 此 项 练习 。 过 杜 面 为 准 。\n=== 第 7 页 ===\n¥ 和 i : ，\n> T 三 少 ， 4. 哑铃 组 合 。\n及 f (1 ) 哑铃 重量 的 选择 以 重复 次\n\ 7 数 能 达到 10 ~ 20 次 为 宜 。\n(2 ) 动作 的 幅度 要 大 ， 速 度 不\n宜 太 快 。\n® 发 展 躯 干 肌肉 力量 的 方法,2.0,80.95890410958904,冀教版_七年级_义务教育教科书·体育与健康七年级全一册,5,2025-07-21T14:24:45.941Z,2.0,义务教育教科书·体育与健康七年级全一册,/Users/LeoQin/Documents/GitHub/PDFconvertor/training_data/初中/体育与健康/冀教版-河北教育出版社/七年级/义务教育教科书·体育与健康七年级全一册.pdf,七年级,tesseract.js-parallel,unknown,0.862934362934363,0.6,1,80.95890410958904,,,,true,,,physics,全一册,冀教版_七年级_义务教育教科书·体育与健康七年级全一册.json,体育,73,初中_体育与健康_冀教版_七年级_义务教育教科书·体育与健康七年级全一册
冀教版_七年级_义务教育教科书·体育与健康七年级全一册_chunk_4,4,度以 下颌 超下 落的 速度要 慢。 此项 练习。 过杜 面为 准。 和 i :， T 三少， 4. 哑铃组 合。 及 f (1 ) 哑铃重量的 选择以 重复次 7 数能 达到 10 20 次为 宜。 (2 ) 动作的 幅度要 大， 速度 不宜 太快。 发展 躯干 肌肉力量的 方法 1. 仰扑 起坐。 2， 仰耻 举腿。 3. 俯耻 背伸。 腹背 肌肉的 练习要 适当放 慢动作速度。 1 六 4. 负重侧 届 A。 5. 负重侧 届 B。 6. 肋木 举腿。 负重侧 届练 习要 注意对 称发 展。 发展 下肢 肌肉 力量的 方法 il 1. 弓箭步 站起。 是幅度要 大， 两腿 交替 进行， 站起 时主 人要 是前 腿用 力。 4 4 2 站立提 贵。 3. 靠球 蹲起。 Sn ee 本 hE 去和 六上 4 深蹲 跳。 5. 连续星 跳。 6. 跳楼梯。 进行这 些跳 的练习主要是 为了 发展 下肢 肌肉的 爆发力， 要尽 可能 用较 快的 速度完成。 综合性 力量练习 y ) ToNg， N 1. 上下 肢组 合。 2. 全身 组合。 发展 肌肉耐力的 练习， 可采用与 发展 肌肉力量相同的 形式。 在练习时 降低负荷， 增加 重复次 数， 这样 就能 够发 展相应部 位的 肌肉耐力。 三。 案例详解 4 案例详解俯卧撑 (push ups ) : 主要锻炼上 肢 、 胸部 并附带铀 炼腰部及 腹部的 肌肉力量。 ) 身体准 备姿 势 : 双展 垂直于 地面， 两腿 向身体后 方伸展， 双手 全手掌和 两个 脚尖着 地并 保持身体平衡， 保持 头 、 颈 、 青部 、 悍部 及双 腿在 一条 直线上。,714,0.3392076338506185,low,ocr,度 以 下 颌 超\n下 落 的 速度 要 慢 。 此 项 练习 。 过 杜 面 为 准 。\n=== 第 7 页 ===\n¥ 和 i : ，\n> T 三 少 ， 4. 哑铃 组 合 。\n及 f (1 ) 哑铃 重量 的 选择 以 重复 次\n\ 7 数 能 达到 10 ~ 20 次 为 宜 。\n(2 ) 动作 的 幅度 要 大 ， 速 度 不\n宜 太 快 。\n® 发 展 躯 干 肌肉 力量 的 方法\n1. 仰 扑 起 坐 。 2， 仰 耻 举 腿 。 3. 俯 耻 背 伸 。\n腹 背 肌肉 的 练习 要 适当 放 慢 动作 速度 。\n/ | 1 -六\n4. 负重 侧 届 A。 5. 负重 侧 届 B。 6. 肋 木 举 腿 。\n负重 侧 届 练 习 要 注意 对 称 发 展 。\n=== 第 8 页 ===\n@® 发 展 下 肢 肌 肉 力量 的 方法\nil 1. 弓箭 步 站 起 。\n是 幅度 要 大 ， 两 腿 交\n替 进 行 ， 站 起 时 主\n人 要 是 前 腿 用 力 。 ™\n4 4\n2 站立 提 贵 。 3. 靠 球 蹲 起 。\nSn ee 本\n| hE 去 和\n六 上\n4 深 蹲 跳 。 5. 连续 星 跳 。 6. 跳楼 梯 。\n进行 这 些 跳 的 练习 主要 是 为 了 发 展 下 肢 肌肉 的 爆发 力 ， 要 尽 可 能 用 较\n快 的 速度 完成 。\n® 综合 性 力量 练习\nES\ny—— ) ToNg ，\nNA\n= / N\n1. 上 下 肢 组 合 。 2. 全 身 组 合 。\n发 展 肌肉 耐力 的 练习 ， 可 采用 与 发 展 肌肉 力量 相同 的 形式 。 在 练习 时\n降低 负荷 ， 增 加 重复 次 数 ， 这 样 就 能 够 发 展 相应 部 位 的 肌肉 耐力 。\n=== 第 9 页 ===\n| 三。 案例 详解 4 案例 详解\n俯卧 撑 (push-ups ) : 主要 锻炼 上 肢 、 胸 部 并 附带 铀 炼 腰部 及 腹部 的 肌肉 力量 。\n@) 身体 准 备 姿 势 : 双 展 垂直 于 地 面 ， 两\n腿 向 身体 后 方 伸展 ， 双 手 全 手掌 和\n两 个 脚尖 着 地 并 保持 身体 平衡 ， 保\n持 头 、 颈 、 青 部 、 悍 部 及 双 腿 在 一\n条 直线 上 。,2.0,80.95890410958904,冀教版_七年级_义务教育教科书·体育与健康七年级全一册,6,2025-07-21T14:24:45.941Z,2.0,义务教育教科书·体育与健康七年级全一册,/Users/LeoQin/Documents/GitHub/PDFconvertor/training_data/初中/体育与健康/冀教版-河北教育出版社/七年级/义务教育教科书·体育与健康七年级全一册.pdf,七年级,tesseract.js-parallel,unknown,0.758893280632411,0.6,1,80.95890410958904,,,,true,,,physics,全一册,冀教版_七年级_义务教育教科书·体育与健康七年级全一册.json,体育,73,初中_体育与健康_冀教版_七年级_义务教育教科书·体育与健康七年级全一册
