Chunk_ID,Chunk_Index,Content,Content_Length,Quality_Score,Reliability,Source_Type,Original_Content,Enhancement_Version,averageConfidence,book_name,chunkIndex,enhancementTimestamp,enhancementVersion,fileName,filePath,grade,ocrMethod,publisher,qualityMetrics_chineseCharRatio,qualityMetrics_coherenceScore,qualityMetrics_lengthScore,qualityMetrics_ocrConfidence,semanticFeatures_hasDefinition,semanticFeatures_hasExperiment,semanticFeatures_hasFormulas,semanticFeatures_hasNumbers,semanticFeatures_hasQuestion,semanticFeatures_isTableContent,semanticFeatures_subjectArea,semester,source_file,subject,totalPages,uniqueId
冀教版_七年级_义务教育教科书·体育与健康七年级全一册_chunk_20,20,规定跳 的时 间 ( 30 60 觉小 腿前 部肌肉疲劳时 止。 . 秒 ) 或跳 的次 数 (30 60。 次 )。 行进 间跳 时， 可规定脚趾力量练习。 跳跃 时最 后推动人 体离 跳的 距离 (20 米 30 米 )。 开地 面的 是脚趾， 脚趾 力量增加可 以提。 以上 练习重复 2 3 组。 高跳跃效率。 (3 ) 纵跳 摸高。 每组 练习 10 次练习方法 : 踏脚 站立， 最少 保持 10 秒钟。。 左右， 重复 3 4 组。 安全警示 (4) 峙跳。 连续 5 7 次为 一组， 如果 小腿 前部 的肌肉力量太 弱， 就会 影。 3 dl a 响小 腿后 面肌肉力量的 发展， 同时 还会 引起。 注意 膝关 节疼痛。 如果 背部 肌肉力量太 弱， 容易 以上 各项 练习， 每组 之间 应引起肌肉拉 伤甚至杖 间盘 突出。。 有较 充足的 休息时 间。 三。 常用移动步 法 4 常用移动步 法步 法 (footwork ) 是综合性 移动技能的 重要组 成部 分， 广泛 适用 于多 种运动项 目。 常用 的步 法包括跨 步 、 垫步 、 并步 、 交叉 步 、 滑步 和后 撤步 等。 这些 步法 常用于 人体 纵向 、 横向 及斜 向的 短距离快速移动。 (0 0 过 00 了左 跨步 右跨 步转 跨步 纪垫 步并 步滑 步 oft f) 跨步 : 主要用 于乒乓球 、 羽毛 球 、 排球 和健美操 等运动项 目。 中热 步 : 主要用 于羽毛球 、 网球 、 排球 和舞蹈等 项目。 wann 并步 : 主要用 于乒乓球 、 琢毛 球和 能球 等项 目。 ee 交叉步 : 主要用 于羽毛球 、 篮球 、 排球 、 网球 、 田径 投据 、 舞 1 蹈和 滑冰等 项目。,753,0.48028036462530216,medium-low,ocr,规定 跳 的 时 间 ( 30 ~ 60\n觉 小 腿 前 部 肌肉 疲劳 时 止 。 . 秒 ) 或 跳 的 次 数 (30 ~ 60\n。 次 ) 。 行 进 间 跳 时 ， 可 规定\n脚趾 力量 练习 。 跳 跃 时 最 后 推动 人 体 离 “ 跳 的 距离 (20 米 ~30 米 ) 。\n开 地 面 的 是 脚趾 ， 脚 趾 力量 增加 可 以 提 。 以 上 练习 重复 2 ~ 3 组 。\n高 跳跃 效率 。 ” (3 ) 纵 跳 摸 高 。 每 组 练习 10 次\n练习 方法 : 踏 脚 站 立 ， 最 少 保持 10 秒 钟 。 。 左右 ， 重 复 3 ~ 4 组 。\n安全 警示 ” (4) 峙 跳 。 连 续 5 ~ 7 次 为 一 组 ，\n如 果 小 腿 前 部 的 肌肉 力量 太 弱 ， 就 会 影 。 3 - dl a\n响 小 腿 后 面 肌肉 力量 的 发 展 ， 同 时 还 会 引起 。 注 意\n膝 关 节 疼痛 。 如 果 背 部 肌肉 力量 太 弱 ， 容 易 “ 以 上 各 项 练习 ， 每 组 之 间 应\n引起 肌肉 拉 伤 甚至 杖 间 盘 突出 。 。 有 较 充足 的 休息 时 间 。\n| 三 。 常用 移动 步 法 4 常用 移动 步 法\n步 法 (footwork ) 是 综合 性 移动 技能 的 重要 组 成 部 分 ， 广 泛 适 用 于 多 种 运动\n项 目 。 常 用 的 步 法 包括 跨 步 、 垫 步 、 并 步 、 交 叉 步 、 滑 步 和 后 撤 步 等 。 这 些 步\n法 常用 于 人 体 纵向 、 横 向 及 斜 向 的 短 距离 快速 移动 。\n(0 0 过 00\nAP 了\n左 跨 步 右 跨 步 转 跨 步 < 纪\n垫 步 并 步 滑 步\noft f) 跨 步 : 主要 用 于 乒乓 球 、 羽 毛 球 、 排 球 和 健美 操 等 运动 项 目 。\n| 中 热 步 : 主要 用 于 羽毛 球 、 网 球 、 排 球 和 舞蹈 等 项 目 。\nwann 并 步 : 主要 用 于 乒乓 球 、 琢 毛 球 和 能 球 等 项 目 。\nee 交叉 步 : 主要 用 于 羽毛 球 、 篮 球 、 排 球 、 网 球 、 田 径 投 据 、 舞\n| 1 蹈 和 滑冰 等 项 目 。,2.0,80.95890410958904,冀教版_七年级_义务教育教科书·体育与健康七年级全一册,24,2025-07-21T14:24:45.942Z,2.0,义务教育教科书·体育与健康七年级全一册,/Users/LeoQin/Documents/GitHub/PDFconvertor/training_data/初中/体育与健康/冀教版-河北教育出版社/七年级/义务教育教科书·体育与健康七年级全一册.pdf,七年级,tesseract.js-parallel,unknown,0.7647058823529411,0.6,1,80.95890410958904,,,,true,,,physics,全一册,冀教版_七年级_义务教育教科书·体育与健康七年级全一册.json,体育,73,初中_体育与健康_冀教版_七年级_义务教育教科书·体育与健康七年级全一册
冀教版_七年级_义务教育教科书·体育与健康七年级全一册_chunk_21,21,乓球 、 羽毛 球 、 排球 和健美操 等运动项 目。 中热 步 : 主要用 于羽毛球 、 网球 、 排球 和舞蹈等 项目。 wann 并步 : 主要用 于乒乓球 、 琢毛 球和 能球 等项 目。 ee 交叉步 : 主要用 于羽毛球 、 篮球 、 排球 、 网球 、 田径 投据 、 舞 1 蹈和 滑冰等 项目。 ) 滑步 : 主要用 于篮球和 田径投掷等 项目。 后交叉步 后撤 步 : 主要用 于篮球和 羽毛球 等项 目。 _ 26 四游泳 4 游泳游泳是 人类 和凭借自身肢体的 动作使 身体在 水中 漂浮和 移动的 综合性 移动技 能。 它既是一 种很 好的 健身手段， 又是 一种 具有避 险和 救助意义的 生存技能。 踩水 〈treading water ) 踩水 又称 立泳， 是最 基本的 水中 运动技能， 也是 人溺水后 最重要的 一种 自救方法。 踩水 时头 部露出水 面， 双手 由胸 前向 两侧 拨水， 双脚 以性 式跨 夹腿 动作向 下踩 水。 BEk ( breaststroke ) 蛙泳是 一种 古老的 游泳姿势， 因模仿青蛙游 水的 动作 而得 名。 峙泳 的手臂划 水动作分 为抓 水 〈 向外 划水 ) 一抱 水 〈 向内 划水 ) 一伸 臂三 个阶段。 蛙泳 的腿 部足 水动作是 和入 推动身体前 进的 主要动力， 分为 收腿 一翻 脚一 路夹 水三 个动作阶段。 手腿 配合 是蛙泳的 关键。 蛙泳划 臂图 蛙泳足 腿图 蛙泳成 套动作 _ 1 2 3 Ra 学习 步又 1. 熟悉水 性。 学会 换气 和在 水中 漂浮。 2. 岸上练习。 划臂 、 足腿 和手 腿配 合。 手腿 配合 的口诀 3. 水中 练习。 划臂 换气 、 足腿 、 划臂 跨腿 配合。 人了 放加 加,760,0.5070779999999999,medium-low,ocr,乓 球 、 羽 毛 球 、 排 球 和 健美 操 等 运动 项 目 。\n| 中 热 步 : 主要 用 于 羽毛 球 、 网 球 、 排 球 和 舞蹈 等 项 目 。\nwann 并 步 : 主要 用 于 乒乓 球 、 琢 毛 球 和 能 球 等 项 目 。\nee 交叉 步 : 主要 用 于 羽毛 球 、 篮 球 、 排 球 、 网 球 、 田 径 投 据 、 舞\n| 1 蹈 和 滑冰 等 项 目 。\n| ) 滑 步 : 主要 用 于 篮球 和 田径 投掷 等 项 目 。\n后 交叉 步 后 撤 步 : 主要 用 于 篮球 和 羽毛 球 等 项 目 。\n_ 26\n=== 第 26 页 ===\n四 游泳 4 游泳\n游泳 是 人 类 和 凭借 自身 肢体 的 动作 使 身体 在 水 中 漂浮 和 移动 的 综合 性 移动 技\n能 。 它 既是 一 种 很 好 的 健身 手段 ， 又 是 一 种 具有 避 险 和 救助 意义 的 生存 技能 。\n&* 踩 水 〈treading water )\n踩 水 又 称 立 泳 ， 是 最 基本 的 水 中 运动 技能 ， 也 是 人\n溺水 后 最 重要 的 一 种 自救 方法 。 踩 水 时 头 部 露出 水 面 ， 双\n手 由 胸 前 向 两 侧 拨 水 ， 双 脚 以 性 式 跨 夹 腿 动作 向 下 踩 水 。\n@&* BEk ( breaststroke )\n蛙泳 是 一 种 古老 的 游泳 姿势 ， 因 模仿 青蛙 游 水 的 动\n作 而 得 名 。 峙 泳 的 手臂 划 水 动作 分 为 抓\n水 〈 向 外 划 水 ) 一 抱 水 〈 向 内 划 水 ) 一\n伸 臂 三 个 阶段 。 蛙 泳 的 腿 部 足 水 动作 是 和 入\n推动 身体 前 进 的 主要 动力 ， 分 为 收 腿 一\n翻 脚 一 路 夹 水 三 个 动作 阶段 。 手 腿 配 合\n是 蛙泳 的 关键 。\n蛙泳 划 臂 图 蛙泳 足 腿 图\n蛙泳 成 套 动作 _\n1 2 3\n< Ra\n学 习 步 又\n1. 熟悉 水 性 。 学 会 换 气 和 在 水 中 漂浮 。\n2. 岸上 练习 。 划 臂 、 足 腿 和 手 腿 配 合 。 手 腿 配 合 的 口诀\n3. 水 中 练习 。 划 臂 换 气 、 足 腿 、 划 臂 跨 腿 配合 。 人 了 放 加 加,2.0,80.95890410958904,冀教版_七年级_义务教育教科书·体育与健康七年级全一册,25,2025-07-21T14:24:45.942Z,2.0,义务教育教科书·体育与健康七年级全一册,/Users/LeoQin/Documents/GitHub/PDFconvertor/training_data/初中/体育与健康/冀教版-河北教育出版社/七年级/义务教育教科书·体育与健康七年级全一册.pdf,七年级,tesseract.js-parallel,unknown,0.8059149722735675,0.6,1,80.95890410958904,,,,true,,,physics,全一册,冀教版_七年级_义务教育教科书·体育与健康七年级全一册.json,体育,73,初中_体育与健康_冀教版_七年级_义务教育教科书·体育与健康七年级全一册
冀教版_七年级_义务教育教科书·体育与健康七年级全一册_chunk_22,22,"。 手腿 配合 是蛙泳的 关键。 蛙泳划 臂图 蛙泳足 腿图 蛙泳成 套动作 _ 1 2 3 Ra 学习 步又 1. 熟悉水 性。 学会 换气 和在 水中 漂浮。 2. 岸上练习。 划臂 、 足腿 和手 腿配 合。 手腿 配合 的口诀 3. 水中 练习。 划臂 换气 、 足腿 、 划臂 跨腿 配合。 人了 放加 加由 划臂 换气 足腿 整套组 合练习， 过渡 到完整的 先仲 子， 后路 有， 手腿 伸直 漂一 会儿。 蛙泳动作练习。 游泳中 意外情况的 预防和 处理 1， 预防。 身体 不适 、 疲劳 或水 温过 低时， 饭前 、 饭 3 只大 的外 理放 法。 只后 或剧烈运动后， 不宜 下水。 下水 前要 做充分的 水有 了丙种， 一种 是准备活动， 补充足够 的盐分， 以避免抽筋。 鼻哈 水， 会引起头 痛 ; 另一 种是 口只 水， 即水 从口腔进 入气管， 会引起反 2， 头晤 和腹痛的 射性 咳嗽和 呼吸障 处理 方法。 游碍。 哈水 时最 关键泳 时如 果出 现的 是不 要紧张， 头头 星或 腹痛症 脑必须保持冷静。 状， 不要 过分 游泳动作不 要乱， 紧张， 应尽快可 先整 住气， 把口 到岸上休息 ; 中的 水吐出或 者干脆如 症状长 时间 咽下， 然后 再调整呼 不能 缓解， 要吸。 坚持 一会 儿， 哈及 时就 医。 水引起的 难受感觉会 逐渐消失。 4、 抽筋 的处 理方法。 抽筋 的自我处 理一 般采 用拉 长痉 牵肌肉的 方法。 在痉 牵肌肉被 外力 牵拉 而伸 长到 一定 程度后 ,抽筋一 般可 以解除， 如抽筋严重不 能自我解 除， 应大 声呼 救。 号 ! 第二 章发 展综合性 身体控制技能",725,0.5560399360063993,medium-low,ocr,"。 手 腿 配 合\n是 蛙泳 的 关键 。\n蛙泳 划 臂 图 蛙泳 足 腿 图\n蛙泳 成 套 动作 _\n1 2 3\n< Ra\n学 习 步 又\n1. 熟悉 水 性 。 学 会 换 气 和 在 水 中 漂浮 。\n2. 岸上 练习 。 划 臂 、 足 腿 和 手 腿 配 合 。 手 腿 配 合 的 口诀\n3. 水 中 练习 。 划 臂 换 气 、 足 腿 、 划 臂 跨 腿 配合 。 人 了 放 加 加\n由 划 臂 换 气 足 腿 整套 组 合 练习 ， 过 渡 到 完整 的 先 仲 子 ， 后 路 有 ，\n手 腿 伸 直 漂 一 会 儿 。\n蛙泳 动作 练习 。\n=== 第 27 页 ===\n@ 游泳 中 意外 情况 的 预防 和 处 理\n1， 预 防 。 身 体 不 适 、 疲 劳 或 水 温 过 低 时 ， 饭 前 、 饭 | | 3 只 大 的 外 理 放 法 。 只\n后 或 剧烈 运动 后 ， 不 宜 下 水 。 下 水 前 要 做 充分 的 水 有 了 丙种， 一 种 是\n准备 活动 ， 补 充足 够 的 盐分 ， 以 避免 抽筋 。 鼻 哈 水 ， 会 引起 头\n痛 ; 另 一 种 是 口 只\n水 ， 即 水 从 口腔 进\n入 气管 ， 会 引起 反\n2， 头 晤 和 腹痛 的 射 性 咳嗽 和 呼吸 障\n处 理 方法 。 游 碍 。 哈 水 时 最 关键\n泳 时 如 果 出 现 的 是 不 要 紧张 ， 头\n头 星 或 腹痛 症 脑 必须 保持 冷静 。\n状 ， 不 要 过 分 游泳 动作 不 要 乱 ，\n紧张 ， 应 尽快 可 先 整 住 气 ， 把 口\n到 岸上 休息 ; 中 的 水 吐出 或 者 干脆\n如 症状 长 时 间 咽 下 ， 然 后 再 调整 呼\n不 能 缓解 ， 要 吸 。 坚 持 一 会 儿 ， 哈\n及 时 就 医 。 水 引起 的 难受 感觉\n会 逐渐 消失 。\n4、 抽 筋 的 处 理 方法 。 抽 筋 的 自我 处 理 一 般 采 用 拉 长 痉 牵 肌肉 的 方法 。 在 痉 牵 肌肉\n被 外 力 牵 拉 而 伸 长 到 一 定 程度 后 ,抽筋 一 般 可 以 解除 ， 如 抽筋 严重 不 能 自我 解\n除 ， 应 大 声 呼 救 。\n号\n!\n=== 第 28 页 ===\n第 二 章 ”发 展 综合 性 身体 控制 技能",2.0,80.95890410958904,冀教版_七年级_义务教育教科书·体育与健康七年级全一册,26,2025-07-21T14:24:45.942Z,2.0,义务教育教科书·体育与健康七年级全一册,/Users/LeoQin/Documents/GitHub/PDFconvertor/training_data/初中/体育与健康/冀教版-河北教育出版社/七年级/义务教育教科书·体育与健康七年级全一册.pdf,七年级,tesseract.js-parallel,unknown,0.8623326959847036,0.6,1,80.95890410958904,,,,true,,,physics,全一册,冀教版_七年级_义务教育教科书·体育与健康七年级全一册.json,体育,73,初中_体育与健康_冀教版_七年级_义务教育教科书·体育与健康七年级全一册
冀教版_七年级_义务教育教科书·体育与健康七年级全一册_chunk_23,23,"感觉会 逐渐消失。 4、 抽筋 的处 理方法。 抽筋 的自我处 理一 般采 用拉 长痉 牵肌肉的 方法。 在痉 牵肌肉被 外力 牵拉 而伸 长到 一定 程度后 ,抽筋一 般可 以解除， 如抽筋严重不 能自我解 除， 应大 声呼 救。 号 ! 第二 章发 展综合性 身体控制技能第 一他 认识综合性 身体控制技能了 了全 快速流畅的 短道 速滑， 4 青春洋溢的 健美操， 体现 力四 A .aa 【与美的竞技体操， 闪展 腾挪一 的武术， 被誉 为水 中芭 茧的 花样游泳真 是技 惊四 座， 美不胜收哇 本以 上这 些运 动项 目主要展示的 是身体控制技能。 主要展示了 哪种 技能 ? 加 A 惫动 后衣 另外， 从事 滑冰 、 滑雪 、 体操 、 武术 、 舞蹈 等运动还 B. 身体控制技能需要身体移动和 使用 某些 器械。 因此， 这些 运动项 目 C. 操作技能最 主要的 运动技能是 综合性 身体控制技能。 运动中 人体 保持平衡和 稳定是 非常重要的。 综合 性身体控制技能的 发展 为人 体平 衡 、 稳定 及流畅而 安全的 运动提供了 保证， 也为 我们 在日 常生活 中维持人 体平衡， 遇到 意外时 应用 合理的 动作避免和 减轻损伤提供了 保障。 知识窗 ? V 人体 的各 个部 分都 受地 球引 力的 作用， 这 A 些引 力合力的 作用点 称为 人体重心。 运动 中改 出变 人体 的姿态和 动作， 人体重心 也会 发生 相应 的改变。 通过 控制肢体的 运动， 使人 体重心 始终 在支撑面 内， 是维持平衡的 最主要因素。 ) 支撑面 对身体重 感知人 体运 控制身体运 控制肌肉用 躯干与 肢体肌肉力量的",721,0.48665725157642964,medium-low,ocr,"感觉\n会 逐渐 消失 。\n4、 抽 筋 的 处 理 方法 。 抽 筋 的 自我 处 理 一 般 采 用 拉 长 痉 牵 肌肉 的 方法 。 在 痉 牵 肌肉\n被 外 力 牵 拉 而 伸 长 到 一 定 程度 后 ,抽筋 一 般 可 以 解除 ， 如 抽筋 严重 不 能 自我 解\n除 ， 应 大 声 呼 救 。\n号\n!\n=== 第 28 页 ===\n第 二 章 ”发 展 综合 性 身体 控制 技能\n第 一 他” 认识 综合 性 身体 控制 技能\n了 了 -全 快速 流畅 的 短 道 速 滑 ，\n4 青春 洋溢 的 健美 操 ， 体 现 力\n四 A .aa 【与 美的 竞技 体操 ， 闪 展 腾挪\n一 的 武术 ， 被 誉 为 水 中 芭 茧 的\nDDN 花样 游泳 …… 真 是 技 惊 四\n座 ， 美不胜收 哇\n本 以 上 这 些 运 动 项 目 主要 展示 的 是 身体 控制 技能 。\n主要 展示 了 哪 种 技能 ? 加\nA 惫 动 后 衣 另外 ， 从 事 滑冰 、 滑 雪 、 体 操 、 武 术 、 舞 蹈 等 运动 还\nB. 身体 控制 技能 需要 身体 移动 和 使 用 某 些 器 械 。 因 此 ， 这 些 运动 项 目\nC. 操作 技能 最 主要 的 运动 技能 是 综合 性 身体 控制 技能 。\n运动 中 人 体 保持 平衡 和 稳定 是 非常 重要 的 。 综 合 性 身体 控制 技能 的 发 展 为\n人 体 平 衡 、 稳 定 及 流畅 而 安全 的 运动 提供 了 保证 ， 也 为 我 们 在 日 常生 活 中 维持\n人 体 平衡 ， 遇 到 意外 时 应 用 合理 的 动作 避免 和 减轻 损伤 提供 了 保障 。\n知识 窗 ?\n\\V//\n人 体 的 各 个 部 分 都 受 地 球 引 力 的 作用 ， 这 A\n些 引 力 合力 的 作用 点 称 为 人 体重 心 。 运 动 中 改 出\n变 人 体 的 姿态 和 动作 ， 人 体重 心 也 会 发 生 相 应\n的 改变 。 通 过 控制 肢体 的 运动 ， 使 人 体重 心 始\n终 在 支撑 面 内 ， 是 维持 平衡 的 最 主要 因素 。 )\n| 支撑 面\n对 身体 重 ”感知 人 体 运 ”控制 身体 运 ”控制 肌肉 用 ”躯干 与 肢体 ”肌肉 力量 的",2.0,80.95890410958904,冀教版_七年级_义务教育教科书·体育与健康七年级全一册,27,2025-07-21T14:24:45.942Z,2.0,义务教育教科书·体育与健康七年级全一册,/Users/LeoQin/Documents/GitHub/PDFconvertor/training_data/初中/体育与健康/冀教版-河北教育出版社/七年级/义务教育教科书·体育与健康七年级全一册.pdf,七年级,tesseract.js-parallel,unknown,0.9035250463821892,0.5,1,80.95890410958904,,,,true,true,,physics,全一册,冀教版_七年级_义务教育教科书·体育与健康七年级全一册.json,体育,73,初中_体育与健康_冀教版_七年级_义务教育教科书·体育与健康七年级全一册
冀教版_七年级_义务教育教科书·体育与健康七年级全一册_chunk_24,24,合力的 作用点 称为 人体重心。 运动 中改 出变 人体 的姿态和 动作， 人体重心 也会 发生 相应 的改变。 通过 控制肢体的 运动， 使人 体重心 始终 在支撑面 内， 是维持平衡的 最主要因素。 ) 支撑面 对身体重 感知人 体运 控制身体运 控制肌肉用 躯干与 肢体肌肉力量的 的认 知动 时及 体的 动的 方加 万的 天的 协调配合友 展水 平影响综合性 身体控制技能发 展的 主要因素第 二节 发展综合性 身体控制技能发 展综合性 身体控制技能可 以提高从 事各 个项 目所 需要的 身体控制能 力。 几乎所 有的 运动项 目都 可以 用来 发展 综合性 身体控制技能， 其中 体操 、 武术 、 轮滑 (或滑冰 ) 等项 目能 更好 地用 来发 展综合性 身体控制技能。 (一体操 4 体操二 双杠 ( parallel bars ) 杜端 跳起 成分 腿坐 支撑后 把挺 身下 的组 合动作。 1 2 3 4 5 6 7 8 学习 步又 1 杠端 跳起 成分 腿坐。 这套 组合 动作可 以很 好 2. 支撑前 后摆动， 躯干 与腿 成直线， 逐步 地发 展人 体空间位 置的 感知国 加加 大摆动幅度， 使鹏 二和 腿高 于杠 面。 能力 和控制人 体横向移动的 g 下能 力， 也可 以发 展人 体上 肤 3. 在低 单杠上 支撑后 摆， 推手 左右横向移 肌肉群 的力量。 动挺身下。 4 双杜 支撑后 摆挺 身下。 5. 完整 动作练习。 技巧 ( acrobatic gymnastics ) 各种 滚翻动作 练习不 仅可 以提高控制身体的 能力， 而且 当出 现意外人 体失 去平,705,0.551124727643388,medium-low,ocr,合力 的 作用 点 称 为 人 体重 心 。 运 动 中 改 出\n变 人 体 的 姿态 和 动作 ， 人 体重 心 也 会 发 生 相 应\n的 改变 。 通 过 控制 肢体 的 运动 ， 使 人 体重 心 始\n终 在 支撑 面 内 ， 是 维持 平衡 的 最 主要 因素 。 )\n| 支撑 面\n对 身体 重 ”感知 人 体 运 ”控制 身体 运 ”控制 肌肉 用 ”躯干 与 肢体 ”肌肉 力量 的\n的 认 知 动 时 及 体 的 动 的 方 加 万 的 天 的 协调 配合 友 展 水 平\n影响 综合 性 身体 控制 技能 发 展 的 主要 因素\n=== 第 29 页 ===\n第 二 节 发展 综合 性 身体 控制 技能\n发 展 综合 性 身体 控制 技能 可 以 提高 从 事 各 个 项 目 所 需要 的 身体 控制 能 力 。\n几乎 所 有 的 运动 项 目 都 可 以 用 来 发 展 综合 性 身体 控制 技能 ， 其 中 体操 、 武 术 、\n轮滑 (或 滑冰 ) 等 项 目 能 更 好 地 用 来 发 展 综合 性 身体 控制 技能 。\n(一 体操 4 体操\n二 双 杠 ( parallel bars )\n杜 端 跳 起 成 分 腿 坐 支撑 后 把 挺 身 下 的 组 合 动作 。\n1 2 3 4\n5 6 7 8\n学 习 步 又\n1 杠 端 跳 起 成 分 腿 坐 。\n这 套 组 合 动作 可 以 很 好 2. 支撑 前 后 摆动 ， 躯 干 与 腿 成 直线 ， 逐 步\n地 发 展 人 体 空间 位 置 的 感知 | 国 加\n加 大 摆动 幅度 ， 使 鹏 二 和 腿 高 于 杠 面 。\n能 力 和 控制 人 体 横向 移动 的 g 下\n能 力 ， 也 可 以 发 展 人 体 上 肤 “3. 在 低 单杠 上 支撑 后 摆 ， 推 手 左右 横向 移\n肌肉 群 的 力量 。 动 挺身 下 。\n4 双 杜 支撑 后 摆 挺 身 下 。\n5. 完 整 动作 练习 。\n=== 第 30 页 ===\n&* 技巧 ( acrobatic gymnastics )\n各 种 滚 翻动 作 练习 不 仅 可 以 提高 控制 身体 的 能 力 ， 而 且 当 出 现 意外 人 体 失 去 平,2.0,80.95890410958904,冀教版_七年级_义务教育教科书·体育与健康七年级全一册,28,2025-07-21T14:24:45.942Z,2.0,义务教育教科书·体育与健康七年级全一册,/Users/LeoQin/Documents/GitHub/PDFconvertor/training_data/初中/体育与健康/冀教版-河北教育出版社/七年级/义务教育教科书·体育与健康七年级全一册.pdf,七年级,tesseract.js-parallel,unknown,0.8445297504798465,0.6,1,80.95890410958904,,,,true,,,physics,全一册,冀教版_七年级_义务教育教科书·体育与健康七年级全一册.json,体育,73,初中_体育与健康_冀教版_七年级_义务教育教科书·体育与健康七年级全一册
