Chunk_ID,Chunk_Index,Content,Content_Length,Quality_Score,Reliability,Source_Type,Original_Content,Enhancement_Version,averageConfidence,book_name,chunkIndex,enhancementTimestamp,enhancementVersion,fileName,filePath,grade,ocrMethod,publisher,qualityMetrics_chineseCharRatio,qualityMetrics_coherenceScore,qualityMetrics_lengthScore,qualityMetrics_ocrConfidence,semanticFeatures_hasDefinition,semanticFeatures_hasExperiment,semanticFeatures_hasFormulas,semanticFeatures_hasNumbers,semanticFeatures_hasQuestion,semanticFeatures_isTableContent,semanticFeatures_subjectArea,semester,source_file,subject,totalPages,uniqueId
冀教版_七年级_义务教育教科书·体育与健康七年级全一册_chunk_50,50,"器官 成长 J 当雌 性激素水 平升 高后， 女性 的第 二性 征逐渐发 育成熟 的嘿 丸产生雄性激 开始发 育 : 乳房变 得丰满， 外生殖顺 变大， 素， 引起 男性第 二性 征的 发育 : 声音部 沉积脂肪 ; 雌性激素使 女性的 头发浓密 , 皮变 粗 ,面部和 身体长 出胡须和 体毛， 肤光 滑 ; 卵策 开始排卵后， 就出 现了 月经。 阴蔡 变得 粗大， 肌肉 变得 更强壮。 青春期 是由 儿童到 成年 的过 渡时 期。 在这 相对短暂的 时期 内， 身体 快速成熟， 几乎 人人 都没有做 好充分的 准备来 应对 自己心理和 身体的 变化。 所以， 应了 解必 要的 知识和 青春期 心理 、 身体 变化的 特点， 以迎接自己的 成熟 并克服各 种可 能的 负面影响。 收获健康重 在参与 v X P 7 . ao 2 刚刚迈进中 学校门的 同学们， 如果 有人 告诉你 们健康是 能让 你们 受益终身的 首要财富， 你们 会同意这 种说 法吗 ? 如果 同意 的话， 你们 又该 怎样做 呢 ? 正确的 选择是 : 到运动场馆去， 到户外去， 到大 自然 中去。 去找 昔吃， 去找 菲受， 去找 欢乐。 去文明我 们的 精神， 去野蛮我 们的 体魄。 体育与 健康课堂是 收获健康的 乐园， 课外 体育锻炼是 收获健康的 另一 方更 广阔的 天地， 而积极的 态度和 切实 的行动则 是收获健康的 前提。 本第 二节 青春期 心理变化每 个人 在从 幼稚转 为成 熟的 成长 过程 中， 都会 产生心理上 的变化， 也会",672,0.5193051955831033,medium-low,ocr,"器 官 成 长 | | \J\n当 雌 性 激素 水 平 升 高 后 ， 女 性 的 第 二 性 征 逐渐 发 育成 熟 的 嘿 丸 产生 雄性 激\n开始 发 育 : 乳房 变 得 丰满 ， 外 生殖 顺 变 大 ， 素 ， 引 起 男性 第 二 性 征 的 发 育 : 声音\n部 沉积 脂肪 ; 雌性 激素 使 女性 的 头发 浓密 , 皮 ” 变 粗 ,面部 和 身体 长 出 胡须 和 体毛 ，\n肤 光 滑 ; 卵 策 开始 排卵 后 ， 就 出 现 了 月 经 。 阴 蔡 变 得 粗大 ， 肌 肉 变 得 更 强壮 。\n青春 期 是 由 儿童 到 成 年 的 过 渡 时 期 。 在 这 相对 短暂 的 时 期 内 ， 身 体 快\n速成 熟 ， 几 乎 人 人 都 没有 做 好 充分 的 准备 来 应 对 自己 心理 和 身体 的 变化 。\n所 以 ， 应 了 解 必 要 的 知识 和 青春 期 心理 、 身 体 变化 的 特点 ， 以 迎接 自己 的\n成 熟 并 克服 各 种 可 能 的 负面 影响 。\n=== 第 56 页 ===\n收获 健康 重 在 参与\n=\nv X P 7 . |\nao\n2\n刚刚 迈进 中 学 校门 的 同学 们 ， 如 果 有 人 告诉 你 们\n“健康 是 能 让 你 们 受益 终身 的 首要 财富 ”， 你 们 会 同意\n这 种 说 法 吗 ?\n如 果 同 意 的话 ， 你 们 又 该 怎样 做 呢 ?\n正确 的 选择 是 : 到 运动 场馆 去 ， 到 户外 去 ， 到 大 自\n然 中 去 。\n去 找 “ 昔 ” 吃 ， 去 找 “ 菲 ” 受 ， 去 找 欢 乐 。\n去 文明 我 们 的 精神 ， 去 野蛮 我 们 的 体魄 。\n体育 与 健康 课堂 是 收获 健康 的 乐园 ， 课 外 体育 锻炼\n是 收获 健康 的 另 一 方 更 广阔 的 天 地 ， 而 积极 的 态度 和 切\n实 的 行动 则 是 收获 健康 的 前 提 。\n本\n=== 第 57 页 ===\n第 二 节 ” 青春 期 心理 变化\n每 个 人 在 从 幼稚 转 为 成 熟 的 成 长 过 程 中 ， 都 会 产生 心理 上 的 变化 ， 也 会",2.0,80.95890410958904,冀教版_七年级_义务教育教科书·体育与健康七年级全一册,56,2025-07-21T14:24:45.942Z,2.0,义务教育教科书·体育与健康七年级全一册,/Users/LeoQin/Documents/GitHub/PDFconvertor/training_data/初中/体育与健康/冀教版-河北教育出版社/七年级/义务教育教科书·体育与健康七年级全一册.pdf,七年级,tesseract.js-parallel,unknown,0.896551724137931,0.5,1,80.95890410958904,,,,true,true,,physics,全一册,冀教版_七年级_义务教育教科书·体育与健康七年级全一册.json,体育,73,初中_体育与健康_冀教版_七年级_义务教育教科书·体育与健康七年级全一册
冀教版_七年级_义务教育教科书·体育与健康七年级全一册_chunk_51,51,。 体育与 健康课堂是 收获健康的 乐园， 课外 体育锻炼是 收获健康的 另一 方更 广阔的 天地， 而积极的 态度和 切实 的行动则 是收获健康的 前提。 本第 二节 青春期 心理变化每 个人 在从 幼稚转 为成 熟的 成长 过程 中， 都会 产生心理上 的变化， 也会 出现 一些 问题 和挑战。 只要 对青春期 的心理特点和 容易产生的 心理问题有 所了 解， 并在 出现 问题时 积极与 父母或 老师沟通， 寻求 帮助， 那么， 人人 都会 拥有一 个美好的 青春。 1 情绪特点。 最突出的 表现是 情绪很 容易产生波动， 目有 时这 种波动表现得 青很 剧烈。 春 (2 思维特点。 抽象 思维有 了较 明显的 发展， 能够 对某 些现象作 概括 性的 阐述。 期 「 3 情感特点。 情感 更加 丰富， 对亲情 、 友情 、 尝黎 之情 及对 异性的 好感 都有 昌了 较丰 富的 体验和 相应的 表现。 特 _『 4 交往特点。 对家 庭的 依赖性 减小， 非常 渴望遇 到志向和 爱好相同的 人， 并占 将其 视为 自己的 贴心密友。 5. 追求新 奇。 对各 种事物和 现象开始产生广泛兴趣， 探索 能力 进一步提高。 青春期 容易出 现的 心理问题 1. 困惑感。 在与 异性交往时， 往往 表现出 既喜 欢与 异性交往， 又关于与 异性在 一起 的矛盾心理， 随之 出现 害羞 、 焦虑 、 困惑 等复杂的 心理变化。 克服害羞心理， 经常 与同龄异性伙伴在 一起 谈论一 些有 共同兴趣的 话题， 或者 共同组 织一 些有 趣味的 活动， 如郊游 、 生日 聚会及 一些 体育活动， 都有 助于 克服,713,0.5938082619863013,medium-low,ocr,。\n体育 与 健康 课堂 是 收获 健康 的 乐园 ， 课 外 体育 锻炼\n是 收获 健康 的 另 一 方 更 广阔 的 天 地 ， 而 积极 的 态度 和 切\n实 的 行动 则 是 收获 健康 的 前 提 。\n本\n=== 第 57 页 ===\n第 二 节 ” 青春 期 心理 变化\n每 个 人 在 从 幼稚 转 为 成 熟 的 成 长 过 程 中 ， 都 会 产生 心理 上 的 变化 ， 也 会\n出 现 一 些 问 题 和 挑战 。 只 要 对 青春 期 的 心理 特点 和 容易 产生 的 心理 问题 有 所 了\n解 ， 并 在 出 现 问题 时 积极 与 父母 或 老师 沟通 ， 寻 求 帮助 ， 那么， 人 人 都 会 拥有\n一 个 美好 的 青春 。\n1 情绪 特点 。 最 突出 的 表现 是 情绪 很 容易 产生 波动 ， 目 有 时 这 种 波动 表现 得\n青 很 剧烈。\n春 (2 思维 特点 。 抽 象 思维 有 了 较 明显 的 发 展 ， 能 够 对 某 些 现象 作 概 括 性 的 阐述 。\n期 | 「 3 情感 特点 。 情 感 更 加 丰富 ， 对 亲情 、 友 情 、 尝 黎 之 情 及 对 异性 的 好 感 都 有\n昌 了 较 丰 富 的 体验 和 相应 的 表现 。\n特 |_『 4 交往 特点 。 对 家 庭 的 依赖 性 减 小 ， 非 常 渴望 遇 到 志向 和 爱好 相同 的 人 ， 并\n占 将 其 视 为 自己 的 贴心 密友 。\n5. 追求 新 奇 。 对 各 种 事物 和 现象 开始 产生 广泛 兴趣 ， 探 索 能 力 进一步 提高 。\n青春 期 容易 出 现 的 心理 问题\n1. 困惑 感 。 在 与 异性 交往 时 ， 往 往 表现 出 既 喜 欢 与 异性 交往 ， 又 关于 与 异性 在 一 起\n的 矛盾 心理 ， 随 之 出 现 害羞 、 焦 虑 、 困 惑 等 复杂 的 心理 变化 。\n克服 害羞 心理 ， 经 常 与 同龄 异性 伙伴 在 一 起 谈论 一 些 有 共同 兴趣 的 话题 ，\n或 者 共同 组 织 一 些 有 趣味 的 活动 ， 如 郊游 、 生 日 聚会 及 一 些 体育 活动 ， 都 有 助 于 克服,2.0,80.95890410958904,冀教版_七年级_义务教育教科书·体育与健康七年级全一册,57,2025-07-21T14:24:45.943Z,2.0,义务教育教科书·体育与健康七年级全一册,/Users/LeoQin/Documents/GitHub/PDFconvertor/training_data/初中/体育与健康/冀教版-河北教育出版社/七年级/义务教育教科书·体育与健康七年级全一册.pdf,七年级,tesseract.js-parallel,unknown,0.8983050847457628,0.5,1,80.95890410958904,,,,true,,,general,全一册,冀教版_七年级_义务教育教科书·体育与健康七年级全一册.json,体育,73,初中_体育与健康_冀教版_七年级_义务教育教科书·体育与健康七年级全一册
冀教版_七年级_义务教育教科书·体育与健康七年级全一册_chunk_52,52,既喜 欢与 异性交往， 又关于与 异性在 一起 的矛盾心理， 随之 出现 害羞 、 焦虑 、 困惑 等复杂的 心理变化。 克服害羞心理， 经常 与同龄异性伙伴在 一起 谈论一 些有 共同兴趣的 话题， 或者 共同组 织一 些有 趣味的 活动， 如郊游 、 生日 聚会及 一些 体育活动， 都有 助于 克服与 异性交往的 害羞心理， 增进 友谊， 加深 了解， 逐渐 学会 异性之 间的 正常交往。 2. 独立与 依附的 矛盾心理。 青少年开始用 自己的 头脑去 思考外 边的 世界， 期望 自己主宰自 己， 同时 对父母和 老师的 教导产生怀疑。 但在 经济 上， 仍需要依靠父母并 受家 庭的 约束。 这种 矛盾心理很 容易导致青少年的 情绪不 稳定和 不愉快， 甚至 导致 家庭 关系和 师生 关系 紧张。 大胆 追求 独立， 正确认识 父母 、 老师 和朋友在 自己成 长中 的作用。 同时， 要学 会克制自己一 些过 分的 要求 和行为。 这样 也可 以堵 养同 学们 理性思考 、 分析 问题 的能 力。 3. 育目 模仿。 很容易不 经思考地 模仿成 人， 如 : 认为能 显示魅力和 成熟 而模仿成 人吸烟 ;模仿某 些暴力片 中的 场景而 去做 些胃 险的 事情。 克服盲目性。 要学 会应 用自己所 学的 知识进行独立判断与 辨别， 认识 到哪 些模仿或 追求是 向上 的 、 向善 的 、 积极 的 、 有益 的， 哪些 是有 害的 、 危险 的和 消极的， 甚至 是违法的。 第三 节青春期 常见的 生理问题进入青春期 后， 同学 们的 身体会 产生一 系列的 生理变化， 带来 一些 以前 没,708,0.6226392230627682,medium,ocr,既 喜 欢 与 异性 交往 ， 又 关于 与 异性 在 一 起\n的 矛盾 心理 ， 随 之 出 现 害羞 、 焦 虑 、 困 惑 等 复杂 的 心理 变化 。\n克服 害羞 心理 ， 经 常 与 同龄 异性 伙伴 在 一 起 谈论 一 些 有 共同 兴趣 的 话题 ，\n或 者 共同 组 织 一 些 有 趣味 的 活动 ， 如 郊游 、 生 日 聚会 及 一 些 体育 活动 ， 都 有 助 于 克服\n与 异性 交往 的 害羞 心理 ， 增 进 友谊， 加 深 了 解 ， 逐 渐 学 会 异性 之 间 的 正常 交往 。\n2. 独立 与 依附 的 矛盾 心理 。 青 少年 开始 用 自己 的 头脑 去 思考 外 边 的 世界 ， 期 望 自己\n主宰 自 己 ， 同 时 对 父母 和 老师 的 教导 产生 怀疑 。 但 在 经 济 上 ， 仍 需要 依靠 父母 并\n受 家 庭 的 约束 。 这 种 矛盾 心理 很 容易 导致 青少年 的 情绪 不 稳定 和 不 愉快 ， 甚 至 导\n致 家 庭 关系 和 师 生 关 系 紧 张 。\n大 胆 追 求 独立 ， 正 确认 识 父母 、 老 师 和 朋友 在 自己 成 长 中 的 作用 。 同 时 ， 要 学\n会 克制 自己 一 些 过 分 的 要 求 和 行为 。 这 样 也 可 以 堵 养 同 学 们 理性 思考 、 分 析 问 题 的 能 力 。\n3. 育 目 模仿 。 很 容易 不 经 思考 地 模仿 成 人 ， 如 : 认为 能 显示 魅力 和 成 熟 而 模仿 成 人\n吸烟 ;模仿 某 些 暴力 片 中 的 场景 而 去 做 些 胃 险 的 事情 。\n克服 盲目 性 。 要 学 会 应 用 自己 所 学 的 知识 进行 独立 判断 与 辨别 ， 认 识 到 哪\n些 模仿 或 追求 是 向 上 的 、 向 善 的 、 积 极 的 、 有 益 的 ， 哪 些 是 有 害 的 、 危 险 的 和 消极\n的 ， 甚 至 是 违法 的 。\n=== 第 58 页 ===\n第 三 节 ”青春 期 常见 的 生理 问题\n进入 青春 期 后 ， 同 学 们 的 身体 会 产生 一 系列 的 生理 变化 ， 带 来 一 些 以 前 没,2.0,80.95890410958904,冀教版_七年级_义务教育教科书·体育与健康七年级全一册,58,2025-07-21T14:24:45.943Z,2.0,义务教育教科书·体育与健康七年级全一册,/Users/LeoQin/Documents/GitHub/PDFconvertor/training_data/初中/体育与健康/冀教版-河北教育出版社/七年级/义务教育教科书·体育与健康七年级全一册.pdf,七年级,tesseract.js-parallel,unknown,0.9066666666666666,0.6,1,80.95890410958904,,,,true,,,general,全一册,冀教版_七年级_义务教育教科书·体育与健康七年级全一册.json,体育,73,初中_体育与健康_冀教版_七年级_义务教育教科书·体育与健康七年级全一册
冀教版_七年级_义务教育教科书·体育与健康七年级全一册_chunk_53,53,立判断与 辨别， 认识 到哪 些模仿或 追求是 向上 的 、 向善 的 、 积极 的 、 有益 的， 哪些 是有 害的 、 危险 的和 消极的， 甚至 是违法的。 第三 节青春期 常见的 生理问题进入青春期 后， 同学 们的 身体会 产生一 系列的 生理变化， 带来 一些 以前 没有 遇到 过的 生理问题。 其中 女生的 月经 、 男生 的遗精是 几乎每 个同学都 会遇 到的 生理问题 ; 而神经性 厌食和 青春期 驼背则 是由 于某 些同学认识上 的俩 误和 不良 的身体姿态造成的。 针痛经遗精女生月 经期 间伴 有严重的 痉男生青春期 遗精是 一种 正常的 生理这 性疼痛症状， 称为 原发 性痛经现象。 正常 男性中 约有 909 的人 有遗精 ( painful menstruation )。 痛经 严体验。 众话说精 满则 游， 男生 进入 重者 会出 现下腹部的 阵发 性剧烈绞 青春期 后， 墨丸 每天 要产生 2 人 2 个精子， 痛， 可放射到 腰佬 部 、 大腿 内侧， 精宫 和前 列腺 也不 断地 产生分 沁物， 储有 的还 伴有 脸色苍白 、 四肢 冰凉 、 存到 一定量时 就会 出现 遗精。 另外， 当出 冷汗 、 亚心 、 哎吐 甚至晕厥等 生殖融 受到 外界 刺激 〈 如穿 过紧 的内 证状。 裤 、 被子 太重 或趴 着睡觉等 ) 或患 有疾 月经 期忌 剧烈 活动， 忌盆 兴和 病 〈 如尿道炎 、 龟头 炎 、 包葵 、 包皮 过游泳， 忌生冷食物。 应消除对 痛经长 等 ) 时， 也可 导致遗精。 应该 留意这 的惊 妨 、 焦虑 等精神负担， 可在 医些 原因 并尽量避免。 如果 是生殖天 疾,726,0.5655347447073475,medium-low,ocr,立 判断 与 辨别 ， 认 识 到 哪\n些 模仿 或 追求 是 向 上 的 、 向 善 的 、 积 极 的 、 有 益 的 ， 哪 些 是 有 害 的 、 危 险 的 和 消极\n的 ， 甚 至 是 违法 的 。\n=== 第 58 页 ===\n第 三 节 ”青春 期 常见 的 生理 问题\n进入 青春 期 后 ， 同 学 们 的 身体 会 产生 一 系列 的 生理 变化 ， 带 来 一 些 以 前 没\n有 遇 到 过 的 生理 问题 。 其 中 女生 的 月 经 、 男 生 的 遗精 是 几乎 每 个 同学 都 会 遇 到\n的 生理 问题 ; 而 神经 性 厌食 和 青春 期 驼背 则 是 由 于 某 些 同学 认识 上 的 俩 误 和 不\n良 的 身体 姿态 造成 的 。\n针 痛经 @ 遗精\n女生 月 经 期 间 伴 有 严重 的 痉 男生 青春 期 遗精 是 一 种 正常 的 生理\n这 性 疼痛 症状 ， 称 为 原 发 性 痛经 现象 。 正 常 男性 中 约 有 909% 的 人 有 遗精\n( painful menstruation ) 。 痛 经 严 体验 。 众 话说 “ 精 满 则 游 ”， 男 生 进 入\n重 者 会 出 现下 腹部 的 阵 发 性 剧烈 绞 青春 期 后 ， 墨 丸 每 天 要 产生 2 人 2 个 精子 ，\n痛 ， 可 放射 到 腰 佬 部 、 大 腿 内 侧 ， 精 宫 和 前 列 腺 也 不 断 地 产生 分 沁 物 ， 储\n有 的 还 伴 有 脸色 苍白 、 四 肢 冰凉 、 存 到 一 定量 时 就 会 出 现 遗 精 。 另 外 ， 当\n出 冷汗 、 亚 心 、 哎 吐 甚至 晕厥 等 生殖 融 受 到 外 界 刺激 〈 如 穿 过 紧 的 内\n证 状 。 裤 、 被 子 太 重 或 趴 着 睡觉 等 ) 或 患 有 疾\n月 经 期 忌 剧 烈 活 动 ， 忌 盆 兴 和 病 〈 如 尿道 炎 、 龟 头 炎 、 包 葵 、 包 皮 过\n游泳 ， 忌 生冷 食物 。 应 消除 对 痛经 长 等 ) 时 ， 也 可 导致 遗精 。 应 该 留意 这\n的 惊 妨 、 焦 虑 等 精神 负担 ， 可 在 医 些 原 因 并 尽量 避免 。 如 果 是 生殖 天 疾,2.0,80.95890410958904,冀教版_七年级_义务教育教科书·体育与健康七年级全一册,59,2025-07-21T14:24:45.943Z,2.0,义务教育教科书·体育与健康七年级全一册,/Users/LeoQin/Documents/GitHub/PDFconvertor/training_data/初中/体育与健康/冀教版-河北教育出版社/七年级/义务教育教科书·体育与健康七年级全一册.pdf,七年级,tesseract.js-parallel,unknown,0.8587786259541985,0.5,1,80.95890410958904,,,,true,,,unknown,全一册,冀教版_七年级_义务教育教科书·体育与健康七年级全一册.json,体育,73,初中_体育与健康_冀教版_七年级_义务教育教科书·体育与健康七年级全一册
冀教版_七年级_义务教育教科书·体育与健康七年级全一册_chunk_54,54,"被子 太重 或趴 着睡觉等 ) 或患 有疾 月经 期忌 剧烈 活动， 忌盆 兴和 病 〈 如尿道炎 、 龟头 炎 、 包葵 、 包皮 过游泳， 忌生冷食物。 应消除对 痛经长 等 ) 时， 也可 导致遗精。 应该 留意这 的惊 妨 、 焦虑 等精神负担， 可在 医些 原因 并尽量避免。 如果 是生殖天 疾生 指导下 服用药物缓解痛经。 病， 要尽早到 医院诊治。 盲目节食与 神经性 厌食症 有的 少女言 目追求体形美， 为了 身材苗条而 节食， 不吃 主食和 动物性 食品， 把人 体所 需的 许多营养都 由排除在 食谱之 外， 导致 食欲日 趋降低， 看见 食物就 亚中 心， 最后 发展 到拒食， 这就 是神经性 厌食症 〈anorexia 了 nervosa ) q z 患有 神经性 厌食证 的少女由 于进食明显减少， 会出 现体重下 降 、 身体 虚弱 、 心率 变缓 、 血压 下降 、 皮肤 粗料 和闭经等 症状， 还可 能出 现一 些精神症状力 至行为失 常， 如不 及时 治疗， 将会 导致严重后 果。 青春期 驼背青春期 正处 于身体生长发 育高 峰期， 这时 的骨骼特别是 疹柱 弹性较 大而 硬度较 小 ,不易 发生 骨折 ,， 但极 容易发 生变形。 如果 在长 时间 的上 课 、 读书 等学 习活 动中 不注意身体的 正确姿势， 比如 身体趴 在桌子上 、 侧着 身子读书等， 就会 引起兰 柱后 突变形 即驼背 (adolescence humpback )。 通常， 男生 青春期 驼彰 发生 率大 大高 于女生。 青春期 驼背一 般是 和暂时性 的和 不固定的， 是可 以预防和 矫正的。 同学 们平时要",722,0.5126722602739726,medium-low,ocr,"被 子 太 重 或 趴 着 睡觉 等 ) 或 患 有 疾\n月 经 期 忌 剧 烈 活 动 ， 忌 盆 兴 和 病 〈 如 尿道 炎 、 龟 头 炎 、 包 葵 、 包 皮 过\n游泳 ， 忌 生冷 食物 。 应 消除 对 痛经 长 等 ) 时 ， 也 可 导致 遗精 。 应 该 留意 这\n的 惊 妨 、 焦 虑 等 精神 负担 ， 可 在 医 些 原 因 并 尽量 避免 。 如 果 是 生殖 天 疾\n生 指导 下 服用 药物 缓解 痛经 。 病 ， 要 尽早 到 医院 诊治 。\n@ 盲目 节食 与 神经 性 厌食 症\n有 的 少女 言 目 追求 体形 美 ， 为 了 身材 “苗条 ”而 节\n食 ， 不 吃 主食 和 动物 性 食品 ， 把 人 体 所 需 的 许多 营养 都 \ 由\n排除 在 食谱 之 外 ， 导 致 食欲 日 趋 降低 ， 看 见 食物 就 亚 中\n心 ， 最 后 发 展 到 拒食 ， 这 就 是 神经 性 厌食 症 〈anorexia | ~ 了 |\nnervosa ) ° q z LU |\n患 有 神经 性 厌食 证 的 少女 由 于 进食 明显 减少 ， 会 出\n现 体重 下 降 、 身 体 虚弱 、 心 率 变 缓 、 血 压 下 降 、 皮 肤 粗\n料 和 闭经 等 症状 ， 还 可 能 出 现 一 些 精神 症状 力 至 行为 失\n常 ， 如 不 及 时 治疗 ， 将 会 导致 严重 后 果 。\n@ 青春 期 驼背\n青春 期 正 处 于 身体 生长 发 育 高 峰 期 ， 这 时 的 骨骼 特别 是 疹 柱 弹性 较 大 而 硬度 较\n小 ,不 易 发 生 骨 折 ,， 但 极 容易 发 生变 形 。 如 果 在 长 时 间 的 上 课 、 读 书 等 学 习 活 动 中 不\n注意 身体 的 正确 姿势 ， 比 如 身体 趴 在 桌子 上 、 侧 着 身子 读书 等 ， 就 会 引起 兰 柱 后 突变\n形 即 驼背 (adolescence humpback ) 。 通 常 ， 男 生 青春 期 驼 彰 发 生 率 大 大 高 于 女生 。\n青春 期 驼背 一 般 是 和 暂时 性 的 和 不 固定 的 ， 是 可 以 预防 和 矫正 的 。 同 学 们 平时 要",2.0,80.95890410958904,冀教版_七年级_义务教育教科书·体育与健康七年级全一册,60,2025-07-21T14:24:45.943Z,2.0,义务教育教科书·体育与健康七年级全一册,/Users/LeoQin/Documents/GitHub/PDFconvertor/training_data/初中/体育与健康/冀教版-河北教育出版社/七年级/义务教育教科书·体育与健康七年级全一册.pdf,七年级,tesseract.js-parallel,unknown,0.8370786516853933,0.5,1,80.95890410958904,,,,,,,biology,全一册,冀教版_七年级_义务教育教科书·体育与健康七年级全一册.json,体育,73,初中_体育与健康_冀教版_七年级_义务教育教科书·体育与健康七年级全一册
