Chunk_ID,Chunk_Index,Content,Content_Length,Quality_Score,Reliability,Source_Type,Original_Content,Enhancement_Version,averageConfidence,book_name,chunkIndex,enhancementTimestamp,enhancementVersion,fileName,filePath,grade,ocrMethod,publisher,qualityMetrics_chineseCharRatio,qualityMetrics_coherenceScore,qualityMetrics_lengthScore,qualityMetrics_ocrConfidence,semanticFeatures_hasDefinition,semanticFeatures_hasExperiment,semanticFeatures_hasFormulas,semanticFeatures_hasNumbers,semanticFeatures_hasQuestion,semanticFeatures_isTableContent,semanticFeatures_subjectArea,semester,source_file,subject,totalPages,uniqueId
华东师大版_八年级_义务教育教科书·数学八年级下册_chunk_23,23,"是常量 . 在研究函数时 ;必须注意自 变量的 取值 范围 . 实际问 题中 , 自变量的 取值 必须符合实际意义 . 例如 ,上述 问题 4 中 , 自变 量表示圆 的尘 径 , 不能 为负数和 零 , 即它 的取 值范围为 一切 正实数 _ 玉 1. 举出 3 个日 常生活 中遇 到的 变量与 函数的 例子 . 2. 下表 是某 城市 2012 年统计的 中小 学男 学生 各年 龄组 的平均身高 : 年龄 组 ( 乡 7 8 9 ofnfw w ulis edirs 让加 回国回国加 四加 四加 irC (cm) 30 .第 1 了章 观察此 表 , 回答 下列 问题 : 人 HH) 该市 14 岁男 学生 的平均身高是 多少 ? (2 扩该 市男 学生 的平均身高从 哪一 岁开 始增加特别迅速 ? (3) 这里 反映了 哪些变量之 间的 关系 ? 其中 哪个是 自变量 ? 哪个是 因变 量 ? 3. 写出 下烈 各问题中 的函数关系式 ,并指出自 变量 的取 值范围 : (1) 圆的 周长 C 是半径的 函数 ; (2) 火牵 叉 60 千米 时的 速度行驶 , 它驶 过的 路程 s( 千米 ) 是所 用时 间克 时 ) 的函数 ; (3) 双努 形内 负和 的度数 3 是边 数慰 的函数 . (1) 填写如 图 17. 工 2 所未 前 10 以内 正整数的 加区 法表 ,然后把 所有 填有 10 的箱子涂 黑 , 看看 你能 发现世 1 国语什么 ? 二二 十时 (2) 如果 把这 些涂 黑的 格子横向的 加数 用表示， 时一 纵向的 加数 用 y 表示 ,y 是 x 的函数 , 旗写 贿这 个函数关 Trenlrsares 系式 . 图 17. 1.2 (3) 当涂 黑的 格子横向的 加数 为 3 时 8 纵向前 加数",778,0.3632662998891352,low,ocr,"是 常量 .\n在 研究 函数 时 ;必须 注意 自 变量 的 取 值 范围 . 实际 问\n题 中 , 自 变量 的 取 值 必须 符合 实际 意义 . 例如 ,上 述 问 题\n4 中 , 自 变 量 > 表示 圆 的 尘 径 , 不 能 为 负数 和 零 , 即 它 的\n取 值 范围 为 一 切 正 实数\n_ 玉 |\n1. 举 出 3 个 日 常生 活 中 遇 到 的 变量 与 函数 的 例子 .\n2. 下 表 是 某 城市 2012 年 统计 的 中 小 学 男 学 生 各 年 龄 组 的 平均 身高 :\n年 龄 组 ( 乡 | 7 | 8 | 9 [ofnfw[w[ulis]|edirs\n让 加 回国 回国 加 四 加 四 加 irC\n(cm)\n30 .第 1 了 章 WESHER\n=== 第 110 页 ===\n观察 此 表 , 回 答 下 列 问题 :\n人 HH) 该 市 14 岁 男 学 生 的 平均 身高 是 多 少 ?\n(2 扩 该 市 男 学 生 的 平均 身高 从 哪 一 岁 开 始 增加 特别 迅速 ?\n(3) 这 里 反映 了 哪些 变量 之 间 的 关系 ? 其 中 哪个 是 自 变量 ? 哪个 是 因 变 量 ?\n3. 写 出 下 烈 各 问题 中 的 函数 关系 式 ,并 指出 自 变 量 的 取 值 范围 :\n(1) 圆 的 周 长 C 是 半径 的 函数 ;\n(2) 火 牵 叉 60 千 米 / 时 的 速度 行驶 , 它 驶 过 的 路 程 s( 千 米 ) 是 所 用 时 间 克 时 ) 的\n函数 ;\n(3) 双 努 形 内 负 和 的 度数 3 是 边 数 慰 的 函数 .\n(1) 填写 如 图 17. 工 2 所 未 前 10 以 内 正 整数 的 加 ”区\n法 表 ,然后 把 所 有 填 有 10 的 箱子 涂 黑 , 看 看 你 能 发 现世 1 国语\n什么 ? 二 二- 十 时\n(2) 如 果 把 这 些 涂 黑 的 格子 横向 的 加 数 用 * 表示 ，“ 时 一\n纵向 的 加 数 用 y 表示 ,y 是 x 的 函数 , 旗 写 贿 这 个 函数 关 Trenlrsares\n系 式 . 图 17. 1.2\n(3) 当 涂 黑 的 格子 横向 的 加 数 为 3 时 8 纵向 前 加 数",2.0,72.4659090909091,华东师大版_八年级_义务教育教科书·数学八年级下册,102,2025-07-21T14:24:55.862Z,2.0,义务教育教科书·数学八年级下册,/Users/LeoQin/Documents/GitHub/PDFconvertor/training_data/初中/数学/华东师大版-华东师范大学出版社/八年级/义务教育教科书·数学八年级下册.pdf,八年级,tesseract.js-parallel,unknown,0.7398523985239852,0.5,1,72.4659090909091,,true,,true,true,,physics,下册,华东师大版_八年级_义务教育教科书·数学八年级下册.json,数学,176,初中_数学_华东师大版_八年级_义务教育教科书·数学八年级下册
华东师大版_八年级_义务教育教科书·数学八年级下册_chunk_24,24,"箱子涂 黑 , 看看 你能 发现世 1 国语什么 ? 二二 十时 (2) 如果 把这 些涂 黑的 格子横向的 加数 用表示， 时一 纵向的 加数 用 y 表示 ,y 是 x 的函数 , 旗写 贿这 个函数关 Trenlrsares 系式 . 图 17. 1.2 (3) 当涂 黑的 格子横向的 加数 为 3 时 8 纵向前 加数 是多 少 ? 当纵向的 加数 为 6 时 ,横向的 加数 是多 少 ? G B 等腰 三角形项 角的 度数 y 是底 角度数 的函数 , 试写 出这 个函数关系式 ,并求 出自 变量 的下 值范围根据等 腰三 角形的 性质 和三 角形内 角和 宪理 , 可知 2x y 180， 有 y 180 2x. 由于 等腰 三角形的 底角 只能 是锐角 ,所以 自变 量的 取值 范围是 0 x 90. 第 1 二章 本数及 其图 象 . 31 致亲 受的 同学我 们的 小伙伴 ,欢迎俐 8 放在 你面前的 是核 据国 家中 长期 教育改革和 发展 规划纲要 (2010 一 2012 年 ) 》 与国家 《 义务 教育 数学课程标准 (20811L 年版 ) 为为 你们 提供的 初中阶段六 册数 学教科书 中的 第四 本 . 这本 书与 你已 经学 过的 三本数学 教科书 一样 ,从你 所熟悉的 情境和 人手, 呈现一 些最 基本的 丰富多 彩的 数学内 容 , 为你 提供皇 些让 你思考 .实践与 自主探索的 栏目 . 书中 还穿插了 一些 阅读材料 . 不同 层次的 习题 ;应用 性织 索性 和开放性 的各 种形式的 问题及 综合与 实践等 ,都为 你提供了 充分展示你 聪明才智号 数学 能办 的机 会 . 现在 ,请你 打开这 本书 , 与我 们全 起继续漫游数学世界 ,探索发 现更 多 ,更具 魅力 的数学奥秘 .",780,0.46622955555555545,medium-low,ocr,"箱子 涂 黑 , 看 看 你 能 发 现世 1 国语\n什么 ? 二 二- 十 时\n(2) 如 果 把 这 些 涂 黑 的 格子 横向 的 加 数 用 * 表示 ，“ 时 一\n纵向 的 加 数 用 y 表示 ,y 是 x 的 函数 , 旗 写 贿 这 个 函数 关 Trenlrsares\n系 式 . 图 17. 1.2\n(3) 当 涂 黑 的 格子 横向 的 加 数 为 3 时 8 纵向 前 加 数\n是 多 少 ? 当 纵向 的 加 数 为 6 时 ,横向 的 加 数 是 多 少 ?\nG@B 等 腰 三 角形 项 角 的 度数 y 是 底 角度 数 * 的\n函数 , 试 写 出 这 个 函数 关系 式 ,并 求 出 自 变 量 * 的 下 值\n范围\n根据 等 腰 三 角形 的 性 质 和 三 角形 内 角 和 宪\n理 , 可 知\n2x +y = 180，\n有 y = 180 - 2x.\n由 于 等 腰 三 角形 的 底 角 只 能 是 锐角 ,所 以 自 变 量 的\n取 值 范围 是 0 < x < 90.\n第 1 二 章 本数 及 其 图 象 . 31\n=== 第 111 页 ===\n致 亲 受 的 同学\n我 们 的 小 伙伴 ,欢迎 俐 8\n放 在 你 面前 的 是 核 据 & 国 家 中 长 期 教育 改革 和 发 展 规划 纲要 (2010 一 2012 年 ) 》 与 国家 《 义\n务 教 育 数学 课程 标准 (20811L 年 版 ) 为 为 你 们 提供 的 初中 阶段 六 册 数 学 教科 书 中 的 第 四 本 .\n这 本 书 与 你 已 经 学 过 的 三 本数 学 教科 书 一 样 ,从 你 所 熟悉 的 情境 和 人手, 呈现 一 些 最 基本\n的 丰富 多 彩 的 数学 内 容 , 为 你 提供 皇 些 让 你 思考 .实践 与 自主 探索 的 栏目 . 书 中 还 穿插 了 一 些\n阅读 材料 . 不 同 层次 的 习题 ;应 用 性 织 索 性 和 开放 性 的 各 种 形式 的 问题 及 综合 与 实践 等 ,都 为\n你 提供 了 充分 展示 你 聪明 才智 号 数 学 能 办 的 机 会 .\n现在 ,请 你 打开 这 本 书 , 与 我 们 全 起 继续 漫游 数学 世界 ,探索 发 现 更 多 ,更 具 魅 力 的 数学 奥秘 .",2.0,72.4659090909091,华东师大版_八年级_义务教育教科书·数学八年级下册,103,2025-07-21T14:24:55.862Z,2.0,义务教育教科书·数学八年级下册,/Users/LeoQin/Documents/GitHub/PDFconvertor/training_data/初中/数学/华东师大版-华东师范大学出版社/八年级/义务教育教科书·数学八年级下册.pdf,八年级,tesseract.js-parallel,unknown,0.8079710144927537,0.6,1,72.4659090909091,,,,true,true,,mathematics,下册,华东师大版_八年级_义务教育教科书·数学八年级下册.json,数学,176,初中_数学_华东师大版_八年级_义务教育教科书·数学八年级下册
华东师大版_八年级_义务教育教科书·数学八年级下册_chunk_25,25,"目 . 书中 还穿插了 一些 阅读材料 . 不同 层次的 习题 ;应用 性织 索性 和开放性 的各 种形式的 问题及 综合与 实践等 ,都为 你提供了 充分展示你 聪明才智号 数学 能办 的机 会 . 现在 ,请你 打开这 本书 , 与我 们全 起继续漫游数学世界 ,探索发 现更 多 ,更具 魅力 的数学奥秘 . 代数式 是你 早就 结识的 朋友 ,前面 我们 已经 误悉 了整 式及 其运算 ,并且 已经 在解 方程和 解不 等式 中派 了用 场 ,顺利地 解决了 不少 实际问 题分 式是 解决问题时 碰到 的又 一种 代数式， 同样需要我 们认识分 式的 性质 和运算 . 分式 与分 数在 许多方面有 着惊人的 相似 ,从中 你可 以进 一步 体会数学的 奥秘 ,学会 探索新 知识的 方法 . 我们 生活的 世界 ,处在 不停 的运动变化之 中 . 例如维 的身高随 着年 龄的 增长在 不断 变化， 气温随 着时 间的 推移而 变化为 了刻画现实世界的 运动变化 ,在数学上 引进了 变量和 郴数 ,使数学发 生了 根本的 转折函数及 其图 象 ""将把 你领 入寺 个新 的数学世界 ,提供解决许多实际问题的 工具和 方法 ,使你 在数学王国里 更加 自由地 针翔 . 实际生活中 充满着 各种 各样 的奇妙图 形 ,你见 过学 校 、 了等 单位的 伸缩大 门吗 ? 那里有 许多你 所认识的 几何图 形 . 平行 四边 形和 和矩形、 攻形 与正 广形 这两 章将 陪伴你 会见 一些 小学 里已 经认识的 老朋 友 ,你也 将结识一 些新 朋友 . 你将 通过探索 5 号亏 ; 对它们的 面瑶 特征有 更深刻的 理解 ,并将 进一步学 会演绎推理 ,解决一 些有 关图 形的 度量间 题",754,0.5600634806696863,medium-low,ocr,"目 . 书 中 还 穿插 了 一 些\n阅读 材料 . 不 同 层次 的 习题 ;应 用 性 织 索 性 和 开放 性 的 各 种 形式 的 问题 及 综合 与 实践 等 ,都 为\n你 提供 了 充分 展示 你 聪明 才智 号 数 学 能 办 的 机 会 .\n现在 ,请 你 打开 这 本 书 , 与 我 们 全 起 继续 漫游 数学 世界 ,探索 发 现 更 多 ,更 具 魅 力 的 数学 奥秘 .\n代数 式 是 你 早 就 结识 的 朋友 ,前 面 我 们 已 经 误 悉 了 整 式 及 其 运算 ,并 且 已 经 在 解 方程 和 解\n不 等 式 中 派 了 用 场 ,顺利 地 解决 了 不 少 实际 问 题 “ 分 式 ” 是 解决 问题 时 碰 到 的 又 一 种 代数 式 ，\n同样 需要 我 们 认识 分 式 的 性 质 和 运算 . 分 式 与 分 数 在 许多 方面 有 着 惊人 的 相似 ,从 中 你 可 以 进\n一 步 体会 数学 的 奥秘 ,学 会 探索 新 知识 的 方法 .\n我 们 生活 的 世界 ,处 在 不 停 的 运动 变化 之 中 . 例如 维 的 身高 随 着 年 龄 的 增长 在 不 断 变化 ，\n气温 随 着 时 间 的 推移 而 变化 …… 为 了 刻画 现实 世界 的 运动 变化 ,在 数学 上 引进 了 变量 ”和 ” 郴\n数 ” ,使 数学 发 生 了 根本 的 转折 “函数 及 其 图 象 ""将 把 你 领 入 寺 个 新 的 数学 世界 ,提供 解决 许多\n实际 问题 的 工具 和 方法 ,使 你 在 数学 王国 里 更 加 自由 地 针 翔 .\n实际 生活 中 充满 着 各 种 各 样 的 奇妙 图 形 ,你 见 过 学 校 、 了 /等 单位 的 伸缩 大 门 吗 ? 那里 有\n许多 你 所 认识 的 几何 图 形 .“ 平 行 四 边 形 ”和 “和 矩形、 攻 形 与 正 广 形 ”这 两 章 将 陪伴 你 会 见 一 些\n小 学 里 已 经 认识 的 老 朋 友 ,你 也 将 结识 一 些 新 朋友 . 你 将 通过 探索 5 号 亏 ; 对 它们 的 面 瑶 特征 有\n更 深刻 的 理解 ,并 将 进一步 学 会 演绎 推理 ,解决 一 些 有 关 图 形 的 度量 间 题",2.0,72.4659090909091,华东师大版_八年级_义务教育教科书·数学八年级下册,104,2025-07-21T14:24:55.862Z,2.0,义务教育教科书·数学八年级下册,/Users/LeoQin/Documents/GitHub/PDFconvertor/training_data/初中/数学/华东师大版-华东师范大学出版社/八年级/义务教育教科书·数学八年级下册.pdf,八年级,tesseract.js-parallel,unknown,0.930783242258652,0.5,1,72.4659090909091,,,,true,true,,physics,下册,华东师大版_八年级_义务教育教科书·数学八年级下册.json,数学,176,初中_数学_华东师大版_八年级_义务教育教科书·数学八年级下册
华东师大版_八年级_义务教育教科书·数学八年级下册_chunk_26,26,"8 时骑 自行车 从家 里出 ,4 末 ) 发到 野外郊游 ,16 时回 到家 里 . 他训 7 离家 的距离 ( 千米 ) 与时 间 !( 时 ) 之 3 闻的 函数美 系可 以用 图中 的折线表 示 s 根据 图象 回答 下列 问题 ; 10 (1)t 小李 到达 元家 最远 的地 方是 什么 时间 ? 机省 上红 时) (2) 小礁 何时 第多 休息 ? (第 6 题 ) (3) 11 时到 胞时 晤尘 骑了 多少 千米 ? (4) 返回时 ,小地 的平均车 速是 多少 ? 磺读 烤料 笛卡 儿的 故事直角坐标系 ,通常称 为笠 卡儿 直角 坐标 汰 s 官是 以法 国哲 学家 、 数学 家和 自然科学家 笛卡 害而 名的 . 4 笛卡 儿从 小就 喜爱沉思默 想 , 寻根 问底 . 他伍 肥和 亲很 懂得儿童教育法 ,针对这 一特点 , 常让 笛卡 儿随 自己的 心意去 学习 ,不加 任何限制 . 1612 年 , 笛卡 儿以 优异的 成绩 从中 学毕业 ,同年秋天 ,来到 普瓦 捷大 学攻读法 律 . 四年 以后 ,又以 优异和 的成 绩获 得学 位和 律师资格 . 当时 ,他对 学校 所学 知识的 贫乏已 经感到极 和有 厨烦 ,于是 ,他决定迈 开双 脚 ,去阅读世界这 本大 书 , 开始 了他 的军旅生活 . 簿卡 儿首先来 到荷兰有 一天 ,他看 见许多人 正盯 着城墙上 一块 矢示 牌子议 论纷 纷 . 笛卡 儿请 身旁 的一 位长 者把 告示上 的荷兰文 译成 法文 或拉丁苑 J 钳来， 这是 一道 数学 难题 , 谁要 是答 出来 ,就可 以得 到一 笔奖 金 ,还将 被授予 ""布雷达 数 42",721,0.3707597912779851,low,ocr,"8 时 骑 自行 车 从 家 里 出 ,4 末 )\n发 到 野外 郊游 ,16 时 回 到 家 里 . 他 训 -----------7\n离 家 的 距离 ( 千 米 ) 与 时 间 !( 时 ) 之 3 |\n闻 的 函数 美 系 可 以 用 图 中 的 折线 表 BEEE\n示 s 根 据 图 象 回 答 下 列 问题 ; 10 |\n(1)t 小 李 到 达 元 家 最 远 的 地 方 是 什 |\n么 时 间 ? 机 省 上 红 时)\n(2) 小 礁 何 时 第 -多 休 息 ? (第 6 题 )\n(3) 11 时 到 胞 时 晤 尘 骑 了 多 少 千 米 ?\n(4) 返回 时 ,小 地 的 平均 车 速 是 多 少 ?\nES = -\n磺 | 读 烤 料\n笛 卡 儿 的 故事\n直角 坐标 系 ,通常 称 为 笠 卡 儿 直 角 坐 标 汰 s 官 是\n以 法 国 哲 学 家 、 数 学 家 和 自然 科学 家 笛 卡 害 而 BFA\n名 的 . &4\n笛 卡 儿 从 小 就 喜爱 沉思 默 想 , 寻 根 问 底 . 他 伍 肥 和\n亲 很 懂得 儿童 教育 法 ,针对 这 一 特点 , 常 让 笛 卡 儿 随\n自己 的 心意 去 学 习 ,不 加 任何 限制 .\n1612 年 , 笛 卡 儿 以 优异 的 成 绩 从 中 学 毕业 ,同年\n秋天 ,来 到 普 瓦 捷 大 学 攻读 法 律 . 四 年 以 后 ,又 以 优异 和\n的 成 绩 获 得 学 位 和 律师 资格 . 当时 ,他 对 学 校 所 学 知识 的 贫乏 已 经 感到 极 和 有 厨\n烦 ,于 是 ,他 决定 迈 开 双 脚 ,去 阅读 世界 这 本 大 书 , 开 始 了 他 的 军旅 生活 .\n簿 卡 儿 首先 来 到 荷兰 有 一 天 ,他 看 见 许多 人 正 盯 着 城墙 上 一 块 矢 示 牌子 议\n论 纷 纷 . 笛 卡 儿 请 身 旁 的 一 位 长 者 把 告示 上 的 荷兰 文 译 成 法 文 或 拉丁 苑 J 钳 来 ，\n这 是 一 道 数 学 难题 , 谁 要 是 答 出 来 ,就 可 以 得 到 一 笔 奖 金 ,还 将 被 授予 ""布雷 达 数\n42\n=== 第 124 页 ===",2.0,72.4659090909091,华东师大版_八年级_义务教育教科书·数学八年级下册,117,2025-07-21T14:24:55.862Z,2.0,义务教育教科书·数学八年级下册,/Users/LeoQin/Documents/GitHub/PDFconvertor/training_data/初中/数学/华东师大版-华东师范大学出版社/八年级/义务教育教科书·数学八年级下册.pdf,八年级,tesseract.js-parallel,unknown,0.8390342052313883,0.5,1,72.4659090909091,,,,true,true,,mathematics,下册,华东师大版_八年级_义务教育教科书·数学八年级下册.json,数学,176,初中_数学_华东师大版_八年级_义务教育教科书·数学八年级下册
华东师大版_八年级_义务教育教科书·数学八年级下册_chunk_27,27,"来到 荷兰有 一天 ,他看 见许多人 正盯 着城墙上 一块 矢示 牌子议 论纷 纷 . 笛卡 儿请 身旁 的一 位长 者把 告示上 的荷兰文 译成 法文 或拉丁苑 J 钳来， 这是 一道 数学 难题 , 谁要 是答 出来 ,就可 以得 到一 笔奖 金 ,还将 被授予 ""布雷达 数 42 学家 的荣誉称号 . 两天 以后 , 笠卡 儿带 来了 正确的 解答 ,使那 位长 者大 为惊 诈 . 在交谈中 , 笛卡 儿才 知道 ,这位 长者 是当时颇 有名 气的 多特大学 校长贝克受 . 从 , 他俩 一起 讨论科学问题 ,贝克有 曼向 笛卡 儿介绍数学的 最新 进展 ,给了 他许多有 待研 范的 问题 . 笠卡 儿从 这次 成功 中看 到了 自己的 数学才能 , 激起 了钻研数学的 兴趣: FIL1621 年回 到巴黎 ,1628 年为 避开 俗事 而移居荷兰 ,专心从 事研究和 写作 ; 末 49 第应 瑞典女王克 丽斯 蒂娜 的邀请来 到斯 德哥 尔摩 任教 ,次年 因病 逝世 : 笛卡 玫首 先导从 运动 着的 点的 坐标概念 ,使用 代数的 方法研究几何 ,创立了 解析几何 ,使数学发 T 划时代的 变化 . 箭卡 儿的 变数 ""被革命导师恩格斯誉 为数学中 的转折点 嘴由 于笛 卡儿 揭哲 学和 数学思想影响日 益深 远 ,法国政府 在 1767 年将 他的 骨灰 迎回国内 ,在他 的墓碑下 铸刻 着笠 卡儿 , 欧洲 文艺 复兴以 来 ,第一 个为 人类 争取并 保证理性权利的 人 : 17.3 一次 函数 1. 一次 困数 小明 暑假 第一 次去 北京 . 汽车驶 上 4 地的 高速 公路 o 后 ,小明 观察 里程 碑 ,发现 汽车的 速度是 95 千米 时 . 已",750,0.49975845569620253,medium-low,ocr,"来 到 荷兰 有 一 天 ,他 看 见 许多 人 正 盯 着 城墙 上 一 块 矢 示 牌子 议\n论 纷 纷 . 笛 卡 儿 请 身 旁 的 一 位 长 者 把 告示 上 的 荷兰 文 译 成 法 文 或 拉丁 苑 J 钳 来 ，\n这 是 一 道 数 学 难题 , 谁 要 是 答 出 来 ,就 可 以 得 到 一 笔 奖 金 ,还 将 被 授予 ""布雷 达 数\n42\n=== 第 124 页 ===\n学 家 ”的 荣誉 称号 . 两 天 以 后 , 笠 卡 儿 带 来 了 正确 的 解答 ,使 那 位 长 者 大 为 惊 诈 .\n在 交谈 中 , 笛 卡 儿 才 知道 ,这 位 长 者 是 当时 颇 有 名 气 的 多 特大 学 校长 贝克 受 . 从\n, 他 俩 一 起 讨论 科学 问题 ,贝克 有 曼 向 笛 卡 儿 介绍 数学 的 最 新 进展 ,给 了 他 许多\n有 待 研 范 的 问题 . 笠 卡 儿 从 这 次 成 功 中 看 到 了 自己 的 数学 才能 , 激 起 了 钻研 数学\n的 兴趣:\n&FIL1621 年 回 到 巴黎 ,1628 年 为 避 开 俗 事 而 移居 荷兰 ,专心 从 事 研究 和\n写作 ; 末 49 第 应 瑞典 女王 克 丽 斯 蒂 娜 的 邀请 来 到 斯 德 哥 尔 摩 任教 ,次 年 因 病\n逝世 :\n笛 卡 玫 首 先导 从 运 动 着 的 点 的 坐标 概念 ,使 用 代数 的 方法 研究 几何 ,创立 了\n解析 几何 ,使 数学 发 & T 划时代 的 变化 .“ 箭 卡 儿 的 变数 ""被 革命 导师 恩格斯 誉\n为 “数学 中 的 转折 点 嘴\n由 于 笛 卡 儿 揭 哲 学 和 数学 思想 影响 日 益 深 远 ,法 国政 府 在 1767 年 将 他 的 骨\n灰 迎 回国 内 ,在 他 的 墓碑 下 铸 刻 着 笠 卡 儿 , 欧 洲 文 艺 复兴 以 来 ,第 一 个 为 人 类\n争取 并 保证 理性 权利 的 人 :\n|17.3 一 次 函数\n1. 一 次 困 数 |\n小 明 暑 假 第 一 次 去 北京 . 汽车 驶 上 4 地 的 高 速 公 路 o\n后 ,小 明 观 察 里 程 碑 ,发 现 汽车 的 速度 是 95 千 米 / 时 . 已",2.0,72.4659090909091,华东师大版_八年级_义务教育教科书·数学八年级下册,118,2025-07-21T14:24:55.862Z,2.0,义务教育教科书·数学八年级下册,/Users/LeoQin/Documents/GitHub/PDFconvertor/training_data/初中/数学/华东师大版-华东师范大学出版社/八年级/义务教育教科书·数学八年级下册.pdf,八年级,tesseract.js-parallel,unknown,0.8689138576779026,0.6,1,72.4659090909091,true,,,true,,,physics,下册,华东师大版_八年级_义务教育教科书·数学八年级下册.json,数学,176,初中_数学_华东师大版_八年级_义务教育教科书·数学八年级下册
