Chunk_ID,Chunk_Index,Content,Content_Length,Quality_Score,Reliability,Source_Type,Original_Content,Enhancement_Version,averageConfidence,book_name,chunkIndex,enhancementTimestamp,enhancementVersion,fileName,filePath,grade,ocrMethod,publisher,qualityMetrics_chineseCharRatio,qualityMetrics_coherenceScore,qualityMetrics_lengthScore,qualityMetrics_ocrConfidence,semanticFeatures_hasDefinition,semanticFeatures_hasExperiment,semanticFeatures_hasFormulas,semanticFeatures_hasNumbers,semanticFeatures_hasQuestion,semanticFeatures_isTableContent,semanticFeatures_subjectArea,semester,source_file,subject,totalPages,uniqueId
华东师大版_九年级_义务教育教科书·数学九年级下册_chunk_0,0,"58 wmx JsaNgA pa n8 (香烟浸出液 一 :2 支香 烟浸 于 200 ml 水 ;香烟浸出液 二 :3 支香烟浸 于 200 ml 水 ;香烟浸出液 三 :4 支香烟溉 工 200 ml 水 ) 据此 ,你估计香烟浸出液 浓度对 绿豆和 赤豆 种子 的出 芽率 有怎样的 影响如 果再 重复这 个实验 4 实验数据是 否可 能与 表 28. 3. 1 所示 的不 一致 为耶 一般 地研究香烟浸出液 浓度 对于 种子 萌芽的 影响号 是千 需要选取一 些其 他种 子做 类似 的实验 ?如果有 兴趣， 请动手做 一做 ,再与 同学一 起讨论你 们各 自获 得的 数据 和结论， 94 .第 2 章样本与 总体 肋一 家冷饮厂 在电视里 做广告 ,说他 们厂 生产 的雪 薰在 小木 棍上 印有 四种 图案 , 集齐 四根 印有 不同 图案 的小 木棍 就能 够拼 成一 幅图 , 任此 可以 在指定的 商店领取全 : 份奖品 . 假设该 三准备的 印有 四种 图案 的小 木棍 一样 多 ,而且 每支 雪糕中 夹入 印有 哪种 图案 的小 木棍 也完全是 随机的 5 汕尾 ,平均要 买多 少支 雪糕才能得 奖呢 ? 《2 中如果幸运 ,也许 买 4 支就 能够 得奖 ,但也 有可 能要 买 20 Z2 XAGH. 那么平均要 买多 少支 才能得 奖呢 ? 在四 张同 样的 少纸 条后 分别 写上 1、2、3 、4 ,代表印 有这 四种 图案 的小 本棍 ,随机抽出 1 张 ,记录下 每次 抽到 的数字 ,直到四 个数字都 出现 ; 就算 完成 了一 次游戏 , 即集 齐了 四根 印有 不同 图案 的湖 术棍 . 记录下 本次 游戏中 抽签的 总次 数 , 它代 表本 次中 奖共 买了 多少 支雪 粕 . 表",768,0.4290455838020247,medium-low,ocr,"| 58\n| wmx JsaNgA\pa | n8\n(香烟 浸出 液 一 :2 支 香 烟 浸 于 200 ml 水 ;香烟 浸出 液 二 :3\n支 香烟 浸 于 200 ml 水 ;香烟 浸出 液 三 :4 支 香烟 溉 工 200 ml 水 )\n据 此 ,你 估计 香烟 浸出 液 浓度 对 绿豆 和 赤 豆 种 子\n的 出 芽 率 有 怎样 的 影响 ”如 果 再 重复 这 个 实验 4 实验\n数据 是 否 可 能 与 表 28. 3. 1 所 示 的 不 一 致 为 耶 一 般\n地 研究 “香烟 浸出 液 浓 度 对 于 种 子 萌芽 的 影响 号 是 千\n需要 选取 一 些 其 他 种 子 做 类 似 的 实验 ?如果 有 兴趣 ，\n请 动手 做 一 做 ,再 与 同学 一 起 讨论 你 们 各 自 获 得 的 数\n据 和 结论 ，\n94 .第 2 章 样本 与 总 体\n=== 第 4 页 ===\n@ 肋 ”一 家 冷饮 厂 在 电视 里 做 广告 ,说 他 们 厂 生 产\n的 雪 薰 在 小 木 棍 上 印 有 四 种 图 案 , 集 齐 四 根 印 有 不 同 图\n案 的 小 木 棍 就 能 够 拼 成 一 幅 图 , 任 此 可 以 在 指定 的 商店\n领取 全 : 份 奖品 . 假设 该 三 准备 的 印 有 四 种 图 案 的 小 木 棍\n一 样 多 ,而 且 每 支 雪糕 中 夹 入 印 有 哪 种 图 案 的 小 木 棍 也\n完全 是 随机 的 5 汕尾 ,平均 要 买 多 少 支 雪糕 才能 得 奖 呢 ?\n《2 中 “如果 幸运 ,也 许 买 4 支 就 能 够 得 奖 ,但 也 有\n可 能 要 买 20 Z2 XAGH. 那么 平均 要 买 多 少 支 才能 得\n奖 呢 ?\n在 四 张 同 样 的 少 纸 条 后 分 别 写 上 1、2、3 、4 ,代表 印\n有 这 四 种 图 案 的 小 本 棍 ,随机 抽出 1 张 ,记录 下 每 次 抽 到\n的 数字 ,直到 四 个 数字 都 出 现 ; 就 算 完 成 了 一 次 游戏 , 即\n集 齐 了 四 根 印 有 不 同 图 案 的 湖 术 棍 . 记录 下 本 次 游戏 中\n抽签 的 总 次 数 , 它 代 表 本 次 中 奖 共 买 了 多 少 支 雪 粕 . 表",2.0,71.02362204724409,华东师大版_九年级_义务教育教科书·数学九年级下册,2,2025-07-21T14:24:55.891Z,2.0,义务教育教科书·数学九年级下册,/Users/LeoQin/Documents/GitHub/PDFconvertor/training_data/初中/数学/华东师大版-华东师范大学出版社/九年级/义务教育教科书·数学九年级下册.pdf,九年级,tesseract.js-parallel,unknown,0.8210332103321033,0.6,1,71.02362204724409,,true,,true,true,,unknown,下册,华东师大版_九年级_义务教育教科书·数学九年级下册.json,数学,127,初中_数学_华东师大版_九年级_义务教育教科书·数学九年级下册
华东师大版_九年级_义务教育教科书·数学九年级下册_chunk_1,1,"的平均预期寿命约 为 66 岁 , 而女性人 局的 平均预期寿命约 为 70 岁 ;2000 年中 国男 性人 辐的 平才 预期 寿命约 为 70 岁 , 而女性人 口的 平均预 期寿命约 为 273 岁 . 因此 ,女性的 预期寿命比 男性长 一些 . 啊时 ,2000 年中 国人口 的预期寿命比 1990 年长 一此 . 除些 之外 ,我们 也可 以利用统计图 使数据变 得更 加直观 . 图 28. 3. 世是 根据 1990 年中 国各 地区 人口 平均 预期 寿命绘制的 , 横轴 刻度表示男性预期寿命 , 纵轴 刻度 则表示女性预期寿命 ,不同 的点 代表不 同的 地区 . 1 2 通过这 种由 辽离散的 点所 组成 的统计图 , 即散 点如 .小图 ,往往可 以直观加 地看 出两 组数据 Le 之间 是否 存在关 5 过联 关系 . 六 Licw 由图 28. 3. 1 1990 年中 国各 地区 男女人 口平 均预 期过 命 98 . 第 28 章样本与 总体 丰根据表 28. 3. 3 , 找一 找 ,图 28. 3. 1 中哪个点 代表 1990 年北京的 男性女性平均预期寿命 ? 2 图申 的点 藉多 数都 落在 一条 直线附近的 狭长带 形区 域内这 条直线的 意义是 什么 ? 3， 如果 茶地 区 1990 年男性平均预期寿命为 64 岁， 请你 根据图 28. 3. 1 推肠 该地 区的 女性平均预期寿命大 约为 多少 岁 ? 4 如果 在图 2853.J5 中用 不同 颜色增加 2000 年的 数据点 , 想一 想 , 新增 数据点和 原有 数据点 之间 会有 怎样的 位置 关系 ? 在图 上标 出 2000 年的 数据点 ,检验一 下你 的猜想 .",750,0.3875951357343869,low,ocr,"的 平均 预期 寿命 约 为 66 岁 , 而\n女性 人 局 的 平均 预期 寿命 约 为 70 岁 ;2000 年 中 国 男 性\n人 辐 的 平 才 预 期 寿命 约 为 70 岁 , 而 女性 人 口 的 平均 预\n期 寿命 约 为 273 岁 . 因此 ,女性 的 预期 寿命 比 男性 长 一\n些 . 啊 时 ,2000 年 中 国人 口 的 预期 寿命 比 1990 年 长\n一 此 .\n除 些 之 外 ,我 们 也 可 以 利用 统计 图 使 数据 变 得 更 加\n直观 . 图 28. 3. 世 是 根据 1990 年 中 国 各 地 区 人 口 平 均 预\n期 寿命 绘制 的 , 横 轴 刻度 表示 男性 预期 寿命 , 纵 轴 刻 度 则\n表示 女性 预期 寿命 ,不 同 的 点 代表 不 同 的 地 区 .\n1 2\n通过 这 种 由 辽\n离散 的 点 所 组 成 AZ\n的 统计 图 , 即 散 点 如 .小\n图 ,往往 可 以 直观 加\n地 看 出 两 组 数据 Le\n之 间 是 否 存在 关 #5 过\n联 关系 . 六 LA\n=\nLicw 由\n图 28. 3. 1 1990 年 中 国 各 地 区 男女 人 口 平 均 预 期 过 命\n98 . 第 28 章 “样本 与 总 体\n=== 第 8 页 ===\n丰 根据 表 28. 3. 3 , 找 一 找 ,图 28. 3. 1 中 哪个 点 代表\n1990 年 北京 的 男性 女性 平均 预期 寿命 ?\n2 图 申 的 点 藉 多 数 都 落 在 一 条 直线 附近 的 狭长 带\n形 区 域内 $ 这 条 直线 的 意义 是 什么 ?\n3， 如 果 茶 地 区 1990 年 男性 平均 预期 寿命 为 64 岁 ，\n请 你 根据 图 28. 3. 1 推 肠 该 地 区 的 女性 平均 预期 寿命 大\n约 为 多 少 岁 ?\n4 如 果 在 图 2853.J5 中 用 不 同 颜色 增加 2000 年 的 数\n据点 , 想 一 想 , 新 增 数 据点 和 原 有 数据 点 之 间 会 有 怎样 的 位\n置 关 系 ? 在 图 上 标 出 2000 年 的 数据 点 ,检验 一 下 你 的 猜想 .",2.0,71.02362204724409,华东师大版_九年级_义务教育教科书·数学九年级下册,6,2025-07-21T14:24:55.891Z,2.0,义务教育教科书·数学九年级下册,/Users/LeoQin/Documents/GitHub/PDFconvertor/training_data/初中/数学/华东师大版-华东师范大学出版社/九年级/义务教育教科书·数学九年级下册.pdf,九年级,tesseract.js-parallel,unknown,0.7579143389199255,0.6,1,71.02362204724409,,,,true,true,,mathematics,下册,华东师大版_九年级_义务教育教科书·数学九年级下册.json,数学,127,初中_数学_华东师大版_九年级_义务教育教科书·数学九年级下册
华东师大版_九年级_义务教育教科书·数学九年级下册_chunk_2,2,"岁， 请你 根据图 28. 3. 1 推肠 该地 区的 女性平均预期寿命大 约为 多少 岁 ? 4 如果 在图 2853.J5 中用 不同 颜色增加 2000 年的 数据点 , 想一 想 , 新增 数据点和 原有 数据点 之间 会有 怎样的 位置 关系 ? 在图 上标 出 2000 年的 数据点 ,检验一 下你 的猜想 . 请每 位同学分 别测量自己的 霖高 和两 人臂 左右平 伸时 两手中指 指尖 之间 的距离 ,并解决以 下问题 : (1) 仿照表 28. 3. 3 设计一 张统计表 , 记录 来自 全班 同学的 数据 . (2) 根据数据表 绘制 散点 图 . (3) 观察图 表 , 你有 哪些发 现 ? (4) 如果 已知 一个 人两 臂左 右平 伸时 两手中指 指尖 之间 的距离 ,你能 估计出 他的 身高吗 ? 2. 容易误导读者的 统计图 简洁的 统计表 和形象的 统计图 可以 在决策过 程中 帮助我 们得 到很 多有 用的 信息 ,比如 ,最小 值和 最大 值是 什么 ,发展 变化的 趋势和 快慢程度如 何 , 等等 . 不过 ,形象的 统计图 如果 画得 不规范也 会给 人留 下不 真实的 印象 . 这里 ,我们 提醒大 家注意几 种容易误导读 者的 统计图 . 第 28 章样本与 总体 . 99 问题 1 一则 广告说 : 据调 查 ,使用 本广 牙膏 可以 使性 牙率 减少 20 ,并以 图 28. 3. 2 示意其 调查得 到的 数据 . os S1 0 . a 亲王 1 s N 图 28. 3.2 你觉得这 样的 统计图 会给 人留 下怎样的 印象 ? GTp 我们 注意到 如图 28. 3. 2 所示 的条 形图 的纵 轴是 从 30 5 开始 的 ,这样 使左边条 形的 高度 等于 右边条",772,0.3968039032620921,low,ocr,"岁 ，\n请 你 根据 图 28. 3. 1 推 肠 该 地 区 的 女性 平均 预期 寿命 大\n约 为 多 少 岁 ?\n4 如 果 在 图 2853.J5 中 用 不 同 颜色 增加 2000 年 的 数\n据点 , 想 一 想 , 新 增 数 据点 和 原 有 数据 点 之 间 会 有 怎样 的 位\n置 关 系 ? 在 图 上 标 出 2000 年 的 数据 点 ,检验 一 下 你 的 猜想 .\n请 每 位 同学 分 别 测量 自己 的 霖 高 和 两 人 臂 左右 平 伸 时 两 手中 指 指 尖 之\n间 的 距离 ,并 解决 以 下 问题 :\n(1) 仿照 表 28. 3. 3 设计 一 张 统计 表 , 记 录 来 自 全 班 同学 的 数据 .\n(2) 根据 数据 表 绘 制 散 点 图 .\n(3) 观察 图 表 , 你 有 哪些 发 现 ?\n(4) 如 果 已 知 一 个 人 两 臂 左 右 平 伸 时 两 手中 指 指 尖 之 间 的 距离 ,你\n能 估计 出 他 的 身高 吗 ?\n2. 容易 误导 读者 的 统计 图 |\n简洁 的 统计 表 和 形象 的 统计 图 可 以 在 决策 过 程 中\n帮助 我 们 得 到 很 多 有 用 的 信息 ,比如 ,最 小 值 和 最 大 值 是\n什么 ,发 展 变化 的 趋势 和 快慢 程度 如 何 , 等 等 .\n不 过 ,形象 的 统计 图 如 果 画 得 不 规范 也 会 给 人 留 下\n不 真实 的 印象 . 这 里 ,我 们 提醒 大 家 注意 几 种 容易 误导 读\n者 的 统计 图 .\n第 28 章 ”样本 与 总 体 . 99\n=== 第 9 页 ===\n问题 1\n一 则 广告 说 : 据 调 查 ,使 用 本 广 牙 膏 可 以 使 性 牙 率 减\n少 20% ,并 以 图 28. 3. 2 示意 其 调查 得 到 的 数据 .\nos\nS1\n0\n. a\n亲王--…1 s THA N\n图 28. 3.2\n你 觉得 这 样 的 统计 图 会 给 人 留 下 怎样 的 印象 ?\nGTp 我 们 注意 到 如 图 28. 3. 2 所 示 的 条 形 图 的 纵\n轴 是 从 30%5 开 始 的 ,这 样 使 左边 条 形 的 高 度 等 于 右边 条",2.0,71.02362204724409,华东师大版_九年级_义务教育教科书·数学九年级下册,7,2025-07-21T14:24:55.891Z,2.0,义务教育教科书·数学九年级下册,/Users/LeoQin/Documents/GitHub/PDFconvertor/training_data/初中/数学/华东师大版-华东师范大学出版社/九年级/义务教育教科书·数学九年级下册.pdf,九年级,tesseract.js-parallel,unknown,0.7874306839186691,0.5,1,71.02362204724409,,true,,true,true,,mathematics,下册,华东师大版_九年级_义务教育教科书·数学九年级下册.json,数学,127,初中_数学_华东师大版_九年级_义务教育教科书·数学九年级下册
华东师大版_九年级_义务教育教科书·数学九年级下册_chunk_3,3,"第一 个西 一幅 恰当的 统正方体 的 2 倍 ; 但从 体积上 看 , 却是 2 倍 . 这样 就会 使读 Usiad 者产生错误的 印象 ,以为 2011 年丁丁收藏的 邮票比 2010 年多 了很 多 .所以 这样 的统计图 不合适 . 习题 28. 3 1. 请在 报纸 .杂志上 找一 些统计图 ,判别它们是 香规 水 2. 期末 考试 前 ,老师想 了解 一下 同学们 的学 习情 部 ,组组 可一 次测试 ,满分 10 分 . 4 、 孔两 班的 成绩 如图 所示 ( 例如 :4 班中 成绩 为 46 分的 同党 有 6 名 ,8 班中 成绩 为 6 分的 同学有 2 名 ). 你觉得从 测验成 绩中 老师可 以得 吊哪 些结论 ? 成引 9 三 5 L_L 1 上 L_ 如 024681I01214161820222426 人数 (第 2 题 ) 102 .第 28 章样本与 总体 3. 下表 列出 的是 某地 三种 长途 电话 业务的 收费办 法 ,如果 某人 某日 21:45 之前 必须要 拨打一 个 5 分钟 左右的 内地 长途 电话 ,请为 他推荐一 个最 经济 的服务 . 如果 他要 拨打的 是一 个 30 分钟 左右的 内地 长途 电话 ,你还 推荐这 种服务吗 ? 为什么 ? Ez 区 1 ix ix 了三 20200200 5 (市话 收费标准汶 咱次 3 分钟 0. 20 元 ,以后 每增加 1 分钟 话费增加 0. 10 元 ) 4. 近年来 ,由于 乱砍 得伐 ,我国 长汪 黄河流域植被遭 到破坏 ,土地沙化严重 , 洪洲 灾害时 有发 生 . 某地 医为 积极啊 应和 支持保护母亲河 的倡议 ,建造了 长 100 km 宽 0.5 km 的防 搞林 . 有关 部门 为统计这 一防护林 共有 多少 棵树 ,从中 选",787,0.34896850393700785,low,ocr,"第 一 个\n西 一 幅 恰当 的 统 正方 体 的 2 倍 ; 但 从 体积 上 看 , 却 是 2 倍 . 这 样 就 会 使 读\nUsiad] 者 产生 错误 的 印象 ,以 为 2011 年 丁丁 收藏 的 邮票 比\n2010 年 多 了 很 多 .所 以 这 样 的 统计 图 不 合适 .\n习题 28. 3\n1. 请 在 报纸 .杂志 上 找 一 些 统计 图 ,判别 它们 是 香 规 水\n2. 期 末 考 试 前 ,老师 想 了 解 一 下 同学 们 的 学 习 情 部 ,组 组 可 一 次 测试 ,满分 10 分 .\n4 、 孔 两 班 的 成 绩 如 图 所 示 ( 例 如 :4 班 中 成 绩 为 46 分 的 同 党 有 6 名 ,8 班 中 成 绩\n为 6 分 的 同学 有 2 名 ). 你 觉得 从 测验 成 绩 中 老师 可 以 得 吊 哪 些 结论 ?\n成 引 9\n三\n5 L_L |\n=\n=\n1 上 L_ |\n如 |\n024681I01214161820222426 人 数\n(第 2 题 )\n102 .第 28 章 样本 与 总 体\n=== 第 12 页 ===\n3. 下 表 列 出 的 是 某 地 三 种 长 途 电 话 业务 的 收费 办 法 ,如 果 某 人 某 日 21:45 之 前 必须\n要 拨打 一 个 5 分 钟 左右 的 内 地 长 途 电话 ,请 为 他 推荐 一 个 最 经 济 的 服务 . 如 果 他 要\n拨打 的 是 一 个 30 分 钟 左右 的 内 地 长 途 电话 ,你 还 推荐 这 种 服务 吗 ? 为 什么 ?\nEz 区\n1 ix\nix\n了 HT\n三 20200200\n5 EEC\n(市 话 收费 标准 汶 咱 次 3 分 钟 0. 20 元 ,以 后 每 增加 1 分 钟 话费 增加 0. 10 元 )\n4. 近年 来 ,由 于 乱 砍 得 伐 ,我 国 长 汪 黄河 流域 植被 遭 到 破坏 ,土地 沙化 严重 , 洪 洲\n灾害 时 有 发 生 . 某 地 医 为 积极 啊 应 和 支持 “保护 母亲 河 ” 的 倡议 ,建造 了 长\n100 km 宽 0.5 km 的 防 搞 林 . 有 关 部 门 为 统计 这 一 防护 林 共 有 多 少 棵 树 ,从 中 选",2.0,71.02362204724409,华东师大版_九年级_义务教育教科书·数学九年级下册,10,2025-07-21T14:24:55.891Z,2.0,义务教育教科书·数学九年级下册,/Users/LeoQin/Documents/GitHub/PDFconvertor/training_data/初中/数学/华东师大版-华东师范大学出版社/九年级/义务教育教科书·数学九年级下册.pdf,九年级,tesseract.js-parallel,unknown,0.7132486388384754,0.5,1,71.02362204724409,,true,,true,true,,mathematics,下册,华东师大版_九年级_义务教育教科书·数学九年级下册.json,数学,127,初中_数学_华东师大版_九年级_义务教育教科书·数学九年级下册
华东师大版_九年级_义务教育教科书·数学九年级下册_chunk_4,4,"费增加 0. 10 元 ) 4. 近年来 ,由于 乱砍 得伐 ,我国 长汪 黄河流域植被遭 到破坏 ,土地沙化严重 , 洪洲 灾害时 有发 生 . 某地 医为 积极啊 应和 支持保护母亲河 的倡议 ,建造了 长 100 km 宽 0.5 km 的防 搞林 . 有关 部门 为统计这 一防护林 共有 多少 棵树 ,从中 选出 10 块防护林 ( 每块 长 Tikn 宽 0. 5 km) 进行统计 ,每块 防护林的 树木数量如 下 :( 单位 : 棵 ) 65 100,， 63200, 64 600, 64 700, 67 300, 63 300, 65 100, 66 600, 62 800, 65 500. 请你 根据以 上数据估算这 一防护林 息共 约有 多少 棵树 . (结果保留到 万棵 ) 区下 了 5 (第 4 题 ) 5. 下表 数据 来自 2010 年 4 中国统计年 鉴 》, 给出 了我 国不 同年份 的人 均水 果产 量 (单位 :kg). 请用 恰当的 统计图 表示这 组数据 ,并据 此估计 2010 年我 国灾 均水 果产 量 . 丽 Ta 第 28 章， 样本 与总 体 103 一加深类 于次 函数的 图象 与性 质上 三确 所提 让的 两个 问题 ,都归结为 有关 二次 函数的 问题 . 为了 解决这 类问题 ,需要研究二 次函数的 性质 在研究次 函背 到简 借助图 象了 解了 一次 函数的 性质 . 对二 次函数的 征完 我们 也从 图象 人手 . 1 二次 困数 yaxt 的图 旨与 性质 我们 知道 ,一次 函数的 图象 是 : 系直 线 . 那么 ,二次 函数的 图象 是什么它 有伟人么 转点 ? 友映 了二 次函数的 哪些性 质 ? 让我 们先 来研究最 简单的 三活 亢散 y or 的图 旬与 性质 .",782,0.3374457619268179,low,ocr,"费 增加 0. 10 元 )\n4. 近年 来 ,由 于 乱 砍 得 伐 ,我 国 长 汪 黄河 流域 植被 遭 到 破坏 ,土地 沙化 严重 , 洪 洲\n灾害 时 有 发 生 . 某 地 医 为 积极 啊 应 和 支持 “保护 母亲 河 ” 的 倡议 ,建造 了 长\n100 km 宽 0.5 km 的 防 搞 林 . 有 关 部 门 为 统计 这 一 防护 林 共 有 多 少 棵 树 ,从 中 选\n出 10 块 防护 林 ( 每 块 长 Tikn 宽 0. 5 km) 进行 统计 ,每 块 防 护林 的 树木 数量 如\n下 :( 单 位 : 棵 )\n65 100,， 63200, 64 600, 64 700, 67 300,\n63 300, 65 100, 66 600, 62 800, 65 500.\n请 你 根据 以 上 数据 估算 这 一 防护 林 息 共 约 有 多 少 棵 树 . (结果 保留 到 万 棵 )\n区 下\n了 | &\n5 VRN\n- (第 4 题 )\n5. 下 表 数 据 来 自 2010 年 4 中国 统计 年 鉴 》, 给 出 了 我 国 不 同年 份 的 人 均 水 果 产 量\n(单位 :kg). 请 用 恰当 的 统计 图 表示 这 组 数据 ,并 据 此 估计 2010 年 我 国 灾 均 水\n果 产 量 .\n丽 Ta\nCT\n第 28 章 ， 样 本 与 总 体 103\n=== 第 13 页 ===\n一 加深 类\n于 次 函数 的 图 象 与 性 质\n上 三 确 所 提 让 的 两 个 问题 ,都 归结 为 有 关 二 次 函数\n的 问题 . 为 了 解决 这 类 问题 ,需要 研究 二 次 函数 的 性 质\n在 研究 -次 函 背 到 $ 简 借助 图 象 了 解 了 一 次 函数 的\n性 质 . 对 二 次 函数 的 征 完 \ 我 们 也 从 图 象 人 手 .\n1 二 次 困 数 yaxt 的 图 旨 与 性 质 |\n我 们 知道 ,一 次 函数 的 图 象 是 : 系 直 线 . 那么 ,二 次\n函数 的 图 象 是 什么 ” 它 有 伟人 么 转 点 ? 友 映 了 二 次 函数 的\n哪些 性 质 ?\n让 我 们 先 来 研究 最 简单 的 三 活 亢 散 y = or 的 图 旬\n与 性 质 .",2.0,71.02362204724409,华东师大版_九年级_义务教育教科书·数学九年级下册,11,2025-07-21T14:24:55.891Z,2.0,义务教育教科书·数学九年级下册,/Users/LeoQin/Documents/GitHub/PDFconvertor/training_data/初中/数学/华东师大版-华东师范大学出版社/九年级/义务教育教科书·数学九年级下册.pdf,九年级,tesseract.js-parallel,unknown,0.7101449275362319,0.5,1,71.02362204724409,,,,true,true,,mathematics,下册,华东师大版_九年级_义务教育教科书·数学九年级下册.json,数学,127,初中_数学_华东师大版_九年级_义务教育教科书·数学九年级下册
华东师大版_九年级_义务教育教科书·数学九年级下册_chunk_5,5,"的征 完我 们也 从图 象人 手 . 1 二次 困数 yaxt 的图 旨与 性质 我们 知道 ,一次 函数的 图象 是 : 系直 线 . 那么 ,二次 函数的 图象 是什么它 有伟人么 转点 ? 友映 了二 次函数的 哪些性 质 ? 让我 们先 来研究最 简单的 三活 亢散 y or 的图 旬与 性质 . 《ED 夯出 二次 函数 y 的图 旨 D . y Jofefifolr N 在平面直角坐标系 中描 点 , 然， 后用 光滑的 曲线顺 次连结各 点 , 得 ? 这个 两歼 的到 函数 y 呈的 图象 , 如图 26. 2. 1， 困旬 有种 么特点 ? 所示 . 这样 的曲线通常叫做抛物线 (parmabola). 它是 轴对 称图 形 ,y 轴是 它的 对称 轴 , 抛物 线与 它的 对称 轴 TO 的交点叫做抛物线 的顶点 (vertex)， 图 26.2 1 第 26 章二 次函数 . 5 一 、 知识 结构计 总体 二 、 要点 1. 当我 们所 要考察的 对象 多得 数不胜数的 时候 , 当我 们的 考察会 给考察对 象带 来损伤破坏的 时便 ; 当我 们的 考察经 费和 时间 都非常有 限的 时候 ,抽样调查方法就 发挥 出其 独特的 作用了 . 简单随机抽样方 法是 一种 很重要的 数学方法 , 它鸽 每余 个体 都有 相等的 机会 被选 和人 样本 . 2. 通过本 章的 学习 ,我们 体会到 抽样调查是 一种 可以 信赖的 方法 ,并看 到当 样本 足够大 且有 较好 的代表性 时 ,样本的 平均数 .方差与 总体 的平均数 方差可 以很 接近 :所以 ;我们 可以 用样本估计总 体 . 3. 我们 感受到 数据分 析对 于决策的 重要性 . 我们 应该 在进行决策",757,0.36381253292453486,low,ocr,"的 征 完 \ 我 们 也 从 图 象 人 手 .\n1 二 次 困 数 yaxt 的 图 旨 与 性 质 |\n我 们 知道 ,一 次 函数 的 图 象 是 : 系 直 线 . 那么 ,二 次\n函数 的 图 象 是 什么 ” 它 有 伟人 么 转 点 ? 友 映 了 二 次 函数 的\n哪些 性 质 ?\n让 我 们 先 来 研究 最 简单 的 三 活 亢 散 y = or 的 图 旬\n与 性 质 .\n《ED 夯 出 二 次 函数 y = 的 图 旨\n@D %.\ny [~Jofefifolr]«[N »\n在 平面 直角 坐标 系 中 描 点 , 然 ，\n后 用 光滑 的 曲线 顺 次 连结 各 点 , 得 ? 这 个 两 歼 的\n到 函数 y -= 呈 的 图 象 , 如 图 26. 2. 1 ， 困 旬 有 种 么 特点 ?\n所 示 . -\n这 样 的 曲线 通常 叫做 抛物 线\n(parmabola). 它 是 轴 对 称 图 形 ,y 轴 是\n它 的 对 称 轴 , 抛 物 线 与 它 的 对 称 轴 “TO\n的 交点 叫做 抛物 线 的 顶点 (vertex)， 图 26.2 1\n第 26 章 ”二 次 函数 . 5\n=== 第 14 页 ===\n一 、 知 识 结构\nCE\n计 总 体\n二 、 要 点\n1. 当 我 们 所 要 考察 的 对 象 多 得 数不胜数 的 时 候 , 当 我 们 的 考察 会\n给 考察 对 象 带 来 损伤 破坏 的 时 便 ; 当 我 们 的 考察 经 费 和 时 间 都 非常 有\n限 的 时 候 ,抽样 调查 方法 就 发 挥 出 其 独特 的 作用 了 . 简单 随机 抽样 方\n法 是 一 种 很 重要 的 数学 方法 , 它 鸽 每 余 个 体 都 有 相等 的 机 会 被 选 和 人\n样本 .\n2. 通过 本 章 的 学 习 ,我 们 体会 到 抽样 调查 是 一 种 可 以 信赖 的 方\n法 ,并 看 到 当 样 本 足够 大 且 有 较 好 的 代表 性 时 ,样本 的 平均 数 .方差\n与 总 体 的 平均 数 方差 可 以 很 接近 :所 以 ;我 们 可 以 用 样本 估计\n总 体 .\n3. 我 们 感受 到 数据 分 析 对 于 决策 的 重要 性 . 我 们 应 该 在 进行 决策",2.0,71.02362204724409,华东师大版_九年级_义务教育教科书·数学九年级下册,12,2025-07-21T14:24:55.891Z,2.0,义务教育教科书·数学九年级下册,/Users/LeoQin/Documents/GitHub/PDFconvertor/training_data/初中/数学/华东师大版-华东师范大学出版社/九年级/义务教育教科书·数学九年级下册.pdf,九年级,tesseract.js-parallel,unknown,0.8018691588785046,0.5,1,71.02362204724409,true,,,true,true,,mathematics,下册,华东师大版_九年级_义务教育教科书·数学九年级下册.json,数学,127,初中_数学_华东师大版_九年级_义务教育教科书·数学九年级下册
