Chunk_ID,Chunk_Index,Content,Content_Length,Quality_Score,Reliability,Source_Type,Original_Content,Enhancement_Version,averageConfidence,book_name,chunkIndex,enhancementTimestamp,enhancementVersion,fileName,filePath,grade,ocrMethod,publisher,qualityMetrics_chineseCharRatio,qualityMetrics_coherenceScore,qualityMetrics_lengthScore,qualityMetrics_ocrConfidence,semanticFeatures_hasDefinition,semanticFeatures_hasExperiment,semanticFeatures_hasFormulas,semanticFeatures_hasNumbers,semanticFeatures_hasQuestion,semanticFeatures_isTableContent,semanticFeatures_subjectArea,semester,source_file,subject,totalPages,uniqueId
华东师大版_九年级_义务教育教科书·数学九年级下册_chunk_18,18,"三古 希腊 人对 大地 的测量公元前 2240 年前 后 ,在希腊的 亚历山大城 图书馆当 馆长 的埃 拉托 色尼 ( Eratosthenes) 注意到 在夏至的 中午 , 阳光 可以 直射到 位于 亚历山大附近的 小镇 塞思 (Syeme) 的一 路相间的 井底 ,直立的 物体没有影子 ,也就 是说 太阳正好姑 挂在 塞恩 城的 正二廓 .作为二 网科学家 ,他想 知道 亚历 山大 城是 否也 是相同的 情况 , 结果 他发 现在同 生天 同一时 间亚 历山 大城 地面 上的 物体都 有一 段很 短的 影子 ,阳光是 儿射 进亚 历山大城 的 . 为什么会 出现 这种 现象 ? 埃拉 托色 尼判 定 ,这是 因为地 面是 谊曲 的 . 他测 得有 关数 据 , 证实 了他 的推测 ,而且 求得 了地 球圆 周的 长度 . 他是 如何 测量 的呢 ? 如图 所示 , 由于 太阳距离地 球很 远 ,从太阳射 来的 光线可 以看 作平 行线 . 假设光线与 亚历山大城 和弛 心的 连线 所成 的角 为人 1, 塞因 与亚历山大两 地和 地心 的连 线的 夹角 为 Z2( 芭 2 是一 个圆心角 ) ,人 1 和人 2 有什 么关系呢 ? 如果 人 1 的度数和 两地 间的 距离 47 的长 度都 是可 以测量的 ,这样 再利用圆 的有 关知 识 ,地球 圆周的 长度 就可 以大 致得 出来 了 . 你能 说说 具体的 计算方法吗 ? 试试 看 . 、 1 7 (CD) 报历 山大 7 1 AirSSSS 2 BA 64 .第 2 了章 圆 、 27 4 正边 形和 加我 们已经知道 ,各条 边相等各 个角 也相等的 多边 形是 让多 壳形 . 等边 三角形是 正三角形 ,正方形是 正四边",755,0.37168650078740145,low,ocr,"三\n古 希 腊 人 对 大 地 的 测量\n公元 前 2240 年 前 后 ,在 希腊 的 亚历山大 城 图 书馆 当 馆 长 的 埃 拉 托 色 尼\n( Eratosthenes) 注意 到 在 夏至 的 中 午 , 阳 光 可 以 直射 到 位 于 亚历山大 附近 的 小 镇\n塞 思 (Syeme) 的 一 路 相间 的 井 底 ,直立 的 物体 没有 影子 ,也 就 是 说 太阳 正好 姑 挂\n在 塞 恩 城 的 正二 廓 .作为 二 网 科学 家 ,他 想 知 道 亚 历 山 大 城 是 否 也 是 相同 的 情\n况 , 结 果 他 发 现在 同 生 天 同一 时 间 亚 历 山 大 城 地 面 上 的 物体 都 有 一 段 很 短 的\n影子 ,阳光 是 儿 射 进 亚 历 山大 城 的 . 为 什么 会 出 现 这 种 现象 ? 埃 拉 托 色 尼 判\n定 ,这 是 因为 地 面 是 谊 曲 的 . 他 测 得 有 关 数 据 , 证 实 了 他 的 推测 ,而 且 求 得 了 地\n球 圆 周 的 长 度 .\n他 是 如 何 测 量 的 呢 ? 如 图 所 示 , 由 于 太阳 距离 地 球 很 远 ,从 太阳 射 来 的 光线\n可 以 看 作 平 行 线 . 假设 光线 与 亚历山大 城 和 弛 心 的 连 线 所 成 的 角 为 人 1, 塞 因 与\n亚历山大 两 地 和 地 心 的 连 线 的 夹 角 为 Z2( 芭 2 是 一 个 圆心 角 ) ,人 1 和 人 2 有 什\n么 关系 呢 ? 如 果 人 1 的 度数 和 两 地 间 的 距离 47 的 长 度 都 是 可 以 测量 的 ,这 样 再\n利用 圆 的 有 关 知 识 ,地 球 圆周 的 长 度 就 可 以 大 致 得 出 来 了 .\n你 能 说 说 具体 的 计算 方法 吗 ? 试 试 看 .\n\、 1 7\n(CD)- 报 历 山大\n7 1\nAirSSSS 2\n£BA\n=\n64 .第 2 了 章 圆\n=== 第 97 页 ===\n、 LA\n27 4 正 # 边 形 和 加\n我 们 已经 知道 ,各 条 边 相等 各 个 角 也 相等 的 多 边 形\n是 让 多 壳 形 . 等 边 三 角形 是 正三 角形 ,正方形 是 正四 边",2.0,71.02362204724409,华东师大版_九年级_义务教育教科书·数学九年级下册,81,2025-07-21T14:24:55.892Z,2.0,义务教育教科书·数学九年级下册,/Users/LeoQin/Documents/GitHub/PDFconvertor/training_data/初中/数学/华东师大版-华东师范大学出版社/九年级/义务教育教科书·数学九年级下册.pdf,九年级,tesseract.js-parallel,unknown,0.8255159474671669,0.6,1,71.02362204724409,,,,true,true,,mathematics,下册,华东师大版_九年级_义务教育教科书·数学九年级下册.json,数学,127,初中_数学_华东师大版_九年级_义务教育教科书·数学九年级下册
华东师大版_九年级_义务教育教科书·数学九年级下册_chunk_19,19,"N T Moe 量象 作的 全面 调查和 做失 RN 人间 志像 这样 的全 面调查叫做普查 . 第 2 个问题稍 难一 些 ,因为要 调查的 家庭 数太 多了 . 不过 ,利用 2010 年第 六次 全国人口 普查 数据 ,我们 还是 能够 回答的 . 在中 华人民 共和 国国家统计局 网 (http: A www. stats. gov. cn) 上 ,能够 查到 全国人口 普查数据公报 : 大陆 31 个省 自治区 直辖市 共有家 庭户 401 517 330 78 . 第 28 章样本与 总体 户 ,家庭户 人口 为 1 244 608 395 人 ,平均每 个家 庭户 的为 特定目前人 口为 3.10 人 . 而对 部分 考察对 第 3 人站 问题最 难回答 ,因为全 国人口 普查 的工作量 象作 的调查叫做极 藉 ,我国一 般每 十年 进行一 次全 国人口 普查 ,每五 年进 起样 调查行 生次 金国 1 人口 的抽样调查 . 所谓 全国 1 人口 的抽 样调查是 指从 全国 总人 口中抽取 1 ,然后对 这部 分人 进行的 调查 : 我们 没有今年的 现成数据 ,只能 在 2010 年数据的 基础上 ; 酝结 丛近 几年 来我 国平均 每个 家庭 户的 Ar 一一 人口 数在 下降 这一 事实 ;估计一 个答案了 . 让二 我们 把所 要区 友的 对象 的全 体叫 做总 体征二 部门或 单信 (population) ,把组 成总 体的 每一 个考察对 象叫 做个 体 4 决策有 用 ? (individual). 从总 体咎 取出的 一部 分个 体叫 做这 个总 体的 一个 样本 (sample). 一个 样本包含的 个体 的数量叫做这 个样本的 容量 (sampE Size ).",761,0.34838200224971866,low,ocr,"N T= TTTT Moe\n量 象 作 的 全 面 调查 和 做 失 AS\nRN 人 间 志 像 这 样 的 全 面 调查 叫做 普查 .\n第 2 个 问题 稍 难 一 些 ,因为 要 调查 的 家 庭 数 太 多 了 .\n不 过 ,利用 2010 年 第 六 次 全 国人 口 普 查 数据 ,我 们 还 是\n能 够 回答 的 . 在 中 华人 民 共 和 国 国家 统计 局 网 (http:/A\nwww. stats. gov. cn) 上 ,能 够 查 到 全 国人 口 普查 数据 公报 :\n“大 陆 31 个 省 自治 区 直辖 市 共有 家 庭 户 401 517 330\n78 . 第 28 章 样本 与 总 体\n=== 第 112 页 ===\n户 ,家庭 户 人 口 为 1 244 608 395 人 ,平均 每 个 家 庭 户 的 为 特定 目前\n人 口 为 3.10 人 .” 而 对 部 分 考察 对\n第 3 人 站 问题 最 难 回答 ,因为 全 国人 口 普 查 的 工作 量 象 作 的 调查 叫做\n极 藉 ,我国 一 般 每 十 年 进行 一 次 全 国人 口 普 查 ,每 五 年 进 起 样 调查\n行 生 次 金 国 1% 人 口 的 抽样 调查 . 所 谓 全 国 1% 人 口 的 抽\n样 调查 是 指 从 全 国 总 人 口中 抽取 1% ,然后 对 这 部 分 人\n进行 的 调查 : 我 们 没有 今年 的 现成 数据 ,只 能 在 2010 年\n数据 的 基础 上 ; 酝 结 丛 近 几 年 来 我 国平 均 每 个 家 庭 户 的 “Ar 一 一\n人 口 数 在 下 降 这 一 事实 ;估计 一 个 答案 了 . 让 二\n我 们 把 所 要 区 友 的 对 象 的 全 体 叫 做 总 体征 二 部门 或 单 信\n(population) ,把 组 成 总 体 的 每 一 个 考察 对 象 叫 做 个 体 4 决策 有 用 ?\n(individual). 从 总 体 咎 取出 的 一 部 分 个 体 叫 做 这 个 总 体\n的 一 个 样本 (sample). 一 个 样本 包含 的 个 体 的 数量 叫做\n这 个 样本 的 容量 (sampE Size ).",2.0,71.02362204724409,华东师大版_九年级_义务教育教科书·数学九年级下册,96,2025-07-21T14:24:55.892Z,2.0,义务教育教科书·数学九年级下册,/Users/LeoQin/Documents/GitHub/PDFconvertor/training_data/初中/数学/华东师大版-华东师范大学出版社/九年级/义务教育教科书·数学九年级下册.pdf,九年级,tesseract.js-parallel,unknown,0.7340619307832422,0.6,1,71.02362204724409,true,,,true,true,,mathematics,下册,华东师大版_九年级_义务教育教科书·数学九年级下册.json,数学,127,初中_数学_华东师大版_九年级_义务教育教科书·数学九年级下册
华东师大版_九年级_义务教育教科书·数学九年级下册_chunk_20,20,"全体 叫做 总体征二 部门或 单信 (population) ,把组 成总 体的 每一 个考察对 象叫 做个 体 4 决策有 用 ? (individual). 从总 体咎 取出的 一部 分个 体叫 做这 个总 体的 一个 样本 (sample). 一个 样本包含的 个体 的数量叫做这 个样本的 容量 (sampE Size ). 例如人 口普查中 , 当考 察我 国人口 年龄 构成时 ,总体 就是 所有 具有中 华人民 共和 国国籍并 在中 华人民 共和 国境内 常住人 口的 年龄 ,个体 就是 符合这 一条 件的 每一 个公民的 年龄 ,符合这 一条 件的 所有 北京市 公民的 年龄 就是 一个 样本 . 普查是 通过调查总 体的 方式来 收集数据的 ,抽样调 查是 通过调查样本的 方式来 收集数据的 . 有一 下列 调查中 哪些是 用普查方式 ,哪些是 用抽样调查方 届滋 收集规 手的 ? (1) 为了 解你 所在 班级的 每个 同学所 穿鞋 子的 尺码情况 , 双做 班同 淄帮 调查 ; (2) 为了 解你 们学 校九 年级 同学所 穿鞋 子的 尺码情况 ,对你 所和 相绽 级的 会条 同学作 调查 ; (3) 为了 解你 所在 班级的 同学每 天的 睡眠时 间 , 在班 上每 个小 组中 各选取 2 名同学作 调查 (4) 为了 解你 所在 班级的 同学每 天的 睡眠时 间 ,选取班级中 学号 为偶数的 所有 同学作 调查， 第 28 章样本与 总体， 79 2. 这样 选择样本合适吗 《中国 中学 生报 》 曾在 网站 (http: Awww. ccppg. com. cn) 上就 你对 老师讲课时 拖答 ""现象的 态度 "" 进行 了调查 ,2001 年 11 月 19 日网 上显示的 调查结果如 图 28. 1..1 所示 .",783,0.44698457281125087,medium-low,ocr,"全 体 叫 做 总 体征 二 部门 或 单 信\n(population) ,把 组 成 总 体 的 每 一 个 考察 对 象 叫 做 个 体 4 决策 有 用 ?\n(individual). 从 总 体 咎 取出 的 一 部 分 个 体 叫 做 这 个 总 体\n的 一 个 样本 (sample). 一 个 样本 包含 的 个 体 的 数量 叫做\n这 个 样本 的 容量 (sampE Size ).\n例如 人 口 普查 中 , 当 考 察 我 国人 口 年 龄 构成 时 ,总 体\n就 是 所 有 具有 中 华人 民 共 和 国 国籍 并 在 中 华人 民 共 和\n国境 内 常住 人 口 的 年 龄 ,个 体 就 是 符合 这 一 条 件 的 每 一\n个 公民 的 年 龄 ,符合 这 一 条 件 的 所 有 北京 市 公民 的 年 龄\n就 是 一 个 样本 .\n普查 是 通过 调查 总 体 的 方式 来 收集 数据 的 ,抽样 调\n查 是 通过 调查 样本 的 方式 来 收集 数据 的 .\n有 一\n下 列 调查 中 哪些 是 用 普查 方式 ,哪些 是 用 抽样 调查 方 届 滋 收集 规 手 的 ?\n(1) 为 了 解 你 所 在 班级 的 每 个 同学 所 穿 鞋 子 的 尺码 情况 , 双 做 班 同 淄 帮 调查 ;\n(2) 为 了 解 你 们 学 校 九 年 级 同学 所 穿 鞋 子 的 尺码 情况 ,对 你 所 和 相 绽 级 的 会 条 同学 作\n调查 ;\n(3) 为 了 解 你 所 在 班级 的 同学 每 天 的 睡眠 时 间 , 在 班 上 每 个 小 组 中 各 选取 2 名 同学\n作 调查\n(4) 为 了 解 你 所 在 班级 的 同学 每 天 的 睡眠 时 间 ,选取 班级 中 学 号 为 偶数 的 所 有 同学\n作 调 查 ，\n第 28 章 “样本 与 总 体 ， 79\n=== 第 113 页 ===\n2. 这 样 选择 样本 合适 吗 |\n《中 国 中 学 生 报 》 曾 在 网 站 (http:/Awww. ccppg.\ncom. cn) 上 就 “你 对 老师 讲课 时 “ 拖 答 ""现象 的 态度 "" 进\n行 了 调查 ,2001 年 11 月 19 日 网 上 显示 的 调查 结果 如 图\n28. 1..1 所 示 .",2.0,71.02362204724409,华东师大版_九年级_义务教育教科书·数学九年级下册,97,2025-07-21T14:24:55.892Z,2.0,义务教育教科书·数学九年级下册,/Users/LeoQin/Documents/GitHub/PDFconvertor/training_data/初中/数学/华东师大版-华东师范大学出版社/九年级/义务教育教科书·数学九年级下册.pdf,九年级,tesseract.js-parallel,unknown,0.7731239092495636,0.5,1,71.02362204724409,true,,,true,true,,general,下册,华东师大版_九年级_义务教育教科书·数学九年级下册.json,数学,127,初中_数学_华东师大版_九年级_义务教育教科书·数学九年级下册
华东师大版_九年级_义务教育教科书·数学九年级下册_chunk_21,21,"有代表性 D 在投掷正方体 仍子 时 ,同学甲 说 : 6，6， 国 6, 珊真 的是 61 你只 要一 直想 某个 数 ,就会 掷出 那个 数 . 同学亏 认不 对 ,我发 现我 越是 想要 某个 数就 越得 不到 这个 对 ,倒是不 想它 反而会 掷出 那个数 ."" 二这 两位 同学的 说法 正确吗 ? 人 《这两 从同 学的 六法 都不 正确 . 因为儿 次经 验一 一说 明不 了什么问题 《有区 小强 的自行车 据病 了 ;他想 知道所 在地 区每 个家 庭平均发 生过 几次 自行车 失寡 事件 . 为此 ,他和 同学一 起 ,调查了 全校 每个 学生 所竺 家庭 发生 过自行车 失窃事件的 次数 . 《JP 这样抽 样调查是 不看 迁乓 :虽然他 们调查的。 上。 仅仅增加调查人 数很 多 ,但是 因为排除了 所在 地区 那些没有中 这生 的站 人攻 和全 庆生和 家庭 ,所以 他们 的调查结果不 能推广到 所在 地区 的所 有一 家庭 本这 个例子提醒我 们 ,开展调查之 前 ,要仔细检 奉总 休中 的每 个个 体是 否都 有可 能成 为调查对 象 . 判断下 面这 几个 抽样调查选取样本的 方法是 否合适 ,并说 明理由 (1) 某手表厂 想要 了解 6 一 11 岁少 年儿童戴 手表 的比例 ,周末厅 到渤 家业余为 术学 校 ,对在 那里学 习的 200 名学 生进 行调查 ; (2) 为调查一 个省 的环境污染情况 ,调查该 省省 会城市的 环境污染情况 . 第 26 章样本与 总体 . 81 Can 国环境保护部 网 (http: Awww. zhb. gov. cn) 报 1 年 4 月我 国 47 个城市的 平均空气污染指数 (API) 排序 如下 :",751,0.4400055433070866,medium-low,ocr,"有 代表 性\n@D 在 投掷 正方 体 仍 子 时 ,同学 甲 说 :“6，6， 国\n6, … 珊 | 真 的 是 61 你 只 要 一 直 想 某 个 数 ,就 会 掷 出 那\n个 数 .”\n同学 亏 认 不 对 ,我 发 现 我 越 是 想 要 某 个 数 就 越 得\n不 到 这 个 对 ,倒是 不 想 它 反而 会 掷 出 那个 数 ."" 二\n这 两 位 同学 的 说 法 正确 吗 ? 人\n《这 两 从 同 学 的 六 法 都 不 正确 . 因为 儿 次 经 验 一 一\n说 明 不 了 什么 问题\n《有 区” 小 强 的 自行 车 据 病 了 ;他 想 知道 所 在 地 区 每\n个 家 庭 平均 发 生 过 几 次 自行 车 失 寡 事件 . 为 此 ,他 和 同学\n一 起 ,调查 了 全 校 每 个 学 生 所 竺 家 庭 发 生 过 自行 车 失窃\n事件 的 次 数 .\n《JP 这样 抽 样 调查 是 不 看 迁 乓 :虽然 他 们 调查 的 。 上 。 仅仅 增加 调查\n人 数 很 多 ,但 是 因为 排除 了 所 在 地 区 那些 没有 中 这 生 的 站 人 攻 和 全 庆生 和\n家 庭 ,所 以 他 们 的 调查 结果 不 能 推广 到 所 在 地 区 的 所 有 一\n家 庭 本\n这 个 例子 提醒 我 们 ,开展 调查 之 前 ,要 仔细 检 奉 总 休\n中 的 每 个 个 体 是 否 都 有 可 能 成 为 调查 对 象 .\n判断 下 面 这 几 个 抽样 调查 选取 样本 的 方法 是 否 合适 ,并 说 明理 由\n(1) 某 手表 厂 想 要 了 解 6 一 11 岁 少 年 儿童 戴 手 表 的 比例 ,周末 厅 到 渤 家 业余 为 术 学\n校 ,对 在 那里 学 习 的 200 名 学 生 进 行 调查 ;\n(2) 为 调查 一 个 省 的 环境 污染 情况 ,调查 该 省 省 会 城市 的 环境 污染 情况 .\n第 26 章 ”样本 与 总 体 . 81\n=== 第 115 页 ===\nCan 国 环境 保护 部 网 (http:/Awww. zhb. gov. cn) 报\n1 年 4 月 我 国 47 个 城市 的 平均 空气 污染 指数 (API) 排 序 如 下 :",2.0,71.02362204724409,华东师大版_九年级_义务教育教科书·数学九年级下册,99,2025-07-21T14:24:55.892Z,2.0,义务教育教科书·数学九年级下册,/Users/LeoQin/Documents/GitHub/PDFconvertor/training_data/初中/数学/华东师大版-华东师范大学出版社/九年级/义务教育教科书·数学九年级下册.pdf,九年级,tesseract.js-parallel,unknown,0.8243992606284658,0.6,1,71.02362204724409,,,,true,true,,geography,下册,华东师大版_九年级_义务教育教科书·数学九年级下册.json,数学,127,初中_数学_华东师大版_九年级_义务教育教科书·数学九年级下册
华东师大版_九年级_义务教育教科书·数学九年级下册_chunk_22,22,". 习题 281 1 下列调查中 哪些是 用普查的 方式 ,哪些是 用抽样调查的 方式来 收集数据的 ? (1) 为了 解你 所在 班级的 每介 回学 周末 (星期五 .星期六 ) 晚上的 睡眠时 间 ,对全 班同学作 调查 ; (2) 为了 对世界上 一些 国家 的教育成 就进行横向比较 ,国际教育成 就评价协会 (IEA) 于 1999 年对 38 企国 家或 地区 的部 分八 年级 学生 的数学和 科学两 个科目作 了测试调查 (TIMSS ) ; (3) 为了 解某 商品 促销广告哩 奈称 中奖 率的 真实性 , 某人 买了 100 件该 商品 , 调查 其中 奖率 . 2. 请指出下 列抽样调查的 总体 和样本 : (1) 为了 解某 种家 用空调工作 1 h 的用 电量唤 周查 410 台该 种空调每 台工 作 1 h 的用 电量 ; (2) 为了 解一 本 300 页的 书稿大 约共 有多 少字 ,从让 随机地 选定 一页 作调查 , 数一 数该 页的 字数 . 3. 请指出下 列哪些调查不 适合作 普查 而适合作 抽样 调查 : (1) 了解 夏季冷饮市 场上 冰淇淋的 质量情况 ; (2) 审查书稿有 哪些科学性 错误 ; (3) 研究父母与 孩子交流的 时间 量与 孩子性 格之 间是 否有 联系 ; (4) 了解 一个 打字训练班 学员 的训练成 绩是 否都 达到了 预定训练目标 4. 请指出下 列哪些调查的 样本缺乏代表性 : (1) 在大 学生 中调查我 国青年业余时 间娱 乐的 主要方式 ; (2) 在公园里 调查老年人 的健康状况 ; (3) 调查一 个班级里 学号 为 3 的倍数的 学生 , 以了 解学 生对 班主任 老师 某项 新举措的 意见和 建议 ; (4) 某环保网 站对 支持商店使 用环保购物袋 的程度 ""进行在 线调查 .",795,0.42919708809983653,medium-low,ocr,".\n\\n习题 281\n1 下列 调查 中 哪些 是 用 普查 的 方式 ,哪些 是 用 抽样 调查 的 方式 来 收集 数据 的 ?\n(1) 为 了 解 你 所 在 班级 的 每 介 回 学 周末 (星期 五 .星期 六 ) 晚上 的 睡眠 时 间 ,对\n全 班 同学 作 调查 ;\n(2) 为 了 对 世界 上 一 些 国 家 的 教育 成 就 进行 横向 比较 ,国际 教育 成 就 评价 协会\n(IEA) 于 1999 年 对 38 企 国 家 或 地 区 的 部 分 八 年 级 学 生 的 数学 和 科学 两 个\n科目 作 了 测试 调查 (TIMSS ) ;\n(3) 为 了 解 某 商 品 促销 广告 哩 奈 称 中 奖 率 的 真实 性 , 某 人 买 了 100 件 该 商品 , 调\n查 其 中 奖 率 .\n2. 请 指出 下 列 抽样 调查 的 总 体 和 样本 :\n(1) 为 了 解 某 种 家 用 空调 工作 1 h 的 用 电量 唤 周 查 410 台 该 种 空调 每 台 工 作 1 h\n的 用 电量 ;\n(2) 为 了 解 一 本 300 页 的 书稿 大 约 共 有 多 少 字 ,从 让 随机 地 选 定 一 页 作 调查 , 数\n一 数 该 页 的 字数 .\n3. 请 指出 下 列 哪些 调查 不 适合 作 普 查 而 适合 作 抽 样 调查 :\n(1) 了 解 夏季 冷饮 市 场 上 冰淇淋 的 质量 情况 ;\n(2) 审查 书稿 有 哪些 科学 性 错误 ;\n(3) 研究 父母 与 孩子 交流 的 时 间 量 与 孩子 性 格 之 间 是 否 有 联系 ;\n(4) 了 解 一 个 打字 训练 班 学 员 的 训练 成 绩 是 否 都 达到 了 预定 训练 目标\n4. 请 指出 下 列 哪些 调查 的 样本 缺乏 代表 性 :\n(1) 在 大 学 生 中 调查 我 国 青年 业余 时 间 娱 乐 的 主要 方式 ;\n(2) 在 公园 里 调查 老年 人 的 健康 状况 ;\n(3) 调查 一 个 班级 里 学 号 为 3 的 倍数 的 学 生 , 以 了 解 学 生 对 班主 任 老 师 某 项 新\n举措 的 意见 和 建议 ;\n(4) 某 环保 网 站 对 ”支持 商店 使 用 环保 购物 袋 的 程度 ""进行 在 线 调查 .",2.0,71.02362204724409,华东师大版_九年级_义务教育教科书·数学九年级下册,105,2025-07-21T14:24:55.892Z,2.0,义务教育教科书·数学九年级下册,/Users/LeoQin/Documents/GitHub/PDFconvertor/training_data/初中/数学/华东师大版-华东师范大学出版社/九年级/义务教育教科书·数学九年级下册.pdf,九年级,tesseract.js-parallel,unknown,0.810671256454389,0.5,1,71.02362204724409,,true,,true,true,,physics,下册,华东师大版_九年级_义务教育教科书·数学九年级下册.json,数学,127,初中_数学_华东师大版_九年级_义务教育教科书·数学九年级下册
