Chunk_ID,Chunk_Index,Content,Content_Length,Quality_Score,Reliability,Source_Type,Original_Content,Enhancement_Version,averageConfidence,book_name,chunkIndex,enhancementTimestamp,enhancementVersion,fileName,filePath,grade,ocrMethod,publisher,qualityMetrics_chineseCharRatio,qualityMetrics_coherenceScore,qualityMetrics_lengthScore,qualityMetrics_ocrConfidence,semanticFeatures_hasDefinition,semanticFeatures_hasExperiment,semanticFeatures_hasFormulas,semanticFeatures_hasNumbers,semanticFeatures_hasQuestion,semanticFeatures_isTableContent,semanticFeatures_subjectArea,semester,source_file,subject,totalPages,uniqueId
华东师大版_九年级_义务教育教科书·数学九年级下册_chunk_12,12,"函数 的图 象之 间有 什么关系 ? 函数字 a( 2) 5 y 1 的图 象的 开口方向相同 , 但对 称轴 和顶点坐标不 同 . 函数 y 六 (x 2 和的 图象 可以 看作 是将 函数 y 的图 象向 右平 移 2 余单位得 到的 . 它的 对称 轴是 直线 x 2, 顶点坐标是 (2 肥 0 ). 据此 , 可以 由冰 数 y E 的性 质 ,得到 郴数 y 六 ( 2)? 的性 质 ; 请思考 ,并完成填空 . 当 x 时 ,函数值 y 随 xs 的增 夫而 减小 ; 当 ae 时 ,函数值 y 随 x 的增 大而 增大 ; 当 x 时 ,函数取得最 值 , 最 Hy 12 .第 26 章二 次函数冯 (x 1)? 与函数 7 图象 ,比较它们的 联系和 区别 . 说出 函数 y Lx 1)? 的图 象可 以看 成是 由本 数了 i 的图 象经 过怎样的 平移得 到的 . 1 牛出 函数 y 记 (x 二 1)2 的性 质 . 在同一个 平面直角坐标系 中函数 y 到 (x 2) 的图 象与 旺数 y 了的 图象 有什么美 系 ? 试说 出函 数 y 计 (z 2)? 的图 象的 开口方 曾 、 对称 轴和 项点 从标 , 并讨论这 个本 数的 性质 . 1. 已知 函数 y 本 2， y 村 (x 3) 和 Yy 三村 (xz 3 (1) 在同一个 平面直角坐标系 中画 出它们的 图象 ; (2) 说出 各个 函数图 象的 开口方向对称轴 和顶点坐标 ; (3) 讨论各 个函数的 性质 . 2. 试说 明 : 分别 通过怎样的 平移 , 可以 由抛物线 y 本安 得到 拢物 4 三和 7y 可 ( x 3)2? 2X 第 20 章二 次困 数 . 13 义务到 育才韦 二数学数学 :",761,0.36020190634065463,low,ocr,"函 数 的 图 象 之 间 有 什么 关系 ?\n函数 字 =a(%-2)* 5 y = 1 的 图 象 的 开口 方向\n相同 , 但 对 称 轴 和 顶点 坐标 不 同 .\n函数 y = 六 (x = 2 和 的 图 象 可 以 看 作 是 将 函数 y =\n的 图 象 向 右 平 移 2 余 单位 得 到 的 . 它 的 对 称 轴 是 直\n线 x = 2, 顶点 坐标 是 (2 肥 0 ).\n据 此 , 可 以 由 冰 数 y = E 的 性 质 ,得 到 郴 数 y =\n六 (> - 2)? 的 性 质 ;\n请 思考 ,并 完成\n填空 . 当 x 时 ,函数 值 y 随 xs 的 增 夫 而 减 小 ; 当 >\nae 时 ,函数 值 y 随 x 的 增 大 而 增 大 ; 当 x\n时 ,函数 取得 最 值 , 最 Hy=\n12 .第 26 章 二 次 函数\n=== 第 39 页 ===\n| = 冯 (x+1)? 与 函数 7 =\n图 象 ,比较 它们 的 联系 和 区 别 . 说 出 函数 y = Lx+1)? 的 图 象 可 以 看\n成 是 由 本 数 了 i 的 图 象 经 过 怎样 的 平移 得 到 的 .\n| 1\n牛 出 函数 y = 记 (x 二 1)2 的 性 质 .\n在 同一 个 平面 直角 坐标 系 中 函数 y = -到 (x +2)\n的 图 象 与 旺 数 y = -了 的 图 象 有 什么 美 系 ? 试 说 出 函\n数 y = - 计 (z+2)? 的 图 象 的 开口 方 曾 、 对 称 轴 和 项 点 从\n标 , 并 讨论 这 个 本 数 的 性 质 .\n1. 已 知 函 数 y = 本 2， y = 村 (x +3) 和 Yy 三 村 (xz 3\n(1) 在 同一 个 平面 直角 坐标 系 中 画 出 它们 的 图 象 ;\n(2) 说 出 各 个 函数 图 象 的 开口 方向 对称 轴 和 顶点 坐标 ;\n(3) 讨论 各 个 函数 的 性 质 .\n2. 试 说 明 : 分 别 通过 怎样 的 平移 , 可 以 由 抛物 线 y = 本 安 得 到 拢 物 4 三\n和 7y = 可 (<x -3)2? 2X\n第 20 章 ”二 次 困 数 . 13\n=== 第 40 页 ===\n义务 到 育才 韦\n二 数学\n数学\n— :",2.0,71.02362204724409,华东师大版_九年级_义务教育教科书·数学九年级下册,31,2025-07-21T14:24:55.892Z,2.0,义务教育教科书·数学九年级下册,/Users/LeoQin/Documents/GitHub/PDFconvertor/training_data/初中/数学/华东师大版-华东师范大学出版社/九年级/义务教育教科书·数学九年级下册.pdf,九年级,tesseract.js-parallel,unknown,0.707843137254902,0.6,1,71.02362204724409,,,,true,true,,mathematics,下册,华东师大版_九年级_义务教育教科书·数学九年级下册.json,数学,127,初中_数学_华东师大版_九年级_义务教育教科书·数学九年级下册
华东师大版_九年级_义务教育教科书·数学九年级下册_chunk_13,13,"轴与 顶点坐标 . 11. 若抛物线 y x x 2 经过 点 4(3, wa) 和点 B(0 0) , 求总 4、B 的坐标 . 12. 行驶中 的汽车乔 车后 ,由于 惯性还 会继续向 前滑 街择 段距 离这 段距 离称 为刹车距离 . 某车 的刹车距离 s(m) 与车 速 x(km h) 之间 有如 下的 本数 关系 : s 0.01x 0. 002x?. 现该 车在 限速 120 km h 的高 速公 路蕊 电子交通事故 , 事后 测得 其刹车距离为 33. 1 m. 请推测乔 车前 ,汽车是 否超 速 ? 13. 已知 二次 函数的 图象 满足下 列条 件 , 求它 的函数表达式 : (1) 经过 原点和 点 ( 1, 3), 对称 轴为 直线 x 4; (2) 经过 点 (1, 1) 、( 2, 1) 和 (2， 3). 第 206 章二 次函数 . 33 亲爱的 小伙伴 ,欢迎像 你现在拿 在手中的 是依据 4 国家中 长期 教育改革和 发展 规划纲要 (2010 一 2020 年 )》 与国 家 《义务教育数学主 程标准 42011 年版 )》, 为你 们提供的 初中阶段六 册数 学教科书 中的 第六 本 . 这是 你初中阶段学 习的 最恒 本数学教科书 . 它与 你学 过的 前五 本数学教科书 一样 , 从你 所熟悉的 情境入 手 ,呈现一 些基 基杰 的埋 写多 彩的 数学内 容 , 并穿插一 些阅读材料 ,设置一 些让 你思考 .实践与 自主探索的 档目 . 不同谋次 揭习 题 ,应用 性 ,探索性 和开放性 的各 种形式的 间题 及综合与 实践等 ,都为 你提供了 充分展示聪明才智与 数学能 力的 机会 . 现在 ,请你 翻开 这本 书 ,与我 们起 继续漫游这 奇妙的 数学世界 ,去探索发 现更 多 ,更具 魅",781,0.3977457203660352,low,ocr,"轴 与 顶点 坐标 .\n11. 若 抛物 线 y=x —x -2 经 过 点 4(3, wa) 和 点 B(0 0) , 求 总 4、B 的 坐标 .\n12. 行驶 中 的 汽车 乔 车 后 ,由 于 惯性 还 会 继续 向 前 滑 街 择 段 距 离 这 段 距 离 称 为\n“刹车 距离 ”. 某 车 的 刹车 距离 s(m) 与 车 速 x(km/h) 之 间 有 如 下 的 本 数 关系 :\ns = 0.01x + 0. 002x?. 现 该 车 在 限 速 120 km/h 的 高 速 公 路 蕊 电子 交通 事故 , 事\n后 测 得 其 刹车 距离 为 33. 1 m. 请 推测 乔 车 前 ,汽车 是 否 超 速 ?\n13. 已 知 二 次 函数 的 图 象 满足 下 列 条 件 , 求 它 的 函数 表达 式 :\n(1) 经 过 原点 和 点 ( -1, 3), 对 称 轴 为 直线 x = 4;\n(2) 经 过 点 (1, 1) 、( -2, 1) 和 (2，-3).\n第 206 章 ”二 次 函数 . 33\n=== 第 62 页 ===\nSS\n亲爱 的 小 伙伴 ,欢迎 像\n你 现在 拿 在 手中 的 是 依据 4 国家 中 长 期 教育 改革 和 发 展 规划 纲要 (2010 一 2020 年 )》 与 国\n家 《义务 教育 数学 主 程 标准 42011 年 版 )》, 为 你 们 提供 的 初中 阶段 六 册 数 学 教科 书 中 的 第\n六 本 .\n这 是 你 初中 阶段 学 习 的 最 恒 - 本 数学 教科 书 . 它 与 你 学 过 的 前 五 本 数学 教科 书 一 样 , 从 你\n所 熟悉 的 情境 入 手 ,呈现 一 些 基 基 杰 的 $ 埋 写 多 彩 的 数学 内 容 , 并 穿插 一 些 阅读 材料 ,设置 一 些\n让 你 思考 .实践 与 自主 探索 的 档 目 . 不 同谋 次 揭 习 题 ,应 用 性 ,探索 性 和 开放 性 的 各 种 形式 的 间\n题 及 综合 与 实践 等 ,都 为 你 提供 了 充分 展示 聪明 才智 与 数学 能 力 的 机 会 .\n现在 ,请 你 翻 开 这 本 书 ,与 我 们 -起 继续 漫游 这 奇妙 的 数学 世界 ,去 探索 发 现 更 多 ,更 具 魅",2.0,71.02362204724409,华东师大版_九年级_义务教育教科书·数学九年级下册,51,2025-07-21T14:24:55.892Z,2.0,义务教育教科书·数学九年级下册,/Users/LeoQin/Documents/GitHub/PDFconvertor/training_data/初中/数学/华东师大版-华东师范大学出版社/九年级/义务教育教科书·数学九年级下册.pdf,九年级,tesseract.js-parallel,unknown,0.7317939609236235,0.6,1,71.02362204724409,,,,true,true,,mathematics,下册,华东师大版_九年级_义务教育教科书·数学九年级下册.json,数学,127,初中_数学_华东师大版_九年级_义务教育教科书·数学九年级下册
华东师大版_九年级_义务教育教科书·数学九年级下册_chunk_14,14,"一些 让你 思考 .实践与 自主探索的 档目 . 不同谋次 揭习 题 ,应用 性 ,探索性 和开放性 的各 种形式的 间题 及综合与 实践等 ,都为 你提供了 充分展示聪明才智与 数学能 力的 机会 . 现在 ,请你 翻开 这本 书 ,与我 们起 继续漫游这 奇妙的 数学世界 ,去探索发 现更 多 ,更具 魅力 的数学奥秘 . 给你 一定 的材料 ,怎样设计一 个矩形花 围 ,使它 的面 稳最 大 ? 一个 物体从 空中下 落时 , 它的 速度会 越来 越快 ,你知道它 下落 的距离是 如何 随着 时间 的变化而 变化的 吗 ? 这些 问题都 可以 在二 次函数 "" 中得 到解决 . 在这 里 ,你将 尝试解决许多这 样的 问题 ,你会 发现 你的 能力 又变 强了 ,你将 成为 解决问题的 能手 . 圆 ?是一 切平面图 形中 最完美 .最谐 调匀称 的图 形 . 你瞻 ! 驮各 个方向看 , 它都 是对 称的， 无论处于 哪个位 置 , 它都 具有相同的 形状 . 古今中 外的 许多建筑 .装饰品 等都 有圆 形的 痕迹 . 进入 圆的 世界 ,去感受它 的魅力吧 ! 我们 已经 学习 了许多统计与 概率的 知识 ,那么如 何既 有效 区简洁地 对荣 凶问题做 出有 意义 的判断与 决策呢 ? 样本 与总 体 "" 将告诉你 如何 使用 科学的 抽样调 杏方法 ,利用收集到 的数 据 ,进行数据分 析 ,对总 体的 特征作出较为可 靠的 估计 . 这是 你今后可 能会 经询 用到 的一 种通 过样本估计总 体的 方法 , 它会 为你 有效 地作出某 些决策提供帮助 . 怎么样 绚亲 目试 试看 ! 我们 相信 ,初中这 三年 ,通过在 丰富多 彩的 数学世界里 漫游与 探索 ,你一 定续 误二 许多好",764,0.5664485777115696,medium-low,ocr,"一 些\n让 你 思考 .实践 与 自主 探索 的 档 目 . 不 同谋 次 揭 习 题 ,应 用 性 ,探索 性 和 开放 性 的 各 种 形式 的 间\n题 及 综合 与 实践 等 ,都 为 你 提供 了 充分 展示 聪明 才智 与 数学 能 力 的 机 会 .\n现在 ,请 你 翻 开 这 本 书 ,与 我 们 -起 继续 漫游 这 奇妙 的 数学 世界 ,去 探索 发 现 更 多 ,更 具 魅\n力 的 数学 奥秘 .\n给 你 一 定 的 材料 ,怎样 设计 一 个 矩形 花 围 ,使 它 的 面 稳 最 大 ? 一 个 物体 从 空中 下 落 时 , 它\n的 速度 会 越 来 越 快 ,你 知道 它 下 落 的 距离 是 如 何 随 着 时 间 的 变化 而 变化 的 吗 ? 这 些 问题 都 可\n以 在 “二 次 函数 "" 中 得 到 解决 . 在 这 里 ,你 将 尝试 解决 许多 这 样 的 问题 ,你 会 发 现 你 的 能 力 又 变\n强 了 ,你 将 成 为 解决 问题 的 能 手 .\n“ 圆 ?是 一 切 平面 图 形 中 最 完美 .最 谐 调匀 称 的 图 形 . 你 瞻 ! 驮 各 个 方向 看 , 它 都 是 对 称 的 ，\n无 论处 于 哪个 位 置 , 它 都 具有 相同 的 形状 . 古今 中 外 的 许多 建筑 .装饰 品 等 都 有 圆 形 的 痕迹 . 进\n入 圆 的 世界 ,去 感受 它 的 魅力 吧 !\n我 们 已 经 学 习 了 许多 统计 与 概率 的 知识 ,那么 如 何 既 有 效 区 简洁 地 对 荣 凶 问题 做 出 有 意\n义 的 判断 与 决策 呢 ?“ 样 本 与 总 体 "" 将 告诉 你 如 何 使 用 科学 的 抽样 调 杏 方法 ,利用 收集 到 的 数\n据 ,进行 数据 分 析 ,对 总 体 的 特征 作出 较为 可 靠 的 估计 . 这 是 你 今后 可 能 会 经 询 用 到 的 一 种 通\n过 样本 估计 总 体 的 方法 , 它 会 为 你 有 效 地 作出 某 些 决策 提供 帮助 . 怎么 样 绚 亲 目 试 试 看 !\n我 们 相信 ,初中 这 三 年 ,通过 在 丰富 多 彩 的 数学 世界 里 漫游 与 探索 ,你 一 定 续 误 二 许多 好",2.0,71.02362204724409,华东师大版_九年级_义务教育教科书·数学九年级下册,52,2025-07-21T14:24:55.892Z,2.0,义务教育教科书·数学九年级下册,/Users/LeoQin/Documents/GitHub/PDFconvertor/training_data/初中/数学/华东师大版-华东师范大学出版社/九年级/义务教育教科书·数学九年级下册.pdf,九年级,tesseract.js-parallel,unknown,0.9128856624319419,0.6,1,71.02362204724409,,,,,true,,physics,下册,华东师大版_九年级_义务教育教科书·数学九年级下册.json,数学,127,初中_数学_华东师大版_九年级_义务教育教科书·数学九年级下册
华东师大版_九年级_义务教育教科书·数学九年级下册_chunk_15,15,"分析 ,对总 体的 特征作出较为可 靠的 估计 . 这是 你今后可 能会 经询 用到 的一 种通 过样本估计总 体的 方法 , 它会 为你 有效 地作出某 些决策提供帮助 . 怎么样 绚亲 目试 试看 ! 我们 相信 ,初中这 三年 ,通过在 丰富多 彩的 数学世界里 漫游与 探索 ,你一 定续 误二 许多好 朋友 ,你的 聪明才智与 数学能 力也一 定有 了充分的 长进 . 无论 你走 到哪里 ,数学世界将 一如 既往地 欢迎你 ,为你 打开更 多神秘的 大并 , 带称 探索 更多 的数学奥秘 . 编者 14: 员图 ,有一 个横 截面 边缘 为抛物线 的水 泥门洞 . 门洞内 的地 面宽度为 8 mm, 两侧 4 m 高处 各有 一蔓 灯 ,两灯 间的 水平 距离为 6 m. 求这 个门洞的 高度 . 《精确到 0. 1 m) 这启 藤 f 7 多 .. 旦 2 N 和加 3 T E tieF 到机 (第 14 题 ) (第 15 题 ) 15. 如图 ,一位 篮球运动员 在距离篮 疾中 心水 平距离 4 m 处跳 起投篮 , 球沿 一条 抛物 线运 动 , 当球 运动的 水平 距离 为 2.5 m 时 ,达到最 大高 度 3. 5 m, 然后 准确落 入篮 框内 . 已知 篮疾 中心 距离 地面 高度 为 3. 05 mm, 试解答下 列问题 ; (1) 建立图 中所 示的 平面直角坐标系 , 求抛物线 所对 应的 函数表达式 . (2) 这次 跳投时 , 球出 手处 离地 面多 高 ? 34 .第 26 章二 次函数第 27 章 H 关恒 下 L Pia T1 三 1 4 a) 在让 7 立交腊 藻拖 芝家 认直 :一坷 证们 训关 全革 关的 证丈 点。 一委 半而 到车",753,0.3108309781091193,low,ocr,"分 析 ,对 总 体 的 特征 作出 较为 可 靠 的 估计 . 这 是 你 今后 可 能 会 经 询 用 到 的 一 种 通\n过 样本 估计 总 体 的 方法 , 它 会 为 你 有 效 地 作出 某 些 决策 提供 帮助 . 怎么 样 绚 亲 目 试 试 看 !\n我 们 相信 ,初中 这 三 年 ,通过 在 丰富 多 彩 的 数学 世界 里 漫游 与 探索 ,你 一 定 续 误 二 许多 好\n朋友 ,你 的 聪明 才智 与 数学 能 力也 一 定 有 了 充分 的 长 进 .\n无 论 你 走 到 哪里 ,数学 世界 将 一 如 既往 地 欢迎 你 ,为 你 打开 更 多 神秘 的 大 并 , 带 称 探 索 更\n多 的 数学 奥秘 .\n编者\n=== 第 63 页 ===\n14: 员 [图 ,有 一 个 横 截 面 边 缘 为 抛物 线 的 水 泥 门洞 . 门洞 内 的 地 面 宽度 为 8 mm, 两 侧\nFEHLTHT 4 m 高 处 各 有 一 蔓 灯 ,两 灯 间 的 水 平 距离 为 6 m. 求 这 个 门洞 的 高 度 .\n《精确 到 0. 1 m)\nES 这 启\n— = 藤 \f\n7% 多 ..\n旦 2 N\n— = 和\n加 3 T E tieF 到 机\n(第 14 题 ) (第 15 题 )\n15. 如 图 ,一 位 篮球 运动 员 在 距离 篮 疾 中 心 水 平 距离 4 m 处 跳 起 投篮 , 球 沿 一 条 抛\n物 线 运 动 , 当 球 运动 的 水 平 距 离 为 2.5 m 时 ,达到 最 大 高 度 3. 5 m, 然 后 准确 落\n入 篮 框 内 . 已 知 篮 疾 中 心 距 离 地 面 高 度 为 3. 05 mm, 试 解答 下 列 问题 ;\n(1) 建立 图 中 所 示 的 平面 直角 坐标 系 , 求 抛物 线 所 对 应 的 函数 表达 式 .\n(2) 这 次 跳投 时 , 球 出 手 处 离 地 面 多 高 ?\n34 .第 26 章 二 次 函数\n=== 第 64 页 ===\n第 27 章 H\n关 恒\n下\n-| L\nPia T1 TJ\n=¥ - 三 - 1\n4 a)\n在 让 7\n立交 腊 藻 拖 芝 家 认 直 :一 坷 证 们 训 关 全 革 关 的 证 丈 点 。 一 委 半 而 到 车",2.0,71.02362204724409,华东师大版_九年级_义务教育教科书·数学九年级下册,53,2025-07-21T14:24:55.892Z,2.0,义务教育教科书·数学九年级下册,/Users/LeoQin/Documents/GitHub/PDFconvertor/training_data/初中/数学/华东师大版-华东师范大学出版社/九年级/义务教育教科书·数学九年级下册.pdf,九年级,tesseract.js-parallel,unknown,0.7788461538461539,0.5,1,71.02362204724409,,,,true,true,,physics,下册,华东师大版_九年级_义务教育教科书·数学九年级下册.json,数学,127,初中_数学_华东师大版_九年级_义务教育教科书·数学九年级下册
华东师大版_九年级_义务教育教科书·数学九年级下册_chunk_16,16,"呢 ? 如图 27.2. 4, 如果 4、B、C 三点 不在 同一条 直线上 ,那么过 4 、B 两点 的圆 的圆心必 在线段 48 的垂直第 2 了章 圆 . 47 平分线 上 ,而过 妃 、C 两点 的圆 的圆心必 在线段的 垂直平分线 上 . 此时 ,这两 条垂直平分线 一定 相交 , 且只 区林苑 8 、C 有一 个交点 , 设交 点为 0, 则 0O4 0C. 于是 ,以点 3 汪避 在同 多条 直 O 为圆心 .O4 为半径画 圆 , 便可 画出 经过 4 B, C 三点 的线 和能 旺出 经过 圆， 即有 : Wit _ 加不 在同一条 直线上 的三 个点 确定一 个圆 . A 图 27.2.4 一个 三角 也就 是说 ,经过 三角形的 三个 项点 可以 画一 个圆 ,并形 的外 接圆 是且 只能 画一 个圆 . 经过 三角形三 个顶点的 圆就 是这 个三 唯一的 . 四角形的 外接 圆 . 三角形外 接圆 的圆心叫做这 个三 角形的 外心 (circumceatiter) 这个 三角形叫做这 个圆 的内 接三 角形 (inscribed triangle ). 主角形 的外 心就 是三 角形三 条边 的垂直平分线 的交点。 1. 任意画 一个 三角形 ,然后作出这 个三 角形的 外接 圆 , 2. 随意画 出四 个点 ,其中 任何三 点都 不在 同一条 直线焉 ,是否 一定 可以 画出 一个 圆经 过这 四点 ? 请举例说 明 . 2. 直线与 圆的 位置 关系 大家 也许 看过 日出 ,如图 27. 2. 5 所示 的照片中 ;如果 我们 把太阳看 作一 个圆 ,那么太阳在 升起 的过 程中 ,和图 27. 2.5 地平 线会 有怎样的 位置 关系 ? 48 .第 2 童加 ER",761,0.3266950030284676,low,ocr,"呢 ?\n如 图 27.2. 4, 如 果 4、B、C 三 点 不 在 同一 条 直线\n上 ,那么 过 4 、B 两 点 的 圆 的 圆心 必 在 线段 48 的 垂直\n第 2 了 章 圆 . 47\n=== 第 78 页 ===\n平分 线 上 ,而 过 妃 、C 两 点 的 圆 的 圆心 必 在 线段 BC 的\n垂直 平分 线 上 . 此 时 ,这 两 条 垂直 平分 线 一 定 相交 , 且 只\n区 林苑 8 、C 有 一 个 交点 , 设 交 点 为 0, 则 0O4 = OB = 0C. 于 是 ,以 点\n3 汪 避 在 同 多 条 直 O 为 圆心 .O4 为 半径 画 圆 , 便 可 画 出 经 过 4 B, C 三 点 的\n线 和 能 旺 出 经 过 圆 ， 即 有 :\n =  Wit _ 加\n不 在 同一 条 直线 上 的 三 个 点 确定 一 个 圆 .\n= A\n%\n图 27.2.4\n一 个 三 角 也 就 是 说 ,经 过 三 角形 的 三 个 项 点 可 以 画 一 个 圆 ,并\n形 的 外 接 圆 是 且 只 能 画 一 个 圆 . 经 过 三 角形 三 个 顶点 的 圆 就 是 这 个 三\n唯一 的 . 四 角形 的 外 接 圆 . 三 角形 外 接 圆 的 圆心 叫做 这 个 三 角形 的\n外 心 (circumceatiter) 这 个 三 角形 叫做 这 个 圆 的 内 接 三\n角形 (inscribed triangle’). 主角 形 的 外 心 就 是 三 角形 三\n条 边 的 垂直 平分 线 的 交点。\n1. 任意 画 一 个 三 角形 ,然后 作出 这 个 三 角形 的 外 接 圆 ,\n2. 随意 画 出 四 个 点 ,其 中 任何 三 点 都 不 在 同一 条 直线 焉 ,是 否 一 定 可 以 画 出 一 个 圆\n经 过 这 四 点 ? 请 举例 说 明 .\n2. 直线 与 圆 的 位 置 关 系 |\n大 家 也 许 看 过 日 出 ,如 图 27. 2. 5 所 示 的 照片 中 ;如\n果 我 们 把 太阳 看 作 一 个 圆 ,那么 太阳 在 升 起 的 过 程 中 ,和\n图 27. 2.5 地 平 线 会 有 怎样 的 位 置 关 系 ?\n48 .第 2 童 加\n=== 第 79 页 ===\nER",2.0,71.02362204724409,华东师大版_九年级_义务教育教科书·数学九年级下册,65,2025-07-21T14:24:55.892Z,2.0,义务教育教科书·数学九年级下册,/Users/LeoQin/Documents/GitHub/PDFconvertor/training_data/初中/数学/华东师大版-华东师范大学出版社/九年级/义务教育教科书·数学九年级下册.pdf,九年级,tesseract.js-parallel,unknown,0.7356746765249538,0.5,1,71.02362204724409,true,,,true,true,,mathematics,下册,华东师大版_九年级_义务教育教科书·数学九年级下册.json,数学,127,初中_数学_华东师大版_九年级_义务教育教科书·数学九年级下册
华东师大版_九年级_义务教育教科书·数学九年级下册_chunk_17,17,"评 ll 本了 二本 人 ra 1 'E 和看 ! 照片上 的泡 泡图 形都 可看 成马 们所 熟悉的 圆 . 有的 像一 对好 朋友互相交 在一 超的 , 唱做 么桐 交涩 ;有的 分离 两处 各有 适相 望的 ,叫做外 离 ""; 有的 像大 哥可 为保护小 弟苯 将总 合在 里面 的 ,叫做内 含 ""; 有的 恰好哥 俩同一个 圆心的 ,叫做同心圆 ;还有 的两 圆若即若离 ,只有 一点 粘连的 , 则称 为相 切 , 相切 又有 外切 和内 切两 种情况 ; 四 (CD 相交外 离内 合 ) 同心圆 外切 内切 第 2 章圆 : 57 生活中 ,我们 还可 以看 到不 少与 两圆 位置 关系有 关的 情景 ,如下 列图 形所 示 . Te 了 La 下看 到这 里 ,你疏 铭会 想 , 那该 如何 区分 这几 种不 同的 情况呢 ? 从图 形来 看 ,你应 该发 现它们之 间公 共点 的个 数不 一样 吧 : 有的 没有 ,有的 只有 一个 ,最多 的有 两个 噬们 再用 经过 两圆 圆心的 一条 直线将 它们串 起来 ,你是 否能 发现 两圆 圆心的 焉离 ( 简称为 圆心距 )d 与两 圆半径站、 r,(r, r,) 之间 的关系 ? 离得 最远 的外 离 "" ,明显有 d 全 mi 户 , 那么其 他情况呢 ? 画一 画 , 你就 清楚了 . 请你 再回 过头 去观察那 幅吹 泡泡 照片 ,相信你 一定 会有 新的 感党 和新 的发 现 . 你看 ,变化无 穷的 万书 世界 充满 着数学美 , 数与 形组 成的 数学世界给 我们 带来 了快乐 ! de EnnitEos 一如 图 27. 3. 1 是圆 哆形状的 铁轨示意图 ,其中 铁轨的",738,0.32590931806955853,low,ocr,"= 评 ll 本\n= 了 二 本 人\nra 1 'E 和\n看 ! 照片 上 的 泡 泡 图 形 都 可 看 成 马 们 所 熟悉 的 圆 .\n有 的 像 一 对 好 朋友 互相 交 在 一 超 的 , 唱 做 么 桐 交 涩 ;有 的 分 离 两 处 各 有 适 相 望\n的 ,叫做 “外 离 ""; 有 的 像 大 哥 可 为 保护 小 弟 苯 将 总 合 在 里 面 的 ,叫做 “内 含 ""; 有\n的 恰好 哥 俩 同一 个 圆心 的 ,叫做 “同心 圆 ” ;还 有 的 两 圆 若即若离 ,只 有 一 点 粘连\n的 , 则 称 为 “ 相 切 ”, 相 切 又 有 “外 切 ” 和 “内 切 ” 两 种 情况 ;\n四 (CD\n相交 外 离 内 合\n@)\n同心 圆 外 切 内 切\n第 2“ 章 圆 : 57\n=== 第 89 页 ===\n生活 中 ,我 们 还 可 以 看 到 不 少 与 两 圆 位 置 关系 有 关 的 情景 ,如 下 列 图 形 所 示 .\nTe\n了\nLa\nSEO 下\n看 到 这 里 ,你 疏 铭 会 想 , 那 该 如 何 区 分 这 几 种 不 同 的 情况 呢 ?\n从 图 形 来 看 ,你 应 该 发 现 它们 之 间 公 共 点 的 个 数 不 一 样 吧 : 有 的 没有 ,有 的 只\n有 一 个 ,最 多 的 有 两 个 噬 们 再 用 经 过 两 圆 圆心 的 一 条 直线 将 它们 串 起 来 ,你 是 否\n能 发 现 两 圆 圆心 的 焉 离 ( 简称 为 圆心 距 )d 与 两 圆 半径 站、 r,(r, >r,) 之 间 的 关系 ?\n离 得 最 远 的 “外 离 "" ,明显 有 d 全 mi 户 , 那么 其 他 情况 呢 ? 画 一 画 , 你 就 清楚 了 .\n请 你 再 回 过 头 去 观察 那 幅 吹 泡 泡 照片 ,相信 你 一 定 会 有 新 的 感 党 和 新 的 发 现 .\n你 看 ,变化 无 穷 的 万 书 世 界 充 满 着 数学 美 , 数 与 形 组 成 的 数学 世界 给 我 们 带\n来 了 快乐 !\nAY de [=]\nBE EnnitEos\n一 如 图 27. 3. 1 是 圆 哆 形状 的 铁轨 示意 图 ,其 中 铁轨 的",2.0,71.02362204724409,华东师大版_九年级_义务教育教科书·数学九年级下册,75,2025-07-21T14:24:55.892Z,2.0,义务教育教科书·数学九年级下册,/Users/LeoQin/Documents/GitHub/PDFconvertor/training_data/初中/数学/华东师大版-华东师范大学出版社/九年级/义务教育教科书·数学九年级下册.pdf,九年级,tesseract.js-parallel,unknown,0.8221343873517787,0.5,1,71.02362204724409,true,true,,true,true,,mathematics,下册,华东师大版_九年级_义务教育教科书·数学九年级下册.json,数学,127,初中_数学_华东师大版_九年级_义务教育教科书·数学九年级下册
