Chunk_ID,Chunk_Index,Content,Content_Length,Quality_Score,Reliability,Source_Type,Original_Content,Enhancement_Version,averageConfidence,book_name,chunkIndex,enhancementTimestamp,enhancementVersion,fileName,filePath,grade,ocrMethod,publisher,qualityMetrics_chineseCharRatio,qualityMetrics_coherenceScore,qualityMetrics_lengthScore,qualityMetrics_ocrConfidence,semanticFeatures_hasDefinition,semanticFeatures_hasExperiment,semanticFeatures_hasFormulas,semanticFeatures_hasNumbers,semanticFeatures_hasQuestion,semanticFeatures_isTableContent,semanticFeatures_subjectArea,semester,source_file,subject,totalPages,uniqueId
华东师大版_八年级_义务教育教科书·数学八年级下册_chunk_11,11,"有 4 K A2 天每 天修 7 米 , 有 3 天每 天修 10 米 ,有 1 天修 11 米 . 这 10 天中 该工程队 平均每 天修建道路多 少米 ?，B 组， 5. 判断下 列说 法是 否正 确 , 若不 正确 ,请举 出反例 : (1) 个数 的平均数 就是 把这 半个 数的 总和 除以 二所 得的 数 ; (2) 半个 数的 平均数 一定 是这 半个 数中 的某 一个 ; (3) 将半 个数 由小 到大 排列后 ,如果 半是 奇数 ,位置 在正 咎间 的数 就是 这个 数的 中位 数 ;如果 半是 偶数 ,位置 在正中间 的那 两个 数的 单掏 数才 是这 个数 的中 位数 ; (4) 工个 数的 中位 数一 定是 这个 数中 的某 一个 ; (5) 如果 在个 数中 某个 或某 几个 数出 现的 频数最 大 ,那么这 个或 这几 余数 就是 这半 个数 的众 数 ,如果 找不 出这 样的 数 ,那么这 半个 数就 没有众 数 ; (6) 如果 个数 中存在众 数 ,那么该 众数 一定 是这 并个 数中 的某 一个 . 第 20 章数据的 整理与 初步处 理 .159 6. 一些 比赛中 规定 ,在所 有裁判对 某选手给 出的 评分中 ,要去 掉一 个最 高分 和一 个最 低分 ,再对 剩下 的评分取 平均 数作为这 个选手的 最终 得分 ,这是 为什么 ? 7.; 贡时 稳 11、12、13 、14 15 依次重复写 18 遍 , 会得 到由 90 个数组成 的一 组数 据细 用巧妙的 方法计算这 组数据的 平均数 , 中位 数和 众数 是 8. 在 Fugp 奖赛 中 ,三位 选手的 得分 情况如 下表 所示 . 请据 此提出一 些问题考 考你 的局 学",748,0.43876208099250935,medium-low,ocr,"有 4 REBRES K A2 天 每 天 修 7 米 , 有 3 天 每 天\n修 10 米 ,有 1 天 修 11 米 . 这 10 天 中 该 工程 队 平均 每 天 修建 道路 多 少 米 ?\n，B 组 ，\n5. 判断 下 列 说 法 是 否 正 确 , 若 不 正确 ,请 举 出 反例 :\n(1) 个 数 的 平均 数 就 是 把 这 半 个 数 的 总 和 除 以 二 所 得 的 数 ;\n(2) 半 个 数 的 平均 数 一 定 是 这 半 个 数 中 的 某 一 个 ;\n(3) 将 半 个 数 由 小 到 大 排列 后 ,如 果 半 是 奇数 ,位 置 在 正 咎 间 的 数 就 是 这 个\n数 的 中 位 数 ;如 果 半 是 偶数 ,位 置 在 正中 间 的 那 两 个 数 的 单 掏 数 才 是 这 ”\n个 数 的 中 位 数 ;\n(4) 工 个 数 的 中 位 数 一 定 是 这 个 数 中 的 某 一 个 ;\n(5) 如 果 在 个 数 中 某 个 或 某 几 个 数 出 现 的 频数 最 大 ,那么 这 个 或 这 几 余 数 就\n是 这 半 个 数 的 众 数 ,如 果 找 不 出 这 样 的 数 ,那么 这 半 个 数 就 没有 众 数 ;\n(6) 如 果 个 数 中 存在 众 数 ,那么 该 众 数 一 定 是 这 并 个 数 中 的 某 一 个 .\n第 20 章 ”数据 的 整理 与 初步 处 理 .159\n=== 第 77 页 ===\n6. 一 些 比赛 中 规定 ,在 所 有 裁判 对 某 选手 给 出 的 评分 中 ,要 去 掉 一 个 最 高 分 和 一\n个 最 低 分 ,再 对 剩 下 的 评分 取 平 均 数 作为 这 个 选手 的 最 终 得 分 ,这 是 为 什么 ?\n7.; 贡 时 稳 11、12、13 、14 15 依次 重复 写 18 遍 , 会 得 到 由 90 个 数组 成 的 一 组 数\n据 细 用 巧妙 的 方法 计算 这 组 数据 的 平均 数 , 中 位 数 和 众 数\n是\n8. 在 Fugp 奖 赛 中 ,三 位 选手 的 得 分 情况 如 下 表 所 示 . 请 据 此 提出 一 些\n问题 考 考 你 的 局 学",2.0,72.4659090909091,华东师大版_八年级_义务教育教科书·数学八年级下册,70,2025-07-21T14:24:55.862Z,2.0,义务教育教科书·数学八年级下册,/Users/LeoQin/Documents/GitHub/PDFconvertor/training_data/初中/数学/华东师大版-华东师范大学出版社/八年级/义务教育教科书·数学八年级下册.pdf,八年级,tesseract.js-parallel,unknown,0.8062015503875969,0.5,1,72.4659090909091,,,,true,true,,unknown,下册,华东师大版_八年级_义务教育教科书·数学八年级下册.json,数学,176,初中_数学_华东师大版_八年级_义务教育教科书·数学八年级下册
华东师大版_八年级_义务教育教科书·数学八年级下册_chunk_12,12,"L L L L cL L L iL， eae 和人 站二 人人 As 164 . 数学实验附 图格 点图 四四 . . . fit : 一 《学实验附 图一 数学实 166 站尝 实用附 辣数学实验附 图 . 167 后记 华东师 大版 初中数学教材是 最早 通过教育部 审查的 新课 标初中数学教材之 一 . 自 200L 年秋季在 7 个国家级 实验区 投入实验以 来 ,已有 分布 在 26 个省 、 市 .自治区 的地 市选用过 或正在选用本 套教 材 . 10 多年 来 ,实验区 的广大师 生对 本套 教材寄 子了 厚爱 ,为它 的不 断完 善提 出了 许多宝贵意见 . 根据这 些意 见 , 在实验期 间 ,我们 对教材进行了 多次 修改 . 在此 ,我们 对多 年来 给予 本套 教材 关心 的各 级领导广 术实验区 师生 和各 位同仁表示衷心感谢 . 根据教育部 的统 地部署, 在 2012 年前 要完成义务教育阶段所 有新 课标 教材 的修订工作 . 为于 确保术 套教材修订工作的 顺利进行 ,在 2011 年 4 月至 7 月间 ,我们 就本 套教 材的 修订广泛征求了 一线 教师的 意见 . 2011 年 9 月在 南京召 开本华东师 大版 初中数学教材修订研讨会 ,来自 实验区 的 120 多名 教研员 和骨干教师以 及全 体编 写人 员人 参加了 会议 . 会议 期间 就本 套教材修订的 整体框架达成了 广泛共识 . 本套 教材 的修订稿 完成 后 ,我们 又特 邀有 关专 家和 来自 教学",665,0.35077207001950195,low,ocr,"----===-L---=--====L-----====-L---=-=-=---L-----=-=cL------=-=-L-----=-==-L---=-==-==-iL--， eae\n和\n人\n站\n二\n人\n人\nYY As\n164 . 数学 实验 附 图\n=== 第 83 页 ===\n格 点 图\n四 四 . . . fit\n: 一 《学 实验 附 图\n一 数学 实\n=== 第 84 页 ===\n166 -站 尝 实用 附 辣\n=== 第 85 页 ===\n数学 实验 附 图 . 167\n=== 第 86 页 ===\n后 记\n华东 师 大 版 初中 数学 教材 是 最 早 通过 教育 部 审查 的 新 课 标 初中 数学 教材\n之 一 . 自 200L 年 秋季 在 7 个 国家 级 实验 区 投入 实验 以 来 ,已 有 分 布 在 26 个 省 、\n市 .自治 区 的 地 市 选用 过 或 正在 选用 本 套 教 材 . 10 多 年 来 ,实验 区 的 广大 师 生 对\n本 套 教材 寄 子 了 厚爱 ,为 它 的 不 断 完 善 提 出 了 许多 宝贵 意见 . 根据 这 些 意 见 , 在\n实验 期 间 ,我 们 对 教材 进行 了 多 次 修改 . 在 此 ,我 们 对 多 年 来 给 予 本 套 教 材 关 心\n的 各 级 领导 广 术 实验 区 师 生 和 各 位 同仁 表示 衷心 感谢 .\n根据 教育 部 的 统 地 部署, 在 2012 年 前 要 完成 义务 教育 阶段 所 有 新 课 标 教\n材 的 修订 工作 . 为 于 确保 术 套 教材 修订 工作 的 顺利 进行 ,在 2011 年 4 月 至 7 月\n间 ,我 们 就 本 套 教 材 的 修订 广泛 征求 了 一 线 教师 的 意见 . 2011 年 9 月 在 南京 召\n开本 华东 师 大 版 初中 数学 教材 修订 研讨 会 ” ,来 自 实验 区 的 120 多 名 教研 员 和\n骨干 教师 以 及 全 体 编 写 人 员 人 参加 了 会 议 . 会 议 期 间 就 本 套 教材 修订 的 整体 框架\n达成 了 广泛 共识 . 本 套 教 材 的 修订 稿 完 成 后 ,我 们 又 特 邀 有 关 专 家 和 来 自 教学",2.0,72.4659090909091,华东师大版_八年级_义务教育教科书·数学八年级下册,81,2025-07-21T14:24:55.862Z,2.0,义务教育教科书·数学八年级下册,/Users/LeoQin/Documents/GitHub/PDFconvertor/training_data/初中/数学/华东师大版-华东师范大学出版社/八年级/义务教育教科书·数学八年级下册.pdf,八年级,tesseract.js-parallel,unknown,0.8257261410788381,0.5,1,72.4659090909091,,true,,true,,,mathematics,下册,华东师大版_八年级_义务教育教科书·数学八年级下册.json,数学,176,初中_数学_华东师大版_八年级_义务教育教科书·数学八年级下册
华东师大版_八年级_义务教育教科书·数学八年级下册_chunk_13,13,"2011 年 9 月在 南京召 开本华东师 大版 初中数学教材修订研讨会 ,来自 实验区 的 120 多名 教研员 和骨干教师以 及全 体编 写人 员人 参加了 会议 . 会议 期间 就本 套教材修订的 整体框架达成了 广泛共识 . 本套 教材 的修订稿 完成 后 ,我们 又特 邀有 关专 家和 来自 教学一 线的 教师进行了 审稿 . 参与本 册教 材审 稿的 有冯 国卫 、 郭奕 津等 专家和 教师 . 尽管我 们对 修订工作倾注了 心血 4 但现在呈现在 广大师 生面前的 修订教材肯定还 存在有 竺进一步完善的 地方 . 我们 真诚希望广大师 生继续关心我 们的 教材 ,对我 们的 教材不 断提出新 的宝贵意见 . 本册 教材 修订的 扎稿 人如 下 (以姓氏笔画为 序六 王继 延 、 李宏 . 李俊 、 吴中 才沈 加 、 唐复苏 、. 程靖 . 编者 168 .后记 2. 计算 : 国二 二 ) 二让 4 2 4 时 o2 1 or o (人 ar2 9 习题和 612 1 计算 : (1) 2 2 (2) 也攻 8x27i 7 Ty 好一 2x 1 和四 30 人 TFeng 2e) 2. 计算 : 生生 t 1 1 和 3. 计算 : 中信二 :二 ha 1 1 .fxz y (2 二 5 4. 林林 家与 学校 的距离为 c 千米 , 林林 骑自行车 伏家 到学 校需要分 钟 . 某天 , 林林 从家 骑自 行车出 发分钟后 ,爸爸才 从家 骑自 行桔 出发 ,结果和 沟爸 与林 林同 时到 达学 校 . 爸爸每 分钟 比林 林多 骑多 少千 米 ? S. 周末 ,小颖 跟妈 妈到 水果 批发 市场 去买 苹果 . 那里有 两种 蔷果 , 甲种 苹果每 箱净",749,0.3222491203400916,low,ocr,"2011 年 9 月 在 南京 召\n开本 华东 师 大 版 初中 数学 教材 修订 研讨 会 ” ,来 自 实验 区 的 120 多 名 教研 员 和\n骨干 教师 以 及 全 体 编 写 人 员 人 参加 了 会 议 . 会 议 期 间 就 本 套 教材 修订 的 整体 框架\n达成 了 广泛 共识 . 本 套 教 材 的 修订 稿 完 成 后 ,我 们 又 特 邀 有 关 专 家 和 来 自 教学\n一 线 的 教师 进行 了 审 稿 . 参与 本 册 教 材 审 稿 的 有 冯 国 卫 、 郭 奕 津 等 专家 和 教师 .\n尽管 我 们 对 修订 工作 倾注 了 心血 4 但 现在 呈现 在 广大 师 生 面前 的 修订 教材\n肯定 还 存在 有 竺 进一步 完善 的 地 方 . 我 们 真诚 希望 广大 师 生 继续 关心 我 们 的 教\n材 ,对 我 们 的 教材 不 断 提出 新 的 宝贵 意见 .\n本 册 教 材 修订 的 扎 稿 人 如 下 (以 姓氏 笔画 为 序 六\n王 继 延 、 李 宏 . 李 俊 、 吴 中 才 沈 加 、 唐 复苏 、. 程 靖 .\n编 者\n168 .后 记\n=== 第 87 页 ===\n2. 计算 :\n国 二 + 二 @) 二 -让\n4 2 4\n时 o2-1 or+o (人 ar2+9\n习题 和 612\n1 计算 :\n(1) 2 2 (2) 也 攻 =8x27i\nTIX 7 Ty\n好 一 2x +1 YX 和 四 30\n人 TFeng @ | 2e)\n2. 计算 :\nCD 生生 @ £-t\n1 1 和\n3. 计算 :\n中信 -二 :二 ha\n1 1 .fxz+y\n(2 二 -5\n4. 林 林 家 与 学 校 的 距离 为 c 千 米 , 林 林 骑 自行 车 伏 家 到 学 校 需要 分 钟 . 某 天 , 林\n林 从 家 骑 自 行车 出 发 分钟 后 ,爸爸 才 从 家 骑 自 行 桔 出 发 ,结果 和 沟 爸 与 林 林 同\n时 到 达 学 校 . 爸爸 每 分 钟 比 林 林 多 骑 多 少 千 米 ?\nS. 周末 ,小 颖 跟 妈 妈 到 水 果 批 发 市 场 去 买 苹果 . 那里 有 两 种 蔷 果 , 甲 种 苹果 每 箱 净",2.0,72.4659090909091,华东师大版_八年级_义务教育教科书·数学八年级下册,82,2025-07-21T14:24:55.862Z,2.0,义务教育教科书·数学八年级下册,/Users/LeoQin/Documents/GitHub/PDFconvertor/training_data/初中/数学/华东师大版-华东师范大学出版社/八年级/义务教育教科书·数学八年级下册.pdf,八年级,tesseract.js-parallel,unknown,0.7701149425287356,0.5,1,72.4659090909091,,true,,true,true,,mathematics,下册,华东师大版_八年级_义务教育教科书·数学八年级下册.json,数学,176,初中_数学_华东师大版_八年级_义务教育教科书·数学八年级下册
华东师大版_八年级_义务教育教科书·数学八年级下册_chunk_14,14,"车伏 家到 学校 需要分 钟 . 某天 , 林林 从家 骑自 行车出 发分钟后 ,爸爸才 从家 骑自 行桔 出发 ,结果和 沟爸 与林 林同 时到 达学 校 . 爸爸每 分钟 比林 林多 骑多 少千 米 ? S. 周末 ,小颖 跟妈 妈到 水果 批发 市场 去买 苹果 . 那里有 两种 蔷果 , 甲种 苹果每 箱净 重闯 千克 , 售价 元 ; 乙种 苹果每 箱净重千克 , 售价 4 元 . 放问 ,里种 苹果的 单价 是乙 种苹果的 多少 倍 ? 10 .第 16 章分 式阅读材料下 类比 学习 分式 . 时 j 我们 注意将 分式 与分 数进行类 比 , 通过 回忆分 数的 有关 知识 来探索咳 现 5 天立 分式 的新 知识 . 重班 直小 荡草 割破 手发 明了锯 , 维也 纳医 生奥 恩布 鲁格 由父亲融 击酒 桶判 断酒 的多 少顷 明了了 扫诊 法 ,仿生学 利用生物的 结构和 功能原理来 研制机 械或 各种 新技术 . 这些 平凡 而作 夫的 创意都 源自 类比 . 什么是 类比 呢 ? 珀学 家 、 才学 教育家 波利 亚说 过 : 类比 就是 一种 相似 . 有具 体地 说 ,类比 是一 种推理形式 , 当忆 经建立两 个对 象在 某些 性质 上的 类似 之处 以后 ,可能 (并非 必定 ) 推出 它们在 其他 某些 性质 上的 类似 . 这种 推理形式的 结构可 以表示如 下对 象 A 有性 质 P, Q, R, , X 对象 B 有性 质 P, Q, R, 推测 (猜想 ) : B 可能 好有 己质 站就 拿分 数和 分式 来说 吧 . 从表示形式有意文 求看 8 分数 的形式是 下 (w、1 是整数 ,b 关 0) , 它表示两 个整数的 商 ;分式 的形式是 5 (ABHEXB 二 0)， 它",773,0.45626431420559194,medium-low,ocr,"车 伏 家 到 学 校 需要 分 钟 . 某 天 , 林\n林 从 家 骑 自 行车 出 发 分钟 后 ,爸爸 才 从 家 骑 自 行 桔 出 发 ,结果 和 沟 爸 与 林 林 同\n时 到 达 学 校 . 爸爸 每 分 钟 比 林 林 多 骑 多 少 千 米 ?\nS. 周末 ,小 颖 跟 妈 妈 到 水 果 批 发 市 场 去 买 苹果 . 那里 有 两 种 蔷 果 , 甲 种 苹果 每 箱 净\n重 闯 千 克 , 售 价 < 元 ; 乙 种 苹果 每 箱 净重 千克 , 售 价 4 元 . 放 问 ,里 种 苹果 的 单\n价 是 乙 种 苹果 的 多 少 倍 ?\n10 .第 16 章 分 式\n=== 第 88 页 ===\n| 阅读 材料 下\n类 比\n学 习 分 式 . 时 j 我 们 注意 将 分 式 与 分 数 进行 类 比 , 通 过 回忆 分 数 的 有 关 知 识 来\n探索 咳 现 5 天 立 分 式 的 新 知识 .\n重 班 直 小 荡 草 割 破 手 发 明了 锯 , 维 也 纳 医 生 奥 恩 布 鲁 格 由 父亲 融 击 酒 桶 判\n断 酒 的 多 少 顷 明了 了 扫 诊 法 ,仿生 学 利用 生物 的 结构 和 功能 原理 来 研制 机 械 或 各\n种 新 技术 . 这 些 平 凡 而 作 夫 的 创意 都 源 自 类 比 .\n什么 是 类 比 呢 ? 珀 学 家 、 才 学 教育 家 波 利 亚 说 过 :“ 类 比 就 是 一 种 相似 . ”有 具\n体 地 说 ,类 比 是 一 种 推理 形式 , 当 忆 经 建立 两 个 对 象 在 某 些 性 质 上 的 类 似 之 处 以\n后 ,可 能 (并 非 必定 ) 推 出 它们 在 其 他 某 些 性 质 上 的 类 似 .\n这 种 推理 形式 的 结构 可 以 表示 如 下\n对 象 A 有 性 质 P, Q, R, ---, X\n对 象 B 有 性 质 P, Q, R, …\n推测 (猜想 ) : B 可 能 好 有 己 质 站\n就 拿 分 数 和 分 式 来 说 吧 . 从 表示 形式 有意 文 求 看 8 分 数 的 形式 是 下 (w、1 是\n整数 ,b 关 0) , 它 表示 两 个 整数 的 商 ;分 式 的 形式 是 5 (ABHEXB 二 0) ， 它",2.0,72.4659090909091,华东师大版_八年级_义务教育教科书·数学八年级下册,83,2025-07-21T14:24:55.862Z,2.0,义务教育教科书·数学八年级下册,/Users/LeoQin/Documents/GitHub/PDFconvertor/training_data/初中/数学/华东师大版-华东师范大学出版社/八年级/义务教育教科书·数学八年级下册.pdf,八年级,tesseract.js-parallel,unknown,0.8380952380952381,0.5,1,72.4659090909091,,,,true,true,,biology,下册,华东师大版_八年级_义务教育教科书·数学八年级下册.json,数学,176,初中_数学_华东师大版_八年级_义务教育教科书·数学八年级下册
华东师大版_八年级_义务教育教科书·数学八年级下册_chunk_15,15,"下对 象 A 有性 质 P, Q, R, , X 对象 B 有性 质 P, Q, R, 推测 (猜想 ) : B 可能 好有 己质 站就 拿分 数和 分式 来说 吧 . 从表示形式有意文 求看 8 分数 的形式是 下 (w、1 是整数 ,b 关 0) , 它表示两 个整数的 商 ;分式 的形式是 5 (ABHEXB 二 0)， 它表示两 个整 式的 商 . 从基本性 质来 看 ,分数 的分 子 、 分母 同乘 以一 个不 等村 零的 数 , 分数 的大 小不 变 , 它是 分数 约分 和通 分的 依据 ;分式 也有 类似 的基本性 硕 , 它是 分式 约分 和通 分的 依据 . 其他 方面 ,从约 分 . 通分 到运算 ,甚至是 最简 分式 与最 简分 数 【 既约 分数 ) 的概念 ,分式 与分 数都 十分 相似 ! 类比 是我 们学 习数 学的 一种 有效 方法 ,我们 还可 以举 出许多例子如 学习 整式 时 ,常常可 以和 整数类 比 . 两个 整数的 和 、 差 、 积仍 是整数 ,但两 个整数的 商却 第 106 章分 式 . 11 文务 教育才 科书 on L 了， 北学 Am jsHUXUE 1 二从 上并。 八年 级 T 办性 人 _ p， 主 WoEm E4EE 一一 复苏二 目， 4 人四 3 华攻 师范大 学出 版村 5 生海 未必 是整数 ,从而 需要引进分 数 ;类似 地 ,两个 整式 的和 、 差 、 积仍 是整 式 ,但两 个整 式的 商未 必是 整式 , 从而 需要引进分 式 . 整式 的因 式分 解可 以与 整数的 因数分 解类 比遇 等等 . 类比 通揭示自然界 的奥秘 , 它是 数学发 现的 重要方法 . 但类 比不 具有证 明的",747,0.31466056463068176,low,ocr,"下\n对 象 A 有 性 质 P, Q, R, ---, X\n对 象 B 有 性 质 P, Q, R, …\n推测 (猜想 ) : B 可 能 好 有 己 质 站\n就 拿 分 数 和 分 式 来 说 吧 . 从 表示 形式 有意 文 求 看 8 分 数 的 形式 是 下 (w、1 是\n整数 ,b 关 0) , 它 表示 两 个 整数 的 商 ;分 式 的 形式 是 5 (ABHEXB 二 0) ， 它\n表示 两 个 整 式 的 商 .\n从 基本 性 质 来 看 ,分 数 的 分 子 、 分 母 同 乘 以 一 个 不 等 村 零 的 数 , 分 数 的 大 小\n不 变 , 它 是 分 数 约 分 和 通 分 的 依据 ;分 式 也 有 类 似 的 基本 性 硕 , 它 是 分 式 约 分 和\n通 分 的 依据 .\n其 他 方面 ,从 约 分 . 通 分 到 运算 ,甚至 是 最 简 分 式 与 最 简 分 数 【 既 约 分 数 ) 的\n概念 ,分 式 与 分 数 都 十 分 相似 !\n类 比 是 我 们 学 习 数 学 的 一 种 有 效 方法 ,我 们 还 可 以 举 出 许多 例子 如 学 习 整\n式 时 ,常常 可 以 和 整数 类 比 . 两 个 整数 的 和 、 差 、 积 仍 是 整数 ,但 两 个 整数 的 商 却\n第 106 章 分 式 . 11\n=== 第 89 页 ===\n文 务 教育 才 科 书\n> on L\n— 了\n> ， 北 学\nAm\njsHUXUE\n1 二\n从 上 并。 八 年 级 T#\n办 性 ——\n人\n—_— p—\n， 主 WoEm\nAE E4EE\n一 一 复苏 二\n目 ， 4\n人\n四\n=\n3 =\n© 华 攻 师范 大 学 出 版 村\n5 生 海 …\n=== 第 90 页 ===\n未 必 是 整数 ,从 而 需要 引进 分 数 ;类 似 地 ,两 个 整 式 的 和 、 差 、 积 仍 是 整 式 ,但 两 个\n整 式 的 商 未 必 是 整 式 , 从 而 需要 引进 分 式 . 整 式 的 因 式 分 解 可 以 与 整数 的 因数 分\n解 类 比 遇 等 等 .\n类 比 通 揭示 自然 界 的 奥秘 , 它 是 数学 发 现 的 重要 方法 . 但 类 比 不 具有 证 明 的",2.0,72.4659090909091,华东师大版_八年级_义务教育教科书·数学八年级下册,84,2025-07-21T14:24:55.862Z,2.0,义务教育教科书·数学八年级下册,/Users/LeoQin/Documents/GitHub/PDFconvertor/training_data/初中/数学/华东师大版-华东师范大学出版社/八年级/义务教育教科书·数学八年级下册.pdf,八年级,tesseract.js-parallel,unknown,0.7782178217821782,0.5,1,72.4659090909091,true,,,true,,,mathematics,下册,华东师大版_八年级_义务教育教科书·数学八年级下册.json,数学,176,初中_数学_华东师大版_八年级_义务教育教科书·数学八年级下册
华东师大版_八年级_义务教育教科书·数学八年级下册_chunk_16,16,"整数 ,从而 需要引进分 数 ;类似 地 ,两个 整式 的和 、 差 、 积仍 是整 式 ,但两 个整 式的 商未 必是 整式 , 从而 需要引进分 式 . 整式 的因 式分 解可 以与 整数的 因数分 解类 比遇 等等 . 类比 通揭示自然界 的奥秘 , 它是 数学发 现的 重要方法 . 但类 比不 具有证 明的 力量 . 由关 吡得 到的 结论可 能成 立 ,也可 能不 成立 , 需要 进一步研究 ,加以 证明 或反 驱科学宗 净火星与 地球 作了 类比 ,发现 火星 有很 多与 地球 类似 之处 :火星是 行星 ,围绕太阳运行 8 绕辆 自转 ;火星上 有大 气层 ,空气成 分很 类似 , 一年 中有 四季 的变更 ;火星汪 有水 员部 分时 间的 温度适合地 球上 某些 已知 生物的 生存 . 地球 上有 生命存在 ,科学家 推测 :火星上 也可 能有 生命存在 ! 但事实究竟怎样 ,还需 进一步的 科学考证 . 在数学学 习时 理解这 二点 也很 本要 . 例如 ,学习 一元 一次 不等 式 , 它的 解法 、 步骤与 解一 元一 次方程非常相似还 等式 与等 式的 性质 也有 类似 的地 方 ,但是 不能 全盘 照搬 ,特别是 不等 芍的 两边 同乘 以一 个负数时 ,不等 号的 方向要 改变 ,在运用类 比时 应该 引起注意 . 忆 SNf 名二 元一 次口 va 一口 方程的 分式 方程 轮船在 顺水中 航行 80 千米 所需 的时 间和 逆水中 航行 2 60 千米 所需 的时 间相 同 . 已知 水流 的速度是 3 千米 时， 12 .第 16 章分 式设 轮船 在静水中 的速度为 千米 时 ,根据题 意， 得 80 60 v 3 x 3 ( )",745,0.4710895816115703,medium-low,ocr,"整数 ,从 而 需要 引进 分 数 ;类 似 地 ,两 个 整 式 的 和 、 差 、 积 仍 是 整 式 ,但 两 个\n整 式 的 商 未 必 是 整 式 , 从 而 需要 引进 分 式 . 整 式 的 因 式 分 解 可 以 与 整数 的 因数 分\n解 类 比 遇 等 等 .\n类 比 通 揭示 自然 界 的 奥秘 , 它 是 数学 发 现 的 重要 方法 . 但 类 比 不 具有 证 明 的\n力量 . 由 关 吡 得 到 的 结论 可 能 成 立 ,也 可 能 不 成 立 , 需 要 进一步 研究 ,加 以 证 明 或\n反 驱 -\n科学 宗 净 火星 与 地 球 作 了 类 比 ,发 现 火 星 有 很 多 与 地 球 类 似 之 处 :火星 是 行\n星 ,围绕 太阳 运行 8 绕 辆 自转 ;火星 上 有 大 气 层 ,空气 成 分 很 类 似 , 一 年 中 有 四 季\n的 变更 ;火星 汪 有 水 员 部 分 时 间 的 温度 适合 地 球 上 某 些 已 知 生物 的 生存 . 地 球\n上 有 生命 存在 ,科学 家 推测 :火星 上 也 可 能 有 生命 存在 ! 但 事实 究竟 怎样 ,还 需\n进一步 的 科学 考证 .\n在 数学 学 习 时 理解 这 二 点 也 很 本 要 . 例如 ,学 习 一 元 一 次 不 等 式 , 它 的 解法 、\n步骤 与 解 一 元 一 次 方程 非常 相似 还 等 式 与 等 式 的 性 质 也 有 类 似 的 地 方 ,但 是 不\n能 全 盘 照搬 ,特别 是 不 等 芍 的 两 边 同 乘 以 一 个 负数 时 ,不 等 号 的 方向 要 改变 ,在\n运用 类 比 时 应 该 引起 注意 .\n忆 > — — SNf\n名 二 元 一 次\n口 va 一 口\n方程 的 分 式 方 程\n轮船 在 顺水 中 航行 80 千 米 所 需 的 时 间 和 逆水 中 航行\n2 60 千 米 所 需 的 时 间 相 同 . 已 知 水 流 的 速度 是 3 千 米 / 时 ，\n12 .第 16 章 分 式\n=== 第 91 页 ===\n设 轮 船 在 静水 中 的 速度 为 * 千 米 / 时 ,根据 题 意 ，\n得\n80 60\nv+3 x-3 (*)",2.0,72.4659090909091,华东师大版_八年级_义务教育教科书·数学八年级下册,85,2025-07-21T14:24:55.862Z,2.0,义务教育教科书·数学八年级下册,/Users/LeoQin/Documents/GitHub/PDFconvertor/training_data/初中/数学/华东师大版-华东师范大学出版社/八年级/义务教育教科书·数学八年级下册.pdf,八年级,tesseract.js-parallel,unknown,0.8689788053949904,0.5,1,72.4659090909091,,,,true,,,physics,下册,华东师大版_八年级_义务教育教科书·数学八年级下册.json,数学,176,初中_数学_华东师大版_八年级_义务教育教科书·数学八年级下册
