Chunk_ID,Chunk_Index,Content,Content_Length,Quality_Score,Reliability,Source_Type,Original_Content,Enhancement_Version,averageConfidence,book_name,chunkIndex,enhancementTimestamp,enhancementVersion,fileName,filePath,grade,ocrMethod,publisher,qualityMetrics_chineseCharRatio,qualityMetrics_coherenceScore,qualityMetrics_lengthScore,qualityMetrics_ocrConfidence,semanticFeatures_hasDefinition,semanticFeatures_hasExperiment,semanticFeatures_hasFormulas,semanticFeatures_hasNumbers,semanticFeatures_hasQuestion,semanticFeatures_isTableContent,semanticFeatures_subjectArea,semester,source_file,subject,totalPages,uniqueId
华东师大版_八年级_义务教育教科书·数学八年级下册_chunk_0,0,"我们 已经 知道 ,有一 个角 是直角的 平行四 边形 是抵 形 ,这是 矩形的 定义 ,我们 可以 依此 判定一 个四 边形 是否 是矩形 . 除此 之外 ,我们 能否 找到其 他判定矩形的 方法呢 ? 矩形是 特殊的 平行四 边形 ,具有如 下性 质 ; 1， 四个 角都 是直角 ; 2， 两条 对角 线相等 . 这些 性质 , 对我 们寻找判定矩形的 方法有 什么启示 ? 让我 们先 思考有 关的 角 . 由矩形的 性质 四个 角都 是直角你 可能 会想到 ,如果 一个 四边 形的 四个 角都 是直角 5 那它 肯定 是一 个拨 形 . 的确 如此 ,但是 ,条件 能否 再减 恩些 : 径个 角是 直角的 四边 形是 矩形吗 ? 试企 恩如 图 19. 此 8 , 作一 :从享 个角 都是 直角的 四边 形 , a Te E19.4.8 步又: 1 任意作 两条 互相垂直的 线段人 2 AD; 2 过点 妇作 垂直于 的直线 3 过点 刀作 垂直于 的直线 m 58 F45 全即 得一 个三 个角 都是 直角的 四边 形 ABCD, 观察你 所作 的图 形 , 它是 一个 矩形吗 ? 1 由此 可以 得到 判定矩形的 一种 方法 : 二短 形的 判定定理 1 有三 个角 是直角的 四边 形是 矩形 102 .第 19 章垂 形 . 痊形 与正方形 现春 狂我 们再 思考有 关的 线段对 角线 相等 ""是抵 形所 特有的 性质 . 那么从 对角 线的 角度 ,你可 以得 到关于矩形判定的 什各 猜想与 你的 同伴交流一 下 ,看看 你们 的想法是 否三 致可 行 . 由此 ,我们 可以 得到 一个 猜想 : ""如果 一个 平行四 边形 的两 条对 角线 相等 ,那么这 个平行四 边形 是矩形 . (人会",766,0.36094504472271904,low,ocr,"我 们 已 经 知道 ,有 一 个 角 是 直角 的 平行 四 边 形 是 抵\n形 ,这 是 矩形 的 定义 ,我 们 可 以 依 此 判定 一 个 四 边 形 是 否\n是 矩形 . 除 此 之 外 ,我 们 能 否 找到 其 他 判定 矩形 的 方法 呢 ?\n矩形 是 特殊 的 平行 四 边 形 ,具有 如 下 性 质 ;\n1， 四 个 角 都 是 直角 ;\n2， 两 条 对 角 线 相等 .\n这 些 性 质 , 对 我 们 寻找 判定 矩形 的 方法 有 什么 启示 ?\n让 我 们 先 思考 有 关 的 角 . 由 矩形 的 性 质 * 四 个 角 都\n是 直角 ”* 你 可 能 会 想到 ,如 果 一 个 四 边 形 的 四 个 角 都 是\n直角 5 那 它 肯 定 是 一 个 拨 形 . 的 确 如 此 ,但 是 ,条 件 能 否 再\n减 恩 - 些 : 径 个 角 是 直角 的 四 边 形 是 矩形 吗 ?\n试 企 恩\n如 图 19. 此 8 , 作 一 :从 享 个 角 都 是 直角 的 四 边 形 ,\n\ | a\nTe\nE19.4.8\n步 又:\n1 任意 作 两 条 互相 垂直 的 线段 人 2< AD;\n2 过 点 妇 作 垂直 于 AB 的 直线\n3 过 点 刀 作 垂直 于 AD 的 直线 m 58 | F45 全 即 得\n一 个 三 个 角 都 是 直角 的 四 边 形 ABCD,\n观察 你 所 作 的 图 形 , 它 是 一 个 矩形 吗 ?\n1 由 此 可 以 得 到 判定 矩形 的 一 种 方法 :\n”二 短 形 的 判定 定理 1 有 三 个 角 是 直角 的 四 边 形 是 矩形\n102 .第 19 章 垂 形 . 痊 形 与 正方 形\n=== 第 15 页 ===\n现 春 狂 我 们 再 思考 有 关 的 线段 “对 角 线 相等 ""是 抵\n形 所 特有 的 性 质 . 那么 从 对 角 线 的 角度 ,你 可 以 得 到 关于\n矩形 判定 的 什 各 猜想” 与 你 的 同伴 交流 一 下 ,看 看 你 们\n的 想法 是 否 三 致 可 行 .\n由 此 ,我 们 可 以 得 到 一 个 猜想 : ""如 果 一 个 平行 四 边\n形 的 两 条 对 角 线 相等 ,那么 这 个 平行 四 边 形 是 矩形 .\n(人 -会",2.0,72.4659090909091,华东师大版_八年级_义务教育教科书·数学八年级下册,11,2025-07-21T14:24:55.861Z,2.0,义务教育教科书·数学八年级下册,/Users/LeoQin/Documents/GitHub/PDFconvertor/training_data/初中/数学/华东师大版-华东师范大学出版社/八年级/义务教育教科书·数学八年级下册.pdf,八年级,tesseract.js-parallel,unknown,0.8442776735459663,0.6,1,72.4659090909091,true,true,,true,true,,mathematics,下册,华东师大版_八年级_义务教育教科书·数学八年级下册.json,数学,176,初中_数学_华东师大版_八年级_义务教育教科书·数学八年级下册
华东师大版_八年级_义务教育教科书·数学八年级下册_chunk_1,1,"_ JBIEH 一完美和 矩形在 房屋装修时 ,客厅地 面铺设地 砖 ,通常是 使用 同样大 小的 正方形 地砖 . 而车 客厅 里的 短形 地面 上 ,正方形 地砖 的大 小各 不相同 , 砖与 砖芝 间 、 砖正 墙之 间没 有空隙 ,并且能 使每 块地砖都 保持完整 , 那将 是多 么奇特别致啊 ! 第 19 章， 和矩形 .菱形与 正方形 .107 如果 一个 矩形 内部 能用 一些 大小 各不 相同的 正方形 铺满 , 既不 重登 ,又无 缝和 为完美矩形 (perfect rectangle ) . 完美天 形非常罕见 ,一旦 遇到 ,总会 立 X 注意 ,多看 几眼 . XS 1 o 9 . 2 . 因是 一个 完关 竹 1 上 . 论是 用 10 个不 同大 小的 正方形 拼成 的 ,其中 最小 的一 个正方形 内写 着数字 3 潜了 明它 的边 长是 3, 其他 正方形 内用 字母表示边 长 . 图中 这些 用字母表示的 正方形 边少 ? 这个 完美矩形的 长和 宽又 是多 少呢 ? 由该 图可 以看 出各 条边 的长 满下 关 A a g 3, 4 h g 3, b a 3 e 0b d, f d e, h d f 3, c b e, k f h, e ec f k 这样 就构成了 一个 九元 一次 方程组 . 由前 六个 式子 可得 g 2d. 由此 容易求 出 108 . 第 19 章矩形. 装形 与正方形 a 25,b 17,c 23， d 11,e 6,f 5, g 22,h 19,k 24. 短形 的长 和宽 分别 是 65 和 47. 图提 申的 大形 由 10 个正方形 拼成 , 称为 10 阶完美矩形 . 这是 一个 非常好 的例子 ; 珑形 的卫 和宽 很小 ,正方形 个数 也相对较 少 .",777,0.32305081564374716,low,ocr,"_—\n| JBIEH# | 一\n完美 和 矩形\n在 房屋 装修 时 ,客厅 地 面 铺设 地 砖 ,通常 是 使 用 同样 大 小 的 正方 形 地 砖 .\n而 车 客 厅 里 的 短 形 地 面 上 ,正方 形 地 砖 的 大 小 各 不 相同 , 砖 与 砖 芝 间 、 砖 正\n墙 之 间 没 有 空隙 ,并且 能 使 每 块 地砖 都 保持 完整 , 那 将 是 多 么 奇特 别致 啊 !\n第 19 章 ， 和 矩形 .菱形 与 正方 形 .107\n=== 第 20 页 ===\n如 果 一 个 矩 形 内 部 能 用 一 些 大 小 各 不 相同 的 正方 形 铺 满 , 既 不 重 登 ,又 无 缝\n和 为 完美 矩形 (perfect rectangle ) . 完美 天 形 非常 罕见 ,一 旦 遇 到 ,总 会 立\nX& 注意 ,多 看 几 眼 .\n-XS\n1 o 9 .\n2\.\n因 是 一 个 完 关 竹 1 上 . 论 是 用 10 个 不 同 大 小 的 正方 形 拼 成 的 ,其 中\n最 小 的 一 个 正方 形 内 写 着 数字 3 潜 了 明 它 的 边 长 是 3, 其 他 正方 形 内 用 字母 表示\n边 长 .\n图 中 这 些 用 字母 表示 的 正方 形 边 少 ? 这 个 完美 矩形 的 长 和 宽 又 是\n多 少 呢 ?\n由 该 图 可 以 看 出 各 条 边 的 长 满 下 关 A\na=g+3, 4\nh=g-3,\nb=a+3-\ne=0b-d,\nf=d-e,\nh=d+f+3,\nc=b+e,\nk=f+h,\ne+ec=f+k\n这 样 就 构成 了 一 个 九 元 一 次 方程 组 . 由 前 六 个 式 子 可 得\ng = 2d.\n由 此 容易 求 出\n108 . 第 19 章 矩形. 装 形 与 正方 形\n=== 第 21 页 ===\na=25,b=17,c =23，\nd=11,e=6,f=5,\ng=22,h=19,k =24.\n短 形 的 长 和 宽 分 别 是 65 和 47.\n图 提 申 的 大 形 由 10 个 正方 形 拼 成 , 称 为 10 阶 完美 矩形 . 这 是 一 个 非常 好 的\n例子 ; 珑 形 的 卫 和 宽 很 小 ,正方 形 个 数 也 相对 较 少 .",2.0,72.4659090909091,华东师大版_八年级_义务教育教科书·数学八年级下册,17,2025-07-21T14:24:55.861Z,2.0,义务教育教科书·数学八年级下册,/Users/LeoQin/Documents/GitHub/PDFconvertor/training_data/初中/数学/华东师大版-华东师范大学出版社/八年级/义务教育教科书·数学八年级下册.pdf,八年级,tesseract.js-parallel,unknown,0.6848030018761726,0.5,1,72.4659090909091,,,,true,true,,mathematics,下册,华东师大版_八年级_义务教育教科书·数学八年级下册.json,数学,176,初中_数学_华东师大版_八年级_义务教育教科书·数学八年级下册
华东师大版_八年级_义务教育教科书·数学八年级下册_chunk_2,2,"与正方形 a 25,b 17,c 23， d 11,e 6,f 5, g 22,h 19,k 24. 短形 的长 和宽 分别 是 65 和 47. 图提 申的 大形 由 10 个正方形 拼成 , 称为 10 阶完美矩形 . 这是 一个 非常好 的例子 ; 珑形 的卫 和宽 很小 ,正方形 个数 也相对较 少 . 细碱 . 完并 矩形的 正方形 个数 能不 能更 少些 呢 ? 图 2 是一 个 98 防宕 美矩 形的 例子 , 它的 长和 宽分 别是 33 和 32, 组成 它的 9 个正方形 , 边长 让、 到其 , 硕次 是 :1,4,7,8,9,10,14,15 ,18. 本上 S IH 本图 2 正方形 的个 数还 能不 能再 减少呢 ? 角丰 能用 Si 介边 长各 不相同的 正方形 拼成 一个 矩形 ? 这是 不可 能的 ,数学上 已经 证明 ,完美矩形的 最候 阶数 是 9 完美矩形的 例子再 次告诉我 们 ,在日 常生活 帅 , 隆含 若许 多数学道理 ,等待 我们 去研究和 探索 . 第 19 章， 和矩形 . 装形 与正方形 .109 一二 一 oF 1. 将一 张矩 形前 纸而 折 , 再对 折 , 然后 沿着 图中 的虚线剪 址 : 打产 , 称发 现这 是一 个什么卜 、 样的 图形 ? 人、 一站 这款 是另 一种 特殊的 平行四 边形 , 即萎 形 (thombus)， 如图 琛于 下楼 形是 有一 组邻 边相 等的 平行四 边形 . 图 19.2.1 作为一 种特殊前 平簿 四统 形 ,菱形具有平行四 边形 的一 般性 质 ,同时也 具有一 些特殊的 性质 . 观察图 19. 2. 1 所示 的萎 形 ,将你 的发 现重 入下 表 Town Jot L omn 平行四 边形 的 3 次形 的",773,0.32258535613870665,low,ocr,"与 正方 形\n=== 第 21 页 ===\na=25,b=17,c =23，\nd=11,e=6,f=5,\ng=22,h=19,k =24.\n短 形 的 长 和 宽 分 别 是 65 和 47.\n图 提 申 的 大 形 由 10 个 正方 形 拼 成 , 称 为 10 阶 完美 矩形 . 这 是 一 个 非常 好 的\n例子 ; 珑 形 的 卫 和 宽 很 小 ,正方 形 个 数 也 相对 较 少 .\n细 碱 . 完 并 矩形 的 正方 形 个 数 能 不 能 更 少 些 呢 ?\n图 2 是 一 个 98 防 宕 美 矩 形 的 例子 , 它 的 长 和 宽 分 别 是 33 和 32, 组 成 它 的 9\n个 正方 形 , 边 长 让、 到 其 , 硕 次 是 :1,4,7,8,9,10,14,15 ,18.\n本 上\nS |\n[IH 本\n图 2\n正方 形 的 个 数 还 能 不 能 再 减少 呢 ? 角 丰 能 用 Si 介 边 长 各 不 相同 的 正方 形 拼\n成 一 个 矩形 ?\n这 是 不 可 能 的 ,数学 上 已 经 证 明 ,完美 矩形 的 最 候 阶 数 是 9\n完美 矩形 的 例子 再 次 告诉 我 们 ,在 日 常生 活 帅 , 隆 含 若 许 多 数学 道理 ,等 待\n我 们 去 研究 和 探索 .\n第 19 章 ， 和 矩形 . 装 形 与 正方 形 .109\n=== 第 22 页 ===\n一 二 一 /\noF = >\n1. ZIPER\n将 一 张 矩 形 前 纸 而 折 , 再 对 折 , 然 后 沿 着 |\n图 中 的 虚线 剪 址 : 打 产 , 称 发 现 这 是 一 个 什么 卜 、 |\n样 的 图 形 ? | 人、 |\n一 站\n这 款 是 另 一 种 特殊 的 平行 四 边 形 , 即 萎 形 (thombus)，\n如 图 琛 于 下 楼 形 是 有 一 组 邻 边 相 等 的 平行 四 边 形 .\n图 19.2.1 <\n作为 一 种 特殊 前 平 簿 四 统 形 ,菱形 具有 平行 四 边 形\n的 一 般 性 质 ,同时 也 具有 一 些 特殊 的 性 质 . 观察 图 19. 2. 1\n所 示 的 萎 形 ,将 你 的 发 现 重 入 下 表\nTown Jot L [omn\n平行 四 边 形 的\n3\n次 形 的",2.0,72.4659090909091,华东师大版_八年级_义务教育教科书·数学八年级下册,18,2025-07-21T14:24:55.862Z,2.0,义务教育教科书·数学八年级下册,/Users/LeoQin/Documents/GitHub/PDFconvertor/training_data/初中/数学/华东师大版-华东师范大学出版社/八年级/义务教育教科书·数学八年级下册.pdf,八年级,tesseract.js-parallel,unknown,0.702048417132216,0.5,1,72.4659090909091,,true,,true,true,,chemistry,下册,华东师大版_八年级_义务教育教科书·数学八年级下册.json,数学,176,初中_数学_华东师大版_八年级_义务教育教科书·数学八年级下册
华东师大版_八年级_义务教育教科书·数学八年级下册_chunk_3,3,"以得 到关于鞭 形判定的 什么猜想 ? 与你 的同伴交流一 下 ,看看 你们 的想法是 否一 致 .可行 . 由此 ,我们 可以 得到 一个 猜想如果一 个平行四 边形 的两 条对 角线 互相垂直 ,那么这 个平行四 边形 是蔡 形 . 第 19 章和 扎形 、 芙形 与正方形 115 如图 19. 2. 10, 取两 根长 度不 等的 细木 棒 , 让两 个木 棒的 中点 重合并 固定在 一起 ,用笔 和直 尺画 出木 棒四 个端点的 连线 . 我们 知道 ,这样 得到 的四 边形 是一 个平行四 边形 . 转动其 中一 根木棒 , 重复 上面 的做 法 , 当两 根木棒 之间 的夹 角等 于 90。 时 ,得到 的是 什么图 形呢 ? 学交流彼此的 结 2 加外 论 . 宣 、 一一 图 19. 2. 10 会各 人鱼 和如 图 19. 2. 1 合作全 不两 条对 角线 互相垂直的 平行四 边形 . 本 2 1， 作两 条互相垂直的 直线风 . 语记 交点为 点 0; 国 1o 2 1 2 以点 0 为圆心 .适当翅 关半 径画 弧 5 在直线 m 上截取相等的 两条 线段 04 、0C; 3. 以点 0 为圆心 . 另一 适当长 勇于径 曾弧 , 在直线上 截取相等的 两条 线段 08、OD; 4、 顺次 连结所 得的 四点 , 即得 一个 对角 绕气相垂直且 平分的 四边 形 ,显然 , 它是 一个 对角 线互相垂直的 平行四 边形 , 和你 的同伴交流一 下 ,看看 它是 否也 是一 个萎 形 , 116 .第 19 章筷 形 . 凌形 与正方形 这就 是判定菱形的 另一 种方法 : 菱形的 判定定理 2 对角 线互相垂直的 平行四 边形 EEW. T 2. 如图 19. 2. 12 ,在局 4BCD 中 ,对 ,",776,0.30484665742793793,low,ocr,"以 得 到 关于 鞭 形 判定 的 什么 猜想 ? 与\n你 的 同伴 交流 一 下 ,看 看 你 们 的 想法 是 否 一 致 .可行 .\n由 此 ,我 们 可 以 得 到 一 个 猜想 “如果 一 个 平行 四 边 形\n的 两 条 对 角 线 互相 垂直 ,那么 这 个 平行 四 边 形 是 蔡 形 . ”\n第 19 章 和 扎 形 、 芙 形 与 正方 形 115\n=== 第 29 页 ===\n如 图 19. 2. 10, 取 两 根 长 度 不 等 的 细 木 棒 , 让 两 个\n木 棒 的 中 点 重合 并 固定 在 一 起 ,用 笔 和 直 尺 画 出 木 棒\n四 个 端点 的 连 线 . 我 们 知道 ,这 样 得 到 的 四 边 形 是 一 个\n平行 四 边 形 . 转动 其 中 一 根木 棒 , 重 复 上 面 的 做 法 , 当\n两 根木 棒 之 间 的 夹 角 等 于 90。 时 ,得 到 的 是 什么 图 形\n呢 ?\n学 交流 彼此 的 结 2 加 外\n论 . 宣 、 一 一\n图 19. 2. 10\n会 各 人 鱼\n和 如 图 19. 2. 1 合作 全 不 两 条 对 角 线 互相 垂直 的 平行\n四 边 形 .\n本 2\n1， 作 两 条 互相 垂直 的 直线 风 . 语 记 交点 为 点 0;\n国 1o 2 1 2 以 点 0 为 圆心 .适当 翅 关 半 径 画 弧 5 在 直线 m 上\n截取 相等 的 两 条 线段 04 、0C;\n3. 以 点 0 为 圆心 . 另 一 适当 长 勇于 径 曾 弧 , 在 直线\n”上 截取 相等 的 两 条 线段 08、OD;\n4、 顺 次 连结 所 得 的 四 点 , 即 得 一 个 对 角 绕 气相 垂直\n且 平分 的 四 边 形 ABCD ,显然 , 它 是 一 个 对 角 线 互相 垂直\n的 平行 四 边 形 ,\n和 你 的 同伴 交流 一 下 ,看 看 它 是 否 也 是 一 个 萎 形 ,\n116 .第 19 章 筷 形 . 凌 形 与 正方 形\n=== 第 30 页 ===\n这 就 是 判定 菱形 的 另 一 种 方法 :\n菱形 的 判定 定理 2 ”对 角 线 互相 垂直 的 平行 四 边 形\nEEW.\nSEERAR T 2. 如 图 19. 2. 12 ,在 局 4BCD 中 ,对 ,",2.0,72.4659090909091,华东师大版_八年级_义务教育教科书·数学八年级下册,25,2025-07-21T14:24:55.862Z,2.0,义务教育教科书·数学八年级下册,/Users/LeoQin/Documents/GitHub/PDFconvertor/training_data/初中/数学/华东师大版-华东师范大学出版社/八年级/义务教育教科书·数学八年级下册.pdf,八年级,tesseract.js-parallel,unknown,0.7777777777777778,0.5,1,72.4659090909091,,,,true,true,,mathematics,下册,华东师大版_八年级_义务教育教科书·数学八年级下册.json,数学,176,初中_数学_华东师大版_八年级_义务教育教科书·数学八年级下册
华东师大版_八年级_义务教育教科书·数学八年级下册_chunk_4,4,"所旦 日。。 有数据 ; 上让 aa， (4) OPTN P , 即可 获得这 组数据的 统计值 ,其中 平到 已 1 汉民均 数元 40. 了二 全 x 亲人你 可以 根据计算器 使用 说明 书动手试 一试 ,了解 辐司 通绚 辐扩 全伴 修改已 经输入的 数据 ,怎样简便地 输入多 个相同煞 据 : 时 1. 六站 计各 开业以 下人 ae : (1)5,5,6,6,6,7,8,8,8,8; (2)2.578,3.64, 9.8,4.6523; (3) 41, 32, 53, 43, 56, 26, 37, 58, 69, 15. 2 2. 已知 一组 数据的 平均数 等于 7 ,判断下 列说 法是 否正确 . 游不 正确 ,请举 出一 个反例 : (1) 如果 这组 数据共有三 个 , 且其 中一 个大 入必 首一 个小 于 7; (2) 如果 这组 数据共有四 个 , 且其 中两 个和 有两 个大 于 7. 区 3. 加权 平均 数在 日常生活 中 ,我们经 常会号 平声数 行交道 ,但有 时发 现以 前计算平均数 的方法并 不适 所 .请看 直面的 例子 : (1) 商店里 有两 种苹果 ,一种 单价为 3. 50 元拉克 , 另你 认为应 一种 单价为 6 元千克 . 小明 妈妈 买了 单价为 3550 元王 克该 如何 计算所 的苹果 1 千克 ,单价为 6 元千克的 苹果 3 千克 ,那么小 买苹果的 平均明 妈妈 所买 苹果的 平均价格是 两个 单价相 加陈 以 2 吗 ? 价格 ? 、 为什么 ? 134 .第 20 章数据的 整理与 初步处 理 (2) 老师在 计算学 生每 学期 的总 评成 绩时 ,并不 是简单地 将一 个学 生的 平时成 绩与 考试成 绩相 加除 以 2， 王河 而是 按照平时成 绩占 40 ,考试成 绩占 60 的比例",794,0.377751234538625,low,ocr,"所\n= 旦 日 。。 有 数据 ;\n上 让 aa， (4) [OPTN]P], 即 可 获得 这 组 数据 的 统计 值 ,其 中 平\n到 已 1 汉民 均 数 元 = 40.\n了 二 全\nx| +]\n亲人 你 可 以 根据 计算 器 使 用 说 明 书 动手 试 一 试 ,了 解\n辐 司 通 绚 辐 扩 全 伴 修改 已 经 输入 的 数据 ,怎样 简便 地 输入 多 个 相同\n煞 据 :\n时\n1. 六 站 计 各 开业 以 下 人 ae :\n(1)5,5,6,6,6,7,8,8,8,8;\n(2)2.578,3.64, 9.8,4.6523;\n(3) 41, 32, 53, 43, 56, 26, 37, 58, 69, 15. 2\n2. 已 知 一 组 数据 的 平均 数 等 于 7 ,判断 下 列 说 法 是 否 正确 . 游 不 正确 ,请 举 出 一 个 反例 :\n(1) 如 果 这 组 数据 共有 三 个 , 且 其 中 一 个 大 入 必 首 一 个 小 于 7;\n(2) 如 果 这 组 数据 共有 四 个 , 且 其 中 两 个 和 有 两 个 大 于 7.\n区\n3. 加 权 平 均 数 |\n在 日 常生 活 中 ,我们 经 常会 号 平声 数 行 交道 ,但 有 时\n发 现 以 前 计算 平均 数 的 方法 并 不 适 所 .请 看 直面 的 例子 :\n(1) 商店 里 有 两 种 苹果 ,一 种 单价 为 3. 50 元 /拉克 , 另\n你 认为 应 一 种 单价 为 6 元 /千克 . 小 明 妈 妈 买 了 单价 为 3550 元 / 王 克\n该 如 何 计算 所 的 苹果 1 千克 ,单价 为 6 元 /千克 的 苹果 3 千克 ,那么 小\n买 苹果 的 平均 明 妈 妈 所 买 苹果 的 平均 价格 是 两 个 单价 相 加 陈 以 2 吗 ?\n价格 ? 、\n为 什么 ?\n134 .第 20 章 数据 的 整理 与 初步 处 理\n=== 第 50 页 ===\n(2) 老师 在 计算 学 生 每 学 期 的 总 评 成 绩 时 ,并 不 是\n简单 地 将 一 个 学 生 的 平时 成 绩 与 考试 成 绩 相 加 除 以 2， 王 河\n而 是 按照 “平时 成 绩 占 40% ,考试 成 绩 占 60% ”的 比例 |",2.0,72.4659090909091,华东师大版_八年级_义务教育教科书·数学八年级下册,42,2025-07-21T14:24:55.862Z,2.0,义务教育教科书·数学八年级下册,/Users/LeoQin/Documents/GitHub/PDFconvertor/training_data/初中/数学/华东师大版-华东师范大学出版社/八年级/义务教育教科书·数学八年级下册.pdf,八年级,tesseract.js-parallel,unknown,0.6882661996497373,0.5,1,72.4659090909091,,,,true,true,,mathematics,下册,华东师大版_八年级_义务教育教科书·数学八年级下册.json,数学,176,初中_数学_华东师大版_八年级_义务教育教科书·数学八年级下册
华东师大版_八年级_义务教育教科书·数学八年级下册_chunk_5,5,"; (2) 如果 将 7 岁 ,40 岁 70 岁分 别作为每 个年 龄段 的代表 ,请佑 算全 Fllo990 年 、 2000 年 .2010 年我 国人口 的平均年 龄分 别是 多少 ? 从申 可以 发现 怎样的 变化 趋势 ? 138 .第 20 章数据的 整理与 初步处 理疝 读材料上 平均 化一 组数据揭 平均 数是 什么含义 ? 也许 你会 打个 比方 : 有一 组数据 1,， 1, 2， 3 , 是我 个每 人手头现 有的 钱 (单位 : 元 ). 现在 ,我们 四个 人决定平分这 些钱 ,大家 将钱 全都 集中到 一起 ,一共是 7 元 ,平分之 后 ,每人 得到 1.75 元 ,这 1.75 就是 原来那 组数据的 评均 数 . 政错 ,汇总后 平分 ,这既是计算平均数 的过 程 ,也是 从不 平均到 平均药 平均 化过 程， 在这 组数据中 先有 是示 平均 数大 的数 与平均数 的差 都是 正数 , 比平 均数 小的 数与 平均数 的差 都是 负数 , 与平移数 一样 大的 数 ( 如果 有的 话 ) 与平均数 的差 恰好 为零 . 那么将 所有 的差 相加 ;答案会 是什么呢 ? 尝试一 下 ,就以 这组 数据为 例外所 有的 差之 和是 (1 1.75) (1L 1.75) (2 1.75) (3 1.75) ( 0.75) ( 0.75) 0.25 1.25 ( 1.5) 1.5 0. 经过 平均化 ,两个 原来只 有 1 元钱 的人 都额外得 到了 0.75 元 ,他们 得到 的这 1.5 元正 是另外两 个人 一起 付出的 1.50, 正次 相抵 , 相加 应该 为零 . 从图 上看 ,两条 细线 长度 之和 与两 条粗 线长 度之 和也 恰好相等 . 1 L 155",763,0.39076861411315955,low,ocr,";\n(2) 如 果 将 7 岁 ,40 岁 70 岁 分 别 作为 每 个 年 龄 段 的 代表 ,请 佑 算 全 -Fllo990 年 、\n2000 年 .2010 年 我 国人 口 的 平均 年 龄 分 别 是 多 少 ? 从 申 可 以 发 现 怎样 的 变\n化 趋势 ?\n138 .第 20 章 数据 的 整理 与 初步 处 理\n=== 第 54 页 ===\n| 疝 读 材料 上\n平 均 化\n一 组 数据 揭 平 均 数 是 什么 含义 ? 也 许 你 会 打 个 比方 : 有 一 组 数据 “1,， 1, 2，\n3”, 是 我 个 每 人 手头 现 有 的 钱 (单位 : 元 ). 现在 ,我 们 四 个 人 决定 平分 这 些 钱 ,大\n家 将 钱 全 都 集中 到 一 起 ,一共 是 7 元 ,平分 之 后 ,每 人 得 到 1.75 元 ,这 1.75 就 是\n原来 那 组 数据 的 评 均 数 . 政 错 ,汇总 后 平分 ,这 既是 计算 平均 数 的 过 程 ,也 是 从 不\n平均 到 平均 药 平 均 化 过 程 ，\n在 这 组 数据 中 先 有 是 示 平 均 数 大 的 数 与 平均 数 的 差 都 是 正 数 , 比 平 均 数 小 的\n数 与 平均 数 的 差 都 是 负数 , 与 平移 数 一 样 大 的 数 ( 如 果 有 的 话 ) 与 平均 数 的 差 恰\n好 为 零 . 那么 将 所 有 的 差 相 加 ;答案 会 是 什么 呢 ?\n尝试 一 下 ,就 以 这 组 数据 为 例外 所 有 的 差 之 和 是\n(1-1.75) +(1L—-1.75) + (2 -1.75) +(3 -1.75)\n=(-0.75) + (-0.75) +0.25 +1.25\n=(-1.5) +1.5\n= 0.\n经 过 平均 化 ,两 个 原来 只 有 1 元 钱 的 人 都 额外 得 到 了 0.75 元 ,他 们 得 到 的\n这 1.5 元 正 是 另外 两 个 人 一 起 付出 的 1.50, 正 次 相抵 , 相 加 应 该 为 零 . 从 图 上\n看 ,两 条 细 线 长 度 之 和 与 两 条 粗 线 长 度 之 和 也 恰好 相等 .\n1 =\nL 155>",2.0,72.4659090909091,华东师大版_八年级_义务教育教科书·数学八年级下册,48,2025-07-21T14:24:55.862Z,2.0,义务教育教科书·数学八年级下册,/Users/LeoQin/Documents/GitHub/PDFconvertor/training_data/初中/数学/华东师大版-华东师范大学出版社/八年级/义务教育教科书·数学八年级下册.pdf,八年级,tesseract.js-parallel,unknown,0.6988847583643123,0.5,1,72.4659090909091,,,,true,true,,unknown,下册,华东师大版_八年级_义务教育教科书·数学八年级下册.json,数学,176,初中_数学_华东师大版_八年级_义务教育教科书·数学八年级下册
