Chunk_ID,Chunk_Index,Content,Content_Length,Quality_Score,Reliability,Source_Type,Original_Content,Enhancement_Version,averageConfidence,book_name,chunkIndex,enhancementTimestamp,enhancementVersion,fileName,filePath,grade,ocrMethod,publisher,qualityMetrics_chineseCharRatio,qualityMetrics_coherenceScore,qualityMetrics_lengthScore,qualityMetrics_ocrConfidence,semanticFeatures_hasDefinition,semanticFeatures_hasExperiment,semanticFeatures_hasFormulas,semanticFeatures_hasNumbers,semanticFeatures_hasQuestion,semanticFeatures_isTableContent,semanticFeatures_subjectArea,semester,source_file,subject,totalPages,uniqueId
华东师大版_九年级_义务教育教科书·数学九年级下册_chunk_6,6,"过本 章的 学习 ,我们 体会到 抽样调查是 一种 可以 信赖的 方法 ,并看 到当 样本 足够大 且有 较好 的代表性 时 ,样本的 平均数 .方差与 总体 的平均数 方差可 以很 接近 :所以 ;我们 可以 用样本估计总 体 . 3. 我们 感受到 数据分 析对 于决策的 重要性 . 我们 应该 在进行决策的 过程 中积极开动脑筋 ,让学 过的 知识发 挥它们应 有的 作用 . 同时 ,我们 还了 解到 有些 不规范的 统计图 容易误导读者。 yV 104 .第 28F 样本与 总体 1， 下面哪 些考察适合用 普查 ,哪些适合用 抽样调查 ? (TE 要考察汪 贞试验田 里某 种大 麦的 穗长 情况 ; (2 六要 考察一 个班级中 的学 生对 建立班级生物角 的看 法 ; (3) 要考察人 们保护海洋的 意识 . 2. 下面 抽样调查中 的取样合适吗 ? (1) 为了 考察 26? 是否是 最难 扼出 的一 个数 , 小华 投掷了 6 次正方体 仍子 ; (2) 某班 的学 号是 按照先 女回 学后 男同 学的 顺序排列的 ,老师想 了解 学生 对举 办骑 自行车郊游的 意见 ;她请 学号 最靠 前的 20 位学 生发表意见 . 3. 一厂家在 某城市几 家经 销本 所产 品的 大商场进行调查 ,得知 本三 产品的 销售量 占这 几个 大商场同类产品销售量 的 50 . 据此 ,该三家在 广告中 宣传说 :他们 的产品在 国内同类产品的 销售量 中占 50 . 请你 根据所 学的 统计知识 ,判断该 宣传中 的数据是 否可 靠 ,为体 么 ? 4. 如图 表示的 是某 班同学衣服上 口袋的 数目 . 口袋数 orhrhrrhrhrTiaeTyrTTT on 由全 全中 6 和是 2 村",759,0.3508458034313002,low,ocr,"过 本 章 的 学 习 ,我 们 体会 到 抽样 调查 是 一 种 可 以 信赖 的 方\n法 ,并 看 到 当 样 本 足够 大 且 有 较 好 的 代表 性 时 ,样本 的 平均 数 .方差\n与 总 体 的 平均 数 方差 可 以 很 接近 :所 以 ;我 们 可 以 用 样本 估计\n总 体 .\n3. 我 们 感受 到 数据 分 析 对 于 决策 的 重要 性 . 我 们 应 该 在 进行 决策\n的 过 程 中 积极 开动 脑筋 ,让 学 过 的 知识 发 挥 它们 应 有 的 作用 . 同时 ,我\n们 还 了 解 到 有 些 不 规范 的 统计 图 容易 误导 读者 。 yV\n104 .第 28F 样本 与 总 体\n=== 第 15 页 ===\n1， 下面 哪 些 考察 适合 用 普查 ,哪些 适合 用 抽样 调查 ?\n(TE 要 考察 汪 贞 试验 田 里 某 种 大 麦 的 穗 长 情况 ;\n(2 六 要 考察 一 个 班级 中 的 学 生 对 建立 班级 生物 角 的 看 法 ;\n(3) 要 考察 人 们 保护 海洋 的 意识 .\n2. 下 面 抽样 调查 中 的 取样 合适 吗 ?\n(1) 为 了 考察 26? 是否 是 最 难 扼 出 的 一 个 数 , 小 华 投掷 了 6 次 正方 体 仍 子 ;\n(2) 某 班 的 学 号 是 按照 先 女 回 学 后 男 同 学 的 顺序 排列 的 ,老师 想 了 解 学 生 对 举\n办 骑 自 行车 郊游 的 意见 ;她 请 学 号 最 靠 前 的 20 位 学 生发 表意 见 .\n3. 一 厂家 在 某 城市 几 家 经 销 本 所 产 品 的 大 商场 进行 调查 ,得 知 本 三 产品 的 销售 量\n占 这 几 个 大 商场 同类 产品 销售 量 的 50%. 据 此 ,该 三家 在 广告 中 宣传 说 :他 们\n的 产品 在 国内 同类 产品 的 销售 量 中 占 50% . 请 你 根据 所 学 的 统计 知识 ,判断 该\n宣传 中 的 数据 是 否 可 靠 ,为 体 么 ?\n4. 如 图 表示 的 是 某 班 同学 衣服 上 口袋 的 数目 .\n口袋 数\norhrhrrhrhrTiaeTyrTTT on |\n由 | 全 全 | |\n中 | |\n6 SEE 和 |\n| | 是 2\n村 SEE  |",2.0,71.02362204724409,华东师大版_九年级_义务教育教科书·数学九年级下册,13,2025-07-21T14:24:55.891Z,2.0,义务教育教科书·数学九年级下册,/Users/LeoQin/Documents/GitHub/PDFconvertor/training_data/初中/数学/华东师大版-华东师范大学出版社/九年级/义务教育教科书·数学九年级下册.pdf,九年级,tesseract.js-parallel,unknown,0.8211091234347049,0.5,1,71.02362204724409,,true,,true,true,,mathematics,下册,华东师大版_九年级_义务教育教科书·数学九年级下册.json,数学,127,初中_数学_华东师大版_九年级_义务教育教科书·数学九年级下册
华东师大版_九年级_义务教育教科书·数学九年级下册_chunk_7,7,"7 殉学 和后 中随机地 抽取 64 名学 生 . 6. 你认为用 简单随机抽样方法选取的 样本 , 其平均数 是和 否可 能等 于总 体的 平均数 ? 你相信用 简单随机抽样谣 法调查得 到的 结果吗 ? 为什么 ? 7. 利用你 收集到 的男女同学的 身高和 体重的 数据 ,在男 同学 的身高和 体重以 及女 同学的 身高和 体重这 四组 数据申 挑选 二组 ,用简单随机抽样方法选取含有 25 名 .40 名 .65 名同学的 三个 样本 ,计算这 三个 样本的 平均数 和方差 ,再与 总体 的平均数 和方差作对比 ,看看 大一 些的 样本的 平鬼 数和 方差是 否往往与 总体 的比 较接 近 . 8. 总三 要评估各 个分 三的 生产效率 ,并据 此来 评定职 玉奖 金 . 下表 给出 了甲 、 乙两 个分 厂的 产量情况 : 人 RISE 时 (1) 你认为哪个分 三的 生产效率更 高 ? 为什么 ? (2) 甲分 三的 负责人 说 :我分 三工人数 与乙 分厂 相同 ,总产量比 乙分 三高 ,应该 率先提高我 分厂 工人的 奖金 . ""你同意他 的说 法吗 ? 为什么 ? 106 .第 28 章样本与 总体 9 有时 公司为 了说 明其 劳资双方的 利益呈现同步增长的 趋势 , 画出 了如 图所 示的 统计 图 . 说说 你看 了这 幅图 后有 什么想法 . 如果 已知 该公司共有 5 位股东和 100 名员 玫 ,你会 如何 分析 劳资 双方的 收入 ? 胶东 .员工月 收入比较 15 15 _ 号全 网 3 人 o a 员上 5 总收入 0 2009 年 20lofe 2004E (第 9 题 ) 10. 专家提醒 ,目前我 国儿 童与 青少年的 健康存在着 五个 必须重视的 问题 :营养不",765,0.332771653543307,low,ocr,"7 殉 学 和 后 中 随机 地 抽取 64 名 学 生 .\n6. 你 认为 用 简单 随机 抽样 方法 选取 的 样本 , 其 平均 数 是 和 否 可 能 等 于 总 体 的 平均\n数 ? 你 相信 用 简单 随机 抽样 谣 法 调查 得 到 的 结果 吗 ? 为 什么 ?\n7. 利用 你 收集 到 的 男女 同学 的 身高 和 体重 的 数据 ,在 男 同 学 的 身高 和 体重 以 及 女\n同学 的 身高 和 体重 这 四 组 数据 申 挑 选 二 组 ,用 简单 随机 抽样 方法 选取 含有 25\n名 .40 名 .65 名 同学 的 三 个 样本 ,计算 这 三 个 样本 的 平均 数 和 方差 ,再 与 总 体 的\n平均 数 和 方差 作对 比 ,看 看 大 一 些 的 样本 的 平 鬼 数 和 方差 是 否 往往 与 总 体 的 比\n较 接 近 .\n8. 总 三 要 评估 各 个 分 三 的 生产 效率 ,并 据 此 来 评定 职 玉 奖 金 . 下 表 给 出 了 甲 、 乙 两\n个 分 厂 的 产量 情况 :\nEC\n人 TI\nRISE\nCEI 时\n(1) 你 认为 哪个 分 三 的 生产 效率 更 高 ? 为 什么 ?\n(2) 甲 分 三 的 负责 人 说 :我 分 三 工人 数 与 乙 分 厂 相 同 ,总 产量 比 乙 分 三 高 ,应\n该 率先 提高 我 分 厂 工人 的 奖金 . ""你 同意 他 的 说 法 吗 ? 为 什么 ?\n106 .第 28 章 样本 与 总 体\n=== 第 17 页 ===\n9 有 时 公司 为 了 说 明 其 劳资 双方 的 利益 呈现 同步 增长 的 趋势 , 画 出 了 如 图 所 示 的 统\n计 图 . 说 说 你 看 了 这 幅 图 后 有 什么 想法 . 如 果 已 知 该 公司 共有 5 位 股东 和 100\n名 员 玫 ,你 会 如 何 分 析 劳 资 双方 的 收入 ?\n胶东 .员工 月 收入 比较\n15 15\n_\n号 全 网 3 人\n= o” —a— 员 上\n< 5 总 收入\n=\n0 2009 年  20lofe  2004E\n(第 9 题 )\n10. 专家 提醒 ,目前 我 国 儿 童 与 青少年 的 健康 存在 着 五 个 必须 重视 的 问题 :营养 不",2.0,71.02362204724409,华东师大版_九年级_义务教育教科书·数学九年级下册,15,2025-07-21T14:24:55.891Z,2.0,义务教育教科书·数学九年级下册,/Users/LeoQin/Documents/GitHub/PDFconvertor/training_data/初中/数学/华东师大版-华东师范大学出版社/九年级/义务教育教科书·数学九年级下册.pdf,九年级,tesseract.js-parallel,unknown,0.8166969147005445,0.5,1,71.02362204724409,,,,true,true,,unknown,下册,华东师大版_九年级_义务教育教科书·数学九年级下册.json,数学,127,初中_数学_华东师大版_九年级_义务教育教科书·数学九年级下册
华东师大版_九年级_义务教育教科书·数学九年级下册_chunk_8,8,"公司共有 5 位股东和 100 名员 玫 ,你会 如何 分析 劳资 双方的 收入 ? 胶东 .员工月 收入比较 15 15 _ 号全 网 3 人 o a 员上 5 总收入 0 2009 年 20lofe 2004E (第 9 题 ) 10. 专家提醒 ,目前我 国儿 童与 青少年的 健康存在着 五个 必须重视的 问题 :营养不 良和肥胖近视 .上晤 齿 、 贫血 以及 心理昌 具 :你认为这 是用 普查还 是抽样调查得 到的 结果 ? 设计一 份调查问卷和 三种 抽样调查方案 ,了解 你们 学校 的学 生是 否普遍存在这 五个 健康问题 ,并指出其 严重程 度 . 第 28 章样本与 总体 . 107 一本 和 5 要本 芋让 一了 睹改进我 们的 课桌 椅走 进学 梭 , 看到 每个 教室里 课桌 椅本 王 : 的规格都 S 样计 分美观 . 然而有 些同 用学 却感觉课 这椅 需要改进 ,他们 说 :从国生和 生生小 学到 现在坏 们都 长大 了 ,长高 了 ,书本二 和三 包里 的书香茵 求越 多了 可是 课桌 椅却 站没有改变 . 小直 的课 绒哪里容 得下 厚厚 oe f fy TReh IE, 9 放在 椅子上 ,这样 坐着 多不 舒服 ! 你们 班的 课桌 椅也 看这 样的 问题吗 课桌 椅不 合适的 主要原因是 什么呢 ? 有必要改进现 有的 课桌 椅设计吗 ?目前市 场上 有符合你 们需求的 课桌 椅吗 ? 让我 们一 起运用已 经掌握的 各狂 知识 ,尝试解决身边的 问题吧 ! 1. 调查 同学们 对正在使 用的 课碍 椅的 感觉 :上课 坐着 的时 候 , 感觉 是否 告服 当需要和 后排 同学讨论时 是否 方便 ? 这些感觉是 否与 同学们 的身高 .体重等 因素有 关 ?",761,0.3548571568935164,low,ocr,"公司 共有 5 位 股东 和 100\n名 员 玫 ,你 会 如 何 分 析 劳 资 双方 的 收入 ?\n胶东 .员工 月 收入 比较\n15 15\n_\n号 全 网 3 人\n= o” —a— 员 上\n< 5 总 收入\n=\n0 2009 年  20lofe  2004E\n(第 9 题 )\n10. 专家 提醒 ,目前 我 国 儿 童 与 青少年 的 健康 存在 着 五 个 必须 重视 的 问题 :营养 不\n良和 肥胖 近视 .上 晤 齿 、 贫 血 以 及 心理 昌 具 :你 认为 这 是 用 普查 还 是 抽样 调查 得\n到 的 结果 ? 设计 一 份 调查 问卷 和 三 种 抽样 调查 方案 ,了 解 你 们 学 校 的 学 生 是 否\n普遍 存在 这 五 个 健康 问题 ,并 指出 其 严重 程 度 .\n第 28 章 ”样本 与 总 体 . 107\n=== 第 18 页 ===\n一 本 和 5 要 本 |\n芋 让 一] 了 睹\n改进 我 们 的 课 桌 椅\n走 进 学 梭 , 看 到 每 个 教室 里 课 桌 椅 本 王 :\n的 规格 都 S- 样 计 分 美观 . 然而 有 些 同 用\n学 却 感觉 课 这 椅 需要 改进 ,他 们 说 :从 ”国生 和 生生\n小 学 到 现在 坏 们 都 长 大 了 ,长 高 了 ,书本 二 和 三\n包 里 的 书香 茵 求 越 多 了 PN 可 是 课 桌 椅 却 站\n没有 改变 . 小 直 的 课 绒 哪里 容 得 下 厚 厚 oe\nf-fy TReh IE, BERAEIE 9\n放 在 椅子 上 ,这 样 坐 着 多 不 舒服 !\n你 们 班 的 课 桌 椅 也 看 这 样 的 问题 吗 ” 课 桌 椅 不 合适 的 主要 原因\n是 什么 呢 ? 有 必要 改进 现 有 的 课 桌 椅 设计 吗 ?目前 市 场 上 有 符合 你\n们 需求 的 课 桌 椅 吗 ?\n让 我 们 一 起 运用 已 经 掌握 的 各 狂 知 识 ,尝试 解决 身边 的 问题 吧 !\n1. 调 查 同学 们 对 正在 使 用 的 课 碍 椅 的 感觉 :上 课 坐 着 的 时 候 , 感\n觉 是 否 告 服 ” 当 需要 和 后 排 同学 讨论 时 $ 是 否 方便 ? 这些 感觉 是 否\n与 同学 们 的 身高 .体重 等 因素 有 关 ?",2.0,71.02362204724409,华东师大版_九年级_义务教育教科书·数学九年级下册,16,2025-07-21T14:24:55.891Z,2.0,义务教育教科书·数学九年级下册,/Users/LeoQin/Documents/GitHub/PDFconvertor/training_data/初中/数学/华东师大版-华东师范大学出版社/九年级/义务教育教科书·数学九年级下册.pdf,九年级,tesseract.js-parallel,unknown,0.8342541436464088,0.6,1,71.02362204724409,,,,true,true,,unknown,下册,华东师大版_九年级_义务教育教科书·数学九年级下册.json,数学,127,初中_数学_华东师大版_九年级_义务教育教科书·数学九年级下册
华东师大版_九年级_义务教育教科书·数学九年级下册_chunk_9,9,"L L mm， 和 : : : : : : : : 人 1 1 : : 人人 : : : : As 数学实验附 图 . 117 格点 图 118 . 数学实验附 图数学实验附 图 119 120 . 数学实验附 图后 记华东师 大版 初中数学教材是 最早 通过 教育部 审查的 新课 标初中数学教材之 一 . 目 2001 年秋季在 7 个国家级 实验区 投入实验以 来 ,已有 分布 在 26 个省 、 市 .自治区 的地 市选用过 或正在选用本 套教 材 . 10 多年 来 ,实验区 的广大师 生对 本套 教材寄 李用 悍爱 , 为它 的不 断完 善提出了 许多宝贵意见 . 根据这 些意见 ,在实验期 间 ,我们 对教材进行了 多次 修改 . 在此 ,我们 对多 年来 给予 本套 教材 关心 的各 级领导广 术实验区 师生 和各 位同仁表示衷心感谢 . 根据教育部 的统 地部 署 ,在 2012 年前 要完成义务教育阶段所 有新 课标 教材 的修订工作 . 为子 确保本 套教 材修订工作的 顺利进行 ,在 2011 年 4 月至 7 月间 ,我们 就本 套教材的 修订广泛征求了 一线 教师 的意见 . 2011 年 9 A7ERI 5t H 开本华东师 大版 初中数学教材修订研讨会 ,来自 实验 区的 120 多名 教研员 和骨 于教师以 及全 体编写人 员参 加了 会议 . 会议 期间就 本套 教材修订的 整体框架达成了 广泛共识 . 本套 教材 的修订稿 完成后 ,我们 又特 邀有 关专 家和 来自 教学",665,0.3338987071060561,low,ocr,"-----====L-------==L--| mm，\n和 | | : | |\n| : : : : :\n| : | : | |\n人 1 | 1 : :\n人 | | | | |\n人 : | : | :\n| : | | | |\nYY As|\n数学 实验 附 图 . 117\n=== 第 29 页 ===\n格 点 图\n118 . 数学 实验 附 图\n=== 第 30 页 ===\n数学 实验 附 图 119\n=== 第 31 页 ===\n120 . 数学 实验 附 图\n=== 第 32 页 ===\n后 记\n华东 师 大 版 初中 数学 教材 是 最 早 通 过 教育 部 审查 的 新 课 标 初中 数学 教材\n之 一 . 目 2001 年 秋季 在 7 个 国家 级 实验 区 投入 实验 以 来 ,已 有 分 布 在 26 个 省 、\n市 .自治 区 的 地 市 选用 过 或 正在 选用 本 套 教 材 . 10 多 年 来 ,实验 区 的 广大 师 生 对\n本 套 教材 寄 李 -用 悍 爱 , 为 它 的 不 断 完 善 提出 了 许多 宝贵 意见 . 根据 这 些 意见 ,在\n实验 期 间 ,我 们 对 教材 进行 了 多 次 修改 . 在 此 ,我 们 对 多 年 来 给 予 本 套 教 材 关 心\n的 各 级 领导 广 术 实验 区 师 生 和 各 位 同仁 表示 衷心 感谢 .\n根据 教育 部 的 统 地 部 署 ,在 2012 年 前 要 完成 义务 教育 阶段 所 有 新 课 标 教\n材 的 修订 工作 . 为 子 确保 本 套 教 材 修订 工作 的 顺利 进行 ,在 2011 年 4 月 至 7 月\n间 ,我 们 就 本 套 教材 的 修订 广泛 征求 了 一 线 教 师 的 意见 . 2011 年 9 A7ERI 5t H\n开本 华东 师 大 版 初中 数学 教材 修订 研讨 会 ” ,来 自 实 验 区 的 120 多 名 教研 员 和\n骨 于 教师 以 及 全 体 编写 人 员 参 加 了 会 议 . 会 议 期间 就 本 套 教材 修订 的 整体 框架\n达成 了 广泛 共识 . 本 套 教 材 的 修订 稿 完成 后 ,我 们 又 特 邀 有 关 专 家 和 来 自 教 学",2.0,71.02362204724409,华东师大版_九年级_义务教育教科书·数学九年级下册,26,2025-07-21T14:24:55.891Z,2.0,义务教育教科书·数学九年级下册,/Users/LeoQin/Documents/GitHub/PDFconvertor/training_data/初中/数学/华东师大版-华东师范大学出版社/九年级/义务教育教科书·数学九年级下册.pdf,九年级,tesseract.js-parallel,unknown,0.8016701461377871,0.5,1,71.02362204724409,,true,,true,,,mathematics,下册,华东师大版_九年级_义务教育教科书·数学九年级下册.json,数学,127,初中_数学_华东师大版_九年级_义务教育教科书·数学九年级下册
华东师大版_九年级_义务教育教科书·数学九年级下册_chunk_10,10,"011 年 9 A7ERI 5t H 开本华东师 大版 初中数学教材修订研讨会 ,来自 实验 区的 120 多名 教研员 和骨 于教师以 及全 体编写人 员参 加了 会议 . 会议 期间就 本套 教材修订的 整体框架达成了 广泛共识 . 本套 教材 的修订稿 完成后 ,我们 又特 邀有 关专 家和 来自 教学 一线 的教师进行了 审稿 . 参与本 册教 材审 稿的 有冯 国卫 、 郭亦 津等 专家和 教师 . 尽管我 们对 修订工作倾注了 心血 ,但现在呈现在 广大师 生面前的 修订教材肯定还 存在有 竺进一步完善的 地方 . 我们 真诚希望广大师 生继续关心我 们的 教材 ,对我 们的 教材不 断提 出新 的宝贵意见 . 本册 教材 修订的 押稿 人如 下 (以姓氏笔画为 序六 王继 延 . 李俊 沈加 、 胡钓 华 . 唐复 囚 、 程靖 . 后记 :121 ee 1 画出 下列 函数 的图 象 : 目目 sm (1)y 327; (2)7 一本 2. 根据上 题所 画的 函数图 全 (1) 抛物线 y 3x2 的对 称轴 机 1.8 坐标是 ,要时， 抛物线 上的 点都 在轴 的上 方 ; (2) 抛物线 y 本的 开口向 , 除 nn 方 , 它的 顶点是 抛物线 上的 最量 全 3. 不画图象 ,说出 抛物线 y 42 和 7 了了 的媳 口方 机 .对称轴 和顶点坐标 . 4. 设园 的半径为 ,面积为 8. (1) 试写 出与 之间 的函数关系式 ; (2) 画出 这个 函数的 图象 2. 二次 图数 axc bx c 的图 象与 性质 我们 已经 研究了 二次 困数 y ax (a 0) 的图 象和 性质 , 现在 我们 来研究一 般的 问题 . 第 26 章一 次函数 . 7",759,0.38255565685868204,low,ocr,"011 年 9 A7ERI 5t H\n开本 华东 师 大 版 初中 数学 教材 修订 研讨 会 ” ,来 自 实 验 区 的 120 多 名 教研 员 和\n骨 于 教师 以 及 全 体 编写 人 员 参 加 了 会 议 . 会 议 期间 就 本 套 教材 修订 的 整体 框架\n达成 了 广泛 共识 . 本 套 教 材 的 修订 稿 完成 后 ,我 们 又 特 邀 有 关 专 家 和 来 自 教 学\n一 线 的 教师 进行 了 审 稿 . 参与 本 册 教 材 审 稿 的 有 冯 国 卫 、 郭 亦 津 等 专家 和 教师 .\n尽管 我 们 对 修订 工作 倾注 了 心血 ,但 现在 呈现 在 广大 师 生 面前 的 修订 教材\n肯定 还 存在 有 竺 进一步 完善 的 地 方 . 我 们 真诚 希望 广大 师 生 继续 关心 我 们 的 教\n材 ,对 我 们 的 教材 不 断 提 出 新 的 宝贵 意见 .\n本 册 教 材 修订 的 押 稿 人 如 下 (以 姓氏 笔画 为 序 六\n王 继 延 . 李 俊 沈 加 、 胡 钓 华 . 唐 复 囚 、 程 靖 .\n后 记 :121\n=== 第 33 页 ===\nee\n1 画 出 下 列 函 数 的 图 象 : 目 目\nsm AAA |\n(1)y =327; (2)7 = 一 本\n2. 根据 上 题 所 画 的 函数 图 全\n(1) 抛物 线 y =3x2 的 对 称 轴 机 1.8 坐标 是 ,要 时 ，\n抛物 线 上 的 点 都 在 * 轴 的 上 方 ;\n(2) 抛物 线 y= -本 的 开口 向 , 除 nn\n方 , 它 的 顶点 是 抛物 线 上 的 最 量 全\n3. 不 画图 象 ,说 出 抛物 线 y = 42 和 7 了 = 了 的 媳 口 方 机 .对称 轴 和 顶点 坐标 .\n4. 设 园 的 半径 为 ,面积 为 8.\n(1) 试 写 出 $ 与 之 间 的 函数 关系 式 ;\n(2) 画 出 这 个 函数 的 图 象 ’\n2. 二 次 图 数 =axc +bx +c 的 图 象 与 性 质 |\n我 们 已 经 研究 了 二 次 困 数 y = ax’ (a #0) 的 图 象 和\n性 质 , 现 在 我 们 来 研究 一 般 的 问题 .\n第 26 章 “一 次 函数 . 7",2.0,71.02362204724409,华东师大版_九年级_义务教育教科书·数学九年级下册,27,2025-07-21T14:24:55.892Z,2.0,义务教育教科书·数学九年级下册,/Users/LeoQin/Documents/GitHub/PDFconvertor/training_data/初中/数学/华东师大版-华东师范大学出版社/九年级/义务教育教科书·数学九年级下册.pdf,九年级,tesseract.js-parallel,unknown,0.7783985102420856,0.5,1,71.02362204724409,,,,true,,,mathematics,下册,华东师大版_九年级_义务教育教科书·数学九年级下册.json,数学,127,初中_数学_华东师大版_九年级_义务教育教科书·数学九年级下册
华东师大版_九年级_义务教育教科书·数学九年级下册_chunk_11,11,"开口方向 、 对称 轴和 项起 坐标 ;它们有 哪些是 相同的 ?又有 哪些不 同 ? 当自 变量 x 取同 一数值时 5 数 y 1 的值 都比 函数 y 六 m2 的值 大巧 度卫 在图 象上 ,函数 y 冯 m 1 的图 象上 的每 一点 都征 琢数 蚤 w 的图 象上 相应点 的上 方 1 个单位 . 函数 y 2 1 的图 象可 以看 成是 称函数六 二的 图象 向上 平移 1 个单位得 到的 . 这两 代函 数图 象的 开口 方向相同 , 对称 轴相 同 , 但顶点坐标不 同 . 亢数 y 冯 1 的图 象的 顶点坐标是 (0，1)， 据此 ,可以 由函数 y 2 a 的性 质 ,得到 函数 W Sat 的一 些性 质 : 请愚 考 , 并完 当 x 时 ,函数值 y 随的 增大 而减 小 ; 当生 汪 ee x 时 ,函数值 y 随的 增大 而增 大 ; 当时 ,函数取得最 值 ,最值 》 三 . 第 26 章二 次函数 . 9 ee 14 2 与函数 y 24 的图 图再 八比 较 ,指出它们的 联系和 区别 . 丽数 y 二 e 2 的图 象可 以看 成征 由冰 数并 二的 图象 经过 怎样的 平移得 到的 ? 试说 出它 的开 口方 , 基币 舟和 顶点名 标 ,并讨论这 个十 数的 性质 在则 竺个 平面直角坐标系 中 ,函数 y 于 42 的图 象与 丽数 gj 过二 2 的图 象有 什么关系 ?你能 说出 函数 y 了 42 的图 旬的 开口方向 ,对称轴 和顶点坐标吗 ?这个 函数有 哪酉 性质? 1. 已知 函数 y 工如 和 y 工 v 一 2. 3 3 (1) 在同一个 平面直角坐标系 中画 出它们的 图象 ; 9",736,0.402834388558573,medium-low,ocr,"开口 方向 、\n对 称 轴 和 项 起 坐标 ;它们 有 哪些 是 相同 的 ?又 有 哪些\n不 同 ?\n当 自 变量 x 取 同 一 数值 时 5 数 y = ° + 1 的 值 都\n比 函数 y = 六 m2 的 值 大 巧 度 卫 在 图 象 上 ,函数 y =\n冯 m + 1 的 图 象 上 的 每 一 点 都 征 琢 数 蚤 = w 的 图 象 上\n相应 点 的 上 方 1 个 单位 .\n函数 y = 2 +1 的 图 象 可 以 看 成 是 称 函数 六 二\n的 图 象 向 上 平移 1 个 单位 得 到 的 . 这 两 代 函 数 图 象 的 开\n口 方向 相同 , 对 称 轴 相 同 , 但 顶点 坐标 不 同 . 亢 数 y =\n冯 + 1 的 图 象 的 顶点 坐标 是 (0，1)，\n据 此 ,可 以 由 函数 y = 2-a® 的 性 质 ,得 到 函数 W =\nSat 的 一 些 性 质 : 请 愚 考 , 并 完\n当 x 时 ,函数 值 y 随 * 的 增 大 而 减 小 ; 当 - 生 汪 ee\nx 时 ,函数 值 y 随 > 的 增 大 而 增 大 ; 当 >\n时 ,函数 取得 最 值 ,最 值\n》 三 .\n第 26 章 ”二 次 函数 . 9\n=== 第 36 页 ===\nee = 14* -2 与 函数 y = 24\n的 图 图 再 八 比 较 ,指出 它们 的 联系 和 区 别 . 丽 数 y = 二 e - 2 的 图 象 可 以\n看 成 征 由 冰 数 并 = 二 的 图 象 经 过 怎样 的 平移 得 到 的 ? 试 说 出 它 的 开 口\n方 , 基 币 舟 和 顶点 名 标 ,并 讨论 这 个 十 数 的 性 质\n在 则 竺 个 平面 直角 坐标 系 中 ,函数 y= -于 42 的\n图 象 与 丽 数 gj= 过 二 2 的 图 象 有 什么 关系 ?你 能 说 出 函\n数 y= -了 42 的 图 旬 的 开口 方向 ,对称 轴 和 顶点 坐标\n吗 ?这 个 函数 有 哪 酉 性质?\n1. 已 知 函 数 y =- 工 如 和 y =- 工 v 一 2. \ &\n3 3\n(1) 在 同一 个 平面 直角 坐标 系 中 画 出 它们 的 图 象 ; 9",2.0,71.02362204724409,华东师大版_九年级_义务教育教科书·数学九年级下册,29,2025-07-21T14:24:55.892Z,2.0,义务教育教科书·数学九年级下册,/Users/LeoQin/Documents/GitHub/PDFconvertor/training_data/初中/数学/华东师大版-华东师范大学出版社/九年级/义务教育教科书·数学九年级下册.pdf,九年级,tesseract.js-parallel,unknown,0.7820773930753564,0.6,1,71.02362204724409,,,,true,true,,mathematics,下册,华东师大版_九年级_义务教育教科书·数学九年级下册.json,数学,127,初中_数学_华东师大版_九年级_义务教育教科书·数学九年级下册
