Chunk_ID,Chunk_Index,Content,Content_Length,Quality_Score,Reliability,Source_Type,Original_Content,Enhancement_Version,averageConfidence,book_name,chunkIndex,enhancementTimestamp,enhancementVersion,fileName,filePath,grade,ocrMethod,publisher,qualityMetrics_chineseCharRatio,qualityMetrics_coherenceScore,qualityMetrics_lengthScore,qualityMetrics_ocrConfidence,semanticFeatures_hasDefinition,semanticFeatures_hasExperiment,semanticFeatures_hasFormulas,semanticFeatures_hasNumbers,semanticFeatures_hasQuestion,semanticFeatures_isTableContent,semanticFeatures_subjectArea,semester,source_file,subject,totalPages,uniqueId
华东师大版_八年级_义务教育教科书·数学八年级下册_chunk_17,17,"a 一口 方程的 分式 方程 轮船在 顺水中 航行 80 千米 所需 的时 间和 逆水中 航行 2 60 千米 所需 的时 间相 同 . 已知 水流 的速度是 3 千米 时， 12 .第 16 章分 式设 轮船 在静水中 的速度为 千米 时 ,根据题 意， 得 80 60 v 3 x 3 ( ) 方程 ( ) 中含有分 各并 且分 母中 含有未 知数 , 像这 样的 方程叫做分 式方程怎样解 分式 方程呢 有没有办 法可 以去 掉分 起方程中 的分 母 ,把它 转化为 整式 方程呢 试动手解 : 解上 面 yd 回顾一 下解 一，。 元一 次方程时 是怎 列出 的方程 ( 样去 分母 的 ,从中 能否 得到 一点 启发 ? 人方程两 边同 乘以 (x 3)(x 3) , 约坪 分母 _ 得 80(x 3) 60(x 3). 解这 个整 式方程 ,得 x 21. 由此 可得 问题的 答案 :轮船在 静水中 的速度为 21 千米 时第 10 章分 式 . 13 上述 解分 式方程的 过程 ,实质上 是将 方程的 两边 都乘 以同一个 整式 , 约去 分峡 , 把分 式方程转化为 整式 方程来 解 . 所乘 的整 式通常取 方程中 出现 的各 分式 的最 简公 分厅 a Mfj 丰 : 2 全方 程两 边同 乘以 ( 1) , 约去 分母 ,得 x 1 2. 解这 个整 直方程 ,得 x 1. 一无 方程的 解也 称为 方解 到这 我但 能不 能说 1 就是 原分 式方程代 的解 (或根 ) 呢 ? 细心的 同学可 能会 发现 , 当 x 1 时 , 原分 式方程左边和 有边 的分 母 (x 1) 与 (2 1) 都是 0 ,方程中 出现 的两 泵分 式都 没有意义 ,因此，",747,0.3877732447183099,low,ocr,"a 一 口\n方程 的 分 式 方 程\n轮船 在 顺水 中 航行 80 千 米 所 需 的 时 间 和 逆水 中 航行\n2 60 千 米 所 需 的 时 间 相 同 . 已 知 水 流 的 速度 是 3 千 米 / 时 ，\n12 .第 16 章 分 式\n=== 第 91 页 ===\n设 轮 船 在 静水 中 的 速度 为 * 千 米 / 时 ,根据 题 意 ，\n得\n80 60\nv+3 x-3 (*)\n方程 ( * ) 中 含有 分 各 并 且 分 母 中 含有 未 知 数 , 像\n这 样 的 方程 叫做 分 式 方程\n怎样 解 分 式 方程 呢 有 没有 办 法 可 以 去 掉 分 起 方程\n中 的 分 母 ,把 它 转化 为 整 式 方程 呢 ” 试 动手 解 :- 解 上 面 yd 回顾 一 下 解 一\n，。 - 元 一 次 方程 时 是 怎\n列 出 的 方程 ( * 样 去 分 母 的 ,从 中 能\n否 得 到 一 点 启发 ?\n人 方程 两 边 同 乘 以 (x+3)(x -3) , 约 坪 分母 _\n得\n80(x -3) =60(x +3).\n解 这 个 整 式 方程 ,得\nx = 21.\n由 此 可 得 问题 的 答案 :轮船 在 静水 中 的 速度 为 21 千\n米 /时\n第 10 章 分 式 . 13\n=== 第 92 页 ===\n上 述 解 分 式 方程 的 过 程 ,实质 上 是 将 方程 的 两 边 都\n乘 以 同一 个 整 式 , 约 去 分 峡 , 把 分 式 方程 转化 为 整 式 方程\n来 解 . 所 乘 的 整 式 通常 取 方程 中 出 现 的 各 分 式 的 最 简 公\n分 厅\na Mfj 丰 :| =- -2\n全 ” 方 程 两 边 同 乘 以 (* -1) , 约 去 分 母 ,得\nx+1 =2.\n解 这 个 整 直方 程 ,得\nx =1.\n一 无 方程\n的 解 也 称 为 方 解 到 这 JE 我 但 能 不 能 说 > -= 1 就 是 原 分 式 方程\n代 的 解 (或 根 ) 呢 ? 细心 的 同学 可 能 会 发 现 , 当 x* = 1\n时 , 原 分 式 方程 左边 和 有 边 的 分 母 (x* -1) 与 (2 -1)\n都 是 0 ,方程 中 出 现 的 两 泵 分 式 都 没有 意义 ,因此 ，",2.0,72.4659090909091,华东师大版_八年级_义务教育教科书·数学八年级下册,86,2025-07-21T14:24:55.862Z,2.0,义务教育教科书·数学八年级下册,/Users/LeoQin/Documents/GitHub/PDFconvertor/training_data/初中/数学/华东师大版-华东师范大学出版社/八年级/义务教育教科书·数学八年级下册.pdf,八年级,tesseract.js-parallel,unknown,0.7705882352941177,0.6,1,72.4659090909091,true,,,true,true,,physics,下册,华东师大版_八年级_义务教育教科书·数学八年级下册.json,数学,176,初中_数学_华东师大版_八年级_义务教育教科书·数学八年级下册
华东师大版_八年级_义务教育教科书·数学八年级下册_chunk_18,18,"传真 021 60821766 客服电话 021 60821720 60821761 印刷 者山西人 民印 刷有 限责 任公司开 本 787 x1092 16 开印 张 1 字数 194 干字 版次 2013 年 10 月第 一版 印 R 2014 年 11 月山西第 二次 B 号 978 7 5675 0639 8 G 6423 10.23 元出 版人 王净 (如发 现本 版图 书有 印订 质量问题 ,请寄 回本 社客服中 心调换或 电话 021 60821720 联系 ) 虽读 材料光 年和 纳米在 阅读报纸 ji 赤志 或科技书刊时 ,有时 我们 会看 到光 年 "" 纳米 ""这两 个名 称 ,你知道它 科的 含义吗 ? 光年 (Jight year) 是天 文学中 使用 的长 度单 位 ,符号为 1.y. ,主要用 于计量太 阳系 外天 体世 间的 距痪 ,1 光年 是指 光在 真空中 一年 时间 所走 的距离 , 它可 由速 度 ( 光速 ) 和时 间 ( 一年 ) 算出 来 : 真空中 的光速田 寺 299792.458 Fk 秒， 14 60 60 x24 x365.25( 秒 )， 故工 光年 二 299792. 458 x 60 x 60 x 24 x 365.25 9.46 x102( 千米 ). 这就 是说 ,一光 年约 等于 9846 万亿 税米 . 离太 阳最 近的 恒星 ( 半人 马座 比邻 是 ) 与太阳的 距离为 4.22 光年 . 银河系 的直径约 为 10 万光 年 . 人类 所观测的 宇宙深度已 达到 150 亿光 年 . 你能 算出这 些距离等 于多 少千 米吗 ? 从中 你可 以体会到 财光 年作 单位的 优越性 . 光年 用来 计量非常大 的距离 ,而纳米 (Tanoniete 梧则 是表示微小距离的 单",786,0.30796996602141685,low,ocr,"传真 021 -60821766\n客服 电话 ”021 -60821720 60821761\n印 刷 者 “山西 人 民 印 刷 有 限 责 任 公司\n开 本 787 x1092 16 开\n印 张 1\n字数 194 干 字\n版 ”次 2013 年 10 月 第 一 版\n印 R 2014 年 11 月 山西 第 二 次\nB 号 ISBN 978 -7 —-5675-0639 -8/G - 6423\n定 价 10.23 元\n出 版 人 王 净\n(如 发 现 本 版 图 书 有 印 订 质量 问题 ,请 寄 回 本 社 客服 中 心 调换 或 电话 021 - 60821720 联系 )\n=== 第 101 页 ===\n虽 | 读 材料 |\n光 年 和 纳米\n在 阅读 报纸 ji 赤 志 或 科技 书刊 时 ,有 时 我 们 会 看 到 “ 光 年 "" “纳米 ""这 两 个 名\n称 ,你 知道 它 科 的 含义 吗 ?\n光 年 (Jight year) 是 天 文学 中 使 用 的 长 度 单 位 ,符号 为 1.y. ,主要 用 于 计量 太\n阳 系 外 天 体 世 间 的 距 痪 ,1 光 年 是 指 光 在 真空 中 一 年 时 间 所 走 的 距离 , 它 可 由 速\n度 ( 光 速 ) 和 时 间 ( 一 年 ) 算 出 来 :\n真空 中 的 光速 田 寺 ”< =299792.458 Fk / 秒 ，\n14 ~ 60 % 60 x24 x365.25( 秒 ) ，\n故 工 光 年 二 299792. 458 x 60 x 60 x 24 x 365.25\n~9.46 x102( 千 米 ).\n这 就 是 说 ,一 光 年 约 等 于 9846 万 亿 税 米 .\n离 太 阳 最 近 的 恒星 ( 半 人 马 座 比 邻 是 ) 与 太阳 的 距离 为 4.22 光 年 . 银河 系 的\n直径 约 为 10 万 光 年 . 人 类 所 观测 的 宇宙 深度 已 达到 150 亿 光 年 . 你 能 算出 这 些\n距离 等 于 多 少 千 米 吗 ? 从 中 你 可 以 体会 到 财 光 年 作 单位 的 优越 性 .\n光 年 用 来 计量 非常 大 的 距离 ,而 纳米 (Tanoniete 梧 则 是 表示 微小 距离 的 单",2.0,72.4659090909091,华东师大版_八年级_义务教育教科书·数学八年级下册,94,2025-07-21T14:24:55.862Z,2.0,义务教育教科书·数学八年级下册,/Users/LeoQin/Documents/GitHub/PDFconvertor/training_data/初中/数学/华东师大版-华东师范大学出版社/八年级/义务教育教科书·数学八年级下册.pdf,八年级,tesseract.js-parallel,unknown,0.596830985915493,0.5,1,72.4659090909091,,,,true,true,,physics,下册,华东师大版_八年级_义务教育教科书·数学八年级下册.json,数学,176,初中_数学_华东师大版_八年级_义务教育教科书·数学八年级下册
华东师大版_八年级_义务教育教科书·数学八年级下册_chunk_19,19,"阳的 距离为 4.22 光年 . 银河系 的直径约 为 10 万光 年 . 人类 所观测的 宇宙深度已 达到 150 亿光 年 . 你能 算出这 些距离等 于多 少千 米吗 ? 从中 你可 以体会到 财光 年作 单位的 优越性 . 光年 用来 计量非常大 的距离 ,而纳米 (Tanoniete 梧则 是表示微小距离的 单位 ,符号为 nm. 1 纳米 107 K( 即 T5 米 )， 由于 籼米 10 人毫米 ,所以 可以 算出 1 纳米 10 毫米 , 它相 当于 1 毫米的 一百 万分 着一 .而卫 毫米 相当于 我们 通常使 用的 刻度尺 上的 一小 格 , 可想 而知 ,1 纳米是 多么 的风 . 当料 子的 大小 处在 1 一 100 纳米范围内 ,可称 为纳米将 子 . 纳米浆 子的 尺寸小 ,表面积 大 ,具有高 度的 活性 . 因此 ,利用纳米粒子可 制备活性又 高的 催化剂 ,在火箭固体燃料中 迭入 铝的 纳米微粒 ,可提高燃烧效率 . 利用铁 磁纳 洲烤 料可 制成 磁性 信用卡 、 磁性 钥匙 ,以及 高性 能录像带 等 . 利用纳米材料等 离予 共插 频率 的可 调性 可制 成隐形飞机的 涂料 . 纳米材料的 表面积 大 ,对外 界环境 (物理的 和化 学的 ) 十分 敏感 ,在制造传感器方面是 有前 途的 材料 ,目前已 开发出 测量温度状 辐射 和检测各 种特定气体的 传感器 . 纳米材料在 生物学 和医学工程中 也有 重要庙 用 . 纳米材料科学是 20 世纪 80 年代 末诞生并 正在崛起的 科技新 领域 , 客已 成为 人们 普遍关注的 一个 科技热点 . 22 .第 10 章分 式一 、 知识 结构 La 、 于的 分六 分数， 均 d a 分式 的运 笨 ___ 人 as 了",769,0.3465997440273037,low,ocr,"阳 的 距离 为 4.22 光 年 . 银河 系 的\n直径 约 为 10 万 光 年 . 人 类 所 观测 的 宇宙 深度 已 达到 150 亿 光 年 . 你 能 算出 这 些\n距离 等 于 多 少 千 米 吗 ? 从 中 你 可 以 体会 到 财 光 年 作 单位 的 优越 性 .\n光 年 用 来 计量 非常 大 的 距离 ,而 纳米 (Tanoniete 梧 则 是 表示 微小 距离 的 单\n位 ,符号 为 nm. 1 纳米 =107° K( 即 T5 米 )， 由 于 籼米 = 10 人 毫米 ,所 以 可 以 算出\n1 纳米 = 10“ 毫米 , 它 相 当 于 1 毫米 的 一 百 万 分 着 一 .而 卫 毫 米 相当 于 我 们 通常\n使 用 的 刻度 尺 上 的 一 小 格 , 可 想 而 知 ,1 纳米 是 多 么 的 风 `.\n当 料 子 的 大 小 处 在 1 一 100 纳米 范围 内 ,可 称 为 纳米 将 子 . 纳米 浆 子 的 尺寸\n小 ,表面 积 大 ,具有 高 度 的 活性 . 因此 ,利用 纳米 粒子 可 制备 活性 又 高 的 催化 剂 ,在\n火箭 固体 燃料 中 迭 入 铝 的 纳米 微粒 ,可 提高 燃烧 效率 . 利用 铁 磁 纳 洲 烤 料 可 制 成 磁\n性 信用 卡 、 磁 性 钥匙 ,以 及 高 性 能 录像 带 等 . 利用 纳米 材料 等 离 予 共 插 频 率 的 可 调\n性 可 制 成 隐形 飞机 的 涂料 . 纳米 材料 的 表面 积 大 ,对 外 界 环境 (物理 的 和 化 学 的 )\n十 分 敏感 ,在 制造 传感器 方面 是 有 前 途 的 材料 ,目前 已 开发 出 测量 温度 & 状 辐 射 和\n检测 各 种 特定 气体 的 传感器 . 纳米 材料 在 生物 学 和 医学 工程 中 也 有 重要 庙 用 .\n纳米 材料 科学 是 20 世纪 80 年 代 末 诞生 并 正在 崛起 的 科技 新 领域 , 客 已 成\n为 人 们 普遍 关注 的 一 个 科技 热点 .\n22 .第 10 章 分 式\n=== 第 102 页 ===\n一 、 知 识 结 构\nLa 、\nTEA\n于 的 分 六\nTREE\n| 分数， 均 d| a 分 式 的 运 笨\nRE |\n|\nAAA\n___ 人 as 了",2.0,72.4659090909091,华东师大版_八年级_义务教育教科书·数学八年级下册,95,2025-07-21T14:24:55.862Z,2.0,义务教育教科书·数学八年级下册,/Users/LeoQin/Documents/GitHub/PDFconvertor/training_data/初中/数学/华东师大版-华东师范大学出版社/八年级/义务教育教科书·数学八年级下册.pdf,八年级,tesseract.js-parallel,unknown,0.8206521739130435,0.6,1,72.4659090909091,,,,true,true,,physics,下册,华东师大版_八年级_义务教育教科书·数学八年级下册.json,数学,176,初中_数学_华东师大版_八年级_义务教育教科书·数学八年级下册
华东师大版_八年级_义务教育教科书·数学八年级下册_chunk_20,20,"加市 法律 知识竞赛 ,他们 的成 绩分 别浙 o，w , ,a, ,这， 名学 生的 平均成 绩为 多少 ? 11. 甲 、 乙两 辆汽车分 别从 4、B 两城 同时 沿高 速公 路驱 癌 C 城 . 已知 4、C 两城 的路 程为 450 千米 ,B、C 两城 的路 程为 400 千米 , 甲孟 比乙 车的 速度快 10 千米 时 ,结果两 辆车 同时到 达 C 城 . 求两 车的 速度 . 12. 计算 : 人 2 V xx 1 (1) 一必 (2) 4 和二 第 16 章分 式 . 25 (3) T (4) (二 13. 某服 装制造三 要在 开学前 赶制 3000 套校 服 ,为了 尽快完成任务 , 厂领 导合 理调 西 3 加强 第一 线人 力 , 使每 天完成的 校服比 原计 划多 了 20 ,结果提前 4 天完 成任务 . 问原 计划每 天能 完成多 少套 校服 ? 14. 一辆 货车送 货上 山 , 并按 原路 下山 . 上山 速度 为 o 千米 时 ,下山 速度为 4 千米 时 . 求货 车上 .下山 的平均速度 . 15. (1) 已知 o Z 255k o2o Lpofa, a a ) efia L 号。 ks Saote 16. 观察下 面依次排列的 一串 单项式 : Xea222 ,4 器， 8x4 16x5 (1) 从第 二个 单项式 起 ,计算每 二个 单项式 与它 前面 的单项式 的商 , 你有 什么发 现 ? (2) 如果 按你 发现 的规律继续写 下去 ,第 10 办单项式 是什么 ? 26 .第 16 章分 式第 17 章函数及 其图 象去 和内 ol Ia a : ae 参一 Ne 村区 大千 世界 处在 不停 的运动变化中， 如何 来三 究区 些运动刘 化规律呢 ?",767,0.3259085779834427,low,ocr,"加 市 法 律 知识 竞赛 ,他 们 的 成 绩 分 别 浙 o ，w ,…,a, ,这 ， 名 学\n生 的 平均 成 绩 为 多 少 ?\n11. 甲 、 乙 两 辆 汽车 分 别 从 4、B 两 城 同 时 沿 高 速 公 路 驱 癌 C 城 . 已 知 4、C 两 城 的\n路 程 为 450 千 米 ,B、C 两 城 的 路 程 为 400 千 米 , 甲 孟 比 乙 车 的 速度 快 10\n千 米 /时 ,结果 两 辆 车 同时 到 达 C 城 . 求 两 车 的 速度 .\n12. 计算 :\n人 2 V xx-1\n(1) -一 必 (2) 4 =-- 和 | 二\n第 16 章 分 式 . 25\n=== 第 105 页 ===\n(3) T— — (4) (二\n13. 某 服 装 制造 三 要 在 开学 前 赶 制 3000 套 校 服 ,为 了 尽快 完成 任务 , 厂 领 导 合 理 调\n西 3 加 强 第 一 线 人 力 , 使 每 天 完成 的 校服 比 原 计 划 多 了 20% ,结果 提前 4 天 完\n成 任务 . 问 原 计划 每 天 能 完成 多 少 套 校服 ?\n14. 一 辆 货车 送 货 上 山 , 并 按 原 路 下 山 . 上 山 速 度 为 o 千 米 /时 ,下 山 速度 为 4\n千 米 /时 . 求 货 车 上 .下 山 的 平均 速度 .\n«@»\n15. (1) 已 知 o + Z 255k o2o Lpofa,\na a\n@) efia-L -号 。 ks Saote\n16. 观察 下 面 依次 排列 的 一 串 单项 式 :\nXea222 ,4 器 ， -8x4 16x5\n(1) 从 第 二 个 单项 式 起 ,计算 每 二 个 单项 式 与 它 前 面 的 单项 式 的 商 , 你 有 什么\n发 现 ?\n(2) 如 果 按 你 发 现 的 规律 继续 写 下 去 ,第 10 办 单项 式 是 什么 ?\n26 .第 16 章 分 式\n=== 第 106 页 ===\n第 17 章 “函数 及 其 图 象\n去 和 |\nNSER 内 -\nol &\n- Ia a\n: ae\n= 参 一 Ne 村”\n区\n大 千 世 界 处 在 不 停 的 运动 变化 中 ， 如 何 来 三 究 区 些 运动 刘 化 规律 呢 ?",2.0,72.4659090909091,华东师大版_八年级_义务教育教科书·数学八年级下册,98,2025-07-21T14:24:55.862Z,2.0,义务教育教科书·数学八年级下册,/Users/LeoQin/Documents/GitHub/PDFconvertor/training_data/初中/数学/华东师大版-华东师范大学出版社/八年级/义务教育教科书·数学八年级下册.pdf,八年级,tesseract.js-parallel,unknown,0.6477272727272727,0.5,1,72.4659090909091,,true,,true,true,,physics,下册,华东师大版_八年级_义务教育教科书·数学八年级下册.json,数学,176,初中_数学_华东师大版_八年级_义务教育教科书·数学八年级下册
华东师大版_八年级_义务教育教科书·数学八年级下册_chunk_21,21,"体重 ,如下 表 : 全届 岁 1 2 3 4 5 571s8 9 wlnda s 体重亲 因国 本加 加国 本本 天国 攻全 : 观察上 表 , 说一 说随 着年 龄的 增长 ,小蓄 的体重是 如何 变化的 ?在哪 一段 时间 内体重增加较 快 ? 8 .第 1 二章 函数及 其图 象问题 3 收音机 刻度盘 上的 波长和 频率分 别是 用米 (m) 和千 赫效 (kHz 为单位标 刻的 . 下面 是一 些对 应的 数值 : IECIEIEIEE 细心的 同学可 能会 发现 : 每一 列 A 与了 的对 应值 的乘积是 一个 定值 , 即 Af 300.000, 或者 说 f 可以 看出 :波长越 大 ,频率就 . 问题 4 圆的 面积随 着半径的 增大 而增 大 . 如果 用六 表示圆 的半径 ,表示圆 的面积 , 则与 之间 满足下列 天系 : S . 利用这 个关系式 , 试求 出半径为 1 em, 105 em, 2 cm、2.6 cm 、3.2 cm 时圆 的面积 ,并将 结果填 人下 表 : was 在上 面的 问题中 ,我们 研究了 一些 数量 关系 ,它们都 第 1 二章 函数及 其图 象 . 29 刻画了 某些 变化规律 . 这里 出现 了各 种各 样的 量 ,特别值 在其 他三 个得 注意的 是出 现了 一些 数值会 发生变化 的量 . 例如问题 1 2 中 ,刻画气温变化规律的 量是 时间 上和 和气温了, 气温了 随着 时间 写的 变化而 变化 ,它们可 以取 不同 的数值像 这样 在某 一变化过 程中 ,可以 取不 同数值的 量 ,叫做变量 (variable ). 上上 面各 个问题中 ,都出 现了 两个 变量 ,它们互相依赖，",741,0.32024667200854706,low,ocr,"体重 ,如 下 表 : 全\n届 岁 | 1 | 2 | 3 | 4 | 5 571s8|9 [wlnda]s\n体重\n亲 因 国 本 加 加 国 本 本 天 国 攻 全 :\n观察 上 表 , 说 一 说 随 着 年 龄 的 增长 ,小 蓄 的 体重 是 如\n何 变化 的 ?在 哪 一 段 时 间 内 体重 增加 较 快 ?\n8 .第 1 二 章 函数 及 其 图 象\n=== 第 108 页 ===\n问题 3\n收音 机 刻度 盘 上 的 波长 和 频率 分 别 是 用 米 (m) 和 千\n赫 效 (kHz 为 单位 标 刻 的 . 下 面 是 一 些 对 应 的 数值 :\nEECRNIEIEIEICICE\nIECIEIEIEE\n细心 的 同学 可 能 会 发 现 : 每 一 列 A 与 了 的 对 应 值 的\n乘积 是 一 个 定 值 , 即\nAf = 300.000,\n或 者 说 f=\n可 以 看 出 :波长 ^ 越 大 ,频率 /就 .\n问题 4\n圆 的 面积 随 着 半径 的 增 大 而 增 大 . 如 果 用 六 表示 圆\n的 半径 ,$ 表示 圆 的 面积 , 则 $ 与 之 间 满 足下 列 天 系 :\nS= .\n利用 这 个 关系 式 , 试 求 出 半径 为 1 em, 105 em,\n2 cm、2.6 cm 、3.2 cm 时 圆 的 面积 ,并 将 结果 填 人 下 表 :\nET\nwas | | | | |\n在 上 面 的 问题 中 ,我 们 研究 了 一 些 数 量 关系 ,它们 都\n第 1 二 章 ”函数 及 其 图 象 . 29\n=== 第 109 页 ===\n刻画 了 某 些 变化 规律 . 这 里 出 现 了 各 种 各 样 的 量 ,特别 值\n在 其 他 三 个 得 注意 的 是 出 现 了 一 些 数值 会 发 生变 化 的 量 . 例如 问题 1\n2 中 ,刻画 气温 变化 规律 的 量 是 时 间 上 和 和 气温 了, 气温 了 随 着\n- 时 间 写 的 变化 而 变化 ,它们 可 以 取 不 同 的 数值 像 这 样 在 某\n一 变化 过 程 中 ,可 以 取 不 同 数值 的 量 ,叫做 变量 (variable ).\n上 上 面 各 个 问题 中 ,都 出 现 了 两 个 变量 ,它们 互相 依赖 ，",2.0,72.4659090909091,华东师大版_八年级_义务教育教科书·数学八年级下册,100,2025-07-21T14:24:55.862Z,2.0,义务教育教科书·数学八年级下册,/Users/LeoQin/Documents/GitHub/PDFconvertor/training_data/初中/数学/华东师大版-华东师范大学出版社/八年级/义务教育教科书·数学八年级下册.pdf,八年级,tesseract.js-parallel,unknown,0.7476099426386233,0.5,1,72.4659090909091,true,true,,true,true,,mathematics,下册,华东师大版_八年级_义务教育教科书·数学八年级下册.json,数学,176,初中_数学_华东师大版_八年级_义务教育教科书·数学八年级下册
华东师大版_八年级_义务教育教科书·数学八年级下册_chunk_22,22,"的量 . 例如问题 1 2 中 ,刻画气温变化规律的 量是 时间 上和 和气温了, 气温了 随着 时间 写的 变化而 变化 ,它们可 以取 不同 的数值像 这样 在某 一变化过 程中 ,可以 取不 同数值的 量 ,叫做变量 (variable ). 上上 面各 个问题中 ,都出 现了 两个 变量 ,它们互相依赖， 密切相关 . 一般 地 ,如果 在一 个变化过 程中 ,有两 个变量， 试说 出在 面例如和 y, 对于 x 的每 一个 值 ,y 都有 唯一的 值与 之对 四个 问题中 的日 应 ,我们就 说 x 是自 变量 (independent variable) ,y 是因 变量 (dependent variable ) ,此时 也称 y 是 x 的函数 (function ). 表示函数关系的 方法通常有 三种 : (1) 解析法 . 如问题 3 中的 太 200.000, 问题 4 中的 Sa iTr 引本 数关系是 用表达式 表示 的 ,它们又 称函 数关 系式 ; (2) 列表法 . 如问题 2 中小 荤的 体重表 , 问题 3 中波 长与 频率的 关系表 5 (3) 图象 法 . 如图 17. 1. 1 中的 气温曲线 . 在问题的 研究过 程中 还有 一种 量 , 它的 取值 始终保 持不 变 , 我们 称包 为常量人 constant). 如问题 3 中的 300 000 ,问题 4 中的 亏等 都是 常量 . 在研究函数时 ;必须注意自 变量的 取值 范围 . 实际问 题中 , 自变量的 取值 必须符合实际意义 . 例如 ,上述 问题 4 中 , 自变 量表示圆 的尘 径 , 不能 为负数和 零 , 即它 的取 值范围为 一切 正实数 _ 玉 1. 举出 3 个日 常生活 中遇 到的 变量与 函数的 例子 .",778,0.41978557038252245,medium-low,ocr,"的 量 . 例如 问题 1\n2 中 ,刻画 气温 变化 规律 的 量 是 时 间 上 和 和 气温 了, 气温 了 随 着\n- 时 间 写 的 变化 而 变化 ,它们 可 以 取 不 同 的 数值 像 这 样 在 某\n一 变化 过 程 中 ,可 以 取 不 同 数值 的 量 ,叫做 变量 (variable ).\n上 上 面 各 个 问题 中 ,都 出 现 了 两 个 变量 ,它们 互相 依赖 ，\n密切 相关 . 一 般 地 ,如 果 在 一 个 变化 过 程 中 ,有 两 个 变量 ，\n试 说 出 在 面 例如 * 和 y, 对 于 x 的 每 一 个 值 ,y 都 有 唯一 的 值 与 之 对\n四 个 问题 中 的 日 应 ,我们 就 说 x 是 自 变量 (independent variable) ,y 是 因 变\n量 (dependent variable ) ,此 时 也 称 y 是 x 的 函数 (function ).\n表示 函数 关系 的 方法 通常 有 三 种 :\n(1) 解析 法 . 如 问题 3 中 的 太 = 200.000, 问题 4 中 的\nSa=iTr 引 本 数 关系 是 用 表达 式 表 示 的 ,它们 又 称 函 数 关\n系 式 ;\n(2) 列表 法 . 如 问题 2 中 小 荤 的 体重 表 , 问 题 3 中 波\n长 与 频率 的 关系 表 5\n(3) 图 象 法 . 如 图 17. 1. 1 中 的 气温 曲线 .\n在 问题 的 研究 过 程 中 * 还 有 一 种 量 , 它 的 取 值 始终 保\n持 不 变 , 我 们 称 包 为 常量 人 constant). 如 问题 3 中 的\n300 000 ,问题 4 中 的 亏 等 都 是 常量 .\n在 研究 函数 时 ;必须 注意 自 变量 的 取 值 范围 . 实际 问\n题 中 , 自 变量 的 取 值 必须 符合 实际 意义 . 例如 ,上 述 问 题\n4 中 , 自 变 量 > 表示 圆 的 尘 径 , 不 能 为 负数 和 零 , 即 它 的\n取 值 范围 为 一 切 正 实数\n_ 玉 |\n1. 举 出 3 个 日 常生 活 中 遇 到 的 变量 与 函数 的 例子 .",2.0,72.4659090909091,华东师大版_八年级_义务教育教科书·数学八年级下册,101,2025-07-21T14:24:55.862Z,2.0,义务教育教科书·数学八年级下册,/Users/LeoQin/Documents/GitHub/PDFconvertor/training_data/初中/数学/华东师大版-华东师范大学出版社/八年级/义务教育教科书·数学八年级下册.pdf,八年级,tesseract.js-parallel,unknown,0.7040998217468806,0.5,1,72.4659090909091,true,,,true,,,mathematics,下册,华东师大版_八年级_义务教育教科书·数学八年级下册.json,数学,176,初中_数学_华东师大版_八年级_义务教育教科书·数学八年级下册
