Chunk_ID,Chunk_Index,Content,Content_Length,Quality_Score,Reliability,Source_Type,Original_Content,Enhancement_Version,averageConfidence,book_name,chunkIndex,enhancementTimestamp,enhancementVersion,fileName,filePath,grade,ocrMethod,publisher,qualityMetrics_chineseCharRatio,qualityMetrics_coherenceScore,qualityMetrics_lengthScore,qualityMetrics_ocrConfidence,semanticFeatures_hasDefinition,semanticFeatures_hasExperiment,semanticFeatures_hasFormulas,semanticFeatures_hasNumbers,semanticFeatures_hasQuestion,semanticFeatures_isTableContent,semanticFeatures_subjectArea,semester,source_file,subject,totalPages,uniqueId
武汉版_八年级_义务教育教科书·科学八年级上册_chunk_71,71,度高 达 1 000 民的 岩浆和 大量 气体 、 尘埃 物质喷 出地 面， 尘烟 滚深， 开天 项日。 这些 物质 是从 哪里来 的 ?它们是 怎样喷 到地 表上 来的 呢 ? 9 火山口 : 二火山锥 上 A f 和 2 区 nr 人 e age. 图 3.1 火山喷发示意图 图 3.2 火山构造示意图 模拟火山喷发 1 在木板上 用乎 士做 成一 个火山的 底座。 2 在底座上 安放一 个容积为 1L 2 工的 塑料瓶， 再用 生士 围绕这 个塑料瓶 建成一 座火山模型， 然后 将其 防干。 3 在塑料瓶 中装 入 200 mL 300 mL 溶有 红色食用色素的 自来水， 将大 约 30 g 苏打粉 溶解其 中。 4 在苏打水 中投入 10 颗左右的 葡萄干， 搅动 水和 和葡萄干， 再加 入 200 mL 2 1 构成物质的 微粒 311.1 原子分 子 8 1.2 原子的 结构 1211.3 元素 第 1911.4 元素 家族 和元 一一 2712.1 单质与 化合 物物 34 22 混合物与 纯净物 质 3712.3 一种 特殊的 混合物 一一 溶液的 412.4 混合物 的分 离结 1 加 3 2 3.1， 吝视 地球 内部 的窗口 6013.2 地壳的 运动和 变化 6713.3 从大 陆漂移到 板块构造 300 mL 食用和 白醋， 然后用 力搅动。 分析 与思考 1. 加入 食用白醋后， 塑料 瓶中 有什么现象发 生 ? 2 这个 模型与 火山喷发中 的岩浆活动类 似吗 ?葡萄干代 表什么 ? 3. 结合图 3.1 和图 3.2， 猜想 火山 是如 何喷发的。 奸地 球内 部可 以释放出 巨大的 能量， 使某 一区 域的 热能特别集中。 在那,744,0.4186079112504307,medium-low,ocr,度 高 达 1 000 民 的 岩浆 和 大 量 气体 、 尘 埃 物质 喷 出 地 面 ，\n尘 烟 滚 深 ， 开 天 项 日 。 这 些 物 质 是 从 哪里 来 的 ?它们 是 怎样 喷 到 地 表 上 来 的 呢 ?\n9 AR 火山 口\n- : 二 火山 锥\n上 A f 和 2\n区 nr\n人 e age.\n图 3.1 火山 喷发 示意 图 图 3.2 火山 构造 示意 图\n模拟 火山 喷发\n1 在 木板 上 用 乎 士 做 成 一 个 火山 的 底座 。\n2 在 底座 上 安放 一 个 容积 为 1L -2 工 的 塑料 瓶 ， 再 用 生 士 围绕 这 个 塑料 瓶\n建成 一 座 火山 模型 ， 然 后 将 其 防 干 。\n3 在 塑料 瓶 中 装 入 200 mL - 300 mL 溶 有 红色 食用 色素 的 自来水 ， 将 大\n约 30 g 苏打 粉 溶解 其 中 。\n4 在 苏打 水 中 投入 10 颗 左右 的 葡萄 干 ， 搅 动 水 和 和 葡萄干 ， 再 加 入 200 mL ~\n=== 第 114 页 ===\n2 1 构成 物质 的 微粒\n311.1 原子 分 子\n8 | 1.2 原子 的 结构\n1211.3 元 素\n第 1911.4 元 素 家 族\n和\n元 一 一\n2712.1 单质 与 化 合 物\n物 34| 22 混合物 与 纯净 物\n质 3712.3 ”一 种 特殊 的 混合 物 一 一 溶液\n的 412.4 混合 物 的 分 离\n结\n1 加 3\n2| 3.1， 吝 视 地 球 内 部 的 窗口\n6013.2 地壳 的 运动 和 变化\n6713.3 ”从 大 陆 漂移 到 板块 构造\n=== 第 115 页 ===\n300 mL 食用 和 白醋， 然后 用 力 搅动 。\n分 析 与 思考\n1. 加 入 食用 白醋 后 ， 塑 料 瓶 中 有 什么 现象 发 生 ?\n2 这 个 模型 与 火山 喷发 中 的 岩浆 活动 类 似 吗 ?葡萄干 代 表 什么 ?\n3. 结合 图 3.1 和 图 3.2， 猜 想 火 山 是 如 何 喷发 的 。\n奸\n地 球 内 部 可 以 释放 出 巨大 的 能 量 ， 使 某 一 区 域 的 热能 特别 集中 。 在 那,2.0,78.12738853503184,武汉版_八年级_义务教育教科书·科学八年级上册,100,2025-07-21T14:24:59.005Z,2.0,义务教育教科书·科学八年级上册,/Users/LeoQin/Documents/GitHub/PDFconvertor/training_data/初中/科学/武汉版-武汉出版社/八年级/义务教育教科书·科学八年级上册.pdf,八年级,tesseract.js-parallel,unknown,0.7185185185185186,0.6,1,78.12738853503184,,,,true,true,,physics,上册,武汉版_八年级_义务教育教科书·科学八年级上册.json,科学,157,初中_科学_武汉版_八年级_义务教育教科书·科学八年级上册
武汉版_八年级_义务教育教科书·科学八年级上册_chunk_72,72,力搅动。 分析 与思考 1. 加入 食用白醋后， 塑料 瓶中 有什么现象发 生 ? 2 这个 模型与 火山喷发中 的岩浆活动类 似吗 ?葡萄干代 表什么 ? 3. 结合图 3.1 和图 3.2， 猜想 火山 是如 何喷发的。 奸地 球内 部可 以释放出 巨大的 能量， 使某 一区 域的 热能特别集中。 在那 里， 高温 将岩石熔化成 熔融态 的岩浆， 并有 气体不 断释放， 使岩浆所 受到相 的压力越 来越 大。 如果 上履 岩层 比较脆弱或 发生 断裂， 岩浆 和气体便 会沿 运着 地壳 裂口 或脆弱的 地方 喷出 地表， 形成 火山喷发 (voleaniceruption )。 到 5 1 结合你 的课外学 习情 况， 你认为地 球表面与 地球 内部 的组 成物质是 一样 的吗 ? 2. 地表 与地 球内 部的 温度和 压力是 否一 样 ? 阅读材料和 滩火山的 类型 火山根据其 活动情况可 分为 三类 : 活火 山 、 死火山 、 休了 眠火 山。 活火 山是 在人 类历史时 期周期性 喷发的 火山。 这类 火山正 处于 活动的 旺盛 时期。 我国 近期火山活动以 台湾岛 大地 火山群 的主峰七 星山 最为 有名。 死火 山是 在人 类历史以 前喷发过， 迄今 为止 没有再 喷发过 的火山。 这类 火山多 已表 失活动能 力， 有的 仍保持着 完整的 火山形态， 有的 则已 风化剥 蚀， 只剩 下残缺不 全的 火山踪迹。 位于 我国 华北 的山西大 同火 山群 包括 30 多座 死火山， 大约 在 10 万年 前停止喷发。 休眠火山是 在人 类历史以 来曾经喷发， 但其 后长 期处 于相对静止状态的 火山。 这类 火山仍 保存有 完好的 火山形态， 具有 活动能 力。 有着 著名的 长白,759,0.550967642227944,medium-low,ocr,力 搅动 。\n分 析 与 思考\n1. 加 入 食用 白醋 后 ， 塑 料 瓶 中 有 什么 现象 发 生 ?\n2 这 个 模型 与 火山 喷发 中 的 岩浆 活动 类 似 吗 ?葡萄干 代 表 什么 ?\n3. 结合 图 3.1 和 图 3.2， 猜 想 火 山 是 如 何 喷发 的 。\n奸\n地 球 内 部 可 以 释放 出 巨大 的 能 量 ， 使 某 一 区 域 的 热能 特别 集中 。 在 那\n里 ， 高 温 将 岩石 熔化 成 熔融 态 的 岩浆 ， 并 有 气体 不 断 释放 ， 使 岩浆 所 受到 相\n的 压力 越 来 越 大 。 如 果 上 履 岩 层 比较 脆弱 或 发 生 断 裂 ， 岩 浆 和 气体 便 会 沿 运\n着 地 壳 裂 口 或 脆弱 的 地 方 喷 出 地 表 ， 形 成 火山 喷发 (voleaniceruption ) 。 到\n| 5\n1 结合 你 的 课外 学 习 情 况 ， 你 认为 地 球 表面 与 地 球 内 部 的 组 成 物质 是 一 样\n的 吗 ?\n2. 地 表 与 地 球 内 部 的 温度 和 压力 是 否 一 样 ?\nSS\n阅读 材料 和 滩\n火山 的 类 型\n火山 根据 其 活动 情况 可 分 为 三 类 : 活 火 山 、 死 火山 、 休 了 眠 火 山 。\n活 火 山 是 在 人 类 历史 时 期 周期 性 喷发 的 火山 。 这 类 火山 正 处 于 活动 的 旺\n盛 时 期 。 我 国 近期 火山 活动 以 台湾 岛 大 地 火山 群 的 主峰 七 星 山 最 为 有 名 。\n死 火 山 是 在 人 类 历史 以 前 喷发 过 ， 迄 今 为 止 没有 再 喷发 过 的 火山 。 这 类\n火山 多 已 表 失 活动 能 力 ， 有 的 仍 保持 着 完整 的 火山 形态 ， 有 的 则 已 风化 剥\n蚀 ， 只 剩 下 残缺 不 全 的 火山 踪迹。 位 于 我 国 华 北 的 山西 大 同 火 山 群 包括 30\n多 座 死 火山 ， 大 约 在 10 万 年 前 停止 喷发 。\n休眠 火山 是 在 人 类 历史 以 来 曾经 喷发 ， 但 其 后 长 期 处 于 相对 静止 状态 的\n火山 。 这 类 火山 仍 保存 有 完好 的 火山 形态 ， 具 有 活动 能 力 。 有 着 著名 的 长 白,2.0,78.12738853503184,武汉版_八年级_义务教育教科书·科学八年级上册,101,2025-07-21T14:24:59.005Z,2.0,义务教育教科书·科学八年级上册,/Users/LeoQin/Documents/GitHub/PDFconvertor/training_data/初中/科学/武汉版-武汉出版社/八年级/义务教育教科书·科学八年级上册.pdf,八年级,tesseract.js-parallel,unknown,0.8663101604278075,0.6,1,78.12738853503184,,,,true,true,,unknown,上册,武汉版_八年级_义务教育教科书·科学八年级上册.json,科学,157,初中_科学_武汉版_八年级_义务教育教科书·科学八年级上册
武汉版_八年级_义务教育教科书·科学八年级上册_chunk_73,73,只剩 下残缺不 全的 火山踪迹。 位于 我国 华北 的山西大 同火 山群 包括 30 多座 死火山， 大约 在 10 万年 前停止喷发。 休眠火山是 在人 类历史以 来曾经喷发， 但其 后长 期处 于相对静止状态的 火山。 这类 火山仍 保存有 完好的 火山形态， 具有 活动能 力。 有着 著名的 长白 山天 池的 长白山主峰一 一白头山， 就是 一座 休了 眠火山。 活火 山 、 死火山和 休眠火山的 区别 不是 绝对的。 休眠 火山可 以复苏， 死火山也 可能 复活。 如在 我国 的五 大连 池火山群 中， 大部 分火山在 10 万年 前已 停止喷发， 但其 中的 老黑 山火 山和 火烧山 火山 却是 在公元 1719 一 1721 年间 喷发形成的。 HHF 火山给 人类 带来 了什么癌 火山喷发可 以摊 毁附近的 城市和 村庄， 也可 以形成山峰和 岛屿， 那么， 火吴山喷发到 底会 给人 类带 来什么呢 ? 秆人 与 ? 运避 读图 3.3 一图 3.9， 思考 以下 问题 : 1883 年， 印度 尼西亚公元 79 年， 维苏 54 火山喷发时 产生的 海的 喀拉 喀托 火山喷发， 约威 火山喷发使 繁华的 哺可 能使 海岸地 带形成数 三万 六千 人死 于火山喷发庞 贝古城整体淹没， 十米 高的 大浪。 引起的 巨浪 中。 造成两 千多 人武生人 : 等 re 之 5 本 0 4 J pa a Ver o 人和 图 3.3 火山喷发引起的 海啸图 3.4 图 3.5 用石膏制 成的 庞风 古城窒 难者 模型火山喷发形成的 烟岩浆中 含有金 、 火山好 像一 座天 然化 肥厂。 在,708,0.3665064581149721,low,ocr,只 剩 下 残缺 不 全 的 火山 踪迹。 位 于 我 国 华 北 的 山西 大 同 火 山 群 包括 30\n多 座 死 火山 ， 大 约 在 10 万 年 前 停止 喷发 。\n休眠 火山 是 在 人 类 历史 以 来 曾经 喷发 ， 但 其 后 长 期 处 于 相对 静止 状态 的\n火山 。 这 类 火山 仍 保存 有 完好 的 火山 形态 ， 具 有 活动 能 力 。 有 着 著名 的 长 白\n山 天 池 的 长 白山 主峰 一 一 白头 山 ， 就 是 一 座 休 了 眠 火山 。\n活 火 山 、 死 火山 和 休眠 火山 的 区 别 不 是 绝对 的 。 休 眠 火山 可 以 复苏 ， 死\n火山 也 可 能 “复活 ”。 如 在 我 国 的 五 大 连 池 火山 群 中 ， 大 部 分 火山 在 10 万\n年 前 已 停止 喷发 ， 但 其 中 的 老 黑 山 火 山 和 火烧 山 火 山 却 是 在 公元 1719 一 1721\n年 间 喷发 形成 的 。\n=== 第 116 页 ===\nAAA <HHF\n火山 给 人 类 带 来 了 什么\n] |\n癌 火山 喷发 可 以 摊 毁 附近 的 城市 和 村 庄 ， 也 可 以 形成 山峰 和 岛屿， 那么 ， 火\n吴山 喷发 到 底 会 给 人 类 带 来 什么 呢 ?\n秆 人\n与 AL ?\n运\n避 读 图 3.3 一 图 3.9， 思 考 以 下 问题 :\n1883 年 ， 印 度 尼 西亚 公元 79 年 ， 维 苏\n54 火山 喷发 时 产生 的 海 的 喀 拉 喀 托 火山 喷发 ， 约 威 火山 喷发 使 繁华 的\n哺 可 能 使 海岸 地 带 形成 数 三 万 六 千 人 死 于 火山 喷发 庞 贝 古城 整体 淹没 ，\n十 米 高 的 大 浪 。 引起 的 巨 浪 中 。 造成 两 千 多 人 武生\n人 : 等\n& re\n之 5 本 0\n4 J pa & a Ver\no = 人 和\n图 3.3 火山 喷发 引起 的 海啸 图 3.4 BRIEBFENU 图 3.5 ”用 石膏 制 成 的 庞 风\n古城 窒 难 者 模型\n火山 喷发 形成 的 烟 岩浆 中 含有 金 、 火山 好 像 一 座 天 然 化 肥 厂 。 在,2.0,78.12738853503184,武汉版_八年级_义务教育教科书·科学八年级上册,102,2025-07-21T14:24:59.005Z,2.0,义务教育教科书·科学八年级上册,/Users/LeoQin/Documents/GitHub/PDFconvertor/training_data/初中/科学/武汉版-武汉出版社/八年级/义务教育教科书·科学八年级上册.pdf,八年级,tesseract.js-parallel,unknown,0.8362235067437379,0.5,1,78.12738853503184,,,,true,true,,geography,上册,武汉版_八年级_义务教育教科书·科学八年级上册.json,科学,157,初中_科学_武汉版_八年级_义务教育教科书·科学八年级上册
武汉版_八年级_义务教育教科书·科学八年级上册_chunk_74,74,"米高 的大 浪。 引起的 巨浪 中。 造成两 千多 人武生人 : 等 re 之 5 本 0 4 J pa a Ver o 人和 图 3.3 火山喷发引起的 海啸图 3.4 图 3.5 用石膏制 成的 庞风 古城窒 难者 模型火山喷发形成的 烟岩浆中 含有金 、 火山好 像一 座天 然化 肥厂。 在云 可以 阻挡部 分太阳光 银 、 铜 、 金刚 石 、 硫火山喷发出 的灰尘里 含有磷 、 钾等 线， 使气温降低， 造成 等物质 , 冷却凝固后 多种 成分 , 可以 使士 壤变 得肥沃。 些地 区天 气异 常。 可形成多 种矿产。 这是 人们 愿意居住在 危险的 火山附 近的 原因之 一。 agree 本人 硫了 当 ae 本外国及 人和 四量 274 金刚石和 3 一生理和 银铜 本图 3.6 火山喷发形成的 烟云图 3.7 火山及 岩浆作 图 3.8 火山附近的 农田用 形成的 矿产火山爆发形成的 山峰 、 湖泊 等 ,成为 人们 的游览胜地。 性 E 地球 的结 构到 图 3.9 长白山天 池 1. 火山给 人类 造成了 哪些危害 ? 2. 火山带 给人 类的 益处又 有哪些 ? 火山喷发可 以给 人类 带来 巨大的 灾难。 涯浆 及其 挟带 的岩石碎 块会 扼埋 农田 、 道路 、 村庄 和城镇， 造成 人员 伤亡 及经 济损失， 喷到 空气中 的气 体和 尘埃物质会 污染空气， 导致 气候异常。 火山 活动也 可以 形成矿产 、 温泉 和肥沃的 火山灰 ; 海底火山喷发形成的 火山岛 可以 提供宝贵的 陆地。 研究 火山还 可以 帮助我 们了 解地 球的 内部 构造。 ) 阅读材料治 新西 兰火山",714,0.42561234634045386,medium-low,ocr,"米 高 的 大 浪 。 引起 的 巨 浪 中 。 造成 两 千 多 人 武生\n人 : 等\n& re\n之 5 本 0\n4 J pa & a Ver\no = 人 和\n图 3.3 火山 喷发 引起 的 海啸 图 3.4 BRIEBFENU 图 3.5 ”用 石膏 制 成 的 庞 风\n古城 窒 难 者 模型\n火山 喷发 形成 的 烟 岩浆 中 含有 金 、 火山 好 像 一 座 天 然 化 肥 厂 。 在\n云 可 以 阻挡 部 分 太阳 光 银 、 铜 、 金 刚 石 、 硫 火山 喷发 出 的 灰尘 里 含有 磷 、 钾 等\n线 ， 使 气温 降低 ， 造 成 等 物质 , 冷却 凝固 后 多 种 成 分 , 可 以 使 士 壤 变 得 肥沃 。\n- 些 地 区 天 气 异 常 。 可 形成 多 种 矿产 。 这 是 人 们 愿意 居住 在 危险 的 火山 附\n近 的 原因 之 一 。\n- agree\n本 人 硫 了 当 ae\n本 外国\n及 人 和 =\n四 量 274 金刚 石和 3\n一 生理 和\n银 铜 本\n图 3.6 ”火山 喷发 形成 的 烟云 图 3.7 ”火山 及 岩浆 作 图 3.8 火山 附近 的 农田\n用 形成 的 矿产\n=== 第 117 页 ===\n火山 爆发 形成 的\n山峰 、 湖 泊 等 ,成 为\n[ 人 们 的 游览 胜地 。\n性 E\n地\n球\n的\n结\n构\n到\n=\n图 3.9 ”长 白山 天 池\n1. 火山 给 人 类 造成 了 哪些 危害 ?\n2. 火山 带 给 人 类 的 益处 又 有 哪些 ?\n火山 喷发 可 以 给 人 类 带 来 巨大 的 灾难 。 涯 浆 及 其 挟 带 的 岩石 碎 块 会 扼\n埋 农 田 、 道 路 、 村 庄 和 城镇 ， 造 成 人 员 伤 亡 及 经 济 损失 ， 喷 到 空气 中 的 气\n体 和 尘埃 物质 会 污染 空气 ， 导 致 气候 异常 。 火 山 活动 也 可 以 形成 矿产 、 温\n泉 和 肥沃 的 火山 灰 ; 海底 火山 喷发 形成 的 火山 岛 可 以 提供 宝贵 的 陆地 。 研\n究 火山 还 可 以 帮助 我 们 了 解 地 球 的 内 部 构造 。\n/)\nASFZ\n阅读 材料 -< 治\n新 西 兰 火山",2.0,78.12738853503184,武汉版_八年级_义务教育教科书·科学八年级上册,103,2025-07-21T14:24:59.005Z,2.0,义务教育教科书·科学八年级上册,/Users/LeoQin/Documents/GitHub/PDFconvertor/training_data/初中/科学/武汉版-武汉出版社/八年级/义务教育教科书·科学八年级上册.pdf,八年级,tesseract.js-parallel,unknown,0.8368932038834952,0.5,1,78.12738853503184,,,,true,true,,geography,上册,武汉版_八年级_义务教育教科书·科学八年级上册.json,科学,157,初中_科学_武汉版_八年级_义务教育教科书·科学八年级上册
武汉版_八年级_义务教育教科书·科学八年级上册_chunk_75,75,亡及 经济 损失， 喷到 空气中 的气 体和 尘埃物质会 污染空气， 导致 气候异常。 火山 活动也 可以 形成矿产 、 温泉 和肥沃的 火山灰 ; 海底火山喷发形成的 火山岛 可以 提供宝贵的 陆地。 研究 火山还 可以 帮助我 们了 解地 球的 内部 构造。 ) 阅读材料治 新西 兰火山新 西兰 是火山多 发地， 其火山活动有 火山喷泉 、 火山 泥塘 和地 热蒸汽等 多种 方式。 火山 喷和 泉向 空中喷射出 来自 地下 深处 的沸水， 水柱 高度 随地压 而变化。 火山 泥塘 宛如 一锅 沸腾 的稀 粥， 充满 了气泡， 和气泡胀 破后 出现 一线 线地 热蒸汽。 火山活动的 迷人景色每 年吸引着 成千 上万 的游客。 火山 温泉和 泥塘 中的 地下 热水 含有 各种 化学 成分， 可用 于医治多 种疾病。 火山 泥中 含有的 化学 物质 如硫， 可用 来医治皮肤病。 地热 蒸汽可 通过管道收集起 来， 用于 家庭 和温 室取暖 、 烘干 和定型木材， 最重要的 应用 还是 发电。 妇地 震是 怎样发 生的 1。 动 2008 年 5 月 12 日， 四川 汶川发 生里 氏 8.0 级强烈地 震， 造成 了巨大琵。 的人 员伤亡和 经济 损失 ; 2011 年 3 月 Cs 1 上日， 日本 富城 县以 东太平洋 海域 Eee 汪汪发 生里 氏 9.0 级地 震， 引发 大规模海 哺， 造成 重大人 员伤 亡， 并引发日 本福 岛第 一核电站 发生 核泄漏事故。 大 Se 地为 什么会 发生 震动 y 地震 是怎样形 图 3.10 地震 后的 景象成 的 ? 模拟地 震,700,0.4111582079564058,medium-low,ocr,亡 及 经 济 损失 ， 喷 到 空气 中 的 气\n体 和 尘埃 物质 会 污染 空气 ， 导 致 气候 异常 。 火 山 活动 也 可 以 形成 矿产 、 温\n泉 和 肥沃 的 火山 灰 ; 海底 火山 喷发 形成 的 火山 岛 可 以 提供 宝贵 的 陆地 。 研\n究 火山 还 可 以 帮助 我 们 了 解 地 球 的 内 部 构造 。\n/)\nASFZ\n阅读 材料 -< 治\n新 西 兰 火山\n新 西 兰 是 火山 多 发 地 ， 其 火山 活动 有 火山 喷泉 、 火 山 泥 塘 和 地 热 蒸汽 等\n多 种 方式 。 火 山 喷 和 泉 向 空中 喷射 出 来 自 地 下 深 处 的 沸水 ， 水 柱 高 度 随地 压 而\n变化 。 火 山 泥 塘 宛 如 一 锅 沸 腾 的 稀 粥 ， 充 满 了 气泡 ， 和 气泡 胀 破 后 出 现 一 线 线\n地 热 蒸汽 。\n火山 活动 的 迷人 景色 每 年 吸引 着 成 千 上 万 的 游客 。 火 山 温泉 和 泥 塘 中 的\n=== 第 118 页 ===\n地 下 热 水 含 有 各 种 化 学 成 分 ， 可 用 于 医治 多 种 疾病 。 火 山 泥 中 含有 的 化 学 物\n质 如 硫 ， 可 用 来 医治 皮肤 病 。 地 热 蒸汽 可 通过 管道 收集 起 来 ， 用 于 家 庭 和 温\n] 室 取暖 、 烘 干 和 定型 木材 ， 最 重要 的 应 用 还 是 发 电 。\n妇 地 震 是 怎样 发 生 的\n1 。\n|\n=\n动 2008 年 5 月 12 日 ， 四 川 汶川 发\n生 里 氏 8.0 级 强烈 地 震 ， 造 成 了 巨大\n琵 。 的 人 员 伤亡 和 经 济 损失 ; 2011 年 3 月 Cs\n1 上 日， 日 本 富 城 县 以 东 太平 洋 海域 | Eee 汪汪\n发 生 里 氏 9.0 级 地 震 ， 引 发 大 规模 海 SR\n哺 ， 造 成 重大 人 员 伤 亡 ， 并 引发 日 本 SS\n福 岛 第 一 核电 站 发 生 核 泄漏 事故 。 大 Se\n地 为 什么 会 发 生 震 动 y 地 震 是 怎样 形\n图 3.10 ”地 震 后 的 景象\n成 的 ?\n模拟 地 震,2.0,78.12738853503184,武汉版_八年级_义务教育教科书·科学八年级上册,104,2025-07-21T14:24:59.005Z,2.0,义务教育教科书·科学八年级上册,/Users/LeoQin/Documents/GitHub/PDFconvertor/training_data/初中/科学/武汉版-武汉出版社/八年级/义务教育教科书·科学八年级上册.pdf,八年级,tesseract.js-parallel,unknown,0.8656126482213439,0.5,1,78.12738853503184,,,,true,true,,geography,上册,武汉版_八年级_义务教育教科书·科学八年级上册.json,科学,157,初中_科学_武汉版_八年级_义务教育教科书·科学八年级上册
