Chunk_ID,Chunk_Index,Content,Content_Length,Quality_Score,Reliability,Source_Type,Original_Content,Enhancement_Version,averageConfidence,book_name,chunkIndex,enhancementTimestamp,enhancementVersion,fileName,filePath,grade,ocrMethod,publisher,qualityMetrics_chineseCharRatio,qualityMetrics_coherenceScore,qualityMetrics_lengthScore,qualityMetrics_ocrConfidence,semanticFeatures_hasDefinition,semanticFeatures_hasExperiment,semanticFeatures_hasFormulas,semanticFeatures_hasNumbers,semanticFeatures_hasQuestion,semanticFeatures_isTableContent,semanticFeatures_subjectArea,semester,source_file,subject,totalPages,uniqueId
武汉版_八年级_义务教育教科书·科学八年级上册_chunk_25,25,"摄食关系， 画出 上述 动植物的 食物网， 并寻找人 类在 食物网 中的 位置。 138 3. 有哪些生物在 食物网 中找 不到 它们的 食物 ? 有哪些生物不 被其 他的 生物 作为 食物 ? 构成它们身体的 物质和 维持生命的 能量 是从 哪里来 的， 又到 哪里去 了 ? 6.3.. 生态 系统和 生物轿 每种 生物都 离不 开它 们的 生活环境， 生物 与环境保持着 十分 密切 的关系。 地球， 这一 生物的 共同家 园， 焕发 着理 然生机。 生态系统的 构成 74 本生物群落能 离开非 生物环境独立存在吗 ? 群落与 非生物环境有 什么关系 ? 读图 6.17， 思考 下列 问题 : 0 1， 图中 的生物分 别栖息在 本天 什么地 方 ? ze 生 2 选取 1 2 种生物， 分析 它们 的生活与 哪些环境因素生 Pe 痢 Vd 其有 关。 r nn， 消费 者 oi 3， 如果 干时 导致河流断 流 77 或干 泗， 致使 某种 生物的 生活一 ( 环境发 生改 变， 那么， 会对 这 Er 种生物产生什么影响 ? 人 139 EED, B 2 任何生物都 在一 定的 环境中 生活， 并与 周围环境中 的各 种全 你全 因素发 生各 种各 样的 联系。 植物 ia 离不 开阳 光， 鱼儿 离不 开水。 群站 人和 落中 的每 种生物都 受着 非生 物环境因素 ( 如阳光 、 土壤 、 温度 、 水等 ) 的影响。 群落与 非生物环境密 不可 分， 共同 构成了 生态系统。 由生物群落和 它的 无机 环境相互作用而 形成的 统一整体， 叫作 生态系 统 (ecosystem )。 生态 系统一 般有 四种 基本组 成部 分， 即非 生物 部分 、 生产 者 、 消费 者和 分解 者。",761,0.40279534618393115,medium-low,ocr,"摄食 关系 ， 画 出 上 述 动 植物 的 食物 网 ， 并 寻找 人 类 在\n食物 网 中 的 位 置 。\n138 3. 有 哪些 生物 在 食物 网 中 找 不 到 它们 的 食物 ? 有 哪些 生物 不 被 其 他 的 生\n物 作 为 食物 ? 构成 它们 身体 的 物质 和 维持 生命 的 能 量 是 从 哪里 来 的 ， 又 到 哪里\n去 了 ?\n6.3.. 生 态 系统 和 生物 轿\n每 种 生物 都 离 不 开 它 们 的 生活 环境 ， 生 物 与 环境 保持 着 十 分 密\n切 的 关系 。 地 球 ， 这 一 生物 的 共同 家 园 ， 焕 发 着 理 然 生机 。\n生态 系统 的 构成\n74\n本\n生物 群落 能 离开 非 生物 环境 独立 存在 吗 ? 群落 与 非 生物 环境 有 什么 关系 ?\n=== 第 53 页 ===\n读 图 6.17， 思 考 下 列 问题 : 0\n1， 图 中 的 生物 分 别 栖息 在 本 天\n什么 地 方 ? ze 生\n2 选取 1 ~ 2 种 生物 ， 分\n析 它 们 的 生活 与 哪些 环境 因素 生 Pe 痢 Vd 其\n有 关 。 r nn ， 消 费 者 oi\n3， 如 果 干 时 导致 河流 断 流 ™ 77\n或 干 泗 ， 致 使 某 种 生物 的 生活 一 (\n环境 发 生 改 变 ， 那 么 ， 会 对 这 Er -\n种 生物 产生 什么 影响 ? 人 139\nEED, B 2 ~\n任何 生物 都 在 一 定 的 环境 EN <\n中 生活 ， 并 与 周围 环境 中 的 各 种 NE 全 你 全\n因素 发 生 各 种 各 样 的 联系 。 植 物 ia\n离 不 开 阳 光 ， 鱼 儿 离 不 开水 。 群 站 人 和\n落 中 的 每 种 生物 都 受 着 非 生 物 环境 因素 ( 如 阳光 、 土 壤 、 温 度 、 水 等 ) 的 影响 。\n群落 与 非 生物 环境 密 不 可 分 ， 共 同 构成 了 生态 系统 。\n由 生物 群落 和 它 的 无 机 环境 相互 作用 而 形成 的 统一 整体 ， 叫 作 生态 系\n统 (ecosystem ) 。 生 态 系统 一 般 有 四 种 基本 组 成 部 分 ， 即 非 生 物 部 分 、 生\n产 者 、 消 费 者 和 分 解 者 。",2.0,78.12738853503184,武汉版_八年级_义务教育教科书·科学八年级上册,45,2025-07-21T14:24:59.003Z,2.0,义务教育教科书·科学八年级上册,/Users/LeoQin/Documents/GitHub/PDFconvertor/training_data/初中/科学/武汉版-武汉出版社/八年级/义务教育教科书·科学八年级上册.pdf,八年级,tesseract.js-parallel,unknown,0.8112522686025408,0.5,1,78.12738853503184,,,,true,true,,geography,上册,武汉版_八年级_义务教育教科书·科学八年级上册.json,科学,157,初中_科学_武汉版_八年级_义务教育教科书·科学八年级上册
武汉版_八年级_义务教育教科书·科学八年级上册_chunk_26,26,"土壤 、 温度 、 水等 ) 的影响。 群落与 非生物环境密 不可 分， 共同 构成了 生态系统。 由生物群落和 它的 无机 环境相互作用而 形成的 统一整体， 叫作 生态系 统 (ecosystem )。 生态 系统一 般有 四种 基本组 成部 分， 即非 生物 部分 、 生产 者 、 消费 者和 分解 者。 绿色植物是 主要生产者， 它们 利用光 能制造有 机物 并储存能 量 ; 直接或 间接依靠生产者 获得食物与 能量 的生物是 消费者 ;把废物 、 生物 遗体 分解 并使 原料重 归周围环境的 生物是 分解 者。 由于 生物的 生存环境不 同， 形成 了许多大 小不 同的 生态系统。 小到 池塘 、 花园， 大到 海洋 、 森林， 都各 自构 成生态系统。 地球 上的 全部 生物及 其无 机环 境的 总和， 构成 地球 上最 大的 生态系统一 生物圈 ( biosphere )。 0 生态系统的 相对稳定网 群落中 存在着 各种 相互联系的 种群， 当一 个种 群受到某 种因素影响的 时候， 基同一群落中 的其 他种 群会 受到影响吗 ?生态系 统能 保持稳定吗 ? 园四 本读 图 6.18， 思考 下列 问题 : 1 如果 雨水 充足， 草原 上的 草生长茂 麻， 那么 草原上 的其 他生物的 数量会 发生 什么变化 ? 和 2. 如果 某种 原因使 草原上 免的 数量下 降， 其他 生物的 数量又 会发 生什么变 化 ? 草原上 生物的 种类 是否 会发 生变化 ? 全人 人 AS 2 区 H， Bos aln Ay : 人下 人 2 全图 6.18 草原生态系统生态系统中 存在着 各种 生物， 各种 生物的 数量昌 然在 不断 地变化 ,但",739,0.4058567589416952,medium-low,ocr,"土 壤 、 温 度 、 水 等 ) 的 影响 。\n群落 与 非 生物 环境 密 不 可 分 ， 共 同 构成 了 生态 系统 。\n由 生物 群落 和 它 的 无 机 环境 相互 作用 而 形成 的 统一 整体 ， 叫 作 生态 系\n统 (ecosystem ) 。 生 态 系统 一 般 有 四 种 基本 组 成 部 分 ， 即 非 生 物 部 分 、 生\n产 者 、 消 费 者 和 分 解 者 。\n绿色 植物 是 主要 生产 者 ， 它 们 利用 光 能 制造 有 机 物 并 储存 能 量 ; 直接\n或 间接 依靠 生产 者 获得 食物 与 能 量 的 生物 是 消费 者 ;把 废物 、 生 物 遗 体 分\n解 并 使 原料 重 归 周围 环境 的 生物 是 分 解 者 。\n由 于 生物 的 生存 环境 不 同 ， 形 成 了 许多 大 小 不 同 的 生态 系统 。 小 到 池塘 、\n花园 ， 大 到 海洋 、 森 林 ， 都 各 自 构 成 生态 系统 。 地 球 上 的 全 部 生物 及 其 无 机 环\n境 的 总 和 ， 构 成 地 球 上 最 大 的 生态 系统 一 “生物圈 ( biosphere ) 。\n=== 第 54 页 ===\n0 生态 系统 的 相对 稳定\n|\n网 群落 中 存在 着 各 种 相互 联系 的 种 群 ， 当 一 个 种 群 受到 某 种 因素 影响 的 时 候 ，\n基 同一 群落 中 的 其 他 种 群 会 受到 影响 吗 ?生态 系 统 能 保持 稳定 吗 ?\n园\n四 本 读 图 6.18， 思 考 下 列 问 题 :\n1 如 果 雨 水 充足 ， 草 原 上 的 草 生长 茂 麻 ， 那 么 草原 上 的 其 他 生物 的 数量 会\n发 生 什么 变化 ?\n和 2. 如 果 某 种 原因 使 草原 上 免 的 数量 下 降 ， 其 他 生物 的 数量 又 会 发 生 什么 变\n化 ? 草原 上 生物 的 种 类 是 否 会 发 生变 化 ?\n— CE\n全 - 人 =\n£ 人\nLA AS\n- 2\n区 H ，\n Bos aln\nAy : 人\n} 下 人 2 全\n图 6.18 ”草原 生态 系统\n=== 第 55 页 ===\n生态 系统 中 存在 着 各 种 生物 ， 各 种 生物 的 数量 昌 然 在 不 断 地 变化 ,但",2.0,78.12738853503184,武汉版_八年级_义务教育教科书·科学八年级上册,46,2025-07-21T14:24:59.003Z,2.0,义务教育教科书·科学八年级上册,/Users/LeoQin/Documents/GitHub/PDFconvertor/training_data/初中/科学/武汉版-武汉出版社/八年级/义务教育教科书·科学八年级上册.pdf,八年级,tesseract.js-parallel,unknown,0.8348794063079777,0.5,1,78.12738853503184,,,,true,true,,geography,上册,武汉版_八年级_义务教育教科书·科学八年级上册.json,科学,157,初中_科学_武汉版_八年级_义务教育教科书·科学八年级上册
武汉版_八年级_义务教育教科书·科学八年级上册_chunk_27,27,"的负面影响上 日益显露出 来。 喷洒 的大 量进 入土壤和 空气中， 并且 随雨水汇 入江河 、 湖沟 和海洋。 由于 这种 杀末 剂在 自然界 中短 时间内 难以分 解， 于是， 经浮游生物一 一鸟 、 兽 、 人这 一食物链 层层 富集， 对生物造成了 极大 危害。 处在 食物链 顶端 的消费者 岛 、 兽 、 人体内积累的 浓度 几乎为 海水中 的 1 000 万倍。DDT 使小 鸟的 卵党 变软 变薄， 这样 就使 鸟卵 极易 被压 碎而 铸不 出小 岛， 导致 许多鸟 类处 于灭绝边缘。DDT 还致使人 类产生许多疾病， 如瘤 症 、 不孕 、 胎儿 畸形等。 0 生物圈 是我 们共同的 家园 F 1 人类 的许多活动正 干扰和 破坏着 生态平衡， 如乱 砍滥 伐 、 过度 放牧， 致使 5 森林草场被 毁， 土地 沙化 ; 现代化 工业带 来严重的 三废 污染 ; 都市 化及 交通 运输的 发展， 使生态环境进一步恶化等。 长此 以往， 地球 会不 会变 得不 适于 人类 居住呢 ? 除地球以 外 ,还有 没有适合生物生存的 其他 星球 ? 7w w 阅读下 面的 资料， 讨论 下列 问题 : 1. 为什么科学家 们提前撤 出了 生物圈 2 号实验室 ? 2. 生物圈 2 号实验对 人类 有什么意义 ? 在现 有的 条件 下， 人类 能模拟出 一个 类似 地球 、 可供 人类 生存的 生态环境吗 ? S Caan 生物圈 2 号 20 世纪 80 年代， 在美国亚利桑那州 的沙漠中 出现 了生物圈 2 号工程基 地。 它是 为试验人 类离开地 球能 否生 存而 建造的。 1991 年 9 月， 八名 科学家 进入生",725,0.39961729964303205,low,ocr,"的 负面 影响 上 日益 显露 出 来 。 喷\n洒 的 DDT 大 量 进 入 土壤 和 空气 中 ， 并 且 随 雨水 汇 入 江河 、 湖 沟 和 海洋 。 由\n于 这 种 杀 末 剂 在 自然 界 中 短 时间 内 难以 分 解 ， 于 是 ， 经 浮游 生物 一 & 一\n鸟 、 兽 、 人 这 一 食物 链 层 层 富 集 ， 对 生物 造成 了 极 大 危害 。 处 在 食物 链 顶 端\n的 消费 者 岛 、 兽 、 人 体内 积累 的 DDT 浓 度 几乎 为 海水 中 的 1 000 万 倍 。DDT\n使 小 鸟 的 卵 党 变 软 变 薄 ， 这 样 就 使 鸟 卵 极 易 被 压 碎 而 铸 不 出 小 岛 ， 导 致 许多\n鸟 类 处 于 灭绝 边缘 。DDT 还 致使 人 类 产生 许多 疾病 ， 如 瘤 症 、 不 孕 、 胎 儿\n畸形 等 。\n=== 第 56 页 ===\n0 生物 圈 是 我 们 共同 的 家 园\nF\n1\n& 人 类 的 许多 活动 正 干扰 和 破坏 着 生态 平衡 ， 如 乱 砍 滥 伐 、 过 度 放牧 ， 致 使\n5 森林 草场 被 毁 ， 土 地 沙化 ; 现代 化 工业 带 来 严重 的 “三 废 ” 污 染 ; 都 市 化 及 交\n通 运输 的 发 展 ， 使 生态 环境 进一步 恶化 等 。 长 此 以 往 ， 地 球 会 不 会 变 得 不 适 于\n人 类 居住 呢 ? 除 地球 以 外 ,还 有 没有 适合 生物 生存 的 其 他 星球 ?\n- @7w w\n阅读 下 面 的 资料 ， 讨 论 下 列 问题 :\n1. 为 什么 科学 家 们 提前 撤 出 了 生物 圈 2 号 实验 室 ?\n2. 生物 圈 2 号 实验 对 人 类 有 什么 意义 ? 在 现 有 的 条 件 下 ， 人 类 能 模拟 出 一\n个 类 似 地 球 、 可 供 人 类 生存 的 生态 环境 吗 ?\nS\nCaan\n生物 圈 2 号\n20 世纪 80 年 代 ， 在 美国 亚利桑那 州 的 沙漠 中 出 现 了 生物 圈 2 号 工程 基\n地 。 它 是 为 试验 人 类 离开 地 球 能 否 生 存 而 建造 的 。\n1991 年 9 月 ， 八 名 科学 家 进入 生",2.0,78.12738853503184,武汉版_八年级_义务教育教科书·科学八年级上册,48,2025-07-21T14:24:59.003Z,2.0,义务教育教科书·科学八年级上册,/Users/LeoQin/Documents/GitHub/PDFconvertor/training_data/初中/科学/武汉版-武汉出版社/八年级/义务教育教科书·科学八年级上册.pdf,八年级,tesseract.js-parallel,unknown,0.8435114503816794,0.5,1,78.12738853503184,,true,,true,true,,geography,上册,武汉版_八年级_义务教育教科书·科学八年级上册.json,科学,157,初中_科学_武汉版_八年级_义务教育教科书·科学八年级上册
武汉版_八年级_义务教育教科书·科学八年级上册_chunk_28,28,现有 的条 件下， 人类 能模拟出 一个 类似 地球 、 可供 人类 生存的 生态环境吗 ? S Caan 生物圈 2 号 20 世纪 80 年代， 在美国亚利桑那州 的沙漠中 出现 了生物圈 2 号工程基 地。 它是 为试验人 类离开地 球能 否生 存而 建造的。 1991 年 9 月， 八名 科学家 进入生 物转 2 号， 开始 为期 两年 的实验。 他 _. 们在 那里一 边从 事科学研究， 一边 养 Sg __S28 鸡养 鸭， 耕种 收获， 过着 完全自给自 恒 Bo 足的 生活。 他们 必须设法保证这 个小 二可 小的 生态系统的 平衡。 然而， 一年 多后， 由于 种种 原因， 科学 家们 不得 不提前扩 出了 生掀 加 6l9 汪思 图 2 旺转 2 号。 1.2. 原子 的结构构 人类 对微观世界的 探索并 没有停留在 原子层面。 科学 家运用先 B 进的 实验技术， 发现 原子由 更小 的微粒组 成， 原子 内部 有更 加复杂质 的结构。 的微 H 原子结构模型原子能 够再 分吗 ? 如何 才能证 明原 子是 由更 小的 微粒组 成的 呢 ? 阅读关于 wa 粒子散射实验的 资料， 讨论 下面 的问题 : 三巴 习 1 如果金 原子是 一个 个实心球， 高速 前进 的粒子撞 到原子会 发生 什么 情况 ? 阳光是 所有 生态系统共有的。 大气 的环流 、 水的 流动等 把大 大小 小的 生态系统连 成了 一个 统一的 整体一 一生物圈。 生物 圈是 我们 共同的 家园。 0 家二 7 课外活动和 桑恤 鱼塘 体系 是一 我国 南方各 省农村比 名大 pn _ 较多 见上 且行 之有 效的 Ae，,719,0.4459011995563128,medium-low,ocr,现 有 的 条 件 下 ， 人 类 能 模拟 出 一\n个 类 似 地 球 、 可 供 人 类 生存 的 生态 环境 吗 ?\nS\nCaan\n生物 圈 2 号\n20 世纪 80 年 代 ， 在 美国 亚利桑那 州 的 沙漠 中 出 现 了 生物 圈 2 号 工程 基\n地 。 它 是 为 试验 人 类 离开 地 球 能 否 生 存 而 建造 的 。\n1991 年 9 月 ， 八 名 科学 家 进入 生\n物 转 2 号 ， 开 始 为 期 两 年 的 实验 。 他 —_.\n们 在 那里 一 边 从 事 科学 研究 ， 一 边 养 Sg ®__S28\n鸡 养 鸭 ， 耕 种 收获 ， 过 着 完全 自给 自 恒 Bo-\n足 的 生活 。 他 们 必须 设法 保证 这 个 小 二 可 >\n小 的 生态 系统 的 平衡 。 RE\n然而 ， 一 年 多 后 ， 由 于 种 种 原\n因 ， 科 学 家 们 不 得 不 提前 扩 出 了 生 掀 加 6l9 汪 思 图 2 旺\n转 2 号 。\n=== 第 57 页 ===\n] 1.2. 原 子 的 结构\n构 人 类 对 微观 世界 的 探索 并 没有 停留 在 原子 层面 。 科 学 家 运用 先\nB 进 的 实验 技术 ， 发 现 原子 由 更 小 的 微粒 组 成 ， 原 子 内 部 有 更 加 复杂\n质 的 结构 。\n的\n微\nH\n原子 结构 模型\n|\n原子 能 够 再 分 吗 ? 如 何 才能 证 明 原 子 是 由 更 小 的 微粒 组 成 的 呢 ?\n阅读 关于 wa 粒子 散射 实验 的 资料 ， 讨 论 下 面 的 问题 :\n三 巴 习\n1 如果 金 原子 是 一 个 个 “实心 球 ”， 高 速 前 进 的 粒子 撞 到 原子 会 发 生 什\n么 情况 ?\n=== 第 58 页 ===\n阳光 是 所 有 生态 系统 共有 的 。 大 气 的 环流 、 水 的 流动 等 把 大 大 小 小\n的 生态 系统 连 成 了 一 个 统一 的 整体 一 一 生物 圈 。 生 物 圈 是 我 们 共同 的\n家 园 。\n- 0 家\n二 7” 课外 活动 和\n桑 恤 鱼 塘 体 系 是 一\n我 国 南方 各 省 农村 比 -名 -大 pn _—\n较 多 见 上 且 行 之 有 效 的 | & & Ae | ，,2.0,78.12738853503184,武汉版_八年级_义务教育教科书·科学八年级上册,49,2025-07-21T14:24:59.003Z,2.0,义务教育教科书·科学八年级上册,/Users/LeoQin/Documents/GitHub/PDFconvertor/training_data/初中/科学/武汉版-武汉出版社/八年级/义务教育教科书·科学八年级上册.pdf,八年级,tesseract.js-parallel,unknown,0.8416988416988417,0.5,1,78.12738853503184,,true,,true,true,,chemistry,上册,武汉版_八年级_义务教育教科书·科学八年级上册.json,科学,157,初中_科学_武汉版_八年级_义务教育教科书·科学八年级上册
武汉版_八年级_义务教育教科书·科学八年级上册_chunk_29,29,"有生态系统共有的。 大气 的环流 、 水的 流动等 把大 大小 小的 生态系统连 成了 一个 统一的 整体一 一生物圈。 生物 圈是 我们 共同的 家园。 0 家二 7 课外活动和 桑恤 鱼塘 体系 是一 我国 南方各 省农村比 名大 pn _ 较多 见上 且行 之有 效的 Ae， 生产体系。 从该 体系到 和二 称 ae r a 143 HjT I A E 24 R J 号 7 制成 品 、 鱼类 以及 沼 mr 人气 等带 来的 经济 效益。 痢全 二全 4 一全 ia 和生态效益。 调查 本站 地区 桑恤 鱼塘 体系， 1 过论 这个 体系中 的生 应浊 8 态学 问题。 县玉 下 B620 一 1 在一 个阴 湿的 山洼 草从 中， 有一 堆长 满苔 葡的 腐木， 其中 聚集着 蚂蚁、 贬蛛 、 蝶虹 等动物， 它们 共同构成一 个。 其中 ,草丛是 . 2 是地 球上 所有 生物的 家， 也是 最大 的。 它是 由地 球上 所有 的和 所组 成的 统一的。 3. 在农业生产中 ,用天 敌控 制害虫种 群的 优点是 . 4 下疼 是南极食物网 的简 图。 看图 填写有 关问 题。 f ma 攻， 二物 及其 家加 il 144 浮游植物 (1 ) 这个 食物网 有食物甸 9 条。 (2 ) 这个 食物网 中的 生产者 是 . (3) 假设由 于某 种原因， 这个 生态系统中 的大 鱼全 部死亡， 磷是 的数量将 会 5 森林生物群落的 特点是 动植物种 类， 和群落结构， 种群 密度和 群落结构长 期处 于状态。 1 生命系统是 一个 开放的 系统。 生命 系统和 非生 物环境有 着紧密的 联系， 不可 分制。",721,0.4079158800231616,medium-low,ocr,"有 生态 系统 共有 的 。 大 气 的 环流 、 水 的 流动 等 把 大 大 小 小\n的 生态 系统 连 成 了 一 个 统一 的 整体 一 一 生物 圈 。 生 物 圈 是 我 们 共同 的\n家 园 。\n- 0 家\n二 7” 课外 活动 和\n桑 恤 鱼 塘 体 系 是 一\n我 国 南方 各 省 农村 比 -名 -大 pn _—\n较 多 见 上 且 行 之 有 效 的 | & & Ae | ，\n生产 体系 。 从 该 体系 到 和 二 称 ae @r- a 143\nHjT I A E 24 R J «| 号 | 7¥\n制 成 品 、 鱼 类 以 及 沼 — | mr | LS 人\n气 等 带 来 的 经 济 效益 。 | 痢 [ 全 二 全 4 一 全 ia |\n和 生态 效益 。 调 查 本 站\n地 区 桑 恤 鱼 塘 体 系 ， 1 -\n过 论 这 个 体系 中 的 生 应 浊 8\n态 学 问题。 县 玉 下\nB620 RESBAR\n一 =-\n1 在 一 个 阴 湿 的 山 洼 草 从 中 ， 有 一 堆 长 满 苔 葡 的 腐 木 ， 其 中 聚集 着 蚂蚁、 贬 蛛 、 蝶 虹\n等 动物 ， 它 们 共同 构成 一 个 。 其 中 ,草丛 是 .\n2 是 地 球 上 所 有 生物 的 家 ， 也 是 最 大 的 。 它 是 由 地 球\n上 所 有 的 和 所 组 成 的 统一 的 。\n3. 在 农业 生产 中 ,用 天 敌 控 制 害虫 种 群 的 优点 是 .\n=== 第 59 页 ===\n4 下 疼 是 南极 食物 网 的 简 图 。 看 图 填写 有 关 问 题 。\nf ma\n攻\n， 二\n物\n及\n其\n家\n加\nil\n144 浮游 植物\n(1 ) 这 个 食物 网 有 食物 甸 9 条 。\n(2 ) 这 个 食物 网 中 的 生产 者 是 .\n(3) 假设 由 于 某 种 原因 ， 这 个 生态 系统 中 的 大 鱼 全 部 死亡 ， 磷 是 的 数量 将 会\n5 森林 生物 群落 的 特点 是 动 植物 种 类 ， 和 群落 结构 ， 种\n群 密度 和 群落 结构 长 期 处 于 状态 。\n1 生命 系统 是 一 个 开放 的 系统 。 生 命 系统 和 非 生 物 环境 有 着 紧密 的 联系 ， 不 可 分 制 。",2.0,78.12738853503184,武汉版_八年级_义务教育教科书·科学八年级上册,50,2025-07-21T14:24:59.003Z,2.0,义务教育教科书·科学八年级上册,/Users/LeoQin/Documents/GitHub/PDFconvertor/training_data/初中/科学/武汉版-武汉出版社/八年级/义务教育教科书·科学八年级上册.pdf,八年级,tesseract.js-parallel,unknown,0.8070866141732284,0.5,1,78.12738853503184,,,,true,,,biology,上册,武汉版_八年级_义务教育教科书·科学八年级上册.json,科学,157,初中_科学_武汉版_八年级_义务教育教科书·科学八年级上册
