Chunk_ID,Chunk_Index,Content,Content_Length,Quality_Score,Reliability,Source_Type,Original_Content,Enhancement_Version,averageConfidence,book_name,chunkIndex,enhancementTimestamp,enhancementVersion,fileName,filePath,grade,ocrMethod,publisher,qualityMetrics_chineseCharRatio,qualityMetrics_coherenceScore,qualityMetrics_lengthScore,qualityMetrics_ocrConfidence,semanticFeatures_hasDefinition,semanticFeatures_hasExperiment,semanticFeatures_hasFormulas,semanticFeatures_hasNumbers,semanticFeatures_hasQuestion,semanticFeatures_isTableContent,semanticFeatures_subjectArea,semester,source_file,subject,totalPages,uniqueId
武汉版_八年级_义务教育教科书·科学八年级上册_chunk_51,51,"矿石一 样， 它们 可以 燃烧， 燃烧 起来 火力比 木头 还要 猛烈， 能够 连续烧 一整 夜， 一直到第 二天 早晨。 因此， 居民 就把 黑石头 当木头烧。 马可 波罗 所说 的可 燃的 黑石头 就是 煤。 中国人开始使 用煤， 大约 是在 马可 ' 波罗 见到 之前 1 000 多年。 煤是 我国 重要 的能 源。 在煤 的开发和 利用上 , 我们还 在继续探索之 中石油又 称原 油， 是地 球上 极其珍贵的 资源之 一。 天然 气的 主要成 分是 甲烷 (CH.)。 甲烷 是优质的 气体燃料， 是目前减少污染的 首选低 成本 燃料。 它还 是制 取痰 黑 、 氮 、 和氮肥、 甲醇、 乙烽 等化 工产品的 重要原料。 煤 、 石油 和天 然气 都是 由远古时 代的 动植物的 遗通 在高 温 、 高压 和缺 氧的 环境下 形成的。 煤和 石油等 化石 燃料 在地 球上 的蕴藏量 是有 限的， 是经 过亿 万年 形成的 非再 生能 源。 根据 科学 家的 预测， 石油 在地 球上 的总 储量为 2.0x 10""t， 现在 每年 主编 : 刘胜 祥鹤 鸿教材设计 : 刘从 康本 册主 编 : 张文华杨 立波 编写人 员 : (以姓氏笔画为 序 ) 杨毅 李娟 乔草 兰涂 敏韩 子煜 尖张 凯文 静的 消费水 平是 40 x 10t， 所以 50 年后 石油就 要枯竭 ; 煤的 总储量为 9.0 x 10 t， 每年 的消费水 平为 2.5 x 10""t， 如果 按这 个消费水 平， 最多 只能 维持 360 年。 ) 要这 由于 化石 燃料在 地球 上的 贮藏量 是有 限的， 人类 现在正 积极 利用太阳能 、 物",721,0.48655235175366796,medium-low,ocr,"矿石 一 样 ， 它 们 可 以 燃\n烧 ， 燃 烧 起 来 火力 比 木 头 还 要 猛烈 ， 能 够 连续 烧 一 整 夜 ， 一 直到 第 二 天 早晨 。\n因此 ， 居 民 就 把 黑石 头 当 木头 烧 。” 马 可 波 罗 所 说 的 可 燃 的 “黑石 头 ” 就 是\n煤 。 中 国人 开始 使 用 煤 ， 大 约 是 在 马 可 ' 波 罗 见 到 之 前 1 000 多 年 。\n煤 是 我 国 重 要 的 能 源 。 在 煤 的 开发 和 利用 上 , 我们 还 在 继续 探索\n之 中\n石油 又 称 原 油 ， 是 地 球 上 极其 珍贵 的 资源 之 一 。\n天 然 气 的 主要 成 分 是 甲烷 (CH.) 。 甲 烷 是 优质 的 气体 燃料 ， 是 目前\n减少 污染 的 首选 低 成 本 燃料 。 它 还 是 制 取 痰 黑 、 氮 、 和 氮肥、 甲醇、 乙 烽 等\n化 工 产品 的 重要 原料 。\n煤 、 石 油 和 天 然 气 都 是 由 远古 时 代 的 动 植物 的 遗 通 在 高 温 、 高 压 和 缺 氧 的\n环境 下 形成 的 。\n煤 和 石油 等 化 石 燃 料 在 地 球 上 的 蕴藏 量 是 有 限 的 ， 是 经 过 亿 万 年 形成 的 非 再\n生 能 源 。 根 据 科 学 家 的 预测 ， 石 油 在 地 球 上 的 总 储量 为 2.0x 10""t， 现 在 每 年\n=== 第 92 页 ===\n主 编 : 刘 胜 祥 鹤 鸿\n教材 设计 : 刘 从 康\n本 册 主 编 : 张文华 ” 杨 立 波\n编写 人 员 : (以 姓氏 笔画 为 序 )\n杨 毅 李 娟 乔 草 兰\n涂 敏 ” 韩 子 煜 尖\n张 凯 文 静\n=== 第 93 页 ===\n的 消费 水 平 是 40 x 10t， 所 以 50 年 后 石油 就 要 枯竭 ; 煤 的 总 储量 为 9.0 x 10 t，\n每 年 的 消费 水 平 为 2.5 x 10""t ， 如 果 按 这 个 消费 水 平 ， 最 多 只 能 维持 360 年 。 )\n要 这 ®\n由 于 化 石 燃料 在 地 球 上 的 贮藏 量 是 有 限 的 ， 人 类 现在 正 积 极 利用 太阳 能 、 物",2.0,78.12738853503184,武汉版_八年级_义务教育教科书·科学八年级上册,80,2025-07-21T14:24:59.004Z,2.0,义务教育教科书·科学八年级上册,/Users/LeoQin/Documents/GitHub/PDFconvertor/training_data/初中/科学/武汉版-武汉出版社/八年级/义务教育教科书·科学八年级上册.pdf,八年级,tesseract.js-parallel,unknown,0.8277886497064579,0.6,1,78.12738853503184,,,,true,,,biology,上册,武汉版_八年级_义务教育教科书·科学八年级上册.json,科学,157,初中_科学_武汉版_八年级_义务教育教科书·科学八年级上册
武汉版_八年级_义务教育教科书·科学八年级上册_chunk_52,52,"消费水 平是 40 x 10t， 所以 50 年后 石油就 要枯竭 ; 煤的 总储量为 9.0 x 10 t， 每年 的消费水 平为 2.5 x 10""t， 如果 按这 个消费水 平， 最多 只能 维持 360 年。 ) 要这 由于 化石 燃料在 地球 上的 贮藏量 是有 限的， 人类 现在正 积极 利用太阳能 、 物地 热能 、 风能 等新 的能 源。 你还 能列举出 其他 的新 能源 吗 ? 时分， as 和 2 癌读 材料人治西 气东 输工程是 我国正在 建设的 特大型 基础设施工程， 它以 新疆 塔里木气田为 主气 源， 以我 国中 东部的 长江 三角洲 地区 为目标消费市 场， 以干线管 道 、 重要 支线和 储气 库为 主体， 连接 沿线用 户， 形成 横贯中 国西 东的 天然 气 33 供气 系统。 实施西 气东 输工程， 可以 改善我 国的 能源 结构， 推动 东部 地区 产业结构调整， 减少 燃煤 造成的 污染， 改善 大气质量， 保护 生态 环境， 提高 人民 群众 生活的 环境质量。 RES id ; 玉门 武威请 边下 于人 延安 【郑州淮南无 锡南京 ""上海图 2.12 西气 东答 一线 工程 建设 示意图 5 一二 全办 二全 课外活动 ER 十一 寻找你 家里 的有 机物 和无 机物， 把它们记录下 来， 并与 同学们 交流。 ) 2,2。 混合 物与 纯净物 在我 们身边的 常见物质中， 有的 由几 种物质组 成， 如空气 、 泥的 土 、 糖水 、 浑浊 的河水等 ; 有的 只含 一种 单质或 化合 物， 如氨 气的 (CN ) 、 三氧化碳 (CO.) 、 和氢化钾 〈(KC1 ) 等。 类物质的 类型 0",733,0.31578660386840407,low,ocr,"消费 水 平 是 40 x 10t， 所 以 50 年 后 石油 就 要 枯竭 ; 煤 的 总 储量 为 9.0 x 10 t，\n每 年 的 消费 水 平 为 2.5 x 10""t ， 如 果 按 这 个 消费 水 平 ， 最 多 只 能 维持 360 年 。 )\n要 这 ®\n由 于 化 石 燃料 在 地 球 上 的 贮藏 量 是 有 限 的 ， 人 类 现在 正 积 极 利用 太阳 能 、 物\n地 热能 、 风 能 等 新 的 能 源 。 你 还 能 列举 出 其 他 的 新 能 源 吗 ? 时\n分\n， as 和 2\n癌 读 材料 -人治\n西 气 东 输 工程 是 我 国正 在 建设 的 特大 型 基础 设施 工程 ， 它 以 新 疆 塔里木\n气田 为 主 气 源 ， 以 我 国 中 东部 的 长 江 三角 洲 地 区 为 目标 消费 市 场 ， 以 干线 管\n道 、 重 要 支线 和 储 气 库 为 主体 ， 连 接 沿线 用 户 ， 形 成 横贯 中 国 西 东 的 天 然 气 33\n供 气 系统 。\n实施 西 气 东 输 工程 ， 可 以 改善 我 国 的 能 源 结构 ， 推 动 东 部 地 区 产业 结构\n调整 ， 减 少 燃 煤 造成 的 污染 ， 改 善 大 气质 量 ， 保 护 生 态 环境 ， 提 高 人 民 群 众\n生活 的 环境 质量 。\nEEEE\nRES\nid ;\n玉 门 武威 请 边\n下 于 人 >\n延安 【郑州\n淮南 无 锡\n南京 ""上海\n图 2.12” 西 气 东 答 一 线 工 程 建 设 示意 图\n5\n-一 二 全 办\n”二 全 ”课外 活动\nER- 十 一\n寻找 你 家 里 的 有 机 物 和 无 机 物 ， 把 它们 记录 下 来 ， 并 与 同学 们 交流 。\n=== 第 94 页 ===\n) 2,2。 混 合 物 与 纯净 物\n在 我 们 身边 的 常见 物质 中 ， 有 的 由 几 种 物质 组 成 ， 如 空气 、 泥\n的 土 、 糖 水 、 浑 浊 的 河水 等 ; 有 的 只 含 一 种 单质 或 化 合 物 ， 如 氨 气\n的 (CN ) 、 三 氧化 碳 (CO.) 、 和 氢化 钾 〈(KC1 ) 等 。\n类\n物质 的 类 型\n0",2.0,78.12738853503184,武汉版_八年级_义务教育教科书·科学八年级上册,81,2025-07-21T14:24:59.004Z,2.0,义务教育教科书·科学八年级上册,/Users/LeoQin/Documents/GitHub/PDFconvertor/training_data/初中/科学/武汉版-武汉出版社/八年级/义务教育教科书·科学八年级上册.pdf,八年级,tesseract.js-parallel,unknown,0.7954110898661568,0.5,1,78.12738853503184,,true,,true,true,,physics,上册,武汉版_八年级_义务教育教科书·科学八年级上册.json,科学,157,初中_科学_武汉版_八年级_义务教育教科书·科学八年级上册
武汉版_八年级_义务教育教科书·科学八年级上册_chunk_53,53,"流。 ) 2,2。 混合 物与 纯净物 在我 们身边的 常见物质中， 有的 由几 种物质组 成， 如空气 、 泥的 土 、 糖水 、 浑浊 的河水等 ; 有的 只含 一种 单质或 化合 物， 如氨 气的 (CN ) 、 三氧化碳 (CO.) 、 和氢化钾 〈(KC1 ) 等。 类物质的 类型 0 我们 生活的 世界上， 有千 千万 万种 物质， 我们 应如 何对 它们进行分 类呢 ? 读图 2.13 图 2.15， 思考 并讨论下 列问题 : 1. 冰水 混合物 是由 几种 物质组 成的 ?如何 证明 你的 观点 ? 2. 你注意过 感冒胶囊的 说明 书吗 ? 胶圳 中的 颗粒是 混合物 还是 纯净物 ? 3. 经过 净化 、 不含 厌尘 的空气是 纯净物 吗 ? 洁净的 物质与 纯净物 有何不同 ? 本人 B213 图 2.14 和胶 者中 的颗粒图 2.15 清洁的 空气物质可 以分 为两 种基本类 型 : 混合物 和纯净物。 混合 物 (mixture ) 是由 两种 或多 种物质混合而 成的， 纯净 物 〈pure substance ) 只由 一种 物质组 成。 纯净 物还 可以 分为 单质和 化合 物。 生活中 的混合物 ) . 如何 判断一 种物质是 混合物 还是 纯净物 组成 混合物 的各 种物质的 化学 性多 质是 否会 因混 合而 发生变化 呢 ? 英铁 粉和 硫粉 的混合物 与硫化亚 铁的 性质 比较 35 材料与 仪器试管， 酒精 灯， 试管 赤， 火柴， 磁铁， 硫粉， 铁粉， 稀盐酸， 水。 一 4 对 r 1. 取一 定量的 铁粉 和硫 粉 (质量 《和比 为 7: 4) 置于 干净的 纸上， 混合 均地 全三 Li 和",737,0.3277467456400427,low,ocr,"流 。\n=== 第 94 页 ===\n) 2,2。 混 合 物 与 纯净 物\n在 我 们 身边 的 常见 物质 中 ， 有 的 由 几 种 物质 组 成 ， 如 空气 、 泥\n的 土 、 糖 水 、 浑 浊 的 河水 等 ; 有 的 只 含 一 种 单质 或 化 合 物 ， 如 氨 气\n的 (CN ) 、 三 氧化 碳 (CO.) 、 和 氢化 钾 〈(KC1 ) 等 。\n类\n物质 的 类 型\n0\n/ 我 们 生活 的 世界 上 ， 有 千 千 万 万 种 物质 ， 我 们 应 如 何 对 它们 进行 分 类 呢 ?\n读 图 2.13 ~ 图 2.15， 思 考 并 讨论 下 列 问题 :\n1. 冰 水 混合 物 是 由 几 种 物质 组 成 的 ?如 何 证 明 你 的 观点 ?\n2. 你 注意 过 感冒 胶囊 的 说 明 书 吗 ? 胶 圳 中 的 颗粒 是 混合 物 还 是 纯净 物 ?\n3. 经 过 净化 、 不 含 厌 尘 的 空气 是 纯净 物 吗 ? 洁净 的 物质 与 纯净 物 有 何不 同 ?\n本\n人 —=\nB213 KIKESY 图 2.14 ”和 胶 者 中 的 颗粒 图 2.15 ”清洁 的 空气\n物质 可 以 分 为 两 种 基本 类 型 : 混合 物 和 纯净 物 。 混 合 物 (mixture ) 是\n由 两 种 或 多 种 物质 混合 而 成 的 ， 纯 净 物 〈pure substance ) 只 由 一 种 物质 组\n成 。 纯 净 物 还 可 以 分 为 单质 和 化 合 物 。\n=== 第 95 页 ===\n生活 中 的 混合 物 )\n| .\n如 何 判断 一 种 物质 是 混合 物 还 是 纯净 物 ” 组 成 混合 物 的 各 种 物质 的 化 学 性 多\n质 是 否 会 因 混 合 而 发 生变 化 呢 ? 英\n铁 粉 和 硫 粉 的 混合 物 与 硫化 亚 铁 的 性 质 比较 35\n材料 与 仪器 -\n试管 ， 酒 精 灯 ， 试 管 赤 ， 火 柴 ，\n磁铁 ， 硫 粉 ， 铁 粉 ， 稀 盐酸 ， 水 。 一\n4 对 r—\n1. 取 一 定量 的 铁 粉 和 硫 粉 (质量 《和 ANAL\n比 为 7: 4) 置 于 干净 的 纸 上 ， 混 合 均  } 地 全\n三 Li 和",2.0,78.12738853503184,武汉版_八年级_义务教育教科书·科学八年级上册,82,2025-07-21T14:24:59.004Z,2.0,义务教育教科书·科学八年级上册,/Users/LeoQin/Documents/GitHub/PDFconvertor/training_data/初中/科学/武汉版-武汉出版社/八年级/义务教育教科书·科学八年级上册.pdf,八年级,tesseract.js-parallel,unknown,0.7595419847328244,0.6,1,78.12738853503184,,,,true,true,,physics,上册,武汉版_八年级_义务教育教科书·科学八年级上册.json,科学,157,初中_科学_武汉版_八年级_义务教育教科书·科学八年级上册
武汉版_八年级_义务教育教科书·科学八年级上册_chunk_54,54,变化 呢 ? 英铁 粉和 硫粉 的混合物 与硫化亚 铁的 性质 比较 35 材料与 仪器试管， 酒精 灯， 试管 赤， 火柴， 磁铁， 硫粉， 铁粉， 稀盐酸， 水。 一 4 对 r 1. 取一 定量的 铁粉 和硫 粉 (质量 《和比 为 7: 4) 置于 干净的 纸上， 混合 均地 全三 Li 和勾 后观察所 得混合物 的颜色。 E 芭 2. 将所 得混合物 分成 四份。 取出 Ne 其中 一份， 用磁铁吸引。 观察 发生 的现象。 图 2.16 铁粉 和硫 粉的 反应 3. 取另 一份 混合物 加入 试管中， 再向 试管中 加入 5 mL 水。 观察 发生 的现象。 4. 取第 三份 混合物 加入 另一 支试管中， 加入 称盐 酸， 观察 发生 的现 象 O 5. 取第 四份 混合物 装入 另一 支试管中， 在酒精灯 上加 热反 应， 等反应完 后冷却， 把生成物 (硫化亚 铁 ) 倒在 纸上。 用硫化亚 铁代替铁 粉和 硫粉 的混合物， 重复 步骤 1 4。 把观察结果填 入表 2.1。 表 2.1 铁粉 和硫 粉混合物 与硫化亚 铁的 性质 比较 质类 分析 与思考 1. 为什么混合物 中的 不同 物质能 够保持各 自的 性质 ? 2. 混合物 与化 合物 的区 别是 什么 ? 混合物 中所 含的 物质之 间没 有发 生化学 反应， 各自 保持原 有的 性质 ; 混合物 各成 分及 其比例可 以是 任意的 ; 混合物 形成过 程中 大多 数不 吸收 或释放能 量 ; 混合物 可用 物理方法进行分 离。 化合 物是 由不 同种 元素 组成 的纯净物， 各元 素之 间按 照一 定的 比例化 合而 成， 不能 用物理方法分 离。,727,0.48230175625378063,medium-low,ocr,变 化 呢 ? 英\n铁 粉 和 硫 粉 的 混合 物 与 硫化 亚 铁 的 性 质 比较 35\n材料 与 仪器 -\n试管 ， 酒 精 灯 ， 试 管 赤 ， 火 柴 ，\n磁铁 ， 硫 粉 ， 铁 粉 ， 稀 盐酸 ， 水 。 一\n4 对 r—\n1. 取 一 定量 的 铁 粉 和 硫 粉 (质量 《和 ANAL\n比 为 7: 4) 置 于 干净 的 纸 上 ， 混 合 均  } 地 全\n三 Li 和\n勾 后 观察 所 得 混合 物 的 颜色 。 E 芭 >\n2. 将 所 得 混合 物 分 成 四 份 。 取 出 Ne \\n—\n其 中 一 份 ， 用 磁铁 吸引 。 观 察 发 生 的\n现象 。 图 2.16 铁 粉 和 硫 粉 的 反应\n3. 取 另 一 份 混合 物 加 入 试管 中 ，\n再 向 试管 中 加 入 5 mL 水 。 观 察 发 生 的 现象 。\n4. 取 第 三 份 混合 物 加 入 另 一 支 试管 中 ， 加 入 称 盐 酸 ， 观 察 发 生 的\n现 象 O\n5. 取 第 四 份 混合 物 装 入 另 一 支 试管 中 ， 在 酒精 灯 上 加 热 反 应 ， 等\n反应 完 后 冷却 ， 把 生成 物 (硫化 亚 铁 ) 倒 在 纸 上 。 用 硫化 亚 铁 代替 铁\n粉 和 硫 粉 的 混合 物 ， 重 复 步骤 1 4。\n把 观察 结果 填 入 表 2.1。\n=== 第 96 页 ===\n表 2.1 铁 粉 和 硫 粉 混合 物 与 硫化 亚 铁 的 性 质 比 较\n=\n质\n类\n分 析 与 思考\n1. 为 什么 混合 物 中 的 不 同 物质 能 够 保持 各 自 的 性 质 ?\n2. 混合 物 与 化 合 物 的 区 别 是 什么 ?\n混合 物 中 所 含 的 物质 之 间 没 有 发 生化 学 反应 ， 各 自 保持 原 有 的 性 质 ;\n混合 物 各 成 分 及 其 比例 可 以 是 任意 的 ; 混合 物 形成 过 程 中 大 多 数 不 吸 收 或\n释放 能 量 ; 混合 物 可 用 物理 方法 进行 分 离 。\n化 合 物 是 由 不 同 种 元 素 组 成 的 纯净 物 ， 各 元 素 之 间 按 照 一 定 的 比例 化\n合 而 成 ， 不 能 用 物理 方法 分 离 。,2.0,78.12738853503184,武汉版_八年级_义务教育教科书·科学八年级上册,83,2025-07-21T14:24:59.004Z,2.0,义务教育教科书·科学八年级上册,/Users/LeoQin/Documents/GitHub/PDFconvertor/training_data/初中/科学/武汉版-武汉出版社/八年级/义务教育教科书·科学八年级上册.pdf,八年级,tesseract.js-parallel,unknown,0.8352713178294574,0.6,1,78.12738853503184,,true,,true,true,,physics,上册,武汉版_八年级_义务教育教科书·科学八年级上册.json,科学,157,初中_科学_武汉版_八年级_义务教育教科书·科学八年级上册
武汉版_八年级_义务教育教科书·科学八年级上册_chunk_55,55,"反应， 各自 保持原 有的 性质 ; 混合物 各成 分及 其比例可 以是 任意的 ; 混合物 形成过 程中 大多 数不 吸收 或释放能 量 ; 混合物 可用 物理方法进行分 离。 化合 物是 由不 同种 元素 组成 的纯净物， 各元 素之 间按 照一 定的 比例化 合而 成， 不能 用物理方法分 离。 市场 上销售的 纯牛 奶是 纯净物， 还是 混合物 ? 站将 半导体材料一 一硅 硅 (Si) 是自然界 分布 最广 的元 素之 一， 约占 地沉 总质量的 27.72。 但是 直到 1823 年才 由瑞典化 学家 贝采 利乌 斯将 它分 离出 来。 自然 界中 的硅 主要以 二氧化硅 和硅 酸盐 的形式存在。 从自然界 直接 加工 制得 的硅， 其纯度最 高只 有 99 ; 经进一步加 工可 得到 用作 半寻 体材料的 高纯 硅， 其纯度可 达 99.999 999 999， 用于 制作电脑芯片 、 集成 电路等。 实际 上， 纯净 物是 相对的， 绝对 纯净的 物质是 不存在的。 Q 2.3,. 一种 特丈 的混合物 溶液 9) 把估 料加 进水 里， 会调制成 味道鲜美的 汤 ; 化验 人的 尿液， 医生 可推断出 人的 健康状况。 这些 都告诉我 们， 我们 所接触到 的各 种的 液体， 里面 也许 含有 各种 不同 的物质。 网类 什么是 溶液 o 炒菜的 时候， 常加 入食盐 、 胡椒 、 味精 、 痪油 、 食用 油等 调料。 当你 在品 和尝 美味 佳肴的 时候， 还能 看到 它们吗 ? 忆溶液 、 悬浊 液和 乳浊 液材料与 仪器试管， 药有 是， 食盐， 泥土， 食用油， 水。 步骤",712,0.4817482187237111,medium-low,ocr,"反应 ， 各 自 保持 原 有 的 性 质 ;\n混合 物 各 成 分 及 其 比例 可 以 是 任意 的 ; 混合 物 形成 过 程 中 大 多 数 不 吸 收 或\n释放 能 量 ; 混合 物 可 用 物理 方法 进行 分 离 。\n化 合 物 是 由 不 同 种 元 素 组 成 的 纯净 物 ， 各 元 素 之 间 按 照 一 定 的 比例 化\n合 而 成 ， 不 能 用 物理 方法 分 离 。\n市 场 上 销售 的 “ 纯 牛 奶 ” 是 纯净 物 ， 还 是 混合 物 ?\n站 将 <\n半导体 材料 一 一 硅\n硅 (Si) 是 自然 界 分 布 最 广 的 元 素 之 一 ， 约 占 地 沉 总 质量 的 27.72 %。\n但 是 直到 1823 年 才 由 瑞典 化 学 家 贝 采 利 乌 斯 将 它 分 离 出 来 。 自 然 界 中 的 硅\n主要 以 二 氧化 硅 和 硅 酸 盐 的 形式 存在 。 从 自然 界 直 接 加 工 制 得 的 硅 ， 其 纯度\n最 高 只 有 99 %; 经 进一步 加 工 可 得 到 用 作 半 寻 体 材料 的 高 纯 硅 ， 其 纯度 可\n达 99.999 999 999 % ， 用 于 制作 电脑 芯片 、 集 成 电路 等 。 实 际 上 ， 纯 净 物 是\n相对 的 ， 绝 对 纯净 的 物质 是 不 存在 的 。\n=== 第 97 页 ===\nQ SR\n2.3,. 一 种 特 丈 的 混合 物 溶液 9)\n把 估 料 加 进 水 里 ， 会 调制 成 味道 鲜美 的 汤 ; 化 验 人 的 尿 液 ， 医\n生 可 推断 出 人 的 健康 状况 。 这 些 都 告诉 我 们 ， 我 们 所 接触 到 的 各 种 的\n液体 ， 里 面 也 许 含 有 各 种 不 同 的 物质 。 网\n类\n什么 是 溶液\n| o\n炒菜 的 时 候 ， 常 加 入 食盐 、 胡 椒 、 味 精 、 痪 油 、 食 用 油 等 调料 。 当 你 在 品\n和 尝 美 味 佳肴 的 时 候 ， 还 能 看 到 它们 吗 ? 忆\n溶液 、 悬 浊 液 和 乳 浊 液\n材料 与 仪器\n试管 ， 药 有 是， 食盐， 泥土， 食用 油 ， 水 。\n步骤",2.0,78.12738853503184,武汉版_八年级_义务教育教科书·科学八年级上册,84,2025-07-21T14:24:59.004Z,2.0,义务教育教科书·科学八年级上册,/Users/LeoQin/Documents/GitHub/PDFconvertor/training_data/初中/科学/武汉版-武汉出版社/八年级/义务教育教科书·科学八年级上册.pdf,八年级,tesseract.js-parallel,unknown,0.8414872798434442,0.5,1,78.12738853503184,,,,true,true,,physics,上册,武汉版_八年级_义务教育教科书·科学八年级上册.json,科学,157,初中_科学_武汉版_八年级_义务教育教科书·科学八年级上册
