Chunk_ID,Chunk_Index,Content,Content_Length,Quality_Score,Reliability,Source_Type,Original_Content,Enhancement_Version,averageConfidence,book_name,chunkIndex,enhancementTimestamp,enhancementVersion,fileName,filePath,grade,ocrMethod,publisher,qualityMetrics_chineseCharRatio,qualityMetrics_coherenceScore,qualityMetrics_lengthScore,qualityMetrics_ocrConfidence,semanticFeatures_hasDefinition,semanticFeatures_hasExperiment,semanticFeatures_hasFormulas,semanticFeatures_hasNumbers,semanticFeatures_hasQuestion,semanticFeatures_isTableContent,semanticFeatures_subjectArea,semester,source_file,subject,totalPages,uniqueId
武汉版_八年级_义务教育教科书·科学八年级上册_chunk_0,0,. 观察狂 (或牛 、 羊 ) 的心脏， 辨认 心脏 的各 个部 位。 本所 在人 2. 用手 捏一 捍， 比较 心脏不 cll a or 同位置 上壁 的厚薄是 否一 样。 想人 ss 一想， 它们 收缩时 产生的 力量是 人否 一样 与其 运送血液的 远近有 什么关系 ? 图 4.22 心脏的 结构 3. 对照 图 422， 认识 心脏的 四个 腔及 所连 的血管， 并填充以 下空白 : 左心室将 血液输送到。 右心室将 血液输送到。 左心 房将 血液输送到。 右心房将 血液输送到。 4. 根据构成名 心腔 的壁 的厚薄， 推测 其输送血液所 能到 达距 离的 远近。 分析 与思考 1. 实验中， 应该 按照怎样的 次序 观察心脏 ? 2 心脏的 什么部 位壁 厚， 什么 部位 壁薄 ? 这与 它们输送血液所 能到 达的 距离远近有 什么联系 ? 3， 不合理的 生活方式会 导致心脏病 和其 他疾病。 因此， 青少年应 养成 哪些良好的 生活习惯 ? 心脏 (heart ) 、 血管 和血液共同构成人 体的 血液循环系统。 血液 在由 心脏和 血管构成的 密闭管道中 循环流动， 供给 人体 细胞生理活动所 需的 营养 物质和 氧气， 并带 走代谢产生的 废物。 心脏主要由 心肌构成， 心肌 强有 力的 收缩和 舒张使 心胜 有节律地 跳动， 像一 个压力泵 一样 推动血液在 全身 循环流动。 一个 健康成 年人 的心脏每 分钟 跳动 72 次左右。 心脏 一旦 停止跳动， 人就 有生命危险。 生你 心脏虽然充满血液， 但它 却不 能依靠心 腔中 的血液获取营养物质和 氧 . 心僚,703,0.4807329291621211,medium-low,ocr,. 观察 狂 (或 牛 、 羊 ) 的 # EN\n心脏 ， 辨 认 心 脏 的 各 个 部 位 。 本 所 在 人\n2. 用 手 捏 一 捍 ， 比 较 心脏 不 cll a= or\n同位 置 上 壁 的 厚薄 是 否 一 样 。 想 人 SA ss\n一 想 ， 它 们 收缩 时 产生 的 力量 是 人\n否 一 样 ” 与 其 运送 血液 的 远近 有\n什么 关系 ? 图 4.22 心脏 的 结构\n3. 对 照 图 422， 认 识 心脏 的 四 个 腔 及 所 连 的 血管 ， 并 填充 以 下 空白 :\n左 心室 将 血液 输送 到 。 右 心室 将 血液 输送 到 。\n左 心 房 将 血液 输送 到 。 右 心房 将 血液 输送 到 。\n4. 根据 构成 名 心 腔 的 壁 的 厚薄 ， 推 测 其 输送 血液 所 能 到 达 距 离 的 远近 。\n分 析 与 思考\n1. 实验 中 ， 应 该 按照 怎样 的 次 序 观察 心脏 ?\n2 心脏 的 什么 部 位 壁 厚 ， 什 么 部 位 壁 薄 ? 这 与 它们 输送 血液 所 能\n到 达 的 距离 远近 有 什么 联系 ?\n3， 不 合理 的 生活 方式 会 导致 心脏 病 和 其 他 疾病 。 因 此 ， 青 少年 应\n养 成 哪些 良好 的 生活 习惯 ?\n心脏 (heart ) 、 血 管 和 血液 共同 构成 人 体 的 血液 循环 系统 。 血 液 在 由\n心脏 和 血管 构成 的 密闭 管道 中 循环 流动 ， 供 给 人 体 细胞 生理 活动 所 需 的 营\n=== 第 5 页 ===\n养 物质 和 氧气 ， 并 带 走 代谢 产生 的 废物 。\n心脏 主要 由 心肌 构成 ， 心 肌 强 有 力 的 收缩 和 舒张 使 心 胜 有 节律 地 跳\n动 ， 像 一 个 “压力 泵 ”一 样 推动 血液 在 全 身 循环 流动 。 一 个 健康 成 年 人 的\n心脏 每 分 钟 跳动 72 次 左右 。 心 脏 一 旦 停止 跳动 ， 人 就 有 生命 危险 。\n生\n你\n心脏 虽然 充满 血液 ， 但 它 却 不 能 依靠 心 腔 中 的 血液 获取 营养 物质 和 氧 . 心 僚,2.0,78.12738853503184,武汉版_八年级_义务教育教科书·科学八年级上册,2,2025-07-21T14:24:59.003Z,2.0,义务教育教科书·科学八年级上册,/Users/LeoQin/Documents/GitHub/PDFconvertor/training_data/初中/科学/武汉版-武汉出版社/八年级/义务教育教科书·科学八年级上册.pdf,八年级,tesseract.js-parallel,unknown,0.8571428571428571,0.6,1,78.12738853503184,,true,,true,true,,biology,上册,武汉版_八年级_义务教育教科书·科学八年级上册.json,科学,157,初中_科学_武汉版_八年级_义务教育教科书·科学八年级上册
武汉版_八年级_义务教育教科书·科学八年级上册_chunk_1,1,"强有 力的 收缩和 舒张使 心胜 有节律地 跳动， 像一 个压力泵 一样 推动血液在 全身 循环流动。 一个 健康成 年人 的心脏每 分钟 跳动 72 次左右。 心脏 一旦 停止跳动， 人就 有生命危险。 生你 心脏虽然充满血液， 但它 却不 能依靠心 腔中 的血液获取营养物质和 氧 . 心僚 脏自 身的 血液循环是 由冠状血管参与完成的。 若食用过 多含 高胆固醇的 食物， 名可 能会 导致血液中 胆固醇过 多， 引起 冠状动脉的 病理性 变化， 血管 壁变 厚变 尼硬， 严重 时可 堵塞血 流， 甚至 使心脏因 缺血 、 缺氧 而停 跳， 危及 生命 ,这就 是次 冠心 病 e 多吃 新鲜 蔬菜 、 水果， 适当 进食肉 、 鱼 、 蛋 、 乳， 减少 每日 胆固醇的 摄取 os 保证充足的 睡眠和 心情舒畅适度运动， 都有 助于 预防冠 心病。 本血液在 血管中 周而复始地 流动运送着 体内的 物质。 血液 是由 哪些成 分组 成的 ? 这些成 分各 有什么功能 ? 读图 423， 思考 下面 的问题 : 1 血细胞有 哪几 种 ? 2 图中 的红细胞有 无细胞核 白细胞有 无细胞核 ? MWe 0 C 6 Pe e 红细胞本， 人细胞 g ee O 白细 隐血小板 Ha O "" 有白细胞二 全全 合计 ee 号 1 (淋巴细胞 ) .80a (和站 名 0l O.2500 图 4.23 血细胞血液 (blood ) 是由 血细胞 (blood cell ) 和血浆 (blood plasma ) 组成 的。 血细胞包括红细胞 、 和白细胞和 血小板。 红细胞具有运输氧 和二 氧化碳 的功能， 白细胞具有免疫功能， 血小 板具有饰 血作 用。",736,0.37589853635881104,low,ocr,"强 有 力 的 收缩 和 舒张 使 心 胜 有 节律 地 跳\n动 ， 像 一 个 “压力 泵 ”一 样 推动 血液 在 全 身 循环 流动 。 一 个 健康 成 年 人 的\n心脏 每 分 钟 跳动 72 次 左右 。 心 脏 一 旦 停止 跳动 ， 人 就 有 生命 危险 。\n生\n你\n心脏 虽然 充满 血液 ， 但 它 却 不 能 依靠 心 腔 中 的 血液 获取 营养 物质 和 氧 . 心 僚\n脏 自 身 的 血液 循环 是 由 冠状 血管 参与 完成 的 。 若 食用 过 多 含 高 胆固醇 的 食物 ， 名\n可 能 会 导致 血液 中 胆固醇 过 多 ， 引 起 冠状 动脉 的 病理 性 变化 ， 血 管 壁 变 厚 变 尼\n硬 ， 严 重 时 可 堵塞 血 流 ， 甚 至 使 心脏 因 缺 血 、 缺 氧 而 停 跳 ， 危 及 生命 ,这 就 是 次\n冠 心 病 [e]\n多 吃 新 鲜 蔬 菜 、 水 果 ， 适 当 进食 肉 、 鱼 、 蛋 、 乳 ， 减 少 每 日 胆固醇 的 摄取 os\n保证 充足 的 睡眠 和 心情 舒畅 适度 运动 ， 都 有 助 于 预防 冠 心病 。\n本\n血液 在 血管 中 周而复始 地 流动 运送 着 体内 的 物质 。 血 液 是 由 哪些 成 分 组\n成 的 ? 这些 成 分 各 有 什么 功能 ?\n读 图 423， 思 考 下 面 的 问题 :\n1 血细胞 有 哪 几 种 ?\n2 图 中 的 红细胞 有 无 细胞 核 ” 白 细胞 有 无 细胞 核 ?\nMWe 0 ¢C 6 Pe¥e ®\n红细胞 本 & ，\n人\n细胞 g ee #O% 白 细 隐\n血小板 Ha O @"" 有\n白细胞 二 全 全 合计 ee 号 1\n(淋巴 细胞 ) | @ .80a® &\n(和 ® < 站 名 &\n0l O.2500 BOP\n图 4.23 血细胞\n=== 第 6 页 ===\n血液 (blood ) 是 由 血细胞 (blood cell ) 和 血浆 (blood plasma ) 组 成 的 。\n血细胞 包括 红细胞 、 和 白细胞 和 血小板 。 红 细胞 具有 运输 氧 和 二 氧化 碳\n的 功能 ， 白 细胞 具有 免疫 功能 ， 血 小 板 具有 饰 血 作 用 。",2.0,78.12738853503184,武汉版_八年级_义务教育教科书·科学八年级上册,3,2025-07-21T14:24:59.003Z,2.0,义务教育教科书·科学八年级上册,/Users/LeoQin/Documents/GitHub/PDFconvertor/training_data/初中/科学/武汉版-武汉出版社/八年级/义务教育教科书·科学八年级上册.pdf,八年级,tesseract.js-parallel,unknown,0.7834862385321101,0.5,1,78.12738853503184,,,,true,true,,physics,上册,武汉版_八年级_义务教育教科书·科学八年级上册.json,科学,157,初中_科学_武汉版_八年级_义务教育教科书·科学八年级上册
武汉版_八年级_义务教育教科书·科学八年级上册_chunk_2,2,; 血小板数 过多， 机体 易形成血栓。 血型和 输血本 你知道自己是 哪种 血型吗 ? 你可 以为 哪种 血型的 病人输血 ? 如需要输血， 你可 以接受哪 种血型的 血液 ? 了解 输血 原则 收集有 关血 型的 资料， 完成 下表 : 表 43 输血时 血型之 间的 关系 2 四次 根据红细胞所 具有的 某些 特征， 可将 血液分 为 A 型 、B 型 、AB 型和 O 型四 种主要类 型。 输血时， 受血 者和 输血者 的血型必须相同或 者相 容。 如果 受血 者和 输血 者的 血型不 相容， 输血 后受 血者 的红细胞会 凝集成 团 ( 图 428)， 形成 血栓， 阻得 血液循环， 甚至 危及生命。 输血时 应以 输同 型血 为原则， 必要 时可 将 O 型血 输给 其他 几种 血型的 人， 型血 的人 可接受其 他三 种血型的 血。 输血能 够挽救病人的 生命， 但如 果输 入的 血液或 血液制品被 病毒污染， 也可 能使 受血 者感染上 乙型 肝炎 、 艾滋 病等 疾病。 输血 时， 一定 要对 使用 的血液或 血液制品进行严格的 检测。 Sz 阅读材料 rS 无偿 献血医学研究证 明， 一个 健康的 成年 人， 如果 加一 次失血量 不超过 400 mL， 能够 通过身体的 调 Sa gR 辣 m 节作用使 血液总 量很 快恢复正常。 因此， 一个 El Y 外你 健康的 成年 人每 次献血 200 mL 400 mL， 不 a 二 fl zk 会影响身体健康。 E 构从 1998 年起， 我国 实行无 偿献血制度，。 有国 本 ; 次提倡 18 55 周岁的 健康公民无 偿献 血。 符合,715,0.4358043391719744,medium-low,ocr,; 血小板 数 过 多 ， 机 体 易 形成 血栓 。\n血型 和 输血\n本\n你 知道 自己 是 哪 种 血型 吗 ? 你 可 以 为 哪 种 血型 的 病人 输血 ?” 如 需要 输血 ，\n你 可 以 接受 哪 种 血型 的 血液 ?\n了 解 输 血 原 则\n收集 有 关 血 型 的 资料 ， 完 成 下 表 :\n=== 第 8 页 ===\n表 43 输血 时 血型 之 间 的 关系\n2\n四\n次\n根据 红细胞 所 具有 的 某 些 特征 ， 可 将 血液 分 为 A 型 、B 型 、AB 型 和\nO 型 四 种 主要 类 型 。\n输血 时 ， 受 血 者 和 输血 者 的 血型 必须 相同 或 者 相 容 。 如 果 受 血 者 和 输\n血 者 的 血型 不 相 容 ， 输 血 后 受 血 者 的 红细胞 会 凝集 成 团 ( 图 428) ， 形 成\n血栓 ， 阻 得 血液 循环 ， 甚 至 危及 生命 。\n输血 时 应 以 输 同 型 血 为 原则 ， 必 要 时 可 将 O 型 血 输 给 其 他 几 种 血型 的 人 ，\nAB 型 血 的 人 可 接受 其 他 三 种 血型 的 血 。\n输血 能 够 挽救 病人 的 生命 ， 但 如 果 输 入 的 血液 或 血液 制品 被 病毒 污染 ， 也\n可 能 使 受 血 者 感染 上 乙 型 肝炎 、 艾 滋 病 等 疾病 。 输 血 时 ， 一 定 要 对 使 用 的 血液\n或 血液 制品 进行 严格 的 检测 。\n=== 第 9 页 ===\n/\nSz\n阅读 材料 rS\n无 偿 献血\n医学 研究 证 明 ， 一 个 健康 的 成 年 人 ， 如 果 加 =\n一 次 失血 量 不 超过 400 mL ， 能 够 通过 身体 的 调 ”Sa gR 辣 m\n节 作用 使 血液 总 量 很 快 恢复 正常 。 因 此 ， 一 个  El Y 外 你\n健康 的 成 年 人 每 次 献血 200 mL ~ 400 mL， 不 a 二 fl zk\n会 影响 身体 健康 。  E | 构\n从 1998 年 起 ， 我 国 实行 无 偿 献血 制度 ， 。 有 国 本 ; 次\n提倡 18 ~ 55 周岁 的 健康 公民 无 偿 献 血 。 符 合,2.0,78.12738853503184,武汉版_八年级_义务教育教科书·科学八年级上册,6,2025-07-21T14:24:59.003Z,2.0,义务教育教科书·科学八年级上册,/Users/LeoQin/Documents/GitHub/PDFconvertor/training_data/初中/科学/武汉版-武汉出版社/八年级/义务教育教科书·科学八年级上册.pdf,八年级,tesseract.js-parallel,unknown,0.8143133462282398,0.5,1,78.12738853503184,,,,true,true,,biology,上册,武汉版_八年级_义务教育教科书·科学八年级上册.json,科学,157,初中_科学_武汉版_八年级_义务教育教科书·科学八年级上册
武汉版_八年级_义务教育教科书·科学八年级上册_chunk_3,3,"gR 辣 m 节作用使 血液总 量很 快恢复正常。 因此， 一个 El Y 外你 健康的 成年 人每 次献血 200 mL 400 mL， 不 a 二 fl zk 会影响身体健康。 E 构从 1998 年起， 我国 实行无 偿献血制度，。 有国 本 ; 次提倡 18 55 周岁的 健康公民无 偿献 血。 符合 条件 的公民应 当积极参加献血， 为挽救他 人的 图 426 无偿 献四 生命秦 献爱心。 998 BifiEm N 人体 骨藉 中有 造血和 干细胞， 这些 干细胞能 够分 化为 红细胞 、 和白细胞和 血小 板。 血细胞时 时刻 刻都 在进行新 陈代谢， 老的 细胞剖 亡了， 新的 细胞又 成部 了。 例如 红细胞从 成长 到衰亡的 周期一 般为 120 天左右。 泌尿系统外 你知道什么是 骨移 植手术吗 ? 什么样 的病人需要进行肾 移植手术 ? 肾脏有 哪些重要功能 ? 读图 427 一图 429， 思考 下面的 问题 : 1. 泌尿系统由 哪些部 分组 成 ? 2. 肾单 位由 哪些部 分组 成 ? 时小 球是 个肾 小圳 膨大 ,四陷， 4 毛细血管球，， 包着 肾小 球 , 并与 肾小 管相连。 . NZ0) 1 . 肾皮 质全 7 做人 n Wik TT3 中的 5 答尿 管 B3 构弛 小管 这而 细 53 层长 ,外面包绕 和次 着毛细血管图 4.27 泌尿系统一 图 4.28 肾脏的 内部 结构示意图 一到 4 100 通过泌尿系统， 人体 将代谢过 程中 产生的 废物和 毒物以 尿液 的形式排 出体外。 泌尿 系统由 肾脏 、 和输尿管、 膀胱 、 尿道 组成。 民脏 是处 理血 液中 的废物并 形成尿 的场所 ; 输尿管 、 膀肛 和尿道是 排尿的 通道。",756,0.3917973641813412,low,ocr,"gR 辣 m\n节 作用 使 血液 总 量 很 快 恢复 正常 。 因 此 ， 一 个  El Y 外 你\n健康 的 成 年 人 每 次 献血 200 mL ~ 400 mL， 不 a 二 fl zk\n会 影响 身体 健康 。  E | 构\n从 1998 年 起 ， 我 国 实行 无 偿 献血 制度 ， 。 有 国 本 ; 次\n提倡 18 ~ 55 周岁 的 健康 公民 无 偿 献 血 。 符 合\n条 件 的 公民 应 当 积极 参加 献血 ， 为 挽救 他 人 的 图 426 无 偿 献 四\n生命 秦 献 爱心 。 998\nBifiEm N\n人 体 骨 藉 中 有 造血 和 干细胞， 这 些 干细胞 能 够 分 化 为 红细胞 、 和 白细胞 和 血\n小 板 。 血 细胞 时 时 刻 刻 都 在 进行 新 陈 代谢 ， 老 的 细胞 剖 亡 了 ， 新 的 细胞 又 成\n部 了 。 例 如 红细胞 从 成 长 到 衰亡 的 周期 一 般 为 120 天 左右 。\n泌尿 系统\n外\n你 知道 什么 是 骨 移 植 手术 吗 ? 什么 样 的 病人 需要 进行 肾 移植 手术 ?” 肾脏 有\n哪些 重要 功能 ?\n|\n读 图 427 一 图 429， 思 考 下面 的 问题 :\n1. 泌尿 系统 由 哪些 部 分 组 成 ?\n2. 肾 单 位 由 哪些 部 分 组 成 ?\n=== 第 10 页 ===\n时 小 球 是 个 “ 肾 小 圳 膨大 ,四 陷 ，\n4 毛细 血管 球 ，， 包 着 肾 小 球 , 并 与\n肾 小 管 相连 。\n. NZ0)\nFHAE [1\n€ . 肾 皮 质 全 7 做\n人\nn Wik TT3 | 中\n的 «\n5 答 尿 管 | B3\n构 | 弛 小 管 这 而 细 @53\n层 长 ,外 面包 绕 ”和\n次 着 毛细 血管-\n图 4.27 泌尿 系统 一 图 4.28 肾脏 的 内 部 结构 示意 图 一 到 4\n100\n通过 泌尿 系统 ， 人 体 将 代谢 过 程 中 产生 的 废物 和 毒物 以 尿 液 的 形式 排\n出 体外 。 泌 尿 系统 由 肾脏 、 和 输尿管、 膀胱 、 尿 道 组 成 。 民 脏 是 处 理 血 液 中\n的 废物 并 形成 尿 的 场所 ; 输尿管 、 膀 肛 和 尿道 是 排尿 的 通道 。",2.0,78.12738853503184,武汉版_八年级_义务教育教科书·科学八年级上册,7,2025-07-21T14:24:59.003Z,2.0,义务教育教科书·科学八年级上册,/Users/LeoQin/Documents/GitHub/PDFconvertor/training_data/初中/科学/武汉版-武汉出版社/八年级/义务教育教科书·科学八年级上册.pdf,八年级,tesseract.js-parallel,unknown,0.7632058287795993,0.5,1,78.12738853503184,,,,true,true,,biology,上册,武汉版_八年级_义务教育教科书·科学八年级上册.json,科学,157,初中_科学_武汉版_八年级_义务教育教科书·科学八年级上册
武汉版_八年级_义务教育教科书·科学八年级上册_chunk_4,4,7 泌尿系统一 图 4.28 肾脏的 内部 结构示意图 一到 4 100 通过泌尿系统， 人体 将代谢过 程中 产生的 废物和 毒物以 尿液 的形式排 出体外。 泌尿 系统由 肾脏 、 和输尿管、 膀胱 、 尿道 组成。 民脏 是处 理血 液中 的废物并 形成尿 的场所 ; 输尿管 、 膀肛 和尿道是 排尿的 通道。 (kidney ) 由约 100 多万 个肾 单位 《nephron ) 构成， 每个 肾单位由 肾小 球 、 红小 吉和 肾小 管组 成。 肾单位是 肾脏的 功能单位。 肾是 由许多肾 单位构成的， 肺是 由许多肺泡构成的， 小肠 黏膜 有许多绒 毛它 们在 结构上 有什么共同之 处 ? 内分 泌系 统 4 4 在紧急情况下， 人往往会 在瞬间爆发出 惊人的 力量。 你有 过类 似的 体验吗 ? 这与 什么因素有 关 ? 3 读图 4.30， 思考 下列 问题 : 4 1. 人体 中有 哪些主要的 内分 泌腺 ? 它们各 有什么功能 ? 2. 唾液腺 、 汗腺 也是 人体内的 腺体， 它们 与图 中的 腺体 有什么不 同 ? 和后 你的 结 5 下匡 脑 A wois 2 次甲状腺 101 肾上腺 1 和卵 梨 (女性 ) FILCFHHE) 甲状腺 、 胰岛 等腺 体和 唾液腺 、 汗腺 不同。 唾液 腺 、 汗腺 等腺 体的 分泌 物经 管道流 到皮肤表面或 体内管 腔中， 这类 腺体 叫作 外分 泌腺 〈exocrine gland )。 甲状 腺 、 胰岛 等腺 体没 有导管， 其分 泌物 直接进入毛细血管， 并随 血液 循环输送到 全身， 这类 腺体 叫作 内分 沙腺 〈endocrine gland )。 所有 的内 分泌 腺共同组 成人 体的 内分 泌系 统。,757,0.38472530360934176,low,ocr,7 泌尿 系统 一 图 4.28 肾脏 的 内 部 结构 示意 图 一 到 4\n100\n通过 泌尿 系统 ， 人 体 将 代谢 过 程 中 产生 的 废物 和 毒物 以 尿 液 的 形式 排\n出 体外 。 泌 尿 系统 由 肾脏 、 和 输尿管、 膀胱 、 尿 道 组 成 。 民 脏 是 处 理 血 液 中\n的 废物 并 形成 尿 的 场所 ; 输尿管 、 膀 肛 和 尿道 是 排尿 的 通道 。\nBE (kidney ) 由 约 100 多 万 个 肾 单 位 《nephron ) 构成 ， 每 个 肾 单位\n由 肾 小 球 、 红 小 吉 和 肾 小 管 组 成 。 肾 单位 是 肾脏 的 功能 单位 。\n肾 是 由 许多 肾 单位 构成 的 ， 肺 是 由 许多 肺泡 构成 的 ， 小 肠 黏 膜 有 许多 绒\n毛 …… 它 们 在 结构 上 有 什么 共同 之 处 ?\n内 分 泌 系 统\n4\n4\n在 紧急 情况 下 ， 人 往往 会 在 瞬间 爆发 出 惊人 的 力量 。 你 有 过 类 似 的 体验 吗 ?\n这 与 什么 因素 有 关 ?\n=== 第 11 页 ===\n3-\n读 图 4.30， 思 考 下 列 问题 : 4\n1. 人 体 中 有 哪些 主要 的 内 分 泌 腺 ? 它们 各 有 什么 功能 ?\n2. 唾液 腺 、 汗 腺 也 是 人 体内 的 腺 体 ， 它 们 与 图 中 的 腺 体 有 什么 不 同 ? 和 后\n你\n的\n结\n5 下 匡 脑 A\n[ wois 2\n次\n甲状 腺\n101\n肾上腺\n1 和\n卵 梨 (女性 )\nFILCFHHE) | [\nTRA\n甲状 腺 、 胰 岛 等 腺 体 和 唾液 腺 、 汗 腺 不 同 。 唾 液 腺 、 汗 腺 等 腺 体 的 分\n泌 物 经 管道 流 到 皮肤 表面 或 体内 管 腔 中 ， 这 类 腺 体 叫 作 外 分 泌 腺 〈exocrine\ngland ) 。 甲 状 腺 、 胰 岛 等 腺 体 没 有 导管 ， 其 分 泌 物 直接 进入 毛细 血管 ， 并\n随 血 液 循环 输送 到 全 身 ， 这 类 腺 体 叫 作 内 分 沙 腺 〈endocrine gland ) 。 所\n有 的 内 分 泌 腺 共同 组 成 人 体 的 内 分 泌 系 统 。,2.0,78.12738853503184,武汉版_八年级_义务教育教科书·科学八年级上册,8,2025-07-21T14:24:59.003Z,2.0,义务教育教科书·科学八年级上册,/Users/LeoQin/Documents/GitHub/PDFconvertor/training_data/初中/科学/武汉版-武汉出版社/八年级/义务教育教科书·科学八年级上册.pdf,八年级,tesseract.js-parallel,unknown,0.7577413479052824,0.5,1,78.12738853503184,,,,true,true,,unknown,上册,武汉版_八年级_义务教育教科书·科学八年级上册.json,科学,157,初中_科学_武汉版_八年级_义务教育教科书·科学八年级上册
