Chunk_ID,Chunk_Index,Content,Content_Length,Quality_Score,Reliability,Source_Type,Original_Content,Enhancement_Version,averageConfidence,book_name,chunkIndex,enhancementTimestamp,enhancementVersion,fileName,filePath,grade,ocrMethod,publisher,qualityMetrics_chineseCharRatio,qualityMetrics_coherenceScore,qualityMetrics_lengthScore,qualityMetrics_ocrConfidence,semanticFeatures_hasDefinition,semanticFeatures_hasExperiment,semanticFeatures_hasFormulas,semanticFeatures_hasNumbers,semanticFeatures_hasQuestion,semanticFeatures_isTableContent,semanticFeatures_subjectArea,semester,source_file,subject,totalPages,uniqueId
沪科技粤教版_八年级_义务教育教科书·物理八年级上册_chunk_40,40,"1) 让光线斜 向射 入空气和 水的 分界面 ,比较折射角 7 和入 射角 必的 大小 ; 折射角 7 ( 选填 大于 等于 ""或 ""小于 "") 入射 角 w。 (2) 改变入 射角 cx 的大 小， 观察 折射角 7 的变化情况， 当入 射角 C 增大 时， 折射 角 7 将 ( 选填 变大 或变 小 "")， 当入 射角 恤减 小时， 折射 角 7 将 ( 选填 变大 或变 小 "")。 若让 光线垂直射 向水 面 , 则进入水 中的 光线方向怎样 ? (3) 把水 槽换 成玻璃砖 (图 3 40)， 重做 图 3 39 所示 的实验。 上述 实验结果表明， 光折射时 ,折射光线 、 入庙 光线 、 法线 三者 在同一平面内 ; 折射光线和 入射 光线 分别 位于 两侧。 光从 空气斜 向射 到水 或玻 璃表面时 , 折射光线向 法线 全图 3 40 光在 空气与 玻璃界面上 发生 折射 折 , 折射角 ___ ( 选填 大于 ' 小于 或等 于 ) 入射 角。 入射 角增 大时 , 折射角 也 ___，。 光垂直射 到水 或玻璃的 表面时 , 在水 或玻璃中 的传播方向。 62 上述 结论就 是光 的折射规律。 忆实验证 明 , 在折射现象中 , 光路也 是可 逆的。 根据光 的折射规律 , 我们 就可 以 ss 解释活动 1 中的 铅笔向 上偏 折的 道理了。 自 P 点射 向空气中 的光线在 水面 处发 生了 折射 , 眼睛沿 着折射光线看 0 ss 去 , 觉得光 好像 是从 水中 己点 射出来 ss 的 , 已点 在 P 点的 上方 (图 3 一 41)。 用相 同的 方法 , 分析 铅笔 在水 下部 分的 各",722,0.3510456708034049,low,ocr,"1) 让 光线 斜 向 射 入 空气 和 水 的 分 界面 ,比较 折射 角 7 和 入 射 角 必 的 大 小 ;\n折射 角 7 ( 选 填 “大 于 ”等 于 ""或 ""小 于 "") 入 射 角 w。\n(2) 改变 入 射 角 cx 的 大 小 ， 观 察 折射 角 7 的 变化 情况 ，\n当 入 射 角 C 增 大 时 ， 折 射 角 7 将 ( 选 填 * 变 大 ”或 * 变 小 "") ，\n当 入 射 角 恤 减 小 时 ， 折 射 角 7 将 ( 选 填 * 变 大 ”或 * 变 小 "")。\n若 让 光线 垂直 射 向 水 面 , 则 进入 水 中 的 光线 方向 怎样 ?\n(3) 把 水 槽 换 成 玻璃 砖 (图 3 - 40)， 重 做 图 3 - 39 所 示 的 实验 。\n上 述 实验 结果 表明 ，\n光 折射 时 ,折射 光线 、 入 庙\n光线 、 法 线 三 者 在 同一 平面 内 ;\n折射 光线 和 入 射 光 线 分 别 位 于\n两 侧 。\n光 从 空气 斜 向 射 到 水 或 玻\n璃 表面 时 , 折射 光线 向 法 线 全\n图 3-40 ” 光 在 空气 与 玻璃 界面 上 发 生 折 射\n折 , 折射 角 ___ ( 选 填 “ 大\n于 ”' 小 于 ”或 “等 于 ”) 入 射 角 。 入 射 角 增 大 时 , 折射 角 也 ___， 。 光 垂直 射 到\n水 或 玻璃 的 表面 时 , 在 水 或 玻璃 中 的 传播 方向 。\n62\n=== 第 110 页 ===\n=== 第 111 页 ===\n上 述 结论 就 是 光 的 折射 规律。\n忆 实验 证 明 , 在 折射 现象 中 , 光路 也\n- 是 可 逆 的 。\nNS 根据 光 的 折射 规律 , 我 们 就 可 以\nss 解释 活动 1 中 的 铅笔 向 上 偏 折 的 道理\nSS 了 。 自 P 点 射 向 空气 中 的 光线 在 水 面\nISSN 处 发 生 了 折射 , 眼睛 沿 着 折射 光线 看\n-0 ss 去 , 觉得 光 好 像 是 从 水 中 己 点 射出 来\nss 的 , 已 点 在 P 点 的 上 方 (图 3 一 41) 。 用 相\n同 的 方法 , 分 析 铅 笔 在 水 下 部 分 的 各",2.0,75.28873239436619,沪科技粤教版_八年级_义务教育教科书·物理八年级上册,96,2025-07-21T14:25:05.892Z,2.0,义务教育教科书·物理八年级上册,/Users/LeoQin/Documents/GitHub/PDFconvertor/training_data/初中/物理/沪科技粤教版-上海科学技术出版社、广东教育出版社/八年级/义务教育教科书·物理八年级上册.pdf,八年级,tesseract.js-parallel,unknown,0.7948207171314741,0.5,1,75.28873239436619,,true,,true,true,,unknown,上册,沪科技粤教版_八年级_义务教育教科书·物理八年级上册.json,物理,142,初中_物理_沪科技粤教版_八年级_义务教育教科书·物理八年级上册
沪科技粤教版_八年级_义务教育教科书·物理八年级上册_chunk_41,41,"解释活动 1 中的 铅笔向 上偏 折的 道理了。 自 P 点射 向空气中 的光线在 水面 处发 生了 折射 , 眼睛沿 着折射光线看 0 ss 去 , 觉得光 好像 是从 水中 己点 射出来 ss 的 , 已点 在 P 点的 上方 (图 3 一 41)。 用相 同的 方法 , 分析 铅笔 在水 下部 分的 各图 3 41 观察水 中的 锦笔 点 ,最后 得到 的结果就 是我 们看 到的 情形。 生活中 和自然中 的折射现象生活中 , 光的 折射现象随处可 见。 在池塘边 上看 水的 深度 ( 称为 视深 度 ) , 总是 比实际的 水要 浅些 , 好像 池底 升高 了。 在水 面上 观察到 的鱼 的位 置 , 总要 比鱼 的实际位 置高 些 (图 3 42) , 因而渔民使 用钢 又捕 鱼时 , 总是 将钢 又向 看到 的鱼 的下 方投掷。 天文 学上 观察到 的太阳跟 它的 实际位 置 5 有一 定的 偏差 , 这是 由于 地球 周围大 气层 的密度不 均匀 , 光线发 生了 折射 ss 的缘故。 海市 萎楼 也是 由于 空气的 上分 布不 均匀 , 从而 导致光线折射而 产生 的现象。 ) : 空气人 人图 3 42 在水 面上 方观察局 到的 鱼比 鱼的 实 ee Te 际位 置要 高 63 上乳 我评价与 作业 wo 1 你是 否做 过光 从空气儿 射入 水中 的实验 ? 若没有 , 请回 家设法做 一做。 2. 生活中 有许多与 折射有 关的 现象 , 你能 举出 一些 实例吗 9 3. 一束 光从 空气儿 向射 入水 中 , 折射光线应 是图 3 一 43 中的 (。 )。 A. B. C. D. E 3 43",723,0.3446558767539072,low,ocr,"解释 活动 1 中 的 铅笔 向 上 偏 折 的 道理\nSS 了 。 自 P 点 射 向 空气 中 的 光线 在 水 面\nISSN 处 发 生 了 折射 , 眼睛 沿 着 折射 光线 看\n-0 ss 去 , 觉得 光 好 像 是 从 水 中 己 点 射出 来\nss 的 , 已 点 在 P 点 的 上 方 (图 3 一 41) 。 用 相\n同 的 方法 , 分 析 铅 笔 在 水 下 部 分 的 各\n图 3-41 “观察 水 中 的 锦 笔 点 ,最 后 得 到 的 结果 就 是 我 们 看 到 的\n情形 。\n生活 中 和 自然 中 的 折射 现象\n生活 中 , 光 的 折射 现象 随处 可 见 。 在 池塘 边 上 看 水 的 深度 ( 称 为 “ 视 深\n度 ” ) , 总 是 比 实际 的 水 要 浅 些 , 好 像 池 底 升 高 了 。 在 水 面 上 观察 到 的 鱼 的 位\n置 , 总 要 比 鱼 的 实际 位 置 高 些 (图 3 - 42) , 因而 渔民 使 用 钢 又 捕 鱼 时 , 总 是 将\n钢 又 向 看 到 的 鱼 的 下 方 投掷 。 天 文\n学 上 观察 到 的 太阳 跟 它 的 实际 位 置\n5 有 一 定 的 偏差 , 这 是 由 于 地 球 周围 大\nSS 气 层 的 密度 不 均匀 , 光线 发 生 了 折射\nss 的 缘故 。 海 市 萎 楼 也 是 由 于 空气 的\n上 分 布 不 均匀 , 从 而 导致 光线 折射 而 产\n| 生 的 现象 。\n]\n) : 空气\n人\n人 图 3-42 在 水 面 上 方 观察\n局 | AR 到 的 鱼 比 鱼 的 实\nee Te 际 位 置 要 高\n63\n=== 第 112 页 ===\n上\n乳 我 评价 与 作业 wo\n1 你 是 否 做 过 光 从 空气 儿 射 入 水 中 的 实验 ? 若 没有 , 请 回 家 设法 做 一 做 。\n2. 生活 中 有 许多 与 折射 有 关 的 现象 , 你 能 举 出 一 些 实例 吗 9\n3. 一 束 光 从 空气 儿 向 射 入 水 中 , 折射 光线 应 是 图 3 一 43 中 的 ( 。 ) 。\nA. B. C. D.\nE]3—43",2.0,75.28873239436619,沪科技粤教版_八年级_义务教育教科书·物理八年级上册,97,2025-07-21T14:25:05.892Z,2.0,义务教育教科书·物理八年级上册,/Users/LeoQin/Documents/GitHub/PDFconvertor/training_data/初中/物理/沪科技粤教版-上海科学技术出版社、广东教育出版社/八年级/义务教育教科书·物理八年级上册.pdf,八年级,tesseract.js-parallel,unknown,0.8165322580645161,0.5,1,75.28873239436619,,true,,true,true,,unknown,上册,沪科技粤教版_八年级_义务教育教科书·物理八年级上册.json,物理,142,初中_物理_沪科技粤教版_八年级_义务教育教科书·物理八年级上册
沪科技粤教版_八年级_义务教育教科书·物理八年级上册_chunk_42,42,"射角 增大 到某 一 2 、 ) 角度 ,使折射角 达到 90"" 时 ,折射光线会 完全消 I Z 1 失 , 入射 光线 全部 被反射回来 , 这种 现象叫做全 T) 1 1 反射。 图 3 一 46 1 1_ _1 Fe 奇妙的 透镜利用光 的折射可 以制 成各 种能 改变光路的 器件 , 其中 应用 最普遍的 是透镜 (lens)。 透镜 通常是 用玻璃制 成的 , 它的 两侧 或一 侧表面常 被研磨成 球面 (图 3 一 47)。 (a) 凸透镜 (b) 凹透镜图 3 47 各种 透镜透镜有 两类 , 中间 比边缘厚 的叫做凸透镜 (convex lens) , 中间比 边缘清 的叫做凹 透镜 (concave lens) 如图 3 一 48 所示 , 透镜的 中心 O 叫做 光心 , 几是 经过 这一 点的 光都 不改变传 播方向。 通过 光心 O 和球面球 心 C 的直线叫做透镜的 主光 轴。 65 y 主光 轴 7 于产 主光 轴 7 一 《一 Pr 站站 一一 T ( 下 bol _ (a) 凸透镜 (b) 凹透镜图 3 48 凸透镜和 凸透镜的 光心 和主 光轴 透镜对 光的 作用 o 活动 1 观察透镜对 光的 作用一 束平 行光 分别 照射到 凸透镜和 凹透镜上 ,观察这 两种 透镜对 光的 作用有 什么不 同 (图 3 一 49)。 (a) 凸透镜对 光的 作用 (b) 凸透镜对 光的 作用图 3 49 观察透镜对 光的 作用 1. 凸透镜对 光有 _ ( E 会聚 或发 散 ) 作用。 2. 凸透镜对 光有 _ (EE ""会聚或 发散 ) 作用。 透镜的 焦点和 焦距通过实验可 以发 现 , 平行于 主光 轴的 光 (如太阳光 ) 经凸透镜折射后 , 会聚",753,0.40340776476641543,medium-low,ocr,"射 角 增 大 到 某 一 2 、 |\n) 角度 ,使 折射 角 达 到 90"" 时 ,折射 光线 会 完全 消 I”Z\n1 失 , 入 射 光 线 全 部 被 反射 回来 , 这 种 现象 叫做 全 T) 1\n1 反射 。 图 3 一 46 1\n1_ _1\nFe\n| 奇妙 的 透镜\n利用 光 的 折射 可 以 制 成 各 种 能 改变 光路 的 器 件 , 其 中 应 用 最 普遍 的 是 透镜\n(lens) 。 透 镜 通常 是 用 玻璃 制 成 的 , 它 的 两 侧 或 一 侧 表面 常 被 研磨 成 球面 (图\n3 一 47) 。\n(a) 凸透镜 (b) 凹 透镜\n图 3-47 “各 种 透镜\n透镜 有 两 类 , 中 间 比 边缘 厚 的 叫做 凸透镜 (convex lens) , 中间 比 边缘 清 的\n叫做 凹 透镜 (concave lens) °\n如 图 3 一 48 所 示 , 透镜 的 中 心 O 叫 做 光 心 , 几 是 经 过 这 一 点 的 光 都 不 改变 传\n播 方向 。 通 过 光 心 O 和 球面 球 心 C 的 直线 叫做 透镜 的 主 光 轴 。\n65\n=== 第 114 页 ===\ny 主 光 轴 7 于 产 主 光 轴 7\n一 《一 Pr 站 站 一 一 T —— (| 下 bol _—\n(a) 凸透镜 (b) 凹 透镜\n图 3-48 ”凸透镜 和 凸透镜 的 光 心 和 主 光 轴\n透镜 对 光 的 作用\no%\n活动 1 观察 透镜 对 光 的 作用\n一 束 平 行 光 分 别 照射 到 凸透镜 和 凹 透镜 上 ,观察 这 两 种 透镜 对 光 的 作用 有\n什么 不 同 (图 3 一 49) 。\n(a) 凸透镜 对 光 的 作用 (b) 凸透镜 对 光 的 作用\n图 3--49 ”观察 透镜 对 光 的 作用\n1. 凸透镜 对 光 有 _ (%E “会 聚 ”或 “发 散 ” ) 作用 。\n2. 凸透镜 对 光 有 _ (EE ""会聚 ”或 “发 散 ” ) 作用 。\n透镜 的 焦点 和 焦距\n通过 实验 可 以 发 现 , 平行 于 主 光 轴 的 光 (如 太阳 光 ) 经 凸透镜 折射 后 , 会 聚",2.0,75.28873239436619,沪科技粤教版_八年级_义务教育教科书·物理八年级上册,99,2025-07-21T14:25:05.892Z,2.0,义务教育教科书·物理八年级上册,/Users/LeoQin/Documents/GitHub/PDFconvertor/training_data/初中/物理/沪科技粤教版-上海科学技术出版社、广东教育出版社/八年级/义务教育教科书·物理八年级上册.pdf,八年级,tesseract.js-parallel,unknown,0.7185741088180112,0.5,1,75.28873239436619,true,true,,true,,,mathematics,上册,沪科技粤教版_八年级_义务教育教科书·物理八年级上册.json,物理,142,初中_物理_沪科技粤教版_八年级_义务教育教科书·物理八年级上册
沪科技粤教版_八年级_义务教育教科书·物理八年级上册_chunk_43,43,"光的 作用 (b) 凸透镜对 光的 作用图 3 49 观察透镜对 光的 作用 1. 凸透镜对 光有 _ ( E 会聚 或发 散 ) 作用。 2. 凸透镜对 光有 _ (EE ""会聚或 发散 ) 作用。 透镜的 焦点和 焦距通过实验可 以发 现 , 平行于 主光 轴的 光 (如太阳光 ) 经凸透镜折射后 , 会聚 于主 光轴 上的 某一 点 (图 3 一 50) , 这一 点也 是光斑最 小 、 最亮 的一 点 , 叫做凸 透镜 的焦点 (focus) , 用字母巨 表示 图 3 一 51(a)。 平行 于主 光轴 的光 经凸透镜 66 折射后 将变 成发 散光线 , 将这 些发 散光线 反向 延长也 3 会相交于 主光 轴上 的一 点图 3 一 51(b)。 由于 这一。 交点 赤不 是实际光线会 聚的 点 , 因此叫做凹 透镜的 虚从 焦点到 光心 的距离叫做焦距 (focal length)， 用太 表示 ( 图 3 51)。 图 3 50 观察焦点交心焦距了 论语 .L 全 Yi 于一 从一 一中 一二 和一 一 A 虚焦 点虑 焦点 (a) 凸透镜 (b) 凸透镜图 3 51 有关 透镜 的几 个名 词 Je 机避 Dy 二 X86) 活动 2 测量凸透镜的 焦距取 两块 不同 的凸透镜 , 先后置 于光 具座 上 , 用手电简 的光 水平 照射凸透镜， 再移动光 屏找到光 的会 聚点。 为了 提高实验的 准确度 , 可进行多 次测量 ,请将 测得 的焦距数据记录在 下表 中。 1 2 3 4 B) 焦距的 平焦距 mm 焦距 Jmm f mm J f mm f mm f 7 mm 讨论 : 用这 种方法测量焦距 ,影响测量准确度 的主要因素有 哪些 ? 67",746,0.3328415563497848,low,ocr,"光 的 作用 (b) 凸透镜 对 光 的 作用\n图 3--49 ”观察 透镜 对 光 的 作用\n1. 凸透镜 对 光 有 _ (%E “会 聚 ”或 “发 散 ” ) 作用 。\n2. 凸透镜 对 光 有 _ (EE ""会聚 ”或 “发 散 ” ) 作用 。\n透镜 的 焦点 和 焦距\n通过 实验 可 以 发 现 , 平行 于 主 光 轴 的 光 (如 太阳 光 ) 经 凸透镜 折射 后 , 会 聚\n于 主 光 轴 上 的 某 一 点 (图 3 一 50) , 这 一 点 也 是 光斑 最 小 、 最 亮 的 一 点 , 叫做 凸 透\n镜 的 焦点 (focus) , 用 字母 巨 表 示 [图 3 一 51(a) ] 。 平 行 于 主 光 轴 的 光 经 凸透镜\n66\n=== 第 115 页 ===\n< 折射 后 将 变 成 发 散光 线 , 将 这 些 发 散光 线 反 向 延长 也\n3 会 相交 于 主 光 轴 上 的 一 点 [图 3 一 51(b) ] 。 由 于 这 一\n¢ 。 交 点 赤 不 是 实际 光线 会 聚 的 点 , 因此 叫做 凹 透镜 的 虚\n= =-\n从 焦点 到 光 心 的 距离 叫做 焦距 (focal length) ，\n用 太 表 示 ( 图 3-51) 。\n图 3-50 观察 焦点\n交心 | 焦距 /了 | 论语 .L\n全 - Yi\n于 一 从 一 -一 中 一\n二 和 一 一 —A 虚 焦 点\n虑 焦点\n(a) 凸透镜 (b) 凸透镜\n图 3-51 有 关 透 镜 的 几 个 名 词\nJe 机\n避 Dy\n二 X86)\n活动 2 测量 凸透镜 的 焦距\n取 两 块 不 同 的 凸透镜 , 先后 置 于 光 具 座 上 , 用 手电 简 的 光 水 平 照射 凸透镜 ，\n再 移动 光 屏 找到 光 的 会 聚 点 。 为 了 提高 实验 的 准确 度 , 可 进行 多 次 测量 ,请 将\n测 得 的 焦距 数据 记录 在 下 表 中 。\n1 | 2 3 4 B) 焦距 的 平\n焦距 mm| 焦 距 Jmm | & JE f/mm | & J f/mm | & JE f/mm | # {f 7/mm\n讨论 : 用 这 种 方法 测量 焦距 ,影响 测量 准确 度 的 主要 因素 有 哪些 ?\n67\n=== 第 116 页 ===",2.0,75.28873239436619,沪科技粤教版_八年级_义务教育教科书·物理八年级上册,100,2025-07-21T14:25:05.892Z,2.0,义务教育教科书·物理八年级上册,/Users/LeoQin/Documents/GitHub/PDFconvertor/training_data/初中/物理/沪科技粤教版-上海科学技术出版社、广东教育出版社/八年级/义务教育教科书·物理八年级上册.pdf,八年级,tesseract.js-parallel,unknown,0.725897920604915,0.7,1,75.28873239436619,true,true,,true,true,,unknown,上册,沪科技粤教版_八年级_义务教育教科书·物理八年级上册.json,物理,142,初中_物理_沪科技粤教版_八年级_义务教育教科书·物理八年级上册
沪科技粤教版_八年级_义务教育教科书·物理八年级上册_chunk_44,44,"9 _ 2) R 活动探究凸透镜成 像的 规律如 图 3 56 所示 , 在房 内面向窗 所户 而立 , 移动凸透镜或 光屏 板的 位央 w 置 ,使窗外景物在 屏上 形成一 个清晰 y 规乡 呈最 图 3 56 使景物成 像在 屏上 假设凸透镜的 焦距为 凡我 们把 本景物到 透镜光 心的 距离中 做物 距， 全和 天喇 用 x 表示 , 把像 到透镜光 心的 距离叫 人做 像距 ,用 uw 表示 , 如图 3 一 57 所示。 物呈。 fesio 那么 ,利用凸透镜能 成什么祥 的像 图 3_57 物距 、 像忠和焦 上距 呢 ?成像 情况与 哪些因素有 关呢 ? 持想 与假 放由 于窗外景物能 成像 在屏 上 , 因而猜想凸透镜总 是成 实像 , 像的 大小 及像 距 v 可能 跟物 距 、 透镜 的焦距都 会有 关系。 你还 有哪些猜想呢 ? 巡计 实验与 逢六 计世 0 BIHLBEHITiH 加本 了为 了探究各 种猜想 ,实验室 里常用光 具座 进行实验。 如图 前 N 8 3 58 所示 , 光具 座上 附有 标尺全 ee 和可 自由移动的 支架座 , 支架座 二一 上可 安装配件。 配件 有光 忆册 一 、 透镜 、 光源 (蜡烛或 发光 二极 管等 ) .请把 你的 实验探究方案写。 在右面的 方框 中。 7O 轩进 行稀 验与 履儒 让控 1. 了解 凸透镜的 焦距 _ cm。 如果 不知道焦距 ,可以 利用 3.5 节活动 2 的方法进行测量。 2. 将蜡烛 、 凸透镜和 光屏 放在 光具 座上 (图 3 一 58)。 点燃 蜡烛 ,调节凸透镜和 光屏 的高 度 , 使它们的 中心 跟烛 焰的 中心 大致 在同一高 度上。",735,0.31160848049837486,low,ocr,"9\n=== 第 118 页 ===\nRSA _\n2) R&\n活动 探究 凸透镜 成 像 的 规律\n如 图 3 -- 56 所 示 , 在 房 内 面向 窗 所\n户 而 立 , 移动 凸透镜 或 光 屏 板 的 位 央 ® w\n置 ,使 窗外 景物 在 屏 上 形成 一 个 清晰\ny NS\n@ 规 乡 呈 最 图 3-56 使 景物 成 像 在 屏 上\n假设 凸透镜 的 焦距 为 凡 我 们 把 本\n景物 到 透镜 光 心 的 距离 中 做 物 距 ， 全 和 天 | 喇\n用 x 表 示 , 把 像 到 透镜 光 心 的 距离 叫 人\n做 像 距 ,用 uw 表 示 , 如 图 3 一 57 所 示 。 物 呈 。 fesio\n那么 ,利用 凸透镜 能 成 什么 祥 的 像 图 3_57 ” 物 距 、 像 忠和 焦 上 距\n呢 ?成 像 情况 与 哪些 因素 有 关 呢 ?\n@ 持 想 与 假 放\n由 于 窗外 景物 能 成 像 在 屏 上 , 因而 猜想 凸透镜 总 是 成 实 像 , 像 的 大 小 及 像\n距 v 可 能 跟 物 距 /、 透 镜 的 焦距 /都 会 有 关系 。 你 还 有 哪些 猜想 呢 ?\n巡 计 实验 与 逢 六 计 世 |\n0 BIHLBEHITiH 加 本 了\n为 了 探究 各 种 猜想 ,实验 室 |\n里 常用 光 具 座 进行 实验 。 如 图 前 N\n8 RE\n3 -58 所 示 , 光 具 座 上 附 有 标尺 全 ee\n和 可 自由 移动 的 支架 座 , 支架 座 二 一\n上 可 安装 配件 。 配 件 有 光 忆 册 -一 、\n透镜 、 光 源 (蜡烛 或 发 光 二 极 管 | |\n等 ) .请 把 你 的 实验 探究 方案 写 。 |\n在 右面 的 方 框 中 。 \\n7O\n=== 第 119 页 ===\n轩 进 行 稀 验 与 履 儒 让 控\n1. 了 解 凸 透镜 的 焦距 /=_ cm。 如 果 不 知道 焦距 ,可 以 利用 3.5 节 活动 2\n的 方法 进行 测量 。\n2. 将 蜡烛 、 凸 透镜 和 光 屏 放 在 光 具 座 上 (图 3 一 58) 。 点 燃 蜡 烛 ,调节 凸透镜\n和 光 屏 的 高 度 , 使 它们 的 中 心 跟 烛 焰 的 中 心 大 致 在 同一 高 度 上 。",2.0,75.28873239436619,沪科技粤教版_八年级_义务教育教科书·物理八年级上册,103,2025-07-21T14:25:05.892Z,2.0,义务教育教科书·物理八年级上册,/Users/LeoQin/Documents/GitHub/PDFconvertor/training_data/初中/物理/沪科技粤教版-上海科学技术出版社、广东教育出版社/八年级/义务教育教科书·物理八年级上册.pdf,八年级,tesseract.js-parallel,unknown,0.8007662835249042,0.5,1,75.28873239436619,,true,,true,true,,unknown,上册,沪科技粤教版_八年级_义务教育教科书·物理八年级上册.json,物理,142,初中_物理_沪科技粤教版_八年级_义务教育教科书·物理八年级上册
沪科技粤教版_八年级_义务教育教科书·物理八年级上册_chunk_45,45,"你的 结论与 同学交流讨论。 71 凸透镜的 应用 一一 放大镜 一 em aisxgang 这雪 有 F24 以知道 , 当物 体位于 凸 ss 透镜焦点以 内 , 即物 距 J 更 or B 小于 焦距时 , 对着 凸透 s 贿 ms 镜观察 , 就可 以看 到物 sm bs Z We. 3 体正 立 . 放大的 虚像 , 如图 3 60 所示。 通常 选用已 二 3 6 焦距比较短 的凸透镜作 为放大镜。 之 w 站 2 油力 7 2 二图 3 60 不同放大倍数的 放大镜 及用 它观 察到 的像 二司 我评价与 作业 1. 如图 3 一 61 所示 是用 蜡烛 、 凸透镜和 光屏 研究凸透镜成 像规律的 实验装置 , 若将 2 蜡烛放 于图 中位 置 , 要在 光屏 上成 清晰的 像， 需下 要进行的 调节是 . 若想 使像 变大 ,应将 蜡烛向 移。 图 8 1 2 在探究凸透镜成 像规律的 实验中 , 当 x 三时 ,你是 怎样观察到 像的 ? 3. 取一 个盛 水的 圆柱形 玻璃杯 , 将手紧靠 在杯 的背面 , 透过 水杯 看到 的手 变大 "" 了。 请实际试 一试 ,并解释这 个现象。 4. 某同 学上 生物课时 ,用一 个焦距为 10 cm 的凸透镜作 放大 镜来 观察标本上 的细微部 分 ,如图 3 一 62 所示 , 则凸透镜与 二 ) 标本的 距离应 ( ). 73 A. 大于 20 cm B. 在 10 cm 与 20 cm 之间 C. 小于 10 cm D. 等于 10 cm 图 3_62 72 Oo 物理学 平凡进 物理 了物理学 渗透在 于现代生活的 方方面面喜爱物理物理学 伟大二 生发度 和时 间物理学 神奇 1 光度和 时间 测量 的应 物理学 揭示着",757,0.38004175385296063,low,ocr,"你 的 结论 与 同学 交流 讨论 。\n71\n=== 第 120 页 ===\n凸透镜 的 应 用 一 一 放大 镜\n一\nem\naisxgang 这 雪 有 F24\n以 知道 , 当 物 体位 于 凸 - ss <\n透镜 焦点 以 内 , 即 物 距 J— 更 or\n— «& B\n小 于 焦距 时 , 对 着 凸 透 s 贿 ms\n镜 观察 , 就 可 以 看 到 物  sm bs/Z We.  3\n体 正 立 . 放大 的 虚像 , 如 -~\n图 3 -60 所 示 。 通 常 选用 已 二 [>3 6\n焦距 比较 短 的 凸透镜 作 GPR\n为 放大 镜 。 之 —w 站\n«2% 油\n& 力 7 2 二\n图 3-60 不同 放大 倍数 的 放大 镜 及 用 它 观 察 到 的 像\n二\n司 我 评价 与 作业\n1. 如 图 3 一 61 所 示 是 用 蜡烛 、 凸 透镜 和\n光 屏 研究 凸透镜 成 像 规律 的 实验 装置 , 若 将 2\n蜡烛 放 于 图 中 位 置 , 要 在 光 屏 上 成 清晰 的 像 ， 需 下\n要 进行 的 调节 是 . 若 想 使\n像 变 大 ,应 将 蜡烛 向 移 。 图 8 1\n2 在 探究 凸透镜 成 像 规律 的 实验 中 , 当 x< 三 时 ,你 是 怎样 观察 到 像 的 ?\n3. 取 一 个 盛 水 的 圆柱 形 玻璃 杯 , 将 手紧 靠 在 杯 的 背面 , 透\n过 水 杯 看 到 的 手 “ 变 大 "" 了 。 请 实际 试 一 试 ,并 解释 这 个 现象。\n4. 某 同 学 上 生物 课时 ,用 一 个 焦距 为 10 cm 的 凸透镜 作 放\n大 镜 来 观察 标本 上 的 细微 部 分 ,如 图 3 一 62 所 示 , 则 凸透镜 与 二 )\n标本 的 距离 应 ( ). 73\nA. 大 于 20 cm B. 在 10 cm 与 20 cm 之 间\nC. 小 于 10 cm D. 等 于 10 cm 图 3_62\n72\n=== 第 121 页 ===\nOo\n物理 学 平凡\n进 物 理 了\n物理 学 渗透 在\n于 现代 生活 的 方方面面\n喜爱 物理 物理 学 伟大\n二 生发 度 和 时 间 物理 学 神奇\n1 光度 和 时 间 测 量 的 应 物理 学 揭示 着",2.0,75.28873239436619,沪科技粤教版_八年级_义务教育教科书·物理八年级上册,105,2025-07-21T14:25:05.892Z,2.0,义务教育教科书·物理八年级上册,/Users/LeoQin/Documents/GitHub/PDFconvertor/training_data/初中/物理/沪科技粤教版-上海科学技术出版社、广东教育出版社/八年级/义务教育教科书·物理八年级上册.pdf,八年级,tesseract.js-parallel,unknown,0.7410207939508506,0.6,1,75.28873239436619,,true,,true,true,,physics,上册,沪科技粤教版_八年级_义务教育教科书·物理八年级上册.json,物理,142,初中_物理_沪科技粤教版_八年级_义务教育教科书·物理八年级上册
