Chunk_ID,Chunk_Index,Content,Content_Length,Quality_Score,Reliability,Source_Type,Original_Content,Enhancement_Version,averageConfidence,book_name,chunkIndex,enhancementTimestamp,enhancementVersion,fileName,filePath,grade,ocrMethod,publisher,qualityMetrics_chineseCharRatio,qualityMetrics_coherenceScore,qualityMetrics_lengthScore,qualityMetrics_ocrConfidence,semanticFeatures_hasDefinition,semanticFeatures_hasExperiment,semanticFeatures_hasFormulas,semanticFeatures_hasNumbers,semanticFeatures_hasQuestion,semanticFeatures_isTableContent,semanticFeatures_subjectArea,semester,source_file,subject,totalPages,uniqueId
沪科技粤教版_八年级_义务教育教科书·物理八年级上册_chunk_10,10,"根据密度的 定义 , 我们 可以 得到 2 :用比值定义物 ; B B ; 理量， 是物理学 中常 ; 若用 六表 示物 体的 质量 , 7 表示物体的 体积 , P ;用的 方法， 这丘 用质 ( 读作 rou) 表示物质的 密度 , 则密度的 公式是 ; 量与 体积的 比值定义 pr ; 密度。 密度 表示 了物 ; P : 质的 一种 属性。 根据密度公式可 知 , 密度的 单位是 由质 量单位和 体积单位 ""组合 而成 的。 国际 单位制 中 , 密度的 单位是 千克米 , 读作 千克 每立方米 , 符号是 kgim 或 kg mm。 有时 也用 克厘米 ""作为密度单位 , 符号是 g cm 或 g cm。 请你 算算 看 1lkgm glem , 118 司我 评价与 作业 1. 在用 实验探究物质密度的 过程 中 , 你认为仅 收集一 组数据就 可以 了四? 为什么 ? 2. 酒精的 密度是 0.8 x 10 Kg m ,其单位读 作。 一瓶 酒精如 果倒 掉一 半 , 则剩 下酒精的 密度是。 3. 一块 体积是 0.1 mm 的金属块 , 质量是 780 kg, 那么该 金属块 的密度是 kg m , 4. 两个 实心金属球 的大 小和 质量都 相同 , Sd ESkH H, 些条 件 , 你能 否断 定另 一个 也是 铁球 ? 、 5.3 密度知识的 应用 密度的 知识在 日常生活 、 生产和 科学研究中 有着 广泛的 应用。 例如 , 人们 常常可 根据密度的 大小 来鉴别物质 ; 也可 根据产品制造的 需要 , 选用不 同密度的 材料 , 科学研究中 还能 通过测定密度的 方法发 现某 些新 的物质。 为了 应用 的方便 , 密度公式可 以进行如 下变换 p 3 m pV 于条",762,0.3771229393858865,low,ocr,"根据 密度 的 定义 , 我 们 可 以 得 到 |\n2\n:用 比值 定义 物 ;\nB B ; 理 量 ， 是 物理 学 中 常 ;\n若 用 六 表 示 物 体 的 质量 , 7 表示 物体 的 体积 , P ;用 的 方法 ， 这 丘 用 质\n( 读 作 rou) 表示 物质 的 密度 , 则 密度 的 公式 是 ; 量 与 体积 的 比值 定义\npr— ; 密度 。 密 度 表 示 了 物 ;\nP=— : 质 的 一 种 属性 。\n根据 密度 公式 可 知 , 密度 的 单位 是 由 * 质 量 单位 ”和 “体积 单位 ""组 合 而\n成 的 。 国 际 单位 制 中 , 密度 的 单位 是 千克 / 米 *, 读 作 *“ 千 克 每 立方 米 ”, 符号 是\nkgim 或 kg mm *。 有 时 也 用 克 /厘米 ""作为 密度 单位 , 符号 是 g/cm 或 g cm 。\n请 你 算 算 看 1lkgm= glem’,\n118\n=== 第 31 页 ===\n\\n司 我 评价 与 作业\n1. 在 用 实验 探究 物质 密度 的 过 程 中 , 你 认为 仅 收集 一 组 数据 就 可 以 了 四?\n为 什么 ?\n2. 酒精 的 密度 是 0.8 x 10 Kg/m ,其 单位 读 作 。 一 瓶 酒精 如 果 倒 掉\n一 半 , 则 剩 下 酒精 的 密度 是 。\n3. 一 块 体积 是 0.1 mm 的 金属 块 , 质量 是 780 kg, 那么 该 金属 块 的 密度 是\nkg/m’,\n4. 两 个 实心 金属 球 的 大 小 和 质量 都 相同 , Sd —ESkH H, ERX\n些 条 件 , 你 能 否 断 定 另 一 个 也 是 铁 球 ?\n|\n=—— 、\n5.3 密度 知识 的 应 用\n密度 的 知识 在 日 常生 活 、 生产 和 科学 研究 中 有 着 广泛 的 应 用 。\n例如 , 人 们 常常 可 根据 密度 的 大 小 来 鉴别 物质 ; 也 可 根据 产品 制造 的 需\n要 , 选用 不 同 密度 的 材料 , 科学 研究 中 还 能 通过 测定 密度 的 方法 发 现 某 些 新 的\n物质 。\n为 了 应 用 的 方便 , 密度 公式 可 以 进行 如 下 变换\np=3\nm=pV 于 条",2.0,75.28873239436619,沪科技粤教版_八年级_义务教育教科书·物理八年级上册,27,2025-07-21T14:25:05.891Z,2.0,义务教育教科书·物理八年级上册,/Users/LeoQin/Documents/GitHub/PDFconvertor/training_data/初中/物理/沪科技粤教版-上海科学技术出版社、广东教育出版社/八年级/义务教育教科书·物理八年级上册.pdf,八年级,tesseract.js-parallel,unknown,0.7509225092250923,0.5,1,75.28873239436619,true,true,,true,true,,physics,上册,沪科技粤教版_八年级_义务教育教科书·物理八年级上册.json,物理,142,初中_物理_沪科技粤教版_八年级_义务教育教科书·物理八年级上册
沪科技粤教版_八年级_义务教育教科书·物理八年级上册_chunk_11,11,"请查 表 , 并回答以 下问题。 (1) 金 、 铜 、 铁 、 冰 、 冬 、 纯水 、 氨 、 和所 的密度各 是多 少 ? (2) 金与 铜 、 冰与 水 、 氨与 氮相 比较， 哪种 物质的 密度大 ? 测量固体和 液体的 密度密度表 只列 出了 一些 常见 物质 的密度。 有时 要知道某 种物质的 密度 , 就必 须进 行测量。 根据密度公式 P 六 ,要测量某 种物质的 密度 , 就必须测 出它 的质量和 体积。 而雪 站 2) 和这 活动 2 测量固体的 密度现 有人 民币 1 元硬币 10 枚 , 假如实验室 里有 直尺 、 量简 和托盘天 平等器 材， 请你 设计一 个测定硬币密度的 方案 , 并将 你的 方案填写在 下面。 人请 根据你 的实验方案 ,实际测量一 下硬币的 密度。 你测 得的 1 元硬币的 密度 是。 121 榴人 (FA 2 活动 3 测量液体的 密度从 食用油 、 桨油 、 酒或 牛奶等 液体中 任选 一种。 设计 一个 实验方案 , 测定其 密度。 要求， (1) 列出 所需要用 的器 材。 (2) 简要写 出实验步 又。 (3) 列出 测量表达式， 并得 出结果。 例题如 图 5 11 所示 是一 枚第 25 届奥运会 的纪 一念 币 , 它的 质量为 16.1 g, 体积为 1.8 cm。 试求 这种 纪 . 念币 的密度 , 并判断它 是金币还 是铜币。 pr ) 已知 : 纪念币 的质量六 16.1 g 1.61 x 10 ke, 人纪念币 的体积六 1.8 cm 1.8x 10 m , 求 : 制成 纪念币 的金属的 密度。 、 102 图 5 11 是金币还 是铜币解 :pp 一亚 LOLXI0ke 89x10kghmm 站 14 1.8x10 Im",764,0.37952815536819523,low,ocr,"|\n请 查 表 , 并 回答 以 下 问题 。\n(1) 金 、 铜 、 铁 、 冰 、 冬 、 纯 水 、 氨 、 和 所 的 密度 各 是 多 少 ?\n(2) 金 与 铜 、 冰 与 水 、 氨 与 氮 相 比较 ， 哪 种 物质 的 密度 大 ?\n测量 固体 和 液体 的 密度\n密度 表 只 列 出 了 一 些 常 见 物 质 的 密度 。 有 时 要 知道 某 种 物质 的 密度 , 就 必\n须 进 行 测量 。 根据 密度 公式 P=- 六 ,要 测量 某 种 物质 的 密度 , 就 必须 测 出 它 的\n质量 和 体积 。\n而 雪 站\n&2) 和 这\n活动 2 测量 固体 的 密度 =-\n现 有 人 民 币 1 元 硬币 10 枚 , 假如 实验 室 里 有 直 尺 、 量 简 和 托盘 天 平等 器 材 ，\n请 你 设计 一 个 测定 硬币 密度 的 方案 , 并 将 你 的 方案 填写 在 下 面 。\n人\n|\n请 根据 你 的 实验 方案 ,实际 测量 一 下 硬币 的 密度 。 你 测 得 的 1 元 硬币 的 密\n度 是  。\n121\n=== 第 34 页 ===\n榴 人\n(FA]\n2%\n活动 3 测量 液体 的 密度\n从 食用 油 、 桨 油 、 酒 或 牛奶 等 液体 中 任 选 一 种 。 设 计 一 个 实验 方案 , 测定 其\n密度 。 要 求 ，\n(1) 列 出 所 需要 用 的 器 材 。\n(2) 简要 写 出 实验 步 又 。\n(3) 列 出 测量 表达 式 ， 并 得 出 结果 。\n例题 ”如 图 5 -11 所 示 是 一 枚 第 25 届 奥运 会 的 纪 一\n念 币 , 它 的 质量 为 16.1 g, 体积 为 1.8 cm。 试 求 这 种 纪 . \\n念 币 的 密度 , 并 判断 它 是 金币 还 是 铜币 。 pr )\n已 知 : 纪念 币 的 质量 六 = 16.1 g— 1.61 x 10* ke, 人\n纪念 币 的 体积 六 = 1.8 cm =1.8x 10 °m’,\n求 : 制 成 纪念 币 的 金属 的 密度 。\n、 102 图 5-11 是 金币 还 是 铜币\n解 :pp 一 亚 - LOLXI0ke ~ 89x10kghmm 站\n14 1.8x10 ”Im",2.0,75.28873239436619,沪科技粤教版_八年级_义务教育教科书·物理八年级上册,29,2025-07-21T14:25:05.891Z,2.0,义务教育教科书·物理八年级上册,/Users/LeoQin/Documents/GitHub/PDFconvertor/training_data/初中/物理/沪科技粤教版-上海科学技术出版社、广东教育出版社/八年级/义务教育教科书·物理八年级上册.pdf,八年级,tesseract.js-parallel,unknown,0.7027522935779816,0.6,1,75.28873239436619,,true,,true,true,,physics,上册,沪科技粤教版_八年级_义务教育教科书·物理八年级上册.json,物理,142,初中_物理_沪科技粤教版_八年级_义务教育教科书·物理八年级上册
沪科技粤教版_八年级_义务教育教科书·物理八年级上册_chunk_12,12,"量约 为 1.5 x 10?t。 区到 图 5 14 恒星爆炸 , 成为 超新 星 , 中心 残能 可能 形成 中子 星号 G onEnotEL E 1. 不用 天平 ,只用 量简 , 你能 不能 量取 100 g 的酒精 ? 2. 苏州盘 门的 钟楼里 ,有一 座唐 式铜 钟 , 其质量为 9t, 它所 用铜 的体积是 多少 ? 3 现保存在 法国 巴黎国际计量局 中的 国际千克原 器 , 是一 个底面直径为 39 mm 、 高为 39 mm 的圆柱体。 它的 密度是 多少 ? 查表 判断 一下 , 它是 用哪 种材 料制 成的 ? 123 4. 某同学在 测量石 块的 密度时 , 先用 天和 平测量石 块的 质量。 天平平衡 时 , 4 内奈 码的 质量及 游码 所在 的位 置如 图 5 一 13(a) 所示 , 石块 的质量为 g;, 再用 量简 测石 块的 体积 ,如图 5 一 15(b) 所示 , 石块 的体积为 cm, 最后 可得 石块 的密度为 kgm。 全全 50g 20g 10g 于和 1 王国一 一了 (a) (b) 图 5 一 15 5. 如图 5 一 16 所示 , 三个 形状相同的 烧杯 , 分别 盛有 质量相等的 水 、 酒精 和硫酸。 根据 图中 液面 的高 度并 查密度表 ,可知 4 杯盛 的是 ,她杯 盛的 是，,C 杯盛 的是。 图 5 16 5.4 认识物质的 一些 物理属性我 们已 经知道密度是 物质的 一种 属性 , 而物质的 属性是 多种 多样 的。 如有 的物质有 磁性 , 有的 物质能 导电 , 有的 物质有 弹性在 本节 中 , 我们 将要 进一步认识物质的 一些 物理属性。 物质的 磁性人 们认识物质磁性的 历史非常悠久 , 早在 2 000 多年 前的 春秋时 期 , 人们 124",780,0.4185836721112012,medium-low,ocr,"量 约 为 1.5 x 10?t。 区 ”到\n图 5-14 ”恒星 爆炸 , 成 为 超 新\n星 , 中 心 残 能 可 能 形\n成 中 子 星\n号\nG onEnotEL E\n1. 不 用 天 平 ,只 用 量 简 , 你 能 不 能 量 取 100 g 的 酒精 ?\n2. 苏州 盘 门 的 钟楼 里 ,有 一 座 唐 式 铜 钟 , 其 质量 为 9t, 它 所 用 铜 的 体积 是\n多 少 ?\n3 现 保存 在 法 国 巴黎 国际 计量 局 中 的 国际 千克 原 器 , 是 一 个 底面 直径 为\n39 mm 、 高 为 39 mm 的 圆柱 体 。 它 的 密度 是 多 少 ? 查 表 判 断 一 下 , 它 是 用 哪 种 材\n料 制 成 的 ?\n123\n=== 第 37 页 ===\n4. 某 同学 在 测量 石 块 的 密度 时 , 先 用 天 和 平 测量 石 块 的 质量 。 天 平平 衡 时 , £4\n内 奈 码 的 质量 及 游 码 所 在 的 位 置 如 图 5 一 13(a) 所 示 , 石 块 的 质量 为 g;, 再\n用 量 简 测 石 块 的 体积 ,如 图 5 一 15(b) 所 示 , 石 块 的 体积 为 cm, 最 后 可 得 石\n块 的 密度 为 “kgm 。\n全 全\n50g 20g 10g | | 于 |\n和 1 王国\n一 一\n— 了\n(a) (b)\n图 5 一 15\n5. 如 图 5 一 16 所 示 , 三 个 形状 相同 的 烧杯 , 分\n别 盛 有 质量 相等 的 水 、 酒 精 和 硫酸 。 根 据 图 中 液 面\n的 高 度 并 查 密度 表 ,可知 4 杯 盛 的 是 ,她 杯 盛\n的 是 ，,C 杯 盛 的 是 。 图 5--16\n——\n5.4 认识 物质 的 一 些 物理 属性\n我 们 已 经 知道 密度 是 物质 的 一 种 属性 , 而 物质 的 属性 是 多 种 多 样 的 。 如 有\n的 物质 有 磁性 , 有 的 物质 能 导电 , 有 的 物质 有 弹性 ……\n在 本 节 中 , 我 们 将 要 进一步 认识 物质 的 一 些 物理 属性 。\n物质 的 磁性 |\n人 们 认识 物质 磁性 的 历史 非常 悠久 , 早 在 2 000 多 年 前 的 春秋 时 期 , 人 们\n124",2.0,75.28873239436619,沪科技粤教版_八年级_义务教育教科书·物理八年级上册,32,2025-07-21T14:25:05.891Z,2.0,义务教育教科书·物理八年级上册,/Users/LeoQin/Documents/GitHub/PDFconvertor/training_data/初中/物理/沪科技粤教版-上海科学技术出版社、广东教育出版社/八年级/义务教育教科书·物理八年级上册.pdf,八年级,tesseract.js-parallel,unknown,0.7330895795246801,0.5,1,75.28873239436619,,,,true,true,,physics,上册,沪科技粤教版_八年级_义务教育教科书·物理八年级上册.json,物理,142,初中_物理_沪科技粤教版_八年级_义务教育教科书·物理八年级上册
沪科技粤教版_八年级_义务教育教科书·物理八年级上册_chunk_13,13,"密度是 物质的 一种 属性 , 而物质的 属性是 多种 多样 的。 如有 的物质有 磁性 , 有的 物质能 导电 , 有的 物质有 弹性在 本节 中 , 我们 将要 进一步认识物质的 一些 物理属性。 物质的 磁性人 们认识物质磁性的 历史非常悠久 , 早在 2 000 多年 前的 春秋时 期 , 人们 124 就认识了 磁石。 我国 古代 利用 磁石的 指向性 发明了指南针 ( 图 3 一 17)。 指南 针为 什么能 指示南北方向呢 ? 因为地 球就 是个 大磁体。 你能 根据图 5 一 18 解释 指南针 能指示方向的 原因吗 ? 图 5 17 古代的 指南针 一一 司南 图 5 18 地球 是一 个大 磁体磁性是 某些 物质 的重要属性。 物质 的磁性应 用非常广泛 , 根据磁性研制的 许多新 颖的 磁性材料 , 广泛地 应用 在生活和 科研中 , 图 5 19 所示 的就 是磁性应 用的 事例。 区 sc 全一 3 习 y a z 二四 ez P7, 一人 (硬盘 ) (a) 磁带能 将声音和 图像 记录 (b) 磁盘可 以贮存许多信息 (c) 磁卡已 广泛应 用于 生活中 并保存下 来图 5 19 磁性材料的 应用 对于 物质磁性的 应用 , 你还 知道多 少 ? 请把 你知道的 填写在 下面 , 并与 同学们 交流。 7 J _ _ _ ,,, 125 导电性 和导热性 也是 物质的 两种 基本属性 , 跟人 们的 生活密切相关。 物质的 导电性 f9GY 区这 活动 1 比较物质的 导电性 能我 们在 小学 《科学 》 中知道 , 用铜 、 铝等 金属做 成的 导线是 能导电的。 干燥 的木",715,0.40345188138833,medium-low,ocr,"密度 是 物质 的 一 种 属性 , 而 物质 的 属性 是 多 种 多 样 的 。 如 有\n的 物质 有 磁性 , 有 的 物质 能 导电 , 有 的 物质 有 弹性 ……\n在 本 节 中 , 我 们 将 要 进一步 认识 物质 的 一 些 物理 属性 。\n物质 的 磁性 |\n人 们 认识 物质 磁性 的 历史 非常 悠久 , 早 在 2 000 多 年 前 的 春秋 时 期 , 人 们\n124\n=== 第 38 页 ===\n就 认识 了 磁石 。 我 国 古 代 利 用 磁石 的 指向 性 发 明了 指南 针 ( 图 3 一 17) 。 指 南 针\n为 什么 能 指示 南北 方向 呢 ? 因为 地 球 就 是 个 大 磁体 。\n你 能 根据 图 5 一 18 解 释 指南 针 能 指示 方向 的 原因 吗 ?\n[]\n图 5-17 古代 的 指南 针 一 一 司 南 图 5--18 ”地 球 是 一 个 大 磁体\n磁性 是 某 些 物 质 的 重要 属性 。 物 质 的 磁性 应 用 非常 广泛 , 根据 磁性 研制 的\n许多 新 颖 的 磁性 材料 , 广泛 地 应 用 在 生活 和 科研 中 , 图 5 — 19 所 示 的 就 是 磁性 应\n用 的 事例 。\n<\n区 sc ® |\n全 >” 一\n3 习 y a | £ & \ z 二 四\nez $P7,\n一\n人 ¥ (硬盘 )\n(a) 磁带 能 将 声音 和 图 像 记 录 (b) 磁盘 可 以 贮存 许多 信息 (c) 磁卡 已 广泛 应 用 于 生活 中\n并 保存 下 来\n图 5-19 ”磁性 材料 的 应 用\n对 于 物质 磁性 的 应 用 , 你 还 知道 多 少 ? 请 把 你 知道 的 填写 在 下 面 , 并 与 同学\n们 交流 。\n7\n[ |\n| J\n~_ _ _ ,,,——\n125\n=== 第 39 页 ===\n导电 性 和 导热 性 也 是 物质 的 两 种 基本 属性 , 跟 人 们 的 生活 密切 相关 。\n物质 的 导电 性\nf9GY\n区 这\n活动 1 比较 物质 的 导电 性 能\n我 们 在 小 学 《科学 》 中 知道 , 用 铜 、 铝 等 金属 做 成 的 导线 是 能 导电 的 。 干 燥 的 木",2.0,75.28873239436619,沪科技粤教版_八年级_义务教育教科书·物理八年级上册,33,2025-07-21T14:25:05.891Z,2.0,义务教育教科书·物理八年级上册,/Users/LeoQin/Documents/GitHub/PDFconvertor/training_data/初中/物理/沪科技粤教版-上海科学技术出版社、广东教育出版社/八年级/义务教育教科书·物理八年级上册.pdf,八年级,tesseract.js-parallel,unknown,0.8160469667318982,0.6,1,75.28873239436619,,,,true,true,,physics,上册,沪科技粤教版_八年级_义务教育教科书·物理八年级上册.json,物理,142,初中_物理_沪科技粤教版_八年级_义务教育教科书·物理八年级上册
沪科技粤教版_八年级_义务教育教科书·物理八年级上册_chunk_14,14,"流。 7 J _ _ _ ,,, 125 导电性 和导热性 也是 物质的 两种 基本属性 , 跟人 们的 生活密切相关。 物质的 导电性 f9GY 区这 活动 1 比较物质的 导电性 能我 们在 小学 《科学 》 中知道 , 用铜 、 铝等 金属做 成的 导线是 能导电的。 干燥 的木 材 、 至璃 . 塑料 、 橡胶 等是 不导电的。 那么 ,液体是 否能 导电呢 ? 下面 我们 用实验来 进行研究。 参照图 5 一 20 所示 的装置 ,用导线把 电池 、 可四 灯泡和 4、B 两块 铜片 连接起 来。 将钢 片分 别播 让入 糖水 、 盐水 和纯净水 中 , 通过观察小 灯泡的 发 cd 光情 况 , 比较三 种液体的 导电性 能 ,将实验结果证 贵写 在下 面的 空格中。 容易导电的 有， 不容易导电的 有， 图 5 20 液体导电物理学 中 , 把容易导电的 物体叫做导体国宝攻 二天 汪 (conducton , 把不 容易导电的 物体叫做绝 Tibemmeir 缘体 (insulator)。 il 时在 工业生产中 , 液体的 导电性 常被 用于 电镀 (图 5 一 21) . 电解、 制药等 方面。 你还 知道哪些导体和 绝缘体 ? 填写在 下面 的表格中 , 并说 出它们的 一个 应用 实例。 图 5 21 电镀车 间的 一角 126 物质的 导热性 价页 克 E 活动 2 比较木 盒和 不锈 钢汤匙的 导热性 能一 请参照图 5 一 22, 将一 双木 俩和 一二 把不 锈钢 汤师 一起 浸在 热水 中 ,数秒上 后 ,两只 手摸 到谷子和 汤匙的 冷热 感觉 有什么不 同 ? 为什么? 3 图 5 一 22 比较导热性 能",733,0.3546870642682716,low,ocr,"流 。\n7\n[ |\n| J\n~_ _ _ ,,,——\n125\n=== 第 39 页 ===\n导电 性 和 导热 性 也 是 物质 的 两 种 基本 属性 , 跟 人 们 的 生活 密切 相关 。\n物质 的 导电 性\nf9GY\n区 这\n活动 1 比较 物质 的 导电 性 能\n我 们 在 小 学 《科学 》 中 知道 , 用 铜 、 铝 等 金属 做 成 的 导线 是 能 导电 的 。 干 燥 的 木\n材 、 至 璃 . 塑料 、 橡 胶 等 是 不 导电 的 。 那 么 ,液体 是 否 能 导电 呢 ?\n下 面 我 们 用 实验 来 进行 研究 。\n参照 图 5 一 20 所 示 的 装置 ,用 导线 把 电池 、 可 四\n灯泡 和 4、B 两 块 铜 片 连接 起 来 。 将 钢 片 分 别 播 让 EN\n入 糖水 、 盐 水 和 纯净 水 中 , 通过 观察 小 灯泡 的 发 cd\n光 情 况 , 比较 三 种 液体 的 导电 性 能 ,将 实验 结果 证/\n贵 写 在 下 面 的 空格 中 。\n容易 导电 的 有 ，\n不 容易 导电 的 有  ， 图 5--20 ”液体 导电\n物理 学 中 , 把 容易 导电 的 物体 叫做 导体 国宝 攻 二 天 汪\n(conducton , 把 不 容易 导电 的 物体 叫做 绝  Tibemmeir\n缘 体 (insulator) 。 - = | il 时\n在 工业 生产 中 , 液体 的 导电 性 常 被 用 于 电  HMEEE\n镀 (图 5 一 21) . 电解、 制药 等 方面 。\n你 还 知道 哪些 导体 和 绝缘 体 ? 填写 在 下 面 =—\n的 表格 中 , 并 说 出 它们 的 一 个 应 用 实例 。 图 5-21 电镀 车 间 的 一 角\n126\n=== 第 40 页 ===\n物质 的 导热 性\n价 页\n克 %E\n活动 2 比较 木 盒 和 不 锈 钢 汤匙 的 导热 性 能 一\n请 参照 图 5 一 22, 将 一 双 木 俩 和 一 二\n把 不 锈 钢 汤 师 一 起 浸 在 热 水 中 ,数秒 上\n后 ,两 只 手 摸 到 谷子 和 汤匙 的 冷 热 感 «\n觉 有 什么 不 同 ? 为什么? 3\n图 5 一 22 比较 导热 性 能",2.0,75.28873239436619,沪科技粤教版_八年级_义务教育教科书·物理八年级上册,34,2025-07-21T14:25:05.891Z,2.0,义务教育教科书·物理八年级上册,/Users/LeoQin/Documents/GitHub/PDFconvertor/training_data/初中/物理/沪科技粤教版-上海科学技术出版社、广东教育出版社/八年级/义务教育教科书·物理八年级上册.pdf,八年级,tesseract.js-parallel,unknown,0.7737642585551331,0.5,1,75.28873239436619,true,true,,true,true,,physics,上册,沪科技粤教版_八年级_义务教育教科书·物理八年级上册.json,物理,142,初中_物理_沪科技粤教版_八年级_义务教育教科书·物理八年级上册
