Chunk_ID,Chunk_Index,Content,Content_Length,Quality_Score,Reliability,Source_Type,Original_Content,Enhancement_Version,averageConfidence,book_name,chunkIndex,enhancementTimestamp,enhancementVersion,fileName,filePath,grade,ocrMethod,publisher,qualityMetrics_chineseCharRatio,qualityMetrics_coherenceScore,qualityMetrics_lengthScore,qualityMetrics_ocrConfidence,semanticFeatures_hasDefinition,semanticFeatures_hasExperiment,semanticFeatures_hasFormulas,semanticFeatures_hasNumbers,semanticFeatures_hasQuestion,semanticFeatures_isTableContent,semanticFeatures_subjectArea,semester,source_file,subject,totalPages,uniqueId
沪科技粤教版_八年级_义务教育教科书·物理八年级下册_chunk_31,31,的变化其 运动情况。 由于 受到重力的 作用， 小球 在空中的 运动路 径 ( 图 7 一 43) 是怎样的 ? 全一 和它 的运动状态是 否改 变 ? se Ye 图 7 43， 抛体 运动状态的 改变 58 活动 3 中的 事例表明， 物体 受非 平衡力作用 时， 其运动状态是 变化的。 有的 由静 变动， 有的 由动 变静， 有的 由慢 变快， 有的 由快 变慢， 还有 的改变运动方向做 曲线运动。 你能 否再 举一 些事例说 明物 体受 非平衡力作用 时运动状态发 生了 变化 ? 3 1. 讨论下 面的 问题， 并发 表你 的观点。 (1) 匀速行驶的 汽车， 关闭 发动机后 在水 平公路 上减速行驶。 有人 说， 这时 汽车在 水平方向 上是 不受 力的。 他的 说法 对吗 9 为什么 9 (2) 神舟系列飞船降落到 地面前， 为什么要 打开一 个巨大的 降落伞 9 2. 重为 3 N 的苹果静止在 水平 桌面 上， 图 7 一 44 中能 正确表示蔷 果受 力的 图是 ( )。 3N 3N 3N 3N 3N 3N A. B. C. D. 图 7 44 3. 电灯通过电线挂 在天 花板 上， 与电灯受到的 重力相互平衡的 力是 (。 )。 A. 电灯对 电线的 拉力 B. 电线对 电灯的 拉力 C. 电线对 天花 板的 拉力 D. 天花 板对 电线的 拉力 4. 一物体受 拉力作用以 0.1 m s 的速度在 水平 桌面上 做匀速直线运动， 此时 它受 到的 摩擦力 是 10 N， 若速度增加到 0.5 ms 后， 物体 仍在 水平 桌面 上做 多速 直线运动， 则此 时它 受到 的水 平拉力大 小是 多少 ?9 受到的 摩擦力 多大 ? 为什 么 ?9 (不计 空气胃 力 ),756,0.4946840386303774,medium-low,ocr,的 变化\n其 运动 情况 。 由 于 受到 重力 的 作用 ， 小 球\n在 空中 的 运动 路 径 ( 图 7 一 43) 是 怎样 的 ? 全 一 和-\n它 的 运动 状态 是 否 改 变 ? se Ye\n图 7-43， 抛 体 运动 状态 的 改变\n58\n=== 第 96 页 ===\n活动 3 中 的 事例 表明 ， 物 体 受 非 平衡 力作 用 时 ， 其 运动 状态 是 变化 的 。 有\n的 由 静 变动 ， 有 的 由 动 变 静 ， 有 的 由 慢 变 快 ， 有 的 由 快 变 慢 ， 还 有 的 改变 运动\n方向 做 曲线 运动 。\n你 能 否 再 举 一 些 事例 说 明 物 体 受 非 平衡 力作 用 时 运动 状态 发 生 了 变化 ?\n3\n1. 讨论 下 面 的 问题 ， 并 发 表 你 的 观点 。\n(1) 匀速 行驶 的 汽车 ， 关 闭 发 动机 后 在 水 平公 路 上 减速 行驶 。 有 人 说 ，\n这 时 汽车 在 水 平方 向 上 是 不 受 力 的 。 他 的 说 法 对 吗 9 为 什么 9\n(2) “神舟 ”系列 飞船 降落 到 地 面前 ， 为 什么 要 打开 一 个 巨大 的 降落 伞 9\n2. 重 为 3 N 的 苹果 静止 在 水 平 桌 面 上 ， 图 7 一 44 中 能 正确 表示 蔷 果 受 力 的\n图 是 (  ) 。\n3N 3N 3N\n3N 3N\n3N\nA. B. C. D.\n图 7-44\n3. 电灯 通过 电线 挂 在 天 花 板 上 ， 与 电灯 受到 的 重力 相互 平衡 的 力 是 ( 。 ) 。\nA. 电灯 对 电线 的 拉力 B. 电线 对 电灯 的 拉力\nC. 电线 对 天 花 板 的 拉力 D. 天 花 板 对 电线 的 拉力\n4. 一 物体 受 拉力 作用 以 0.1 m/s 的 速度 在 水 平 桌面 上 做 匀速 直线 运动 ， 此\n时 它 受 到 的 摩擦 力 是 10 N， 若 速度 增加 到 0.5 ms 后 ， 物 体 仍 在 水 平 桌 面 上 做 多\n速 直线 运动 ， 则 此 时 它 受 到 的 水 平 拉力 大 小 是 多 少 ?9 受到 的 摩擦 力 多 大 ? 为 什\n么 ?9 (不 计 空气 胃 力 ),2.0,75.8955223880597,沪科技粤教版_八年级_义务教育教科书·物理八年级下册,83,2025-07-21T14:25:05.847Z,2.0,义务教育教科书·物理八年级下册,/Users/LeoQin/Documents/GitHub/PDFconvertor/training_data/初中/物理/沪科技粤教版-上海科学技术出版社、广东教育出版社/八年级/义务教育教科书·物理八年级下册.pdf,八年级,tesseract.js-parallel,unknown,0.7743119266055046,0.6,1,75.8955223880597,,,,true,true,,physics,下册,沪科技粤教版_八年级_义务教育教科书·物理八年级下册.json,物理,134,初中_物理_沪科技粤教版_八年级_义务教育教科书·物理八年级下册
沪科技粤教版_八年级_义务教育教科书·物理八年级下册_chunk_32,32,物体受 拉力作用以 0.1 m s 的速度在 水平 桌面上 做匀速直线运动， 此时 它受 到的 摩擦力 是 10 N， 若速度增加到 0.5 ms 后， 物体 仍在 水平 桌面 上做 多速 直线运动， 则此 时它 受到 的水 平拉力大 小是 多少 ?9 受到的 摩擦力 多大 ? 为什 么 ?9 (不计 空气胃 力 ) 5. 如图 7 一 45 所示， 小车 在斜面上 由静止开始加 速下 滑， 是由 于它 受到力 的作 用， 在水 平面上 运动一 段距离后 停下 来， 是由 于它 受到力 的作用。 归纳 起来， 说明 力的 作用可 以改变物体的 . 图 7 45 59 6. 关于力 、 运动 和力 的关系， 下列 说法 正确的 是 ( )。 A. 受力 物体一 定不 是施 力物 体 B. 相互不 接触的 物体之 间， 一定 没有力 的作用 C. 物体受到力 的作用， 和运动状态一 定会 改变 D. 物体的 运动状态改变， 一定 是受到了 力的 作用你 能说 说作出上 述选 择的 理由吗 ? 一课外活动一 战重心 1 利用二 力平 衡知 识， 可以 很方便地 1 找出 薄板状 物体的 重心位 置。 实验方法如 下 : 1， 取一 块形 状不 规则的 薄硬 纸板， 用 1 1 细线 把它 悬挂 起来， 并在 纸板上 沿悬 线 1 1 方向画 一直线图 7 一 46(a)。 再在 纸 1 板上 这一 条直线以 外的 另一 位置 用细 线 4 把它 蛙起 来， 并沿 细线 方向再 画一 直 (a) 1 ) 线图 7 一 46(b )。 纸板 上所 画的 两条 图 7 46 确定薄板重心 1 1 直线的 交点 O， 就是 纸板的 重心。 1,726,0.4848525530243518,medium-low,ocr,物体 受 拉力 作用 以 0.1 m/s 的 速度 在 水 平 桌面 上 做 匀速 直线 运动 ， 此\n时 它 受 到 的 摩擦 力 是 10 N， 若 速度 增加 到 0.5 ms 后 ， 物 体 仍 在 水 平 桌 面 上 做 多\n速 直线 运动 ， 则 此 时 它 受 到 的 水 平 拉力 大 小 是 多 少 ?9 受到 的 摩擦 力 多 大 ? 为 什\n么 ?9 (不 计 空气 胃 力 )\n5. 如 图 7 一 45 所 示 ， 小 车 在 斜面 上 由 静止\n开始 加 速 下 滑 ， 是 由 于 它 受到 力 的 作\n用 ， 在 水 平面 上 运动 一 段 距离 后 停 下 来 ， 是\n由 于 它 受到 力 的 作用 。 归 纳 起 来 ， 说\n明 力 的 作用 可 以 改变 物体 的 . 图 7-45\n59\n=== 第 97 页 ===\n6. 关于 力 、 运 动 和 力 的 关系 ， 下 列 说 法 正确 的 是 (  ) 。\nA. 受 力 物体 一 定 不 是 施 力 物 体\nB. 相互 不 接触 的 物体 之 间 ， 一 定 没有 力 的 作用\nC. 物体 受到 力 的 作用 ， 和 运动 状态 一 定 会 改变\nD. 物体 的 运动 状态 改变 ， 一 定 是 受到 了 力 的 作用\n你 能 说 说 作出 上 述 选 择 的 理由 吗 ?\n一 课外 活动 -一\n战 重心\n1 利用 二 力 平 衡 知 识 ， 可 以 很 方便 地 1\n| 找 出 薄板 状 物体 的 重心 位 置 。\n| 实验 方法 如 下 :\n1 ， 取 一 块 形 状 不 规则 的 薄 硬 纸板 ， 用 1\n1 细 线 把 它 悬 挂 起 来 ， 并 在 纸板 上 沿 悬 线 1\n1 方向 画 一 直线 [图 7 一 46(a)] 。 再 在 纸 1\n板 上 这 一 条 直线 以 外 的 另 一 位 置 用 细 线 4\n| 把 它 蛙 起 来 ， 并 沿 细 线 方向 再 画 一 直 (a) 1\n) 线 [ 图 7 一 46(b ) ] 。 纸 板 上 所 画 的 两 条 图 7-46 “确定 薄板 重心 1\n1 直线 的 交点 O， 就 是 纸板 的 重心 。 1,2.0,75.8955223880597,沪科技粤教版_八年级_义务教育教科书·物理八年级下册,84,2025-07-21T14:25:05.847Z,2.0,义务教育教科书·物理八年级下册,/Users/LeoQin/Documents/GitHub/PDFconvertor/training_data/初中/物理/沪科技粤教版-上海科学技术出版社、广东教育出版社/八年级/义务教育教科书·物理八年级下册.pdf,八年级,tesseract.js-parallel,unknown,0.796078431372549,0.5,1,75.8955223880597,,true,,true,true,,physics,下册,沪科技粤教版_八年级_义务教育教科书·物理八年级下册.json,物理,134,初中_物理_沪科技粤教版_八年级_义务教育教科书·物理八年级下册
沪科技粤教版_八年级_义务教育教科书·物理八年级下册_chunk_33,33,"发生 形变。 探究压力的 作用效果在 生活和 生产中， 人们 有时 希望物体在 压力的 作用下 能发 生较 大的 形变， 有时 又希望形变小 一些。 上述 大型 载重卡车安装了 许多车 轮， 就不 易压 坏路 面 ;图钉的 一端 做得 很从， 就容易能 和物体。 那么， 压力 的作用效果到 底跟 哪些 因素有 关 ? 和活动 1 探究压力的 作用效果一 根据上 述事例， 有的 同学猜想， 压力 的作用效果跟 压力 的大 小有 关， 也有 的同学猜想， 跟受 力面积的 大小 有关。 你认为他 们的 猜想有 道理吗 ? Q ITELESHITiT4 为了 用实验验证这 些猜 ,age 想， 设计 实验 的思路是 : 先保 2 持受 力面积不 变， 改变 压力 大 ; 网 : 小， 观察 压力作用效果， 再保 物理学 中用 实验研究三 个量 (压力等 压力大 小不 变。 改变 受力 面 ; 作用效果 、 压力 大小 、 受力 面积 ) 之间 的积 大小， 观察 压力 作用效果 : 关系时， 常用 的方法是 : 先使 一个 量 ( 压 : 图 8 二 3 是可 供实验选用的 力 ) 保持不 变， 研究 其余 两个 量 (效果 、 器村， 同学 们提出了 三种 组合 方面积 ) 的关系 ; 再使 另一 个量 (面积 ) 保案， 可供 选反 ; 持不 变， 研究 其余 两个 量 ( 效果、 压 (1) 小方 昌模 型， 太类 力 ) 的关系 ; 最后 即可 得到 三个 量之 间的 关系。 这种 方法叫做控制变量法。 63 (2) 小方 桌模型 、 砖块 、 海绵 块。 (3) 海绵块 、 钩码 、 细线 、 弹筑 测力 计。 你的 方案是 什么 ? 请相互交流。 了 GE 小方 桌模型细 沙砖 块",755,0.41076726594301216,medium-low,ocr,"发 生 形变 。\n探究 压力 的 作用 效果 |\n在 生活 和 生产 中 ， 人 们 有 时 希望 物体 在 压力 的 作用 下 能 发 生 较 大 的 形变 ，\n有 时 又 希望 形变 小 一 些 。 上 述 大 型 载重 卡车 安装 了 许多 车 轮 ， 就 不 易 压 坏 路\n面 ;图钉 的 一 端 做 得 很 从， 就 容易 能 和 物体。 那么 ， 压 力 的 作用 效果 到 底 跟 哪\n些 因素 有 关 ?\n和\n活动 1 ”探究 压力 的 作用 效果 一\n根据 上 述 事例 ， 有 的 同学 猜想 ， 压 力 的 作用 效果 跟 压 力 的 大 小 有 关 ， 也\n有 的 同学 猜想 ， 跟 受 力 面积 的 大 小 有 关 。 你 认为 他 们 的 猜想 有 道理 吗 ?\nQ ’ITELESHITiT4/\n为 了 用 实验 验证 这 些 猜 ,age —\n想 ， 设 计 实 验 的 思路 是 : 先 保 2\n持 受 力 面积 不 变 ， 改 变 压 力 大 ; 网 :\n小 ， 观 察 压力 作用 效果 ， 再 保 物理 学 中 用 实验 研究 三 个 量 (压力\n等 压力 大 小 不 变 。 改 变 受 力 面 ; 作用 效果 、 压 力 大 小 、 受 力 面 积 ) 之 间 的\n积 大 小 ， 观 察 压 力 作用 效果 : 关系 时 ， 常 用 的 方法 是 : 先 使 一 个 量 ( 压 :\n图 8 二 3 是 可 供 实验 选用 的 | 力 ) 保持 不 变 ， 研 究 其 余 两 个 量 (效果 、\n器 村 ， 同 学 们 提出 了 三 种 组 合 方 面积 ) 的 关系 ; 再 使 另 一 个 量 (面积 ) 保\n案 ， 可 供 选 反 ; 持 不 变 ， 研 究 其 余 两 个 量 ( 效果、 压 |\n(1) 小 方 昌 模 型 ， 太 类 | 力 ) 的 关系 ; 最 后 即 可 得 到 三 个 量 之 间 的 |\n- ” ”关系 。 这 种 方法 叫做 控制 变量 法 。\n63\n=== 第 101 页 ===\n(2) 小 方 桌 模型 、 砖 块 、 海 绵 块 。\n(3) 海绵 块 、 钩 码 、 细 线 、 弹 筑 测 力 计 。\n你 的 方案 是 什么 ? 请 相互 交流 。\n了\nFT GE\n小 方 桌 模型 细 沙 砖 块",2.0,75.8955223880597,沪科技粤教版_八年级_义务教育教科书·物理八年级下册,87,2025-07-21T14:25:05.847Z,2.0,义务教育教科书·物理八年级下册,/Users/LeoQin/Documents/GitHub/PDFconvertor/training_data/初中/物理/沪科技粤教版-上海科学技术出版社、广东教育出版社/八年级/义务教育教科书·物理八年级下册.pdf,八年级,tesseract.js-parallel,unknown,0.8190298507462687,0.5,1,75.8955223880597,true,true,,true,true,,physics,下册,沪科技粤教版_八年级_义务教育教科书·物理八年级下册.json,物理,134,初中_物理_沪科技粤教版_八年级_义务教育教科书·物理八年级下册
沪科技粤教版_八年级_义务教育教科书·物理八年级下册_chunk_34,34,"aa 部产生压强， 对容器侧 壁也 会硬 ss 产生压强。 图 8 一 15 中的 实验直 4 观地 显示出 液体压强的 这个 特日 :人点。 有那么， 液体内部 是否 有压 人强 ? 液体压强的 大小 与什么因 (a) () 素有 关呢 ? 图 8 15 液体对 容器的 底部和 侧壁 都产生压强为 了进一步揭示液体压强的 特点， 需要 用压强计 对液体压强进行研究。 如图 8 一 16 (a ) 所示 为一 个简易 U 形压强计。 在 U 形玻璃管内盛 了有 颜色的 水 ,玻璃管 的两 端开 口， 其中 一端 用橡皮管 连接一 个开 有小 孔的 金属会， 金属盒 上蒙 有一 层橡皮膜。 未对 橡皮膜 加压 时，U 形管 两侧 的水 面在 同一高 度上。 用力 压橡皮膜 时， 跟盒 相连的 一侧 管中 气体 压强 变大 ,水面 就下 降， 另一 侧水 面上 升。 加在 橡皮膜 上的 压强越 大，U 形管 两侧 水面 的高 度差 就越 大图 8 一 16(b)。 ak ahb E H : 上 A E : a (a) (b) 图 8 16 简易 U 形压强计 把压强计 的金属盒 放入 水中 时， 根据 U 形管 两侧 水面 的高 度差 就可 以知道橡皮膜 受到 水的 压强的 大小 了。 71 Var 2) X8 活动 2 探究液体内 部的 压强请 利用 U 形压强计， 研究 图 8 一 17 中两 种 、 液体内 部压强的 大小 跟哪 些因素有 关。 一 (1) 将压强计 的金属使 依次 放入 水中 的国人人 不同 深度处 (如 5 cm、10 cm )， 研究 流体 于 E Sm 强跟 深度有 什么关系。 Sa s (2) 保持金属使 在水 中的 深度不 变 ( 如",744,0.4639236658434445,medium-low,ocr,"aa\n部 产生 压强 ， 对 容器 侧 壁 也 会 | 硬 ss\n产生 压强 。 图 8 一 15 中 的 实验 直 | 4\n观 地 显示 出 液体 压强 的 这 个 特 日 :人\n点 。 | 有 »\n那么 ， 液 体内 部 是 否 有 压 人 &\n强 ? 液体 压强 的 大 小 与 什么 因 (a) ()\n素 有 关 呢 ? 图 8-15 “液体 对 容器 的 底部 和 侧 壁 都 产生 压强\n为 了 进一步 揭示 液体 压强\n的 特点 ， 需 要 用 压强 计 对 液体 压强 进行 研究 。\n如 图 8 一 16 (a ) 所 示 为 一 个 简易 U 形 压强 计 。 在 U 形 玻璃 管内 盛 了 有 颜色 的\n水 ,玻璃 管 的 两 端 开 口 ， 其 中 一 端 用 橡皮 管 连接 一 个 开 有 小 孔 的 金属 会， 金属\n盒 上 蒙 有 一 层 橡皮 膜 。 未 对 橡皮 膜 加 压 时 ，U 形 管 两 侧 的 水 面 在 同一 高 度 上 。\n用 力 压 橡皮 膜 时 ， 跟 盒 相连 的 一 侧 管 中 气 体 压 强 变 大 ,水 面 就 下 降 ， 另 一 侧\n水 面 上 升 。 加 在 橡皮 膜 上 的 压强 越 大 ，U 形 管 两 侧 水 面 的 高 度 差 就 越 大 [ 图 8 一\n16(b)]。\nak ahb\nE H\n: 上\nA E :\n— ° a\n(a) (b)\n图 8-16 ”简易 U 形 压强 计\n把 压强 计 的 金属 盒 放 入 水 中 时 ， 根 据 U 形 管 两 侧 水 面 的 高 度 差 就 可 以 知道\n橡皮 膜 受 到 水 的 压强 的 大 小 了 。\n71\n=== 第 110 页 ===\nVar\n2) X8\n活动 2 探究 液体 内 部 的 压强\n请 利用 U 形 压强 计 ， 研 究 图 8 一 17 中 两 种 = 、\n液体 内 部 压强 的 大 小 跟 哪 些 因素 有 关 。 一\n(1) 将 压强 计 的 金属 使 依 次 放 入 水 中 的 国人 人\n不 同 深度 处 (如 5 cm、10 cm ) ， 研 究 流 体 于  [E Sm\n强 跟 深度 有 什么 关系 。 Sa «s\n(2) 保持 金属 使 在 水 中 的 深度 不 变 ( 如 — -",2.0,75.8955223880597,沪科技粤教版_八年级_义务教育教科书·物理八年级下册,95,2025-07-21T14:25:05.847Z,2.0,义务教育教科书·物理八年级下册,/Users/LeoQin/Documents/GitHub/PDFconvertor/training_data/初中/物理/沪科技粤教版-上海科学技术出版社、广东教育出版社/八年级/义务教育教科书·物理八年级下册.pdf,八年级,tesseract.js-parallel,unknown,0.7703984819734345,0.5,1,75.8955223880597,,true,,true,true,,unknown,下册,沪科技粤教版_八年级_义务教育教科书·物理八年级下册.json,物理,134,初中_物理_沪科技粤教版_八年级_义务教育教科书·物理八年级下册
沪科技粤教版_八年级_义务教育教科书·物理八年级下册_chunk_35,35,强计， 研究 图 8 一 17 中两 种 、 液体内 部压强的 大小 跟哪 些因素有 关。 一 (1) 将压强计 的金属使 依次 放入 水中 的国人人 不同 深度处 (如 5 cm、10 cm )， 研究 流体 于 E Sm 强跟 深度有 什么关系。 Sa s (2) 保持金属使 在水 中的 深度不 变 ( 如 5 cm )， 转动 金属 盒的 方向， 观察 U 形管 两例 图 8_17 不同液体水 面的 高度 差的 变化情况。 (3) 将金属盒 分别 放入 清水和 盐水中 的同一深度处， 观察 U 形管 两侧 水面 的高 度差， 判断 液体的 压强跟 液体密度有 什么关系。 将以 上实验结果与 同学交流后， 可以 得出 结论， 液体内 部各 个方向都 有， 并且 在同一深度各 个方向的 压强 ; 液体内 部的 压强跟 有关， 深度 增加， 压强 ; 不同 液体内 部的 压强跟 液体的 有关， 在同一深度， 密度 越大， 压强。 液体内 部压强的 特点在 工程技术上 有许 多应 用。 例如， 水对 堤坝下 部的 压强比 上部 鼎。 一大， 因此， 在设计堤坝时， 提坝 下部 应当 比 2 上部 更为 厚实 (图 8 一 18 )。 这样 既能 保证堤坝坚固， 又节省了 材料。 Ea e co 玻璃管 、 如图 8 一 19 所示， 上端 开口 、 底部 互相连通的 容器， 物理学上 叫做连通器。 若连通器 内装 入同 种液体， 当液体静止时， 各容器中 的液 面总 保持相 平。 茶过 、 过路 涵洞 、 锅炉 水位 器 、 船闸 等都 属于连通器， 连通 器在 日常生活 和工农业 生人 产中 的应 用非常广泛。 图 8 19 连通顺 72 0 _ _ 路面 寺村,743,0.34307189757924156,low,ocr,强 计 ， 研 究 图 8 一 17 中 两 种 = 、\n液体 内 部 压强 的 大 小 跟 哪 些 因素 有 关 。 一\n(1) 将 压强 计 的 金属 使 依 次 放 入 水 中 的 国人 人\n不 同 深度 处 (如 5 cm、10 cm ) ， 研 究 流 体 于  [E Sm\n强 跟 深度 有 什么 关系 。 Sa «s\n(2) 保持 金属 使 在 水 中 的 深度 不 变 ( 如 — -\n5 cm ) ， 转 动 金 属 盒 的 方向 ， 观 察 U 形 管 两 例 图 8_17 不同 液体\n水 面 的 高 度 差 的 变化 情况 。\n(3) 将 金属 盒 分 别 放 入 清水 和 盐水 中 的 同一 深度 处 ， 观 察 U 形 管 两 侧 水 面\n的 高 度 差 ， 判 断 液体 的 压强 跟 液体 密度 有 什么 关系 。\n将 以 上 实验 结果 与 同学 交流 后 ， 可 以 得 出 结论 ，\n液体 内 部 各 个 方向 都 有 ， 并 且 在 同一 深度 各 个 方向 的 压强\n; 液体 内 部 的 压强 跟 有 关 ， 深 度 增 加 ， 压 强 ; 不 同\n液体 内 部 的 压强 跟 液体 的 有关， 在 同一 深度 ， 密 度 越 大 ， 压 强 。\n液体 内 部 压强 的 特点 在 工程 技术 上 有 许 RE\n多 应 用 。 例 如 ， 水 对 堤坝 下 部 的 压强 比 上 部 鼎 。 TECN 一\n大 ， 因 此 ， 在 设计 堤坝 时 ， 提 坝 下 部 应 当 比 NS 2\n上 部 更 为 厚实 (图 8 一 18 ) 。 这 样 既 能 保证 堤坝 =\n坚固 ， 又 节省 了 材料 。 Ea\ne\nco\n玻璃 管 、\n如 图 8 一 19 所 示 ， 上 端 开口 、 底 部 互相 连通 的 容器 ， 物\n理学 上 叫做 连通 器 。 若 连通 器 内 装 入 同 种 液体 ， 当 液体 静止\n时 ， 各 容器 中 的 液 面 总 保持 相 平 。 茶 过 、 过 路 涵洞 、 锅 炉 水\n位 器 、 船 闸 等 都 属于 连通 器 ， 连 通 器 在 日 常生 活 和 工农 业 生 人\n产 中 的 应 用 非常 广泛 。\n图 8-19 连通 顺\n72\n=== 第 111 页 ===\n0-—_-\n_— ZS 路 面 寺村 |,2.0,75.8955223880597,沪科技粤教版_八年级_义务教育教科书·物理八年级下册,96,2025-07-21T14:25:05.847Z,2.0,义务教育教科书·物理八年级下册,/Users/LeoQin/Documents/GitHub/PDFconvertor/training_data/初中/物理/沪科技粤教版-上海科学技术出版社、广东教育出版社/八年级/义务教育教科书·物理八年级下册.pdf,八年级,tesseract.js-parallel,unknown,0.8030018761726079,0.5,1,75.8955223880597,true,true,,true,,,chemistry,下册,沪科技粤教版_八年级_义务教育教科书·物理八年级下册.json,物理,134,初中_物理_沪科技粤教版_八年级_义务教育教科书·物理八年级下册
