Chunk_ID,Chunk_Index,Content,Content_Length,Quality_Score,Reliability,Source_Type,Original_Content,Enhancement_Version,averageConfidence,book_name,chunkIndex,enhancementTimestamp,enhancementVersion,fileName,filePath,grade,ocrMethod,publisher,qualityMetrics_chineseCharRatio,qualityMetrics_coherenceScore,qualityMetrics_lengthScore,qualityMetrics_ocrConfidence,semanticFeatures_hasDefinition,semanticFeatures_hasExperiment,semanticFeatures_hasFormulas,semanticFeatures_hasNumbers,semanticFeatures_hasQuestion,semanticFeatures_isTableContent,semanticFeatures_subjectArea,semester,source_file,subject,totalPages,uniqueId
沪科技粤教版_九年级_义务教育教科书·物理九年级下册_chunk_5,5,"你的 猜想填写在 下面 : 电动机 的转动 , 可能 跟和 有关。 由于 磁场对 通电线圈产生力 的作用 , 电动机 才会 转动起 来。 圆柱形 的转子是 由硅钢片 亚成 的 , 线圈就 腐在 硅钢片 的槽 中。 23 要验证上 述猜想 , 需要对 电动机 的结构做 合理简化。 1 对镶 和藤 在转子槽 内复杂的 线圈 , 可按照图 : 简化是 科学 ; 17 4 所示 进行 简化。 ; 探究中 常用的 一种 : 方法。 党 PEE: 一一 )， 简化 , 指把 ; fo J w ;影响事物发 展与 变 i . J ; 六斑 ; 要因素 ) 忽略 掉，: ; 而将 影响事物发 展电动机 转于 ;。，: 转子上 的 ;。， 一组 线圈中 :。，: 一个 线圈中 的 :。 ; 与变化较 大的 因素 ; 上的 线圈组 一组 线圈的 一个 线圈一 段直 导线 ; 〈 主要 因素 ) 抽取出 G 图 17 4 电动机 转子简化过 程的 示意图 ; 来的 做法。 对灸 内在定子槽 内比较复杂的 通电线圈 (电磁铁 ), 可按照图 17 5 所示 简化为 蹄形 磁铁。 0 二为 到 E "" o . : 一全 图 17 5 电动机 定子简化过 程的 示意图 通过对 电动机 两个 主要部 件的 简化后 , 就可 以用 线圈或 单根 直导线与 蹄形 磁铁来 进行实验研究了。 请你 在课 后设计一 个验证电动机 转动原因的 猜想的 实验方案 , 填写在 下面 的方 框中。 1 入 24 责任编辑陈 慧敏 金波艳 陈鹏 美术编辑赵 军义务教育教科书 物理 九年 级下 册华东地 区初中物理教材编写组 编著",701,0.3421625437828371,low,ocr,"你 的 猜想 填写 在\n下 面 :\n电动 机 的 转动 , 可 能 跟 和 有 关 。 由 于 磁场 对 通电\n线圈 产生 力 的 作用 , 电动 机 才 会 转动 起 来 。\n* 圆柱 形 的 转子 是 由 硅钢 片 亚 成 的 , 线圈 就 腐 在 硅钢 片 的 槽 中 。\n23\n=== 第 25 页 ===\n要 验证 上 述 猜想 , 需要 对 电动 机 的 结构 做 合理 —\n简化 。 1\n对 镶 和 藤 在 转子 槽 内 复杂 的 线圈 , 可 按照 图 : “简化 ”是 科学 ;\n17 - 4 所 示 进 行 简化 。 ; 探究 中 常用 的 一 种\n: 方法 。\n党 PEE: 一 一 )， “简化 , 指 把 ;\nfo J »/ /w/ ;影响 事物 发 展 与 变 i\n. J / /  / HFRARERR ;\n六 FE > 斑 / / ; 要 因素 ) 忽 略 掉 ，:\n; 而 将 影响 事物 发 展 |\n电动 机 转 于 ; 。，: 转子 上 的 ; 。， 一 组 线圈 中 : 。“，: 一 个 线圈 中 的 : 。 ; 与 变化 较 大 的 因素 ;\n上 的 线圈 组 ”一 组 线圈 ”的 一 个 线圈 一 段 直 导线 ; 〈 主 要 因素 ) 抽取 出 G\n图 17-4 ”电动 机 转子 简化 过 程 的 示意 图 ; 来 的 做 法 。\n对 灸 内在 定子 槽 内 比较 复杂 的 通电 线圈 (电磁 铁 ), 可 按照 图 17 - 5 所 示\n简化 为 蹄 形 磁铁 。\n[0 ——\n二 为 -到\n—| | E ""\no . :\n一 全\n图 17-5 ”电动 机 定子 简化 过 程 的 示意 图\n通过 对 电动 机 两 个 主要 部 件 的 简化 后 , 就 可 以 用 线圈 或 单 根 直 导线 与 蹄 形\n磁铁 来 进行 实验 研究 了 。\n请 你 在 课 后 设计 一 个 “验证 电动 机 转动 原因 的 猜想 ” 的 实验 方案 , 填写 在 下\n面 的 方 框 中 。\n1\n| |\n| |\n|\n入\n24\n=== 第 26 页 ===\n责任 编辑 陈 慧 敏 ”金波 艳 陈 鹏\n美术 编辑 赵 军\n义务 教育 教科 书\n物 理\n九 年 级 下 册\n华东 地 区 初中 物理 教材 编写 组 ”编著",2.0,74.20588235294117,沪科技粤教版_九年级_义务教育教科书·物理九年级下册,19,2025-07-21T14:25:05.769Z,2.0,义务教育教科书·物理九年级下册,/Users/LeoQin/Documents/GitHub/PDFconvertor/training_data/初中/物理/沪科技粤教版-上海科学技术出版社、广东教育出版社/九年级/义务教育教科书·物理九年级下册.pdf,九年级,tesseract.js-parallel,unknown,0.818,0.5,1,74.20588235294117,,true,,true,,,physics,下册,沪科技粤教版_九年级_义务教育教科书·物理九年级下册.json,物理,102,初中_物理_沪科技粤教版_九年级_义务教育教科书·物理九年级下册
沪科技粤教版_九年级_义务教育教科书·物理九年级下册_chunk_6,6,"属棒 4 有还 会动 吗 ? 这个 现象说 明什么 ? 26 (3) 改变电流方向 , 金属棒 4B 的运动方向是 否改变 ? (4) 保持电流方向不 变 , 改变磁场方向 , 金属棒 4B 运动 的方向是 否改变 ? 2. 如果 你选 定了 图 17 7(c) 所示 的实验装置 , 怎样进行实验呢 ? 通过上 述实 验 , 你能 得出 什么结论 ? 通电导体在 磁场中 会受到， 力的 方向跟 方 1 人 (， 向和 方向都 有关系。 入 _ __ 你能 用上 述结论来 说明 通电线圈 在磁场中 是怎样运动的 吗 ? 请试 试看。 开始时 , 线圈平面与 磁感 线平行 , 如图 17 8(a) 所示。 接通电路 后 , 绿色边 和红色边 的电流方向不 同 , 甚受 力的 方向相反 , 线圈便 转动 起来 ; 当线圈转 到如 图 17 一 8(b) 所示 的位 置时 , 绿色边 和红色边 受到的 力恰好在 同一条 直线上， 且大 小相等 , 方向相反 , 线圈来 回摆动几 次就 停在 该位 置上 了。 线圈 的这 一位 置叫做平衡位 置 , 此时 线圈的 平面恰好与 磁感 线垂 直。 rr F Yv ) ? S 7 2 F 二 5 (a) (b) 图 17 8 通电线圈在 磁场中 的运动通过分 析发 现 , 通电线圈在 磁场中 转动到 平衡位 置时 就会 停下 来 , 那么 , 怎样 才能使 通电线圈在 磁场中 持续地 转动呢 ? 换向 器的 作用当 线圈 由于 惯性刚 越过 平衡位 置时 , 如果立 刻改变线圈中 的电流方向， 线圈就 能够 继续转动下 去了。 在电动机 上能 够完成这 一任务的 装置叫做换 向器。 27 活动 2 探究换 向器 的作用",738,0.4200929440497335,medium-low,ocr,"属 棒 4 有 还 会 动 吗 ? 这 个 现象 说 明 什么 ?\n26\n=== 第 29 页 ===\n(3) 改变 电流 方向 , 金属 棒 4B 的 运动 方向 是 否 改变 ?\n(4) 保持 电流 方向 不 变 , 改变 磁场 方向 , 金属 棒 4B 运 动 的 方向 是 否 改变 ?\n2. 如 果 你 选 定 了 图 17 -7(c) 所 示 的 实验 装置 , 怎样 进行 实验 呢 ?\n通过 上 述 实 验 , 你 能 得 出 什么 结论 ?\n通电 导体 在 磁场 中 会 受到 ， 力 的 方向 跟 方 1\n人 (， 向 和 方向 都 有 关系 。 |\n入 _ ”~ __\n你 能 用 上 述 结论 来 说 明 通 电线 圈 在 磁场 中 是 怎样 运动 的 吗 ? 请 试 试看 。\n开始 时 , 线圈 平面 与 磁 感 线 平行 , 如 图 17 — 8(a) 所 示 。 接 通电 路 后 , 绿色\n边 和 红色 边 的 电流 方向 不 同 , 甚 受 力 的 方向 相反 , 线圈 便 转 动 起 来 ; 当 线圈 转 到\n如 图 17 一 8(b) 所 示 的 位 置 时 , 绿色 边 和 红色 边 受到 的 力 恰好 在 同一 条 直线 上 ，\n且 大 小 相等 , 方向 相反 , 线圈 来 回 摆动 几 次 就 停 在 该 位 置 上 了 。 线 圈 的 这 一 位\n置 叫做 平衡 位 置 , 此 时 线圈 的 平面 恰好 与 磁 感 线 垂 直 。\nrr F{\nYv ¢)¥\n? S\nAAA 7\n- - 2\nF 二 5\n(a) (b)\n图 17-8 通电 线圈 在 磁场 中 的 运动\n通过 分 析 发 现 , 通电 线圈 在 磁场 中 转动 到 平衡 位 置 时 就 会 停 下 来 , 那么 , 怎\n样 才能 使 通电 线圈 在 磁场 中 持续 地 转动 呢 ?\n换 向 器 的 作用\n当 线 圈 由 于 惯性 刚 越 过 平衡 位 置 时 , 如果 立 刻 改变 线圈 中 的 电流 方向 ，\n线圈 就 能 够 继续 转动 下 去 了 。 在 电动 机 上 能 够 完成 这 一 任务 的 装置 叫做 换 向\n器 。\n27\n=== 第 30 页 ===\n活动 2 探究 换 向 器 的 作用 --",2.0,74.20588235294117,沪科技粤教版_九年级_义务教育教科书·物理九年级下册,22,2025-07-21T14:25:05.769Z,2.0,义务教育教科书·物理九年级下册,/Users/LeoQin/Documents/GitHub/PDFconvertor/training_data/初中/物理/沪科技粤教版-上海科学技术出版社、广东教育出版社/九年级/义务教育教科书·物理九年级下册.pdf,九年级,tesseract.js-parallel,unknown,0.8102466793168881,0.5,1,74.20588235294117,true,true,,true,true,,physics,下册,沪科技粤教版_九年级_义务教育教科书·物理九年级下册.json,物理,102,初中_物理_沪科技粤教版_九年级_义务教育教科书·物理九年级下册
沪科技粤教版_九年级_义务教育教科书·物理九年级下册_chunk_7,7,"机 g :于二 、 ls f 活动 1 让我 们自己来 发电 放生仔细观察如 图 17 15 所示 的手 播发电机。 用导线把 它与 小灯泡 、 开关连接 起来。 试一 试， 怎样才。 e 能使 小灯泡发 光 ? 一图 17 15 手摇 发电机模型 31 活动 2 拆开发电机一 为了 探究发 电机发 电的 奥秘 ,可采用类 似研 究电动机 的办 法。 将发 电机模 型拆 开 , 看一 看它 的内 部结构。 想一 想 : 发电机的 主要部 件有 哪些 ? 探究电磁感应现象站 二 : 232 活动 3 探究电磁感应现象通过上 述活 动 , 我们 知道发 电机跟 电动机类 似 , 主要部 件也 是两 个 : 线圈和 磁体。 让我 们仿照对 电动机 的研究 , 对线圈和 磁体都 做些 简化 , 用实验来 探究 发电机产生电流的 条件。 根据以 上思路， 同学 们设计了 如图 17 16(a)、(b) 所示 的两 种实验装置。 你选择哪 种方案 ? 请在 图 17 17 中选择合适的 器材 , 进行实验。 如图 17 16(a)、(b) 所示 , 将灵敏电流计 跟线圈或 单根 导线连接起 来 , 检测 线圈或 单根 导线中 是否 有电流。 (1) 当单 根导线或 线圈的 一边 在磁场中 静止不 动时 , 仔细观察 ,灵敏电流计 的指针会 偏转吗 ?9 f o 5L 二 ae 一 (a) (b) 图 17 16 探究电磁感应现象的 实验装置 (一 ) 32 一单 根导 线线圈导线蹄 形磁铁灵敏电流计 图 17 17 探究电磁感应现象的 实验器 材 (2) 单根 导线或 线圈的 一边 在磁场中 做怎样的 运动时 ,灵敏电流计 的指针",721,0.3833095173913044,low,ocr,"机 |\ng\n:于 二 \、| ls f @®\n活动 1 ”让 我 们 自己 来 发 电 放生\n仔细 观察 如 图 17 - 15 所 示 的 手 播发 电机 。 用 >\n导线 把 它 与 小 灯泡 、 开 关连 接 起 来 。 试 一 试 ， 怎样 才 。 e\n能 使 小 灯泡 发 光 ? 一\n图 17-15 手 摇 发 电机 模型\n31\n=== 第 34 页 ===\n活动 2 拆 开发 电机 一\n为 了 探究 发 电机 发 电 的 奥秘 ,可 采用 类 似 研 究 电动 机 的 办 法 。 将 发 电机 模\n型 拆 开 , 看 一 看 它 的 内 部 结构 。 想 一 想 : 发 电机 的 主要 部 件 有 哪些 ?\n探究 电磁 感应 现象\n站 二 :\n232\n活动 3 探究 电磁 感应 现象 -\n通过 上 述 活 动 , 我 们 知道 发 电机 跟 电 动机 类 似 , 主要 部 件 也 是 两 个 : 线圈\n和 磁体 。 让 我 们 仿照 对 电动 机 的 研究 , 对 线圈 和 磁体 都 做 些 简 化 , 用 实验 来 探\n究 发 电机 产生 电流 的 条 件 。\n根据 以 上 思路 ， 同 学 们 设计 了 如 图 17 -16(a)、(b) 所 示 的 两 种 实验 装置 。\n你 选择 哪 种 方案 ? 请 在 图 17 — 17 中 选择 合适 的 器 材 , 进行 实验 。\n如 图 17 — 16(a)、(b) 所 示 , 将 灵敏 电流 计 跟 线圈 或 单 根 导线 连接 起 来 , 检\n测 线圈 或 单 根 导线 中 是 否 有 电流 。\n(1) 当 单 根 导线 或 线圈 的 一 边 在 磁场 中 静止 不 动 时 , 仔细 观察 ,灵敏 电流 计\n的 指针 会 偏转 吗 ?9\nf o |\n5L & JE\n= 二 -ae = = = 一\n(a) (b)\n图 17-16 ”探究 电磁 感应 现象 的 实验 装置 (一 )\n32\n=== 第 35 页 ===\n一\n单 根 导 线 线圈 导线 蹄 形 磁铁 灵敏 电流 计\n图 17-17 ”探究 电磁 感应 现象 的 实验 器 材\n(2) 单 根 导线 或 线圈 的 一 边 在 磁场 中 做 怎样 的 运动 时 ,灵敏 电流 计 的 指针",2.0,74.20588235294117,沪科技粤教版_九年级_义务教育教科书·物理九年级下册,27,2025-07-21T14:25:05.769Z,2.0,义务教育教科书·物理九年级下册,/Users/LeoQin/Documents/GitHub/PDFconvertor/training_data/初中/物理/沪科技粤教版-上海科学技术出版社、广东教育出版社/九年级/义务教育教科书·物理九年级下册.pdf,九年级,tesseract.js-parallel,unknown,0.7882797731568998,0.5,1,74.20588235294117,,true,,true,true,,physics,下册,沪科技粤教版_九年级_义务教育教科书·物理九年级下册.json,物理,102,初中_物理_沪科技粤教版_九年级_义务教育教科书·物理九年级下册
沪科技粤教版_九年级_义务教育教科书·物理九年级下册_chunk_8,8,"十六 章电 磁铁与 自动控制 16.1 从永 磁体 谈起 .2 16.2 奥斯 特的 发现 . .9 16.3 探究电磁铁 的磁性 13 16.4 电磁继电器与 自动控制 . 17 人第 十八 章家庭电路与 安全用 电 x illa J 18.1 家庭 电路 .38 Na 本 18.2 怎样用 电才 安全 .42 1 18.3 电能与 社会发 展 . .48 第十 七章 电动机与 发电机昌 at J8 Sr， 17.1 关于电动机 转动的 猜想 : 22 呈站 2 17.2 探究电动机 转动的 原理 . . . 26 攻冬 二二 志 17.3 发电机为 什么能 发电 :31 有 1 在览 法拉 第的 伟大发 现与 科拉 顿的 跑 "" 失良 机自从丹麦物理学 家奥 斯特 于 1820 年发 现电 流的 磁效 应 "" 之后 ,科学家 们从 自然的 对称 ""原理出 发， 提出 既然电能生 磁 ,那么 , 磁能 和否 生电 "" 这个 问题。 英国 科学家 法拉 第曾 在他 的实验记录本 上 ,如同 座右铭一 样记 下了 这个 极有 价值的 问题。 N nB 了 5 置本 1 图 17 23 法拉第和 他在 1831 年 10 月 28 日图 17 24 1832 年在 法国 制成 的研制出 的世界上 第一 台发 电机手 摇发 电机经 过长 期研究 , 他于 1831 年发 现了 电磁感应现象""， 并用 10 天时 间做 了一 系列试验 , 令人 信服地 解决了 磁生 电的 问题。 法拉 第的 发现 , 不仅 揭开 了电 与磁 之间 内在 联系的 奥秘 , 而且 使电能的 大规模利用成 为可 能 ,为人 类从 闵汽 时代 "" 跨入 电气时 代 ""做出 了伟大的 贡献。 瑞士物理学 家科 拉上 顿也",756,0.33640000000000003,low,ocr,"十 六 章 ” 电 磁铁 与 自动 控制\n16.1 从 永 磁 体 谈 起 .2\n16.2 奥 斯 特 的 发 现 . .9\n16.3 探究 电磁 铁 的 磁性 13 =\n16.4 电磁 继电器 与 自动 控制 .… ………… 17 人\n第 十 八 章 “家庭 电路 与 安全 用 电\nx» =illa ~J \ 18.1 家 庭 电路 .38\nNa 本 18.2 怎样 用 电 才 安 全 .42\n1 18.3 电能 与 社会 发 展 . .48\n第 十 七 章 ” 电 动机 与 发 电机\n昌\nat J8 Sr RE ，\n17.1 关于 电动 机 转动 的 猜想 ………: 22 呈 站 2\n17.2 探究 电动 机 转动 的 原理 .…… .……. 26 攻 冬 二 二 志 SS\n17.3 发 电机 为 什么 能 发 电 ………… :31 & — 有\n1\n=== 第 38 页 ===\n在 > 览\n法 拉 第 的 伟大 发 现 与 科 拉 顿 的 “ 跑 "" 失 良 机\n自从 丹麦 物理 学 家 奥 斯 特 于 1820 年 发 现 “ 电 流 的 磁 效 应 ""\n之 后 ,科学 家 们 从 自然 的 “对 称 ""原理 出 发 ， 提 出 “既然 电能 生\n磁 ,那么 , 磁 能 和 否 生 电 "" 这 个 问题 。 英 国 科学 家 法 拉 第 曾 在 他 的\n实验 记录 本 上 ,如 同 座右铭 一 样 记 下 了 这 个 极 有 价值 的 问题 。\n’ N nB\n了 5 置 “本 1\n图 17-23 法拉第 和 他 在 1831 年 10 月 28 日 图 17-24 1832 年 在 法 国 制 成 的\n研制 出 的 世界 上 第 一 台 发 电机 手 摇 发 电机\n经 过 长 期 研究 , 他 于 1831 年 发 现 了 “电磁 感应 现象""， 并 用 10\n天 时 间 做 了 一 系列 试验 , 令 人 信服 地 解决 了 磁 生 电 的 问题 。 法\n拉 第 的 发 现 , 不 仅 揭 开 了 电 与 磁 之 间 内 在 联系 的 奥秘 , 而 且 使\n电能 的 大 规模 利用 成 为 可 能 ,为 人 类 从 * 闵 汽 时 代 "" 跨 入 “电气\n时 代 ""做 出 了 伟大 的 贡献 。\n瑞士 物理 学 家 科 拉 上 顿 也",2.0,74.20588235294117,沪科技粤教版_九年级_义务教育教科书·物理九年级下册,30,2025-07-21T14:25:05.769Z,2.0,义务教育教科书·物理九年级下册,/Users/LeoQin/Documents/GitHub/PDFconvertor/training_data/初中/物理/沪科技粤教版-上海科学技术出版社、广东教育出版社/九年级/义务教育教科书·物理九年级下册.pdf,九年级,tesseract.js-parallel,unknown,0.7276119402985075,0.5,1,74.20588235294117,,true,,true,,,physics,下册,沪科技粤教版_九年级_义务教育教科书·物理九年级下册.json,物理,102,初中_物理_沪科技粤教版_九年级_义务教育教科书·物理九年级下册
沪科技粤教版_九年级_义务教育教科书·物理九年级下册_chunk_9,9,"， 并用 10 天时 间做 了一 系列试验 , 令人 信服地 解决了 磁生 电的 问题。 法拉 第的 发现 , 不仅 揭开 了电 与磁 之间 内在 联系的 奥秘 , 而且 使电能的 大规模利用成 为可 能 ,为人 类从 闵汽 时代 "" 跨入 电气时 代 ""做出 了伟大的 贡献。 瑞士物理学 家科 拉上 顿也 四曾 探究过 如何 让磁 生电 的问 和题。1825 年的 某天 , 年轻 的科 拉顿 在实验室 里做 磁生 o 国电的 实验探 完。 他设想将 A 工作国史磁铁放 在线圈中 ,线圈中 可所 一站 能会 产生电流。 为了 避免磁 铁对 磁针 的影响 ,他将 磁针 M。 放到 另外一 个房间里 ,如图 17 25 所示。 实验 时 ,他将 图 17 25 科拉 顿进行实验的 示意图 磁铁插入线圈中 , 立刻跑 到另 一个 房间观察小 磁针 的入 35 转情 况 , 十分 遗憾 ,他并 未看 到设想的 结果。 后来 , 有一 位科学家 幽默地 说倒霉的 科拉 顿 ' 跑 ' 失了 良机 ! 和否则 ,发现电磁感应现象的 殊荣 ,就要 落在 23 岁的 科拉 上顿 头上 了。 从这 个小 故事中 , 你悟 出了 什么 ? 让合计 585 1. 请你 比较发 电机和 电动机 的结构 , 看看 它们的 主要结构有 什么相似之 处。 2.， 对产生感应电流的 条件 有下 面四 种说 法 ,你认为正确的 是 ( )。 A. 只要 导体在 磁场中 做切割磁 感线 的运动 ,就一 定会 产生感应电流 B. 只要 闭合导体的 一部 分在 磁场中 运动 ,就一 定会 产生感应电流 C. 闭合导体的 一部 分在 磁场中 不动 , 只要 磁场运动就 一定 会产生感应电流",736,0.5069596402877699,medium-low,ocr,"， 并 用 10\n天 时 间 做 了 一 系列 试验 , 令 人 信服 地 解决 了 磁 生 电 的 问题 。 法\n拉 第 的 发 现 , 不 仅 揭 开 了 电 与 磁 之 间 内 在 联系 的 奥秘 , 而 且 使\n电能 的 大 规模 利用 成 为 可 能 ,为 人 类 从 * 闵 汽 时 代 "" 跨 入 “电气\n时 代 ""做 出 了 伟大 的 贡献 。\n瑞士 物理 学 家 科 拉 上 顿 也\n四 曾 探究 过 如 何 让 磁 生 电 的 问\n和 题 。1825 年 的 某 天 , 年 轻 的\n[| 科 拉 顿 在 实验 室 里 做 “ 磁 生\no 国电 的 实验 探 完 。 他 设想 将\nA 工作 ”国史 磁铁 放 在 线圈 中 ,线圈 中 可\n= 所 一 站 能 会 产生 电流 。 为 了 避免 磁\n| 铁 对 磁 针 的 影响 ,他 将 磁 针\n/ M 。 放 到 另外 一 个 房间 里 ,如 图\n” 17 -25 所 示 。 实 验 时 ,他 将\n图 17-25 “ 科 拉 顿 进行 实验 的 示意 图 磁铁 插入 线圈 中 , 立刻 跑 到\n另 一 个 房间 观察 小 磁 针 的 入\n35\n=== 第 39 页 ===\n转 情 况 , 十 分 遗憾 ,他 并 未 看 到 设想 的 结果 。\n后 来 , 有 一 位 科学 家 幽默 地 说 “倒霉 的 科 拉 顿 ' 跑 ' 失 了\n良机 ! ”和 否则 ,发现 电磁 感应 现象 的 殊荣 ,就 要 落 在 23 岁 的 科\n拉 上 顿 头 上 了 。\n从 这 个 小 故事 中 , 你 悟 出 了 什么 ?\n让\n合计 585 —\n1. 请 你 比较 发 电机 和 电动 机 的 结构 , 看 看 它们 的 主要 结构 有 什么 相似 之\n处 。\n2.， 对 产生 感应 电流 的 条 件 有 下 面 四 种 说 法 ,你 认为 正确 的 是 (  )。\nA. 只 要 导体 在 磁场 中 做 切割 磁 感 线 的 运动 ,就 一 定 会 产生 感应 电流\nB. 只 要 闭合 导体 的 一 部 分 在 磁场 中 运动 ,就 一 定 会 产生 感应 电流\nC. 闭合 导体 的 一 部 分 在 磁场 中 不 动 , 只 要 磁场 运动 就 一 定 会 产生 感应 电流",2.0,74.20588235294117,沪科技粤教版_九年级_义务教育教科书·物理九年级下册,31,2025-07-21T14:25:05.769Z,2.0,义务教育教科书·物理九年级下册,/Users/LeoQin/Documents/GitHub/PDFconvertor/training_data/初中/物理/沪科技粤教版-上海科学技术出版社、广东教育出版社/九年级/义务教育教科书·物理九年级下册.pdf,九年级,tesseract.js-parallel,unknown,0.8566037735849057,0.5,1,74.20588235294117,,true,,true,true,,physics,下册,沪科技粤教版_九年级_义务教育教科书·物理九年级下册.json,物理,102,初中_物理_沪科技粤教版_九年级_义务教育教科书·物理九年级下册
