Chunk_ID,Chunk_Index,Content,Content_Length,Quality_Score,Reliability,Source_Type,Original_Content,Enhancement_Version,averageConfidence,book_name,chunkIndex,enhancementTimestamp,enhancementVersion,fileName,filePath,grade,ocrMethod,publisher,qualityMetrics_chineseCharRatio,qualityMetrics_coherenceScore,qualityMetrics_lengthScore,qualityMetrics_ocrConfidence,semanticFeatures_hasDefinition,semanticFeatures_hasExperiment,semanticFeatures_hasFormulas,semanticFeatures_hasNumbers,semanticFeatures_hasQuestion,semanticFeatures_isTableContent,semanticFeatures_subjectArea,semester,source_file,subject,totalPages,uniqueId
沪科技粤教版_九年级_义务教育教科书·物理九年级下册_chunk_10,10,"做自动空气断路 n 因四 上器。 图 18 3 所示 的是 家庭 常用的 一种 空气 B x. 当电 路发 生短路 、 过载 等异常情况时， IMe oMe 00。 空气 开关就 能自动切断电路。 目前， 它已 震代 闸刀 开关 和熔断器 而得 到广泛应 用。 图 18 3 空气开关火线与 雯线 一般 家庭 电路 有两 根进 户线 , 都是 从低压输电线 上引 下来 的。 其中 一根 叫做 零线 , 正常情况下 , 零线 跟地 相通 , 它跟 地之 间没 有电压， 另一 根叫 做火线， 火线跟 零线 之间 有 220V 的电压。 为了 安全起 见 , 有些 家用 电器所 用的 三孔 插座 还加 接了 一根 地线 , 即直接与 大地 相连通 的导线 , 万一 家用 电器出 现漏电， 电流便 从地 线流入大 地 , 从而 避免发 生触电事故。 那么 , 怎样识别火线和 零线 呢 ? ( 的 2) 8 活动 1 用测 电笔 辨别 火线与 零线 金属体 笔尾 人和 从高 值电阻为 了安全 、 合理 地安装和 使用 电 Na 器， 常用 测电 笔 (图 18 4) 来让 别火 wwendf 线和 零线。 多图 18 4 测电 笔的 外形 和内 部结构 7 39 使用 测电 笔时 , 正确的 握笔 方法应 如图 18 5 所示。 通过 看测 电笔 的氛 管是 否发 光 , 即可 辨别火线与 零线。 信 A 2 GAN (a) 氛管 发光 , 这是 火线 (b) 氛管 不发 光 , 这是 零线 图 18 5 用测 电笔 辨别 火线与 零线 在老师的 指导下 , 用测 电笔试触 教室内 的插座 , 判断哪个插 孔是 接火线的。",717,0.3173446282527881,low,ocr,"做 自动 空气 断路\n= -\n| =n 因 四 上 器 。 图 18 - 3 所 示 的 是 家 庭 常用 的 一 种 空气\nB x. 当 电 路 发 生 短路 、 过 载 等 异常 情况 时 ，\nIMe oMe 00 。 空 气 开关 就 能 自动 切断 电路 。 目 前 ， 它 已 震\n代 闸 刀 开 关 和 熔断 器 而 得 到 广泛 应 用 。\n图 18-3 空气 开关\n火线 与 雯 线\n一 般 家 庭 电 路 有 两 根 进 户 线 , 都 是 从 低压 输电 线 上 引 下 来 的 。 其 中 一 根 叫\n做 零 线 , 正常 情况 下 , 零 线 跟 地 相通 , 它 跟 地 之 间 没 有 电压 ， 另 一 根 叫 做 火线 ，\n火线 跟 零 线 之 间 有 220V 的 电压 。 为 了 安全 起 见 , 有 些 家 用 电器 所 用 的 三 孔 插\n座 还 加 接 了 -一 根 地 线 , 即 直接 与 大 地 相连 通 的 导线 , 万 一 家 用 电器 出 现 漏电 ，\n电流 便 从 地 线 流入 大 地 , 从 而 避免 发 生 触电 事故 。\n那么 , 怎样 识别 火线 和 零 线 呢 ?\nFRR\n(£ 的\né2) %8\n活动 1 用 测 电 笔 辨 别 火线 与 零 线\n金属 体 笔 尾\n人 和 从 高 值 电阻\n为 了 安全 、 合 理 地 安装 和 使 用 电 /Na\n器 ， 常 用 测 电 笔 (图 18 -- 4) 来 让 别 火  wwendf []\n线 和 零 线 。 多\n图 18-4 测 电 笔 的 外 形 和 内 部 结构 SREER 7\n39\n=== 第 43 页 ===\n使 用 测 电 笔 时 , 正确 的 握 笔 方法 应 如 图 18 — 5 所 示 。 通 过 看 测 电 笔 的 氛 管\n是 否 发 光 , 即 可 辨别 火线 与 零 线 。\n信 A\n2 ER\nGAN\n(a) 氛 管 发 光 , 这 是 火线 (b) 氛 管 不 发 光 , 这 是 零 线\n图 18-5 用 测 电 笔 辨 别 火线 与 零 线\n在 老师 的 指导 下 , 用 测 电 笔试 触 教室 内 的 插座 , 判断 哪个 插 孔 是 接 火线 的 。",2.0,74.20588235294117,沪科技粤教版_九年级_义务教育教科书·物理九年级下册,34,2025-07-21T14:25:05.769Z,2.0,义务教育教科书·物理九年级下册,/Users/LeoQin/Documents/GitHub/PDFconvertor/training_data/初中/物理/沪科技粤教版-上海科学技术出版社、广东教育出版社/九年级/义务教育教科书·物理九年级下册.pdf,九年级,tesseract.js-parallel,unknown,0.804,0.5,1,74.20588235294117,,,,true,true,,general,下册,沪科技粤教版_九年级_义务教育教科书·物理九年级下册.json,物理,102,初中_物理_沪科技粤教版_九年级_义务教育教科书·物理九年级下册
沪科技粤教版_九年级_义务教育教科书·物理九年级下册_chunk_11,11,"5 所示。 通过 看测 电笔 的氛 管是 否发 光 , 即可 辨别火线与 零线。 信 A 2 GAN (a) 氛管 发光 , 这是 火线 (b) 氛管 不发 光 , 这是 零线 图 18 5 用测 电笔 辨别 火线与 零线 在老师的 指导下 , 用测 电笔试触 教室内 的插座 , 判断哪个插 孔是 接火线的。 在使 用家 用电器时 , 先要 将电器的 插头插入插座或 接线板 上 , 这样 就可 以接 通电源了。 例如 , 将台灯的 插头插入插座 , 就是 把灯泡接 到火线和 零线 之间， 闭合台灯的 开关后 , 灯泡便 发光 了 (图 18 一 6)。 火线一 本 f 220V Ng EAEY 由零 线图 18 6 将家 用电器接 入电源白炽电灯家 庭中 常用的 照明光源是 白炽电灯 , 当电 流通过 灯丝时 , 灯丝温度高 达 2000 C 以上, 呈和 白炽状态 , 发出 的光 呈白色。 40 (3 2) 省活动 2 电流怎样通过灯泡一 分别 准备一 个装 在灯头里 的螺 口灯泡和 卡口 灯泡 (灯头里 有接线以 模拟火 线 、 零线 )， 印下 灯泡 , 旋开 灯头后 面的 盖子 , 对照 图 18 7(a) .(b) ,仔细观察并 讨论， (1) 这两 种灯泡和 灯头的 构造有 什么不 同 ? (2) 这两 种灯泡分 别是 怎样让 电流通过灯丝的 ? 保险扣 有保险扣 、、 全 i 用 . a 区旭 放去 、 全 s1.3t a : 金属柱 一 ma 锡块 n 2 1 锡块 me 和全 (a) 螺口 灯泡和 灯头 (b) 卡口 灯泡 和灯头图 18 7， 螺口 灯泡 和卡 口灯泡节能灯 荧光灯 比白炽灯 省电， 它的 发光 效率约 三本 一人 相当于 白炽灯 的 5 倍。 荧光 灯中 的节能灯 ( 图",767,0.38476677573529405,low,ocr,"— 5 所 示 。 通 过 看 测 电 笔 的 氛 管\n是 否 发 光 , 即 可 辨别 火线 与 零 线 。\n信 A\n2 ER\nGAN\n(a) 氛 管 发 光 , 这 是 火线 (b) 氛 管 不 发 光 , 这 是 零 线\n图 18-5 用 测 电 笔 辨 别 火线 与 零 线\n在 老师 的 指导 下 , 用 测 电 笔试 触 教室 内 的 插座 , 判断 哪个 插 孔 是 接 火线 的 。\n在 使 用 家 用 电器 时 , 先 要 将 电器 的 插头 插入 插座 或 接线 板 上 , 这 样 就 可 以\n接 通 电源 了 。 例 如 , 将 台灯 的 插头 插入 插座 , 就 是 把 灯泡 接 到 火线 和 零 线 之 间 ，\n闭合 台灯 的 开关 后 , 灯泡 便 发 光 了 (图 18 一 6)。\n火线\n一 本 |\n| ] | f 220V\nNg [EAEY 由\n零 线\n图 18-6 将 家 用 电器 接 入 电源\n白炽 电灯\n家 庭 中 常用 的 照明 光源 是 白炽 电灯 , 当 电 流通 过 灯丝 时 , 灯丝 温度 高 达\n2000 C 以上, 呈 和 白炽 状态 , 发 出 的 光 呈 白色 。\n40\n=== 第 44 页 ===\n(3\n&2) 省\n活动 2 电流 怎样 通过 灯泡 一\n分 别 准备 一 个 装 在 灯头 里 的 螺 口 灯泡 和 卡 口 灯泡 (灯头 里 有 接线 以 模拟 火\n线 、 零 线 )， 印 下 灯泡 , 旋 开 灯头 后 面 的 盖子 , 对 照 图 18 - 7(a) .(b) ,仔细 观察\n并 讨论 ，\n(1) 这 两 种 灯泡 和 灯头 的 构造 有 什么 不 同 ?\n(2) 这 两 种 灯泡 分 别 是 怎样 让 电流 通过 灯丝 的 ?\n保险 扣 ~ @ 有 保险 扣 、、 全 »i\n/用 .\na 区\n旭 放 去 、 全 s1.3t—\na&: 金属 柱 一\nma 锡 块 n 2 1 锡 块\nme- 和 全\n& &\n(a) 螺 口 灯泡 和 灯头 (b) 卡 口 灯 泡 和 灯头\n图 18-7， 螺 口 灯 泡 和 卡 口 灯泡\n节能 灯\n荧光 灯 比 白炽 灯 省 电 ， 它 的 发 光 效率 约\n三 本 一 人 相当 于 白炽 灯 的 5 倍 。 荧 光 灯 中 的 节能 灯 ( 图",2.0,74.20588235294117,沪科技粤教版_九年级_义务教育教科书·物理九年级下册,35,2025-07-21T14:25:05.769Z,2.0,义务教育教科书·物理九年级下册,/Users/LeoQin/Documents/GitHub/PDFconvertor/training_data/初中/物理/沪科技粤教版-上海科学技术出版社、广东教育出版社/九年级/义务教育教科书·物理九年级下册.pdf,九年级,tesseract.js-parallel,unknown,0.7665441176470589,0.6,1,74.20588235294117,,true,,true,true,,general,下册,沪科技粤教版_九年级_义务教育教科书·物理九年级下册.json,物理,102,初中_物理_沪科技粤教版_九年级_义务教育教科书·物理九年级下册
沪科技粤教版_九年级_义务教育教科书·物理九年级下册_chunk_12,12,"a 区旭 放去 、 全 s1.3t a : 金属柱 一 ma 锡块 n 2 1 锡块 me 和全 (a) 螺口 灯泡和 灯头 (b) 卡口 灯泡 和灯头图 18 7， 螺口 灯泡 和卡 口灯泡节能灯 荧光灯 比白炽灯 省电， 它的 发光 效率约 三本 一人 相当于 白炽灯 的 5 倍。 荧光 灯中 的节能灯 ( 图 18 8) 由于 采用了 发光 效率更 高的 荧光粉 和本 二电子变频镇 流器 ,使电能的 利用率 大大 提高。 人一 个 11 节能灯 的亮度相当于 60 W 白炽 灯一 2 的亮度 ,而它 消耗的 电能只 有 60 W 白炽 灯的 图 18 8 节能灯 17 9 6 41 中司 我评价与 作 J 芭 1. 电灯的 开关应 该接 在火线与 灯泡之 间 , 还是 零线 与灯泡之 间 ? 为什么 ? 2. 观察比较一 下 PZ 220 15 和了 220 100"" 两种 规格的 白炽灯泡灯丝的 粗细 , 根据它们额定功率的 不同 , 说说 灯丝粗细与 额定功率的 关系。 3. 一个 灯泡的 灯丝断 了。 若将 灯丝搭 接后 再用 , 灯泡的 发光 跟原来的 情况 相比 , 将变 亮还 是变 暗 ? 为什么? 4. 安装家 庭电路中 螺口 灯泡的 灯头时 ,灯头中 间的 金属片 应跟 电源线 的线 相连 ,灯头内 的螺旋套 应跟 线相连。 有， 1 1 1 在父母的 帮助下 , 观察自己家 中的 电路 , 看看 进户 线 、 电能 表 、 开关 、1 1 播座 , 以及 各种 用电器是 怎样布局的。 参照 图 18 一 2, 尝试 将你 家的 电路画 1 出来 1 1_ _ 加由 _1 7 2 怎样用 电才 安全随 着生活水 平的 提高 , 家庭 中使 用的 电器设备也 越来 越多 , 因此 , 用电 安全",770,0.3936952856130403,low,ocr,"a 区\n旭 放 去 、 全 s1.3t—\na&: 金属 柱 一\nma 锡 块 n 2 1 锡 块\nme- 和 全\n& &\n(a) 螺 口 灯泡 和 灯头 (b) 卡 口 灯 泡 和 灯头\n图 18-7， 螺 口 灯 泡 和 卡 口 灯泡\n节能 灯\n荧光 灯 比 白炽 灯 省 电 ， 它 的 发 光 效率 约\n三 本 一 人 相当 于 白炽 灯 的 5 倍 。 荧 光 灯 中 的 节能 灯 ( 图\n= & 18 -8) 由 于 采用 了 发 光 效率 更 高 的 荧光 粉 和\n< 本 二 | 电子 变频 镇 流 器 ,使 电能 的 利用 率 大 大 提高。\n人 一 个 11 节能 灯 的 亮度 相当 于 60 W 白 炽 灯\n一 2 的 亮度 ,而 它 消耗 的 电能 只 有 60 W 白 炽 灯 的\n图 18-8 节能 灯 17 9%6\n41\n=== 第 45 页 ===\n中\n司 我 评价 与 作 J 芭 =\n1. 电灯 的 开关 应 该 接 在 火线 与 灯泡 之 间 , 还 是 零 线 与 灯泡 之 间 ? 为 什么 ?\n2. 观察 比较 一 下 “PZ 220-15” 和 “了 PZ 220-100"" 两 种 规格 的 白炽 灯泡 灯丝\n的 粗细 , 根据 它们 额定 功率 的 不 同 , 说 说 灯丝 粗细 与 额定 功率 的 关系 。\n3. 一 个 灯泡 的 灯丝 断 了 。 若 将 灯丝 搭 接 后 再 用 , 灯泡 的 发 光 跟 原来 的 情\n况 相 比 , 将 变 亮 还 是 变 暗 ? 为什么?\n4. 安装 家 庭 电路 中 螺 口 灯泡 的 灯头 时 ,灯头 中 间 的 金属 片 应 跟 电源 线 的\n线 相 连 ,灯头 内 的 螺旋 套 应 跟 线 相连 。\n-有 -=---------，\n1 1\n1 在 父母 的 帮助 下 , 观察 自己 家 中 的 电路 , 看 看 进 户 线 、 电 能 表 、 开 关 、1\n1 播 座 , 以 及 各 种 用 电器 是 怎样 布局 的 。 参 照 图 18 一 2, 尝 试 将 你 家 的 电路 画 |\n1 出 来 1\n1_ _ 加 由 _1\n- 7 2\n怎样 用 电 才 安全\n随 着 生活 水 平 的 提高 , 家 庭 中 使 用 的 电器 设备 也 越 来 越 多 , 因此 , 用 电 安 全",2.0,74.20588235294117,沪科技粤教版_九年级_义务教育教科书·物理九年级下册,36,2025-07-21T14:25:05.769Z,2.0,义务教育教科书·物理九年级下册,/Users/LeoQin/Documents/GitHub/PDFconvertor/training_data/初中/物理/沪科技粤教版-上海科学技术出版社、广东教育出版社/九年级/义务教育教科书·物理九年级下册.pdf,九年级,tesseract.js-parallel,unknown,0.7742537313432836,0.6,1,74.20588235294117,,true,,true,true,,unknown,下册,沪科技粤教版_九年级_义务教育教科书·物理九年级下册.json,物理,102,初中_物理_沪科技粤教版_九年级_义务教育教科书·物理九年级下册
沪科技粤教版_九年级_义务教育教科书·物理九年级下册_chunk_13,13,"人二 J 出 N 7 、 1 ( 1 a 刘接 地线 从忆 2 人 1 pe 二 (a) 当家用 电器漏电或 因火线破损与 外壳 接 (b) 外壳 接地 后 , 即使外 壳带 电 , 也会 从接地触 时 , 会使 外壳 带电 ,这时 人接触外 壳会 线流 走 , 人接触外 壳不 会触电发 生触电图 18 14 带有 金属外 壳的 家用 电器要 有接地线 46 V 2 为英 文 China Compulsory Certification 的缩 写 ) 意为 中国 强制认证， 简称 3C""。 该认证标志是 我国 对家 用电器准许其 出厂 销售 和使 用的 标志 , 如图 18 一 15 所示。 我国 从 2003 年 8 月 1 日开始全 面实 施 3C"" 认证 ,现在购买的 家用 电器都 应有 3C"" 标志。 如果菜家 用电器没有加 贴这 一标志 , 则表 示该 产品可 能不 符合国家标准和 技术要 求 ,质量难以保证。 图 18 15 中国强制认证标志和 司我 评价与 作业 1.， 在你 家的 供电电路中 , 用的 是熔断器 还是 空气开关 ? 你家 里是 否发 生过 过载 现象 ? 如发 生过 , 是如 何解决的 ? 2. 使用 带有 金属外 这的 家用 电器 ,其金属外 壳必 须有 接地线。 你知道为 什么要 有这 样的 规定吗 ? 3. 你家 里所 有用 电器若 同时工作 , 电能表 是否 会超 负荷 9 如果 超负荷， 你建议采取什么措施解决这 个问题 ? 4 了解社会上 因假 置伪 劣电器引发的 事故 , 进一步考察 ""3C 的具体内 容， 进而认识 3C 的意义。 5. 某同 学编 了一 段 "" 顺口溜 ,总结了 家庭 安全用 电的 基本常识 : 家庭 用",747,0.3389595652173913,low,ocr,"|\n人 二 ¢ SN\nJ = \ 出 | N 7\n、 1 ( 1 / a £ 刘 接 地 线\n= 从 忆 2 人\n1 pe 二\n(a) 当家 用 电器 漏电 或 因 火线 破损 与 外 壳 接 (b) 外 壳 接 地 后 , 即使 外 壳 带 电 , 也 会 从 接地\n触 时 , 会 使 外 壳 带 电 ,这 时 人 接触 外 壳 会 线 流 走 , 人 接触 外 壳 不 会 触电\n发 生 触电\n图 18-14 带 有 金属 外 壳 的 家 用 电器 要 有 接地 线\n46\n=== 第 51 页 ===\nV 2 CCC 为 英 文 China Compulsory Certification 的 缩 写 ) 意 为\nSTS “中 国 强制 认证 ”， 简 称 “3C""。 该 认证 标志 是 我 国 对 家 用 电器\n准许 其 出 厂 销 售 和 使 用 的 标志 , 如 图 18 一 15 所 示 。\n我 国 从 2003 年 8 月 1 日 开始 全\n面 实 施 “3C""” 认证 ,现在 购买 的 家\n用 电器 都 应 有 “3C""” 标志。 如 果菜\n家 用 电器 没有 加 贴 这 一 标志 , 则 表\n示 该 产品 可 能 不 符合 国家 标准 和\n技术 要 求 ,质量 难以 保证 。 图 18-15 ”中国 强制 认证 标志\n和\n司 我 评价 与 作业\n1.， 在 你 家 的 供电 电路 中 , 用 的 是 熔断 器 还 是 空气 开关 ? 你 家 里 是 否 发 生 过\n过 载 现象 ? 如 发 生 过 , 是 如 何 解决 的 ?\n2. 使 用 带 有 金属 外 这 的 家 用 电器 ,其 金属 外 壳 必 须 有 接地 线 。 你 知道 为\n什么 要 有 这 样 的 规定 吗 ?\n3. 你 家 里 所 有 用 电器 若 同时 工作 , 电能 表 是 否 会 超 负荷 9 如 果 超 负荷 ， 你\n建议 采取 什么 措施 解决 这 个 问题 ?\n4 了解 社会 上 因 假 置 伪 劣 电器 引发 的 事故 , 进一步 考察 ""3C 的 具体 内 容 ，\n进而 认识 “3C ”的 意义 。\n5. 某 同 学 编 了 一 段 "" 顺口溜 ” ,总结 了 家 庭 安全 用 电 的 基本 常识 : “家 庭 用",2.0,74.20588235294117,沪科技粤教版_九年级_义务教育教科书·物理九年级下册,41,2025-07-21T14:25:05.769Z,2.0,义务教育教科书·物理九年级下册,/Users/LeoQin/Documents/GitHub/PDFconvertor/training_data/初中/物理/沪科技粤教版-上海科学技术出版社、广东教育出版社/九年级/义务教育教科书·物理九年级下册.pdf,九年级,tesseract.js-parallel,unknown,0.7663551401869159,0.5,1,74.20588235294117,,,,true,true,,physics,下册,沪科技粤教版_九年级_义务教育教科书·物理九年级下册.json,物理,102,初中_物理_沪科技粤教版_九年级_义务教育教科书·物理九年级下册
沪科技粤教版_九年级_义务教育教科书·物理九年级下册_chunk_14,14,"况目前 , 我国 除了台湾地 区和 港 、 澳特别行政区 外 , 已经 形成华北 、 东北 、 华东 、 华中 、 西北 、 川渝 和南方联合等 7 个跨 省区 电网和 5 个独立的 省级 电网。 大电网覆盖了 全部 城市和 绝大 部分 农村。 我国 的电力工业已 跨入 大区 联网和 推进全 国联网 的新 阶段。 我国 长江 三峡 地区 正大力 发展 水力 发电 , 并实现西 电东 送。 目前 长江 三峡 向华东电网输电的 线路共 有三 条 : 第一 条是 从葛洲坝到 上海 市的 葛沪 线 "", 已于 1989 年全 线投入运行， 第二 条是 从湖北宜昌市 龙于 泉到 常州市 政平 的龙 政线 , 第三 条就 是从 长江 三人 峡到 上海 青浦的 线路。 图 18 17 高压输 电随 着我 国经 谤建设的 发展 , 对电能的 需求日 益增 加。 国家 正大力 发展 水力 发电 、 风力 发电 和核电 , 积极开发利用新 能源 , 以适应国民经 济和 社会发 展的 需要。 c 息浏 监电网是 将那些邻近的 电厂 、 变电站 、 高压 输电线路联合起 来组 成的 地区 性送 配电 系统 , 具有统一管理和 统一调配大 面积送 配电 的功能。 节约用 电电能使 用方便 、 清洁 , 因此 , 它已 成为 人类 使用 最普遍 、 最广泛的 一种 能源。 但目前电能主要是 从煤炭 、 石油 、 天然 气等 资源转化而 来的 , 对这 些资 源的 过度 开采 , 带来 的是 对环境的 破坏。 因此 , 提倡节约用 电 , 可以 减少能 源的 消耗 , 保护环境 , 这不 仅关系到 社会的 科学发 展 , 而且 也关系到 每个 人生活质量的 提高。",729,0.4741011064946423,medium-low,ocr,"况\n目前 , 我 国 除了 台湾 地 区 和 港 、 澳 特别 行政 区 外 , 已 经 形成 华北 、 东 北 、 华\n东 、 华中 、 西 北 、 川 渝 和 南方 联合 等 7 个 跨 省 区 电网 和 5 个 独立 的 省 级 电网 。 大\n电网 覆盖 了 全 部 城市 和 绝 大 部 分 农村 。 我 国 的 电力 工业 已 跨 入 大 区 联网 和 推进\n全 国联 网 的 新 阶段 。\n我 国 长 江 三 峡 地 区 正大 力 发 展 水 力 发 电 , 并 实现 西 电 东 送 。 目 前 长 江 三 峡\n向 华东 电网 输电 的 线路 共\n有 三 条 : 第 一 条 是 从 葛洲坝\n到 上 海 市 的 “ 葛 沪 线 "", 已\n于 1989 年 全 线 投入 运行 ，\n第 二 条 是 从 湖北 宜昌 市 龙\n于 泉 到 常州 市 政 平 的 “ 龙 政\nCE 线 ”, 第 三 条 就 是 从 长 江 三\nES 人 峡 到 上 海 青浦 的 线路 。\n图 18-17 高压 输 电\n=== 第 53 页 ===\n随 着 我 国 经 谤 建设 的 发 展 , 对 电能 的 需求 日 益 增 加 。 国 家 正大 力 发 展 水 力 发\n电 、 风 力 发 电 和 核电 , 积极 开发 利用 新 能 源 , 以 适应 国民 经 济 和 社会 发 展 的 需要 。\nc 息 浏 | 监\n电网 是 将 那些 邻近 的 电厂 、 变 电站 、 高 压 输电 线路 联合 起\n来 组 成 的 地 区 性 送 配 电 系统 , 具有 统一 管理 和 统一 调配 大 面积\n送 配 电 的 功能 。\n节约 用 电\n电能 使 用 方便 、 清 洁 , 因此 , 它 已 成 为 人 类 使 用 最 普遍 、 最 广泛 的 一 种 能\n源 。 但 目前 电能 主要 是 从 煤炭 、 石 油 、 天 然 气 等 资源 转化 而 来 的 , 对 这 些 资 源\n的 过 度 开 采 , 带 来 的 是 对 环境 的 破坏 。 因 此 , 提倡 节约 用 电 , 可 以 减少 能 源 的 消\n耗 , 保护 环境 , 这 不 仅 关系 到 社会 的 科学 发 展 , 而 且 也 关系 到 每 个 人 生活 质量 的\n提高 。",2.0,74.20588235294117,沪科技粤教版_九年级_义务教育教科书·物理九年级下册,43,2025-07-21T14:25:05.769Z,2.0,义务教育教科书·物理九年级下册,/Users/LeoQin/Documents/GitHub/PDFconvertor/training_data/初中/物理/沪科技粤教版-上海科学技术出版社、广东教育出版社/九年级/义务教育教科书·物理九年级下册.pdf,九年级,tesseract.js-parallel,unknown,0.8921001926782274,0.6,1,74.20588235294117,,,,true,,,physics,下册,沪科技粤教版_九年级_义务教育教科书·物理九年级下册.json,物理,102,初中_物理_沪科技粤教版_九年级_义务教育教科书·物理九年级下册
