Chunk_ID,Chunk_Index,Content,Content_Length,Quality_Score,Reliability,Source_Type,Original_Content,Enhancement_Version,averageConfidence,book_name,chunkIndex,enhancementTimestamp,enhancementVersion,fileName,filePath,grade,ocrMethod,publisher,qualityMetrics_chineseCharRatio,qualityMetrics_coherenceScore,qualityMetrics_lengthScore,qualityMetrics_ocrConfidence,semanticFeatures_hasDefinition,semanticFeatures_hasExperiment,semanticFeatures_hasFormulas,semanticFeatures_hasNumbers,semanticFeatures_hasQuestion,semanticFeatures_isTableContent,semanticFeatures_subjectArea,semester,source_file,subject,totalPages,uniqueId
沪科技粤教版_九年级_义务教育教科书·物理九年级下册_chunk_20,20,"出发 , 想一 想 : 能源 危机 是否 正在 向人 类发 起挑 战 ?人类 应当 如何 应对 这场 能源 危机 的挑战呢 ? 72 se 我国 已成 为世界第 三大 能源 生产国 , 现已 探明 的煤 、 石油 、 天然 气的 储量如 图 20 5 所示。 4 请计算一 下 , 我国 能源 的人 均拥 有量 分别 是多 少 ? 谈谈 你的 感想。 (a) 煤的 储量约 为 1.5 x 10 t, 居世 界第 一位 ss 人四 和图 20 5 我国 煤 . 石油 、 Ta 1 下避 天然 气的 储量全 可 (b) 天然 气的 储量约 为 40 x 10 m， (c) 石油的 储量约 为 07x 107 居世 界第 十六 位 30x 10""t, 居世 界第 八位 一车 友王 315 人蚀 1 煤炭、 石油 、 核能 、 太阳能 、 风能 、 地热能 、 潮汐 能等 能源 中 , 哪些是 可再 生能 源 , 哪些是 不可 再生 能源 ? 2. 请从 互联网 上或 有关 资料 中了 解我 国能 源的 状况 ,以及 我国 每年 进口原油量 的情况 , 并做 出评价。 3. 请你 调查一 下 ,出租车平均每 天耗 油量 是多 少 ? 再调查一 下你 所在 城市有 多少 辆出 租车 ? 在一 个月 内 ,这个 城市的 出租车要 消耗多 少汽油 ? 如果 你在 农村 ,就请 调查一 下你 家或 同学家 的摩托车 , 月平均耗 油量 是多 少 ? 再调查一 下你 所在 村子 里有 多少 辆摩托车 ? 在一 个月 内 ,这个 村子 的摩托车 要消耗多 少汽油 ? 73 o b o 920.2 所入 新能 .人开发新 能源 本是 十的 能源 危机 ,世界各 国越 来越 重视能 源的 开发和 节能 , 并下",755,0.33989397272727273,low,ocr,"出 发 , 想 一 想 : 能 源 危 机 是 否 正 在 向 人 类 发 起 挑\n战 ?人 类 应 当 如 何 应 对 这 场 能 源 危 机 的 挑战 呢 ?\n72\n=== 第 79 页 ===\nse\n我 国 已 成 为 世界 第 三\n大 能 源 生产 国 , 现 已 探 明 的\n煤 、 石 油 、 天 然 气 的 储量 如\n图 20 — 5 所 示 。 4\n请 计算 一 下 , 我 国 能\n源 的 人 均 拥 有 量 分 别 是 多\n少 ? 谈 谈 你 的 感想 。\n(a) 煤 的 储量 约 为 1.5 x 10° t, 居 世 界 第 一 位\nss 人\n四 和\n图 20-5 我 国 煤 . 石油 、 ER Ta 1 下 避\n天 然 气 的 储量 全 可\n(b) 天 然 气 的 储量 约 为 40 x 10° m， (c) 石油 的 储量 约 为 07x 107 ~\n居 世 界 第 十 六 位 30x 10""t, 居 世 界 第 八 位\nWA -一\n车 友 王 315 人 蚀\n1 煤炭、 石油 、 核 能 、 太阳能 、 风 能 、 地 热能 、 潮 汐 能 等 能 源 中 , 哪些 是 可\n再 生 能 源 , 哪些 是 不 可 再 生 能 源 ?\n2. 请 从 互联 网 上 或 有 关 资 料 中 了 解 我 国 能 源 的 状况 ,以 及 我 国 每 年 进口\n原油 量 的 情况 , 并 做 出 评价 。\n3. 请 你 调查 一 下 ,出 租车 平均 每 天 耗 油 量 是 多 少 ? 再 调查 一 下 你 所 在 城市\n有 多 少 辆 出 租车 ? 在 一 个 月 内 ,这 个 城市 的 出 租车 要 消耗 多 少 汽油 ? 如 果 你 在\n农村 ,就 请 调查 一 下 你 家 或 同学 家 的 摩托 车 , 月 平均 耗 油 量 是 多 少 ? 再 调查 一\n下 你 所 在 村 子 里 有 多 少 辆 摩托 车 ? 在 一 个 月 内 ,这 个 村 子 的 摩托 车 要 消耗 多\n少 汽油 ?\n73\n=== 第 80 页 ===\nET\no -\nb o -\n$920.2 所 入 新 能 <\n.人 “开发 新 能 源 本\n是 十 的 能 源 危 机 ,世界 各 国 越 来 越 重视 能 源 的 开发 和 节能 , 并 下",2.0,74.20588235294117,沪科技粤教版_九年级_义务教育教科书·物理九年级下册,67,2025-07-21T14:25:05.769Z,2.0,义务教育教科书·物理九年级下册,/Users/LeoQin/Documents/GitHub/PDFconvertor/training_data/初中/物理/沪科技粤教版-上海科学技术出版社、广东教育出版社/九年级/义务教育教科书·物理九年级下册.pdf,九年级,tesseract.js-parallel,unknown,0.783625730994152,0.5,1,74.20588235294117,,,,true,true,,geography,下册,沪科技粤教版_九年级_义务教育教科书·物理九年级下册.json,物理,102,初中_物理_沪科技粤教版_九年级_义务教育教科书·物理九年级下册
沪科技粤教版_九年级_义务教育教科书·物理九年级下册_chunk_21,21,"量是 多少 ? 再调查一 下你 所在 村子 里有 多少 辆摩托车 ? 在一 个月 内 ,这个 村子 的摩托车 要消耗多 少汽油 ? 73 o b o 920.2 所入 新能 .人开发新 能源 本是 十的 能源 危机 ,世界各 国越 来越 重视能 源的 开发和 节能 , 并下 避医 天阳 能和 核能在 内的 各种 新能 源。 本太阳能 一一 永恒的 动力之 源 N 改天了 是不 目天 的能 源， 它不 断向 四周 辐射以 光和 热为 主要形式的 能量 ,其， 中到 大地 球表面的 太阳辐射功率达 1.7x 10"" kW (图 20 6), 是我 国发 电装机客 量 (截至 2011 年底 ) 的 1.7 x 10' 倍。 直接 利用太阳能 不会 污染环境 , 因此它 是最 具开发价值的 能源。 太阳能 到达 地面 后 , 主要通过如 图 20 7 所示 的四 种途径被 吸收或 利用。 ba : (a) 被植物 、 微生物吸收 (b) 使大 气 、 水分 升腾循环一 一到 到地 面的 天阳 辐射 动率 2 K Si BRA 5h : 二本 xxw A N 本 aa (c) 被海洋吸收 (d) 直接利用 0 闪图 20 7 吸收和 利用太阳能 的四 种主要途径图 20 6 大阳 能 74 2 活动 1 你对 磁体了 解多 少请 用图 16 3 所示 的器 材进行实验 , 并研究以 下问题 : 磁体各 处的 磁性是 否一 样 9 哪里最 强 ? 磁体有 几个 磁极 ? 磁极的 指向有 何特点 ? 磁极间 的相互作用有 什么规律 9 y 4 T Sa Ab 条形 磁铁 铁届 锯条和 钢尺 细线 磁针 大头 针图 16 3 实验器 材通过上 述活动 , 你得 出的 结论是 :",744,0.3113798804920913,low,ocr,"量 是 多 少 ? 再 调查 一\n下 你 所 在 村 子 里 有 多 少 辆 摩托 车 ? 在 一 个 月 内 ,这 个 村 子 的 摩托 车 要 消耗 多\n少 汽油 ?\n73\n=== 第 80 页 ===\nET\no -\nb o -\n$920.2 所 入 新 能 <\n.人 “开发 新 能 源 本\n是 十 的 能 源 危 机 ,世界 各 国 越 来 越 重视 能 源 的 开发 和 节能 , 并 下\n避 医 天 阳 能 和 核能 在 内 的 各 种 新 能 源 。 本\n太阳 能 一 一 永恒 的 动力 之 源 N\n改天 了 是 不 目 天 的 能 源 ， 它 不 断 向 四 周 辐射 以 光 和 热 为 主要 形式 的 能 量 ,其\n， 中 到 大 地 球 表面 的 太阳 辐射 功率 达 1.7x 10"" kW (图 20 — 6), 是 我 国 发 电 装机\n客 量 (截至 2011 年 底 ) 的 1.7 x 10' 倍 。 直 接 利用 太阳 能 不 会 污染 环境 , 因此 它 是\n最 具 开发 价值 的 能 源 。\n太阳 能 到 达 地 面 后 , 主要 通过 如 图 20 - 7 所 示 的 四 种 途径 被 吸收 或 利用 。\nba\n: (a) 被 植物 、 微 生物 吸收 (b) 使 大 气 、 水 分 升腾 循环\n- 一 一\n到 到 地 面 的 天 阳 辐 射 动 率 2 K\n Si EAA BRA 5h : 二\n本 xxw A N\n=== /\n-本 aa (c) 被 海洋 吸收 (d) 直接 利用\n- 0 闪 图 20-7 ”吸收 和 利用 太阳 能 的 四 种 主要 途径\n图 20-6 大 阳 能\n74\n=== 第 81 页 ===\n2%\n活动 1 你 对 磁体 了 解 多 少 FE\n请 用 图 16 — 3 所 示 的 器 材 进行 实验 , 并 研究 以 下 问题 : 磁体 各 处 的 磁性 是\n否 一 样 9 哪里 最 强 ? 磁体 有 几 个 磁极 ? 磁极 的 指向 有 何 特点 ? 磁极 间 的 相互 作用\n有 什么 规律 9\ny 4 T Sa\n”Ab\n条 形 磁 铁 铁 届 锯条 和 钢 尺 细 线 磁 针 大 头 针\n图 16-3 ”实验 器 材\n通过 上 述 活动 , 你 得 出 的 结论 是 :",2.0,74.20588235294117,沪科技粤教版_九年级_义务教育教科书·物理九年级下册,68,2025-07-21T14:25:05.769Z,2.0,义务教育教科书·物理九年级下册,/Users/LeoQin/Documents/GitHub/PDFconvertor/training_data/初中/物理/沪科技粤教版-上海科学技术出版社、广东教育出版社/九年级/义务教育教科书·物理九年级下册.pdf,九年级,tesseract.js-parallel,unknown,0.7596153846153846,0.6,1,74.20588235294117,,true,,true,true,,geography,下册,沪科技粤教版_九年级_义务教育教科书·物理九年级下册.json,物理,102,初中_物理_沪科技粤教版_九年级_义务教育教科书·物理九年级下册
沪科技粤教版_九年级_义务教育教科书·物理九年级下册_chunk_22,22,"器材 进行实验 , 并研究以 下问题 : 磁体各 处的 磁性是 否一 样 9 哪里最 强 ? 磁体有 几个 磁极 ? 磁极的 指向有 何特点 ? 磁极间 的相互作用有 什么规律 9 y 4 T Sa Ab 条形 磁铁 铁届 锯条和 钢尺 细线 磁针 大头 针图 16 3 实验器 材通过上 述活动 , 你得 出的 结论是 : (1) 磁体的 磁性最 强 , 叫做磁极 , 每一 个磁体都 有两 个磁极。 (2) 悬挂着 的磁体静止时 , 总是 一端 指南 , 一端 指北 ; 指南的 一端 是磁体的 _ 极 ,又叫做极 , 另一 端是 极 ,又叫做人 极。 (3) 磁极间 相互 作用 的规律是 : 同名磁极 , 异名 磁极。 一块 磁体 ,无论 被分 割得 多么 小 ,总存在南极和 北极。 1931 年 ,英国物理学 家狄 拉克 (P A. M. Dirac, 1902 1984) 从理论上 推测， 存在 着只 有一 个磁极的 粒子一 磁单 极子。 但是 , 直到现在 ,寻找磁 单极 子的 工作仍 在进行中。 人们 发现 , 一些 没有 磁性的 铁质 物体 , 如铁 钉 、 钢尺 等 ,有时 会变 得有 磁性。 这是 怎么回 事呢 ? 下面 , 我们 通过实验来 进行研究。 3 第一 种途径是 通过植物的 光合作用把 太阳能 转化和 储存起 来 ,再以 草木、 沼气、 煤 . 石油 、 天然 气等 燃料的 形式释放出 来 ,第二 种途径是 通过大 气和 水分 的升腾循环 , 再通过风 、 流水、 波浪 、 海流等 释放出 来第 三种 途径是 被海洋吸收 ,成为 海洋的 内能 , 第四 种途径是 被人 们直接利用 , 如太阳能 热水器 、 太阳 灶等 (SS 有省 活动怎样直接利用太阳能 太阳能 一内 能太阳能 一电能太阳能 一化 学能 二",779,0.420558301559792,medium-low,ocr,"器 材 进行 实验 , 并 研究 以 下 问题 : 磁体 各 处 的 磁性 是\n否 一 样 9 哪里 最 强 ? 磁体 有 几 个 磁极 ? 磁极 的 指向 有 何 特点 ? 磁极 间 的 相互 作用\n有 什么 规律 9\ny 4 T Sa\n”Ab\n条 形 磁 铁 铁 届 锯条 和 钢 尺 细 线 磁 针 大 头 针\n图 16-3 ”实验 器 材\n通过 上 述 活动 , 你 得 出 的 结论 是 :\n(1) 磁体 的 “磁性 最 强 , 叫做 磁极 , 每 一 个 磁体 都 有 两 个 磁极 。\n(2) 悬挂 着 的 磁体 静止 时 , 总 是 一 端 指南 , 一 端 指 北 ; 指南 的 一 端 是 磁体 的\n_ 极 ,又 叫做 $ 极 , 另 一 端 是 极 ,又 叫做 人 极 。\n(3) 磁极 间 相 互 作 用 的 规律 是 : 同名 磁极 , 异 名 磁极  。\n一 块 磁体 ,无 论 被 分 割 得 多 么 小 ,总 存在 南极 和 北极 。\n1931 年 ,英国 物理 学 家 狄 拉 克 (P A. M. Dirac, 1902—\n1984) 从 理论 上 推测 ， 存 在 着 只 有 一 个 磁极 的 粒子 一 磁 单 极\n子 。 但 是 , 直到 现在 ,寻找 磁 单 极 子 的 工作 仍 在 进行 中 。\n人 们 发 现 , 一 些 没 有 磁性 的 铁 质 物体 , 如 铁 钉 、 钢 尺 等 ,有 时 会 变 得 有 磁性 。\n这 是 怎么 回 事 呢 ? 下 面 , 我 们 通过 实验 来 进行 研究 。\n3\n=== 第 82 页 ===\n第 一 种 途径 是 通过 植物 的 光合 作用 把 太阳 能 转化 和 储存 起 来 ,再 以 草木、\n沼气、 煤 . 石油 、 天 然 气 等 燃料 的 形式 释放 出 来 ,第 二 种 途径 是 通过 大 气 和 水 分\n的 升腾 循环 , 再 通过 风 、 流 水、 波浪 、 海流 等 释放 出 来 第 三 种 途径 是 被 海洋\n吸收 ,成 为 海洋 的 内 能 , 第 四 种 途径 是 被 人 们 直接 利用 , 如 太阳 能 热水器 、 太\n阳 灶 等\n(SS\n有 省\n活动 怎样 直接 利用 太阳 能\n太阳 能 一 内 能 太阳 能 一 电能 太阳 能 一 化 学 能\nES 二 <",2.0,74.20588235294117,沪科技粤教版_九年级_义务教育教科书·物理九年级下册,69,2025-07-21T14:25:05.769Z,2.0,义务教育教科书·物理九年级下册,/Users/LeoQin/Documents/GitHub/PDFconvertor/training_data/初中/物理/沪科技粤教版-上海科学技术出版社、广东教育出版社/九年级/义务教育教科书·物理九年级下册.pdf,九年级,tesseract.js-parallel,unknown,0.8172043010752689,0.5,1,74.20588235294117,true,true,,true,true,,physics,下册,沪科技粤教版_九年级_义务教育教科书·物理九年级下册.json,物理,102,初中_物理_沪科技粤教版_九年级_义务教育教科书·物理九年级下册
沪科技粤教版_九年级_义务教育教科书·物理九年级下册_chunk_23,23,"出巨大能 量 , 原子弹 爆炸就 是人 着这 种情况 (图 20 11)。 计算表明 , 1kg 铀全 部裂变释放的 能量 , 相当于 2700t 标准 煤完全燃烧放出的 能量。 地球 上的 其他 能源 都无 法与 核能相 比。 然而 , 要安全利用核能 , 就必须控制产生中 子的 数量和 速度 , 核反应堆 中就 有这 样的 装置。 图 20 12 是核电站 的外 景和 工作流程示意图。 控制棒 核反应堆 水受热变 成素 汽二 1 证主公全 站几 水泥 外充 Sapd i 3 全 fl g P, 2el 王 : sr 让时 六夺回让 型二 本有 转 , 使发 电机发 电 (a) 我国 秦山核电站 (b) 核电站 工作流程示意图 图 20 12 核电站 核发电 是人 类利用核能的 主要方式 , 世界上 自 1954 年第 一座 核电站 建成以 来 , 至今 已有 很多 国家和 地区 的核电厂 在运行。 我国 大陆 正在 运行的 核电站 有 6 座 , 核发电量仅 占总 发电量的 1.8 6, 目前国家正在制定核电安全规划和 发展 规划。 77 VBFEE HBRE 核聚变是 释放核能的 另一 种方式。 科学家 研究发 现 , 在超 高温 条件 下 ,可将 两种 质量较 轻的 原子核 (如和 饼和 乞 )， 本一 一聚合成 一个 较重 的原子核 , 这种 反应叫 e p 做核 聚变 (图 20 13)。 核聚变能 够逢 全汶 o 放出比 核裂变更 加巨大的 能量。 太阳 能就 是来 自于 太阳内 的核 聚变。 核聚 变要 求所 和气 具有 很高 的温 an 度 , 在反应过 程中 要把 反应物质加 热到 0 千万 摄氏度 以上 才能发 生大 规模的 核聚 变。 因此 , 聚变反应又 称为 热核反应。",761,0.3005853730703259,low,ocr,"出 巨大 能 量 , 原子 弹 爆炸 就 是 人 着\n这 种 情况 (图 20 - 11)。\n计算 表明 , 1kg 铀 全 部 裂变 释放 的 能 量 , 相当 于 2700t 标 准 煤 完全 燃烧 放出\n的 能 量 。 地 球 上 的 其 他 能 源 都 无 法 与 核能 相 比 。\n然而 , 要 安全 利用 核能 , 就 必须 控制 产生 中 子 的 数量 和 速度 , 核反应 堆 中 就\n有 这 样 的 装置 。 图 20 — 12 是 核电 站 的 外 景 和 工作 流程 示意 图 。\n控制 棒\n核反应 堆\n水 受热 变 成 素 汽 二\n| 1 证 > 主公 全 站 几 水 泥 外 充\nSapd\n—i 3 RS 全 fl¥g P, 2el\n| 王 : sr CE\n让 时 六 夺回\n让 = 型 二 本 — 有\n转 , 使 发 电机 发 电\n(a) 我 国 秦山 核电 站 (b) 核电 站 工作 流程 示意 图\n图 20-12 核电 站\n核发 电 是 人 类 利用 核能 的 主要 方式 , 世界 上 自 1954 年 第 一 座 核电 站 建成 以\n来 , 至 今 已 有 很 多 国家 和 地 区 的 核电 厂 在 运行 。 我 国 大 陆 正 在 运行 的 核电 站 有\n6 座 , 核发 电量 仅 占 总 发 电量 的 1.8%6, 目前 国家 正在 制定 核电 安全 规划 和 发 展\n规划 。\n77\n=== 第 85 页 ===\nVBFEE—HBRE\n核 聚变 是 释放 核能 的 另 一 种 方式 。\n科学 家 研究 发 现 , 在 超 高 温 条 件 下 ,可\n将 两 种 质量 较 轻 的 原子 核 (如 和 饼 和 乞 )， 本 /一 @ 一\n聚合 成 一 个 较 重 的 原子 核 , 这 种 反应 叫 e p\n做 核 聚变 (图 20 - 13)。 核 聚变 能 够 逢 全 汶 o\n放出 比 核 裂变 更 加 巨大 的 能 量 。 太 阳 能\n就 是 来 自 于 太阳 内 的 核 聚变 。\n核 聚 变 要 求 所 和 气 具 有 很 高 的 温 an\n度 , 在 反应 过 程 中 要 把 反应 物质 加 热 到 0 RREER\n千 万 摄氏 度 以 上 才能 发 生 大 规模 的 核 聚 变 。 因 此 , 聚变 反应 又 称 为 热 核反应 。",2.0,74.20588235294117,沪科技粤教版_九年级_义务教育教科书·物理九年级下册,72,2025-07-21T14:25:05.769Z,2.0,义务教育教科书·物理九年级下册,/Users/LeoQin/Documents/GitHub/PDFconvertor/training_data/初中/物理/沪科技粤教版-上海科学技术出版社、广东教育出版社/九年级/义务教育教科书·物理九年级下册.pdf,九年级,tesseract.js-parallel,unknown,0.7996357012750456,0.5,1,74.20588235294117,,,,true,,,physics,下册,沪科技粤教版_九年级_义务教育教科书·物理九年级下册.json,物理,102,初中_物理_沪科技粤教版_九年级_义务教育教科书·物理九年级下册
沪科技粤教版_九年级_义务教育教科书·物理九年级下册_chunk_24,24,"聚变能 够逢 全汶 o 放出比 核裂变更 加巨大的 能量。 太阳 能就 是来 自于 太阳内 的核 聚变。 核聚 变要 求所 和气 具有 很高 的温 an 度 , 在反应过 程中 要把 反应物质加 热到 0 千万 摄氏度 以上 才能发 生大 规模的 核聚 变。 因此 , 聚变反应又 称为 热核反应。 目前 , 核聚 变应 用只 限于核 爆炸。 人类 正致力于 探索控制核 聚变的 途径， 使热 核反应的 能量 缓慢地 释放出 来。 热核反应所 需要的 材料气 "", 在海水中 有着 丰富的 储量 , 1 工海水中 大约 有 0.03g 的气 , 它发 生热 核反应时 放出的 能量 大约 与燃烧 300 工汽油放出的 能量 相当 , 因此 , 一旦 受控 热核反应得 到实现 , 人类 利用能 源的 结构将 发生 重大变化。 目前 , 我国 和世界各 国都在 致力于 受控 热核 反应的 研究 , 我国 的研究成 果已 位于 世界前 列。 当今 , 人类 可以 利用的 一次 能源 中 , 约 90 6 是不 可再 生的 化石 能源 , 用一 点就 少一 点。 可再 生的 、 洁净 的 、 潜力 巨大 的能 源 , 如太阳能 、 风能 、 地热能等 的开发仅 处于 起步 阶段 , 要大 规模应 用还 需经 历较 长的 时间。 因此 , 加快 新能 源的 开发 ,是人 类目前的 一项 十分 重要而 又紧迫的 工作。 图 20 14 1967 年 , 我国成 功图 20 15 我国研究受 控热 核反应的 装置试 爆第 一颗 气弹 一一 环流缮 二号 A 装置 和 wiii 上 2 省 : 攻二 二 B 加和 本一 he S ic 3 2 和只 5 1 二局 1 7s S 个卫 加人 起和 县 : RE",754,0.30623187088553827,low,ocr,"聚变 能 够 逢 全 汶 o\n放出 比 核 裂变 更 加 巨大 的 能 量 。 太 阳 能\n就 是 来 自 于 太阳 内 的 核 聚变 。\n核 聚 变 要 求 所 和 气 具 有 很 高 的 温 an\n度 , 在 反应 过 程 中 要 把 反应 物质 加 热 到 0 RREER\n千 万 摄氏 度 以 上 才能 发 生 大 规模 的 核 聚 变 。 因 此 , 聚变 反应 又 称 为 热 核反应 。\n目前 , 核 聚 变 应 用 只 限于 核 爆炸 。 人 类 正 致力 于 探索 控制 核 聚变 的 途径 ，\n使 热 核反应 的 能 量 缓慢 地 释放 出 来 。 热 核反应 所 需要 的 材料 * 气 "", 在 海水 中 有\n着 丰富 的 储量 , 1 工 海水 中 大 约 有 0.03g 的 气 , 它 发 生 热 核反应 时 放出 的 能 量 大\n约 与 燃烧 300 工 汽油 放出 的 能 量 相 当 , 因此 , 一 旦 受 控 热 核反应 得 到 实现 , 人 类\n利用 能 源 的 结构 将 发 生 重大 变化 。 目 前 , 我 国 和 世界 各 国都 在 致力 于 受 控 热 核\n反应 的 研究 , 我 国 的 研究 成 果 已 位 于 世界 前 列 。\n当今 , 人 类 可 以 利用 的 一 次 能 源 中 , 约 90%6 是 不 可 再 生 的 化 石 能 源 , 用 一 点\n就 少 一 点 。 可 再 生 的 、 洁 净 的 、 潜 力 巨 大 的 能 源 , 如 太阳 能 、 风 能 、 地 热能 等 的\n开发 仅 处 于 起 步 阶段 , 要 大 规模 应 用 还 需 经 历 较 长 的 时 间 。 因 此 , 加 快 新 能 源\n的 开发 ,是 人 类 目前 的 一 项 十 分 重要 而 又 紧迫 的 工作 。\n图 20-14 1967 年 , 我国 成 功 图 20-15 我国 研究 受 控 热 核反应 的 装置\n试 爆 第 一 颗 气 弹 一 一 环流 缮 二 号 A 装 置\n— [和 ~ — wiii 上\n2 NT 省 : 攻 二\nES\n二 B 加 和 本 一 - he | S #] ic 3\n2\n和\n只 5 © 1 二 - ES [= 局 /1 SEAS\n7s S 个 卫 加 人 起 ”和 县 :\nRE",2.0,74.20588235294117,沪科技粤教版_九年级_义务教育教科书·物理九年级下册,73,2025-07-21T14:25:05.769Z,2.0,义务教育教科书·物理九年级下册,/Users/LeoQin/Documents/GitHub/PDFconvertor/training_data/初中/物理/沪科技粤教版-上海科学技术出版社、广东教育出版社/九年级/义务教育教科书·物理九年级下册.pdf,九年级,tesseract.js-parallel,unknown,0.8310940499040307,0.6,1,74.20588235294117,,,,true,,,chemistry,下册,沪科技粤教版_九年级_义务教育教科书·物理九年级下册.json,物理,102,初中_物理_沪科技粤教版_九年级_义务教育教科书·物理九年级下册
