Chunk_ID,Chunk_Index,Content,Content_Length,Quality_Score,Reliability,Source_Type,Original_Content,Enhancement_Version,averageConfidence,book_name,chunkIndex,enhancementTimestamp,enhancementVersion,fileName,filePath,grade,ocrMethod,publisher,qualityMetrics_chineseCharRatio,qualityMetrics_coherenceScore,qualityMetrics_lengthScore,qualityMetrics_ocrConfidence,semanticFeatures_hasDefinition,semanticFeatures_hasExperiment,semanticFeatures_hasFormulas,semanticFeatures_hasNumbers,semanticFeatures_hasQuestion,semanticFeatures_isTableContent,semanticFeatures_subjectArea,semester,source_file,subject,totalPages,uniqueId
沪科技粤教版_八年级_义务教育教科书·物理八年级上册_chunk_25,25,"YY 名沉 活动 3 你身上的 尺 ""和表 一上 面所 说的 长度 和时 间的 测量 ,都要 用到 测量工具。 假如 你身边什么工具都 没有 ,你能 否对 长度 .时间进 行一 些估 测呢 ? A. 你身上的 "" 尺 "" 现在请 你跟 同学 合作 , 测出 你身体上 某些 部位 的尺寸 (图 1 一 27)。 请先 用眼睛估 测课 桌的 长度 , 再用 你身上的 "" 尺 "" 粗测 ,最后 用刻度尺 测量 , 看看 这三 个结果之 间相 差多 少。 8 ; i : 2 人册 er ds (a) (b) (c) 图 1 27 身体上 的一 些尺 十 B、 你身上的 表 "" 在正常情况下 , 你的 脉掩 1 min 跳动 多少 次 ?能否 用它 作为 "" 表 "" 来估 测时 间呢 ? 请试 一试， A onEnotL 王 1 你能 用几 种方法测量图 1 一 28 所示 的枉 贺的 周长 ? 请试 一试 , 并把 测量步骤和 方法写 出来。 C 图 1 一 28 图 1 一 29 16 2. 如图 1 一 29 所示 , 将细 铜丝 在铅笔上 紧密排 绕 25 圈 , 则细 铜丝 的直 径为 mm。 3. 仔细观察全 国地 图 , 想一 想 : 怎样测量地 图中 上海 到北京的 京沪 高铁路线 的长 度 ? 洲量 方案 TeE 二二 京沪 高铁路线 的长 度约 为 km。 民生 Bhr 人 4. 警方在 案发 现场发 现一 个脚印世 天加 少 25，26 人浊 (图 1 30)。 根据 医学研究 ,通常人 站 gume eme y 立时的 身高约 是脚 长的 7 倍。 据此 可判 知 E 犯罪嫌疑人 的身高约 为 (。 )。 隐人 2 2 A. 1.65 m B.1.75m 有 r C.1.85m D.1.95m E1 30 4 二 . 4。 尝试科学探究云 子",791,0.31482192586071983,low,ocr,"YY\n名 沉\n活动 3 你 身上 的 “ 尺 ""和 “ 表 ” 一\n上 面 所 说 的 长 度 和 时 间 的 测量 ,都 要 用 到 测量 工具 。 假 如 你 身边 什么 工具\n都 没有 ,你 能 否 对 长 度 .时间 进 行 一 些 估 测 呢 ?\nA. 你 身上 的 "" 尺 ""\n现在 请 你 跟 同 学 合作 , 测 出 你 身体 上 某 些 部 位 的 尺寸 (图 1 一 27) 。\n请 先 用 眼睛 估 测 课 桌 的 长 度 , 再 用 你 身上 的 "" 尺 "" 粗 测 ,最 后 用 刻度 尺 测\n量 , 看 看 这 三 个 结果 之 间 相 差 多 少 。\n&8 ;\ni :\n2\n人 册 er ds\nMA\n(a) (b) (c)\n图 1-27 身体 上 的 一 些 尺 十\nB、 你 身上 的 “ 表 ""\n在 正常 情况 下 , 你 的 脉 掩 1 min 跳 动 多 少 次 ?能 否 用 它 作为 "" 表 "" 来 估 测 时 间\n呢 ? 请 试 一 试 ，\nA\nGF onEnotL 王 -\n1 你 能 用 几 种 方法 测量 图 1 一 28 所 示 的 枉 贺 的 周 长 ? 请 试 一 试 , 并 把 测量\n步骤 和 方法 写 出 来 。\nC\n图 1 一 28 图 1 一 29\n16\n=== 第 60 页 ===\n2. 如 图 1 一 29 所 示 , 将 细 铜 丝 在 铅笔 上 紧密 排 绕 25 圈 , 则 细 铜 丝 的 直\n径 为 mm 。\n3. 仔细 观察 全 国 地 图 , 想 一 想 : 怎样 测量 地 图 中 上 海 到 北京 的 京 沪 高 铁路\n线 的 长 度 ?\n洲 量 方案 TeE| 二 二\n京 沪 高 铁路 线 的 长 度 约 为 “km。 民生 Bhr 人\n4. 警方 在 案 发 现场 发 现 一 个 脚印 “| 世 天 加 少 25 ，26 人 浊\n(图 1 -30) 。 根 据 医学 研究 ,通常 人 站 gume—  eme y\n立时 的 身高 约 是 脚 长 的 7 倍 。 据 此 可 判 知  E\n犯罪 嫌疑 人 的 身高 约 为 ( 。 ) 。 隐 人 2 2\nA. 1.65 m B.1.75m > 有 £ r\nC.1.85m D.1.95m E1-30\n- 4 二\n|. 4。 尝试 科学 探究\n云 子",2.0,75.28873239436619,沪科技粤教版_八年级_义务教育教科书·物理八年级上册,51,2025-07-21T14:25:05.892Z,2.0,义务教育教科书·物理八年级上册,/Users/LeoQin/Documents/GitHub/PDFconvertor/training_data/初中/物理/沪科技粤教版-上海科学技术出版社、广东教育出版社/八年级/义务教育教科书·物理八年级上册.pdf,八年级,tesseract.js-parallel,unknown,0.6727941176470589,0.5,1,75.28873239436619,,true,,true,true,,unknown,上册,沪科技粤教版_八年级_义务教育教科书·物理八年级上册.json,物理,142,初中_物理_沪科技粤教版_八年级_义务教育教科书·物理八年级上册
沪科技粤教版_八年级_义务教育教科书·物理八年级上册_chunk_26,26,"加少 25，26 人浊 (图 1 30)。 根据 医学研究 ,通常人 站 gume eme y 立时的 身高约 是脚 长的 7 倍。 据此 可判 知 E 犯罪嫌疑人 的身高约 为 (。 )。 隐人 2 2 A. 1.65 m B.1.75m 有 r C.1.85m D.1.95m E1 30 4 二 . 4。 尝试科学探究云 子科学的 核心是 探究 , 学习 物理 就要 学会 科学探究。 探究摆 的奥秘最 近 , 小慧 家的 摆钟 走快 了 , 小慧 就请 邻居张 师傅 帮忙 修理。 只见 张师傅将 摆锤 下面 的螺母拧 了几 Ci3 全下 , 摆钟 走时就 准了。 人 Re 小慧 好奇 地看 完了这 的个 过程 , 她想 : 规巍 鼎证 o (全张 师傅拧 钟摆 下面 的 prmges Wed ih 螺母对 摆动的 快慢会 产生行 科学探究的 第 _ v L ) 什么影响呢 ? 步 , 爱因 斯坦 说过， 这个 钟摆 来来 回回摆 提出问题有 时比 和 W 动 , 摆动一 次所 需的 时间 由天 问题更 重要么 决定昌 1 一 31)? fra 定时四 ) 图 1 31 小慧 的疑问 17 小慧 和同班同学对 这些 问题 进行 了猜想。 了光 放 wm 牛天 说过 ,没有伪 2 晶的 猜测 , 就不 会 wO 钟摆 下面 的螺 的有 计会 影响摆 的长 短 , 看来 , 摆区 四计 会形 啊 kZ, , d3x 起 _ NAR2IN 由动 的快慢跟 摆的 长短 有国有全 S 猜想不 是胡 猜乱 想， 摆动的 快慢可 局它 是以 自己的 经验 和加 能跟 摆偏离的 角度知识为 基础作出的 一三 关 . ri 种试探性 解释。 本四 图 1 一 32 对摆 钟走时快慢原因的 各种 猜想 niEE 小慧 他们起,",767,0.3041757737784733,low,ocr,"加 少 25 ，26 人 浊\n(图 1 -30) 。 根 据 医学 研究 ,通常 人 站 gume—  eme y\n立时 的 身高 约 是 脚 长 的 7 倍 。 据 此 可 判 知  E\n犯罪 嫌疑 人 的 身高 约 为 ( 。 ) 。 隐 人 2 2\nA. 1.65 m B.1.75m > 有 £ r\nC.1.85m D.1.95m E1-30\n- 4 二\n|. 4。 尝试 科学 探究\n云 子\n科学 的 核心 是 探究 , 学 习 物 理 就 要 学 会 科学 探究 。\n探究 摆 的 奥秘 |\n最 近 , 小 慧 家 的 摆 钟 走 快 了 , 小 慧 就 请 邻居 张 师\n傅 帮 忙 修理 。 只 见 张 师傅 将 摆 锤 下 面 的 螺母 拧 了 几 Ci3 全\n下 , 摆 钟 走时 就 准 了 。 人 Re\n小 慧 好 奇 地 看 完了 这 的\n个 过 程 , 她 想 : 规 巍 鼎 证 o (全\n张 师傅 拧 钟 摆 下 面 的 prmges \ Wed ih -\n螺母 对 摆动 的 快慢 会 产生 行 科学 探究 的 第 _ v L )\n什么 影响 呢 ? 步 , 爱 因 斯 坦 说 过 ，\n这 个 钟 摆 来 来 回回 摆 提出 问题 有 时 比 和 W\n动 , 摆动 一 次 所 需 的 时 间 由 天 问题 更 重要 |\n么 决定 昌 1 一 31)?\nfra 定时 四 ) 图 1-31 小 慧 的 疑问\n17\n=== 第 61 页 ===\n小 慧 和 同班 同学 对 这 些 问 题 进 行 了 猜想 。\n了 光 放\nwm\n牛 天 说 过 ,没有 伪 2 -\n晶 的 猜测 , 就 不 会 wO 钟 摆 下 面 的 螺 SS\n的 有 计 会 影响 摆 的 长 短 , 看 来 , 摆 区-\n四 计 会 形 啊 kZ, , d3x 起 _\nNAR2IN <\n由 动 的 快慢 跟 摆 的 长 短 有\n国有 全 S—\n猜想 不 是 胡 猜 乱 想 ， + 摆动 的 快慢 可 局\n它 是 以 自己 的 经 验 和 加 能 跟 摆 偏离 的 角度\n知识 为 基础 作出 的 一 三 关 . ri\n种 试探 性 解释 。 本 四\n图 1 一 32 ”对 摆 钟 走时 快慢 原因 的 各 种 猜想\nniEE\n小 慧 他们 起,",2.0,75.28873239436619,沪科技粤教版_八年级_义务教育教科书·物理八年级上册,52,2025-07-21T14:25:05.892Z,2.0,义务教育教科书·物理八年级上册,/Users/LeoQin/Documents/GitHub/PDFconvertor/training_data/初中/物理/沪科技粤教版-上海科学技术出版社、广东教育出版社/八年级/义务教育教科书·物理八年级上册.pdf,八年级,tesseract.js-parallel,unknown,0.7132216014897579,0.5,1,75.28873239436619,,,,true,true,,mathematics,上册,沪科技粤教版_八年级_义务教育教科书·物理八年级上册.json,物理,142,初中_物理_沪科技粤教版_八年级_义务教育教科书·物理八年级上册
沪科技粤教版_八年级_义务教育教科书·物理八年级上册_chunk_27,27,"线悬挂小 球做 实验第 一组 实验结果 (同样长 度的 悬线 , 不同 的小 球 ) : 忆间 人摆动次 数小 球种 由上 表可 知， 铜球 摆动一 次平均所 需的 时间 为。 铝球 摆动一 次平均所 需的 时间 为。 第二 组实验结果 (同一小 球 , 不同 长度 的悬 线 )， 克忆 摆动次 数 19 由上 表可 知 : 悬线 长 80 cm 的摆 球摆动一 次平均所 需的 时间 为。 悬线 长 160 em 的摆 球摆动一 次平均所 需的 时间 为。 同学们 对这 些实验数据进行比较分 析 , 得到 了下 面的 一些 结论 : 分丰 与论 让实验数据只 是一 7 N N 人 A 堆原始材料 , 必须通过悬 线长 度相等时， 摆球 的摆动快 人论证 H S， 2U7 慢与 摆球 的轻重 (材料 ) 一结论。 好比 建造房子， 摆球 摆动一 次的 时间 只跟 悬线 的苇 块 、 黄沙 、 水泥 等村 有关 ; 悬线 越长 , 摆球 的摆动料 , 要经 过设计 、 施工装饰 , 才能变 成宏伟的 J 建筑六 从探究过 程是 去避 当 e 上面 这些 结论是 否可 靠 ? 是否 与张 师傅的 操作吻 的结果是 否合理， 合 ? 小慧 与同学七 嘴八 舌地 议论起 来 (图 1 一 37)。 探究过 程中 是否 Ah 相间加 由见 张师 传把 螺母往 下拧， 分的 思考。 增加长 度的 作用 ,使摆动变 慢 , 原来榴 走快 的钟 就走 准了。 张师 传的 做法 我测 的援 动跟 我们 实验的 结论是 一致 的时 间可 够准 呢。 人了 汪如 果我 人全 查力 的影响 ,名的 几次 实验 , 总结 出来 的人 m 4 可能 跟它 所处 的地 点有 关",735,0.3385583718309859,low,ocr,"线 悬挂 小 球 做 实验\n第 一 组 实验 结果 (同样 长 度 的 悬 线 , 不 同 的 小 球 ) :\n忆 间 人 摆动 次 数\n小 球 种\n由 上 表 可 知 ，\n铜 球 摆动 一 次 平均 所 需 的 时 间 为 。\n铝 球 摆动 一 次 平均 所 需 的 时 间 为 “ 。\n第 二 组 实验 结果 (同一 小 球 , 不 同 长 度 的 悬 线 ) ，\n克 忆 /摆动 次 数\n19\n=== 第 63 页 ===\n由 上 表 可 知 :\n悬 线 长 80 cm 的 摆 球 摆动 一 次 平均 所 需 的 时 间 为 。\n悬 线 长 160 em 的 摆 球 摆动 一 次 平均 所 需 的 时 间 为 。\n同学 们 对 这 些 实验 数据 进行 比较 分 析 , 得 到\n了 下 面 的 一 些 结论 : 分 丰 与 论 让\n实验 数据 只 是 一\n7 - — N N 人 A\\n堆 原始 材料 , 必须 通过\n| 悬 线 长 度 相等 时 ， 摆 球 的 摆动 快 | 人 论证 H\nS ， 2U7\n| 慢 与 摆 球 的 轻重 (材料 ) 一 | 结论 。 好 比 建造 房子 ，\n摆 球 摆动 一 次 的 时 间 只 跟 悬 线 的 苇 块 、 黄 沙 、 水 泥 等 村\n| 有关 ; 悬 线 越 长 , 摆 球 的 摆动 | 料 , 要 经 过 设计 、 施工\n装饰 , 才能 变 成 宏伟 的\nCU J 建筑\n六 从\n探究 过 程 是\n去 避 当 e 上 面 这 些 结论 是 否 可 靠 ? 是 否 与 张 师傅 的 操作 吻\n的 结果 是 否 合理 ， 合 ? 小 慧 与 同学 七 嘴 八 舌 地 议论 起 来 (图 1 一 37) 。\n探究 过 程 中 是 否\nII Ah 相间 加 由\nII 见 张 师 传 把 螺母 往 下 拧 ，\n分 的 思考 。 增加 长 度 的 作用 ,使 摆动 变 慢 , 原来\n榴 走 快 的 钟 就 走 准 了 。 张 师 传 的 做 法\n{ 我 测 的 援 动 跟 我 们 实验 的 结论 是 一 致 的\n时 间 可 够 准 呢 。\n人\nAN\n了 汪\n如 果 我 人 全 查 力 的 影响 ,名 的\n几 次 实验 , 总 结 出 来 的 人 m 4 可 | 能 跟 它 所 处 的 地 点 有 关",2.0,75.28873239436619,沪科技粤教版_八年级_义务教育教科书·物理八年级上册,54,2025-07-21T14:25:05.892Z,2.0,义务教育教科书·物理八年级上册,/Users/LeoQin/Documents/GitHub/PDFconvertor/training_data/初中/物理/沪科技粤教版-上海科学技术出版社、广东教育出版社/八年级/义务教育教科书·物理八年级上册.pdf,八年级,tesseract.js-parallel,unknown,0.8565815324165029,0.6,1,75.28873239436619,,true,,true,true,,unknown,上册,沪科技粤教版_八年级_义务教育教科书·物理八年级上册.json,物理,142,初中_物理_沪科技粤教版_八年级_义务教育教科书·物理八年级上册
沪科技粤教版_八年级_义务教育教科书·物理八年级上册_chunk_28,28,"机的 扬声器上 ( 国 2 人。 2 3) ,感受一 下扬声器和 机图 2 一 2 观察音 又振动图 2 3 感受振动身 的振动。 上壕 活动表明 , 声音 (sound) 是由 于物体振动而 产生的。 事实 上 , 各种 物体 都可 以发 出声音。 人说 话 、 唱歌是 哗里 的声带振动发 声的 , 昨纯 颜动 妈膀 来唱歌 ""。 物理学中 , 把正在发 声的 物体叫做声 源 (sound source )。 现在你 能理解由 斯卡 的实验了 吗 ? 请你 观察周围的 发声 现象 , 并找 出其 中的 振动物体。 24 声音是 怎样传播的 明声音在 空气中 是怎样传播的 ? 如图 2 一 4 所示 , 音又 振动时 , 当叉 股向 左运 动时 , 压缩了 左侧 的空气 , 这部 分空气变 密 , 而右 侧的 空气却 稀玻 了 ; 当又 股向 右运 动时 , 右侧 的空气变 密 , 而左 侧的 空气却 稀玻 了 ' 随着 音又 的不 断振 动 , 空气中 就形成了 玻密 相间的 波动向远 处传播 , 这就 是声波 (sound wave )。 声音在 传播的 过程 中 , 如遇 到障碍物 就会 被反射回来 , 反射回来的 声音叫 做回 声。 图 2 4 音又 振动时 , 邻近的 空气随 音又 振动 , 形成一 系列玻 密相间的 波动向 四周 传播 , 这就 是声波声音是 一种 波 , 不仅 能被 听见 , 而且 可以 被看 到。 殊这 将声音信号通过话筒, 转换成 电信号 , 再通过计算机 或一 种叫 示波器的 仪器 , 就能 在显示屏 上显示出 声音的 波形。 图 2 一 5(a) 是音 又振动时 , 示波器显示的 声波波形 ,图 2 5(b) 是同学唱歌时 ,示波器显示的 声波波形。 请比较一 下 , 这两 种波形是 否相同 ?9 信人",783,0.4562807652098156,medium-low,ocr,"机 的 扬声器 上 ( 国\n2 人。 2-3) ,感受 一 下 扬声器 和 机\n图 2 一 2 观察 音 又 振动 ”图 2-3 ”感受 振动 身 的 振动 。\n上 壕 活动 表明 , 声音 (sound) 是 由 于 物体 振动 而 产生 的 。 事 实 上 , 各 种 物\n体 都 可 以 发 出 声音 。 人 说 话 、 唱歌 是 哗 里 的 声带 振动 发 声 的 , 昨 纯 颜 动 妈 膀\n来 “唱歌 ""。 物 理学 中 , 把 正在 发 声 的 物体 叫做 声 源 (sound source ) 。\n现在 你 能 理解 由 斯 卡 的 实验 了 吗 ?\n请 你 观察 周围 的 发 声 现象 , 并 找 出 其 中 的 振动 物体 。\n24\n=== 第 69 页 ===\n声音 是 怎样 传播 的 明\n声音 在 空气 中 是 怎样 传播 的 ?\n如 图 2 一 4 所 示 , 音 又 振动 时 , 当 叉 股 向 左 运 动 时 , 压缩 了 左 侧 的 空气 , 这 部\n分 空气 变 密 , 而 右 侧 的 空气 却 稀 玻 了 ; 当 又 股 向 右 运 动 时 , 右 侧 的 空气 变 密 , 而\n左 侧 的 空气 却 稀 玻 了 ……' 随 着 音 又 的 不 断 振 动 , 空气 中 就 形成 了 玻 密 相间 的 波\n动向 远 处 传播 , 这 就 是 声波 (sound wave ) 。\n声音 在 传播 的 过 程 中 , 如 遇 到 障碍 物 就 会 被 反射 回来 , 反射 回来 的 声音 叫\n做 回 声 。\n图 2-4 音 又 振动 时 , 邻近 的 空气 随 音 又 振动 , 形成 一 系列\n玻 密 相间 的 波动 向 四 周 传 播 , 这 就 是 声波\n声音 是 一 种 波 , 不 仅 能 被 听见 , 而 且 可 以 被 “看 到 ”。\nTS\n殊 这\n将 声音 信号 通过 话筒, 转换 成 电信 号 , 再 通过 计算 机 或 一 种 叫 示波器 的 仪\n器 , 就 能 在 显示 屏 上 显示 出 声音 的 波形 。\n图 2 一 5(a) 是 音 又 振动 时 , 示波器 显示 的 声波 波形 ,图 2-5(b) 是 同学 唱歌\n时 ,示波器 显示 的 声波 波形 。 请 比较 一 下 , 这 两 种 波形 是 否 相同 ?9\n信人",2.0,75.28873239436619,沪科技粤教版_八年级_义务教育教科书·物理八年级上册,58,2025-07-21T14:25:05.892Z,2.0,义务教育教科书·物理八年级上册,/Users/LeoQin/Documents/GitHub/PDFconvertor/training_data/初中/物理/沪科技粤教版-上海科学技术出版社、广东教育出版社/八年级/义务教育教科书·物理八年级上册.pdf,八年级,tesseract.js-parallel,unknown,0.8121645796064401,0.5,1,75.28873239436619,true,true,,true,true,,unknown,上册,沪科技粤教版_八年级_义务教育教科书·物理八年级上册.json,物理,142,初中_物理_沪科技粤教版_八年级_义务教育教科书·物理八年级上册
沪科技粤教版_八年级_义务教育教科书·物理八年级上册_chunk_29,29,"S 殊这 将声音信号通过话筒, 转换成 电信号 , 再通过计算机 或一 种叫 示波器的 仪器 , 就能 在显示屏 上显示出 声音的 波形。 图 2 一 5(a) 是音 又振动时 , 示波器显示的 声波波形 ,图 2 5(b) 是同学唱歌时 ,示波器显示的 声波波形。 请比较一 下 , 这两 种波形是 否相同 ?9 信人四 区本 人有 全一 V 7 一 (a) 音又 振动时 , 示波器显示出 的声波波形 (b) 唱歌时 , 示波器显示出 的声波波形图 2 5 比较波形 25 用声音的 传播需要介 局 (6 区这 A. 真空能 传声 吗如 图 2 6 所示 , 将手机悬挂在 广口 瓶中， 拨通 手机 ,手机发 出铃声 , 同时显示屏 发光。 这时 我们 能清楚地 听到 铃声。 用抽 气机 慢慢 抽出瓶 中的 空气 ,你听 到的 通和 锥声 发生 了什么变化 ? 抽气 到一 定程度时 ,还 PiWR 能听 到铃声吗 ? 图 2 6 真空能 传声 吧技 掉抽 气管 ,让空气进入瓶 中 , 你是 否又 能听 到铃声 9 Xs) 这个 实验表明 :真空。 从 NSh B， 听水 中传 出的 声音如 图 2 一 7 所示 , 把耳朵贴 在玻璃水 槽的 外和 一癌 土 、 上 、 上二 一面 , 能否 听到 水中 散击 石块 的声音 ? 请试 一试 图 2 7 水中 传声 C， 隔墙 听音 如图 2 8 所示 , 一位 同学在 室外用 手轻山墙体 , 室内的 同学把 耳杀 贴在 墙上 ,能否 中。 寂轩 e 人见 基击 声 9 当耳 采离 开墙 后， 划易 还能 听见声音吗 ? 比较一 下， 、 这两 种听 音方式的 效果是 否一 中样 ? 图 2 8 了喇 墙听 音 26 大汉 汪",746,0.30664194085981855,low,ocr,"S\n殊 这\n将 声音 信号 通过 话筒, 转换 成 电信 号 , 再 通过 计算 机 或 一 种 叫 示波器 的 仪\n器 , 就 能 在 显示 屏 上 显示 出 声音 的 波形 。\n图 2 一 5(a) 是 音 又 振动 时 , 示波器 显示 的 声波 波形 ,图 2-5(b) 是 同学 唱歌\n时 ,示波器 显示 的 声波 波形 。 请 比较 一 下 , 这 两 种 波形 是 否 相同 ?9\n信人\n-> 四 区 本 -> 人 有 全 一\nV 7 一\n(a) 音 又 振动 时 , 示波器 显示 出 的 声波 波形 (b) 唱歌 时 , 示波器 显示 出 的 声波 波形\n图 2--5 ”比较 波形\n25\n=== 第 70 页 ===\n用\n声音 的 传播 需要 介 局\n(6\n区 这\nA. 真空 能 传 声 吗\n如 图 2 -6 所 示 , 将 手机 悬挂 在 广 口 瓶 中 ，\n拨 通 手机 ,手机 发 出 铃声 , 同时 显示 屏 发 光 。\n这 时 我 们 能 清楚 地 听 到 铃声 。\n用 抽 气 机 慢 慢 抽出 瓶 中 的 空气 ,你 听 到 的\n| 通 和 锥 声 发 生 了 什么 变化 ? 抽 气 到 一 定 程度 时 ,还\nPiWR 能 听 到 铃声 吗 ?\n图 2-6 真空 能 传 声 吧 技 掉 抽 气 管 ,让 空气 进入 瓶 中 , 你 是 否 又\n能 听 到 铃声 9\nXs) 这 个 实验 表明 :真空  。\n从\nNSh\nSA B， 听 水 中 传 出 的 声音\nSNAY 如 图 2 一 7 所 示 , 把 耳朵 贴 在 玻璃 水 槽 的 外\n/ 和 一 癌 \ 土 、 上 、 上\n二 一 面 , 能 否 听 到 水 中 散 击 石 块 的 声音 ? 请 试 一 试 |\n图 2--7 ”水 中 传 声\nC， 隔 墙 听 音\n如 图 2 -8 所 示 , 一 位 同学\n在 室外 用 手轻 山墙 体 , 室内 的\n同学 把 耳 杀 贴 在 墙 上 ,能 否 中 。 寂 轩 e | 人\n见 基 击 声 9 当 耳 采 离 开 墙 后， 划 易\n还 能 听见 声音 吗 ? 比较 一 下 ， 、\n这 两 种 听 音 方式 的 效果 是 否 一 @ 中\n样 ? 图 2--8 了 喇 墙 听 音\n26\n=== 第 71 页 ===\n大\n< 汉 汪",2.0,75.28873239436619,沪科技粤教版_八年级_义务教育教科书·物理八年级上册,59,2025-07-21T14:25:05.892Z,2.0,义务教育教科书·物理八年级上册,/Users/LeoQin/Documents/GitHub/PDFconvertor/training_data/初中/物理/沪科技粤教版-上海科学技术出版社、广东教育出版社/八年级/义务教育教科书·物理八年级上册.pdf,八年级,tesseract.js-parallel,unknown,0.8110687022900763,0.5,1,75.28873239436619,,true,,true,true,,unknown,上册,沪科技粤教版_八年级_义务教育教科书·物理八年级上册.json,物理,142,初中_物理_沪科技粤教版_八年级_义务教育教科书·物理八年级上册
