Chunk_ID,Chunk_Index,Content,Content_Length,Quality_Score,Reliability,Source_Type,Original_Content,Enhancement_Version,averageConfidence,book_name,chunkIndex,enhancementTimestamp,enhancementVersion,fileName,filePath,grade,ocrMethod,publisher,qualityMetrics_chineseCharRatio,qualityMetrics_coherenceScore,qualityMetrics_lengthScore,qualityMetrics_ocrConfidence,semanticFeatures_hasDefinition,semanticFeatures_hasExperiment,semanticFeatures_hasFormulas,semanticFeatures_hasNumbers,semanticFeatures_hasQuestion,semanticFeatures_isTableContent,semanticFeatures_subjectArea,semester,source_file,subject,totalPages,uniqueId
沪科技粤教版_九年级_义务教育教科书·物理九年级下册_chunk_0,0,"一央 : 鳃磁感应强度的 单位。 . 一 7 上司 我评价与 作 J 山 m 1， 一根 条形 磁铁 , 你能 想出 儿种 办法 辨别它 的南极和 北极 ? 2， 以下 关于磁场和 磁感 线的 说法 中 , 正确的 是 (。 )。 A. 磁体周围存在着 磁场 B. 磁场中 实际存在着 磁感 线 C. 磁体周围 , 画有 了磁 感线 的地 方有 磁场 ,没有史 二画 磁感 线的 地方 则没有磁场 D， 磁感 线上 某一 点的 磁场方向是 放在 该点 处的 小磁 针南极所 指的 方向 3， 把一 根钢 条靠近磁 针的 一个 磁极时 ,发现 该图 16_10 磁极被 排斥 , 则这 根钢 条 (。 )。 A， 一定 具有磁性 B B、 一定 没有磁性 52s C、 可能 有磁性 , 也可 能没有磁性 D. 条件 不足 ,无法 判断 4. f54 (H16 10) 能从 几百 千米 甚至 2 000 km o 外的 地方 飞回 自己的 寅。 有人 做过 实验 , 身上绑 一小 块磁体， 那么 它们就 会迷失方向。 这是 什么 ) 原因呢 ? 你还 知道哪些生物是 利用地 磁场帮助定向的 ? 图 5， 如图 16 11 所示 , 两根 条形 磁铁同 极相对放置 ,请画 出两 极之 间磁 感线 分布 的大 致情况。 6. 如图 16 12 所示 , 磁体在 日常生活 中有 着广泛的 应用。 请你 再列举一 些生活中 应用 磁体的 事例。 图 16 12 我们 身边的 磁体一 L 有冰箱门 磁圭 __ y ea E 区 ee 回避王 动呈 一有 _ S3 16 .2。 奥斯 特的 发现 电流的 磁场万 山上 , 省有 不少 科学 人家 认为电 和磁 之间 是没有联 A 、",741,0.3676576576182137,low,ocr,"一\n” 央 : - 鳃 磁感应 强度 的 单位 。\n-. 一 7\n=== 第 8 页 ===\n上\n司 我 评价 与 作 J 山 m—\n1， 一 根 条 形 磁 铁 , 你 能 想 出 儿 种 办 法 辨别 它 的 南极 和 北极 ?\n2， 以 下 关于 磁场 和 磁 感 线 的 说 法 中 , 正确 的 是 ( 。 )。\nA. 磁体 周围 存在 着 磁场\nB. 磁场 中 实际 存在 着 磁 感 线\nC. 磁体 周围 , 画 有 了 磁 感 线 的 地 方 有 磁场 ,没有 史 二\n画 磁 感 线 的 地 方 则 没有 磁场\nD， 磁 感 线 上 某 一 点 的 磁场 方向 是 放 在 该 点 处\n的 小 磁 针 南极 所 指 的 方向\n3， 把 一 根 钢 条 靠近 磁 针 的 一 个 磁极 时 ,发 现 该 图 16_10\n磁极 被 排斥 , 则 这 根 钢 条 ( 。 )。\nA， 一 定 具有 磁性 B\nB、 一 定 没有 磁性 52s\nC、 可 能 有 磁性 , 也 可 能 没有 磁性 @\nD. 条 件 不 足 ,无 法 判断\n4. f54 (H16 - 10) 能 从 几 百 千 米 甚至 2 000 km [o\n外 的 地 方 飞 回 自己 的 寅 。 有 人 做 过 实验 , RE\n身上 绑 一 小 块 磁体 ， 那 么 它们 就 会 迷失 方向 。 这 是 什么 ®)\n原因 呢 ? 你 还 知道 哪些 生物 是 利用 地 磁场 帮助 定向 的 ? 图\n5， 如 图 16 - 11 所 示 , 两 根 条 形 磁铁 同 极 相对 放置 ,请 画 出 两 极 之 间 磁 感\n线 分 布 的 大 致 情况 。\n6. 如 图 16 - 12 所 示 , 磁体 在 日 常生 活 中 有 着 广泛 的 应 用 。 请 你 再 列举 一\n些 生活 中 应 用 磁体 的 事例 。\n图 16-12 ”我 们 身边 的 磁体\n一 [| L\n有 冰箱 门 磁 圭\n__==y\nea E— ——— 区\n| | | ee\n回避 | 王 动 呈 | 一 |\n”有 _-—\n=== 第 9 页 ===\n\ =\nS3 16 .2 。 奥 斯 特 的 发 现\n电流 的 磁场\n万 山上 , 省 有 不 少 科 学 人\n家 认为 电 和 磁 之 间 是 没有 联 A >、",2.0,74.20588235294117,沪科技粤教版_九年级_义务教育教科书·物理九年级下册,6,2025-07-21T14:25:05.769Z,2.0,义务教育教科书·物理九年级下册,/Users/LeoQin/Documents/GitHub/PDFconvertor/training_data/初中/物理/沪科技粤教版-上海科学技术出版社、广东教育出版社/九年级/义务教育教科书·物理九年级下册.pdf,九年级,tesseract.js-parallel,unknown,0.7649325626204239,0.5,1,74.20588235294117,,true,,true,true,,physics,下册,沪科技粤教版_九年级_义务教育教科书·物理九年级下册.json,物理,102,初中_物理_沪科技粤教版_九年级_义务教育教科书·物理九年级下册
沪科技粤教版_九年级_义务教育教科书·物理九年级下册_chunk_1,1,"应用 磁体的 事例。 图 16 12 我们 身边的 磁体一 L 有冰箱门 磁圭 __ y ea E 区 ee 回避王 动呈 一有 _ S3 16 .2。 奥斯 特的 发现 电流的 磁场万 山上 , 省有 不少 科学 人家 认为电 和磁 之间 是没有联 A 、 系的 , 而丹麦物理学 家奥 其特 (H. C. Oersted, 1777 一过 1851) 则认为电 、 热 . 光 . 磁之 人 2 间是 有联系的。 他经 过多 年的 实验研究 , 于 1820 年 4 月首先发 现了 电流的 磁效 应， 打开了 通向 电与 磁联 系的 大门。 下面 我们 来做 奥斯 特做 过的 实验。 图 16 13 奥斯 特和 他的 助手在 做电流的 磁效 应实验活动 1 观察通电直 导线周 围的 磁场把 小磁 针放 在桌面上 , 将一 根直 导线平行架 在小 磁针 的上 方 (图 16 14)， 然后把 导线的 两端 接入 电路中。 闭合 开关， 导线 中有 电流通过时， 磁针 就会 转到 一个 新的 位置， 断开 开关， 导线 中无 o, 电流时 ,小磁 针又 回到 原来的 位置。 再把 一一 接入 电路的 导线两 端对 调一 下 ,观察小 磁针 的转向是 否改变。 在这 个活动中 , 导线中 有电流通过时， 小磁 针发 生转动的 现象说 明了什么 ? o ) 小磁 针转 动的 方向跟 电流 的方向有 关吗 ? 图"" "" 9 奥斯 特实验说 明和 通电导体跟 磁体一 样 , 周围也 存在着。 s 正是 电流的 磁场使 磁针 发生 了偏转 , 而且 磁场 的方向跟 电流的 方向有 关。 通电螺 线管 的磁场",708,0.3415616931216931,low,ocr,"应 用 磁体 的 事例 。\n图 16-12 ”我 们 身边 的 磁体\n一 [| L\n有 冰箱 门 磁 圭\n__==y\nea E— ——— 区\n| | | ee\n回避 | 王 动 呈 | 一 |\n”有 _-—\n=== 第 9 页 ===\n\ =\nS3 16 .2 。 奥 斯 特 的 发 现\n电流 的 磁场\n万 山上 , 省 有 不 少 科 学 人\n家 认为 电 和 磁 之 间 是 没有 联 A >、\n系 的 , 而 丹麦 物理 学 家 奥 其\n特 (H. C. Oersted, 1777 一 & 过\n1851) 则 认为 电 、 热 . 光 . 磁 之 人 2\n间 是 有 联系 的 。 他 经 过 多 年\n的 实验 研究 , 于 1820 年 4 月\n首先 发 现 了 电流 的 磁 效 应 ， ® RE #\n打开 了 通 向 电 与 磁 联 系 的 大\n门 。 下 面 我 们 来 做 奥 斯 特 做\n过 的 实验 。 图 16-13 ” 奥 斯 特 和 他 的 助手 在 做 电流 的 磁 效 应 实验\n活动 1 观察 通电 直 导线 周 围 的 磁场\n把 小 磁 针 放 在 桌面 上 , 将 一 根 直 导线 平行 架 在 小 磁 针 的 上 方 (图 16 — 14)，\n然后 把 导线 的 两 端 接 入 电路 中 。 闭 合 开关 ， 导 线 中 有 电流 通过 时 ， 磁 针 就 会\n转 到 一 个 新 的 位 置 ， 断 开 开 关 ， 导 线 中 无 o,\n电流 时 ,小 磁 针 又 回 到 原来 的 位 置 。 再 把 一 一\n接 入 电路 的 导线 两 端 对 调 一 下 ,观察 小 磁\n针 的 转向 是 否 改变 。\n在 这 个 活动 中 , 导线 中 有 电流 通过\n时 ， 小 磁 针 发 生 转动 的 现象 说 明了 什么 ? o )\n小 磁 针 转 动 的 方向 跟 电 流 的 方向 有 关 吗 ? 图"" ""” PRLRRARARENRS\n9\n=== 第 10 页 ===\n奥 斯 特 实验 说 明\n[和\n| 通电 导体 跟 磁体 一 样 , 周围 也 存在 着  。\n~—  s\n正 是 电流 的 磁场 使 磁 针 发 生 了 偏转 , 而 且 磁 场 的 方向 跟 电流 的 方向 有 关 。\n通电 螺 线 管 的 磁场",2.0,74.20588235294117,沪科技粤教版_九年级_义务教育教科书·物理九年级下册,7,2025-07-21T14:25:05.769Z,2.0,义务教育教科书·物理九年级下册,/Users/LeoQin/Documents/GitHub/PDFconvertor/training_data/初中/物理/沪科技粤教版-上海科学技术出版社、广东教育出版社/九年级/义务教育教科书·物理九年级下册.pdf,九年级,tesseract.js-parallel,unknown,0.8,0.5,1,74.20588235294117,,true,,true,true,,physics,下册,沪科技粤教版_九年级_义务教育教科书·物理九年级下册.json,物理,102,初中_物理_沪科技粤教版_九年级_义务教育教科书·物理九年级下册
沪科技粤教版_九年级_义务教育教科书·物理九年级下册_chunk_2,2,"o ) 小磁 针转 动的 方向跟 电流 的方向有 关吗 ? 图"" "" 9 奥斯 特实验说 明和 通电导体跟 磁体一 样 , 周围也 存在着。 s 正是 电流的 磁场使 磁针 发生 了偏转 , 而且 磁场 的方向跟 电流的 方向有 关。 通电螺 线管 的磁场我 们把 用导线在 圆柱形 空心简 上绕 成的 螺纹状 线圈 , 叫做螺 线管。 这是 一种 重要的 电磁器 件。 通电螺 线管 的磁场是 怎样分 布的 ? 它的 极性 与电流方向的 关系是 怎样的 ? 下面 ,我们 通过实验来 进行研究。 活动 2 探究通电螺 线管 外部 磁场的 方向一 一 A， 观察 通电螺 线管 周围的 铁导 分布 在谎 有螺 线管 的有 机玻璃板 上均匀地 撤上 铁届， 给螺 线管 通电， 并轻 禹有 机玻璃板 ,观察螺 线管 周围的 铁居 分布 情况 (图 16 15)。 实验表明 , 通电螺 线管 周围存 在着 磁场。 你能 说出 通电螺 线管 外部 的磁场分 布与 哪种 磁体的 磁场相似吗 ? B. 探究通电螺 线管 的极 性全 全与 电流方向的 关系 Ne 过时 用导线把 如图 16 16 所未 安计 天区 攻 E 汉的 器材 连接起 来， 在螺 线管 接入 2 省攻 目攻 电路后 , 把小 磁针 放在 螺线 管丙 二端， 闭合 开关 ,观察螺 线管 两端 人的 小磁 针的 指向。 然后 , 改变电 人流 方向， 记下 则线 管中 的电流方 向和 小磁 针静止时 N 极的 指向。 国生请 想一 起 : 通电螺 线管 的极 性跟 电流方向间 有什么关系 ? 10 Te p : 《人加 上要 多 s A L 二 1 条",711,0.3342750533807829,low,ocr,"o )\n小 磁 针 转 动 的 方向 跟 电 流 的 方向 有 关 吗 ? 图"" ""” PRLRRARARENRS\n9\n=== 第 10 页 ===\n奥 斯 特 实验 说 明\n[和\n| 通电 导体 跟 磁体 一 样 , 周围 也 存在 着  。\n~—  s\n正 是 电流 的 磁场 使 磁 针 发 生 了 偏转 , 而 且 磁 场 的 方向 跟 电流 的 方向 有 关 。\n通电 螺 线 管 的 磁场\n我 们 把 用 导线 在 圆柱 形 空心 简 上 绕 成 的 螺纹 状 线圈 , 叫做 螺 线 管 。 这 是 一\n种 重要 的 电磁 器 件 。\n通电 螺 线 管 的 磁场 是 怎样 分 布 的 ? 它 的 极 性 与 电流 方向 的 关系 是 怎样 的 ?\n下 面 ,我 们 通过 实验 来 进行 研究 。\n活动 2 探究 通电 螺 线 管 外 部 磁场 的 方向 一 一\nA， 观 察 通电 螺 线 管 周围 的 铁 导 分 布\n在 谎 有 螺 线 管 的 有 机 玻璃 板 上 均匀 地 撤 上 铁 届 ， 给 螺 线 管 通电 ， 并 轻 禹 有\n机 玻璃 板 ,观察 螺 线 管 周围 的 铁 居 分 布 情况 (图 16 - 15)。\n实验 表明 , 通电 螺 线 管 周围 存 在 着 磁场。\n你 能 说 出 通电 螺 线 管 外 部 的 磁场 分 布 与 哪 种 磁体 的 磁场 相似 吗 ?\nCR — B. 探究 通电 螺 线 管 的 极 性\n全 RE 全 与 电流 方向 的 关系\nNe TAN 过 时 用 导线 把 如 图 16 ~ 16 所 未\n| 安 | 计 | 天 | 区 | 攻 E 汉 的 器 材 连接 起 来 ， 在 螺 线 管 接 入\n2 | 省 | 攻 | 目 | 攻 电路 后 , 把 小 磁 针 放 在 螺 线 管 丙\n二 端 ， 闭 合 开关 ,观察 螺 线 管 两 端\n人 的 小 磁 针 的 指向 。 然 后 , 改变 电\n人 流 方向 ， 记 下 则 线 管 中 的 电流 方\n| 向 和 小 磁 针 静止 时 N 极 的 指向 。\n国生 请 想 一 起 : 通电 螺 线 管 的 极 性 跟\n电流 方向 间 有 什么 关系 ?\n10\n=== 第 11 页 ===\n| Te “ p :\n/\n《人\n加\n上 要\n多 s A L\n二 ~\n1 条",2.0,74.20588235294117,沪科技粤教版_九年级_义务教育教科书·物理九年级下册,8,2025-07-21T14:25:05.769Z,2.0,义务教育教科书·物理九年级下册,/Users/LeoQin/Documents/GitHub/PDFconvertor/training_data/初中/物理/沪科技粤教版-上海科学技术出版社、广东教育出版社/九年级/义务教育教科书·物理九年级下册.pdf,九年级,tesseract.js-parallel,unknown,0.868,0.5,1,74.20588235294117,true,true,,true,true,,physics,下册,沪科技粤教版_九年级_义务教育教科书·物理九年级下册.json,物理,102,初中_物理_沪科技粤教版_九年级_义务教育教科书·物理九年级下册
沪科技粤教版_九年级_义务教育教科书·物理九年级下册_chunk_3,3,"观察电磁铁 的结构拆 开电 磁铁 (图 16 23) ,观察它 的结构， 请把 它的 主要部 件的 名称 写在 下面 方框 中。 一一 一一 一一 一一 一一 一一 一人 人线圈衔 铁国 7 图 16 一 23 实验室 里常用的 电磁铁 13 B. 制作简易电磁铁， 了解 电磁铁 的磁性在 图 16 一 24 中, 选用合适的 器材 制作 一个 螺线 管 , 并将 它接 入图 16 一 25 所示 的电路中。 将铁 钉插入螺 线管内， 接通电路 ,观察其 磁性的 变化情况。 中同学比 一比 ,看谁 做的 电磁铁 的磁性更 强。 2 Eye 矿 4 用来 绕制 螺线 管。 粗细不 同的 大铁 钉胶带洪 包线 大头 针的 塑料管 图 16 24 研究电磁铁 磁性 的实验器 材二 猜一 猜 , 如果 用人 竹征 插入螺 线和 二管内， 其磁性有 无变化 ? 不妨 动手 Q 做一 做。 一二 图 16 25 探究电磁铁 磁性 的电路实验表明 , 当通电螺 线管内插入铁 钉时 , 甚磁性明显增强。 因此 , 人们 在利 用通电螺 线管 的磁性时 , 通常都 要把 螺线 管紧 密地 套在 一个 铁必 上, 这样 就构 成了 一个 电磁铁 (electromagnet )。 由此 可见 , 电磁铁 是一 个带 有铁心的 螺线 管 , 它由 线圈和 铁艺两 部分 组成。 电磁铁通电 时有 磁性 , 断电 时磁性消失。 电磁铁 磁性 的强 弱跟 哪些 2 活动 2 探究影响电磁铁 磁性 强弱 的因素 s 通过制作简易电磁铁 , 我们 已经 发现 电磁铁磁性的 强弱 与电流的 大小 有关 ,， 有些同学猜测还 与线圈的 下数 有关 ,， 于是 设计出 如图 16 26(a)、b) 所示 14",748,0.43400663612565443,medium-low,ocr,"观察 电磁 铁 的 结构\n拆 开 电 磁铁 (图 16 — 23) ,观察 它 的 结构 ，\n请 把 它 的 主要 部 件 的 名 称 写 在 下 面 方 框 中 。\n一 一 一 一 一 一 一 一 一 一 一 一 一 人 人 线圈\n衔 铁\n国 7 图 16 一 23 ”实验 室 里 常用 的 电磁 铁\n13\n=== 第 14 页 ===\nB. 制作 简易 电磁 铁 ， 了 解 电磁 铁 的 磁性\n在 图 16 一 24 中, 选用 合适 的 器 材 制 作 一 个 螺 线 管 , 并 将 它 接 入 图 16 一 25\n所 示 的 电路 中 。 将 铁 钉 插入 螺 线 管内 ， 接 通电 路 ,观察 其 磁性 的 变化 情况 。 中\n同学 比 一 比 ,看 谁 做 的 电磁 铁 的 磁性 更 强 。\n2 AVI\nEye 矿 4 &\n用 来 绕 制 螺 线 管 。 粗细 不 同 的 大 铁 钉 胶带 洪 包 线 大 头 针\n的 塑料 管\n图 16-24 ”研究 电磁 铁 磁 性 的 实验 器 材\n二 猜 一 猜 , 如 果 用 人 竹 征 插入 螺 线\n和 二 管内 ， 其 磁性 有 无 变化 ? 不 妨 动手\nQ | 做 一 做 。\n|\n一 二\n图 16-25 探究 电磁 铁 磁 性 的 电路\n实验 表明 , 当 通电 螺 线 管内 插入 铁 钉 时 , 甚 磁性 明显 增强 。 因 此 , 人 们 在 利\n用 通电 螺 线 管 的 磁性 时 , 通常 都 要 把 螺 线 管 紧 密 地 套 在 一 个 铁 必 上, 这 样 就 构\n成 了 一 个 电磁 铁 (electromagnet ) 。\n由 此 可 见 , 电磁 铁 是 一 个 带 有 铁心 的 螺 线 管 , 它 由 线圈 和 铁艺 两 部 分 组 成 。\n电磁 铁通 电 时 有 磁性 , 断 电 时 磁性 消失 。\n电磁 铁 磁 性 的 强 弱 跟 哪 些\n2%\n活动 2 探究 影响 电磁 铁 磁 性 强 弱 的 因素 s\n通过 制作 简易 电磁 铁 , 我 们 已 经 发 现 电 磁铁 磁性 的 强 弱 与 电流 的 大 小 有\n关 ,， 有些 同学 猜测 还 与 线圈 的 下 数 有 关 ,， 于 是 设计 出 如 图 16 - 26(a)、b) 所 示\n14\n=== 第 15 页 ===",2.0,74.20588235294117,沪科技粤教版_九年级_义务教育教科书·物理九年级下册,11,2025-07-21T14:25:05.769Z,2.0,义务教育教科书·物理九年级下册,/Users/LeoQin/Documents/GitHub/PDFconvertor/training_data/初中/物理/沪科技粤教版-上海科学技术出版社、广东教育出版社/九年级/义务教育教科书·物理九年级下册.pdf,九年级,tesseract.js-parallel,unknown,0.812962962962963,0.5,1,74.20588235294117,,true,,true,true,,unknown,下册,沪科技粤教版_九年级_义务教育教科书·物理九年级下册.json,物理,102,初中_物理_沪科技粤教版_九年级_义务教育教科书·物理九年级下册
沪科技粤教版_九年级_义务教育教科书·物理九年级下册_chunk_4,4,"梧 17 1 所示 你全 一还 能说 出哪些器 6 二 v 具用 到电动机 ? 一相生一 比一 比 , 看谁 说得 . 人人 最多 1 0 站 2 证图 17 1 电动机 的一 应用 数控机 床 ne 了解 电动机的 结构活动 1 让电动机 转起 来 G a 5 参照图 17 一 2(a) 所示 的电 W 路, 用导线把 图 17 一 2(b) 中的 s oJ 电源 、 开关 和模型电动机 连接起 E Js 来。 闭合 开关 , 看看 电动机 是否 转动。 若不 转动 ,仔细查找原因或 请求 老师的 帮助。 (a) 电路图 (b) 模型电动机 、 电源和 开关图 17 一 2 连接模型电动机 22 而有 23 活动 2 探究电动机 的内 部结构要 想知 道电动机 通电后 为什么会 转动 , 就要 了解 电动机 的内 部结构。 让我 们将 电动机 拆开 , 对它 的内 部结构作 一探究。 mA 用 .60 _ 大加 Jo 全电动机 装有 电磁铁 的定子各 有线圈的 转子 ae 每 2 国全 1 1 B es 9 模型电动机 磁体线圈图 17 3 电动机 的主要部 件电动机 的主要部 件是 和。 电动机 转动原因的 猜想电动机 内磁铁和 线圈之 间并 无接触 , 但线圈通电就 会转动 , 这说 明磁 铁的 磁场对 通电线圈一 定有 力的 作用。 对此 , 你有 什么猜想 ? 请把 你的 猜想填写在 下面 : 电动机 的转动 , 可能 跟和 有关。 由于 磁场对 通电线圈产生力 的作用 , 电动机 才会 转动起 来。 圆柱形 的转子是 由硅钢片 亚成 的 , 线圈就 腐在 硅钢片 的槽 中。 23 要验证上 述猜想 , 需要对 电动机 的结构做 合理简化。 1",739,0.37941031141868514,low,ocr,"梧 |\n17- 1 所 示 你 [全 SEO 一\n还 能 说 出 哪些 器 6 二 = v—\n具 用 到 电动 机 ? 一 相生 一\n比 一 比 , 看 谁 说 得 . 人 人\n最 多 1 ==0 站\n2 证 |\n图 17-1 电动 机 的 * -一\n应 用 数控 机 床 ne\n了 解 电 动机 的 结构\n活动 1 让 电动 机 转 起 来\nG a=5 参照 图 17 一 2(a) 所 示 的 电\nW 路, 用 导线 把 图 17 一 2(b) 中 的\ns oJ 电源 、 开 关 和 模型 电动 机 连接 起\nE Js 来 。 闭 合 开关 , 看 看 电动 机 是 否\n转动 。 若 不 转动 ,仔细 查找 原因\n或 请 求 老师 的 帮助 。\n(a) 电路 图 (b) 模型 电动 机 、 电源 和 开关\n图 17 一 2 连接 模型 电动 机\n22\n=== 第 24 页 ===\n而 有\n~23\n活动 2 探究 电动 机 的 内 部 结构\n要 想 知 道 电动 机 通电 后 为 什么 会 转动 , 就 要 了 解 电动 机 的 内 部 结构 。 让 我\n们 将 电动 机 拆 开 , 对 它 的 内 部 结构 作 一 探究 。\nmA&\n用 | .60\n—_— | 大 加 | “ » -\nJo 全\n电动 机 装 有 电磁 铁 的 定子 各 有 线圈 的 转子 ”\nae\n“每 2 国 |\n全 1 1 B\nSS es\n9\n模型 电动 机 磁体 线圈\n图 17--3 ”电动 机 的 主要 部 件\n电动 机 的 主要 部 件 是 和  。\n电动 机 转动 原因 的 猜想\n电动 机 内 磁铁 和 线圈 之 间 并 无 接触 , 但 线圈 通电 就 会 转动 , 这 说 明 磁 铁 的\n磁场 对 通电 线圈 一 定 有 力 的 作用 。 对 此 , 你 有 什么 猜想 ? 请 把 你 的 猜想 填写 在\n下 面 :\n电动 机 的 转动 , 可 能 跟 和 有 关 。 由 于 磁场 对 通电\n线圈 产生 力 的 作用 , 电动 机 才 会 转动 起 来 。\n* 圆柱 形 的 转子 是 由 硅钢 片 亚 成 的 , 线圈 就 腐 在 硅钢 片 的 槽 中 。\n23\n=== 第 25 页 ===\n要 验证 上 述 猜想 , 需要 对 电动 机 的 结构 做 合理 —\n简化 。 1",2.0,74.20588235294117,沪科技粤教版_九年级_义务教育教科书·物理九年级下册,18,2025-07-21T14:25:05.769Z,2.0,义务教育教科书·物理九年级下册,/Users/LeoQin/Documents/GitHub/PDFconvertor/training_data/初中/物理/沪科技粤教版-上海科学技术出版社、广东教育出版社/九年级/义务教育教科书·物理九年级下册.pdf,九年级,tesseract.js-parallel,unknown,0.8030592734225621,0.5,1,74.20588235294117,,,,true,true,,physics,下册,沪科技粤教版_九年级_义务教育教科书·物理九年级下册.json,物理,102,初中_物理_沪科技粤教版_九年级_义务教育教科书·物理九年级下册
