Chunk_ID,Chunk_Index,Content,Content_Length,Quality_Score,Reliability,Source_Type,Original_Content,Enhancement_Version,averageConfidence,book_name,chunkIndex,enhancementTimestamp,enhancementVersion,fileName,filePath,grade,ocrMethod,publisher,qualityMetrics_chineseCharRatio,qualityMetrics_coherenceScore,qualityMetrics_lengthScore,qualityMetrics_ocrConfidence,semanticFeatures_hasDefinition,semanticFeatures_hasExperiment,semanticFeatures_hasFormulas,semanticFeatures_hasNumbers,semanticFeatures_hasQuestion,semanticFeatures_isTableContent,semanticFeatures_subjectArea,semester,source_file,subject,totalPages,uniqueId
沪科技粤教版_八年级_义务教育教科书·物理八年级上册_chunk_0,0,"受热能直接。 图 4 34 碘的 升华物理学 中 , 把物质由 固态直接变 成气态的 现象 , 叫做升华 (sublimation)。 固态的 冰直 接变 成气态的 水蒸气 , 是冰 的升华。 现在 , 你能 解释图 4 一 33 (a) (b) 所示 的现象了 吗 ? C258 活动 2 观察凝 华现象 A. 在活动 1 的实验中 , 当烧 杯中 出现 许多 碘闵 气时 ,停止加 热。 待冷却后 提开 玻璃益 片 , 你在 烧瓶内 壁和 下璃 益片上又 看到 了什么 ? B. 在一 个挤 姿杯 里盛 一些 冰和 盐的 混合物 , 过一 会儿 , 在挤 姿杯 的外 表面 ,可以 看到 一层 薄薄 的霜 , 这层 霜是 从哪儿来 的 9 请与 同学交流和 讨论 ,将观察到 的现象记 录下 来。 101 物理学 中 , 把物质由 气态直接变 为固态的 现象 , 叫做凝 华 (condensation)。 气态的 碘蒸 气直接变 成固态的 碘 , 是节 气的 凝华。 霜是 空气中 的水 蒸气直 接凝 华而 成的。 因此 , 霜并 不是 从天 上沙 下来 的 , 人们 常说 的下 霜了 并不 科学。 试用 凝华 的观点解释图 4 33 (c) (d) 的现象。 物质在 升华过 程中 要吸 热 , 在凝 华过 程中 要放 热。 你还 能举 出一 些升华和 凝华 的具体事例吗 ? 让人 工降雨利用物质的 升华 ,可以 制冷 ,干冰 (固态二 氧化碳 ) 就是 一种 常用的 制冷剂。 用干冰可 以实施人 工降雨。 ra 配备特殊装置的 飞机将 干冰撤 入一 eg 和定 高度 的冷 云层中 ,干冰就 会很 快 pi 升华 , 并从 周围吸收大 量的 热 , 使空 人气 的温度急剧下 降 , 于是 高空中的",757,0.3062808593021544,low,ocr,"受 热能 直接 。 ATE\n图 4--34 ” 碘 的 升华\n物理 学 中 , 把 物质 由 固态 直接 变 成 气态 的 现象 , 叫做 升华 (sublimation) 。\n固态 的 冰 直 接 变 成 气态 的 水 蒸气 , 是 冰 的 升华 。 现 在 , 你 能 解释 图 4 一 33 (a) (b)\n所 示 的 现象 了 吗 ?\nPS —\nC258\n活动 2 观察 凝 华 现象 ED\nA. 在 活动 1 的 实验 中 , 当 烧 杯 中 出 现 许 多 碘 闵 气 时 ,停止 加 热 。 待 冷却 后 提\n开 玻璃 益 片 , 你 在 烧瓶 内 壁 和 下 璃 益 片上 又 看 到 了 什么 ?\nB. 在 一 个 挤 姿 杯 里 盛 一 些 冰 和 盐 的 混合 物 , 过 一 会 儿 , 在 挤 姿 杯 的 外 表\n面 ,可 以 看 到 一 层 薄 薄 的 霜 , 这 层 霜 是 从 哪儿 来 的 9\n请 与 同学 交流 和 讨论 ,将 观察 到 的 现象 记 录 下 来 。\n101\n=== 第 12 页 ===\n物理 学 中 , 把 物质 由 气态 直接 变 为 固态 的 现象 , 叫做 凝 华 (condensation) 。\n气态 的 碘 蒸 气 直接 变 成 固态 的 碘 , 是 节 气 的 凝 华 。 霜 是 空气 中 的 水 蒸气 直\n接 凝 华 而 成 的 。 因 此 , 霜 并 不 是 从 天 上 沙 下 来 的 , 人 们 常 说 的 “下 霜 了 ”并 不 科\n学 。 试 用 凝 华 的 观点 解释 图 4- 33 (c) (d) 的 现象 。\n物质 在 升华 过 程 中 要 吸 热 , 在 凝 华 过 程 中 要 放 热 。\n你 还 能 举 出 一 些 升华 和 凝 华 的 具体 事例 吗 ?\n让\n人 工 降雨\nSTS 利用 物质 的 升华 ,可 以 制冷 ,干冰 (固态 二 氧化 碳 ) 就 是 一\n种 常用 的 制冷 剂 。\n用 干冰 可 以 实施 人 工 降雨 。\nra 配备 特殊 装置 的 飞机 将 干冰 撤 入 一\neg 和 SEE 定 高 度 的 冷 云层 中 ,干冰 就 会 很 快\n< pi 升华 , 并 从 周围 吸收 大 量 的 热 , 使 空\n人 气 的 温度 急剧 下 降 , 于 是 高 空中 的",2.0,75.28873239436619,沪科技粤教版_八年级_义务教育教科书·物理八年级上册,9,2025-07-21T14:25:05.891Z,2.0,义务教育教科书·物理八年级上册,/Users/LeoQin/Documents/GitHub/PDFconvertor/training_data/初中/物理/沪科技粤教版-上海科学技术出版社、广东教育出版社/八年级/义务教育教科书·物理八年级上册.pdf,八年级,tesseract.js-parallel,unknown,0.7974217311233885,0.6,1,75.28873239436619,true,true,,true,true,,physics,上册,沪科技粤教版_八年级_义务教育教科书·物理八年级上册.json,物理,142,初中_物理_沪科技粤教版_八年级_义务教育教科书·物理八年级上册
沪科技粤教版_八年级_义务教育教科书·物理八年级上册_chunk_1,1,"物质的 升华 ,可以 制冷 ,干冰 (固态二 氧化碳 ) 就是 一种 常用的 制冷剂。 用干冰可 以实施人 工降雨。 ra 配备特殊装置的 飞机将 干冰撤 入一 eg 和定 高度 的冷 云层中 ,干冰就 会很 快 pi 升华 , 并从 周围吸收大 量的 热 , 使空 人气 的温度急剧下 降 , 于是 高空中的 部分 水蒸气便 上凝 华成 小冰 粒。 这些 小冰 粒逐渐变 大而 下落 , 遇到 暖气流 就熔化为 雨点降落到 地面 上，, 在一 定条 件下 就形成降雨。 图 4 35 人工降雨 wA 避我 评价与 作业 m 1. 如图 4 一 36 所示 , 文艺演出时 ,舞台上 往往有 称漫 的白色烟雾 ,仿佛是 流动的 白云。 它是 利用干冰在 党温 下 (。 )。 A. 迅速液化成 二氧化碳 的小 液珠 而形成的 B. 迅速熔化再 汽化变 成二 氧化碳 气体而 形成的 C. 迅速升华成 二氧化碳 气体而 形成的 D. 迅速 升华成 二氧化碳 气体 ,使空气中 水东 气由 于降温液化成 小水 珠而 形成白雪 El4 36 102 物理学 推动了 社会的 发展 E . : tk 家 )ntln 贞放 图 1 6， 古埃及人 建造金字塔 物理学 的每 一次 重大发 现 , 都极 大地 推动了 科学和 技术的 进步 , 不断 改变着 人们 的生活方式 , 加速 了人 类 W 社会物质文明的 进程, 深化了 人类 对自然界 的认识。 远古的 人类 , 刀耕 火种。 简单机你 械的 发明和应 用 , 使人 类创造了 许多二 2 师巧夺天工的 奇迹。 Re 人 17 一 18 世纪 , 由于 生产的 需要和 (A 力学 、 热学 的发 展 , 促进了 蒸汽机 的研 考生一",742,0.40519026888604354,medium-low,ocr,"物质 的 升华 ,可 以 制冷 ,干冰 (固态 二 氧化 碳 ) 就 是 一\n种 常用 的 制冷 剂 。\n用 干冰 可 以 实施 人 工 降雨 。\nra 配备 特殊 装置 的 飞机 将 干冰 撤 入 一\neg 和 SEE 定 高 度 的 冷 云层 中 ,干冰 就 会 很 快\n< pi 升华 , 并 从 周围 吸收 大 量 的 热 , 使 空\n人 气 的 温度 急剧 下 降 , 于 是 高 空中 的\n部 分 水 蒸气 便 上 凝 华 成 小 冰 粒 。 这 些\n小 冰 粒 逐渐 变 大 而 下 落 , 遇 到 暖气\n流 就 熔化 为 雨点 降落 到 地 面 上 ，, 在\n一 定 条 件 下 就 形成 降雨 。\n图 4--35 ”人工 降雨\nwA\n避 我 评价 与 作业 m—\n1. 如 图 4 一 36 所 示 , 文艺 演出 时 ,舞台 上 往往 有 称\n漫 的 白色 烟雾 ,仿佛 是 流动 的 白云 。 它 是 利用 干冰 在 党\n温 下 ( 。 )。 |\nA. 迅速 液化 成 二 氧化 碳 的 小 液 珠 而 形成 的\nB. 迅速 熔化 再 汽化 变 成 二 氧化 碳 气体 而 形成 的\nC. 迅速 升华 成 二 氧化 碳 气体 而 形成 的\nD. 迅 速 升华 成 二 氧化 碳 气体 ,使 空气 中 水 东 气 由\n于 降温 液化 成 小 水 珠 而 形成 白雪\nEl4—36\n102\n=== 第 13 页 ===\n物理 学 推动 了 社会 的 发 展\nE .\n: tk\n> 家 )ntln\n贞 放\n图 1-6 ， 古 埃及 人 建造 金字 塔\n物理 学 的 每 一 次 重大 发 现 , 都 极\n大 地 推动 了 科学 和 技术 的 进步 , 不 断\n改变 着 人 们 的 生活 方式 , 加 速 了 人 类 W\n社会 物质 文明 的 进程, 深化 了 人 类 对 |\n自然 界 的 认识 。\n远古 的 人 类 , 刀 耕 火种 。 简 单机 你 —\n械 的 发 明和 应 用 , 使 人 类 创造 了 许多 二 -2 师\n巧夺天工 的 奇迹 。 Re 人\n17 一 18 世 纪 , 由 于 生产 的 需要 和  (A  OR\n力学 、 热 学 的 发 展 , 促进 了 蒸汽 机 的 研 考生 一",2.0,75.28873239436619,沪科技粤教版_八年级_义务教育教科书·物理八年级上册,10,2025-07-21T14:25:05.891Z,2.0,义务教育教科书·物理八年级上册,/Users/LeoQin/Documents/GitHub/PDFconvertor/training_data/初中/物理/沪科技粤教版-上海科学技术出版社、广东教育出版社/八年级/义务教育教科书·物理八年级上册.pdf,八年级,tesseract.js-parallel,unknown,0.8277153558052435,0.5,1,75.28873239436619,,,,true,,,physics,上册,沪科技粤教版_八年级_义务教育教科书·物理八年级上册.json,物理,142,初中_物理_沪科技粤教版_八年级_义务教育教科书·物理八年级上册
沪科技粤教版_八年级_义务教育教科书·物理八年级上册_chunk_2,2,"凝结为 淡水。 这个 过程 中涉及的 水的 物态 变化有 ( ). A. 汽化 .凝固 B. 汽化 液化 C. 液化 . 凝华 D. 升华 、 凝华 5. 请你 在图 4 一 37 中的 方括号内 填上 相应物 态变化的 名称 , 在圆 括号内 填入 这个 物态 变化过 程中 是吸 热还 是放 热。 图 4 一 37 : 观察并 研究电 冰箱 中有 哪些物 态变 化现象 , 写一 篇探究报告 , 并与 同 : 学交流 1_ _ _ 水循环与 水资源自然界 中的 水循环地 球上 的水 处于 不停 的运动变化之 中。 陆地 和海洋表面的 水通过蒸发进入大 气 , 大气 中的 水蒸气冷却后 通过降水又 回到 陆地和 海洋 , 其循环过 程 103 L a om 的如 图 4 一 38 所示。 水的 这种 特本 号 ar . Ze 环过 程不 仅是 水的 气态 、 液态 、 固态之 间的 物态 变化 ,更 11 kh 育育 用重要的 是使 陆地上 的淡水不 断得 到补充。 本一 一图 4 38 自然界 中的 水循环 M.E 5 5 云雨 . 直 、 雪 、 雾 、 露 . 霜都 是水 的家 族成 员。 太阳照射到 江 、 河 、 湖 、 海 , 使水 蒸发 , 水蒸气上 升到 气温较 低的 高空 , 凝结成 小水 珠或 凝华 成小 冰晶 ,形成一 采采 白色 的云 (图 4 一 39)。 人白云若 再遇 到冷 空气 , 云中 E 的小 水珠 相互凝聚逐渐增 大成 为大 水珠 , 白云变 成乌云。 当大 y 稚如 水珠 越来 越重 , 便下 落到 地面， Rs 这就 是两 (图 4 40)。 若云 中的 Eee : sa 小冰晶凝聚变 大 ,下沙 过程 中熔 图 4 39 去",745,0.371827418525753,low,ocr,"凝结 为 淡水 。 这 个 过 程 中 涉及 的 水 的 物 态 变化 有 ( ).\nA. 汽 化 .凝固 B. 汽 化 液化 C. 液 化 . 凝 华 “ D. 升华 、 凝 华\n5. 请 你 在 图 4 一 37 中 的 方 括号 内 填 上 相应 物 态 变化 的 名 称 , 在 圆 括号 内 填\n入 这 个 物 态 变化 过 程 中 是 吸 热 还 是 放 热 。\n图 4 一 37\nET\n: 观察 并 研究 电 冰 箱 中 有 哪些 物 态 变 化 现象 , 写 一 篇 探究 报告 , 并 与 同 |\n: 学 交流 |\n1_ _ _\n水 循环 与 水 资源\n自然 界 中 的 水 循环\n地 球 上 的 水 处 于 不 停 的 运动 变化 之 中 。 陆 地 和 海洋 表面 的 水 通过 蒸发\n进入 大 气 , 大 气 中 的 水 蒸气 冷却 后 通过 降水 又 回 到 陆地 和 海洋 , 其 循环 过 程\n103\n=== 第 15 页 ===\nL\na om 的 如 图 4 一 38 所 示 。 水 的 这 种 特\n本 ¥ > = 号\nar =. = Ze 环 过 程 不 仅 是 水 的 气态 、 液\n — 态 、 固态 之 间 的 物 态 变化 ,更\n11 kh 育 育 用 重要 的 是 使 陆地 上 的 淡水 不\n= -—  = 断 得 到 补充 。\n本 -一 一 -\n图 4--38 ”自然 界 中 的 水 循环\n= M.E 5 5 & BORR\n云雨 . 直 、 雪 、 雾 、 露 . 霜 都 是 水 的 家 族 成 员 。\n太阳 照射 到 江 、 河 、 湖 、 海 , 使 水 蒸发 , 水 蒸气 上 升 到 气温 较 低 的 高 空 , 凝结 成\n小 水 珠 或 凝 华 成 小 冰晶 ,形成 一 采\n采 白 色 的 云 (图 4 一 39) 。 人\n白云 若 再 遇 到 冷 空 气 , 云 中 E\n的 小 水 珠 相互 凝聚 逐渐 增 大 成\n为 大 水 珠 , 白云 变 成 乌云 。 当 大 y | 稚 = 如\n水 珠 越 来 越 重 , 便 下 落 到 地 面 ， Rs\n这 就 是 两 (图 4- 40) 。 若 云 中 的 Eee : sa\n小 冰晶 凝聚 变 大 ,下 沙 过 程 中 熔 图 4-39 去",2.0,75.28873239436619,沪科技粤教版_八年级_义务教育教科书·物理八年级上册,12,2025-07-21T14:25:05.891Z,2.0,义务教育教科书·物理八年级上册,/Users/LeoQin/Documents/GitHub/PDFconvertor/training_data/初中/物理/沪科技粤教版-上海科学技术出版社、广东教育出版社/八年级/义务教育教科书·物理八年级上册.pdf,八年级,tesseract.js-parallel,unknown,0.7795275590551181,0.5,1,75.28873239436619,,true,,true,,,physics,上册,沪科技粤教版_八年级_义务教育教科书·物理八年级上册.json,物理,142,初中_物理_沪科技粤教版_八年级_义务教育教科书·物理八年级上册
沪科技粤教版_八年级_义务教育教科书·物理八年级上册_chunk_3,3,".1 物体的 质量我 们周围的 世界是 如此 纷繁多 姿 , 这个 精彩世界里 的一 切物 体都 是由 物质组 成的。 物质 有各 种属性 , 人们 始终在 不情 地探索着。 随着 物质的 各种 新属性的 不断 发现 , 一些 新材料也 应运 而生 , 从而 使我 们的 生活也 变得 越来 越丰富多 彩。 物体所 含的 物质有 的多 , 有的 少 , 本章 就先 从这 里开始探究。 物体的 质量如 图 5 一 1 所示 , 盛满 水的 硫和 盆 , 哪个装 的水 多 ? 充足气 的篮球和 乒乓球， 哪个里 面的 空气多 ? 汽车轮胎和 自行车 轮胎 , 哪个用 的橡胶材料多 ? nn 的 . 本 ioJf i ) 和心 人 YANwsw o 全约 和 (b) (c) 图 5 1 比较物质的 多少 事实表明 , 组成 物体的 物质有 多有 少。 物理学中 , 把物体所 含物质的 多少 叫做物体的 质量 (mass )。 那么 , 物体的 质量会 不会 随着 它的 形状的 变化 、 位置 的移动而 发生变化 呢 ? 请观察并 讨论图 5 一 2 所示 的几 种情况。 110 是 .. 六 p 后， 5 g ei) 1 人 B 心二 4 23 本一 人 2 村 5 本一 (a) 钢锭被 压成 钢板， 形状 变了， 质量 不变 (b) 航天员 飞向 太空， 空间 位置 变了， 质量 不变 图 5 2 物体的 质量不 会随 形状和 位置 而变化上 述事 实说明 : 一个 物体的 质量不 因为它 的和 _ 等的 变化而 变化。 可见 , 质量是 物体的 一个 基本属性。 全 cs 随痢 村学 的发 展 , 人们 对国生质量的 认识也 不断 深入。20 世 2 二纪 初 , 爱因 斯坦 在相对论 中指 二 5 息有 芝后 全",768,0.40602945448849687,medium-low,ocr,".1 物体 的 质量\n我 们 周围 的 世界 是 如 此 纷繁 多 姿 , 这 个 精彩 世界 里 的 一 切 物 体 都 是 由 物质 组\n成 的 。 物 质 有 各 种 属性 , 人 们 始终 在 不 情 地 探索 着 。 随 着 物质 的 各 种 新 属性 的 不 断\n发 现 , 一 些 新 材料 也 应 运 而 生 , 从 而 使 我 们 的 生活 也 变 得 越 来 越 丰富 多 彩 。\n物体 所 含 的 物质 有 的 多 , 有 的 少 , 本 章 就 先 从 这 里 开始 探究 。\n物体 的 质量 |\n如 图 5 一 1 所 示 , 盛 满 水 的 硫 和 盆 , 哪个 装 的 水 多 ? 充足 气 的 篮球 和 乒乓 球 ，\n哪个 里 面 的 空气 多 ? 汽车 轮胎 和 自行 车 轮胎 , 哪个 用 的 橡胶 材料 多 ?\nnn 的 .\n本 ioJf »\n® EL\n—| <i < #\n) | 和 心\n人\nYANwsw\n€o 全 —\n约 和\n(b) (c)\n图 5-1 比较 物质 的 多 少\n事实 表明 , 组 成 物体 的 物质 有 多 有 少 。 物 理学 中 , 把 物体 所 含 物质 的 多 少\n叫做 物体 的 质量 (mass ) 。\n那么 , 物体 的 质量 会 不 会 随 着 它 的 形状 的 变化 、 位 置 的 移动 而 发 生变 化\n呢 ? 请 观察 并 讨论 图 5 一 2 所 示 的 几 种 情况 。\n110\n=== 第 22 页 ===\n是 .. 六\n—p 后， 5\ng ei) 1 人 >\nB- 心 二 4 © 23\n本 一\n人\n2 村\n5 本 一\n(a) 钢锭 被 压 成 钢板 ， 形 状 变 了 ， 质 量 不 变 (b) 航天 员 飞 向 太空 ， 空 间 位 置 变 了 ， 质 量 不 变\n图 5-2 ”物体 的 质量 不 会 随 形状 和 位 置 而 变化\n上 述 事 实说 明 :\n一 个 物体 的 质量 不 因为 它 的 和 _ 等 的 变化 而 变化 。\n可 见 , 质量 是 物体 的 一 个 基本 属性 。\n全 cs\n随 痢 村 学 的 发 展 , 人 们 对 国生\n质量 的 认识 也 不 断 深入 。20 世 [2 二\n纪 初 , 爱 因 斯 坦 在 相对 论 中 指 二 5 息 有 芝 后 全",2.0,75.28873239436619,沪科技粤教版_八年级_义务教育教科书·物理八年级上册,18,2025-07-21T14:25:05.891Z,2.0,义务教育教科书·物理八年级上册,/Users/LeoQin/Documents/GitHub/PDFconvertor/training_data/初中/物理/沪科技粤教版-上海科学技术出版社、广东教育出版社/八年级/义务教育教科书·物理八年级上册.pdf,八年级,tesseract.js-parallel,unknown,0.800376647834275,0.7,1,75.28873239436619,true,true,,true,true,,physics,上册,沪科技粤教版_八年级_义务教育教科书·物理八年级上册.json,物理,142,初中_物理_沪科技粤教版_八年级_义务教育教科书·物理八年级上册
沪科技粤教版_八年级_义务教育教科书·物理八年级上册_chunk_4,4,"质量不 会随 形状和 位置 而变化上 述事 实说明 : 一个 物体的 质量不 因为它 的和 _ 等的 变化而 变化。 可见 , 质量是 物体的 一个 基本属性。 全 cs 随痢 村学 的发 展 , 人们 对国生质量的 认识也 不断 深入。20 世 2 二纪 初 , 爱因 斯坦 在相对论 中指 二 5 息有 芝后 全出 ,物体的 质量会 随着 速度的 全改变而 变化 , 当物 体的 速度接 2 近光 速时 ,质量会 变得 极大。， 现在 , 科学家 在高 能煌 子加 速。 图 5 3 高能 粒子加 速器 器实验中 已证 实了 爱因 斯坦 的观点。 物体的 运动速度通常比 光速小 得多 , 物体的 质量可 认为不 随位 置 、 形状 、 状态、 运动速度的 改变而 发生变化。 质量的 单位要 测量物体的 质量 , 首先就 应规定质量的 单位。 在国际单位制 中 ,质量的 单位是 千克 (kilogram) , 符号是 Kg。 最初 规定 1000 cm 的纯 水在 4 C 时的 质量为 1 kg。 后来, 人们据 此用 铂撩 合金制 成一 个国际千克原 器 (图 5 一 4) , 存放在 法国 巴黎国际计量局 中。 111 ee 二为 了实际需要 , 人们 还规定了 比千 克大 的单位 , 如 P 吨 (0 , 比千克小 的单位 , 如克 (8) 、 毫克 (mg) 等。 人部 分质量单位的 换算关系由 H 重结 位日 要 __ n, : 一是 eraog Tiecioos istoome 图 5 4 国际千克原 器请 填写一 些物 体的 质量单位。 aef0d、 Y 全 F .二 P w p 1 j 上二 二 116 (a) 一根 眼睫毛的 (b) 30 粒大米的 ( ) 15 个鸡蛋的 (d) 1 头大 象的",767,0.3743870702765818,low,ocr,"质量 不 会 随 形状 和 位 置 而 变化\n上 述 事 实说 明 :\n一 个 物体 的 质量 不 因为 它 的 和 _ 等 的 变化 而 变化 。\n可 见 , 质量 是 物体 的 一 个 基本 属性 。\n全 cs\n随 痢 村 学 的 发 展 , 人 们 对 国生\n质量 的 认识 也 不 断 深入 。20 世 [2 二\n纪 初 , 爱 因 斯 坦 在 相对 论 中 指 二 5 息 有 芝 后 全\n出 ,物体 的 质量 会 随 着 速度 的 全\n改变 而 变化 , 当 物 体 的 速度 接 2\n近 光 速 时 ,质量 会 变 得 极 大 。 ，\n现在 , 科学 家 在 高 能 煌 子 加 速 。 图 5-3 高 能 粒子 加 速 器\n器 实验 中 已 证 实 了 爱 因 斯 坦 的 观点 。\n物体 的 运动 速度 通常 比 光速 小 得 多 , 物体 的 质量 可 认为 不\n随 位 置 、 形 状 、 状态、 运动 速度 的 改变 而 发 生变 化 。\n质量 的 单位 |\n要 测量 物体 的 质量 , 首先 就 应 规定 质量 的 单位 。\n在 国际 单位 制 中 ,质量 的 单位 是 千克 (kilogram) , 符号 是 Kg。 最 初 规定\n1000 cm 的 纯 水 在 4 C 时 的 质量 为 1 kg。 后来, 人们 据 此 用 铂 撩 合金 制 成 一 个\n国际 千克 原 器 (图 5 一 4) , 存放 在 法 国 巴黎 国际 计量 局 中 。\n111\n=== 第 23 页 ===\nee\n二\n为 了 实际 需要 , 人 们 还 规定 了 比 千 克 大 的 单位 , 如 “P ¥\n吨 (0 , 比 千克 小 的 单位 , 如 克 (8) 、 毫克 (mg) 等 。 人\n部 分 质量 单位 的 换算 关系 | & 由\nH 重 结 位 日 要 __—n,\n- ‘ : 一 是\neraog  Tiecioos [istoome\n图 5-4 ”国际 千克 原 器\n请 填写 一 些 物 体 的 质量 单位 。\naef0d、 NEES ~Y ~\n全 F .二 P\nw p 1 AR j—\n上 二 二 116\n(a) 一 根 眼睫毛 的 (b) 30 粒 大米 的 (¢) 15 个 鸡蛋 的 (d) 1 头 大 象 的",2.0,75.28873239436619,沪科技粤教版_八年级_义务教育教科书·物理八年级上册,19,2025-07-21T14:25:05.891Z,2.0,义务教育教科书·物理八年级上册,/Users/LeoQin/Documents/GitHub/PDFconvertor/training_data/初中/物理/沪科技粤教版-上海科学技术出版社、广东教育出版社/八年级/义务教育教科书·物理八年级上册.pdf,八年级,tesseract.js-parallel,unknown,0.7271062271062271,0.6,1,75.28873239436619,,true,,true,,,physics,上册,沪科技粤教版_八年级_义务教育教科书·物理八年级上册.json,物理,142,初中_物理_沪科技粤教版_八年级_义务教育教科书·物理八年级上册
