Chunk_ID,Chunk_Index,Content,Content_Length,Quality_Score,Reliability,Source_Type,Original_Content,Enhancement_Version,averageConfidence,book_name,chunkIndex,enhancementTimestamp,enhancementVersion,fileName,filePath,grade,ocrMethod,publisher,qualityMetrics_chineseCharRatio,qualityMetrics_coherenceScore,qualityMetrics_lengthScore,qualityMetrics_ocrConfidence,semanticFeatures_hasDefinition,semanticFeatures_hasExperiment,semanticFeatures_hasFormulas,semanticFeatures_hasNumbers,semanticFeatures_hasQuestion,semanticFeatures_isTableContent,semanticFeatures_subjectArea,semester,source_file,subject,totalPages,uniqueId
浙教版_九年级_义务教育教科书·数学九年级下册_chunk_5,5,"不同方向 上的 正投影来 表达物体的 形状和 大小 . 如图 3 14， 长方 体的 侧楼 与水 平投影面 和垂直 ,请与 同伴一 起探讨下 面的 问题 : 了 (1) 这个 长方 体的 四条 侧棱 在水 平投影摇 叶乞 面上 的正 投影是 什么图 形 ? A (2) 画出 长方 体在 水平 投影面 上的 正投 影 ( 棱在 水平 投影面 上的 正投影为 4 ), 得小 水平投影面 到的 正投影是 什么图 形 ? 它与 长方 体的 底面有 图 3 14 什么关系 ? 由上 面的 探究可 以发 现， 沿一 个方向的 物体的 正投影从 一个 方面反映了 物体的 形状和 大小 . 为了 全面 地反映一 个物体的 形状和 大小， 除了 水平 投影 面外 ,人们 常常再 选择正面和 侧面两 个投影面 9, 画出 物体的 正投影 . 如图 3 15, 长方 体正 投影面 上的 正投影是 一个 和矩形 4AABB, 全等 的矩 形， 从左 向右 在侧 投影面 上的 正投影是 一个 和矩形 AADD, 全等 的矩形 . 把侧 投影面 水平 投影面 分别 向右 、 向下 旋转 90。, 使三 个正 投影处 于同一平面， 如图 3 16. 这就 是人 们常用于 表示物体形状和 大小 的三 视图 . 正面和 出而 两不 投曙 分别 向称 正投影面 和全 投影面 ,如图 3_15. 第 3 章 wmssmRra 十司 2 和 ss 主视图左 视图正 投影面 便晤 是 2 水平 投影面 俯视图 图 3 15 了图 3 16 物体在 正投影面 上的 正投影叫做主 视图， 在水 平投影面 上的 正投影叫 做俯视图 ,在侧 投影面 上的 正投影叫做左 视图 . 主视图左 视图 和俯视图 合",741,0.41213252329749106,medium-low,ocr,"不 同方 向 上 的 正 投影 来 表达 物体 的 形状 和\n大 小 .\n如 图 3-14， 长 方 体 的 侧 楼 与 水 平 投影 面 和\n垂直 ,请 与 同伴 一 起 探讨 下 面 的 问题 : 了\n(1) 这 个 长 方 体 的 四 条 侧 棱 在 水 平 投影 摇 叶 乞\n面 上 的 正 投影 是 什么 图 形 ? A—\n(2) 画 出 长 方 体 在 水 平 投影 面 上 的 正 投\n影 ( 棱 AA 在 水 平 投影 面 上 的 正 投影 为 4 ), 得 “小 水平 投影 面\n到 的 正 投影 是 什么 图 形 ? 它 与 长 方 体 的 底面 有 图 3-14\n什么 关系 ?\n由 上 面 的 探究 可 以 发 现 ， 沿 一 个 方向 的 物体 的 正 投影 从 一 个 方面 反映\n了 物体 的 形状 和 大 小 . 为 了 全 面 地 反映 一 个 物体 的 形状 和 大 小 ， 除 了 水 平 投\n影 面 外 ,人 们 常常 再 选择 正面 和 侧面 两 个 投影 面 9, 画 出 物体 的 正 投影 .\n如 图 3-15, 长 方 体 正 投影 面 上 的 正 投影 是 一 个 和 矩形 4AABB, 全 等 的 矩\n形 ， 从 左 向 右 在 侧 投影 面 上 的 正 投影 是 一 个 和 矩形 AADD, 全 等 的 矩形 . 把\n侧 投影 面 \ 水 平 投影 面 分 别 向 右 、 向 下 旋转 90。, 使 三 个 正 投影 处 于 同一 平面 ，\n如 图 3-16. 这 就 是 人 们 常用 于 表示 物体 形状 和 大 小 的 三 视图 .\n© 正面 和 出 而 两 不 投 曙 分 别 向 称 正 投影 面 和 全 投影 面 ,如 图 3_15.\n第 3 章 =wmssmRra 十 司\n=== 第 67 页 ===\n2 和 ss\n主 视图 左 视图\n[% | 正 投影 面 | 便\n晤 | 是 2\n水 平 投影 面\n俯视 图\n图 3-15 了 图 3-16\n物体 在 正 投影 面 上 的 正 投影 叫做 主 视图 ， 在 水 平 投影 面 上 的 正 投影 叫\n做 俯视 图 ,在 侧 投影 面 上 的 正 投影 叫做 左 视 图 . 主 视图 左 视 图 和 俯视 图 合",2.0,76.96,浙教版_九年级_义务教育教科书·数学九年级下册,57,2025-07-21T14:25:06.215Z,2.0,义务教育教科书·数学九年级下册,/Users/LeoQin/Documents/GitHub/PDFconvertor/training_data/初中/数学/浙教版-浙江教育出版社/九年级/义务教育教科书·数学九年级下册.pdf,九年级,tesseract.js-parallel,unknown,0.8358490566037736,0.5,1,76.96,true,,,true,true,,unknown,下册,浙教版_九年级_义务教育教科书·数学九年级下册.json,数学,100,初中_数学_浙教版_九年级_义务教育教科书·数学九年级下册
浙教版_九年级_义务教育教科书·数学九年级下册_chunk_6,6,"十司 2 和 ss 主视图左 视图正 投影面 便晤 是 2 水平 投影面 俯视图 图 3 15 了图 3 16 物体在 正投影面 上的 正投影叫做主 视图， 在水 平投影面 上的 正投影叫 做俯视图 ,在侧 投影面 上的 正投影叫做左 视图 . 主视图左 视图 和俯视图 合称 三视图 . 产生主 视图的 投射线 方向也 叫做主 视方向 . 从图 3 16 可以 看出， 在三 视图中 , 主视图和 俯视图 共同反映了 物体左右方向的 尺寸 ,通常称 之为 长对 正 ; 主视图和 左视图共同反映了 物体上 下方向的 尺寸， 通常 称之 为高 平齐 ""; 俯视图 和左 视图共同反映了 物体前 后方向的 尺寸， 通常 称之 为宽 相等 长对 正高 平齐 、 宽相等 ""是画 三视图必须遵循的 法则 . 在画 三视图时， 我们 一般 先选择主 视方 向 , 画出 主视图 ,再把 左视图画 在主 视图的 右边 ,把俯视图 画在 主视 图的 下方 . 例 1 如图 3 17， 一个 长方 体的 底面是 一个 正方形 . 请按 立体图 的尺 才大 小和 指定的 主视 方向 画出 三视图 . 解所 求三 视图如 图 3 18. 主人 Eee L 上局 主视 方向俯视图 图 3 17 图 3 18 66 下 ms he 1.1 锐角三 角函 数六 2. 两个 物体在 倾斜角 不同 的斜面上 向上 运动相 同的 距离 ,它们上 升的 高度 相同吗 ? (CT) 从图 1 1 我们 可以 看到 ,在倾斜角 ( a, 二 B) 不同 的两 个斜面上 ,物体移动的 距离都 是 1, 而它 在水 平和铅 垂两 个方向上 运动的 距离却 各不 相同 . 物体在 斜面一 一全 一",734,0.44287092676056333,medium-low,ocr,"十 司\n=== 第 67 页 ===\n2 和 ss\n主 视图 左 视图\n[% | 正 投影 面 | 便\n晤 | 是 2\n水 平 投影 面\n俯视 图\n图 3-15 了 图 3-16\n物体 在 正 投影 面 上 的 正 投影 叫做 主 视图 ， 在 水 平 投影 面 上 的 正 投影 叫\n做 俯视 图 ,在 侧 投影 面 上 的 正 投影 叫做 左 视 图 . 主 视图 左 视 图 和 俯视 图 合\n称 三 视图 . 产生 主 视图 的 投射 线 方向 也 叫做 主 视 方向 . 从 图 3-16 可 以 看 出 ，\n在 三 视图 中 , 主 视图 和 俯视 图 共同 反映 了 物体 左右 方向 的 尺寸 ,通常 称 之 为\n“长 对 正 ”; 主 视图 和 左 视图 共同 反映 了 物体 上 下 方向 的 尺寸 ， 通 常 称 之 为\n“高 平 齐 ""; 俯视 图 和 左 视图 共同 反映 了 物体 前 后 方向 的 尺寸 ， 通 常 称 之 为\n“ 宽 相 等 ”\n“长 对 正 \ 高 平 齐 、 宽 相等 ""是 画 三 视图 必须 遵循 的 法 则 . 在 画 三 视图 时 ，\n我 们 一 般 先 选择 主 视 方 向 , 画 出 主 视图 ,再 把 左 视图 画 在 主 视图 的 右边 ,把\n俯视 图 画 在 主 视 图 的 下 方 .\n例 1 如 图 3-17， 一 个 长 方 体 的 底面 是 一 个 正方 形 . 请 按 立体 图 的 尺\n才 大 小 和 指定 的 主 视 方 向 画 出 三 视图 .\n解 ” 所 求 三 视图 如 图 3-18. 主人 Eee\nL\n上 局\n主 视 方向 俯视 图\n图 3-17 图 3-18\n| 66 下 ms he\n=== 第 68 页 ===\n1.1 锐角 三 角 函 数 六\n2.= 两 个 物体 在 倾斜 角 不 同 的 斜面 上 向 上 运动 相\n同 的 距离 ,它们 上 升 的 高 度 相同 吗 ?\n(CT)\n从 图 1-1 我 们 可 以 看 到 ,在 倾斜 角 ( <a, 二 B) 不 同\n的 两 个 斜面 上 ,物体 移动 的 距离 都 是 1, 而 它 在 水 平和 |\n铅 垂 两 个 方向 上 运动 的 距离 却 各 不 相同 . 物体 在 斜面 “一 一 全 一",2.0,76.96,浙教版_九年级_义务教育教科书·数学九年级下册,58,2025-07-21T14:25:06.215Z,2.0,义务教育教科书·数学九年级下册,/Users/LeoQin/Documents/GitHub/PDFconvertor/training_data/初中/数学/浙教版-浙江教育出版社/九年级/义务教育教科书·数学九年级下册.pdf,九年级,tesseract.js-parallel,unknown,0.8390804597701149,0.5,1,76.96,true,,,true,true,,physics,下册,浙教版_九年级_义务教育教科书·数学九年级下册.json,数学,100,初中_数学_浙教版_九年级_义务教育教科书·数学九年级下册
浙教版_九年级_义务教育教科书·数学九年级下册_chunk_7,7,"4 八 g As 棱柱是 特殊的 几何体 ,分为 直楼 柱和 斜棱柱 , 现阶段我 们只 讨论直 楼柱， 直棱柱的 上下 底面可 以是 三角形四边形、 五边 形侧 面都 是矩形 ,上 、 下底面是 全等 多边 形 . 根据底面图 形的 边数 ,我们 就说 它是 直三 棱柱直 四楼 柱 、 直五 楼柱 ( 图 3 19). 底面 2 ng 加站 FeT 直五 棱柱直 六棱柱图 3 19 长方 体和 立方体 都是 直四 棱柱 . 例 2 一个 直五 棱柱的 立体图 如图 3 20 所示 , 它的 底面形状是 一个 正方形被 裁去 一个 等腰 三角形后 所成 的五 边形，。， 单位 :em 立体图 上标注的 尺寸是 实际尺寸 (单位 :cm)， 选取适当的 比例画 出它 的三 视图 . 解按 1:2 的比例 , 画出 三视图如 图 3 21. ? 主视图左 视图 4， 主视 方向正二全 7 到看 不到 的轮 廊线 通常画 成虚线 . 俯视图 _ 图 3 21 第 3 章 7 1. 如图 为一 个立方体 和它 的三 视图 , 完成下 面的 填空主 视图 左视图 H G R C A G 硬围 人 N M 面 4 B K L 主视 方向俯视图 (第 1 题 ) (1) 4D 在正 投影面 上的 正投影是 ,在水 平投影面 上的 正投影是 . (2) 侧面 BCCiB, 在正 投影面 上的 正投影是 ,在侧 投影面 上的 正投影是 . 2. 如图 是底面为 正方形 的直 四棱柱, 下面有 关它 的三 个视图的 说法 正确的 是 ( ) (A) 俯视图 与主 视图相同 . (B) 左视图与 主视图相同 . (C) 左视 图与 俯视图 相同 . (D) 三个 视图都 相同 . 主视 方向",747,0.3934499776678445,low,ocr,"| 4 八 g As\n=== 第 69 页 ===\n棱柱 是 特殊 的 几何 体 ,分 为 直 楼 柱 和 斜 棱柱 , 现 阶段 我 们 只 讨论 直 楼 柱 ，\n直 棱柱 的 上 下 底面 可 以 是 三 角形 四边形、 五 边 形 …… 侧 面 都 是 矩形 ,上 、 下\n底面 是 全 等 多 边 形 . 根据 底面 图 形 的 边 数 ,我 们 就 说 它 是 直 三 棱柱 \ 直 四 楼\n柱 、 直 五 楼 柱 ……( 图 3-19).\n底面\n2 ng\n| | | |\n加 站\nFeT - RE 直 五 棱柱 直 六 棱柱\n图 3-19\n长 方 体 和 立方 体 都 是 直 四 棱柱 .\n例 2 ”一 个 直 五 棱柱 的 立体 图 如 图 3-20 所 示 , 它 的 底面 形状 是 一 个 正\n方形 被 裁 去 一 个 等 腰 三 角形 后 所 成 的 五 边 形 ，。 ， 单位 :em\n立体 图 上 标注 的 尺寸 是 实际 尺寸 (单位 :cm)，\n选取 适当 的 比例 画 出 它 的 三 视图 .\n解 按 1:2 的 比例 , 画 出 三 视图 如 图 3-21. ?\n主 视图 左 视 图 4 ， 主 视 方向\n正二 全 |\n[7 到\n看 不 到 的 轮 廊\n线 通常 画 成 虚线 .\n俯视 图\n_—\n图 3-21\n第 3 章 7 |\n=== 第 70 页 ===\n1. 如 图 为 一 个 立方 体 和 它 的 三 视图 , 完成 下 面 的 填空\n主 视 图 左 视图\nH G R C\nA G 硬 围\n人\n| N M\n‘ 面\n4 B K L\n主 视 方向 俯视 图\n(第 1 题 )\n(1) # 4D 在 正 投影 面 上 的 正 投影 是 ,在 水 平 投影 面 上\n的 正 投影 是 .\n(2) 侧面 BCCiB, 在 正 投影 面 上 的 正 投影 是 ,在 侧 投影 面\n上 的 正 投影 是 .\n2. 如 图 是 底面 为 正方 形 的 直 四 棱柱, 下面 有 关 它 的\n三 个 视图 的 说 法 正确 的 是 (  )\n(A) 俯视 图 与 主 视图 相同 .\n(B) 左 视图 与 主 视图 相同 .\n(C) 左 视 图 与 俯视 图 相同 .\n(D) 三 个 视图 都 相同 .\n主 视 方向",2.0,76.96,浙教版_九年级_义务教育教科书·数学九年级下册,60,2025-07-21T14:25:06.215Z,2.0,义务教育教科书·数学九年级下册,/Users/LeoQin/Documents/GitHub/PDFconvertor/training_data/初中/数学/浙教版-浙江教育出版社/九年级/义务教育教科书·数学九年级下册.pdf,九年级,tesseract.js-parallel,unknown,0.7634615384615384,0.6,1,76.96,,,,true,true,,mathematics,下册,浙教版_九年级_义务教育教科书·数学九年级下册.json,数学,100,初中_数学_浙教版_九年级_义务教育教科书·数学九年级下册
浙教版_九年级_义务教育教科书·数学九年级下册_chunk_8,8,"iB, 在正 投影面 上的 正投影是 ,在侧 投影面 上的 正投影是 . 2. 如图 是底面为 正方形 的直 四棱柱, 下面有 关它 的三 个视图的 说法 正确的 是 ( ) (A) 俯视图 与主 视图相同 . (B) 左视图与 主视图相同 . (C) 左视 图与 俯视图 相同 . (D) 三个 视图都 相同 . 主视 方向 3. 如图 是一 个直 三棱柱的 立体图 和三 视图， 根据 立 (第 ? 题 ) 体图 上的 尺寸标注其 三视图的 尺寸 . 主视图左 视图 5 s 人俯视图 (第 3 题 ) 68 ss aa Q)1. 填写如 图直 六棱柱的 三个 视图的 名称 . 7 主视 方向 _ _ _ (第 1 题 ) 2. 如图 为一 个几何体 和它 的主 视图 ,请完成下 面的 填空 . (1) 几何体 的三 条侧 棱 44,,BB,, CC, 在正 投影面 上的 正投影分 别是 9 (2) 下底面在 正投影面 上的 正投影是 ; 左例 面矩形 AABB, 在正 投影面 上的 正投影是 . 主视图 Ai Ci G H F A H C D 了 E B (第 2 题 ) 3. 按 1:4 的比例画 出如 图长 方体 的三 视图 . 单位 :cm 1 1 主视 方向主 视方向 (第 3 题 ) (第 4 题 ) 二 4 一个 直棱柱的 底面是 边长 为 1 cm 的等 边三 角形， 便楼 长为 1.5 em. 了画 出它 的三 视图 (尺寸比例自选 )， 5. 一个 直棱柱的 高为 .4 cm, 它的 俯视图 是平行四 边形 (如图 ). 按 (第 5 题 ) 1:1 的比例画 出它 的三 视图 . 第 3 章 wmssRra 二本 2 下面 我们 来学 习怎 样画 圆柱 、 圆锥 等简单旋转体 的三 视图 .",768,0.3218560484848485,low,ocr,"iB, 在 正 投影 面 上 的 正 投影 是 ,在 侧 投影 面\n上 的 正 投影 是 .\n2. 如 图 是 底面 为 正方 形 的 直 四 棱柱, 下面 有 关 它 的\n三 个 视图 的 说 法 正确 的 是 (  )\n(A) 俯视 图 与 主 视图 相同 .\n(B) 左 视图 与 主 视图 相同 .\n(C) 左 视 图 与 俯视 图 相同 .\n(D) 三 个 视图 都 相同 .\n主 视 方向\n3. 如 图 是 一 个 直 三 棱柱 的 立体 图 和 三 视图 ， 根 据 立 (第 ? 题 )\n体 图 上 的 尺寸 标注 其 三 视图 的 尺寸 .\n主 视图 左 视图\n5 | |\n| |s\n人\n俯视 图\n(第 3 题 )\n| 68 ss aa\n=== 第 71 页 ===\nQ)1. 填写 如 图 直 六 棱柱 的 三 个 视图 的 名 称 .\n7\n主 视 方向 _ _ _\n(第 1 题 )\n2. 如 图 为 一 个 几何 体 和 它 的 主 视 图 ,请 完成 下 面 的 填空 .\n(1) 几何 体 的 三 条 侧 棱 44,,BB,, CC, 在 正 投影 面 上 的 正 投影 分 别\n是 9-\n(2) 下 底面 ABC 在 正 投影 面 上 的 正 投影 是 ;\n左 例 面 矩形 AABB, 在 正 投影 面 上 的 正 投影 是 .\n主 视图\nAi Ci G H F\n=\nA H C\nD 了 E\nB (第 2 题 )\n3. 按 1:4 的 比例 画 出 如 图 长 方 体 的 三 视图 .\n单位 :cm\n1\n1-\n主 视 方向 主 视 方向\n(第 3 题 ) (第 4 题 )\n二 4 一 个 直 棱柱 的 底面 是 边 长 为 1 cm 的 等 边 三 角形 ， 便 楼 长 为 1.5 em.\n了 画 出 它 的 三 视图 (尺寸 比例 自选 )，\n5. 一 个 直 棱柱 的 高 为 .4 cm, 它 的 俯视 图 是 平行 四 边 形 (如 图 ). 按\n(第 5 题 ) 1:1 的 比例 画 出 它 的 三 视图 .\n第 3 章 =wmssRra 二 本\n=== 第 72 页 ===\n2\n下 面 我 们 来 学 习 怎 样 画 圆柱 、 圆 锥 等 简单 旋转 体 的 三 视图 .",2.0,76.96,浙教版_九年级_义务教育教科书·数学九年级下册,61,2025-07-21T14:25:06.215Z,2.0,义务教育教科书·数学九年级下册,/Users/LeoQin/Documents/GitHub/PDFconvertor/training_data/初中/数学/浙教版-浙江教育出版社/九年级/义务教育教科书·数学九年级下册.pdf,九年级,tesseract.js-parallel,unknown,0.6975425330812854,0.5,1,76.96,,,,true,true,,mathematics,下册,浙教版_九年级_义务教育教科书·数学九年级下册.json,数学,100,初中_数学_浙教版_九年级_义务教育教科书·数学九年级下册
浙教版_九年级_义务教育教科书·数学九年级下册_chunk_9,9,"了画 出它 的三 视图 (尺寸比例自选 )， 5. 一个 直棱柱的 高为 .4 cm, 它的 俯视图 是平行四 边形 (如图 ). 按 (第 5 题 ) 1:1 的比例画 出它 的三 视图 . 第 3 章 wmssRra 二本 2 下面 我们 来学 习怎 样画 圆柱 、 圆锥 等简单旋转体 的三 视图 . 例 3 如图 3 22 ,一个 圆柱的 底面半径为 1.2 cm ,高为 1.6 cm. 按所 标的 主视 方向 说出 它在 正投影面 水平 投影面 侧投影面 上的 正投 影各 是什 么图 形 ,并按 指定的 主视 方向画 出它 的三 视图 (比例为 1 : 1). 解圆柱在 正投影面 上的 正投影是 矩形 ,在水 平投影面 上的 正投 影是 圆 ,在侧 投影面 上的 正投影是 矩形 . 其三 视图如 图 3 23. 主视图左 视图主 视方向图 3 22 全视图图 3 23 值得注意的 是 ,对于 同一个 物体 ,如果 选择 不同 的主 视方向 ,那么画 出的 三视图也 将不 同 . 画物体的 三视图时 我们 通常选择合适的 主视 方向 ,使得 三视图易 画 、 易读 . 对于 上例 的圆柱 ,如果按 图 3 24 的主 视方 向 ,那么其 三视图如 图 3 25 所示 . 主视图左 视图 主视 方向 国俯视图 图 3 24 图 3 25 170 和 as ha 例 4 如图 3 26 ,一个 圆锥的 底面直径为 8 cm ,高为 6cm. 按 1:4 的比例画 出它 的三 视图 . 分析 若以 垂直于 圆锥的 轴和 截面 a4BC 的方向为 主视 方向 (图 3 26 )， 则这 个圆锥在 正投影面 上的 正投影是 一个 底边 长为 8cm， 高为 6cm 的等",745,0.4149629314183124,medium-low,ocr,"了 画 出 它 的 三 视图 (尺寸 比例 自选 )，\n5. 一 个 直 棱柱 的 高 为 .4 cm, 它 的 俯视 图 是 平行 四 边 形 (如 图 ). 按\n(第 5 题 ) 1:1 的 比例 画 出 它 的 三 视图 .\n第 3 章 =wmssRra 二 本\n=== 第 72 页 ===\n2\n下 面 我 们 来 学 习 怎 样 画 圆柱 、 圆 锥 等 简单 旋转 体 的 三 视图 .\n例 3 如 图 3-22 ,一 个 圆柱 的 底面 半径 为 1.2 cm ,高 为 1.6 cm. 按 所 标\n的 主 视 方 向 说 出 它 在 正 投影 面 \ 水 平 投影 面 ` 侧 投影 面 上 的 正 投 影 各 是 什\n么 图 形 ,并 按 指定 的 主 视 方向 画 出 它 的 三 视图 (比例 为 1 : 1).\n解 圆柱 在 正 投影 面 上 的 正 投影 是 矩形 ,在 水 平 投影 面 上 的 正 投 影 是\n圆 ,在 侧 投影 面 上 的 正 投影 是 矩形 . 其 三 视图 如 图 3-23.\n主 视图 左 视图\n主 视 方向\n图 3-22 全 视图 图 3-23\n值得 注意 的 是 ,对 于 同一 个 物体 ,如 果 选 择 不 同 的 主 视 方向 ,那么 画 出\n的 三 视图 也 将 不 同 . 画 物体 的 三 视图 时 我 们 通常 选择 合适 的 主 视 方 向 ,使 得\n三 视图 易 画 、 易 读 .\n对 于 上 例 的 圆柱 ,如果 按 图 3-24 的 主 视 方 向 ,那么 其 三 视图 如 图 3-25\n所 示 . 主 视图 左 视 图\n主 视 方 向 国\n俯视 图\n图 3-24 图 3-25\n170 和 as ha\n=== 第 73 页 ===\n例 4 如 图 3-26 ,一 个 圆锥 的 底面 直径 为 8 cm ,高 为 6cm. 按 1:4 的\n比例 画 出 它 的 三 视图 .\n分 析 若 以 垂直 于 圆锥 的 轴 和 截面 a4BC 的 方向 为 主 视 方 向 (图 3-26 )，\n则 这 个 圆锥 在 正 投影 面 上 的 正 投影 是 一 个 底 边 长 为 8cm， 高 为 6cm 的 等",2.0,76.96,浙教版_九年级_义务教育教科书·数学九年级下册,62,2025-07-21T14:25:06.215Z,2.0,义务教育教科书·数学九年级下册,/Users/LeoQin/Documents/GitHub/PDFconvertor/training_data/初中/数学/浙教版-浙江教育出版社/九年级/义务教育教科书·数学九年级下册.pdf,九年级,tesseract.js-parallel,unknown,0.75,0.5,1,76.96,,,,true,,,mathematics,下册,浙教版_九年级_义务教育教科书·数学九年级下册.json,数学,100,初中_数学_浙教版_九年级_义务教育教科书·数学九年级下册
浙教版_九年级_义务教育教科书·数学九年级下册_chunk_10,10,"例 4 如图 3 26 ,一个 圆锥的 底面直径为 8 cm ,高为 6cm. 按 1:4 的比例画 出它 的三 视图 . 分析 若以 垂直于 圆锥的 轴和 截面 a4BC 的方向为 主视 方向 (图 3 26 )， 则这 个圆锥在 正投影面 上的 正投影是 一个 底边 长为 8cm， 高为 6cm 的等 腰三 角形 ,在水 平投影面 上的 正投影是 直径为 8 cm 的圆 ,在侧 投影面 上的 正投 影与 在正 投影面 上的 正投 影相 同 . 按 1:4 的比例 , 主视图左 视图是 底边 长为 2 cm ,高线 长为 1.5cm 的等 腰三 角形 ,俯视图 是直径为 2cm 的圆 . 解所 求三 视图如 图 3 27. 主视图左 视图 A a. O) 主视 方向俯视图 图 3 26 图 3 27 1. 下列 选项 中 ,如图 圆柱的 三视图画 法正确的 是 ( ) (A) FmE 左视图 (B)。 主视图左 视图圆柱 _ O 俯视图 俯视图 (c) 主视图左 视图 (p) 主视 图左 视图俯视图 俯视图 圆锥的 轴鹤 面指 过圆锥项 点和 底面圆心的 截面 . 第 3 章三 视图与 表面展开图 71 2. 球的 三个 视图是 什么图 形 ? 3. 已知 一个 圆锥的 底面半径为 1. 5 em ,高为 3 em. 按 1: 1 的比例画 出这 个圆锥的 三视图 ( 主视 方向自选 9). O1 将图 中的 实物与 它的 主视图用 线连 起来 . w (第 1 题 ) 2. 一个 圆柱和 一个 长方 体如 图放置 ,说出 下面 两组 视图分 别是 什么 视图 . 攻加 Ol 国国 主视 方向 (第 2 题 ) 3. 如图 为一 个圆柱的 主视图和 左视图 , 补画 它的 俯视图 . 主视 图左 视图 (第 3 题 )",773,0.3815557379310345,low,ocr,"=== 第 73 页 ===\n例 4 如 图 3-26 ,一 个 圆锥 的 底面 直径 为 8 cm ,高 为 6cm. 按 1:4 的\n比例 画 出 它 的 三 视图 .\n分 析 若 以 垂直 于 圆锥 的 轴 和 截面 a4BC 的 方向 为 主 视 方 向 (图 3-26 )，\n则 这 个 圆锥 在 正 投影 面 上 的 正 投影 是 一 个 底 边 长 为 8cm， 高 为 6cm 的 等\n腰 三 角形 ,在 水 平 投影 面 上 的 正 投影 是 直径 为 8 cm 的 圆 ,在 侧 投影 面 上 的\n正 投 影 与 在 正 投影 面 上 的 正 投 影 相 同 . 按 1:4 的 比例 , 主 视图 `\ 左 视图 是\n底 边 长 为 2 cm ,高 线 长 为 1.5cm 的 等 腰 三 角形 ,俯视 图 是 直径 为 2cm 的 圆 .\n解 ”所 求 三 视图 如 图 3-27.\n主 视图 左 视图\nA\na. O)\n主 视 方向 俯视 图\n图 3-26 图 3-27\n1. 下 列 选 项 中 ,如 图 圆柱 的 三 视图 画 法 正确 的 是 ( )\n(A)  FmE 左 视图 (B) 。 主 视图 左 视图\n圆柱\n_ [| O\n俯视 图 俯视 图\n(c) 主 视图 左 视图 (p) 主 视 图 左 视图\n俯视 图 俯视 图\n@ 圆锥 的 轴 鹤 面 指 过 圆锥 项 点 和 底面 圆心 的 截面 .\n第 3 章 三 视图 与 表面 展开 图 ¥ 71 |\n=== 第 74 页 ===\n2. 球 的 三 个 视图 是 什么 图 形 ?\n3. 已 知 一 个 圆锥 的 底面 半径 为 1. 5 em ,高 为 3 em. 按 1: 1 的 比例 画\n出 这 个 圆锥 的 三 视图 ( 主 视 方向 自选 9).\nO1 将 图 中 的 实物 与 它 的 主 视图 用 线 连 起 来 .\n—— %\nw\n(第 1 题 )\n2. 一 个 圆柱 和 一 个 长 方 体 如 图 放置 ,说 出 下 面 @@@ 两 组 视图 分 别 是 什\n么 视图 .\n攻\n加 Ol 国 国\n® @\n主 视 方向\n(第 2 题 )\n3. 如 图 为 一 个 圆柱 的 主 视图 和 左 视图 , 补 画 它 的 俯视 图 .\n主 视 图 左 视 图\n(第 3 题 )",2.0,76.96,浙教版_九年级_义务教育教科书·数学九年级下册,63,2025-07-21T14:25:06.215Z,2.0,义务教育教科书·数学九年级下册,/Users/LeoQin/Documents/GitHub/PDFconvertor/training_data/初中/数学/浙教版-浙江教育出版社/九年级/义务教育教科书·数学九年级下册.pdf,九年级,tesseract.js-parallel,unknown,0.7309833024118738,0.5,1,76.96,,,,true,true,,mathematics,下册,浙教版_九年级_义务教育教科书·数学九年级下册.json,数学,100,初中_数学_浙教版_九年级_义务教育教科书·数学九年级下册
