Chunk_ID,Chunk_Index,Content,Content_Length,Quality_Score,Reliability,Source_Type,Original_Content,Enhancement_Version,averageConfidence,book_name,chunkIndex,enhancementTimestamp,enhancementVersion,fileName,filePath,grade,ocrMethod,publisher,qualityMetrics_chineseCharRatio,qualityMetrics_coherenceScore,qualityMetrics_lengthScore,qualityMetrics_ocrConfidence,semanticFeatures_hasDefinition,semanticFeatures_hasExperiment,semanticFeatures_hasFormulas,semanticFeatures_hasNumbers,semanticFeatures_hasQuestion,semanticFeatures_isTableContent,semanticFeatures_subjectArea,semester,source_file,subject,totalPages,uniqueId
浙教版_九年级_义务教育教科书·数学九年级下册_chunk_0,0,"倾仪， 可用 来测量观察目标时 的仰角和 俯角 . 它由 度 ; 盘 、 铅锤 和支 杆组 成 . 测量时 ,将支 杆插入地 面 , 使支 桂的 p 厅 ;中心线 铅垂 线和 度盘 的 0 刻度 线重合 ,这时 度盘 的直径 : ;PH 处于 水平 位置 . 转动度 盘， 使度 盘的 直径对 准测量 ; 目标， 这时 铅垂 线指 的度数就 是仰角或 俯角 的度数 . 你知道攻 ;这是 为什么吗 ? 度航 选择校园内 某一 目标物 ,用测 倾仪 测出 你所 需要的 数名 人 ; 据 ,并求 出目标物 的高 度 . 完成测量之 后 , 写一 份测量报告 . 的 ;报告中 要求 有以 下内 容 :测量的 示意图 、 测量 的操作过 程 、 ; 测得 的数据计算方法和 最终结果 等 26 下 ws 九年 级下 册亲爱的 同学 : 当这 册数 学教 笠书 效在 你面前时， 体葡 开始 了一 段新 的数学学 习之 旅， 翻开 新书， 你会 感受到 数学世界的 精彩 : 九年 级下 册主 要内 容有 解直 育三 角形， 直线 与圆 的住 置关系， 三视图与 表面展开图 . 通过解 直角 三角 形一 章的 学习， 我们 将议 识一 类新 的函数， 它为 我们 解决许多有 关图 形计 浴的 问题提供了 简革 的方法 :在这 一册 中 , 我们 将进一步学 习图 的知识， 了解 查线 与圆 的位 置关 了夭 及其 应用 .通过三 视图与 表而 展开图 的学 习， .将使 我和 建立起 平面图 形和 立体图 形的 联系， 如用 三视图来 描述几何体， 简单 元何 体的 表面展开图 等 . 这册 新的 数学教科书， 保持 了前 元册 的体例 、 结构 和理念 . 合作 学",736,0.43001328740740735,medium-low,ocr,"倾 仪 ， 可 用 来 测量 观察 目标 时 的 仰角 和 俯 角 . 它 由 度  |\n; 盘 、 铅 锤 和 支 杆 组 成 . 测量 时 ,将 支 杆 插入 地 面 , 使 支 桂 的 p 厅\n;中心 线 \ 铅 垂 线 和 度 盘 的 0* 刻 度 线 重合 ,这 时 度 盘 的 直径 AW :\n;PH 处 于 水 平 位 置 . 转动 度 盘 ， 使 度 盘 的 直径 PH 对 准 测量\n; ”目标 ， 这 时 铅 垂 线 指 的 度数 就 是 仰角 或 俯 角 的 度数 . 你 知道 攻\n;这 是 为 什么 吗 ? 度 航\n选择 校园 内 某 一 目标 物 ,用 测 倾 仪 测 出 你 所 需要 的 数 名 人\n; “ 据 ,并 求 出 目标 物 的 高 度 . 完成 测量 之 后 , 写 一 份 测量 报告 . 的\n;报告 中 要 求 有 以 下 内 容 :测量 的 示意 图 、 测 量 的 操作 过 程 、\n; 测 得 的 数据 计算 方法 和 最 终结 果 等\n[26 下 ws 九 年 级 下 册\n=== 第 24 页 ===\n亲爱 的 同学 :\n当 这 册 数 学 教 笠 书 效 在 你 面前 时 ， 体 葡 开 始 了 一 段 新 的 数学 学 习 之 旅 ，\n翻 开 新 书 ， 你 会 感受 到 数学 世界 的 精彩 : 九 年 级 下 册 主 要 内 容 有 解 直\n育 三 角形 ， 直 线 与 圆 的 住 置 关系 ， 三 视图 与 表面 展开 图 . 通过 解 直 角 三 角\n形 一 章 的 学 习 ， 我 们 将 议 识 一 类 新 的 函数 ， 它 为 我 们 解决 许多 有 关 图 形 计\n浴 的 问题 提供 了 简 革 的 方法 :在 这 一 册 中 ,- 我 们 将 进一步 学 习 图 的 知识 ， 了\n解 查 线 与 圆 的 位 置 关 了 夭 及 其 应 用 .通过 三 视图 与 表 而 展开 图 的 学 习 ， .将 使\n我 和 建立 起 平面 图 形 和 立体 图 形 的 联系 ， 如 用 三 视图 来 描述 几何 体 ， 简 单\n元 何 体 的 表面 展开 图 等 .\n这 册 新 的 数学 教科 书 ， 保 持 了 前 元 册 的 体例 、 结 构 和 理念 .“ 合 作 学",2.0,76.96,浙教版_九年级_义务教育教科书·数学九年级下册,21,2025-07-21T14:25:06.215Z,2.0,义务教育教科书·数学九年级下册,/Users/LeoQin/Documents/GitHub/PDFconvertor/training_data/初中/数学/浙教版-浙江教育出版社/九年级/义务教育教科书·数学九年级下册.pdf,九年级,tesseract.js-parallel,unknown,0.8861003861003861,0.5,1,76.96,,true,,true,true,,mathematics,下册,浙教版_九年级_义务教育教科书·数学九年级下册.json,数学,100,初中_数学_浙教版_九年级_义务教育教科书·数学九年级下册
浙教版_九年级_义务教育教科书·数学九年级下册_chunk_1,1,"识， 了解 查线 与圆 的位 置关 了夭 及其 应用 .通过三 视图与 表而 展开图 的学 习， .将使 我和 建立起 平面图 形和 立体图 形的 联系， 如用 三视图来 描述几何体， 简单 元何 体的 表面展开图 等 . 这册 新的 数学教科书， 保持 了前 元册 的体例 、 结构 和理念 . 合作 学习 ""， 社你 与同伴一 起探索新 的数学知识 、 新的 数学方法 ; 探究活动 ""， 使你 亲身经 历短 识的 发生 过程， 体验 发现的 快乐 ; 阅读材料帮助你 了解 许多 有趣 的教学史实， 开阁 体的 教学视野 ; 而设计题 和课题学 习， 则为 你提高分 析和 解决问题的 能力， 并在 数学中 进行探索 、 实践 和创 新提供了 机会 . 数学是 重要的 基础学 科， 是学 习物 理 、 人化学、 地理、 生物、 经济等 学科 的必 备知识 ; 数学能 培养我 们的 思考能 力， 增强 届辑 性和 精确性， 使人 思维统 密 、 思路 清晰 ; 数学更 是认识了 世界， 把握 事物 本质 的科学， 有具有简 HXE, HAFATEN, BERFIHEFABGYSWA; 但数学也 并不 神秘， 只要 有充分的 兴趣和 良好的 方法， 每个 人都 可以 学好 它， 这套 教科 书按照教育部 最新 制订的 《义务教育数学课程标准 》 (2011 年版 ) 编写，7 9 年级 共 6 册 :. 我们 段切 希望 它能 成为 你的 朋友， 能鲁 帮助 你掌握数学知识， 提高 数学能 力， 欣赏 数学风力， 部受 学习 乐趣 . 祝你 学习 快乐， 学业 进步 ! 编会 徽中 的数学国际数学家 大会 (ICM) 和国际数学教育大 会 (ICME) 堪称 国际数学界",744,0.3488653112195121,low,ocr,"识 ， 了\n解 查 线 与 圆 的 位 置 关 了 夭 及 其 应 用 .通过 三 视图 与 表 而 展开 图 的 学 习 ， .将 使\n我 和 建立 起 平面 图 形 和 立体 图 形 的 联系 ， 如 用 三 视图 来 描述 几何 体 ， 简 单\n元 何 体 的 表面 展开 图 等 .\n这 册 新 的 数学 教科 书 ， 保 持 了 前 元 册 的 体例 、 结 构 和 理念 .“ 合 作 学\n习 ""， 社 你 与 同伴 一 起 探索 新 的 数学 知识 、 新 的 数学 方法 ; “探究 活动 ""，\n使 你 亲身 经 历 短 识 的 发 生 过 程 ， 体 验 “发现 ” 的 快乐 ; “阅读 材料 ”帮助 你\n了 解 许 多 有 趣 的 教学 史实 ， 开 阁 体 的 教学 视野 ; 而 “设计 题 ” 和 “课题 学\n习 ”， 则 为 你 提高 分 析 和 解决 问题 的 能 力 ， 并 在 数学 中 进行 探索 、 实 践 和 创\n新 提供 了 机 会 .\n数学 是 重要 的 基础 学 科 ， 是 学 习 物 理 、 人 化学、 地理、 生物、 经济 等 学\n科 的 必 备 知识 ; 数学 能 培养 我 们 的 思考 能 力 ， 增 强 届 辑 性 和 精确 性 ， 使 人\n思维 统 密 、 思 路 清晰 ; 数学 更 是 认识 了 世界， 把 握 事 物 本 质 的 科学 ， 有 具有 简\nHXE, AAEZIR\nHAFATEN, BERFIHEFABGYSWA; 但 数学 也 并 不 神\n秘 ， 只 要 有 充分 的 兴趣 和 良好 的 方法 ， 每 个 人 都 可 以 学 好 它 ，\n这 套 教 科 书 按照 教育 部 最 新 制订 的 《义务 教育 数学 课程 标准 》 (2011\n年 版 ) 编写 ，7~ 9 年 级 共 6 册 :. 我 们 段 切 希 望 它 能 成 为 你 的 朋友 ， 能 鲁 帮 助\n你 掌握 数学 知识 ， 提 高 数学 能 力 ， 欣 赏 数学 风力 ， 部 受 学 习 乐 趣 . 祝 你 学 习\n快乐 ， 学 业 进 步 !\n编\n=== 第 25 页 ===\n会 徽 中 的 数学\n= =\n国际 数学 家 大 会 (ICM) 和 国际 数学 教育 大 会 (ICME) 堪 称 国际 数学 界",2.0,76.96,浙教版_九年级_义务教育教科书·数学九年级下册,22,2025-07-21T14:25:06.215Z,2.0,义务教育教科书·数学九年级下册,/Users/LeoQin/Documents/GitHub/PDFconvertor/training_data/初中/数学/浙教版-浙江教育出版社/九年级/义务教育教科书·数学九年级下册.pdf,九年级,tesseract.js-parallel,unknown,0.818348623853211,0.6,1,76.96,,,,true,,,chemistry,下册,浙教版_九年级_义务教育教科书·数学九年级下册.json,数学,100,初中_数学_浙教版_九年级_义务教育教科书·数学九年级下册
浙教版_九年级_义务教育教科书·数学九年级下册_chunk_2,2,"cm. 求这 个等 腰三 角形的 腰长 和 AZG2 三角形的 面积 ( 腰长 精确到 01cm, 面积精确到 2 , 4 少 8. 如图 ,48 是的 内接 正五 边形 的边 长 . 求 ! 图中 弓形的 面积 (精确到 0.1 cm?). (第 8 题 ) 能用 锐角三 角函 数解决一 些简单的 实际问题动 和 5， 为测量一 条河 的宽度 , 某学 习小 组在 河南岸 的点 4 测得 河北岸 的树 C 恰好在 4 的正 北方向 ,然后向 东走 10 m 到达 思点 , 测得 树 C 在点 巨的 北偏 西 65"" 方向 . 画出 示意图 ,并求 出河 宽 (精确到 0.1 m). 10. 为了 解决楼 房之 间的 采光问题 , 某市 有关 部门 规定 :两剧 楼房 之间 的最 小距离要 使中 午 12 时不 能亦 光 . 如图 , 旧楼 的一 楼窗台高 Im， 现计划在 旧楼 正南 方 40m 处再 建一 幢新 楼 . 已知 该市 冬天中 午 12 时太阳从 正南 方照射的 光线与 水平 线的 夹角 最小 为 30"". 问 :新楼 房最 高可 建多 少米 (结果精确到 1m)? _30 . Ir 楼 1 T Fnm (第 10 题 ) 11. 飞行员 在空中观察地 面的 区域 是一 个圆 ( 如图 ). 当观 察角 为 50 , 飞机的 飞行高 度 4 0.8X 10 m 时， 观察 区域 的半径为 多少 米 (结果精确到 1 m)? 如果 观察角度不 变 ,要使 观察区 域面积增加 1 倍 ,那么飞机要 升高 多少 米 (精确到 1m)? 一 _Tor 一 (第 11 题 ) as aa 12. 如图 , 某轮船在 海上以 每小 时 30 海里的 速度向 正西方向 航行 . 上",754,0.3300373236889692,low,ocr,"cm. 求 这 个 等 腰 三 角形 的 腰 长 和\nAZG2\n三 角形 的 面积 ( 腰 长 精确 到 01cm, 面积 精确 到 “2 < , 4%\n少\n8. 如 图 ,48 是 OO 的 内 接 正 五 边 形 的 边 长 . 求 !\n图 中 弓形 的 面积 (精确 到 0.1 cm?). (第 8 题 )\n& EGGC @ 能 用 锐角 三 角 函 数 解决 一 些 简单 的 实际 问题\n动 和 5， 为 测量 一 条 河 的 宽度 , 某 学 习 小 组 在 河南 岸 的 点 4 测 得 河北 岸 的\n树 C 恰好 在 4 的 正 北方 向 ,然后 向 东 走 10 m 到 达 思 点 , 测 得 树 C\n在 点 巨 的 北 偏 西 65"" 方 向 . 画 出 示意 图 ,并 求 出 河 宽 (精确 到 0.1 m).\n10. 为 了 解决 楼 房 之 间 的 采光 问题 , 某 市 有 关 部 门 规定 :两 剧 楼 房 之 间\n的 最 小 距离 要 使 中 午 12 时 不 能 亦 光 . 如 图 , 旧 楼 的 一 楼 窗台 高 Im，\n现 计划 在 旧 楼 正 南 方 40m 处 再 建 一 幢 新 楼 . 已 知 该 市 冬天 中 午\n12 时 太阳 从 正 南 方 照射 的 光线 与 水 平 线 的 夹 角 最 小 为 30"". 问 :新\n楼 房 最 高 可 建 多 少 米 (结果 精确 到 1m)?\n_30°\n. Ir\n楼 |\n1\nT Fnm —|\n(第 10 题 )\n11. 飞行 员 在 空中 观察 地 面 的 区 域 是 一 个 圆 ( 如 图 ). 当 观 察 角 为 50°,\n飞机 的 飞行 高 度 4% 0.8X 10° m 时 ， 观 察 区 域 的 半径 为 多 少 米\n(结果 精确 到 1 m)? 如 果 观察 角度 不 变 ,要 使 观察 区 域 面积 增加\n1 倍 ,那么 飞机 要 升 高 多 少 米 (精确 到 1m)?\n一\n\\n_Tor\n~ 一\n(第 11 题 )\n[as aa\n=== 第 29 页 ===\n12. 如 图 , 某 轮船 在 海上 以 每 小 时 30 海里 的 速度 向 正 西方 向 航行 . 上",2.0,76.96,浙教版_九年级_义务教育教科书·数学九年级下册,26,2025-07-21T14:25:06.215Z,2.0,义务教育教科书·数学九年级下册,/Users/LeoQin/Documents/GitHub/PDFconvertor/training_data/初中/数学/浙教版-浙江教育出版社/九年级/义务教育教科书·数学九年级下册.pdf,九年级,tesseract.js-parallel,unknown,0.7088122605363985,0.5,1,76.96,,true,,true,true,,physics,下册,浙教版_九年级_义务教育教科书·数学九年级下册.json,数学,100,初中_数学_浙教版_九年级_义务教育教科书·数学九年级下册
浙教版_九年级_义务教育教科书·数学九年级下册_chunk_3,3,"). 这时 ,光线叫做投射线 ,投影所 在的 平面叫做投影面 . 如图 3 1, 地上 的树 影是 树在 阳光照射下 的投影 ,投射线 是太阳光线 ,投影面 就是 地面 ;图 3 2 是雕塑和 它在 灯光照射下 的投影 ,灯光光线就 是投射线 ,地面 就是 投影面 . Ae st pe ol df 图 3 1 图 3 2 由平行的 投射线 所形成的 投影叫做平行投影 (parallel projection). 例如， 太阳光线探照灯的 光线都 可以 看成 平行光线 ,它们所 形成的 投影就 是平行投影 . 在平行投影下 ,线段和 平面图 形的 投影与 图形 本身 、 投影 面 、 投射线之 间的 相对位 置有 什么关系 ? 请就 此问题作 一探讨 . 建议 : 1. 以 4 一 6 人为 一组 ,观察在 太阳光线下 , 木杆 和三 角形纸板在 地面 的投影 . 58 us 2. 不断 改变木 杆和 三角形纸板的 位置 . 什么时 候木 杆的 影子成 为一 个点 ,三角形纸板的 影子是 一条 线段 ? 当木 杆的 影子与 木杆 长度 相等时， 你发 现木 杆在 什么位 置 ? 三角形纸板在 什么位 置时， 它的 影子恰好与 三角形纸板成 为全 等图 形 ? 还有 其他 情况吗 ? 3. 根据前 面的 探索 ,你能 解释下 列示意图 (图 3 3 ,图 3 4) 的实际意 义吗 ? A dl M 上。 4 bs 让 r : r 投影面 P 投影面 投影面 (1) (2) (3) 图 3 3 7 外，， 认 1C lf 2 , ,Am 几六 六 7 人 aa (1) (2) (3) 图 3 4 例 1 如图 3 5， 已知 竖直 立在 地面 的甲 旗杆和 在太阳光线下 形成的 投影 ,在图 中画 出太阳光线 ,并画 出此 时竖 直立在 地面 的乙 旗杆的 投影 .",793,0.3531808747913189,low,ocr,").\n这 时 ,光线 叫做 投射 线 ,投影 所 在 的 平面 叫做 投影 面 . 如 图 3-1, 地 上 的 树 影\n是 树 在 阳光 照射 下 的 投影 ,投射 线 是 太阳 光线 ,投影 面 就 是 地 面 ;图 3-2 是\n雕塑 和 它 在 灯光 照射 下 的 投影 ,灯光 光线 就 是 投射 线 ,地 面 就 是 投影 面 .\nAe\nst FE pe\nol df\n图 3-1 图 3-2\n由 平行 的 投射 线 所 形成 的 投影 叫做 平行 投影 (parallel projection). 例如 ，\n太阳 光线 探照灯 的 光线 都 可 以 看 成 平行 光线 ,它们 所 形成 的 投影 就 是 平行\n投影 .\n在 平行 投影 下 ,线段 和 平面 图 形 的 投影 与 图 形 本 身 、 投 影 面 、 投 射线\n之 间 的 相对 位 置 有 什么 关系 ? 请 就 此 问题 作 一 探讨 .\n建议 :\n1. 以 4 一 6 人 为 一 组 ,观察 在 太阳 光线 下 , 木 杆 和 三 角形 纸板 在 地 面\n的 投影 .\n| 58 us GT\n=== 第 60 页 ===\n2. 不 断 改变 木 杆 和 三 角形 纸板 的 位 置 . 什么 时 候 木 杆 的 影子 成 为 一\n个 点 ,三 角形 纸板 的 影子 是 一 条 线段 ? 当 木 杆 的 影子 与 木 杆 长 度 相等 时 ，\n你 发 现 木 杆 在 什么 位 置 ? 三 角形 纸板 在 什么 位 置 时 ， 它 的 影子 恰好 与 三\n角形 纸板 成 为 全 等 图 形 ? 还 有 其 他 情况 吗 ?\n3. 根据 前 面 的 探索 ,你 能 解释 下 列 示意 图 (图 3-3 ,图 3-4) 的 实际 意\n义 吗 ?\nA\ndl M\n上 。 [4 bs / £ 让 r : r\n投影 面 P 投影 面 投影 面\n(1) (2) (3)\n图 3-3\n7 外 ，， | 认 1C lf\n2 ,| ,Am\n几 六 六 7\n[人 AAA aa\n(1) (2) (3)\n图 3-4\n例 1 如 图 3-5， 已 知 竖 直 立 在 地 面 的 甲 旗杆 和 在 太阳 光线 下 形成 的\n投影 ,在 图 中 画 出 太阳 光线 ,并 画 出 此 时 竖 直立 在 地 面 的 乙 旗杆 的 投影 .",2.0,76.96,浙教版_九年级_义务教育教科书·数学九年级下册,51,2025-07-21T14:25:06.215Z,2.0,义务教育教科书·数学九年级下册,/Users/LeoQin/Documents/GitHub/PDFconvertor/training_data/初中/数学/浙教版-浙江教育出版社/九年级/义务教育教科书·数学九年级下册.pdf,九年级,tesseract.js-parallel,unknown,0.7385159010600707,0.5,1,76.96,true,true,,true,true,,unknown,下册,浙教版_九年级_义务教育教科书·数学九年级下册.json,数学,100,初中_数学_浙教版_九年级_义务教育教科书·数学九年级下册
浙教版_九年级_义务教育教科书·数学九年级下册_chunk_4,4,"长相等 (3) 它们在 灯光下 的影子总 在同一侧 . (4) 它们在 阳光下 的影子总 在同一侧 . 2. 小杰 与小 刚身高相同 .一天 晚上 ,两人 在路 灯下 玩要 , 小刚 恰好站 在小 杰影 子的 头部 . 请在 图中 分别 画出 小杰 和小 刚的 影子 〈 用线 段表 示 ). 路灯 小杰 (第 2 题 ) 3. 在灯光的 照射下 ,一块 矩形 木板 在地 面上 形成的 影子如 图所 示 , 请画 出光源的 位置 . ss (第 3 题 ) (第 4 题 ) 入 4. 如图 ,在圆桌的 正上 方有 一萤 吊灯 ,在灯光下 ,圆桌在 地板 上的 投影是 面积为 0.81m ms 的圆 . 已知 圆桌的 高度 为 1 m， 圆桌面的 半径为 05m. 求吊灯距 地面 的高 度 . Os5. 某人 身高 18m, 开始 时站 在路 灯下 的影子长 为 3.6 m, 然后 他向 路灯 走近 3.6 m( 指水 平距离 ), 此时 他的 影子长 与身高相等 . 求路 灯高， 以及 开始时 他与 路灯 的水 平距离 . 64 下 ws ha 3 2 简单几何体 的三 视图 am as 如图 所示 的蒙古包 的上 部是 圆锥 ,下部 是国 柱 ,我们 怎样用 ES: 二平面图 形去 表示其 形状和 大小 呢 ? R (人 Er、 在平行投影中 ,如果 投射线垂直于 投影面 ,那么这 种投影就 称为 正投影 (orthogonal projection). 人们 常用不 同方向 上的 正投影来 表达物体的 形状和 大小 . 如图 3 14， 长方 体的 侧楼 与水 平投影面 和垂直 ,请与 同伴一 起探讨下 面的 问题 : 了 (1) 这个 长方 体的 四条 侧棱 在水 平投影摇 叶乞 面上 的正 投影是 什么图 形 ? A (2) 画出 长方 体在 水平 投影面 上的 正投",800,0.43852364337349403,medium-low,ocr,"长 相等\n(3) 它们 在 灯光 下 的 影子 总 在 同一 侧 .\n(4) 它们 在 阳光 下 的 影子 总 在 同一 侧 .\n2. 小 杰 与 小 刚 身高 相同 .一 天 晚上 ,两 人 在 路 灯 下 玩 要 , 小 刚 恰好 站\n在 小 杰 影 子 的 头 部 . 请 在 图 中 分 别 画 出 小 杰 和 小 刚 的 影子 〈 用 线\n段 表 示 ).\n路 灯 小 杰\n(第 2 题 )\n3. 在 灯光 的 照射 下 ,一 块 矩 形 木 板 在 地 面 上 形成 的 影子 如 图 所 示 , 请\n画 出 光源 的 位 置 .\nss \\n(第 3 题 ) (第 4 题 )\n入 4. 如 图 ,在 圆桌 的 正 上 方 有 一 萤 吊 灯 ,在 灯光 下 ,圆桌 在 地 板 上 的 投影\n是 面积 为 0.81m ms 的 圆 . 已 知 圆桌 的 高 度 为 1 m， 圆 桌面 的 半径 为\n05m. 求 吊灯 距 地 面 的 高 度 .\nOs5. 某 人 身高 18m, 开 始 时 站 在 路 灯 下 的 影子 长 为 3.6 m, 然 后 他 向 路 灯\n走 近 3.6 m( 指 水 平 距离 ), 此 时 他 的 影子 长 与 身高 相等 . 求 路 灯 高 ，\n以 及 开始 时 他 与 路 灯 的 水 平 距离 .\n[64 下 ws ha\n=== 第 66 页 ===\n3-2 简单 几何 体 的 三 视图\nam as\n如 图 所 示 的 蒙古 包 的 上 部 是 圆锥 ,下 部 是 国 柱 ,我 们 怎样 用 ES: 二\n平面 图 形 去 表示 其 形状 和 大 小 呢 ? R\n(人 Er、\n在 平行 投影 中 ,如 果 投 射线 垂直 于 投影 面 ,那么 这 种 投影 就 称 为 正 投影\n(orthogonal projection). 人 们 常用 不 同方 向 上 的 正 投影 来 表达 物体 的 形状 和\n大 小 .\n如 图 3-14， 长 方 体 的 侧 楼 与 水 平 投影 面 和\n垂直 ,请 与 同伴 一 起 探讨 下 面 的 问题 : 了\n(1) 这 个 长 方 体 的 四 条 侧 棱 在 水 平 投影 摇 叶 乞\n面 上 的 正 投影 是 什么 图 形 ? A—\n(2) 画 出 长 方 体 在 水 平 投影 面 上 的 正 投",2.0,76.96,浙教版_九年级_义务教育教科书·数学九年级下册,56,2025-07-21T14:25:06.215Z,2.0,义务教育教科书·数学九年级下册,/Users/LeoQin/Documents/GitHub/PDFconvertor/training_data/初中/数学/浙教版-浙江教育出版社/九年级/义务教育教科书·数学九年级下册.pdf,九年级,tesseract.js-parallel,unknown,0.7526501766784452,0.5,1,76.96,,,,true,true,,mathematics,下册,浙教版_九年级_义务教育教科书·数学九年级下册.json,数学,100,初中_数学_浙教版_九年级_义务教育教科书·数学九年级下册
