Chunk_ID,Chunk_Index,Content,Content_Length,Quality_Score,Reliability,Source_Type,Original_Content,Enhancement_Version,averageConfidence,book_name,chunkIndex,enhancementTimestamp,enhancementVersion,fileName,filePath,grade,ocrMethod,publisher,qualityMetrics_chineseCharRatio,qualityMetrics_coherenceScore,qualityMetrics_lengthScore,qualityMetrics_ocrConfidence,semanticFeatures_hasDefinition,semanticFeatures_hasExperiment,semanticFeatures_hasFormulas,semanticFeatures_hasNumbers,semanticFeatures_hasQuestion,semanticFeatures_isTableContent,semanticFeatures_subjectArea,semester,source_file,subject,totalPages,uniqueId
浙教版_九年级_义务教育教科书·数学九年级下册_chunk_11,11,"它的 主视图用 线连 起来 . w (第 1 题 ) 2. 一个 圆柱和 一个 长方 体如 图放置 ,说出 下面 两组 视图分 别是 什么 视图 . 攻加 Ol 国国 主视 方向 (第 2 题 ) 3. 如图 为一 个圆柱的 主视图和 左视图 , 补画 它的 俯视图 . 主视 图左 视图 (第 3 题 ) 和在 没有特别说 明的 情况下 , 画三 视图的 主视 方向可 自选 ,下同 . 72 仆 ws hrarm 人 4. 如图 是一 个底面直径与 高相等的 圆柱 , 按立体图 尺寸画 出它 的三 视图 . 单位 :mm T 1 (第 4 题 ) 160 (第 5 题 ) 5. 选取合适的 比例 , 画出 如图 圆锥的 三视图 . 运用我 们已 经掌握的 基本几何体 ( 直棱柱 、 圆柱 、 圆锥 、 球 ) 的三 视图的 画法 ,就能 画一 些简 单物体的 三视图 . 例 5 如图 3 28， 一个 蒙古包 上部 的圆锥部 分和 下部 的圆柱部 分的 高都 是 2m ,底面直径为 am. 以 1:200 的比例画 出它 的三 视图 . 分析 我们 可以 把蒙古包 看成 圆柱和 圆锥两 种几何体 的组 合体 . 利用三 视图的 正投影原理 ,想象出 蒙古包 在正 投影面 水平 投影面 侧投影面 上的 正投影的 图形 ,就可 画出 三视图 . 解按 1:200 的比例画 出蒙古包 的三 视图 ,如图 3 29. 主视图左 视图 局 w 俯视图 图 3 28 图 3 29 第 3 章三 视图与 表面展开图 73 例 6 如图 3 30 ,一个 六角 螺帽 毛坯底面正六边 形的 边长 为 120mm ,高为 120mm, 内孔 直径 为 120mm. 画出 这个 六角 螺帽 毛坯的 三视图 .",756,0.41625233684210516,medium-low,ocr,"它 的 主 视图 用 线 连 起 来 .\n—— %\nw\n(第 1 题 )\n2. 一 个 圆柱 和 一 个 长 方 体 如 图 放置 ,说 出 下 面 @@@ 两 组 视图 分 别 是 什\n么 视图 .\n攻\n加 Ol 国 国\n® @\n主 视 方向\n(第 2 题 )\n3. 如 图 为 一 个 圆柱 的 主 视图 和 左 视图 , 补 画 它 的 俯视 图 .\n主 视 图 左 视 图\n(第 3 题 )\n和 @ 在 没有 特别 说 明 的 情况 下 , 画 三 视图 的 主 视 方向 可 自选 ,下 同 .\n[72 仆 ws hrarm\n=== 第 75 页 ===\n人 4. 如 图 是 一 个 底面 直径 与 高 相等 的 圆柱 , 按 立体 图 尺寸 画 出 它 的 三 视图 .\n单位 :mm\n— T\n|\n1\n(第 4 题 ) 160 ==\n(第 5 题 )\n5. 选取 合适 的 比例 , 画 出 如 图 圆锥 的 三 视图 .\n运用 我 们 已 经 掌握 的 基本 几何 体 ( 直 棱柱 、 圆 柱 、 圆 锥 、 球 ) 的 三 视图 的\n画 法 ,就 能 画 一 些 简 单 物体 的 三 视图 .\n例 5 “如 图 3-28， 一 个 蒙古 包 上 部 的 圆锥 部 分 和 下 部 的 圆柱 部 分 的 高\n都 是 2m ,底面 直径 为 am. 以 1:200 的 比例 画 出 它 的 三 视图 .\n分 析 我 们 可 以 把 蒙古 包 看 成 圆柱 和 圆锥 两 种 几何 体 的 组 合体 . 利用 三\n视图 的 正 投影 原理 ,想象 出 蒙古 包 在 正 投影 面 \ 水 平 投影 面 \ 侧 投影 面 上 的\n正 投影 的 图 形 ,就 可 画 出 三 视图 .\n解 按 1:200 的 比例 画 出 蒙古 包 的 三 视图 ,如 图 3-29.\n主 视图 左 视 图\n局 w 俯视 图\n图 3-28 图 3-29\n第 3 章 三 视图 与 表面 展开 图 73 |\n=== 第 76 页 ===\n例 6 ”如 图 3-30 ,一 个 六 角 螺 帽 毛坯 底面 正六 边 形 的 边 长 为 120mm ,高\n为 120mm, 内 孔 直 径 为 120mm. 画 出 这 个 六 角 螺 帽 毛坯 的 三 视图 .",2.0,76.96,浙教版_九年级_义务教育教科书·数学九年级下册,64,2025-07-21T14:25:06.215Z,2.0,义务教育教科书·数学九年级下册,/Users/LeoQin/Documents/GitHub/PDFconvertor/training_data/初中/数学/浙教版-浙江教育出版社/九年级/义务教育教科书·数学九年级下册.pdf,九年级,tesseract.js-parallel,unknown,0.7585551330798479,0.5,1,76.96,,,,true,,,mathematics,下册,浙教版_九年级_义务教育教科书·数学九年级下册.json,数学,100,初中_数学_浙教版_九年级_义务教育教科书·数学九年级下册
浙教版_九年级_义务教育教科书·数学九年级下册_chunk_12,12,"视图 ,如图 3 29. 主视图左 视图 局 w 俯视图 图 3 28 图 3 29 第 3 章三 视图与 表面展开图 73 例 6 如图 3 30 ,一个 六角 螺帽 毛坯底面正六边 形的 边长 为 120mm ,高为 120mm, 内孔 直径 为 120mm. 画出 这个 六角 螺帽 毛坯的 三视图 . 分析 六角 螺帽 毛坯可 以看 成在 底面为 正六边 形的 直六 棱柱的 中间 挖去 一个 圆柱 . 根据直 六棱柱和 圆柱的 三视图的 画法 ,我们 就能 画出 这个 六角 螺帽 毛坯的 三视图 . 解选取 1:10 的比例 , 画出 这个 主视图左 视图 六角 螺帽 毛坯的 三视图 ,如图 3 31. 1 册川 图 3 30 图 3 31 1. 如图 ,下列 关于 物体的 主视图画 法正确的 是 ( ) UOoono (第 1 题 ) (A) (B) ( (D) 2. 如图 是由 四个 相同的 小立方块 搭成 的几何体 , 画出 它的 三视图 ( 按立体图 斥十 ). 东三 四 (第 2 题 ) (第 3 题 ) 3. 如图 是一 个多 功能塞 子 , 上部 是直 三棱柱 (三棱柱的 底面是 等腰 三角形 ), 下部 是圆柱 . 画出 它的 三视图 ( 按立 体图 斥才 ). 74 下 ms Ag O1 如图 ,一截 钢管 的内 直径为 200mm, 外直径为 260mm, 高为 300mm. 选取适当的 比例画 出它 的三 视图 . 440 e 全人 400 X 单位 :mm (第 1 题 ) (第 2 题 ) 2. 如图 物体由 两个 圆锥组 成 . 选取适当的 比例画 出它 的三 视图 . 3. 如图 是一 个凹 ""字形几何体 . 画出 它的 三视图 (尺寸自选 )， (第 3 题 ) (第 4 题 )",771,0.38172560138648176,low,ocr,"视图 ,如 图 3-29.\n主 视图 左 视 图\n局 w 俯视 图\n图 3-28 图 3-29\n第 3 章 三 视图 与 表面 展开 图 73 |\n=== 第 76 页 ===\n例 6 ”如 图 3-30 ,一 个 六 角 螺 帽 毛坯 底面 正六 边 形 的 边 长 为 120mm ,高\n为 120mm, 内 孔 直 径 为 120mm. 画 出 这 个 六 角 螺 帽 毛坯 的 三 视图 .\n分 析 六 角 螺 帽 毛坯 可 以 看 成 在 底面 为 正六 边 形 的 直 六 棱柱 的 中 间\n挖 去 一 个 圆柱 . 根据 直 六 棱柱 和 圆柱 的 三 视图 的 画 法 ,我 们 就 能 画 出 这 个 六\n角 螺 帽 毛坯 的 三 视图 .\n解 选取 1:10 的 比例 , 画 出 这 个 主 视图 左 视 图\n六 角 螺 帽 毛坯 的 三 视图 ,如 图 3-31. [| |\n1\n册 川 ~—\n图 3-30 图 3-31\n1. 如 图 ,下 列 关 于 物体 的 主 视图 画 法 正确 的 是 ( )\nUOoono\n(第 1 题 ) (A) (B) (© (D)\n2. 如 图 是 由 四 个 相同 的 小 立方 块 搭 成 的 几何 体 , 画 出 它 的 三 视图 ( 按\n立体 图 斥 十 ).\n东\n三 四\n(第 2 题 ) (第 3 题 )\n3. 如 图 是 一 个 多 功能 塞 子 , 上 部 是 直 三 棱柱 (三 棱柱 的 底面 是 等 腰 三\n角形 ), 下 部 是 圆柱 . 画 出 它 的 三 视图 ( 按 立 体 图 斥 才 ).\n| 74 下 ms Ag\n=== 第 77 页 ===\nO1 如 图 ,一 截 钢 管 的 内 直径 为 200mm, 外 直径 为 260mm, 高 为 300mm.\n选取 适当 的 比例 画 出 它 的 三 视图 .\n440 [e=\n全 人\n| |\n|\n- 400\n| X\n单位 :mm\n(第 1 题 ) (第 2 题 )\n2. 如 图 物体 由 两 个 圆锥 组 成 . 选取 适当 的 比例 画 出 它 的 三 视图 .\n3. 如 图 是 一 个 * 凹 ""字形 几何 体 . 画 出 它 的 三 视图 (尺寸 自选 )，\n(第 3 题 ) (第 4 题 )",2.0,76.96,浙教版_九年级_义务教育教科书·数学九年级下册,65,2025-07-21T14:25:06.215Z,2.0,义务教育教科书·数学九年级下册,/Users/LeoQin/Documents/GitHub/PDFconvertor/training_data/初中/数学/浙教版-浙江教育出版社/九年级/义务教育教科书·数学九年级下册.pdf,九年级,tesseract.js-parallel,unknown,0.6866791744840526,0.5,1,76.96,,,,true,,,mathematics,下册,浙教版_九年级_义务教育教科书·数学九年级下册.json,数学,100,初中_数学_浙教版_九年级_义务教育教科书·数学九年级下册
浙教版_九年级_义务教育教科书·数学九年级下册_chunk_13,13,". 选取适当的 比例画 出它 的三 视图 . 440 e 全人 400 X 单位 :mm (第 1 题 ) (第 2 题 ) 2. 如图 物体由 两个 圆锥组 成 . 选取适当的 比例画 出它 的三 视图 . 3. 如图 是一 个凹 ""字形几何体 . 画出 它的 三视图 (尺寸自选 )， (第 3 题 ) (第 4 题 ) G4 从一 个边 长为 2 cm 的大 立方体 上挖 去一 个小 立方体 ( 边长 是大 立方 体的 一半 ) ,得到 的几何体 如图 所示 . 画出 它的 三视图 (比例为 1:1). 5. 选取适当的 比例画 出如 图零件的 三视图 ( 直四 棱柱的 底面是 正方形， 其中 心与 圆柱底面的 圆心重合 ). ea 单位 :mm 200 "" 200 A 50 (第 5 题 ) 第 3 章三 视图与 表面展开图 P 75 亚体 图的 一种 画法 如图 3 32 ,甲乙两 图分 别是 小明和小 慧画 的方 桌图 . (1) 两幅 图中 ,桌面画 法的 区别 在哪里 ? 你认为哪 种画 法更 有立体感 ? (2) 量一 量 , 图甲 中 ,表示桌面的 平行四 边形 的锐角是 多少 度 ? 四条 边的 长度 有什么关系 ? 位甲 乙图 3 32 在画 立体 图形 时， 我们 常把 其中 水平 位置 的正方形 或长 方形画 成平行四 边形 , 它的 锐角是 45"" ,横向边 长与 实际边 长相同 ,纵向边 长画 成实际边 长的 一半 . 例画 棱长 为 2cm 的立方体 的立体图 形 . 分析 画立 方体 的立体图 形时 ,上 、 下底面应 画成 平行四 边形 ,其中 的锐角是 45"" ,横向边 长与 实际边 长相同 ,为 2cm, 纵向 边长 画成 实际边 长的 一",752,0.3861775425493716,low,ocr,".\n选取 适当 的 比例 画 出 它 的 三 视图 .\n440 [e=\n全 人\n| |\n|\n- 400\n| X\n单位 :mm\n(第 1 题 ) (第 2 题 )\n2. 如 图 物体 由 两 个 圆锥 组 成 . 选取 适当 的 比例 画 出 它 的 三 视图 .\n3. 如 图 是 一 个 * 凹 ""字形 几何 体 . 画 出 它 的 三 视图 (尺寸 自选 )，\n(第 3 题 ) (第 4 题 )\nG4 从 一 个 边 长 为 2 cm 的 大 立方 体 上 挖 去 一 个 小 立方 体 ( 边 长 是 大 立\n方 体 的 一 半 ) ,得 到 的 几何 体 如 图 所 示 . 画 出 它 的 三 视图 (比例 为\n1:1).\n5. 选取 适当 的 比例 画 出 如 图 零件 的 三 视图 ( 直 四 棱柱 的 底面 是 正方 形 ，\n其 中 心 与 圆柱 底面 的 圆心 重合 ).\nea 单位 :mm\nFE 200\n="" 200 A—— 50 —=\n(第 5 题 )\n第 3 章 三 视图 与 表面 展开 图 P 75 |\n=== 第 78 页 ===\n亚 体 图 的 一 种 画 法\n如 图 3-32 ,甲乙 两 图 分 别 是 小 明和 小 慧 画 的 方 桌 图 .\n(1) 两 幅 图 中 ,桌面 画 法 的 区 别 在 哪里 ? 你 认为 哪 种 画 法 更 有 立体 感 ?\n(2) 量 一 量 , 图 甲 中 ,表示 桌面 的 平行 四 边 形 的 锐角 是 多 少 度 ? 四 条 边\n的 长 度 有 什么 关系 ?\nAAA |\n位 |\n甲 乙\n图 3-32\n在 画 立 体 图 形 时 ， 我 们 常 把 其 中 水 平 位 置 的 正方 形 或 长 方形 画 成 平行\n四 边 形 , 它 的 锐角 是 45"" ,横向 边 长 与 实际 边 长 相同 ,纵向 边 长 画 成 实际 边 长\n的 一 半 .\n例 画 棱 长 为 2cm 的 立方 体 的 立体 图 形 .\n分 析 画 立 方 体 的 立体 图 形 时 ,上 \、 下 底面 应 画 成 平行 四 边 形 ,其 中 的\n锐角 是 45"" ,横向 边 长 与 实际 边 长 相同 ,为 2cm, 纵 向 边 长 画 成 实际 边 长 的 一",2.0,76.96,浙教版_九年级_义务教育教科书·数学九年级下册,66,2025-07-21T14:25:06.215Z,2.0,义务教育教科书·数学九年级下册,/Users/LeoQin/Documents/GitHub/PDFconvertor/training_data/初中/数学/浙教版-浙江教育出版社/九年级/义务教育教科书·数学九年级下册.pdf,九年级,tesseract.js-parallel,unknown,0.762906309751434,0.5,1,76.96,,,,true,true,,mathematics,下册,浙教版_九年级_义务教育教科书·数学九年级下册.json,数学,100,初中_数学_浙教版_九年级_义务教育教科书·数学九年级下册
浙教版_九年级_义务教育教科书·数学九年级下册_chunk_14,14,"就能 制造出 符合设计要 求的 零件 . 2 三视图不 仅反映了 物体的 形状 ,而且 反映 了各 个方向的 斥寸 大小 . 在制造机 器工 具 . 生活用品 等时 ,设计人 员通 常把 自己构思的 产品形状用 三视图表 示出 来 ,再由 工人根据三 视图制造出 符合要 求产品 . 因此三 视图在 许多行业有 着广泛的 应用 . 你能 从下 面的 三视图 (图 3 35) 中推断出 它们分 别表示什么几何体 吗 ? (1 ) 主视 图 T (2 )。 主视图左 视图 (3 ) 主视 图左 视图俯视图 俯视图 仿视 图图 3 35 3 二 ta5 RFa 2 由三 视图描述几何体 (或实物原型 ), 一般 先根据各 视图想象从 各个 广向 看到 的几何体形状 ,然后综合起 来确定几何体 (或实物原型 ) 的形状 ,再根 据三 个视图长 对正高平 章 、 宽相等 ""的关系 ,确定轮廓线 的位 置以 及各 个方向的 尺寸例 已知 一个 几何体 的三 视图如 图 3 36 所示， 描述 该几何体 的形 状 , 量出 三视图的 有关 尺寸 ,并根据已 知的 比例求 出它 的侧面积 (精确到 0.1cm9) 主视图左 视图 6 cm 9cm 比例 :1:3 原 em 俯视图 图 3 36 图 3 37 分析 由主 视图和 左视图知道 ,这个 几何体 是直 棱柱 ,但不 能确定棱 的条 数 . 再由 俯视图 可以 确定它 是直 四棱柱 ,上底面是 梯形 , 解这 个几何体 是底面为 梯形的 直四 棱柱. 量出 有关 尺寸根据比例 1:3, 可得 这个 直四 棱柱各 个方向的 尺寸 ,如图 3 37 它的 四个 侧面都 是长 为 9 cm 的长 方形 ,前侧面的 宽为 3 cm, 后侧面的 宽为 6 cm, 左侧面的 宽为 4.5 cm",773,0.48772275199999987,medium-low,ocr,"就 能 制造 出 符合 设计 要 求 的 零件 . 2\n三 视图 不 仅 反映 了 物体 的 形状 ,而 且 反 映 了 各 个 方向 的 斥 寸 大 小 . 在 制造\n机 器 ` 工 具 . 生 活用 品 等 时 ,设计 人 员 通 常 把 自己 构思 的 产品 形状 用 三 视图 表\n示 出 来 ,再 由 工人 根据 三 视图 制造 出 符合 要 求 产品 . 因此 三 视图 在 许多 行业\n有 着 广泛 的 应 用 .\n你 能 从 下 面 的 三 视图 (图 3-35) 中 推断 出 它们 分 别 表示 什么 几何 体 吗 ?\n(1 ) 主 视 图 T] (2 ) 。 主 视图 左 视图 (3 ) 主 视 图 左 视图\n俯视 图 俯视 图 仿 视 图\n图 3-35\n* 3 二 =ta5#RFa -2\n=== 第 81 页 ===\n由 三 视图 描述 几何 体 (或 实物 原型 ), 一 般 先 根据 各 视图 想象 从 各 个 广\n向 看 到 的 几何 体形 状 ,然后 综合 起 来 确定 几何 体 (或 实物 原型 ) 的 形状 ,再 根\n据 三 个 视图 “长 对 正高 平 章 、 宽 相等 ""的 关系 ,确定 轮廓 线 的 位 置 以 及 各 个\n方向 的 尺寸\n例 已 知 一 个 几何 体 的 三 视图 如 图 3-36 所 示 ， 描 述 该 几何 体 的 形\n状 , 量 出 三 视图 的 有 关 尺 寸 ,并 根据 已 知 的 比例 求 出 它 的 侧面 积 (精确\n到 0.1cm9)\n主 视图 左 视图\n6 cm\n9cm\n比例 :1:3 ]\n原 em\n俯视 图\n图 3-36 图 3-37\n分 析 由 主 视图 和 左 视图 知道 ,这 个 几何 体 是 直 棱柱 ,但 不 能 确定 棱 的\n条 数 . 再 由 俯视 图 可 以 确定 它 是 直 四 棱柱 ,上 底面 是 梯形 ,\n解 这 个 几何 体 是 底面 为 梯形 的 直 四 棱柱. 量 出 有 关 尺寸 根据 比例\n1:3, 可 得 这 个 直 四 棱柱 各 个 方向 的 尺寸 ,如 图 3-37\n它 的 四 个 侧面 都 是 长 为 9 cm 的 长 方形 ,前 侧面 的 宽 为 3 cm, 后 侧面\n的 宽 为 6 cm, 左 侧面 的 宽 为 4.5 cm",2.0,76.96,浙教版_九年级_义务教育教科书·数学九年级下册,69,2025-07-21T14:25:06.215Z,2.0,义务教育教科书·数学九年级下册,/Users/LeoQin/Documents/GitHub/PDFconvertor/training_data/初中/数学/浙教版-浙江教育出版社/九年级/义务教育教科书·数学九年级下册.pdf,九年级,tesseract.js-parallel,unknown,0.803921568627451,0.6,1,76.96,,,,true,true,,mathematics,下册,浙教版_九年级_义务教育教科书·数学九年级下册.json,数学,100,初中_数学_浙教版_九年级_义务教育教科书·数学九年级下册
浙教版_九年级_义务教育教科书·数学九年级下册_chunk_15,15,"确定它 是直 四棱柱 ,上底面是 梯形 , 解这 个几何体 是底面为 梯形的 直四 棱柱. 量出 有关 尺寸根据比例 1:3, 可得 这个 直四 棱柱各 个方向的 尺寸 ,如图 3 37 它的 四个 侧面都 是长 为 9 cm 的长 方形 ,前侧面的 宽为 3 cm, 后侧面的 宽为 6 cm, 左侧面的 宽为 4.5 cm 由勾 股定理 ,可得 右侧面的 宽为 VES5T06 一 3 (om). 所以 它的 侧面积 为 3X9 6X9 4.5X9 14.52 (6 3)? X9 170.2(cm?). 答 :这个 几何体 的侧面积 为 170.2 cm? 78 和 as na 1. 某物 体的 三视图如 图所 示 ,说出 它的 形状 . 主视图左 视图 四俯视图 下 (第 1 题 ) (第 2 题 ) 2. 由几 个相同的 小立方块 搭成 的几何体 的俯视图 如图 所示 , 方格 中的 数字表示在 该位 置的 小立方块 的个 数 . 画出 这个 几何体 的三 视图 . QO1L 已知 一个 几何体 的三 个视图都 是全 等的 正方形 , 则这 个几何体 是 2. 已知 一个 几何体 的三 个视图都 是半径相等的 圆， 则这 个几何体 是 3. 一个 几何体 的三 视图如 图所 示 . 它是 什么几何体 ? 主视图左 视图 ANL 一一 下本 100 220 国国 ee 俯视图 俯视图 (第 3 题 ) (第 4 题 ) Q4. 一个 几何体 的三 视图如 图所 示 . 说出 这个 几何体 的形状， 并求 出它 的表面积 . 第 3 章 wmssmRra 7 5. 一个 几何体 的三 视图如 图所 示 ,描述这 个几何体 的形状 . 主视图左 视图 俯视图 (第 5 题 ) 用人 3 4 简单几何体 的表面展开图",769,0.3578221305699481,low,ocr,"确定 它 是 直 四 棱柱 ,上 底面 是 梯形 ,\n解 这 个 几何 体 是 底面 为 梯形 的 直 四 棱柱. 量 出 有 关 尺寸 根据 比例\n1:3, 可 得 这 个 直 四 棱柱 各 个 方向 的 尺寸 ,如 图 3-37\n它 的 四 个 侧面 都 是 长 为 9 cm 的 长 方形 ,前 侧面 的 宽 为 3 cm, 后 侧面\n的 宽 为 6 cm, 左 侧面 的 宽 为 4.5 cm\n由 勾 股 定理 ,可 得 右 侧面 的 宽 为 VES5T06 一 3 (om).\n所 以 它 的 侧面 积 为\n3X9+6X9+4.5X9+14.52+(6—3)? X9~170.2(cm?).\n答 :这 个 几何 体 的 侧面 积 为 170.2 cm?\n| 78 和 as na\n=== 第 82 页 ===\n1. 某 物 体 的 三 视图 如 图 所 示 ,说 出 它 的 形状 .\n主 视图 左 视 图\n| 四\n俯视 图 下\n(第 1 题 ) (第 2 题 )\n2. 由 几 个 相同 的 小 立方 块 搭 成 的 几何 体 的 俯视 图 如 图 所 示 , 方 格 中\n的 数字 表示 在 该 位 置 的 小 立方 块 的 个 数 . 画 出 这 个 几何 体 的 三\n视图 .\nQO1L 已 知 一 个 几何 体 的 三 个 视图 都 是 全 等 的 正方 形 , 则 这 个 几何 体 是\n2. 已 知 一 个 几何 体 的 三 个 视图 都 是 半径 相等 的 圆 ， 则 这 个 几何 体 是\n3. 一 个 几何 体 的 三 视图 如 图 所 示 . 它 是 什么 几何 体 ?\n主 视图 左 视 图\nANL] 一 一\n下 本\n100\n220\n国 国 ee\n俯视 图 俯视 图\n(第 3 题 ) (第 4 题 )\nQ4. 一 个 几何 体 的 三 视图 如 图 所 示 . 说 出 这 个 几何 体 的 形状 ， 并 求 出\n它 的 表面 积 .\n第 3 章 =wmssmRra 7\n=== 第 83 页 ===\n5. 一 个 几何 体 的 三 视图 如 图 所 示 ,描述 这 个 几何 体 的 形状 .\n主 视图 左 视 图\n俯视 图\n(第 5 题 )\n用人\n3-4 简单 几何 体 的 表面 展开 图",2.0,76.96,浙教版_九年级_义务教育教科书·数学九年级下册,70,2025-07-21T14:25:06.215Z,2.0,义务教育教科书·数学九年级下册,/Users/LeoQin/Documents/GitHub/PDFconvertor/training_data/初中/数学/浙教版-浙江教育出版社/九年级/义务教育教科书·数学九年级下册.pdf,九年级,tesseract.js-parallel,unknown,0.7074954296160878,0.5,1,76.96,,,,true,true,,mathematics,下册,浙教版_九年级_义务教育教科书·数学九年级下册.json,数学,100,初中_数学_浙教版_九年级_义务教育教科书·数学九年级下册
浙教版_九年级_义务教育教科书·数学九年级下册_chunk_16,16,"题 ) Q4. 一个 几何体 的三 视图如 图所 示 . 说出 这个 几何体 的形状， 并求 出它 的表面积 . 第 3 章 wmssmRra 7 5. 一个 几何体 的三 视图如 图所 示 ,描述这 个几何体 的形状 . 主视图左 视图 俯视图 (第 5 题 ) 用人 3 4 简单几何体 的表面展开图 杜登 尼 (Dudeney,1857 一 1930 年 ) 是 19 世纪英国知名的 迹题 创 B 作者 ,下面 的问题来 源于 他创作的 牧蛛 和苍蝇问题 :在一 个长 、 Eee y 宽 、 高分 别为 3 米 ,2 米 ,2 米的 长方 体房 间内 ,一只 啤蛛 在一 面墙 的中 间 , 离天 花板 0.1 米处 (点 4 处 ), 苍蝇 在对 面墙 的中 间 , 离地 面 0.1 米处 (点召 处 ). 试问 , 晓蛛 去捉 苍晶 需要 爬行的 最短路程 是多 少 ? 分别 将三 个立方体 纸盒 沿某 些棱 剪开 , 且使 六个 面连 在一 起 ,然后铺 平 . 你能 得到 下列 图形 ( 图 3 38) 吗 ? 请试 一试 . 你还 能得 到其 他不 同的 展开图 吗 ? 图 3 38 80 和 ws near 像图 3 38 那样 ,将几何体 沿着 某些 棱 "" 剪开 ,并使 各个 面连 在一 起 , 铺平 所得 到的 平面图 形称 为几何体 的表面展开图 (net). 例 1 图 3 39 是一 个立方体 的表面展开图 吗 ? 如果 是 ,分别 用 1,2， 3,4,5,6 中的 同一个 数字表示立方体 和它 的展开图 中各 对对 应的 面 〈 只要 求给 出一 种表示法 ). 分析 可以 先用 折肢 的方法试 一试 ,看它 能否 折成 一个 立方体 . 解图 3 39 是一 个立方体 的表面展开图 ,各对 应面 上的 数字表示如 图",787,0.44560241530434774,medium-low,ocr,"题 )\nQ4. 一 个 几何 体 的 三 视图 如 图 所 示 . 说 出 这 个 几何 体 的 形状 ， 并 求 出\n它 的 表面 积 .\n第 3 章 =wmssmRra 7\n=== 第 83 页 ===\n5. 一 个 几何 体 的 三 视图 如 图 所 示 ,描述 这 个 几何 体 的 形状 .\n主 视图 左 视 图\n俯视 图\n(第 5 题 )\n用人\n3-4 简单 几何 体 的 表面 展开 图\n杜 登 尼 (Dudeney,1857 一 1930 年 ) 是 19 世纪 英国 知名 的 迹 题 创\nB 作者 ,下 面 的 问题 来 源 于 他 创作 的 “ 牧 蛛 和 苍蝇 ”问题 :在 一 个 长 、\nEee y 宽 、 高 分 别 为 3 米 ,2 米 ,2 米 的 长 方 体 房 间 内 ,一 只 啤 蛛 在 一 面 墙 的\n中 间 , 离 天 花 板 0.1 米 处 (点 4 处 ), 苍 蝇 在 对 面 墙 的 中 间 , 离 地 面 0.1\n米 处 (点 召 处 ). 试问 , 晓 蛛 去 捉 苍 晶 需 要 爬行 的 最 短路 程 是 多 少 ?\n分 别 将 三 个 立方 体 纸 盒 沿 某 些 棱 剪 开 , 且 使 六 个 面 连 在 一 起 ,然后\n铺 平 . 你 能 得 到 下 列 图 形 ( 图 3-38) 吗 ? 请 试 一 试 . 你 还 能 得 到 其 他 不 同\n的 展开 图 吗 ?\n图 3-38\n[80 和 ws near\n=== 第 84 页 ===\n像 图 3-38 那样 ,将 几何 体 沿 着 某 些 棱 ""* 剪 开 ” ,并 使 各 个 面 连 在 一 起 , 铺\n平 所 得 到 的 平面 图 形 称 为 几何 体 的 表面 展开 图 (net).\n例 1 图 3-39 是 一 个 立方 体 的 表面 展开 图 吗 ? 如 果 是 ,分 别 用 1,2，\n3,4,5,6 中 的 同一 个 数字 表示 立方 体 和 它 的 展开 图 中 各 对 对 应 的 面 〈 只 要\n求 给 出 一 种 表示 法 ).\n分 析 可 以 先 用 折 肢 的 方法 试 一 试 ,看 它 能 否 折 成 一 个 立方 体 .\n解 图 3-39 是 一 个 立方 体 的 表面 展开 图 ,各 对 应 面 上 的 数字 表示 如 图",2.0,76.96,浙教版_九年级_义务教育教科书·数学九年级下册,71,2025-07-21T14:25:06.215Z,2.0,义务教育教科书·数学九年级下册,/Users/LeoQin/Documents/GitHub/PDFconvertor/training_data/初中/数学/浙教版-浙江教育出版社/九年级/义务教育教科书·数学九年级下册.pdf,九年级,tesseract.js-parallel,unknown,0.7440147329650092,0.5,1,76.96,,,,true,true,,mathematics,下册,浙教版_九年级_义务教育教科书·数学九年级下册.json,数学,100,初中_数学_浙教版_九年级_义务教育教科书·数学九年级下册
