Chunk_ID,Chunk_Index,Content,Content_Length,Quality_Score,Reliability,Source_Type,Original_Content,Enhancement_Version,averageConfidence,book_name,chunkIndex,enhancementTimestamp,enhancementVersion,fileName,filePath,grade,ocrMethod,publisher,qualityMetrics_chineseCharRatio,qualityMetrics_coherenceScore,qualityMetrics_lengthScore,qualityMetrics_ocrConfidence,semanticFeatures_hasDefinition,semanticFeatures_hasExperiment,semanticFeatures_hasFormulas,semanticFeatures_hasNumbers,semanticFeatures_hasQuestion,semanticFeatures_isTableContent,semanticFeatures_subjectArea,semester,source_file,subject,totalPages,uniqueId
科普版_七年级_义务教育教科书·地理七年级上册_chunk_0,0,"站获取地 理科普 信息， 通过 网上 图片 资源库 获取 我们 想要 的地 理景观图 片等。 4 第一 节发 展中 国家和 发达 国家 n 发展 中国家和 发达 国家 发展 水平 的差异表现在 哪些方面 ? 说出 这两 类国家的 分布 特点。 1， 经济发 展水 平的 差异世界各 国的 经济 发展 水平 很不 相同。 有些 国家经 济发 展水 平高， 属于 发达 国家 ;有些 国家 经济 发展 相对落后， 属于 发展 中国家。 发达 国家 与发 展中 国家在 科技 、 生产 、 生活 等方面均 有明显的 差别。 发展 中国家经 济落后的 原因是 多方面的。 有大 多数 发展 中国家长 期受 帝国 主义和 殖民主义侵略剥削， 资源 被大 量掠夺等 外在 因素， 也有 发展 时间 、 政策等 内在 原因。 第二 次址 界大 战以 后， 许多 发展 中国家抓 住全 球经 济发 展的 有利 机遇， 实现了 经济 的快速发 展。 在一 些领域， 有些 发展 中国家甚至超过了 某些 发达 国家， 如印度的 软件业 、 中国 的航天业 等。 50000 45 000 40 000 35 000 30 000 25 000 20 000 15 000 10 000 5000 1 图 5 1 1 世界部 分国家 2009 年人 均国 民总 收人 【美元 ) 4 司南北差距 ""， 目前， 世界 上的 发达 国家大 多分 布于 北半球的 北部， 便如 美国 、 英国 、 污国 、 德国 、 加拿 大等。 发展 中国家和 地区 主要分 布于 南半球及 北半球的 南部。 由于 这种 地理 分布 上的 南北差异， 国际 上把 发展 中国家与 发达 国家的 经济 发展 差别， 简称 为南北差距。 2 全 0",751,0.41999765617402013,medium-low,ocr,"站 获取 地 理科 普 信息 ， 通\n过 网 上 图 片 资源 库 获 取 我 们 想 要 的 地 理 景观 图 片 等 。\n4\n=== 第 3 页 ===\n第 一 节 ”发 展 中 国家 和 发 达 国 家\n@ n 发 展 中 国家 和 发 达 国 家 发 展 水 平 的 差异 表现 在 哪些 方面 ?\nGLY 说 出 这 两 类 国家 的 分 布 特点 。\n1， 经济 发 展 水 平 的 差异\n世界 各 国 的 经 济 发 展 水 平 很 不 相同 。 有 些 国家 经 济 发 展 水 平 高 ， 属 于 发 达\n国家 ;有 些 国 家 经 济 发 展 相对 落后 ， 属 于 发 展 中 国家 。 发 达 国 家 与 发 展 中 国家\n在 科技 、 生 产 、 生 活 等 方面 均 有 明显 的 差别 。\n发 展 中 国家 经 济 落后 的 原因 是 多 方面 的 。 有 大 多 数 发 展 中 国家 长 期 受 帝 国\n主义 和 殖民 主义 侵略 剥削 ， 资 源 被 大 量 掠夺 等 外 在 因素 ， 也 有 发 展 时 间 、\n政策 等 内 在 原因 。\n第 二 次 址 界 大 战 以 后 ， 许 多 发 展 中 国家 抓 住 全 球 经 济 发 展 的 有 利 机 遇 ，\n实现 了 经 济 的 快速 发 展 。 在 一 些 领域 ， 有 些 发 展 中 国家 甚至 超过 了 某 些 发 达 国\n家 ， 如 印度 的 软件 业 、 中 国 的 航天 业 等 。\n50000\n45 000\n40 000\n35 000\n30 000\n25 000\n20 000\n15 000\n10 000\n5000\n1\n图 5-1-1 世界 部 分 国家 2009 年 人 均 国 民 总 收 人 【美元 )\n4 司\n=== 第 4 页 ===\n“南北 差距 ""” ，\n目前 ， 世 界 上 的 发 达 国家 大 多 分 布 于 北半球 的 北部 ， 便 如 美国 、 英 国 、 污\n国 、 德 国 、 加 拿 大 等 。 发 展 中 国家 和 地 区 主要 分 布 于 南半球 及 北半球 的 南部 。\n由 于 这 种 地 理 分 布 上 的 南北 差异 ， 国 际 上 把 发 展 中 国家 与 发 达 国家 的 经 济 发 展\n差别 ， 简 称 为 “南北 差距 ”。\n2 全\n0",2.0,71.74311926605505,科普版_七年级_义务教育教科书·地理七年级上册,2,2025-07-21T14:25:06.389Z,2.0,义务教育教科书·地理七年级上册,/Users/LeoQin/Documents/GitHub/PDFconvertor/training_data/初中/地理/科普版-科学普及出版社/七年级/义务教育教科书·地理七年级上册.pdf,七年级,tesseract.js-parallel,unknown,0.8081936685288641,0.5,1,71.74311926605505,,,,true,true,,unknown,上册,科普版_七年级_义务教育教科书·地理七年级上册.json,地理,109,初中_地理_科普版_七年级_义务教育教科书·地理七年级上册
科普版_七年级_义务教育教科书·地理七年级上册_chunk_1,1,"一要 w.o fh N 5 Sa 72 小治 船近海捕 鱼远洋船 深海捕 鱼图 5 1 3 渔业生产 BPeamhia 海洋风能发 电图 5 14 能源 生产 3. 举鲁 说明 发达 国家和 发展 中国家在 交通 、 教育 、 居住 等方面有 什么不 同。 96 wu 第二 节国际经 济合作 TWiILDEZMWRETTETREREFEE? 广泛的 国际经 济合 作世界上 的任何国家和 地区 都会 与其 他国家和 地区 发生 各种 不同 程度的 联系。 在传统的 国际分 工格局中， 国际 经济 交往最 主要的 形式是 商品贸易 ;现在国际经 济联系的 广度和 深度都 大大 提高， 各国家和 地区 之间 的经 济联系越 来越 紧密， 产品 生产的 分工 协作也 越来 越显 著。 路国 公司和 地区 性 、 全球 性的 经济 贸易合作组 织的 出现， 使世界各 国的 经济 更加 相互依 袁 、 相互 融合。 同时 ,各国 在关系全 人类 生存与 发展 的许多问题上， 也迫切需要国际间 的密切合作。 品牌放 计由 美国公司产品组 堵由 中国 工人完成。 完成。 熏型 硬盘 、 视频 利音 闫人 电池 、 显示 屏 、 耳机 解码器 、 内存 由美国、 由中 国台湾和 中国 大日 本 、 荷兰 、 韩国 等国 陆所 供。 提供。 图 2 1， 匡际 合作的 产品 97 四七 年级 上机 重要的 国际经 济合 作组 织世界各 国在 政治 、 经济 、 文化 和科技等 领域开展了 广泛的 合作， 并成 立了 相应的 国际组 织。 这些 组织 中的 一些 重要国际经 济组 织在 促进全 球的 经济 发展 方面发 挥着 越来 越重要的 作用。",725,0.35124998698679155,low,ocr,"一 要\nw.o fh N 5 Sa\n72 AS\n小 治 船 近海 捕 鱼 远洋 船 深海 捕 鱼\n图 5-1-3 ”渔业 生产\n——\nBPeamhia 海洋 风能 发 电\n图 5-14 能 源 生 产\n3. 举 鲁 说 明 发 达 国家 和 发 展 中 国家 在 交通 、 教 育 、 居 住 等 方面 有 什么\n不 同 。\n96\n=== 第 6 页 ===\nwu\n第 二 节 ”国际 经 济 合作\n@ - TWiILDEZMWRETTETREREFEE?\n广泛 的 国际 经 济 合 作\n世界 上 的 任何 国家 和 地 区 都 会 与 其 他 国家 和 地 区 发 生 各 种 不 同 程度 的 联\n系 。 在 传统 的 国际 分 工 格局 中 ， 国 际 经 济 交往 最 主要 的 形式 是 商品 贸易 ;现在\n国际 经 济 联系 的 广度 和 深度 都 大 大 提高 ， 各 国家 和 地 区 之 间 的 经 济 联系 越 来 越\n紧密 ， 产 品 生产 的 分 工 协作 也 越 来 越 显 著 。 路 国 公司 和 地 区 性 、 全 球 性 的 经 济\n贸易 合作 组 织 的 出 现 ， 使 世界 各 国 的 经 济 更 加 相互 依 袁 、 相 互 融 合 。 同 时 ,各\n国 在 关系 全 人 类 生存 与 发 展 的 许多 问题 上 ， 也 迫切 需要 国际 间 的 密切 合作 。\n品牌 放 计 由 美国 公司 - 产品 组 堵 由 中 国 工人\n完成。 完成 。\n熏 型 硬盘 、 视 频 利 | 音 闫 人 电池 、 显 示 屏 、 耳 机\n解码 器 、 内 存 由 美国、 由 中 国 台湾 和 中 国 大\n日 本 、 荷 兰 、 韩 国 等 国 -~ 陆 所 供 。\n提供 。\n图 $-2-1 ， 匡 际 合作 的 产品\n-97\n=== 第 7 页 ===\n四 七 年 级 上 机\n重要 的 国际 经 济 合 作 组 织\n世界 各 国 在 政治 、 经 济 、 文 化 和 科技 等 领域 开展 了 广泛 的 合作 ， 并 成 立\n了 相应 的 国际 组 织 。 这 些 组 织 中 的 一 些 重要 国际 经 济 组 织 在 促进 全 球 的 经 济\n发 展 方面 发 挥 着 越 来 越 重要 的 作用 。",2.0,71.74311926605505,科普版_七年级_义务教育教科书·地理七年级上册,4,2025-07-21T14:25:06.389Z,2.0,义务教育教科书·地理七年级上册,/Users/LeoQin/Documents/GitHub/PDFconvertor/training_data/初中/地理/科普版-科学普及出版社/七年级/义务教育教科书·地理七年级上册.pdf,七年级,tesseract.js-parallel,unknown,0.825426944971537,0.5,1,71.74311926605505,,,,true,true,,geography,上册,科普版_七年级_义务教育教科书·地理七年级上册.json,地理,109,初中_地理_科普版_七年级_义务教育教科书·地理七年级上册
科普版_七年级_义务教育教科书·地理七年级上册_chunk_2,2,"标准 《2011 年版 ) 》, 在 《义务教育课程标准实验教科书。 地理 〈 七年 级上 册一 八年 级下 册 ) 》 的基 础上 重新编写修订而 成的。 本套 教科 书共 四册， 供七 、 八年 级学 生使 用。 2011 年 ?月至 2013 年 4 月， 北京 市仁爱教育研究所 的数 十位 地理 教材编写专家和 优秀的 一线 教师， 在充分比较 、 分析 数十 种中 外地 理教材的 基础上， 依据 《 义务 教育地 理课 程标准 ( 2011 年版 ) 》， 结合 仁爱版 地理 教材使 用地 区广 大师 生的 意见， 对本 教科书 进行 了大 量的 仔细的 修订完善工作， 并于 2012 年 4 月和 2013 年 4 月率先一 次性 通过了 教育部 基础教育课程教材专家工作委员会 的审查。 《义务教育课程标准实验教科书， 地理 (七年 级上 册一 八年 级下 册 ) 》 第一 次出 版时 的主编为 王缉 慈， 朱行 主编为 林宪 生。 2011 年至 2013 年重新编写修订 、 送教育部 审查通过后 再版 时的 《义务教 育教 科书， 地理 〈 七年 级上 册一 八年 级下 册 ) 》 的主编为 王缉 芝 、 官作 民。 本教科书 在立项 、 编写 及数 百次 的修改 、 审校 过程 中得 到了 全国 数百 位地 理教育专家 、 教研 员和 优秀一 线教师的 指导和 帮助， 尤其 是北京大 学的 王缉 慈教授、 天津师范大 学的 宫作 民教 授 、 辽宁 师范 大学 的林 宪生 教授等 等。 在此， 北京 市仁爱教育研究所 向他 们表示诚 攀的 谢意 ! 由于 时间 的关系， 教材 中还 存在不 足及 需要完善之 处， 衷心 希望广大地",736,0.5102779833726354,medium-low,ocr,"标准 《2011 年 版 ) 》, 在\n《义务 教育 课程 标准 实验 教科 书 。 地 理 〈 七 年 级 上 册 一 八 年 级 下 册 ) 》 的 基\n础 上 重新 编写 修订 而 成 的 。 本 套 教 科 书 共 四 册 ， 供 七 、 八 年 级 学 生 使 用 。\n2011 年 ?月 至 2013 年 4 月 ， 北 京 市 仁爱 教育 研究 所 的 数 十 位 地 理 教材 编写\n专家 和 优秀 的 一 线 教师 ， 在 充分 比较 、 分 析 数 十 种 中 外 地 理 教材 的 基础 上 ， 依\n据 《 义 务 教育 地 理 课 程 标准 ( 2011 年 版 ) 》， 结 合 仁爱 版 地 理 教材 使 用 地 区 广\n大 师 生 的 意见 ， 对 本 教科 书 进 行 了 大 量 的 仔细 的 修订 完善 工作 ， 并 于 2012 年 4\n月 和 2013 年 4 月 率先 一 次 性 通过 了 教育 部 基础 教育 课程 教材 专家 工作 委员 会 的\n审查 。\n《义务 教育 课程 标准 实验 教科 书 ， 地 理 (七 年 级 上 册 一 八 年 级 下 册 ) 》\n第 一 次 出 版 时 的 主编 为 王 缉 慈 ， 朱 行 主编 为 林 宪 生 。\n2011 年 至 2013 年 重新 编写 修订 、 送 教育 部 审查 通过 后 再 版 时 的 《义务 教\n育 教 科 书 ， 地 理 〈 七 年 级 上 册 一 八 年 级 下 册 ) 》 的 主编 为 王 缉 芝 、 官 作 民 。\n本 教科 书 在 立项 、 编 写 及 数 百 次 的 修改 、 审 校 过 程 中 得 到 了 全 国 数 百 位\n地 理 教育 专家 、 教 研 员 和 优秀 一 线 教师 的 指导 和 帮助 ， 尤 其 是 北京 大 学 的 王\n缉 慈 教授、 天津 师范 大 学 的 宫 作 民 教 授 、 辽 宁 师 范 大 学 的 林 宪 生 教授 等 等 。 在\n此 ， 北 京 市 仁爱 教育 研究 所 向 他 们 表示 诚 攀 的 谢意 !\n由 于 时 间 的 关系 ， 教 材 中 还 存在 不 足 及 需要 完善 之 处 ， 衷 心 希望 广大 地",2.0,71.74311926605505,科普版_七年级_义务教育教科书·地理七年级上册,9,2025-07-21T14:25:06.389Z,2.0,义务教育教科书·地理七年级上册,/Users/LeoQin/Documents/GitHub/PDFconvertor/training_data/初中/地理/科普版-科学普及出版社/七年级/义务教育教科书·地理七年级上册.pdf,七年级,tesseract.js-parallel,unknown,0.8367729831144465,0.5,1,71.74311926605505,,true,,true,true,,general,上册,科普版_七年级_义务教育教科书·地理七年级上册.json,地理,109,初中_地理_科普版_七年级_义务教育教科书·地理七年级上册
科普版_七年级_义务教育教科书·地理七年级上册_chunk_3,3,"和优秀一 线教师的 指导和 帮助， 尤其 是北京大 学的 王缉 慈教授、 天津师范大 学的 宫作 民教 授 、 辽宁 师范 大学 的林 宪生 教授等 等。 在此， 北京 市仁爱教育研究所 向他 们表示诚 攀的 谢意 ! 由于 时间 的关系， 教材 中还 存在不 足及 需要完善之 处， 衷心 希望广大地 理专 家 、 教研 员 、 一线 教师 、 在校 学生 及学 生家 长等 来电 来函 批评指正， 以便 下次 修订时 改正。 在本 教材出 版过 程中， 使用 的部 分作品因 无法 与作者取得联系， 特委托北京版 权代理有 限责 任公司向 权利人 转付 稿酬。 请您 与北京版 权代 理有 限责任公司联系并 领取稿酬。 联系 方式 : (010)82357058 57 56 北京市 仁爱教育研究所 绪言 打开地 理知 识之 六 W) m 你知道从 归几 个方面思考地 理问 题吧 ? Sl 学习 地理 课程， 要养 成良好的 地理 思维 习惯。 考察地 理学 习地 理课程 ,不仅要 了解 地理事物 和现象的 分布， 还要 多角度地 观察 地理事物 和现象， 注重地图 的运用， 通过 观察 、 调查 、 比较 、 分析 和综合等 广法， 探究 地理事物 的特征与 成因， 认识 人类 活动与 地理 环境的 关系， 并提出有 意义的 建议。 ) 图如 何在生活中 、 大自然中 学习 地理 知识 ? GLy s 7c BRANES 二小 ) 20 0800. M2ant E 人 】 尼而 有中 B 二观测月 食观察潮汐地 理课堂是 一个 学习 与生活的 共同体。 地理 课堂需要回归到 生活中。 在生活中 、 大自然中 学习 地理 知识， 会使 地理 知识焕发出 勃勃生机 ,走向更 具",747,0.4493364699822951,medium-low,ocr,"和 优秀 一 线 教师 的 指导 和 帮助 ， 尤 其 是 北京 大 学 的 王\n缉 慈 教授、 天津 师范 大 学 的 宫 作 民 教 授 、 辽 宁 师 范 大 学 的 林 宪 生 教授 等 等 。 在\n此 ， 北 京 市 仁爱 教育 研究 所 向 他 们 表示 诚 攀 的 谢意 !\n由 于 时 间 的 关系 ， 教 材 中 还 存在 不 足 及 需要 完善 之 处 ， 衷 心 希望 广大 地\n理 专 家 、 教 研 员 、 一 线 教师 、 在 校 学 生 及 学 生 家 长 等 来 电 来 函 批评 指正 ， 以 便\n下 次 修订 时 改正 。\n在 本 教材 出 版 过 程 中 ， 使 用 的 部 分 作品 因 无 法 与 作者 取得 联系 ， 特 委托\n北京 版 权 代理 有 限 责 任 公司 向 权利 人 转 付 稿酬 。 请 您 与 北京 版 权 代 理 有 限 责任\n公司 联系 并 领取 稿酬 。 联 系 方 式 : (010)82357058/57/56\n北京 市 仁爱 教育 研究 所\n=== 第 13 页 ===\n绪 言 打开 地 理 知 识 之 六\nW) m ”你 知道 从 归 几 个 方面 思考 地 理 问 题 吧 ?\nSl\n学 习 地 理 课程 ， 要 养 成 良好 的 地 理 思 维 习惯 。\n考察 地 理\n学 习 地 理 课程 ,不仅 要 了 解 地 理事 物 和 现象 的 分 布 ， 还 要 多 角度 地 观 察\n地 理事 物 和 现象 ， 注 重地 图 的 运用 ， 通 过 观察 、 调 查 、 比 较 、 分 析 和 综合 等 广\n法 ， 探 究 地 理事 物 的 特征 与 成 因 ， 认 识 人 类 活动 与 地 理 环境 的 关系 ， 并 提出 有\n意义 的 建议 。\n@) 图” 如 何在 生活 中 、 大 自然 中 学 习 地 理 知识 ?\nGLy\ns 7c BRANES=\n二 小 = )%20 0800. M2ant\nE 人 】 尼 而 = 有 中 / B & 二\n观测 月 食 观察 潮汐\n地 理 课堂 是 一 个 学 习 与 生活 的 共同 体 。 地 理 课堂 需要 回归 到 生活 中 。 在\n生活 中 、 大 自然 中 学 习 地 理 知识 ， 会 使 地 理 知识 焕发 出 勃勃 生机 ,走向 更 具",2.0,71.74311926605505,科普版_七年级_义务教育教科书·地理七年级上册,10,2025-07-21T14:25:06.389Z,2.0,义务教育教科书·地理七年级上册,/Users/LeoQin/Documents/GitHub/PDFconvertor/training_data/初中/地理/科普版-科学普及出版社/七年级/义务教育教科书·地理七年级上册.pdf,七年级,tesseract.js-parallel,unknown,0.8360655737704918,0.6,1,71.74311926605505,,true,,true,true,,mathematics,上册,科普版_七年级_义务教育教科书·地理七年级上册.json,地理,109,初中_地理_科普版_七年级_义务教育教科书·地理七年级上册
科普版_七年级_义务教育教科书·地理七年级上册_chunk_4,4,"习地 理知识 ? GLy s 7c BRANES 二小 ) 20 0800. M2ant E 人 】 尼而 有中 B 二观测月 食观察潮汐地 理课堂是 一个 学习 与生活的 共同体。 地理 课堂需要回归到 生活中。 在生活中 、 大自然中 学习 地理 知识， 会使 地理 知识焕发出 勃勃生机 ,走向更 具有 生活意义和 生命价值的 新境界。 5 地理 七年 级上 贡生活中 只要 留意， 地理 知识就 在我 们身边。 行万 里路， 读万 卷书 ""， 我们 可以 通过多 种方式走 进大 自然。 进行 日月 星展 、 天气 、 河流 、 动物 和植物等 方面的 观察， 学会 了解 大自然， 欣赏 大自然。 野外办 方向在 野外， 我们 经常 需要办 别方向。 下面 re 是一 些常用的 简便方法， 体也 试着 做一 做， 全学 会这 些方法， 体就 不会 迷失方向了。 信道项 昌天 1. 太阳定向 : 根据太阳的 东升西 落确 定 Z00 F m 司站 轩国 As 0 :Je 2. 指南针 定向 : 将指南针 平放， 磁针 总全 性有 同本 是指向南北方向。 3. 北极星 定向 〔 北半球 ): 在晴朗的 夜空找到北极里， 面对 北福星的 方向就 是正 北方。 和 wa 过 8 1. 这个 双休日， 请你 对某 种地 理事物 或地 理现象进行考察， 号出 考察记录， 准备 在班级交流。 (考察对 象如 天气 、 河流 、 交通 明确 写出 是震 一种 地理事物 或现象， 付么 时间， 什么 地点。) 2. 国庆节 快到 了， 请你 设计一 个班级秋游方案 (方案包括 : 秋游的 时间 、 路线 、 要准备的 物品和 注意事项等 )。 6 三",729,0.3197792209882504,low,ocr,"习 地 理 知识 ?\nGLy\ns 7c BRANES=\n二 小 = )%20 0800. M2ant\nE 人 】 尼 而 = 有 中 / B & 二\n观测 月 食 观察 潮汐\n地 理 课堂 是 一 个 学 习 与 生活 的 共同 体 。 地 理 课堂 需要 回归 到 生活 中 。 在\n生活 中 、 大 自然 中 学 习 地 理 知识 ， 会 使 地 理 知识 焕发 出 勃勃 生机 ,走向 更 具\n有 生活 意义 和 生命 价值 的 新 境界 。\n5\n=== 第 14 页 ===\n地 理 七 年 级 上 贡\n生活 中 只 要 留意 ， 地 理 知识 就 在 我 们 身边 。 “ 行 万 里 路 ， 读 万 卷 书 ""， 我\n们 可 以 通过 多 种 方式 走 进 大 自然 。 进 行 日 月 星 展 、 天 气 、 河 流 、 动 物 和 植物 等\n方面 的 观察 ， 学 会 了 解 大 自然 ， 欣 赏 大 自然 。\n—-\n野外 办 方向\n在 野外 ， 我 们 经 常 需要 办 别 方向 。 下 面 re\n是 一 些 常用 的 简便 方法 ， 体 也 试 着 做 一 做 ， LA 全\n学 会 这 些 方法 ， 体 就 不 会 迷失 方向 了 。 信道 项 昌 天\n1. 太阳 定向 : 根据 太阳 的 东升 西 落 确 定 Z00 ®F — m\n司 站 轩 | 国 As\n0 :Je\n2. 指南 针 定 向 : 将 指南 针 平 放 ， 磁 针 总 全 性 有 同 本 <\n是 指向 南北 方向 。\n3. 北极 星 定 向 〔 北 半球 ): 在 晴朗 的 夜空\n找到 北极 里 ， 面 对 北 福星 的 方向 就 是 正 北方 。\n和\nwa 过 8\n1. 这 个 双休日 ， 请 你 对 某 种 地 理事 物 或 地 理 现象 进行 考察 ， 号 出 考察\n记录 ， 准 备 在 班级 交流 。 (考察 对 象 如 天 气 、 河 流 、 交 通 …… 明 确 写 出 是\n震 一 种 地 理事 物 或 现象 ， 付 么 时 间 ， 什 么 地 点 。)\n2. 国庆 节 快 到 了 ， 请 你 设计 一 个 班级 秋游 方案 (方案 包括 : 秋游 的 时\n间 、 路 线 、 要 准备 的 物品 和 注意 事项 等 ) 。\n6\n=== 第 15 页 ===\n三\n- =",2.0,71.74311926605505,科普版_七年级_义务教育教科书·地理七年级上册,11,2025-07-21T14:25:06.389Z,2.0,义务教育教科书·地理七年级上册,/Users/LeoQin/Documents/GitHub/PDFconvertor/training_data/初中/地理/科普版-科学普及出版社/七年级/义务教育教科书·地理七年级上册.pdf,七年级,tesseract.js-parallel,unknown,0.7966101694915254,0.5,1,71.74311926605505,,true,,true,true,,biology,上册,科普版_七年级_义务教育教科书·地理七年级上册.json,地理,109,初中_地理_科普版_七年级_义务教育教科书·地理七年级上册
