Chunk_ID,Chunk_Index,Content,Content_Length,Quality_Score,Reliability,Source_Type,Original_Content,Enhancement_Version,averageConfidence,book_name,chunkIndex,enhancementTimestamp,enhancementVersion,fileName,filePath,grade,ocrMethod,publisher,qualityMetrics_chineseCharRatio,qualityMetrics_coherenceScore,qualityMetrics_lengthScore,qualityMetrics_ocrConfidence,semanticFeatures_hasDefinition,semanticFeatures_hasExperiment,semanticFeatures_hasFormulas,semanticFeatures_hasNumbers,semanticFeatures_hasQuestion,semanticFeatures_isTableContent,semanticFeatures_subjectArea,semester,source_file,subject,totalPages,uniqueId
科普版_七年级_义务教育教科书·地理七年级上册_chunk_15,15,"重简 学二 地 1 降水量 (mm) 降水量 (mm 1. 图 3 2 14 表示意大 利罗马的 年降水。 300 300 旺的 各月 分配 情况， 读图 完成下 列要 求 : 20 200 (1) 罗马哪 几个 月份 降水较 多 ? 本 w (2) 罗马哪 几个 月份 降水较 少 ? (3 ) 说说 罗马降水季节变化的 特点。 图 3 2 14 罗马降水量 柱状图 2. 表 3 2 2 是越南河内者 月降水量 的数据。 在图 3 2 15 中， 参展 1 一 4 月的 画法， 完成 河内降水量 柱状图， 并说 出该 地全 年降水量 分配 的特点。 表 3 2 2 河内各 月降水量 统计 月 1 2 3 4 5 6 7 8 9 10 11 12 19 26 44 90 189 240 288 318 265 131 43 23 58 第三 章 wRam 3. 根据下 列事 例说 出降水对 我们 生活的 影响 : (2 ) 长江 流域连 降暴 雨数 天。 可 (3 ) 黄河流域持续干旱。 ao0 (4 ) BREFERARRHR. B N 4. 撒哈拉沙 汉全 年高 温少 两， 你能 想象并 描述那里的 景象吗 ? 100 100 5. 每年 秋季， 如果 多蝴 好天 气， 对秋收作。， A 物的 成熟 和收获晾晒十 分有 利 ; 如果 出现 暴两， 甚至 产生洪涝灾害， 就会 导致作物侠 伏图 3 2 15 河内降水量 柱状图 或受 流， 对晚 灼作 物的 授粉和 成也 会产生不 利影响。 你还 能举 出一 些降 水对 生产影响的 其他 实例吗 ? 降水的 分布 降水在 世界各 地的 分布 是不 均衡的， 有的 地区 降水多， 有的 地区 降水少。 在纬度位 转 、 海陆 位置 等因素的 影响下 ,世界降水的 总体 分布 具有一定的 规律",782,0.3376545683046374,low,ocr,"重 简\n学 二 地 1\n降水 量 (mm) 降水 量 (mm\n1. 图 3-2-14 表 示意 大 利 罗马 的 年 降水 。 300 300\n旺 的 各 月 分 配 情况 ， 读 图 完成 下 列 要 求 : 20 200\n(1) 罗马 哪 几 个 月 份 降水 较 多 ? 本 w\n(2) 罗马 哪 几 个 月 份 降水 较 少 ?\n(3 ) 说 说 罗马 降水 季节 变化 的 特点 。 II\n图 3-2-14 ”罗马 降水 量 柱状 图\n2. 表 3-2-2 是 越南 河内 者 月 降水 量 的 数据 。 在 图 3-2-15 中 ， 参 展 1 一 4\n月 的 画 法 ， 完 成 河内 降水 量 柱状 图 ， 并 说 出 该 地 全 年 降水 量 分 配 的 特点 。\n表 3-2-2 河内 各 月 降水 量 统 计\n月 # 1 2 3 4 5 6 7 8 9 10 11 12\n| 19 26 44 90 189 | 240 | 288 | 318 | 265 131 43 23\n58\n=== 第 72 页 ===\n第 三 章  wRam\n3. 根据 下 列 事 例 说 出 降水 对 我 们 生活 的 影响 :\n(2 ) 长 江 流域 连 降 暴 雨 数 天 。 可 -\n(3 ) 黄河 流域 持续 干旱 。 ” ao0\n(4 ) BREFERARRHR. B N\n4. 撒哈拉 沙 汉 全 年 高 温 少 两 ， 你 能 想象\n并 描述 那里 的 景象 吗 ? 100 100\n5. 每 年 秋季 ， 如 果 多 蝴 好 天 气 ， 对 秋收 作 。 ， A\n物 的 成 熟 和 收获 晾晒 十 分 有 利 ; 如 果 出 现 暴\n两 ， 甚 至 产生 洪涝 灾害 ， 就 会 导致 作物 侠 伏 图 3 -2 15 河内 降水 量 柱状 图\n或 受 流 ， 对 晚 灼 作 物 的 授粉 和 成 也 会 产生 不 利 影响 。 你 还 能 举 出 一 些 降\n水 对 生产 影响 的 其 他 实例 吗 ?\n降水 的 分 布\n降水 在 世界 各 地 的 分 布 是 不 均衡 的 ， 有 的 地 区 降水 多 ， 有 的 地 区 降水 少 。\n在 纬度 位 转 、 海 陆 位 置 等 因素 的 影响 下 ,世界 降水 的 总 体 分 布 具有 一定 的 规律",2.0,71.74311926605505,科普版_七年级_义务教育教科书·地理七年级上册,58,2025-07-21T14:25:06.389Z,2.0,义务教育教科书·地理七年级上册,/Users/LeoQin/Documents/GitHub/PDFconvertor/training_data/初中/地理/科普版-科学普及出版社/七年级/义务教育教科书·地理七年级上册.pdf,七年级,tesseract.js-parallel,unknown,0.677536231884058,0.5,1,71.74311926605505,,,,true,true,,unknown,上册,科普版_七年级_义务教育教科书·地理七年级上册.json,地理,109,初中_地理_科普版_七年级_义务教育教科书·地理七年级上册
科普版_七年级_义务教育教科书·地理七年级上册_chunk_16,16,病一 一容 流图 3 3 2 亚欧 大陆 东西 两岸 的气候和 洋流示意图 62 第三 章世界的 气隐 学悦 区 Ap 行动 1. 请同学们 读图 1 2 6， 并填写下 表 : 表 3 3 1 不同 纬度地 区太阳光照射 的比较正午太阳光线与 地面 的单位面积获得的 太阳光 热气 温夹 角 《 大 、 小 ) 《多 、 少 ) 《高 、 低 ) 高纬度低 纬度 2. 讨论 : 参考图 3 3 3， 分组 讨论从 呼玛 到鹿特丹年 降水量 的变化规 律， 并分 析形 成这 种变化规律的 上珠 因。 二人 本人 呈和 7 了 2 区二 公交县 和 2 的和 7 了 2 oq i Fr mg 2 7 如有 个人 二 1 图 3 3 3 世界部 分城市年 降水量 3. 请分 析人 间四 月芳菲尽， 山寺 桃花 始盛 开这 名诗 的地 理原理。 世界主要气候类 型的 分布 世界各 地气温和 降水不 同。 有的 地方 终年高 温多 雨， 有的 地方 终年低温少 雨， 有的 地方 冬季寒冷干燥， 夏季 炎热 多雨 这样 地球 上出 现了 各种 不同 的气候类 型。 63 绪言 打开地 理知 识之 门打开地 理知识之 站地 理学是 研究地 理环 境以 及人 类活动与 地理 环境相互关系的 科学。 学习 地理 课程， 有助 于我 们感受不 同区 域的 自然地 理 、 人文 地理 特征， 可以 更好 地认识和 欣赏我 们生存的 这个 世界， 开病 祝野， 提升 生活 品位， 增进 我们 对地 理环境的 适应能 力。 地理 课程为 我们 展示了 多彩 的世 界全。 你知道大 自然鬼斧神工造就的 地理事物 吗 ? 你,709,0.441937614678899,medium-low,ocr,病 < 一 一 容 流\n图 3-3-2 亚 欧 大 陆 东 西 两 岸 的 气候 和 洋流 示意 图\n62\n=== 第 76 页 ===\n第 三 章 世界 的 气 隐\n学 悦 区 Ap 行动\n1. 请 同学 们 读 图 1-2-6， 并 填写 下 表 :\n表 3-3-1 不 同 纬度 地 区 太阳 光照 射 的 比较\n正午 太阳 光线 与 地 面 的 | 单位 面积 获得 的 太阳 光 热 气 温\n夹 角 《 大 、 小 ) 《多 、 少 ) 《高 、 低 )\n高 纬度\n低 纬 度\n2. 讨论 : 参考 图 3-3-3， 分 组 讨论 从 呼 玛 到 鹿特丹 年 降水 量 的 变化 规\n律 ， 并 分 析 形 成 这 种 变化 规律 的 上 珠 因 。\n二\n人 本 ~ 人 呈 和 7 了 - 2\n区 二 公交\n县 和 2 的\n和 7\n® 了 2 oq | i -] Fr mg\n2 7 如 有\n/* < 个 人\n二 1\n图 3-3-3 ”世界 部 分 城市 年 降水 量\n3. 请 分 析 “ 人 间 四 月 芳菲 尽 ， 山 寺 桃 花 始 盛 开 ” 这 名 诗 的 地 理 原理 。\n世界 主要 气候 类 型 的 分 布\n世界 各 地 气温 和 降水 不 同 。 有 的 地 方 终年 高 温 多 雨 ， 有 的 地 方 终年 低温 少\n雨 ， 有 的 地 方 冬季 寒冷 干燥 ， 夏 季 炎 热 多 雨 …… 这 样 地 球 上 出 现 了 各 种 不 同 的\n气候 类 型 。\n63\n=== 第 77 页 ===\n绪 言 打开 地 理 知 识 之 门\n—\n% =\n打开 地 理 知识 之 站\n地 理学 是 研究 地 理 环 境 以 及 人 类 活动 与 地 理 环境 相互 关系 的 科学 。 学 习\n地 理 课程 ， 有 助 于 我 们 感受 不 同 区 域 的 自然 地 理 、 人 文 地 理 特征 ， 可 以 更 好\n地 认识 和 欣赏 我 们 生存 的 这 个 世界 ， 开 病 祝 野 ， 提 升 生 活 品位 ， 增 进 我 们 对\n地 理 环境 的 适应 能 力 。\n地 理 课程 为 我 们 展示 了 多 彩 的 世 界\n全 =。 你 知道 大 自然 “鬼斧神工 ”造就 的 地 理事 物 吗 ? 你,2.0,71.74311926605505,科普版_七年级_义务教育教科书·地理七年级上册,62,2025-07-21T14:25:06.389Z,2.0,义务教育教科书·地理七年级上册,/Users/LeoQin/Documents/GitHub/PDFconvertor/training_data/初中/地理/科普版-科学普及出版社/七年级/义务教育教科书·地理七年级上册.pdf,七年级,tesseract.js-parallel,unknown,0.8511066398390342,0.6,1,71.74311926605505,,,,true,true,,geography,上册,科普版_七年级_义务教育教科书·地理七年级上册.json,地理,109,初中_地理_科普版_七年级_义务教育教科书·地理七年级上册
科普版_七年级_义务教育教科书·地理七年级上册_chunk_17,17,月份 1 2 3 4 5 6 7 8 9 10 11 12 Ac 128 136 149 164 189 199 25 227 217 192 167 141 降水量 〈mmy》 60 86 60 30 加 2 0 1 yi 13 26 79 3. 气候的 分布 具有一 定的 规律性， 读图 3 3 4， 完成 下列 要求 : (1) 找出 分布 在热带 、 温带 和塞 带的 主要气候类 型， 并奸 在表 3 3 3 中 : 表 3 3 3 热带、 温带和 寒带的 气候类 型分 布地区 热带 温带寒 带主要气候类 型 (2 ) 找出 分布 在温带地 区亚 欧大 陆西 岸 、 大陆 内部 和大 陆东 岸的 气候类 型， 并填 在表 3 3 4 中 : 表 3 3 4 温带地 区亚 欧大 陆的 气候类 型分 布地区 大陆 西岸大 陆内 部大 陆东 岸主要气候类 型 《3 ) 青藏高 原属 于什么气候类 型 ? 这种 气候类 型在 世界其 他哪些大 洲还 有分 布 ? 67 地理区 CSF4R LLAt 气候与 人类 活动气候与 人们 的日 常生活 关系密切。 世界 各地 区气候不 同， 人们 为了 适应不 同的 气收 条件， 逐渐 形成 了不 同的 生活方式。 例如， 热带 多雨 地区 的传统民居多 为高 架竹 楼， 利于 通风散热 ; 北冰洋沿岸的 因纽 特人 捕猎时 多住 雪旺， 方便就 地取材。 和气候与 疾病的 发生 也有 着十 分密切的 关系， 例如 心血管 疾病和 呼吸系统疾病在 寒冷季节有 明显的 高峰， 关节 炎在 冷湿 气候下 的发 病率 较高。 气候也 影响人 们的 生产活动， 尤其 对农业生产的 影响最 为显著。 不同 地区,733,0.3674807339449542,low,ocr,月 份 1 2 3 4 5 6 7 8 9 10 | 11 | 12\nAc |128| 136 | 149 | 164| 189 | 199 | 25 | 227 | 217| 192 ] 167 | 141\n降水 量 〈mmy》 60 86 60 30 加 2 0 1 yi 13 26 79\n3. 气候 的 分 布 具有 一 定 的 规律 性 ， 读 图 3-3-4， 完 成 下 列 要 求 :\n(1) 找 出 分 布 在 热带 、 温 带 和 塞 带 的 主要 气候 类 型 ， 并 奸 在 表 3-3-3 中 :\n表 3-3-3 热带、 温带 和 寒带 的 气候 类 型\n分 布地 区 热 带 温带 寒 ” 带\n主要 气候 类 型\n(2 ) 找 出 分 布 在 温带 地 区 亚 欧 大 陆 西 岸 、 大 陆 内 部 和 大 陆 东 岸 的 气候\n类 型 ， 并 填 在 表 3-3-4 中 :\n表 3-3-4 温带 地 区 亚 欧 大 陆 的 气候 类 型\n分 布地 区 大 陆 西岸 大 陆 内 部 大 陆 东 岸\n主要 气候 类 型\n《3 ) 青藏 高 原 属 于 什么 气候 类 型 ? 这 种 气候 类 型 在 世界 其 他 哪些 大\n洲 还 有 分 布 ?\n67\n=== 第 82 页 ===\n-地理 区 -CSF4R LLAt\n气候 与 人 类 活动\n气候 与 人 们 的 日 常生 活 关系 密切 。 世 界 各 地 区 气候 不 同 ， 人 们 为 了 适应 不\n同 的 气 收 条 件 ， 逐 渐 形 成 了 不 同 的 生活 方式 。 例 如 ， 热 带 多 雨 地 区 的 传统 民居\n多 为 高 架 竹 楼 ， 利 于 通风 散热 ; 北冰洋 沿岸 的 因 纽 特 人 捕猎 时 多 住 雪 旺 ， 方便\n就 地 取材 。 和 气候 与 疾病 的 发 生 也 有 着 十 分 密切 的 关系 ， 例 如 心血 管 疾病 和 呼吸\n系统 疾病 在 寒冷 季节 有 明显 的 高 峰 ， 关 节 炎 在 冷 湿 气候 下 的 发 病 率 较 高 。\n气候 也 影响 人 们 的 生产 活动 ， 尤 其 对 农业 生产 的 影响 最 为 显著 。 不 同 地 区,2.0,71.74311926605505,科普版_七年级_义务教育教科书·地理七年级上册,66,2025-07-21T14:25:06.389Z,2.0,义务教育教科书·地理七年级上册,/Users/LeoQin/Documents/GitHub/PDFconvertor/training_data/初中/地理/科普版-科学普及出版社/七年级/义务教育教科书·地理七年级上册.pdf,七年级,tesseract.js-parallel,unknown,0.7300970873786408,0.5,1,71.74311926605505,,,,true,true,,geography,上册,科普版_七年级_义务教育教科书·地理七年级上册.json,地理,109,初中_地理_科普版_七年级_义务教育教科书·地理七年级上册
科普版_七年级_义务教育教科书·地理七年级上册_chunk_18,18,"87 页第 四这 世界史 居民两 am 人口 的增长出 生率 是一 年内 某一 地区 出生 的了 儿数 与该 地区 总人 口数 之比。 死亡率 是一 年内 某一 地区 死亡的 人口 数与 该地 区总 人口 数之 比， 人口 的自然增长率 是指 一年 内某 一地 区人 口的 自然增长情况， 一般 用千 分比 〔go ) 来表示。 自然增 长率 出生 率死亡率， 自然 增长 率大 于 0， 表示人口 增加 ; 等于 0， 表示人口 霍增长 ; 小于 0， 表示人口 减少， 也也 人口 负增长。 从全 世界来 看， 随着 医疗卫生事业的 发展 和营养状况的 改善， 现在 每年 新出 生的 机儿 数大 大超过死 亡的 人数， 使得 人口 总数 不断 地增 自然增长率 加。 联合 国 《2000 年世界人 口前 景 (修订本 ) 》 报告预测 : 到 2050 年， 世界 人口 将达到 94 亿， 发展 中国家人 口将 由目前的 49 亿增加到 82 亿， 发达 国家 的人 口保 持在 12 忆。 图 4 1 2 人人 口自然增长率 本 LoEH 4_1 1， 你能 说出 世界人 口自 然增 长率 最高 和最 低的 各是 有个 大洲 吗 ? 2. 读网 4_1 3， 说出 公元 1800 年以 后， 世界 每增加 10 亿人。 大约 各用 了多 少年 ? 73 地理 七年 级上 册地 学习 czpa 行动 1. 观察下 面两 幅图 片， 你能 说出 生活在 这两 称环 境下 的其 他动物和 植物 吗 ? 8 1 : A 2 四热带草原温带草原 2, 你知道仙人掌 生长在 什么样 的环境中 吗 ? 你能 说出 在这 循环境 中生 活着郧 些动 物吗 ?",732,0.403267940782445,medium-low,ocr,"87 页 ===\n第 四 这 世界 史 居民\n两  am\n人 口 的 增长\n出 生 率 是 一 年 内 某 一 地 区 出 生 的 了 儿 数 与 该 地 区 总 人 口 数 之 比 。\n死亡 率 是 一 年 内 某 一 地 区 死亡 的 人 口 数 与 该 地 区 总 人 口 数 之 比 ，\n人 口 的 自然 增长 率 是 指 一 年 内 某 一 地 区 人 口 的 自然 增长 情况 ， 一 般\n用 千 分 比 〔go ) 来 表示 。 自然 增 长 率 -= 出 生 率 -死亡 率 ， 自 然 增 长 率 大 于\n0， 表 示人 口 增加 ; 等 于 0， 表 示人 口 霍 增长 ; 小 于 0， 表 示人 口 减少 ，\n也 也 人 口 负 增长 。\n从 全 世界 来 看 ， 随 着 医疗 卫生 事业 的 发 展 和 营养 状况 的 改善 ， 现 在\n每 年 新 出 生 的 机 儿 数 大 大 超过 死\n亡 的 人 数 ， 使 得 人 口 总 数 不 断 地 增\n自然 增长 率\n加 。 联 合 国 《2000 年 世界 人 口 前 景\n(修订 本 ) 》 报告 预测 : 到 2050\n年 ， 世 界 人 口 将 达到 94 亿 ， 发 展 中\n国家 人 口 将 由 目前 的 49 亿 增加 到 82\n亿 ， 发 达 国 家 的 人 口 保 持 在 12 忆 。 图 4-1-2 人 人 口 自然 增长 率\n本\nETY\nLoEH 4_1-1， 你 能 说 出 世界 人 口 自 然 增 长 率 最 高 和 最 低 的 各 是 有 个\n大 洲 吗 ?\n2. 读 网 4_1 -3， 说 出 公元 1800 年 以 后 ， 世 界 每 增加 10 亿 人 。 大 约 各 用\n了 多 少年 ?\n73\n=== 第 88 页 ===\n地 理 七 年 级 上 册\n地\n学 习 czpa 行动\n1. 观察 下 面 两 幅 图 片 ， 你 能 说 出 生活 在 这 两 称 环 境 下 的 其 他 动物 和 植\n物 吗 ?\n~ 8 | 1 =\n: A 2\n四\n|\n热带 草原 温带 草原\n2, 你 知道 仙人 掌 生长 在 什么 样 的 环境 中 吗 ? 你 能 说 出 在 这 循环 境 中 生\n活着 郧 些 动 物 吗 ?",2.0,71.74311926605505,科普版_七年级_义务教育教科书·地理七年级上册,71,2025-07-21T14:25:06.389Z,2.0,义务教育教科书·地理七年级上册,/Users/LeoQin/Documents/GitHub/PDFconvertor/training_data/初中/地理/科普版-科学普及出版社/七年级/义务教育教科书·地理七年级上册.pdf,七年级,tesseract.js-parallel,unknown,0.8054474708171206,0.5,1,71.74311926605505,,true,,true,true,,biology,上册,科普版_七年级_义务教育教科书·地理七年级上册.json,地理,109,初中_地理_科普版_七年级_义务教育教科书·地理七年级上册
科普版_七年级_义务教育教科书·地理七年级上册_chunk_19,19,"图 4 1 10 升学 、 就业 困难现在 ,亚洲 、 非洲 、 拉本 美洲的 一些 发展 中国家人 口增 长过 快。 过多 的人 口使 得人 们为 了生存大 规模地 砍伐森林 、 开星 草原 、 开采矿产， 结果 造成 了水 土流失 、 土地 荒漠化 和工业污染， 使人 类的 生存环境和 恶化。 同时， 发展缓慢的 农村经 济容 纳不 了更 多的 劳动万， 越来 越多 的人 从农村流 人城市。 但在 欧洲的 一些 国家， 如意大利 、 德国 、 法国 和瑞典等， 近些 年来 人口 一直 处于 零增长或 负增长状态， 已经 引起人 口老龄化， 出现 了劳动力 短缺， 国防 兵源不 足， 老年 人生活困难 、 琶单 等问题。 为此， 有些 国家 采取措施鼓励生 育， 如法 国给 多子女家 庭发 放各 种补贴。 总的 来君， 人口 增长速度过 快带 来的 问题更 为突出， 为了 解决这 一问题， 必须控制人 口增长速度， 做到 有计划地 生育， 使人 口的 增长与 社会 、 经济 的发 展相 适应， 与环境 、 资源 相协调。 同时 还要 使人 们能 够受到良好的 教育， 提高 人口 索质。 77 地理 七年 级上 和册 两和 该中 国计 划生育的 成就 中国 作为世界最 大的 发展 中国家和 人口 最多 的国家， 在控制人 己过 快增长方面进行了 不懈 的努力。 在过 去的 30 多年 里， 中国 因计划生育而 上少 出生 了 3.5 亿人， 对控制世界人 口的 过快 增长做 出了 巨大贡献。 了 1. 全班 同学分 成丙 组， 以人 口多 是负担还 是资源为 主题进行辩论。 角色分 配 : 个辩 手 : 主要发 言人。 四策划 : 收集和 整理本 方辩 手的 资料。",745,0.47821876698565374,medium-low,ocr,"图 4-1-10 升学 、 就 业 困难\n现在 ,亚洲 、 非 洲 、 拉 本 美洲 的 一 些 发 展 中 国家 人 口 增 长 过 快 。 过 多 的 人\n口 使 得 人 们 为 了 生存 大 规模 地 砍伐 森林 、 开 星 草 原 、 开 采矿 产 ， 结 果 造 成 了 水\n土 流失 、 土 地 荒漠 化 和 工业 污染 ， 使 人 类 的 生存 环境 和 恶化。 同时， 发展 缓慢 的\n农村 经 济 容 纳 不 了 更 多 的 劳动 万 ， 越 来 越 多 的 人 从 农村 流 人 城市 。\n但 在 欧洲 的 一 些 国家 ， 如 意大利 、 德 国 、 法 国 和 瑞典 等 ， 近 些 年 来 人 口\n一 直 处 于 零增长 或 负增长 状态 ， 已 经 引起 人 口 老龄 化 ， 出 现 了 劳动 力 短缺 ， 国\n防 兵源 不 足 ， 老 年 人 生活 困难 、 琶 单 等 问题 。 为 此 ， 有 些 国 家 采取 措施 鼓励 生\n育 ， 如 法 国 给 多 子女 家 庭 发 放 各 种 补贴 。\n总 的 来 君 ， 人 口 增长 速度 过 快 带 来 的 问题 更 为 突出 ， 为 了 解决 这 一 问题 ，\n必须 控制 人 口 增长 速度 ， 做 到 有 计划 地 生育 ， 使 人 口 的 增长 与 社会 、 经 济 的 发\n展 相 适 应 ， 与 环境 、 资 源 相 协调 。 同 时 还 要 使 人 们 能 够 受到 良好 的 教育 ， 提 高\n人 口 索 质 。\n77\n=== 第 93 页 ===\n地 理 七 年 级 上 和 册\n两 和 该\n中 国 计 划 生育 的 成 就\n中 国 作为 世界 最 大 的 发 展 中 国家 和 人 口 最 多 的 国家 ， 在 控制 人 己 过\n快 增长 方面 进行 了 不 懈 的 努力 。 在 过 去 的 30 多 年 里 ， 中 国 因 计划 生育 而\n上 少 出 生 了 3.5 亿 人 ， 对 控制 世界 人 口 的 过 快 增长 做 出 了 巨大 贡献 。\n了\nNA\n1. 全 班 同学 分 成 丙 组 ， 以 “人 口 多 是 负担 还 是 资源 ”为 主题 进行 辩论 。\n角色 分 配 :\n个 辩 手 : 主要 发 言 人 。\n四 策划 : 收集 和 整理 本 方 辩 手 的 资料 。",2.0,71.74311926605505,科普版_七年级_义务教育教科书·地理七年级上册,75,2025-07-21T14:25:06.389Z,2.0,义务教育教科书·地理七年级上册,/Users/LeoQin/Documents/GitHub/PDFconvertor/training_data/初中/地理/科普版-科学普及出版社/七年级/义务教育教科书·地理七年级上册.pdf,七年级,tesseract.js-parallel,unknown,0.8835489833641405,0.5,1,71.74311926605505,,,,true,,,physics,上册,科普版_七年级_义务教育教科书·地理七年级上册.json,地理,109,初中_地理_科普版_七年级_义务教育教科书·地理七年级上册
