Chunk_ID,Chunk_Index,Content,Content_Length,Quality_Score,Reliability,Source_Type,Original_Content,Enhancement_Version,averageConfidence,book_name,chunkIndex,enhancementTimestamp,enhancementVersion,fileName,filePath,grade,ocrMethod,publisher,qualityMetrics_chineseCharRatio,qualityMetrics_coherenceScore,qualityMetrics_lengthScore,qualityMetrics_ocrConfidence,semanticFeatures_hasDefinition,semanticFeatures_hasExperiment,semanticFeatures_hasFormulas,semanticFeatures_hasNumbers,semanticFeatures_hasQuestion,semanticFeatures_isTableContent,semanticFeatures_subjectArea,semester,source_file,subject,totalPages,uniqueId
科普版_七年级_义务教育教科书·地理七年级上册_chunk_5,5,"备在 班级交流。 (考察对 象如 天气 、 河流 、 交通 明确 写出 是震 一种 地理事物 或现象， 付么 时间， 什么 地点。) 2. 国庆节 快到 了， 请你 设计一 个班级秋游方案 (方案包括 : 秋游的 时间 、 路线 、 要准备的 物品和 注意事项等 )。 6 三 . _ : 本 B 起于 外竹 一人 本本 1 o AREREFEFIARMBREZRE? 全怎样在 地球 羽上 确定基地点 的位 置 ? 总地 球是 如何 运动的 ? 哪些地 理现 象能 说明 地球 在不 断运 动 ? 全你 知道地 图的 三要 素是 什么吗 ? 它们各 有什么作用 ? 马在 地图 上如 何表 示地 面高 低起 伏和 地表 形态 ? 地理 七年级上 册第 一节 地球 与地 球仪 人你 知道人 类认识地 球形状 的历程吗 ? 你能 说出 地球 仪上 经纬 网的 作用吗 ? 人类 认识地 球形状 的历程现在， 人们 从人 造地 球卫 星影 像上 能够 清楚地 看到 地球 的真实形状。 在这 之前， 由于 科学技术条 件的 限制， 人们 无法 看到 地球 的全 和狐， 对地 球形状 的认 识勾 历了 漫长的 过程。 w_ m 人类 对地 球形状 的认识吉 代， 人们 由于 活动范围狱 小， 往往 赁自己的 直觉去 认识世界。 看到 眼前的 地面 是平 的， 就以 为整个大 地也 是平 的， 并且 把天 空看 做是 饲扣 在平坦大 地上 的一 口大 锅。 于是， 就有 了盖 天说 和天 国地 方说。 汉代， 我国 天文学家 张衡提出了 浑天 说 ""， 意思 是宇宙就 像一 个",690,0.3031903036423388,low,ocr,"备 在 班级 交流 。 (考察 对 象 如 天 气 、 河 流 、 交 通 …… 明 确 写 出 是\n震 一 种 地 理事 物 或 现象 ， 付 么 时 间 ， 什 么 地 点 。)\n2. 国庆 节 快 到 了 ， 请 你 设计 一 个 班级 秋游 方案 (方案 包括 : 秋游 的 时\n间 、 路 线 、 要 准备 的 物品 和 注意 事项 等 ) 。\n6\n=== 第 15 页 ===\n三\n- =\n.-_ :\n本 =\nB 起\nSS 于\n外 竹\n一 人 -\nRE % ER\n“本\n本 1\no AREREFEFIARMBREZRE?\n全 怎样 在 地 球 羽 上 确定 基地 点 的 位 置 ?\n总 地 球 是 如 何 运动 的 ? 哪些 地 理 现 象 能 说 明 地 球 在 不 断 运 动 ?\n全 你 知道 地 图 的 三 要 素 是 什么 吗 ? 它们 各 有 什么 作用 ?\n马 在 地 图 上 如 何 表 示 地 面 高 低 起 伏 和 地 表 形 态 ?\n=== 第 16 页 ===\n地 理 七 年级 上 册\n第 一 节 ”地 球 与 地 球 仪\n人 你 知道 人 类 认识 地 球形 状 的 历程 吗 ? 你 能 说 出 地 球 仪 上\nLY 经 纬 网 的 作用 吗 ?\n人 类 认识 地 球形 状 的 历程\n现在 ， 人 们 从 人 造 地 球 卫 星 影 像 上 能 够 清楚 地 看 到 地 球 的 真实 形状 。 在 这\n之 前 ， 由 于 科学 技术 条 件 的 限制 ， 人 们 无 法 看 到 地 球 的 全 和 狐 ， 对 地 球形 状 的 认\n识 勾 历 了 漫长 的 过 程 。\n%\nw_¢ m\n人 类 对 地 球形 状 的 认识\n吉 代 ， 人 们 由 于 活动 范围 狱 小 ， 往 往 赁 自己 的 直觉 去 认识 世界 。 看\n到 眼前 的 地 面 是 平 的 ， 就 以 为 整个 大 地 也 是 平 的 ， 并 且 把 天 空 看 做 是\n饲 扣 在 平坦 大 地 上 的 一 口 大 锅 。 于 是 ， 就 有 了 “ 盖 天 说 ”和 “天 国 地\n方 说 ”。\n汉代 ， 我 国 天 文学 家 张衡 提出 了 “ 浑 天 说 ""”， 意 思 是 宇宙 就 像 一 个",2.0,71.74311926605505,科普版_七年级_义务教育教科书·地理七年级上册,12,2025-07-21T14:25:06.389Z,2.0,义务教育教科书·地理七年级上册,/Users/LeoQin/Documents/GitHub/PDFconvertor/training_data/初中/地理/科普版-科学普及出版社/七年级/义务教育教科书·地理七年级上册.pdf,七年级,tesseract.js-parallel,unknown,0.8551020408163266,0.5,1,71.74311926605505,,,,true,true,,physics,上册,科普版_七年级_义务教育教科书·地理七年级上册.json,地理,109,初中_地理_科普版_七年级_义务教育教科书·地理七年级上册
科普版_七年级_义务教育教科书·地理七年级上册_chunk_6,6,"北极轿，66.5。""S 称为 南极圈。 在日 常生活 和生产中 有很 多利用色 纬网 的实例。 利用 经纬 网可 以确定地 球表面任意一 点的 位置， 如航海 、 航空 和气象台 发布 台风中 心的 位置 ; 利用 到纬 网还 可以 判断方向和 识别两 地之 间的 位置 关系， 如知道北京的 经纬度 (39 56'N, 116 20E) 和杭州的 经纬度 (30 16'N, 120 12 E)， 我们 就可 以判断出 杭州位 于北京的 东南方向。 12 F F 地球 与地 图两 全该 地球 经纬 网的 起瑶 为了 准确地 表示地 球各 好的 位置， 人们 给地 球表 面假 设了 一个 坐标系， 这就 是经 纬网 那么， 最初 的经 屿网 是息 样产生的 ? 又是 如何 测定的 呢 ? 公元前 344 年， 亚历 山大 渡海南侵， 继而 东征， 随军 地理学家 尼尔 摩斯 治途 收集资料， 发现 沿东 征的 路线 由西向东 李节 变换 和有 尽夜 长短 都很 相仿， 于是 他画 出了 第一 条纬 线。 后来， 埃及 亚历山大城 的图 书馆馆 长埃 拉托 斯特 尼计算出 地球 的圆周是 46 250 千米， 画了 一张 有 7 条经 线和 6 条师 线的 世界地 图。 公元 120 年， 古希腊地 理学家 托勒 密综 合前 人的 研究上 成果， 认为绘 制地 图应 以已 知经 纬度的 定点作 根据， 提出 了在 地图 上绘制经 纬网 的概 您。 为使 地球 上的 经纬 线能 在平面上 描绘出 来， 他设法把 经纬 线绘 成简 单的 扁形， 从而 绘制出 一幅 著名 的托 勒密 地图。 了 ws 四 7",710,0.47990711704197936,medium-low,ocr,"北极\n轿 ，66.5。""S 称 为 南极 圈 。\n在 日 常生 活 和 生产 中 有 很 多 利用 色 纬 网 的 实例 。 利 用 经 纬 网 可 以 确定\n地 球 表面 任意 一 点 的 位 置 ， 如 航海 、 航 空 和 气象 台 发 布 台风 中 心 的 位 置 ; 利\n用 到 纬 网 还 可 以 判断 方向 和 识别 两 地 之 间 的 位 置 关系 ， 如 知道 北京 的 经 纬度\n(39°56'N, 116°20E) 和 杭州 的 经 纬度 (30° 16'N, 120°12°E) ， 我 们 就 可 以\n判断 出 杭州 位 于 北京 的 东南 方向 。\n12\n=== 第 21 页 ===\n»F—F 地 球 与 地 图\n两 全 该\n地 球 经 纬 网 的 起 瑶\n为 了 准确 地 表示 地 球 各 好 的 位 置 ， 人 们 给 地 球 表 面 假 设 了 一 个 坐标\n系 ， 这 就 是 经 纬 网 那么， 最 初 的 经 屿 网 是 息 样 产生 的 ? 又 是 如 何 测定\n的 呢 ?\n公元 前 344 年 ， 亚 历 山 大 渡海 南侵 ， 继 而 东 征 ， 随 军 地 理学 家 尼 尔\n摩 斯 治 途 收集 资料 ， 发 现 沿 东 征 的 路 线 由 西向 东 李 节 变 换 和 有 尽 夜 长 短 都\n很 相仿 ， 于 是 他 画 出 了 第 一 条 纬 线 。 后 来 ， 埃 及 亚历山大 城 的 图 书馆 馆\n长 埃 拉 托 斯 特 尼 计算 出 地 球 的 圆周 是 46 250 千 米 ， 画 了 一 张 有 7 条 经 线\n和 6 条 师 线 的 世界 地 图 。\n公元 120 年 ， 古 希腊 地 理学 家 托 勒 密 综 合 前 人 的 研究 上 成果， 认为 绘\n制 地 图 应 以 已 知 经 纬度 的 定点 作 根 据 ， 提 出 了 在 地 图 上 绘制 经 纬 网 的 概\n您 。 为 使 地 球 上 的 经 纬 线 能 在 平面 上 描绘 出 来 ， 他 设法 把 经 纬 线 绘 成 简\n单 的 扁 形 ， 从 而 绘制 出 一 幅 著 名 的 “ 托 勒 密 地 图 ”。\n了\nws 四 7",2.0,71.74311926605505,科普版_七年级_义务教育教科书·地理七年级上册,17,2025-07-21T14:25:06.389Z,2.0,义务教育教科书·地理七年级上册,/Users/LeoQin/Documents/GitHub/PDFconvertor/training_data/初中/地理/科普版-科学普及出版社/七年级/义务教育教科书·地理七年级上册.pdf,七年级,tesseract.js-parallel,unknown,0.8290766208251473,0.5,1,71.74311926605505,,,,true,true,,mathematics,上册,科普版_七年级_义务教育教科书·地理七年级上册.json,地理,109,初中_地理_科普版_七年级_义务教育教科书·地理七年级上册
科普版_七年级_义务教育教科书·地理七年级上册_chunk_7,7,") (长 、 短 ) (多 、 少 》 夏至日 冬至日 3. 在你 家附近找 一处 有阳光的 地方， 垂直 地面 揪上 一根木杆。 观察 并试 解闻 为什么夏季中 午时的 影子会 比冬季的 要短 得多。 Se S o 政竹 冬季图 1 2 8 木杆 与日 影 4. 读图 1 2 7， 说出 划分五 带的 界线。 5. 你的 家乡 位于 五带 中的 哪一 带 ? 说一 说家 乡一 年中 的正午太阳照射情 况和 和且 夜长 短的 变化规律。 19 地理 七年 级上 抽第 三节 地图 人人 们很 多活动都 需要地 图， 怎样 选择 合适的 地图 ? 如何在地 图上 读出 我们 需要的 信息呢 ? 读懂 地图 的语言地 图是 我们 学习 和生活中 必不 可少 的工具。 制作 地图 时， 我们 将要 表示的 地表 事物 按照一 定比 例缩 小， 然后 用不 同的 符号在 图中 表示出 来， 再加 上必要的 文字和 数字说 明。 地图 的用 途很 广， 外出 旅行， 地图 是我 们很 好的 向导 ; 读书看 报， 地图 会帮助我 们找到事件的 发生地 ; 修路 选址 、 航空 航海 等都 离不 开地 图。 要想 灵活 地运用地 图， 首先 要读 懂地 图的 语言。 地图 的语言就 是指 方向 、 比例 斥以 及图 例和 注记， 通常 称为 地图 的三 要素。 在地 图上 判定方向的 一般 方法 是 : 面对 地图 上北 下南， 左西 右东 ""， 进一 步可 以确定东北 、 东南 、 西南 、 西北， 加起 来共 八个 方向 (如网 1 3 1)。 在有 和经纬网 的地 图上， 我们 可以 这样 判断方向 : 经线 指示 南北， 竺线 指示 东",727,0.40828014981273414,medium-low,ocr,") (长 、 短 ) (多 、 少 》\n夏至 日\n冬至 日\n3. 在 你 家 附近 找 一 处 有 阳光 的 地 方 ， 垂 直 地 面 揪 上 一 根木 杆 。 观 察 并\n试 解 闻 为 什么 夏季 中 午时 的 影子 会 比 冬季 的 要 短 得 多 。\nSe RE \ S— o\n政 竹 冬季\n图 1-2-8 木 杆 与 日 影\n4. 读 图 1-2-7， 说 出 划分 五 带 的 界线 。\n5. 你 的 家 乡 位 于 五 带 中 的 哪 一 带 ? 说 一 说 家 乡 一 年 中 的 正午 太阳 照射 情\n况 和 和 且 夜 长 短 的 变化 规律 。\n19\n=== 第 29 页 ===\n地 理 七 年 级 上 抽\n第 三 节 地 图\n人 = 人 们 很 多 活动 都 需要 地 图 ， 怎 样 选 择 合适 的 地 图 ?\nQLY 如 何在 地 图 上 读 出 我 们 需要 的 信息 呢 ?\n读 懂 地 图 的 “语言 ”\n地 图 是 我 们 学 习 和 生活 中 必 不 可 少 的 工具 。 制 作 地 图 时 ， 我 们 将 要 表示 的\n地 表 事 物 按照 一 定 比 例 缩 小 ， 然 后 用 不 同 的 符号 在 图 中 表示 出 来 ， 再 加 上 必要\n的 文字 和 数字 说 明 。\n地 图 的 用 途 很 广 ， 外 出 旅行 ， 地 图 是 我 们 很 好 的 向 导 ; 读书 看 报 ， 地 图 会\n帮助 我 们 找到 事件 的 发 生地 ; 修 路 选 址 、 航 空 航 海 等 都 离 不 开 地 图 。\n要 想 灵 活 地 运用 地 图 ， 首 先 要 读 懂 地 图 的 “语言 ” 。 地 图 的 “语言 ”就 是\n指 方向 、 比 例 斥 以 及 图 例 和 注 记 ， 通 常 称 为 地 图 的 三 要 素 。\n在 地 图 上 判定 方向 的 一 般 方 法 是 : 面 对 地 图 “上 北 下 南 ， 左 西 右 东 ""， 进\n一 步 可 以 确定 东北 、 东 南 、 西 南 、 西 北 ， 加 起 来 共 八 个 方向 (如 网 1-3-1) 。\n在 有 和 经纬 网 的 地 图 上 ， 我 们 可 以 这 样 判断 方向 : 经 线 指 示 南 北 ， 竺 线 指 示 东",2.0,71.74311926605505,科普版_七年级_义务教育教科书·地理七年级上册,24,2025-07-21T14:25:06.389Z,2.0,义务教育教科书·地理七年级上册,/Users/LeoQin/Documents/GitHub/PDFconvertor/training_data/初中/地理/科普版-科学普及出版社/七年级/义务教育教科书·地理七年级上册.pdf,七年级,tesseract.js-parallel,unknown,0.8628230616302187,0.5,1,71.74311926605505,,,,true,true,,unknown,上册,科普版_七年级_义务教育教科书·地理七年级上册.json,地理,109,初中_地理_科普版_七年级_义务教育教科书·地理七年级上册
科普版_七年级_义务教育教科书·地理七年级上册_chunk_8,8,"图， 首先 要根据自身的 需要选择适合的 地图， 然后 才能在 地图 上获取有 用的 信息。 例如， 我们 要去 外地 旅游。 确定 行程时 就要 用到 交通图， 到达 景区游玩时 就要 用到 景区游览图。 不同比例 尺的 地图， 表示 内容 的详 略也 不同。 大比例尺 的地 图， 表示 的内 容详细 ;小比例尺 的地 图， 表示 的内 容粗略。 如果 想知道自己家 乡在 全国 28 第一 齐地 对与 地图 的位 置， 可以 选用小 比例尺的 地图， 如果 想进一步了 解自 己家 在本 市 (区 ) 的位 置， 就要 选用大 比例尽 的地 图。 六 7 ea 元市 _ 上和 瑟布 "" gY E 江西过 1 E : . 妇生生 wa 2 党 f 和商 虽市 了一 图 1 3 14 都阳 湖地 区洪 游灾害遥感监测图 而合 访遥感的 发展 有过 感， 就是 人们 利用一 定的 技术装备， 在航空器 〈 如飞机 ) 或航天器 (如卫星 ) 上， 对姑 远的 地物 进行感知。 自 1839 年世界上 发明了照 相摄影技术后， 人们 就试图用 拍摄的 照片制作地 形图。19 世纪 五六 十年 代， 法国 、 人美国相继利用气球拍摄巴黎街道岛 县照片 : FokEMBTE BARE. 198 28054K, ; 英国 、 俄国 和美国都 曾有 人利用风筝拍摄有 地景。1903 年曾 有人 利用饮 子进 行空中摄 影。 直至 1909 年， 人类 第一 次利用飞机实 现了 从空中观测地 面， 拍摄 了地 面有 照片， 图 1 3 15 卫星勘测 29 四七 年级 上册",689,0.3566584317502154,low,ocr,"图 ， 首 先 要 根据 自身 的 需要 选择 适合 的 地 图 ， 然 后 才能 在 地\n图 上 获取 有 用 的 信息 。 例 如， 我 们 要 去 外 地 旅游 。 确 定 行程 时 就 要 用 到 交通\n图 ， 到 达 景区 游玩 时 就 要 用 到 景区 游览 图 。\n不 同比 例 尺 的 地 图 ， 表 示 内 容 的 详 略 也 不 同 。 大 比例 尺 的 地 图 ， 表 示 的\n内 容 详细 ;小 比例 尺 的 地 图 ， 表 示 的 内 容 粗略 。 如 果 想 知道 自己 家 乡 在 全 国\n28\n=== 第 39 页 ===\n第 一 齐 地 对 与 地 图\n的 位 置 ， 可 以 选用 小 比例尺 的 地 图 ， 如 果 想 进一步 了 解 自 己 家 在 本 市 (区 ) 的\n位 置 ， 就 要 选用 大 比例 尽 的 地 图 。\n六 7 ea 元 市\n_ | 上 和 瑟 布 "" %\ngY E % 江西 过 1 E : ]\n. 妇 生生 | wa 2 &\n党 f 和 商 虽 市 了 = | SN\n| 一\n图 1-3-14 ”都 阳 湖 地 区 洪 游 灾害 遥感 监测 图\n而 合 访\n遥感 的 发 展\n有 过 感 ， 就 是 人 们 利用 一 定 的 技术 装备 ， 在 航空 器 〈 如 飞机 ) 或 航天\n器 (如 卫星 ) 上 ， 对 姑 远 的 地 物 进行 感知 。\n自 1839 年 世界 上 发 明了 照 相 摄影 技术 后 ， 人 们 就 试图 用 拍摄 的 照片\n制作 地 形 图 。19 世 纪 五 六 十 年 代 ， 法 国 、 人\n美国 相继 利用 气球 拍摄 巴黎 街道 岛 县 照片 &% :\nFokEMBTE BARE. 198-28054K, ;\n英国 、 俄 国 和 美国 都 曾 有 人 利用 风筝 拍摄 “有\n地 景 。1903 年 曾 有 人 利用 饮 子 进 行 空中 摄\n影 。 直 至 1909 年 ， 人 类 第 一 次 利用 飞机 实\n现 了 从 空中 观测 地 面 ， 拍 摄 了 地 面 有 照片 ， 图 1-3-15 ”卫星 勘测\n29\n=== 第 40 页 ===\n四 七 年 级 上 册",2.0,71.74311926605505,科普版_七年级_义务教育教科书·地理七年级上册,33,2025-07-21T14:25:06.389Z,2.0,义务教育教科书·地理七年级上册,/Users/LeoQin/Documents/GitHub/PDFconvertor/training_data/初中/地理/科普版-科学普及出版社/七年级/义务教育教科书·地理七年级上册.pdf,七年级,tesseract.js-parallel,unknown,0.7928286852589641,0.5,1,71.74311926605505,,,,true,,,unknown,上册,科普版_七年级_义务教育教科书·地理七年级上册.json,地理,109,初中_地理_科普版_七年级_义务教育教科书·地理七年级上册
科普版_七年级_义务教育教科书·地理七年级上册_chunk_9,9,人类 在感 中自然造物神奇的 同时， 也对 自然界 充满了 好奇 与想象。 时至 今日， 地理事物 与现象越 来越 被人 们所 关注。 当你 面对 这形形色色的 地理事物 和多 姿多 彩的 地理 现象时， 你是 和否 思考 过 : 为什么会 有四 季变 化和 此夜 更蔡 ? 为什么会 有火山喷 发和 地震 ? 在地 图上 上如何表示高 山 、 平原 、 盆地 ? 保护极地环境我 们应 该做 些什 么 ? 世界庞大的 人口 会蒂 来哪些问题 ? 为什么世 界各 国间 的经 济合 作越 来越 紧密这 些都 与地 理密切相关。 七年 级上 册地 理教科书， 将引领同学们 认识地 球与 地图 、 世界 的陆地和 海洋， 了解 世界的 气候 、 世界 的居民 、 不同 地域 发展 的差异， 人稚 得保护世界文化遗产和 保护环境的 意义 ;将为 同学们 打开地 理知 识学习之 门和 贡定 学习 地理 的知识基础。 教科书 里有 各种 各样 的图 片 、 科学 严谨的 知识 、 创意 性的 学习 行动 、 开放 的疯 读， 证同学们 在感受学 习乐 趣的 同时， 增长 才王， 开拓 视野， 还能 帮助同学们 更好 地应 对生活中 的各 种困难， 解决生活中 的一 些实际问题。 地理 环境空间广大， 地理事物 多种 多样， 地理 关系 错综 复杂。 让我 们一 起走 进地 理教 科书， 在那 丰富 多彩 的地 理知 识海 洋中 六游 ! 地理 七年 级上 和册 为岛屿， 大陆 与它 周围 的岛屿合 起来 称为 大洲。 全球 陆地 共分 为七 个大 洲， 即亚洲 、 欧洲 、 非洲 、 北美洲 、 南美洲 、 大洋 洲和 南极洲。 . 本本 今世攻 人机 8,732,0.49042974203595247,medium-low,ocr,人 类 在 感 中 自然 造物 神奇 的 同时 ， 也 对 自然 界 充满 了\n好 奇 与 想象 。 时 至 今日 ， 地 理事 物 与 现象 越 来 越 被 人 们 所 关注 。\n当 你 面 对 这 形形色色 的 地 理事 物 和 多 姿 多 彩 的 地 理 现象 时 ， 你 是\n—= 和 否 思 考 过 : 为 什么 会 有 四 季 变 化 和 此 夜 更 蔡 ? 为 什么 会 有 火山 喷\n发 和 地 震 ? 在 地 图 上 上 如何 表示 高 山 、 平 原 、 盆 地 ? 保护 极地 环境\n我 们 应 该 做 些 什 么 ? 世界 庞大 的 人 口 会 蒂 来 哪些 问题 ? 为 什么 世\n界 各 国 间 的 经 济 合 作 越 来 越 紧密 …… 这 些 都 与 地 理 密切 相关 。\n七 年 级 上 册 地 理 教科 书 ， 将 引领 同学 们 认识 地 球 与 地 图 、 世\n界 的 陆地 和 海洋， 了 解 世界 的 气候 、 世 界 的 居民 、 不 同 地 域 发 展\n的 差异 ， 人 稚 得 保护 世界 文化 遗产 和 保护 环境 的 意义 ;将 为 同学 们\n打开 地 理 知 识 学习 之 门 和 贡 定 学 习 地 理 的 知识 基础 。\n教科 书 里 有 各 种 各 样 的 图 片 、 科 学 严谨 的 知识 、 创 意 性 的 学\n习 行 动 、 开 放 的 疯 读 ， 证 同学 们 在 感受 学 习 乐 趣 的 同时 ， 增 长 才\n王 ， 开 拓 视 野 ， 还 能 帮助 同学 们 更 好 地 应 对 生活 中 的 各 种 困难 ，\n解决 生活 中 的 一 些 实际 问题 。\n地 理 环境 空间 广大 ， 地 理事 物 多 种 多 样 ， 地 理 关 系 错 综 复\n杂 。 让 我 们 一 起 走 进 地 理 教 科 书 ， 在 那 丰 富 多 彩 的 地 理 知 识 海 洋\n中 六 游 !\n=== 第 45 页 ===\n地 理 七 年 级 上 和 册\n为 岛屿 ， 大 陆 与 它 周 围 的 岛屿 合 起 来 称 为 大 洲 。 全 球 陆 地 共 分 为 七 个 大 洲 ， 即\n亚洲 、 欧 洲 、 非 洲 、 北 美洲 、 南 美洲 、 大 洋 洲 和 南极 洲 。\n-. 本 本 SS\n今世 | 攻 人\n机 8,2.0,71.74311926605505,科普版_七年级_义务教育教科书·地理七年级上册,37,2025-07-21T14:25:06.389Z,2.0,义务教育教科书·地理七年级上册,/Users/LeoQin/Documents/GitHub/PDFconvertor/training_data/初中/地理/科普版-科学普及出版社/七年级/义务教育教科书·地理七年级上册.pdf,七年级,tesseract.js-parallel,unknown,0.9103053435114504,0.5,1,71.74311926605505,,,,true,true,,geography,上册,科普版_七年级_义务教育教科书·地理七年级上册.json,地理,109,初中_地理_科普版_七年级_义务教育教科书·地理七年级上册
