Chunk_ID,Chunk_Index,Content,Content_Length,Quality_Score,Reliability,Source_Type,Original_Content,Enhancement_Version,averageConfidence,book_name,chunkIndex,enhancementTimestamp,enhancementVersion,fileName,filePath,grade,ocrMethod,publisher,qualityMetrics_chineseCharRatio,qualityMetrics_coherenceScore,qualityMetrics_lengthScore,qualityMetrics_ocrConfidence,semanticFeatures_hasDefinition,semanticFeatures_hasExperiment,semanticFeatures_hasFormulas,semanticFeatures_hasNumbers,semanticFeatures_hasQuestion,semanticFeatures_isTableContent,semanticFeatures_subjectArea,semester,source_file,subject,totalPages,uniqueId
科普版_七年级_义务教育教科书·地理七年级上册_chunk_10,10,在那 丰富 多彩 的地 理知 识海 洋中 六游 ! 地理 七年 级上 和册 为岛屿， 大陆 与它 周围 的岛屿合 起来 称为 大洲。 全球 陆地 共分 为七 个大 洲， 即亚洲 、 欧洲 、 非洲 、 北美洲 、 南美洲 、 大洋 洲和 南极洲。 . 本本 今世攻 人机 8 只骂 总关 人 ec 人作 . 二 E re 4 党 : : 了少 多图 2 1 3 七大 洲的 面积和 平均海拔并 he H2 14 亚欧 非三 洲分 界人 们把 乌拉尔 出脉 、 乌拉 尔河 、 大高 加索 山脉 和土耳其海峡一 线作 为亚洲和 欧洲的 分界线， 把苏 仇士 运河作为亚洲和 非洲的 分界线， 把巴拿马运河作为北美洲 和南美洲 的分 界线。 习惯 上， 人们 还把 美国以 南的 美洲地 区， 称为 拉丁美洲。 Po A 大洲 的命名亚洲全称是 亚细亚洲。 意思 是太阳升 起的 地方。 歌洲 全称 是欧罗巴洲。 由于 其位 于亚洲西 面， 被人 们看 做是 日落 之处， 称为 欧罗巴。 非洲全称是 阿非 利加 洲。 拉丁 文阿 非利加是 炽热的 阳光 的意思。 北美洲 指巴拿马运河以 北的 美洲地 区。 其命名是 为纪念意大利探 34 第二 齐世界的 陆地和 海洋险 家亚 美利 哥。 南美洲 指巴拿马运河以 南的 美洲地 区， 与北美洲 合称 为亚 美利 加洲。 大洋 洲意思是 大洋 中的 陆地。 南极洲 指位 于地 球南端的 南极大 陆及 周围岛屿。 学习 区 Ap 行动 1. 在图 2 1 S上找 出七 大洲 的位 置并 填写名 称。 凡人 N Certz 过,686,0.31491494078698135,low,ocr,在 那 丰 富 多 彩 的 地 理 知 识 海 洋\n中 六 游 !\n=== 第 45 页 ===\n地 理 七 年 级 上 和 册\n为 岛屿 ， 大 陆 与 它 周 围 的 岛屿 合 起 来 称 为 大 洲 。 全 球 陆 地 共 分 为 七 个 大 洲 ， 即\n亚洲 、 欧 洲 、 非 洲 、 北 美洲 、 南 美洲 、 大 洋 洲 和 南极 洲 。\n-. 本 本 SS\n今世 | 攻 人\n机 8\n只 骂 总 关 | 人 ec\n人 作 . 二 E re SN\n 4 党 :|\n| / : - 了 少 多\nSN\n图 2-1-3 ”七 大 洲 的 面积 和 平均 海拔 “并 he\nH2-14 亚 欧 非 三 洲 分 界\n人 们 把 乌拉 尔 出 脉 、 乌 拉 尔 河 、 大 高 加 索 山 脉 和 土耳其 海峡 一 线 作 为 亚洲\n和 欧洲 的 分 界线 ， 把 苏 仇 士 运河 作为 亚洲 和 非洲 的 分 界线 ， 把 巴拿马 运河 作为\n北美 洲 和 南美 洲 的 分 界线 。 习 惯 上 ， 人 们 还 把 美国 以 南 的 美洲 地 区 ， 称 为 拉丁\n美洲 。\nPo A\n大 洲 的 命名\n亚洲 全称 是 “亚细亚 洲 ”。 意 思 是 “太阳 升 起 的 地 方 ”。\n歌 洲 “” 全 称 是 “欧罗巴 洲 ”。 由 于 其 位 于 亚洲 西 面 ， 被 人 们 看 做 是\n日 落 之 处 ， 称 为 “欧罗巴 ”。\n非洲 全称 是 “ 阿 非 利 加 洲 ”。 拉 丁 文 “ 阿 非 利加 ”是 “炽热 的 阳\n光 ” 的 意思 。\n北美 洲 “ 指 巴拿马 运河 以 北 的 美洲 地 区 。 其 命名 是 为 纪念 意大利 探\n34\n=== 第 46 页 ===\n第 二 齐 世界 的 陆地 和 海洋\n险 家 亚 美 利 哥 。\n南美 洲 ” 指 巴拿马 运河 以 南 的 美洲 地 区 ， 与 北美 洲 合 称 为 “ 亚 美 利\n加 洲 ” 。\n大 洋 洲 意思 是 “大 洋 中 的 陆地 ” 。\n南极 洲 ” 指 位 于 地 球 南端 的 南极 大 陆 及 周围 岛屿 。\n学 习 区 Ap 行动\n1. 在 图 2-1-S$ 上 找 出 七 大 洲 的 位 置 并 填写 名 称 。\nAR\n[ 凡人 N\nCertz 过,2.0,71.74311926605505,科普版_七年级_义务教育教科书·地理七年级上册,38,2025-07-21T14:25:06.389Z,2.0,义务教育教科书·地理七年级上册,/Users/LeoQin/Documents/GitHub/PDFconvertor/training_data/初中/地理/科普版-科学普及出版社/七年级/义务教育教科书·地理七年级上册.pdf,七年级,tesseract.js-parallel,unknown,0.8551020408163266,0.5,1,71.74311926605505,,,,true,,,geography,上册,科普版_七年级_义务教育教科书·地理七年级上册.json,地理,109,初中_地理_科普版_七年级_义务教育教科书·地理七年级上册
科普版_七年级_义务教育教科书·地理七年级上册_chunk_11,11,。 南美洲 指巴拿马运河以 南的 美洲地 区， 与北美洲 合称 为亚 美利 加洲。 大洋 洲意思是 大洋 中的 陆地。 南极洲 指位 于地 球南端的 南极大 陆及 周围岛屿。 学习 区 Ap 行动 1. 在图 2 1 S上找 出七 大洲 的位 置并 填写名 称。 凡人 N Certz 过起 时让 是二 _ J 了人 4 aa 潜图 2 1 S世界海陆分 布状况 2. 读图 2 1 1， 除南极洲 外， 东半球主要有 哪斤 个大 洲 ? 3. 读图 2 1 3， 七大 洲中， 平均 海拔 最高 和最 低的 分别 是哪个大 洲 ? 35 地理 48 _Jit 四大 地球 上的 海洋是 彼此相通的 四个 部分， 它们 分别 是太平洋 、 大西洋 、 印上 度洋 和履 冰洋。 R2 1 2 四大 洋的 面积和 平均深度大 洋太平洋 大西洋印度洋 北冰洋本 本 2 和本 2 天本 2 有平均深度 《 米 ) 4 028 3 627 3 897 1200 向学 该大 详的 命名太平洋 是由 航海家 可哲 伦命名的， 他在 环球航行时， 从进入太平洋 直至 到达 菲律 宾群 岛这 一过 程中， 一直 有风平浪静， 于是 他就 把这 个水 域叫 做太平洋。 大西洋十 名为 阿特 拉斯 海， 得名 于十 希腊神话中 的大 力神 阿特 拉斯 . 印度洋 是由 葡萄牙 航海 家达 ' 伽马 命名 的。1497 年， 达 ' 舒马 绕道 非洲好 望朋， 向东 寻找 印度大 陆， 将所 经过 的洋 命名为 印度洋。 北冰洋位 于北极， 终年 冰封， 所以 就把 它叫 做北冰洋。 大洋 的边缘部 分是 海。 海的 面积比较小， 一般 靠近 大陆， 由半岛和 岛屿与,730,0.37014343269450517,low,ocr,。\n南美 洲 ” 指 巴拿马 运河 以 南 的 美洲 地 区 ， 与 北美 洲 合 称 为 “ 亚 美 利\n加 洲 ” 。\n大 洋 洲 意思 是 “大 洋 中 的 陆地 ” 。\n南极 洲 ” 指 位 于 地 球 南端 的 南极 大 陆 及 周围 岛屿 。\n学 习 区 Ap 行动\n1. 在 图 2-1-S$ 上 找 出 七 大 洲 的 位 置 并 填写 名 称 。\nAR\n[ 凡人 N\nCertz 过\n起 时 让 是 二 _ * J 了 人\n4 aa\nRSS\n潜\n图 2-1-S$ 世界 海陆 分 布 状况\n2. 读 图 2-1-1， 除 南极 洲 外 ， 东 半球 主要 有 哪 斤 个 大 洲 ?\n3. 读 图 2-1-3， 七 大 洲 中 ， 平 均 海 拔 最 高 和 最 低 的 分 别 是 哪个 大 洲 ?\n35\n=== 第 47 页 ===\n地 理 ~48 _Jit\n四 大 ¥\n地 球 上 的 海洋 是 彼此 相通 的 四 个 部 分 ， 它 们 分 别 是 太平 洋 、 大 西洋 、 印 上 度\n洋 和 履 冰 洋 。\nR2-1-2 四 大 洋 的 面积 和 平均 深度\n大 洋 太平 洋 大 西洋 印度 洋 北冰洋\n本 本 2 和 本 2 天 本 2 有\n平均 深度 《 米 ) 4 028 3 627 3 897 1200\n向 学 该\n大 详 的 命名\n太平 洋 是 由 航海 家 可 哲 伦 命名 的 ， 他 在 环球 航行 时 ， 从 进入 太平\n洋 直 至 到 达 菲 律 宾 群 岛 这 一 过 程 中 ， 一 直 有 风平浪静 ， 于 是 他 就 把 这 个 水\n域 叫 做 “太平 洋 ”。\n大 西洋 十 名 为 阿 特 拉 斯 海 ， 得 名 于 十 希腊 神话 中 的 大 力 神 阿 特 拉 斯 .\n印度 洋 是 由 葡萄 牙 航 海 家 达 ' 伽 马 命 名 的 。1497 年 ， 达 ' 舒 马 绕\n道 非洲 好 望 朋 ， 向 东 寻 找 印度 大 陆 ， 将 所 经 过 的 洋 命名 为 “印度 洋 ”。\n北冰洋 ”位 于 北极 ， 终 年 冰 封 ， 所 以 就 把 它 叫 做 “北冰洋 ”。\n大 洋 的 边缘 部 分 是 海 。 海 的 面积 比较 小 ， 一 般 靠 近 大 陆 ， 由 半岛 和 岛屿 与,2.0,71.74311926605505,科普版_七年级_义务教育教科书·地理七年级上册,39,2025-07-21T14:25:06.389Z,2.0,义务教育教科书·地理七年级上册,/Users/LeoQin/Documents/GitHub/PDFconvertor/training_data/初中/地理/科普版-科学普及出版社/七年级/义务教育教科书·地理七年级上册.pdf,七年级,tesseract.js-parallel,unknown,0.7992277992277992,0.5,1,71.74311926605505,,,,true,true,,geography,上册,科普版_七年级_义务教育教科书·地理七年级上册.json,地理,109,初中_地理_科普版_七年级_义务教育教科书·地理七年级上册
科普版_七年级_义务教育教科书·地理七年级上册_chunk_12,12,1 000 米。 一般 由强风带 起 gal g PE， 北地 区 、 华北 地区 和东北地 区， 图 3 1 8 沙尘暴沙尘暴爆发的 季节以 寿季 最多。 沙尘 暴是 灾害性 天气， 危害 主要表现在 污染大 气环境， 影响 交通 安全， 造成 农牧 业减 产， 加剧 土地 荒漠化， 特强 沙尘暴的 破坏力 可与 台风相 比， 甚至 危及人 的生命安全。 酸两 四雨 是大 气遭 受严重污染的 F 一种 表现。 目前， 煤 、 石油 等仍 全这 5 ; 上二 是世界上 的主要能 源， 人类 对这 9 沁角 源无 节币 的中 将和 利用， U 空气中 的酸性气体不 断增加， 最册 川 J PEPCETCTNCCYr 林和 农作物的 生长， 影响 鱼类 的图 3 1 9 被酸雨破坏后 的林木繁殖， 还会 腐蚀建筑物 和文物古迹。 据调查和 监测， 我国 东南部 大部 分地 区成 为酸雨区。 全世界的 酸雨区 面积仍 在不 断扩 大 . 50 第三 章世界的 气候 C wa 1. 空气质量的 高侨 很大 程度上 受到人 类活动的 影响， 下列 事件都 发生 在我 们的 身边， 请你 说说 对它们的 看法 : 了许多沙土， 没有 兰盖， 有风 多， 汽车 的尾气对 城市大 气环 的时 候， 尘士 漫天。 境有 许多不 利的 影响。 在你 的生活中， 还有 哪些对 空气质量有 影响的 事例， 请举 出两 例 : 2. 调查身边的 空气质量状况。 (1) 确定调查题目。 (2 ) 通过查阅空气质量周报等 方式收集资料。 《3 ) 把所 调查的 情况在 小组 展示并 与同学交流。 (4) 小组 成员 集思广益， 一起 为改善当地的 空气质量出 谋划策。 S1,734,0.33384299905093323,low,ocr,1 000 米 。 一 般 由 强风 带 起 -\ngal ~g\nARMYLRIRREAR PE，\n北 地 区 、 华 北 地 区 和 东北 地 区 ， 图 3-1-8 沙尘暴\n沙尘暴 爆发 的 季节 以 寿 季 最 多 。 沙 尘 暴 是 灾害 性 天 气 ， 危 害 主要 表现 在\n污染 大 气 环境 ， 影 响 交 通 安全 ， 造 成 农 牧 业 减 产 ， 加 剧 土 地 荒漠 化 ， 特\n强 沙尘暴 的 破坏 力 可 与 台风 相 比 ， 甚 至 危及 人 的 生命 安全 。\n酸 两\n四 雨 是 大 气 遭 受 严重 污染 的 F\n一 种 表现 。 目 前 ， 煤 、 石 油 等 仍 | > 全 这 5\n; ¢ 上 ”| 二\n是 世界 上 的 主要 能 源 ， 人 类 对 这 | | 9\n沁 角 源 无 节 币 的 中 将 和 利用 ， « U HEE |\n空气 中 的 酸性 气体 不 断 增加 ， 最 册 | 川 J\nPEPCETCTNCCYr\n林 和 农作物 的 生长 ， 影 响 鱼 类 的 图 3-1-9 被 酸雨 破坏 后 的 林木\n繁殖 ， 还 会 腐蚀 建筑 物 和 文物 古迹 。 据 调查 和 监测 ， 我 国 东南 部 大 部 分\n地 区 成 为 酸雨 区 。 全 世界 的 酸雨 区 面积 仍 在 不 断 扩 大 .\n50\n=== 第 63 页 ===\n第 三 章 世界 的 气候\nC\nwa\n1. 空气 质量 的 高 侨 很 大 程度 上 受到 人 类 活动 的 影响 ， 下 列 事件 都 发 生\n在 我 们 的 身边 ， 请 你 说 说 对 它们 的 看 法 :\n了 许多 沙土 ， 没 有 兰 盖 ， 有 风 多 ， 汽 车 的 尾气 对 城市 大 气 环\n的 时 候 ， 尘 士 漫天 。 境 有 许多 不 利 的 影响 。\n在 你 的 生活 中 ， 还 有 哪些 对 空气 质量 有 影响 的 事例 ， 请 举 出 两 例 :\n2. 调查 身边 的 空气 质量 状况 。\n(1) 确定 调查 题目 。\n(2 ) 通过 查阅 空气 质量 周报 等 方式 收集 资料 。\n《3 ) 把 所 调查 的 情况 在 小 组 展示 并 与 同学 交流 。\n(4) 小 组 成 员 集思广益 ， 一 起 为 改善 当地 的 空气 质量 出 谋划 策 。\nS1,2.0,71.74311926605505,科普版_七年级_义务教育教科书·地理七年级上册,51,2025-07-21T14:25:06.389Z,2.0,义务教育教科书·地理七年级上册,/Users/LeoQin/Documents/GitHub/PDFconvertor/training_data/初中/地理/科普版-科学普及出版社/七年级/义务教育教科书·地理七年级上册.pdf,七年级,tesseract.js-parallel,unknown,0.8144712430426716,0.5,1,71.74311926605505,,,,true,,,physics,上册,科普版_七年级_义务教育教科书·地理七年级上册.json,地理,109,初中_地理_科普版_七年级_义务教育教科书·地理七年级上册
科普版_七年级_义务教育教科书·地理七年级上册_chunk_13,13,"， 还有 哪些对 空气质量有 影响的 事例， 请举 出两 例 : 2. 调查身边的 空气质量状况。 (1) 确定调查题目。 (2 ) 通过查阅空气质量周报等 方式收集资料。 《3 ) 把所 调查的 情况在 小组 展示并 与同学交流。 (4) 小组 成员 集思广益， 一起 为改善当地的 空气质量出 谋划策。 S1 地理 七年 级上 和册 第二 气温与 降水人 气温和 降水对 我们 的生活有 哪些影响 ? 图你 知道气温和 降水的 变化规律吗 ? 气温随时间 的变化气温表示空气的 冷热 程度， 我国 的气温单位尖 用摄氏度 ( C) 表示。 生活 中 ,我们 一般 比较 关心一 天中 的最 高气温和 最低 气温。 气象 工作者 通常每 天中 次对 百叶箱 中的 温度计 进行 测量记录， 时间 一般 安排在 北京时 间 8 时 、14 时 、20 时 、2 时。 恒通过感觉或 观测， 你会 发觉 从早 到晚， 从夏 到人 冬， 气温 是在 不断 变化着 的。 以一 天为 周期的 气温 eusil 变化， 叫做 气温的 日变化 ;以一 年为 周期的 气温变 化， 叫做 气温的 年变化。 气温 的时 间变 化通常用 气温 曲线图 表示。 的北半球陆地月 平均 最高 气温一 般陆地最 高气温北半球陆地月 平出 现在 7 月。 一般 出现在 14 均最 爷气 温一 般陆地最 低气温时 左右。 出现在 1 月。 一般 出现在日 全四 出前 后。 Ac 31 15 29 0 27 一 15 25 23 30 21 要加 2 4 6 8 10 12 14 16 18 20 22 24 (BD) 2 3 45 6 7 8 9101112() 图 3 2 2 气温的 日变化图 3 2 3 气温的 年变化 52 第三 章世界的 气候",766,0.32646742655916966,low,ocr,"， 还 有 哪些 对 空气 质量 有 影响 的 事例 ， 请 举 出 两 例 :\n2. 调查 身边 的 空气 质量 状况 。\n(1) 确定 调查 题目 。\n(2 ) 通过 查阅 空气 质量 周报 等 方式 收集 资料 。\n《3 ) 把 所 调查 的 情况 在 小 组 展示 并 与 同学 交流 。\n(4) 小 组 成 员 集思广益 ， 一 起 为 改善 当地 的 空气 质量 出 谋划 策 。\nS1\n=== 第 64 页 ===\n地 理 七 年 级 上 和 册\n第 二 ”气温 与 降水\n人 气温 和 降水 对 我 们 的 生活 有 哪些 影响 ?\nGLF 图 ”你 知道 气温 和 降水 的 变化 规律 吗 ?\n气温 随时 间 的 变化\n气温 表示 空气 的 冷 热 程度 ， 我 国 的 气温 单位 尖\n用 摄氏 度 (°C) 表示 。 生 活 中 ,我 们 一 般 比 较 关心\n一 天 中 的 最 高 气温 和 最 低 气温 。 气 象 工作 者 通常 每\n天 中 次 对 百叶 箱 中 的 温度 计 进 行 测量 记录 ， 时 间 一 BE\n般 安排 在 北京 时 间 8 时 、14 时 、20 时 、2 时 。 恒 ”\n通过 感觉 或 观测 ， 你 会 发 觉 从 早 到 晚 ， 从 夏 到 人\n冬 ， 气 温 是 在 不 断 变化 着 的 。 以 一 天 为 周期 的 气温 [eusil §\n变化 ， 叫 做 气温 的 日 变化 ;以 一 年 为 周期 的 气温 变\n化 ， 叫 做 气温 的 年 变化 。 气 温 的 时 间 变 化 通常 用 气\n温 曲线 图 表示 。 的\n北半球 陆地 月 平\n均 最 高 气温 一 般\n陆地 最 高 气温 北半球 陆地 月 平 出 现在 7 月 。\n一 般 出 现在 14 均 最 爷 气 温 一 般\n陆地 最 低 气温 时 左右 。 出 现在 1] 月。\n一 般 出 现在 日\n全 四 出 前 后 。 Ac\n31 15\n29 0\n27 一 15\n25\n23 —30\n21 -要\n加 2 4 6 8 10 12 14 16 18 20 22 24 (BD) 2 3 45 6 7 8 9101112()\n图 3-2-2 气温 的 日 变化 图 3-2-3 气温 的 年 变化\n52\n=== 第 65 页 ===\n第 三 章 世界 的 气候",2.0,71.74311926605505,科普版_七年级_义务教育教科书·地理七年级上册,52,2025-07-21T14:25:06.389Z,2.0,义务教育教科书·地理七年级上册,/Users/LeoQin/Documents/GitHub/PDFconvertor/training_data/初中/地理/科普版-科学普及出版社/七年级/义务教育教科书·地理七年级上册.pdf,七年级,tesseract.js-parallel,unknown,0.7553956834532374,0.5,1,71.74311926605505,,true,,true,true,,physics,上册,科普版_七年级_义务教育教科书·地理七年级上册.json,地理,109,初中_地理_科普版_七年级_义务教育教科书·地理七年级上册
科普版_七年级_义务教育教科书·地理七年级上册_chunk_14,14,、 雪 、 冰雹 等， 统称 为降水。 其中， 降雨 是降水的 主要形式。 降水 对我 们的 生活 、 生产 影响 很大。 世界各 地， 一年 中各 月 、 各季 降水 量是 不一 样的。 鲍如， 一年 内， 伦敦 的降水比较均匀， 属于 常年湿润区 ; 而北京的 降水季节变化比较大， 属于 夏季多 十区。 人们 习惯用 柱状图 来表示降水量 的时 间变 化。 降水量 (mm) 降水量 (mm) 降水量 (my 降水量 (mm) 300 300 300 300 200 200 200 200 100 100 100 100 011 4 7 wen m 4 7 w0e 图 3 2 11 伦教 降水量 柱状 图图 3 2 12， 阔京 降水量 柱状图 画包 该降雨量 的测量测 蚤某 段时 间内 降雨总 量的 仅器 是雨量器。 它的 外壳 是金属圆 简， 蛙面 有漏斗和 刍水 痛， 另外 还配 有与 储水 瓶吕 径成 比例的 量秽。 有降 两 57 地理 七年 级上 贡站 雨量器 口时， 两水 会通过漏斗流入储 水下 本瓶， 测量 的时 候， 将储 水瓶 取上 和出， 把水 全入 量简 内， 从量 向 _ 所上 读出 刻度数， 这样 我们 就可 王以 测得 各时 段的 降雨量。 降两 人让 量单位常用这 米表 示。 l TE E 量简 图 3 2 13 雨量器 和重 简学 二地 1 降水量 (mm) 降水量 (mm 1. 图 3 2 14 表示意大 利罗马的 年降水。 300 300 旺的 各月 分配 情况， 读图 完成下 列要 求 : 20 200 (1) 罗马哪 几个 月份 降水较 多 ? 本 w (2) 罗马哪 几个 月份 降水较 少 ? (3 ) 说说 罗马降水季节变化的 特点。 II,756,0.35838777188371673,low,ocr,、 雪 、 冰 雹 等 ， 统 称 为 降水 。 其 中 ， 降 雨 是 降水\n的 主要 形式 。 降 水 对 我 们 的 生活 、 生 产 影 响 很 大 。\n世界 各 地 ， 一 年 中 各 月 、 各 季 降 水 量 是 不 一 样 的 。 鲍 如 ， 一 年 内 ， 伦 敦 的\n降水 比较 均匀 ， 属 于 常年 湿润 区 ; 而 北京 的 降水 季节 变化 比较 大 ， 属 于 夏季 多\n十 区 。 人 们 习惯 用 柱状 图 来 表示 降水 量 的 时 间 变 化 。\n降水 量 (mm) 降水 量 (mm) 降水 量 (my 降水 量 (mm)\n300 300 300 300\n200 200 200 200\n100 100 100 100\n011 4 7 wen ° °m 4 7 w0e °\n图 3-2-11 伦 教 降水 量 柱 状 图 图 3-2-12 ， 阔 京 降水 量 柱状 图\n画 包 该\n降雨 量 的 测量\n测 蚤 某 段 时 间 内 降雨 总 量 的 仅 器 是 雨量 器 。 它 的 外 壳 是 金属 圆 简 ，\n蛙 面 有 漏斗 和 刍 水 痛 ， 另 外 还 配 有 与 储 水 瓶 吕 径 成 比例 的 量 秽 。 有 降 两\n57\n=== 第 71 页 ===\n地 理 七 年 级 上 贡\n站 雨量 器 口\n时 ， 两 水 会 通过 漏斗 流入 储 水 下 本\n瓶 ， 测 量 的 时 候 ， 将 储 水 瓶 取 上- 和\n出 ， 把 水 全 入 量 简 内 ， 从 量 向 | | | _ 所\n上 读 出 刻度 数 ， 这 样 我 们 就 可 | 王\n以 测 得 各 时 段 的 降雨 量 。 降 两 | “| 人 让\n量 单位 常用 这 米 表 示 。 { &l\nTE#E 量 简\n图 3-2-13 ”雨量 器 和 重 简\n学 二 地 1\n降水 量 (mm) 降水 量 (mm\n1. 图 3-2-14 表 示意 大 利 罗马 的 年 降水 。 300 300\n旺 的 各 月 分 配 情况 ， 读 图 完成 下 列 要 求 : 20 200\n(1) 罗马 哪 几 个 月 份 降水 较 多 ? 本 w\n(2) 罗马 哪 几 个 月 份 降水 较 少 ?\n(3 ) 说 说 罗马 降水 季节 变化 的 特点 。 II,2.0,71.74311926605505,科普版_七年级_义务教育教科书·地理七年级上册,57,2025-07-21T14:25:06.389Z,2.0,义务教育教科书·地理七年级上册,/Users/LeoQin/Documents/GitHub/PDFconvertor/training_data/初中/地理/科普版-科学普及出版社/七年级/义务教育教科书·地理七年级上册.pdf,七年级,tesseract.js-parallel,unknown,0.7052238805970149,0.5,1,71.74311926605505,,,,true,true,,mathematics,上册,科普版_七年级_义务教育教科书·地理七年级上册.json,地理,109,初中_地理_科普版_七年级_义务教育教科书·地理七年级上册
