Chunk_ID,Chunk_Index,Content,Content_Length,Quality_Score,Reliability,Source_Type,Original_Content,Enhancement_Version,averageConfidence,book_name,chunkIndex,enhancementTimestamp,enhancementVersion,fileName,filePath,grade,ocrMethod,publisher,qualityMetrics_chineseCharRatio,qualityMetrics_coherenceScore,qualityMetrics_lengthScore,qualityMetrics_ocrConfidence,semanticFeatures_hasDefinition,semanticFeatures_hasExperiment,semanticFeatures_hasFormulas,semanticFeatures_hasNumbers,semanticFeatures_hasQuestion,semanticFeatures_isTableContent,semanticFeatures_subjectArea,semester,source_file,subject,totalPages,uniqueId
苏少版_九年级_义务教育教科书·美术九年级下册_chunk_0,0,"主拨 盘本 光力 uy U 快门按钮 v 背带环 本 B 快门快 对焦 模式开关三 元本 而司 一图像稳 定器 取景器 名尖 证开关了 遮光埋 4 人更 赤售 环国 怎样拍 出好 照片存储上 对焦 环拍摄满意的 作品离 不开 三个 要点 : 1. 有明 确的 表现主题。2. 有一 个视觉主体。3. 有一 个 ab2x 证折合三 拍摄时 要运用到 光轩 和景深的 知识。 光轿 是能 突显出 画面主体的 好表 景。 摄影镜头上 的圆 孔， 可以 在拍摄时 控制光线的 摄 oy 入量。 景深 是指 一副 照片 中可 以接受的 清晰范 围。 光图 小则 景深大， 即远近景物都 清晰 ; 光力 大则 景深小， 即焦点清晰， 其他 景物模糊。 人小 光 _ 1 学团 和广角镜头通常可 以获得最 大景深。 天 F : E ( 3 p _ _ 你知道吗 ? 世界 Re 乱一 张腿 呈是 虑灶 直人本 上第 一张 照片是 曝光约 对针 孔相机和 暗箱的 使用 8 时局 得到 的哟 ! L a 而可 以称 作摄影史 的源头， 但最 早它们还 只是 将人 影打 在白 墙我 还听 说很 早的 时上， 帮助 画家 精确地 描草 对象 候用 银版 来感光呢 oF 用的， 直到 有人 发现 银的 感光性 和合适的 显影液 后， 对照相 R, A ARI 无题 ( 手和 房屋前 的人 体 ) 尤斯 曼 ( 美国 ) 技术的 研究才 真正开始。 这幅 作品是 由四 张分 别表现手 、 房屋 、 人体 以及 云末 的照 片， 通过 计算机 软件后 期合成的， 它展现了 拍摄者 新奇 、 梦幻 12 的内 心世 界",700,0.31498256585211043,low,ocr,"主 拨 盘 本 光 力\n\ uy U\n快门 按钮 v 背带 环 |\n本 B |\n- - 快门\n| | 快 |\n对 焦 模式 开关 三 < & | [元\n> 本 而 司 一 | 图像 稳 定 器 取景 器 “| 名\n< 尖 证 开关\nRE 了\n遮光 埋 ~4\n人\n更 赤 售 环 ” 国 怎样 拍 出 好 照片 存储 上\n对 焦 环 拍摄 满意 的 作品 离 不 开 三 个 要 点 : 1. 有 明\n确 的 表现 主题 。2. 有 一 个 视觉 主体 。3. 有 一 个\nab2x 证 [折合 三\n拍摄 时 要 运用 到 光 轩 和 景深 的 知识 。 光 轿 是 能 突显 出 画面 主体 的 好 表 景 。\n摄影 镜头 上 的 圆 孔 ， 可 以 在 拍摄 时 控制 光线 的 摄 oy »\n入 量 。 景 深 是 指 一 副 照 片 中 可 以 接受 的 清晰 范 ’\n围 。 光 图 小 则 景深 大 ， 即 远近 景物 都 清晰 ; 光 力\n大 则 景深 小 ， 即 焦点 清晰 ， 其 他 景物 模糊 。 人 小 光 _ 1 学\n团 和 广角 镜头 通常 可 以 获得 最 大 景深 。 天 F : -\n»E (=3\np—_ _ - - =\n你 知道 吗 ? 世界 Re - =\n- 乱 一 张 腿 呈 是 虑 灶 & » £\n直人 本 上 第 一 张 照片 是 曝光 约 ’ =\n对 针 孔 相机 和 暗箱 的 使 用 8 时 局 得 到 的 哟 ! L a -而\n可 以 称 作 摄影 史 的 源头 ， 但 最 -\n早 它们 还 只 是 将 人 影 打 在 白 墙 我 还 听 说 很 早 的 时 -\n上 ， 帮 助 画 家 精确 地 描 草 对 象 候 用 银 版 来 感光 呢 oF -\n用 的 ， 直 到 有 人 发 现 银 的 感光 - |\n性 和 合适 的 显影 液 后 ， 对 照相 ¥ | R, A—ARI 无 题 ( 手 和 房屋 前 的 人 体 ) AF - 尤 斯 曼 ( 美国 )\n技术 的 研究 才 真正 开始 。 这 幅 作品 是 由 四 张 分 别 表现 手 、 房 屋 、 人 体 以 及 云 末 的 照\n片 ， 通 过 计算 机 软件 后 期 合成 的 ， 它 展现 了 拍摄 者 新 奇 、 梦 幻\n12 的 内 心 世 界",2.0,67.45652173913044,苏少版_九年级_义务教育教科书·美术九年级下册,9,2025-07-21T14:25:08.551Z,2.0,义务教育教科书·美术九年级下册,/Users/LeoQin/Documents/GitHub/PDFconvertor/training_data/初中/美术/苏少版-江苏凤凰少年儿童出版社/九年级/义务教育教科书·美术九年级下册.pdf,九年级,tesseract.js-parallel,unknown,0.8531187122736419,0.5,1,67.45652173913044,,,,true,true,,mathematics,下册,苏少版_九年级_义务教育教科书·美术九年级下册.json,美术,46,初中_美术_苏少版_九年级_义务教育教科书·美术九年级下册
苏少版_九年级_义务教育教科书·美术九年级下册_chunk_1,1,"要的 物品之 一， 不一 同风格的 灯具会 形成完全不 同的 空间气 气创意实践是 体验设计布置的 最好 方法， 请你 亲自动手， 利用 手中的 料来 进行居室的 装名， 验家 个人 的学 习空间要 方便 、 简洁。 人各 洒进行居室的 装饰和 年体验家 具 、 室内 陈设品 对室内空间的 改变和 o onn 影响。 画最 能够 表达自 Erem t 小组 讨论， 说说 自己家 中的 陈设布置尝试用 自制的 小物件布置自己的 房间。 给家 里的 客厅设计 、 制作 有个 性的 家具 或陈设品 省能 够增添居室的 风格情调 En ; o 一全 aa 4 只要 改变储 物架 的组 合方 式， 就可 以改变居室的 气氛。 有创意的 组合 能够 形成方便又 好看 的小 储物 架。 29 第课 公共艺术被 称为 大众 的艺 Ken, d 术， 因为 它是 存在于 社会公共环境本 中 ,为大 众拥 有和 观赏的 艺术。 公共 艺术早 在古 罗马 建城 时期 就已 存在， 证并 一直 发展 到今天。 在世界很 多城市二 二 pb 站五 H B 破碎的 地球 反对战争或 乡镇中 者能够见 到公共艺术的 号纽约联合国 总部 广场前 的纽约联合国 总部 广场前 的公共艺术。 影， 它为 我们 的生活环境平添了 浓郁公共艺术。 、 二的 文化和 艺术氛围。 国公共艺术的 概念城市是 公共艺术比较集中的 地方， 它 ma 由纪念性 雕塑 、 壁画 、 建筑 小品 、 城市 标上 识等 构成， 承载 和表达了 一个 地方 的历史 we 文化特色。 一些 重要的 公共艺术还 能成 为 ; 二一 一个 城市， 甚至 一个 国家的 重要标志。 一一 一",722,0.3594671499961794,low,ocr,"要\n的 物品 之 一 ， 不\n一 同 风格 的 灯具 会\n形成 完全 不 同 的\n空间 气 气 -\n创意 实践 是 体验 设计 布置 的 最\n好 方法 ， 请 你 亲自 动手 ， 利 用 手中 的\n料 来 进行 居室 的 装 名 ， 验 家\n个 人 的 学 习 空间 要 方便 、 简 洁 。 人 各 洒 进行 居室 的 装饰 和 年 体验 家\n具 、 室 内 陈设 品 对 室内 空间 的 改变 和\no onn 影响 。\n画 最 能 够 表达 自 Erem\nt - 小 组 讨论 ， 说 说 自己 家 中\n的 陈设 布置\n尝试 用 自制 的 小 物件 布置\n自己 的 房间 。\n给 家 里 的 客厅 设计 、 制 作\n有 个 性 的 家 具 或 陈设 品\n省 能 够 增添 居室 的 风格 情调\nEn - ;\no 一\n= |\n¥ 全 —\nSS\naa 4 只 要 改变 储 物 架 的 组 合 方\n式 ， 就 可 以 改变 居室 的 气氛 。\n有 创意 的 组 合 能 够 形成 方便 又 好 看 的 小\n储 物 架 。 29\n=== 第 21 页 ===\n第 课 ZARHRZM\n公共 艺术 被 称 为 “大 众 的 艺 Ken, PV d\n术 ”， 因 为 它 是 存在 于 社会 公共 环境 本\n中 ,为 大 众 拥 有 和 观赏 的 艺术 。 公 共 \\n艺术 早 在 古 罗 马 建 城 时 期 就 已 存在 ， 证\n并 一 直 发 展 到 今天 。 在 世界 很 多 城市\n二 二 pb 站 五 | H  B 破碎 的 地 球 反对 战争\n或 乡镇 中 者 能够 见 到 公共 艺术 的 号 纽约 联合 国 总 部 广场 前 的 ”纽约 联合 国 总 部 广场 前 的 公共 艺术 。\n影 ， 它 为 我 们 的 生活 环境 平添 了 浓郁 公共 艺术 。\n、 二\n的 文化 和 艺术 氛围 。 国 公共 艺术 的 概念\n城市 是 公共 艺术 比较 集中 的 地 方 ， 它\nma 由 纪念 性 雕塑 、 壁 画 、 建 筑 小 品 、 城 市 标\n上 - 识 等 构成 ， 承 载 和 表达 了 一 个 地 方 的 历史\nwe 文化 特色 。 一 些 重要 的 公共 艺术 还 能 成 为\n; 二 一 一 个 城市 ， 甚 至 一 个 国家 的 重要 标志 。\n— 一 一 一",2.0,67.45652173913044,苏少版_九年级_义务教育教科书·美术九年级下册,23,2025-07-21T14:25:08.551Z,2.0,义务教育教科书·美术九年级下册,/Users/LeoQin/Documents/GitHub/PDFconvertor/training_data/初中/美术/苏少版-江苏凤凰少年儿童出版社/九年级/义务教育教科书·美术九年级下册.pdf,九年级,tesseract.js-parallel,unknown,0.8801498127340824,0.6,1,67.45652173913044,true,,,true,,,geography,下册,苏少版_九年级_义务教育教科书·美术九年级下册.json,美术,46,初中_美术_苏少版_九年级_义务教育教科书·美术九年级下册
苏少版_九年级_义务教育教科书·美术九年级下册_chunk_2,2,哪些城市广场 ? 本说 说对 它们的 印象。 1 v 设计一 个想象的 城市广场。 上 ( 平面或 立体表现 ) 1 l 设计一 件广场环境艺术小 品。 和 ( 平面或 立体表现 ) Wo_ amsars 组织 一次 班集体广场活动。 和学 生作品模型制作往往需要集体合作来 完成。 37 第 6 课。 纱因 的音乐一 一处 国建筑元 本世界上 的建筑干 变万 化。 诗人 说， 没有 两片 树叶 是相同的， 建筑 何党 不是 如此。 凡有 人之 处就 有建筑， 建筑 是人 类生活的 舞台， 人塑造了 建筑， 建筑 也塑造了 人。 不同时代 的建筑具有不 同的 特点， 从某 种意义上 说， 建筑 是历史的 见证， 同时 也是 人类 心灵的 寄托。 最旱 的宗教建筑要 数英格兰南部的 圆形 巨石栏 斯通 享治， 它是 欧洲新 石器时 代 j 最为 重要的 遗迹之 一。 斯通 享治 塌为 悬浮 的石头， 它由 一些 巨大 沉重的 石柱等 距离国 成两 个石 圈， 石柱 之间 横架 着石 梁， 圆圈 f 由的 中央 放着 一块 妹礼 用的 石板。 这些 石头的 本和 汪排 列非常讲 完， 都经 过精确的 计算， 这在 当时 的技术条 件下 是非常不 容易的。 国历史与 神秘的 凝聚人 类的 祖先最 初主要栖 居在 树上 或斯 通享 治巨石阵 约公元前 3000 年 ( 英国 ) 潮湿的 洞从 里。 后来， 昔着 生 j 7 的日 渐提 高和 工具的 不断 进步， 原始 人类 开始 根据他 们的 需求来 建造居所了。 虽然， 这些 最初 的建筑无 论在 形式还 是在 功能上 都显得简陋不,699,0.4235278291006992,medium-low,ocr,哪些 城市 广场 ?\n本 FF 说 说 对 它们 的 印象 。 ~ [1\nv @ 设计 一 个 想象 的 城市 广场 。 ®\n上 ( 平面 或 立体 表现 ) 1 -l\n@ 设计 一 件 广场 环境 艺术 小 品 。 和\n( 平面 或 立体 表现 ) | |\nWo_ amsars @ 组 织 一 次 班 集体 广场 活动 。 和\n学 生 作品 模型 制作 往往 需要 集体 合作 来 完成 。\n37\n=== 第 30 页 ===\n第 6 课 。 纱 因 的 音乐 一 一 处 国 建筑 元 本\n世界 上 的 建筑 干 变 万 化 。 诗 人 说 ， 没 有 两 片 树 叶 是 相同 的 ， 建 筑 何 党 不 是 如 此 。 凡 有 人 之 处\n就 有 建筑 ， 建 筑 是 人 类 生活 的 舞台 ， 人 塑造 了 建筑 ， 建 筑 也 塑造 了 人。 不 同时 代 的 建筑 具有 不 同\n的 特点 ， 从 某 种 意义 上 说 ， 建 筑 是 历史 的 见证 ， 同 时 也 是 人 类 心灵 的 寄托 。\n最 旱 的 宗教 建筑 要 数 英格兰 南部 的 圆 形\n| 巨石 栏 “ 斯 通 享 治 ”， 它 是 欧洲 新 石器 时 代\nj 最 为 重要 的 遗迹 之 一 。“ 斯 通 享 治 ” 塌 为 悬\n浮 的 石头 ， 它 由 一 些 巨 大 沉重 的 石柱 等 距离\n国 成 两 个 石 圈 ， 石 柱 之 间 横 架 着 石 梁 ， 圆 圈\nf 由 的 中 央 放 着 一 块 妹 礼 用 的 石板 。 这 些 石头 的\n | 本 和 汪 排 列 非常 讲 完 ， 都 经 过 精确 的 计算 ， 这 在 当\n- - 时 的 技术 条 件 下 是 非常 不 容易 的 。\n国 历史 与 神秘 的 凝聚\n人 类 的 祖先 最 初 主要 栖 居 在 树 上 或\n斯 通 享 治 巨石 阵 “” 约 公元 前 3000 年 ( 英国 ) 潮湿 的 洞 从 里。 后 来 ， 昔 着 生 j 7 的 日\n渐 提 高 和 工具 的 不 断 进步 ， 原 始 人 类 开\n始 根据 他 们 的 需求 来 建造 居所 了 。 虽 然 ， 这 些 最 初 的 建筑 无 论 在 形式 还 是 在 功能 上 都 显得 简陋 不,2.0,67.45652173913044,苏少版_九年级_义务教育教科书·美术九年级下册,31,2025-07-21T14:25:08.551Z,2.0,义务教育教科书·美术九年级下册,/Users/LeoQin/Documents/GitHub/PDFconvertor/training_data/初中/美术/苏少版-江苏凤凰少年儿童出版社/九年级/义务教育教科书·美术九年级下册.pdf,九年级,tesseract.js-parallel,unknown,0.8764705882352941,0.5,1,67.45652173913044,,,,true,true,,mathematics,下册,苏少版_九年级_义务教育教科书·美术九年级下册.json,美术,46,初中_美术_苏少版_九年级_义务教育教科书·美术九年级下册
苏少版_九年级_义务教育教科书·美术九年级下册_chunk_3,3,"的祖先最 初主要栖 居在 树上 或斯 通享 治巨石阵 约公元前 3000 年 ( 英国 ) 潮湿的 洞从 里。 后来， 昔着 生 j 7 的日 渐提 高和 工具的 不断 进步， 原始 人类 开始 根据他 们的 需求来 建造居所了。 虽然， 这些 最初 的建筑无 论在 形式还 是在 功能上 都显得简陋不 堪， 但它 却是 人类 创造史上跨 出的 一大 步。 原始 人的 建筑最 初只 是为 栖号， 但随 着社会的 发展， 建筑的 作用也 延伸到 了人 们的 精神生活中。 在为 已故人建造的 陵墓中， 埃及 法老 的金 字塔 可以 说是 无与 伦比的 了。 它们 以简洁的 造和 型 、 沉重 而又 巨大的 体量 给人 以一 种视觉和 精 AHARTEHASEREE, 它有 无数 的下 神上 的尾 揣， 丛而 产生了 一种 庄重壮美的 审美尚 待解 开， 是什么造就了 它的 千年传奇 ? 效果。 其中， 最著名的 胡夫 金字塔 高达 146 米， 用 230 余万 块平均重量达 2.5 吨的 石块 堆砌而 成。 3 那些体积庞大 、 高等 入云 的金字塔 是一 种信仰， 是古 村人 区证 下全 汪下 全站 全会 埃及王权和 神权的 象征 ! 它是 人类 幼年时 代最 伟大的 成就 如此 紧密， 以致 很薄 的刀片也 插不 进去。 之一， 今天 人们 在它 的面前依然会 感到渺小和 卑微吉 萨金字塔 群 ( 中间 为胡 夫金字塔 ) 约公元前 2530 年 (埃及 38 抱芝 .评述转 经典 与荣耀的 乐章古 希腊 人不 断追 求完 美， 在建筑上 将朴素的 形式 、 与人 体活 动相 适应的 尺度以 及与 材料和 施工相 适应 的装饰结合在 一",730,0.4421669599184783,medium-low,ocr,"的 祖先 最 初 主要 栖 居 在 树 上 或\n斯 通 享 治 巨石 阵 “” 约 公元 前 3000 年 ( 英国 ) 潮湿 的 洞 从 里。 后 来 ， 昔 着 生 j 7 的 日\n渐 提 高 和 工具 的 不 断 进步 ， 原 始 人 类 开\n始 根据 他 们 的 需求 来 建造 居所 了 。 虽 然 ， 这 些 最 初 的 建筑 无 论 在 形式 还 是 在 功能 上 都 显得 简陋 不\n堪 ， 但 它 却 是 人 类 创造 史上 跨 出 的 一 大 步 。 原 始 人 的 建筑 最 初 只 是 为 栖 号 ， 但 随 着 社会 的 发 展 ，\n建筑 的 作用 也 延伸 到 了 人 们 的 精神 生活 中 。\n在 为 已 故人 建造 的 陵墓 中 ， 埃 及 法 老 的 金\n字 塔 可 以 说 是 无 与 伦比 的 了 。 它 们 以 简洁 的 造\n和 型 、 沉 重 而 又 巨大 的 体 量 给 人 以 一 种 视觉 和 精\n¥ AHARTEHASEREE, 它 有 无 数 的 下 神 上 的 尾 揣 ， 丛 而 产生 了 一 种 庄重 壮美 的 审美\n尚 待 解 开 ， 是 什么 造就 了 它 的 千年 传奇 ? 效果 。 其 中 ， 最 著名 的 胡 夫 金字 塔 高 达 146 米 ，\n| 用 230 余 万 块 平均 重量 达 2.5 吨 的 石 块 堆砌 而 成 。\n3 那些 体积 庞大 、 高 等 入 云 的 金字 塔 是 一 种 信仰， 是 古 村 人 区 证 下 全 汪 下 全 站 全 会\n埃及 王权 和 神权 的 象征 ! 它 是 人 类 幼年 时 代 最 伟大 的 成 就 如 此 紧密 ， 以 致 很 薄 的 刀片 也 插 不 进去 。\n之 一 ， 今 天 人 们 在 它 的 面前 依然 会 感到 渺小 和 卑微\n吉 萨 金字 塔 群 ( 中 间 为 胡 夫 金字 塔 ) ” 约 公元 前 2530 年 (埃及\n38\n=== 第 31 页 ===\n抱 芝 .评述\n转 经 典 与 荣耀 的 乐章\n古 希 腊 人 不 断 追 求 完 美 ， 在 建筑 上\n将 朴素 的 形式 、 与 人 体 活 动 相 适应 的 尺度\n以 及 与 材料 和 施工 相 适 应 的 装饰 结合 在 一",2.0,67.45652173913044,苏少版_九年级_义务教育教科书·美术九年级下册,32,2025-07-21T14:25:08.551Z,2.0,义务教育教科书·美术九年级下册,/Users/LeoQin/Documents/GitHub/PDFconvertor/training_data/初中/美术/苏少版-江苏凤凰少年儿童出版社/九年级/义务教育教科书·美术九年级下册.pdf,九年级,tesseract.js-parallel,unknown,0.8676748582230623,0.5,1,67.45652173913044,,,,true,true,,unknown,下册,苏少版_九年级_义务教育教科书·美术九年级下册.json,美术,46,初中_美术_苏少版_九年级_义务教育教科书·美术九年级下册
苏少版_九年级_义务教育教科书·美术九年级下册_chunk_4,4,"依然会 感到渺小和 卑微吉 萨金字塔 群 ( 中间 为胡 夫金字塔 ) 约公元前 2530 年 (埃及 38 抱芝 .评述转 经典 与荣耀的 乐章古 希腊 人不 断追 求完 美， 在建筑上 将朴素的 形式 、 与人 体活 动相 适应的 尺度以 及与 材料和 施工相 适应 的装饰结合在 一起。 自负 的罗马帝国在 建造了 无数 纪念 性和 Peracsi。 建筑的 同时， 也创造了 半圆穹顶， 并开创了 新的 建筑风格。 帕特 农神 店位 于希腊的 雅典， 它是 雅典最 车名 的古迹之 一。 作为 献给 智慧女神雅典娜 和以 其名 字命名的 雅典城 保护神 的神 店， 帕特 农神 让代 由特 农神 庙公 元前 447 前 438 年 ( 希腊表 着古 希腊 建筑 艺术的 疾峰。 神唐 始建 于公元前 447 年， 距今 已有 2000 多年 的历史。 这是 神的 居所， 是希腊人 用石头建 起的 宫殿， 是一 个庄严的 奇迹。 他们 用信仰建立的 柱式 建筑影响至 今纪 功柱 以浅 浮雕 形式 铺陈了 一幅 表现征战全 过程 的安 大画面。 浮雕 以前 进式 散点 透视方法， 整场 战事的 开端 、 发纪 功柱 106 113 年 ( 意大利 ) 展 、 高潮 、 尾声 一应 俱全。 在这 里， 不仅 措绘 了不 同的 时间， 也描绘了 不同 的空间。 4 下 T 1 ARIRASAL. rrol f !。 梓素 挺拔。 义种 轻巧。 全和 由受 奥尼 ! 柱基 、 柱身 粗有 柱基， 柱身 细式 演变而 来， ! ! 壮， 向上 逐渐缩 长， 上下 变化不 所不 同的 是柱， 1! 小 , 刻有 模 , 在显著 ,四村 较关节高， 呈花",730,0.3791762745251923,low,ocr,"依然 会 感到 渺小 和 卑微\n吉 萨 金字 塔 群 ( 中 间 为 胡 夫 金字 塔 ) ” 约 公元 前 2530 年 (埃及\n38\n=== 第 31 页 ===\n抱 芝 .评述\n转 经 典 与 荣耀 的 乐章\n古 希 腊 人 不 断 追 求 完 美 ， 在 建筑 上\n将 朴素 的 形式 、 与 人 体 活 动 相 适应 的 尺度\n以 及 与 材料 和 施工 相 适 应 的 装饰 结合 在 一\n起 。 自 负 的 罗马 帝国 在 建造 了 无 数 纪 念 性 和 Peracsi 。\n建筑 的 同时 ， 也 创造 了 半圆 穹顶 ， 并 开创\n了 新 的 建筑 风格 。\n帕 特 农 神 店 位 于 希腊 的 雅典 ， 它 是 雅典 最 车\n名 的 古迹 之 一 。 作 为 献 给 智慧 女神 雅典 娜 和 以 其\n名 字 命名 的 雅典 城 保护 神 的 神 店 ， 帕 特 农 神 让 代 由 特 农 神 庙 “ 公 元 前 447- 前 438 年 ( 希腊\n表 着 古 希 腊 建 筑 艺术 的 疾 峰 。 神 唐 始 建 于 公元 前 447 年 ， 距 今 已 有 2000 多 年\n的 历史 。 这 是 神 的 居所 ， 是 希腊\n™ 人 用 石头 建 起 的 宫殿 ， 是 一\n个 庄严 的 奇迹 。 他 们 用 信仰\n建立 的 柱 式 建筑 影响 至 今\n纪 功 柱 以 浅 浮 雕 形 式 铺陈 了 一 幅 表现 征战 全 过 程 的 安 大\n画面 。 浮 雕 以 前 进 式 散 点 透视 方法 ， 整 场 战事 的 开端 、 发\n纪 功 柱 106~113 年 ( 意大利 ) 展 、 高 潮 、 尾 声 一 应 俱全 。 在 这 里 ， 不 仅 措\n绘 了 不 同 的 时 间 ， 也 描绘 了 不 同 的 空间 。\n4 下\nT 1\n—— ARIRASAL. |\n| | rrol ~ f\n! 。 梓 素 挺拔 。 —— 义 种 轻巧 。 全 和 由 受 奥 尼 BE\n! 柱 基 、 柱 身 粗 有 柱 基 ， 柱 身 细 式 演变 而 来 ， !\n! 壮 ， 向 上 逐渐 缩 | 长， 上 下 变化 不 所 不 同 的 是 柱 ，\n1! 小 , 刻 有 模 , 在 | 显著 ,四 村 较 | | 关节 高 ， 呈 花 ]",2.0,67.45652173913044,苏少版_九年级_义务教育教科书·美术九年级下册,33,2025-07-21T14:25:08.551Z,2.0,义务教育教科书·美术九年级下册,/Users/LeoQin/Documents/GitHub/PDFconvertor/training_data/初中/美术/苏少版-江苏凤凰少年儿童出版社/九年级/义务教育教科书·美术九年级下册.pdf,九年级,tesseract.js-parallel,unknown,0.8091603053435115,0.5,1,67.45652173913044,,,,true,,,mathematics,下册,苏少版_九年级_义务教育教科书·美术九年级下册.json,美术,46,初中_美术_苏少版_九年级_义务教育教科书·美术九年级下册
