Chunk_ID,Chunk_Index,Content,Content_Length,Quality_Score,Reliability,Source_Type,Original_Content,Enhancement_Version,averageConfidence,book_name,chunkIndex,enhancementTimestamp,enhancementVersion,fileName,filePath,grade,ocrMethod,publisher,qualityMetrics_chineseCharRatio,qualityMetrics_coherenceScore,qualityMetrics_lengthScore,qualityMetrics_ocrConfidence,semanticFeatures_hasDefinition,semanticFeatures_hasExperiment,semanticFeatures_hasFormulas,semanticFeatures_hasNumbers,semanticFeatures_hasQuestion,semanticFeatures_isTableContent,semanticFeatures_subjectArea,semester,source_file,subject,totalPages,uniqueId
苏少版_九年级_义务教育教科书·美术九年级下册_chunk_5,5,朗的 集中式 陵墓为 蓝本， 发展 并创造了 入闪 圣洁过 情的 白色大 自己的 纪念性 陵墓建筑的 形制，17 世纪建造的 泰姬 陵堪 称印度和 陵墓建筑的 经典。 这是 当时印度的 皇帝为 他的 王妃建造的 一座 花， 如许如 陵墓， 整座 建筑布局完美， 形象 肃穆， 比例 和谐。 建筑 细部的 装饰非常精致， 许多 地方 镶嵌宝石， 技艺 的精湛可 以说 是巧 夺天 工， 是伊斯兰建筑的 经典， 被誉 为印度的 珍珠。 驹 F 3 aa 本 9 ARaames 1 In mi 人 as 产 Ce r E 1 时办 7 四二 8 加八仙 2 R V B 3 1 一一 E 后 42 国亦 幻亦 真的 交融 18 19 世纪的 欧洲工业革 命极 大地 提高了 生产力， 也使 得建筑的 技术和 材料有 了较 大的 发展， 巴黎 的埃菲尔铁塔就 是这 一时 期的 代表作 之一。 随着 时代 的发 展和 材料的 进步， 建筑 师的 理念发 生了 深刻变化。 他们 相信未 来属于曾 梧那些决心从 头做 起的 人， 他们 抛弃成 规和 束缚， 打算 根据建 生本 一王 B。 筑的 目的来 重新看 待自己的 任务。 而新 的世纪也 提供了 各种 理念发 展的 广阔空间。 埃菲尔铁塔是 为了 1889 年巴黎万 国博览会 而建 的， 塔高 有 300 多米， 整个 塔身 重达 7000 多权 ee 吨， 由 250 万只 锦钉 连为 一体。 埃菲尔铁塔以 巨大的 体量 、 复杂 的结构 、 严密 的设计和 优美的 轮廊 线成 为那个时 代的 象征， 现在 用也 成为 了法 国的 标志建筑。 玉让 志册 埃菲尔铁塔总 立在 法国 巴黎 塞纳 河南岸， 于,732,0.4096360186114758,medium-low,ocr,朗 的 集中 式 陵墓 为 蓝本 ， 发 展 并 创造 了 入 闪 圣洁 过 情 的 白色 大\n自己 的 纪念 性 陵墓 建筑 的 形制 ，17 世纪 建造 的 泰 姬 陵 堪 称 印度 和\n陵墓 建筑 的 经 典 。 这 是 当时 印度 的 皇帝 为 他 的 王妃 建造 的 一 座 花 ， 如许 如\n陵墓 ， 整 座 建筑 布局 完美 ， 形 象 肃 穆 ， 比 例 和 谐 。 建 筑 细部 的\n装饰 非常 精致 ， 许 多 地 方 镶嵌 宝石 ， 技 艺 的 精湛 可 以 说 是 巧 夺\n天 工 ， 是 伊斯兰 建筑 的 经 典 ， 被 誉 为 “印度 的 珍珠 ”。 |\n驹 F-3 -\n- - aa 本 9 - -\n~  ARaames -\n| 1 In mi 人\nas 产 Ce r *\nE 1 时 办 “7 四\n- 二\n8 加 八仙 2\n- R— = V ¥ B 3 - 1\n一 一 E 后\n42\n=== 第 36 页 ===\n国 亦 幻 亦 真 的 交融\n18~19 世纪 的 欧洲 工业 革\n命 极 大 地 提高 了 生产 力 ， 也 使\n得 建筑 的 技术 和 材料 有 了 较 大\n的 发 展 ， 巴 黎 的 埃菲尔 铁塔 就\n是 这 一 时 期 的 代表 作 之 一 。\n随 着 时 代 的 发 展 和 材料\n的 进步 ， 建 筑 师 的 理念 发 生 了\n深刻 变化 。 他 们 相信 未 来 属于\n曾 梧 那些 决心 从 头 做 起 的 人 ， 他 们\n抛弃 成 规 和 束缚 ， 打 算 根据 建\n生 本 一 王 B 。 筑 的 目的 来 重新 看 待 自己 的 任\n务 。 而 新 的 世纪 也 提供 了 各 种\n理念 发 展 的 广阔 空间 。\n埃菲尔 铁塔 是 为 了 1889 年\n巴黎 万 国 博览 会 而 建 的 ， 塔 高 有\n300 多 米 ， 整 个 塔 身 重 达 7000 多\n权 ee 吨 ， 由 250 万 只 锦 钉 连 为 一 体 。\n埃菲尔 铁塔 以 巨大 的 体 量 、 复 杂\n的 结构 、 严 密 的 设计 和 优美 的 轮\n廊 线 成 为 那个 时 代 的 象征 ， 现 在\n用 也 成 为 了 法 国 的 标志 建筑 。\n- 玉 让 志 册 |\n埃菲尔 铁塔 总 立 在\n法 国 巴 黎 塞 纳 河南 岸 ， 于,2.0,67.45652173913044,苏少版_九年级_义务教育教科书·美术九年级下册,38,2025-07-21T14:25:08.551Z,2.0,义务教育教科书·美术九年级下册,/Users/LeoQin/Documents/GitHub/PDFconvertor/training_data/初中/美术/苏少版-江苏凤凰少年儿童出版社/九年级/义务教育教科书·美术九年级下册.pdf,九年级,tesseract.js-parallel,unknown,0.8301886792452831,0.5,1,67.45652173913044,,,,true,,,unknown,下册,苏少版_九年级_义务教育教科书·美术九年级下册.json,美术,46,初中_美术_苏少版_九年级_义务教育教科书·美术九年级下册
苏少版_九年级_义务教育教科书·美术九年级下册_chunk_6,6,"米， 整个 塔身 重达 7000 多权 ee 吨， 由 250 万只 锦钉 连为 一体。 埃菲尔铁塔以 巨大的 体量 、 复杂 的结构 、 严密 的设计和 优美的 轮廊 线成 为那个时 代的 象征， 现在 用也 成为 了法 国的 标志建筑。 玉让 志册 埃菲尔铁塔总 立在 法国 巴黎 塞纳 河南岸， 于画 和让 1889 年建成。 铁塔 由很 ae 人多 分散 的钢铁构件组 成， 高 300 米 , 天线 高 24 米， 上总 高 324 米， 是当时世界了 上县 高的 建筑物。 人 wua, SECRAmE 村人才 y 大是 1 村一 埃菲尔铁塔埃菲尔 ( 法国 ) 43 本 RISE 建筑师 伍重 设计的 悉尼歌剧院 是一 座在 结构和 造型上 打破传 (A2) 统 、 追求 新奇 的经 典现代建筑。 它位 于悉尼港 三面 环水 的班 尼归 岛上， 以白色壳 形屋顶交错组 合， 形成 了独特的 外观 造型。 在蓝 天眉 水的 映衬下， 整座 建筑远 远望 去既 像扬帆起 航的 舰船， 又像 掠水 而过 的白 芍， 充满 了诗情画意。 法国医皮 杜文化艺术中 心巴黎的 莲皮 杜文化艺术中 心建 筑总 面积约 为 10 万平方皮 亚诺 ( 意大利 )， 罗杰斯英国 ) 米， 内部 包括工业设计中 心 、 音乐 与声乐研究所 、 现代 艺术 博物 馆 、 公共 情报 知识图 书馆 Tad Js 以及 相应的 服务设施等。 从外 形 r 上来 看， 它与 其说 是文化艺术中 心， 倒不 如说 更像 一座 化工厂， 且下 Te ne 因为整个建筑都 被许多纵横交错 . ; 的并 涂有 各种 鲜艳色彩的 管道和 多 7 天人 、",722,0.33141173077518177,low,ocr,"米 ， 整 个 塔 身 重 达 7000 多\n权 ee 吨 ， 由 250 万 只 锦 钉 连 为 一 体 。\n埃菲尔 铁塔 以 巨大 的 体 量 、 复 杂\n的 结构 、 严 密 的 设计 和 优美 的 轮\n廊 线 成 为 那个 时 代 的 象征 ， 现 在\n用 也 成 为 了 法 国 的 标志 建筑 。\n- 玉 让 志 册 |\n埃菲尔 铁塔 总 立 在\n法 国 巴 黎 塞 纳 河南 岸 ， 于\n画 -| 和 让 1889 年 建成 。 铁 塔 由 很\nae —- 人 多 分 散 的 钢铁 构件 组 成 ，\n高 300 米 , 天 线 高 24 米 ，\n上 总 高 324 米 ， 是 当时 世界\n了 上 县 高 的 建筑 物 。\n人 wua, SECRAmE\n村 人才 = y 大 是\n1 村 一\n埃菲尔 铁塔 ”埃菲尔 ( 法 国 )\n43\n=== 第 37 页 ===\n本 ET RISE\n建筑 师 伍 重 设计 的 悉尼 歌剧 院 是 一 座 在 结构 和 造型 上 打破 传 HATRRERHE  (A2)\n统 、 追 求 新 奇 的 经 典 现代 建筑 。 它 位 于 悉尼 港 三 面 环 水 的 班 尼 归\n岛 上 ， 以 白色 壳 形 屋顶 交错 组 合 ， 形 成 了 独特 的 外 观 造型 。 在 蓝\n天 眉 水 的 映衬 下 ， 整 座 建筑 远 远 望 去 既 像 扬帆 起 航 的 舰 船 ， 又 像\n掠 水 而 过 的 白 芍 ， 充 满 了 诗情画意 。\n法 国医 皮 杜 文化 艺术 中 心 巴黎 的 莲 皮 杜 文化 艺术 中 心 建 筑 总 面积 约 为 10 万 平方\n皮 亚 诺 ( 意大利 ) ， -\n罗杰斯 { 英国 ) 米 ， 内 部 包括 工业 设计 中 心 、 音 乐 与 声乐 研究 所 、 现 代 艺\n术 博 物 馆 、 公 共 情 报 知识 图 书馆\nTad Js 以 及 相应 的 服务 设施 等 。 从 外 形\n[ r 上 来 看 ， 它 与 其 说 是 文化 艺术 中\n| | —— 心 ， 倒 不 如 说 更 像 一 座 化 工厂 ，\n| 且 下 Te ne 因为 整个 建筑 都 被 许多 纵横 交错\n- . ; 的 并 涂 有 各 种 鲜艳 色彩 的 管道 和\n| 多\n” 7\n- 天 人 、",2.0,67.45652173913044,苏少版_九年级_义务教育教科书·美术九年级下册,39,2025-07-21T14:25:08.551Z,2.0,义务教育教科书·美术九年级下册,/Users/LeoQin/Documents/GitHub/PDFconvertor/training_data/初中/美术/苏少版-江苏凤凰少年儿童出版社/九年级/义务教育教科书·美术九年级下册.pdf,九年级,tesseract.js-parallel,unknown,0.8099808061420346,0.6,1,67.45652173913044,,,,true,,,general,下册,苏少版_九年级_义务教育教科书·美术九年级下册.json,美术,46,初中_美术_苏少版_九年级_义务教育教科书·美术九年级下册
苏少版_九年级_义务教育教科书·美术九年级下册_chunk_7,7,"博物 馆 、 公共 情报 知识图 书馆 Tad Js 以及 相应的 服务设施等。 从外 形 r 上来 看， 它与 其说 是文化艺术中 心， 倒不 如说 更像 一座 化工厂， 且下 Te ne 因为整个建筑都 被许多纵横交错 . ; 的并 涂有 各种 鲜艳色彩的 管道和 多 7 天人 、 一一 1 这是 一座 具有未 来主 一让 义风 格的 建筑， 这里 珍藏和 乔 Se h 着法 国帮 至世界现代艺术 . e 的珍品， 而它 本身 就是 一号， 人加 座建 筑艺 术的 珍品 44 _ 这座 流水别墅是 不是 和中 国江南园林二 二 x. 人有 着某 种相似的 地方 呢 ? 2 b 1 宣更 如果 我们 身处 这别墅之 中， 聆听 着溪 可水 的声音， 你将 会有 怎样的 感觉呢 ? 各证 美国著名建筑师 赖特 的流水别 放生 2 墅将 建筑与 周国 的自然环境融 为一 一 ) 十体， 让它们看 上去 不像 是人 造的， ma 忆玫 渍网 站而 是像 植物那样自然生长 ""出来 的。 于是 赖特 在流水别墅中 大胆 地用 窗户蕉 二代 了墙壁， 将室内的 空间置 于一 种开放的 状态， 使室外的 自然景观成 流水别 里孝 竺 (美国 ) 为室内空间的 有机 下续。 Amny , 加人 能避 举册 卫少 人二 四是 二是 纽约的 古根 汉姆 美术馆 是赖 特的 另一 件们 分别 代表哪个国家或 哪座 城市 ? 重要作品， 也是 纽约著名的 地标 建筑。 这座 在你 熟知的 建筑中， 你最 感兴趣的 是泛 形全 和构 的建 和是 呐四 螺旋形 结构的 建筑， 从外 形上 看就 像一 个巨",701,0.39499147601060836,low,ocr,"博 物 馆 、 公 共 情 报 知识 图 书馆\nTad Js 以 及 相应 的 服务 设施 等 。 从 外 形\n[ r 上 来 看 ， 它 与 其 说 是 文化 艺术 中\n| | —— 心 ， 倒 不 如 说 更 像 一 座 化 工厂 ，\n| 且 下 Te ne 因为 整个 建筑 都 被 许多 纵横 交错\n- . ; 的 并 涂 有 各 种 鲜艳 色彩 的 管道 和\n| 多\n” 7\n- 天 人 、\n一 一 1 这 是 一 座 具有 未 来 主\n= 一 让 = 义 风 格 的 建筑 ， 这 里 珍藏\n和 乔 Se h+ 着 法 国 帮 至 世界 现代 艺术\n=. e 的 珍品 ， 而 它 本 身 就 是 一\n- 号 ， 人 加 - 座 建 筑 艺 术 的 珍品\n44\n=== 第 38 页 ===\n_ 这 座 流水 别墅 是 不 是 和 中 国 江南 园林 二 二 x.\n人 有 着 某 种 相似 的 地 方 呢 ? - 2 b 1 - 宣\n更 如 果 我 们 身 处 这 别墅 之 中 ， 聆 听 着 溪 “可\n水 的 声音 ， 你 将 会 有 怎样 的 感觉 呢 ? < 各 ~ /\nJS 证\n美国 著名 建筑 师 赖 特 的 流水 别 放生 2\n- —\n墅 将 建筑 与 周 国 的 自然 环境 融 为 一 一 ) -十\n体 ， 让 它们 看 上 去 不 像 是 人 造 的 ， ma 忆 玫 渍\n网 - - 站\n而 是 像 植物 那样 自然 生长 ""出 来 的 。 于 是\n赖 特 在 流水 别墅 中 大 胆 地 用 窗户 蕉 二\n代 了 墙壁 ， 将 室内 的 空间 置 于 一 种\n开放 的 状态 ， 使 室外 的 自然 景观 成 流水 别 里 孝 竺 (美国 )\n为 室内 空间 的 有 机 下 续 。\nAmny , 加\n人 能 避 举 册 卫 少 人 二 四 是 二 是 纽约 的 古 根 汉 姆 美术 馆 是 赖 特 的 另 一 件\n们 分 别 代表 哪个 国家 或 哪 座 城市 ? 重要 作品 ， 也 是 纽约 著名 的 地 标 建筑 。 这 座\n在 你 熟知 的 建筑 中 ， 你 最 感 兴趣 的 是 泛 形 全 和 构 的 建 和 ES 是 呐\n四 螺旋 形 结构 的 建筑 ， 从 外 形 上 看 就 像 一 个 巨",2.0,67.45652173913044,苏少版_九年级_义务教育教科书·美术九年级下册,40,2025-07-21T14:25:08.551Z,2.0,义务教育教科书·美术九年级下册,/Users/LeoQin/Documents/GitHub/PDFconvertor/training_data/初中/美术/苏少版-江苏凤凰少年儿童出版社/九年级/义务教育教科书·美术九年级下册.pdf,九年级,tesseract.js-parallel,unknown,0.874,0.6,1,67.45652173913044,,,,true,true,,geography,下册,苏少版_九年级_义务教育教科书·美术九年级下册.json,美术,46,初中_美术_苏少版_九年级_义务教育教科书·美术九年级下册
苏少版_九年级_义务教育教科书·美术九年级下册_chunk_8,8,"举册 卫少 人二 四是 二是 纽约的 古根 汉姆 美术馆 是赖 特的 另一 件们 分别 代表哪个国家或 哪座 城市 ? 重要作品， 也是 纽约著名的 地标 建筑。 这座 在你 熟知的 建筑中， 你最 感兴趣的 是泛 形全 和构 的建 和是 呐四 螺旋形 结构的 建筑， 从外 形上 看就 像一 个巨 大的 蘑菇。 这也 是建筑师 赖特 有机 建筑 "" 理论的 产物。 : ps sm 要这 中 8 1 上一 i H o wa 有古 根汉 姆美术馆 一赖 特 ( 美国 ) 45 同学们 : 建筑是 人类 生活的 舞台， 主要 的物质环境。 人塑造了 建筑， 建筑也 塑造人。 这说 明建 筑环 境对 人的 成长 有一 定影响。 本册 教科 书有 五节 课与 建筑相关， 即中 国建筑艺术欣赏 、 外国 建筑艺术欣 近 、 房屋 室内设计 、 室外 公共艺术设计 、 城市 中心 广场设计等。 在加 速城镇化 建设的 今天， 一个 能够 令世 人满意又 富有特色的 城市规 划和 建筑设计， 是放 在我 们面前的 一个 重大课题。 本书 还为 同学们 安排了 一节 版画 课 、 一节 摄影 课和 一节 数码 画课。 综合 课则 是将 鲁迅先生的 《故乡 》 一文 改成 课本剧， 利用 学校 现有 的条 件来 制作道具 、 服装 及其 他舞台美术用 品等， 演出 效果还 真的 很好 呢 ! 根据初中学 生的 身心特点， 教科 书在 课程设计和 体例安排上， 加强 了内 容的 衔接， 完善 了课程的 结构。 在内 容的 选择上 突出了 优秀 的民族文化， 使教科书 体现更 为浓郁的 中国 特色， 同时 也兼顾了 世界多 元文化。",716,0.454102215389016,medium-low,ocr,"举 册 卫 少 人 二 四 是 二 是 纽约 的 古 根 汉 姆 美术 馆 是 赖 特 的 另 一 件\n们 分 别 代表 哪个 国家 或 哪 座 城市 ? 重要 作品 ， 也 是 纽约 著名 的 地 标 建筑 。 这 座\n在 你 熟知 的 建筑 中 ， 你 最 感 兴趣 的 是 泛 形 全 和 构 的 建 和 ES 是 呐\n四 螺旋 形 结构 的 建筑 ， 从 外 形 上 看 就 像 一 个 巨\n大 的 蘑菇 。 这 也 是 建筑 师 赖 特 “ 有 机 建筑 ""\n理论 的 产物 。\n—\n: ps -\n- sm 要\n+ 这 中 8\n1 上 一\ni\nH o\nwa\n有\n古 根 汉 姆 美术 馆\n一 赖 特 ( 美国 )\n45\n=== 第 39 页 ===\n同学 们 :\n建筑 是 人 类 生活 的 舞台 ， 主 要 的 物质 环境 。 人 塑造 了 建筑 ，\n建筑 也 塑造 人。 这 说 明 建 筑 环 境 对 人 的 成 长 有 一 定 影响 。 本 册 教\n科 书 有 五 节 课 与 建筑 相关 ， 即 中 国 建筑 艺术 欣赏 、 外 国 建筑 艺术 欣\n近 、 房 屋 室内 设计 、 室 外 公共 艺术 设计 、 城 市 中 心 广场 设计 等 。 在\n加 速 城镇 化 建设 的 今天 ， 一 个 能 够 令 世 人 满意 又 富有 特色 的 城市 规\n划 和 建筑 设计 ， 是 放 在 我 们 面前 的 一 个 重大 课题 。\n本 书 还 为 同学 们 安排 了 一 节 版 画 课 、 一 节 摄 影 课 和 一 节 数 码 画\n课 。 综 合 课 则 是 将 鲁迅 先生 的 《故乡 》 一 文 改 成 课本 剧 ， 利 用 学 校\n现 有 的 条 件 来 制作 道具 、 服 装 及 其 他 舞台 美术 用 品 等 ， 演 出 效果 还\n真 的 很 好 呢 !\n根据 初中 学 生 的 身心 特点 ， 教 科 书 在 课程 设计 和 体例 安排 上 ，\n加 强 了 内 容 的 衔接 ， 完 善 了 课程 的 结构 。 在 内 容 的 选择 上 突出 了 优\n秀 的 民族 文化 ， 使 教科 书 体现 更 为 浓郁 的 中 国 特色 ， 同 时 也 兼顾 了\n世界 多 元 文化 。",2.0,67.45652173913044,苏少版_九年级_义务教育教科书·美术九年级下册,41,2025-07-21T14:25:08.551Z,2.0,义务教育教科书·美术九年级下册,/Users/LeoQin/Documents/GitHub/PDFconvertor/training_data/初中/美术/苏少版-江苏凤凰少年儿童出版社/九年级/义务教育教科书·美术九年级下册.pdf,九年级,tesseract.js-parallel,unknown,0.8951456310679612,0.5,1,67.45652173913044,,,,true,true,,geography,下册,苏少版_九年级_义务教育教科书·美术九年级下册.json,美术,46,初中_美术_苏少版_九年级_义务教育教科书·美术九年级下册
苏少版_九年级_义务教育教科书·美术九年级下册_chunk_9,9,其他 舞台美术用 品等， 演出 效果还 真的 很好 呢 ! 根据初中学 生的 身心特点， 教科 书在 课程设计和 体例安排上， 加强 了内 容的 衔接， 完善 了课程的 结构。 在内 容的 选择上 突出了 优秀 的民族文化， 使教科书 体现更 为浓郁的 中国 特色， 同时 也兼顾了 世界多 元文化。 希望同学们 通过美术课程的 学习 获得乐趣， 从学 习中 拓展自己各 方面的 能力， 并能 够去 创造更 加美好的 生活。 参加本 套教 科书 编号、 课文加 工 、 提供 图侈 的还 有 : 有罗 戟 、 王文 燕 、 张晓 玲等 老师 ; 广大一 线教师为 本书 的编写也 提供了 很多 宝贵经 验与 素材， 并协助我 们完成了 部分 课例 的课 演实验工作， 使得 本套 教科 书更 为丰富 、 实用， 具有 较强 的可 操作性， 在此 一并 深表 谢意 《初中美术 》 教材 编写组 第一 位使 用同学签名年 月日 姓名 学校 班级 地区 学习 感性 3 :上上 上证 本第 二位 使用 同学签名年 月日 姓名 学校 班级 地区 学习 感恒 第三 位使 用同学签名年 月日 姓名 学校 班级 地区 学习 感恒 置同学们 好根据国家教育部 规定， 凡循环使 用的 课本， 前后 有三 人使 用。 具体 做法 是 : 开学时 学校 应发 给每 人一 册美 术课 本， 并由 学生 保管， 一学 期使 用完毕后， 交学 校留 给下 一届 同学 使用。 因为 一本 书要 供三 位同学每 人使 用半年。 所以， 同学 们应 该特别爱护书籍， 如有 意外损坏， 应及 时报告学 校补 上新 书。 《初中美术 》 教材 编写组 《9 风力传 召,721,0.47481360766045544,medium-low,ocr,其 他 舞台 美术 用 品 等 ， 演 出 效果 还\n真 的 很 好 呢 !\n根据 初中 学 生 的 身心 特点 ， 教 科 书 在 课程 设计 和 体例 安排 上 ，\n加 强 了 内 容 的 衔接 ， 完 善 了 课程 的 结构 。 在 内 容 的 选择 上 突出 了 优\n秀 的 民族 文化 ， 使 教科 书 体现 更 为 浓郁 的 中 国 特色 ， 同 时 也 兼顾 了\n世界 多 元 文化 。\n希望 同学 们 通过 美术 课程 的 学 习 获得 乐趣 ， 从 学 习 中 拓展 自己\n各 方面 的 能 力 ， 并 能 够 去 创造 更 加 美好 的 生活 。\n参加 本 套 教 科 书 编号、 课文 加 工 、 提 供 图 侈 的 还 有 : 有 罗 戟 、 王 文 燕 、 张 晓 玲 等 老师 ; 广大\n一 线 教师 为 本 书 的 编写 也 提供 了 很 多 宝贵 经 验 与 素材 ， 并 协助 我 们 完成 了 部 分 课 例 的 课 演 实验\n工作 ， 使 得 本 套 教 科 书 更 为 丰富 、 实 用 ， 具 有 较 强 的 可 操作 性 ， 在 此 一 并 深 表 谢意\n《初中 美术 》 教 材 编写 组\n=== 第 40 页 ===\n第 一 位 使 用 同学 签名 年 月 日\n姓 名 学 校\n班 级 地 区\n学 习 感性 3\n:上 上 上 证\n本\n第 二 位 使 用 同学 签名 年 月 日\n姓 名 学 校\n班 级 地 区\n学 习 感 恒\n =\n第 三 位 使 用 同学 签名 年 月 日\n姓 名 学 校\n班 级 地 区\n学 习 感 恒 置\n—-—\n同学 们 好\n根据 国家 教育 部 规定 ， 凡 循环 使 用 的 课本 ， 前 后 有 三 人 使 用 。 具 体 做 法 是 : 开学 时 学 校 应\n发 给 每 人 一 册 美 术 课 本 ， 并 由 学 生 保管 ， 一 学 期 使 用 完毕 后 ， 交 学 校 留 给 下 一 届 同 学 使 用 。 因\n为 一 本 书 要 供 三 位 同学 每 人 使 用 半年 。 所 以 ， 同 学 们 应 该 特别 爱护 书籍 ， 如 有 意外 损坏 ， 应 及\n时 报告 学 校 补 上 新 书 。\n《初中 美术 》 教 材 编写 组\n=== 第 41 页 ===\n\\n《9 风力 传 召,2.0,67.45652173913044,苏少版_九年级_义务教育教科书·美术九年级下册,42,2025-07-21T14:25:08.551Z,2.0,义务教育教科书·美术九年级下册,/Users/LeoQin/Documents/GitHub/PDFconvertor/training_data/初中/美术/苏少版-江苏凤凰少年儿童出版社/九年级/义务教育教科书·美术九年级下册.pdf,九年级,tesseract.js-parallel,unknown,0.9155470249520153,0.5,1,67.45652173913044,,true,,true,,,general,下册,苏少版_九年级_义务教育教科书·美术九年级下册.json,美术,46,初中_美术_苏少版_九年级_义务教育教科书·美术九年级下册
