Chunk_ID,Chunk_Index,Content,Content_Length,Quality_Score,Reliability,Source_Type,Original_Content,Enhancement_Version,averageConfidence,book_name,chunkIndex,enhancementTimestamp,enhancementVersion,fileName,filePath,grade,ocrMethod,publisher,qualityMetrics_chineseCharRatio,qualityMetrics_coherenceScore,qualityMetrics_lengthScore,qualityMetrics_ocrConfidence,semanticFeatures_hasDefinition,semanticFeatures_hasExperiment,semanticFeatures_hasFormulas,semanticFeatures_hasNumbers,semanticFeatures_hasQuestion,semanticFeatures_isTableContent,semanticFeatures_subjectArea,semester,source_file,subject,totalPages,uniqueId
苏科版_八年级_义务教育教科书·生物学八年级上册_chunk_30,30,"随着 生理上 生殖器 官发 育的 加 w 速， 青少年的 性意识开始萌动， 对性 可知识产生兴趣， 对异性有 较强 的交往和 欲望。 此外， 青春期 的少年还 表现出 强烈的 人际 交往 欲， 一方面希望结交志 趣相 同， 年龄 相仿， 能够 相互理解 、 分享 生活感受的 知心朋友 ; 另一 方面， 对自己周围的 人尽量保持良好的 关系 ,尤其是 对自己所 属的 集体有 强烈的 归属 感和 依赖性。 此外， 兴趣 爱好日 益广泛， 求知 欲与 好奇 心也 十分 强烈。 全 1. 想一 想 : 进入青春期 的你， 心理上 有哪些突出的 变化 ? 2. 你认为青少年应 该怎样正确对 待青春期 出现 的生理或 心理变化 ? 处于 青春期 的青少年， 生理 和心理发 生的 变化是 正常的。 要正确认识性 知识是 一种 科学知识。 要努力学 习， 积极 参加文体活动， 提高 心理健康的 稳定性和 对各 种有 害影响的 抵抗力， 健康 度过 青春年 华。 129.，e 科学 . 技术 . 社会影响青 毒期 发育 的因素青少年生长发 育是 在身体与 外界 环境的 相互作用下 实现的。 影响 青少年生长发 育的 因素与 自身的 素质有 关， 也与 外界 影响 密切相关， 大致 可以 归纳为 以下 5 种。 1. 遗传基因。 决定 青少年身高 、 智力 、 体质 发育 的因素中 ,遗传基因约 占 23， 后天 的环境因素约 占 1 3。 2. 营养。 对于 处在 生长发 育高 峰期 的青少年来 说， 保证 蛋白质 、 牛磺 酸 、 维生 素和 微量元 素等 营养的 供给很 重要。 3. 充足睡眠。 从儿童时 期到 青春前 期， 青少年体内的 生长激素在 睡眼 时分 小旺盛。",741,0.5278610430181792,medium-low,ocr,"随 着 生理 上 生殖 器 官 发 育 的 加 w\n速 ， 青 少年 的 性 意识 开始 萌动 ， 对 性 —& 可\n知识 产生 兴趣 ， 对 异性 有 较 强 的 交往\n和 欲望。 此外， 青春 期 的 少年 还 表现 出 强烈 的 人 际 交 往 欲 ， 一 方面 希望 结交 志\n趣 相 同 ， 年 龄 相仿 ， 能 够 相互 理解 、 分 享 生活 感受 的 知心 朋友 ; 另 一 方面 ，\n对 自己 周围 的 人 尽量 保持 良好 的 关系 ,尤其 是 对 自己 所 属 的 集体 有 强烈 的 归\n属 感 和 依赖 性 。 此 外 ， 兴 趣 爱好 日 益 广泛 ， 求 知 欲 与 好 奇 心 也 十 分 强烈 。\n全\n1. 想 一 想 : 进入 青春 期 的 你 ， 心理 上 有 哪些 突出 的 变化 ?\n2. 你 认为 青少年 应 该 怎样 正确 对 待 青春 期 出 现 的 生理 或 心理 变化 ?\n处 于 青春 期 的 青少年 ， 生 理 和 心理 发 生 的 变化 是 正常 的 。 要 正确 认识 性\n知识 是 一 种 科学 知识 。 要 努力 学 习 ， 积 极 参加 文体 活动 ， 提 高 心理 健康 的 稳\n定性 和 对 各 种 有 害 影响 的 抵抗 力 ， 健 康 度 过 青春 年 华 。\n129.\n=== 第 41 页 ===\n@，e@\nCS 科学 . 技术 . 社会\n影响 青 毒 期 发 育 的 因素\n青少年 生长 发 育 是 在 身体 与 外 界 环境 的 相互 作用 下 实现 的 。 影 响 青少年 生长 发 育 的\n因素 与 自身 的 素质 有 关 ， 也 与 外 界 影 响 密切 相关 ， 大 致 可 以 归纳 为 以 下 5 种 。\n1. 遗传 基因 。 决 定 青少年 身高 、 智 力 、 体 质 发 育 的 因素 中 ,遗传 基因 约 占 23， 后 天\n的 环境 因素 约 占 1/3。\n2. 营养 。 对 于 处 在 生长 发 育 高 峰 期 的 青少年 来 说 ， 保 证 蛋白 质 、 牛 磺 酸 、 维 生 素 和\n微量 元 素 等 营养 的 供给 很 重要 。\n3. 充足 睡眠 。 从 儿童 时 期 到 青春 前 期 ， 青 少年 体内 的 生长 激素 在 睡 眼 时 分 小 旺盛。",2.0,80.01408450704226,苏科版_八年级_义务教育教科书·生物学八年级上册,45,2025-07-21T14:25:09.108Z,2.0,义务教育教科书·生物学八年级上册,/Users/LeoQin/Documents/GitHub/PDFconvertor/training_data/初中/生物学/苏科版-江苏凤凰科学技术出版社/八年级/义务教育教科书·生物学八年级上册.pdf,八年级,tesseract.js-parallel,unknown,0.8754512635379061,0.5,1,80.01408450704226,,,,true,true,,chemistry,上册,苏科版_八年级_义务教育教科书·生物学八年级上册.json,生物,142,初中_生物学_苏科版_八年级_义务教育教科书·生物学八年级上册
苏科版_八年级_义务教育教科书·生物学八年级上册_chunk_31,31,"步人 青春期 后， 女孩 每年 增高 4 10 cm， 男孩 每年 增高 6 12 cm。 身体 增高的 主要原因是 下肢 骨的 增长。 体重 迅速增加是 骨骼 、 肌肉 和内 脏迅 速生长 发育 的结果。 功能发 育进入青春期， 由于 大脑 皮质的 内部 结构和 功能不 断地 分化 与完善， 使大 脑对 人体 的调节功能大 大增强， 分析 、 理解 和判断间 题的 能力 有了 很大 提高。 在这 一时 期， 好奇 心和 求知欲 增强， 容易 接受 新事物， 是学 习文 化科学知识 、 发展 智力 的黄金时 期。 是 230) 青春期 由于 心肌增 厚， 心脏 的重量迅速增加。 到 18 岁时， 心脏 重量约 为成 年时 重量的 90。 随着 心肌的 增厚， 心脏 的收缩力 增强 ,心脏供 血能 力显著提高， 保证 了青春期 日益 旺盛 的新 陈代谢的 需要。 性发 育进入青春期 后， 在激素的 作用下， 举丸 或卵 梨得 到迅速发 育。 男性 的符 丸开始增 大， 内部 结构逐渐发 育完善， 能产生精子， 分泌 雄激素， 开始 出现 遗精。 女性 的卵 梨发 育也 加快， 能产生卵细胞， 分泌 肉激素， 开始 出现 月经。 生殖 器官 的发 育和 性功能的 成熟 是青春期 发育 的突出特征。 区月 经女孩到 了青春期， 每月 一次 的子宫出 血现象叫 作月 经。 第一 次来 月经 叫作 初潮。 女孩 大多 在 9 13 岁开始有 月经。 月经 初潮开始的 年龄 与每 个人 的遗传 、 生活 环境 、 营养 等因素有 密切关系。 如果 营养 好可 能导致月 经提前。 月经 周期一 般是 28 30 天， 但由 于在 青",721,0.558499783415039,medium-low,ocr,"步 人 青春 期 后 ， 女 孩 每 年 增高 4 ~ 10 cm， 男 孩 每 年 增\n高 6~ 12 cm。 身 体 增高 的 主要 原因 是 下 肢 骨 的 增长 。 体 重 迅速 增加 是 骨骼 、 肌 肉 和 内 脏 迅\n速生 长 发 育 的 结果 。\n功能 发 育 ”进入 青春 期 ， 由 于 大 脑 皮质 的 内 部 结构 和 功能 不 断 地 分 化 与 完善 ， 使 大 脑 对\n人 体 的 调节 功能 大 大 增强 ， 分 析 、 理 解 和 判断 间 题 的 能 力 有 了 很 大 提高 。 在 这 一 时 期 ， 好\n奇 心 和 求知 欲 增强 ， 容 易 接 受 新 事物 ， 是 学 习 文 化 科学 知识 、 发 展 智 力 的 “黄金 时 期 ”。\n是 230)\n=== 第 42 页 ===\n青春 期 由 于 心肌 增 厚 ， 心 脏 的 重量 迅速 增加 。 到 18 岁 时 ， 心 脏 重量 约 为 成 年 时 重量\n的 90%。 随 着 心肌 的 增 厚 ， 心 脏 的 收缩 力 增强 ,心脏 供 血 能 力 显著 提高 ， 保 证 了 青春 期 日\n益 旺 盛 的 新 陈 代谢 的 需要 。\n性 发 育 ”进入 青春 期 后 ， 在 激素 的 作用 下 ， 举 丸 或 卵 梨 得 到 迅速 发 育 。 男 性 的 符 丸\n开始 增 大 ， 内 部 结构 逐渐 发 育 完善 ， 能 产生 精子 ， 分 泌 雄 激素 ， 开 始 出 现 遗 精 。 女 性 的 卵\n梨 发 育 也 加 快 ， 能 产生 卵细胞 ， 分 泌 肉 激素 ， 开 始 出 现 月 经 。 生 殖 器 官 的 发 育 和 性 功能 的\n成 熟 是 青春 期 发 育 的 突出 特征 。\n区 月 经\n女孩 到 了 青春 期 ， 每 月 一 次 的 子宫 出 血 现象 叫 作 月 经 。 第 一 次 来 月 经 叫 作 初 潮 。 女\n孩 大 多 在 9 ~ 13 岁 开始 有 月 经 。 月 经 初潮 开始 的 年 龄 与 每 个 人 的 遗传 、 生 活 环境 、 营 养 等\n因素 有 密切 关系 。 如 果 营 养 好 可 能 导致 月 经 提前 。 月 经 周期 一 般 是 28 ~ 30 天 ， 但 由 于 在 青",2.0,80.01408450704226,苏科版_八年级_义务教育教科书·生物学八年级上册,47,2025-07-21T14:25:09.108Z,2.0,义务教育教科书·生物学八年级上册,/Users/LeoQin/Documents/GitHub/PDFconvertor/training_data/初中/生物学/苏科版-江苏凤凰科学技术出版社/八年级/义务教育教科书·生物学八年级上册.pdf,八年级,tesseract.js-parallel,unknown,0.8645038167938931,0.5,1,80.01408450704226,,,,true,,,biology,上册,苏科版_八年级_义务教育教科书·生物学八年级上册.json,生物,142,初中_生物学_苏科版_八年级_义务教育教科书·生物学八年级上册
苏科版_八年级_义务教育教科书·生物学八年级上册_chunk_32,32,"月一 次的 子宫出 血现象叫 作月 经。 第一 次来 月经 叫作 初潮。 女孩 大多 在 9 13 岁开始有 月经。 月经 初潮开始的 年龄 与每 个人 的遗传 、 生活 环境 、 营养 等因素有 密切关系。 如果 营养 好可 能导致月 经提前。 月经 周期一 般是 28 30 天， 但由 于在 青春 期初期， 卵梨 功能 和身体的 调节功能还 不健全， 所以 有的 女孩在 初潮时 期， 会有 月经 周期 不规律的 现象。 卵梨 在发 育成熟 后， 约一 个月 排出一 个卵细胞。 卵细胞排出后 先到 达输 卵管， 这时 子宫内 膜也 逐渐增 厚。 若这 期间 卵细胞受精了， 受精 卵就 会植 人增 厚的 子宫内 膜， 发育成胎儿。 如果 卵细胞没有受精， 增厚 的子宫内 膜就 会脱落下 来， 排出 体外， 形成 月经。 月经 的到 来 ,标志着 一个 成熟女性 的诞生， 表示 其已 有了 生殖基础。 子宫六 了 3 的 _ 排卵时， 肉激素促 卵细胞未 受精， 雌激素月 经大 约 4 天以 后， 使子宫内 膜增 厚， 血减少， 引起 子宫内 膜脱落子宫内 膜重新长 起， 下管 增生出 血， 并由 阴道排出一 个月 经周期开始月 经形成示意图 月经 期间 必须 注意卫生保健， 要做 到以 下几 点 : 1. 保持良好的 心理状态， 避免 剧烈运动和 过度 劳累， 注意 保暖， 苯防 感冒。 2. 注意饮食卫生， 不吃 生冷 、 油肤 、 刺激 性强 的食物。 1 月 3. 讲究卫生， 保持 阴部 清洁。 卫生 巾 、 卫生 纸要 干净和 柔软， 内裤 要勤 换勤 洗， 洗过 的内 裤要 放在 阳光下 晒干。 二入 Se 7 L 4 p",728,0.5187913204225353,medium-low,ocr,"月 一 次 的 子宫 出 血 现象 叫 作 月 经 。 第 一 次 来 月 经 叫 作 初 潮 。 女\n孩 大 多 在 9 ~ 13 岁 开始 有 月 经 。 月 经 初潮 开始 的 年 龄 与 每 个 人 的 遗传 、 生 活 环境 、 营 养 等\n因素 有 密切 关系 。 如 果 营 养 好 可 能 导致 月 经 提前 。 月 经 周期 一 般 是 28 ~ 30 天 ， 但 由 于 在 青\n春 期 初期 ， 卵 梨 功 能 和 身体 的 调节 功能 还 不 健全 ， 所 以 有 的 女孩 在 初潮 时 期 ， 会 有 月 经 周\n期 不 规律 的 现象 。\n卵 梨 在 发 育成 熟 后 ， 约 一 个 月 排出 一 个 卵细胞 。 卵 细胞 排出 后 先 到 达 输 卵 管 ， 这 时\n子宫 内 膜 也 逐渐 增 厚 。 若 这 期 间 卵 细胞 受精 了 ， 受 精 卵 就 会 植 人 增 厚 的 子宫 内 膜 ， 发 育成\n胎儿 。 如 果 卵 细胞 没有 受精 ， 增 厚 的 子宫 内 膜 就 会 脱落 下 来 ， 排 出 体外 ， 形 成 月 经 。\n月 经 的 到 来 ,标志 着 一 个 成 熟女 性 的 诞生 ， 表 示 其 已 有 了 生殖 基础 。\n子宫 六 了\n3\n的\n_\n排卵 时 ， 肉 激素 促 卵细胞 未 受精 ， 雌 激素 月 经 大 约 4 天 以 后 ，\n使 子宫 内 膜 增 厚 ， 血 减少 ， 引 起 子宫 内 膜 脱落 子宫 内 膜 重新 长 起 ， 下\n管 增生 出 血 ， 并 由 阴道 排出 一 个 月 经 周期 开始\n月 经 形成 示意 图\n月 经 期 间 必 须 注意 卫生 保健 ， 要 做 到 以 下 几 点 :\n1. 保持 良好 的 心理 状态 ， 避 免 剧烈 运动 和 过 度 劳 累 ， 注 意 保暖 ， 苯 防 感冒 。\n2. 注意 饮食 卫生 ， 不 吃 生 冷 、 油 肤 、 刺 激 性 强 的 食物 。\n1 月\n=== 第 43 页 ===\n3. 讲究 卫生 ， 保 持 阴 部 清洁 。 卫 生 巾 、 卫 生 纸 要 干净 和 柔软， 内 裤 要 勤 换 勤 洗 ， 洗 过\n的 内 裤 要 放 在 阳光 下 晒 干 。\n二 入 Se\n7 » L\n4 —\np ES\n« %",2.0,80.01408450704226,苏科版_八年级_义务教育教科书·生物学八年级上册,48,2025-07-21T14:25:09.108Z,2.0,义务教育教科书·生物学八年级上册,/Users/LeoQin/Documents/GitHub/PDFconvertor/training_data/初中/生物学/苏科版-江苏凤凰科学技术出版社/八年级/义务教育教科书·生物学八年级上册.pdf,八年级,tesseract.js-parallel,unknown,0.8631178707224335,0.5,1,80.01408450704226,,,,true,,,physics,上册,苏科版_八年级_义务教育教科书·生物学八年级上册.json,生物,142,初中_生物学_苏科版_八年级_义务教育教科书·生物学八年级上册
苏科版_八年级_义务教育教科书·生物学八年级上册_chunk_33,33,"注意 保暖， 苯防 感冒。 2. 注意饮食卫生， 不吃 生冷 、 油肤 、 刺激 性强 的食物。 1 月 3. 讲究卫生， 保持 阴部 清洁。 卫生 巾 、 卫生 纸要 干净和 柔软， 内裤 要勤 换勤 洗， 洗过 的内 裤要 放在 阳光下 晒干。 二入 Se 7 L 4 p 内裤 要勤 换勤 洗内 裤要 放在 阳光下 晒干 咕和 遗精青春期 的男性， 有时 会在 睡眠中 出现 排精 的现象， 这就 是遗精， 也叫 梦遗。 青春期 男性的 睾丸除了分 泌雄 激素引发第 二性 征外 ,还产生由 精子和 一些 黏液 组成 的精液。 精液 一部 分因 排出 体外而 消失， 一部 分会 被吸收， 遗留 下来 的精液随 着时 间而 积聚 起来。 面对 遗精， 不必 惊慌， 不必 均人 炊， 因为 它是 一种 正常的 生理现象， 就像 女孩 来月 经一 样， 它是 生殖系统成 熟的 标志。 如果 频繁 遗精， 就要 分析 原因， 及时 解决问题。 防止 和消除频繁遗精， 最重要的 是自我调整， 将精力集中在 学习 上， 并积极参加体育锻炼和 有益 的文娱活动 ; 同时养 成良好的 生活习惯， 经常 保持 外生殖器 清洁， 不穿 过紧 内裤， 睡前 用温水洗 脚。 进入青春期 的青少年， 体内 的性 激素分 泌增 多。 有些 人体内雄 激素分 记过于 旺盛， 刺激皮肤中 的皮脂腺 分泌 大量 皮脂。 同时， 还使 毛圳 皮脂腺的 导管增 粗 、 变硬， 造成 皮脂排出障碍， 从而 在皮肤的 表面形成凸 起状 的青春冶， 也称 痊疮。 堵塞 的毛 塞易 滋生 细菌 而",687,0.4859338125303545,medium-low,ocr,"注 意 保暖 ， 苯 防 感冒 。\n2. 注意 饮食 卫生 ， 不 吃 生 冷 、 油 肤 、 刺 激 性 强 的 食物 。\n1 月\n=== 第 43 页 ===\n3. 讲究 卫生 ， 保 持 阴 部 清洁 。 卫 生 巾 、 卫 生 纸 要 干净 和 柔软， 内 裤 要 勤 换 勤 洗 ， 洗 过\n的 内 裤 要 放 在 阳光 下 晒 干 。\n二 入 Se\n7 » L\n4 —\np ES\n« %\n内 裤 要 勤 换 勤 洗 内 裤 要 放 在 阳光 下 晒 干\n咕 和 遗精\n青春 期 的 男性 ， 有 时 会 在 睡眠 中 出 现 排 精 的 现象 ， 这 就 是 遗精 ， 也 叫 梦 遗 。\n青春 期 男性 的 睾丸 除了 分 泌 雄 激素 引发 第 二 性 征 外 ,还 产生 由 精子 和 一 些 黏 液 组 成\n的 精液 。 精 液 一 部 分 因 排 出 体外 而 消失 ， 一 部 分 会 被 吸收 ， 遗 留 下 来 的 精液 随 着 时 间 而 积\n聚 起 来 。 面 对 遗精 ， 不 必 惊 慌 ， 不 必 均 人 炊 ， 因 为 它 是 一 种 正常 的 生理 现象 ， 就 像 女 孩 来 月\n经 一 样 ， 它 是 生殖 系统 成 熟 的 标志 。 如 果 频 繁 遗 精 ， 就 要 分 析 原 因 ， 及 时 解决 问题 。 防 止\n和 消除 频繁 遗精 ， 最 重要 的 是 自我 调整 ， 将 精力 集中 在 学 习 上 ， 并 积极 参加 体育 锻炼 和 有\n益 的 文娱 活动 ; 同时 养 成 良好 的 生活 习惯 ， 经 常 保 持 外 生殖 器 清洁 ， 不 穿 过 紧 内 裤 ， 睡 前\n用 温水 洗 脚 。\n» JEHE\n进入 青春 期 的 青少年 ， 体 内 的 性 激素 分 泌 增 多 。 有 些 人 体内 雄 激素 分 记过 于 旺盛 ，\n刺激 皮肤 中 的 皮脂 腺 分 泌 大 量 皮脂 。 同 时 ， 还 使 毛 圳 皮脂腺 的 导管 增 粗 、 变 硬 ， 造 成 皮脂\n排出 障碍 ， 从 而 在 皮肤 的 表面 形成 凸 起 状 的 青春 冶 ， 也 称 痊 疮 。 堵 塞 的 毛 塞 易 滋 生 细 菌 而",2.0,80.01408450704226,苏科版_八年级_义务教育教科书·生物学八年级上册,49,2025-07-21T14:25:09.108Z,2.0,义务教育教科书·生物学八年级上册,/Users/LeoQin/Documents/GitHub/PDFconvertor/training_data/初中/生物学/苏科版-江苏凤凰科学技术出版社/八年级/义务教育教科书·生物学八年级上册.pdf,八年级,tesseract.js-parallel,unknown,0.8822355289421158,0.5,1,80.01408450704226,,,,true,,,unknown,上册,苏科版_八年级_义务教育教科书·生物学八年级上册.json,生物,142,初中_生物学_苏科版_八年级_义务教育教科书·生物学八年级上册
苏科版_八年级_义务教育教科书·生物学八年级上册_chunk_34,34,春期 的青少年， 体内 的性 激素分 泌增 多。 有些 人体内雄 激素分 记过于 旺盛， 刺激皮肤中 的皮脂腺 分泌 大量 皮脂。 同时， 还使 毛圳 皮脂腺的 导管增 粗 、 变硬， 造成 皮脂排出障碍， 从而 在皮肤的 表面形成凸 起状 的青春冶， 也称 痊疮。 堵塞 的毛 塞易 滋生 细菌 而引发炎症。 青少年出 现青 春冶 后要 养成 良好的 卫生习惯， 每日 可以 用温水洗脸清洁皮肤， 不要 用力 挤压 或者 抓破 青春阁， 以免 加重病情。 对绝 大多 数青少年而 言， 这种 现象在 青春期 后会 自然减轻或 消失。 区区 辣卵 双生与 异卵 双生一 次怀孕能 生出一 个以 上的 观儿， 叫作 多胞 胎。 大约 90 个新 生儿 里会 出现 一例 双 132. 胞胎，7 000 个新 生儿 中有 可能 出现 一例三 胞胎。 双胞 胎有 两种 类型 : 同卵 双生和 有异 卵双 生。 同卵 双生 是指 在胚胎发 育的 早期， 由一 个受精卵 发育成两 个完全相同的 豚胎， 这两 个胚胎具有完全相同的 遗传特性和 性别 ; 异卵 双生是 由于 卵梨 同时释放出 两个 卵细胞， 并且 和两 个不 同的 精子结合形成两 个受精卵 发育 而成 的。 异卵 双生的 婴儿可 能不 相像， 也可 能具有不 同的 性别。 胎盘 7 p iw 他 B 7 a ifax 入 J i ) A ) 多子宫 N 异卵 双生 〈 左 ) 和同 卵双生 ( 右 ) 示意图 基因 The Developing Baby ( 发育中 的胎儿 ) The ball of cells in the womb ( 子富 ) lining slowly grows into tissues ( 组织 ) and organs,759,0.401698681177977,medium-low,ocr,春 期 的 青少年 ， 体 内 的 性 激素 分 泌 增 多 。 有 些 人 体内 雄 激素 分 记过 于 旺盛 ，\n刺激 皮肤 中 的 皮脂 腺 分 泌 大 量 皮脂 。 同 时 ， 还 使 毛 圳 皮脂腺 的 导管 增 粗 、 变 硬 ， 造 成 皮脂\n排出 障碍 ， 从 而 在 皮肤 的 表面 形成 凸 起 状 的 青春 冶 ， 也 称 痊 疮 。 堵 塞 的 毛 塞 易 滋 生 细 菌 而\n引发 炎症 。 青 少年 出 现 青 春 冶 后 要 养 成 良好 的 卫生 习惯 ， 每 日 可 以 用 温水 洗脸 清洁 皮肤 ，\n不 要 用 力 挤 压 或 者 抓 破 青春 阁 ， 以 免 加 重病 情 。 对 绝 大 多 数 青少年 而 言 ， 这 种 现象 在 青春\n期 后 会 自然 减轻 或 消失 。\n区 区 辣 卵 双生 与 异 卵 双生\n一 次 怀孕 能 生出 一 个 以 上 的 观 儿 ， 叫 作 多 胞 胎 。 大 约 90 个 新 生 儿 里 会 出 现 一 例 双\n132.\n=== 第 44 页 ===\n胞 胎 ，7 000 个 新 生 儿 中 有 可 能 出 现 一例 三 胞 胎 。 双 胞 胎 有 两 种 类 型 : 同 卵 双生 和 有 异 卵 双\n生 。 同 卵 双 生 是 指 在 胚胎 发 育 的 早期 ， 由 一 个 受精 卵 发 育成 两 个 完全 相同 的 豚 胎 ， 这 两 个\n胚胎 具有 完全 相同 的 遗传 特性 和 性 别 ; 异 卵 双生 是 由 于 卵 梨 同时 释放 出 两 个 卵细胞 ， 并 且\n和 两 个 不 同 的 精子 结合 形成 两 个 受精 卵 发 育 而 成 的 。 异 卵 双生 的 婴儿 可 能 不 相像 ， 也 可 能\n具有 不 同 的 性 别 。\n胎盘 7 AN p ™\niw 他 \B 7\n{ a ifax\n入 | J i )\n\ A\n) 多 子宫 N /\n异 卵 双生 〈 左 ) 和 同 卵 双生 ( 右 ) 示意 图\n基因 The Developing Baby ( 发育 中 的 胎儿 )\nThe ball of cells in the womb ( 子 富 ) lining slowly grows into tissues ( 组织 ) and organs,2.0,80.01408450704226,苏科版_八年级_义务教育教科书·生物学八年级上册,50,2025-07-21T14:25:09.108Z,2.0,义务教育教科书·生物学八年级上册,/Users/LeoQin/Documents/GitHub/PDFconvertor/training_data/初中/生物学/苏科版-江苏凤凰科学技术出版社/八年级/义务教育教科书·生物学八年级上册.pdf,八年级,tesseract.js-parallel,unknown,0.740072202166065,0.5,1,80.01408450704226,,,,true,,,biology,上册,苏科版_八年级_义务教育教科书·生物学八年级上册.json,生物,142,初中_生物学_苏科版_八年级_义务教育教科书·生物学八年级上册
