Chunk_ID,Chunk_Index,Content,Content_Length,Quality_Score,Reliability,Source_Type,Original_Content,Enhancement_Version,averageConfidence,book_name,chunkIndex,enhancementTimestamp,enhancementVersion,fileName,filePath,grade,ocrMethod,publisher,qualityMetrics_chineseCharRatio,qualityMetrics_coherenceScore,qualityMetrics_lengthScore,qualityMetrics_ocrConfidence,semanticFeatures_hasDefinition,semanticFeatures_hasExperiment,semanticFeatures_hasFormulas,semanticFeatures_hasNumbers,semanticFeatures_hasQuestion,semanticFeatures_isTableContent,semanticFeatures_subjectArea,semester,source_file,subject,totalPages,uniqueId
苏科版_八年级_义务教育教科书·生物学八年级上册_chunk_0,0,"定根 的部 分各 是哪 一种 营养器 官 ? 2. 在日 常生活 中， 你还 知道哪些植物可 以通过营养器 官繁殖后 代 ? 落地生根的 叶 、 甘暮 的块根 、 马铃 划的 块茎以 及草莓的 币灸 茎上 都能 发芽 、 生根， 长出 新的 植物体。 在农业生产和 园艺工作中， 人们 创造了 一些 人工 营养繁殖的 方法， 如插 插 、 嫁接 和压条等 来培育果树和 花开 等 ( Pp103)。 营养繁殖是 通过母体的 营养器 官产 生子代 新个 体， 后代 可保持母体的 优良遗传性 状。 在生产实践中， 无法 用种 子繁殖的 植物， 或者 用种 子很 难繁殖的 植物， 都可 以通过营养繁殖的 方式来 培育植物。 植物的 组织 培养 v 植物的 组织 培养 (tissue culture )， 是一 种植物快速繁殖的 技术。 图 19 3 表示的 是人 们利用生物技术将 某种 植物的 叶片培育成 完整植物体 的过 程。 仔细观察图 19 3， 与同学分 析讨 论植物组 织培养的 过程 ( 昔萌 p.104 )。 一一 人一 一 4 一 S 人在 无菌 条件 下， 小块 不愈 伤组 织分 化逐渐将 小块 接种 在断 分裂 形成 愈发 育成完整的 植物培养基 上伤 组织 体一 一幼苗图 切取植物或 其他 组织 器官 的小 块叶片移 栽图 19 3 植物组 织培养示意图 _ 95 利用组 织培养技术 ,不仅能 快速繁殖植物， 保持 品种的 优良性 状， 还可 以防止植物病菌的 危害。 例如， 在花卉栽培中 ,科学家 利用康 乃志 植株的 一个 菠尖， 一年 之中 就可 以繁殖出 上百 万株 康乃 世的 试管种 苗。 目前 ,在桑 、 甘蔗、",729,0.4677967312936232,medium-low,ocr,"定 根 的 部 分 各 是 哪 一 种 营养 器 官 ?\n2. 在 日 常生 活 中 ， 你 还 知道 哪些 植物 可 以 通过 营养 器 官 繁殖 后 代 ?\n落地 生根 的 叶 、 甘 暮 的 块根 、 马 铃 划 的 块茎 以 及 草莓 的 币 灸 茎 上 都 能 发\n芽 、 生 根 ， 长 出 新 的 植物 体 。 在 农业 生产 和 园艺 工作 中 ， 人 们 创造 了 一 些 人 工\n营养 繁殖 的 方法 ， 如 插 插 、 嫁 接 和 压条 等 来 培育 果树 和 花 开 等 (»Pp103) 。\n营养 繁殖 是 通过 母体 的 营养 器 官 产 生子 代 新 个 体 ， 后 代 可 保持 母体 的 优良\n遗传 性 状 。 在 生产 实践 中 ， 无 法 用 种 子 繁殖 的 植物 ， 或 者 用 种 子 很 难 繁殖 的 植\n物 ， 都 可 以 通过 营养 繁殖 的 方式 来 培育 植物 。\n植物 的 组 织 培养 v\n植物 的 组 织 培 养 (tissue culture ) ， 是 一 种 植物 快速 繁殖 的 技术 。 图 19-3\n表示 的 是 人 们 利用 生物 技术 将 某 种 植物 的 叶片 培育 成 完整 植物 体 的 过 程 。\n仔细 观察 图 19-3， 与 同学 分 析 讨 论 植物 组 织 培养 的 过 程 ( 昔 萌 p.104 ) 。\nCD 一 一 人\n- 一 一 4 一 S\n人 在 无 菌 条 件 下 ， “小 块 ”不 愈 伤 组 织 分 化 逐渐\n将 “小 块 ” 接 种 在 断 分 裂 形 成 愈 发 育成 完整 的 植物\n培养 基 上 伤 组 织 体 一 一 幼苗\n图\n切取 植物 AN\n或 其 他 组 织 器 官\n的 小 块\n叶片 移 栽\n图 19-3 ”植物 组 织 培养 示意 图\n_ 95\n=== 第 4 页 ===\n利用 组 织 培养 技术 ,不仅 能 快速 繁殖 植物 ， 保 持 品种 的 优良 性 状 ， 还 可 以\n防止 植物 病菌 的 危害 。 例 如 ， 在 花卉 栽培 中 ,科学 家 利用 康 乃 志 植株 的 一 个 菠\n尖 ， 一 年 之 中 就 可 以 繁殖 出 上 百 万 株 康 乃 世 的 试管 种 苗 。 目 前 ,在 桑 、 甘蔗、",2.0,80.01408450704226,苏科版_八年级_义务教育教科书·生物学八年级上册,1,2025-07-21T14:25:09.108Z,2.0,义务教育教科书·生物学八年级上册,/Users/LeoQin/Documents/GitHub/PDFconvertor/training_data/初中/生物学/苏科版-江苏凤凰科学技术出版社/八年级/义务教育教科书·生物学八年级上册.pdf,八年级,tesseract.js-parallel,unknown,0.85,0.5,1,80.01408450704226,,true,,true,true,,biology,上册,苏科版_八年级_义务教育教科书·生物学八年级上册.json,生物,142,初中_生物学_苏科版_八年级_义务教育教科书·生物学八年级上册
苏科版_八年级_义务教育教科书·生物学八年级上册_chunk_1,1,"养示意图 _ 95 利用组 织培养技术 ,不仅能 快速繁殖植物， 保持 品种的 优良性 状， 还可 以防止植物病菌的 危害。 例如， 在花卉栽培中 ,科学家 利用康 乃志 植株的 一个 菠尖， 一年 之中 就可 以繁殖出 上百 万株 康乃 世的 试管种 苗。 目前 ,在桑 、 甘蔗、 和葡萄、 苹果 、 兰花 等植物的 种植 中， 大多 采用组 织培养技术进行快速繁殖。 我国 已经 用花药培育出 许多优质高 产的 小麦 、 水稻 等新 品种， 在组 织培养技术的 某些 方面已 经处 于世界领先地 位。 从观察植物生长的 过程 取常 见的 植物种 子如 大豆 、 恤豆 、 王米 的种 子， 在适合的 气温条 件下 播种到 土壤里， 每天 浇适 量的 水， 注意 观察 种子 在什么时 候萌 发。 待种 子萌发出 幼苗后， 小心地照料它们长 大， 直到 它们产生自己的 种子。 记录 下你 的观察过 程与 结果， 并与 同学进行交流。 Cs 科学 . 技术 . 社会人 工秋子人 工种子 是根据天 然种 子具 有的 结构， 运用 植物组 织培养技术， 培养 具有胚芽 、 胚根 、 胚轴 等结构的 植物胚 状体， 并且 用适当的 方法将 胚状 体包 衷起 来而 获得的。 人工种子 的结构由 人工种皮 、 胚状 体和 人工 胚乳 组成。 人工种皮具有 保护胚 状体 的作用， 人工 肛乳 可以 提供胚 状体 发育 所需 的营 养。 人工种子 可以 较好 地解决一 些作 物种子 发芽 率人 工种皮 低和 繁殖能 力差 的问题， 也可 以进行工业化 生产， 推动农业自动化 的进程。 例如， 利用 人工种子 生产",707,0.5909456571024662,medium-low,ocr,"养 示意 图\n_ 95\n=== 第 4 页 ===\n利用 组 织 培养 技术 ,不仅 能 快速 繁殖 植物 ， 保 持 品种 的 优良 性 状 ， 还 可 以\n防止 植物 病菌 的 危害 。 例 如 ， 在 花卉 栽培 中 ,科学 家 利用 康 乃 志 植株 的 一 个 菠\n尖 ， 一 年 之 中 就 可 以 繁殖 出 上 百 万 株 康 乃 世 的 试管 种 苗 。 目 前 ,在 桑 、 甘蔗、\n和 葡萄、 苹果 、 兰 花 等 植物 的 种 植 中 ， 大 多 采用 组 织 培养 技术 进行 快速 繁殖 。 我\n国 已 经 用 花药 培育 出 许多 优质 高 产 的 小 麦 、 水 稻 等 新 品种 ， 在 组 织 培养 技术 的\n某 些 方面 已 经 处 于 世界 领先 地 位 。\n从\n观察 植物 生长 的 过 程\n取 常 见 的 植物 种 子 如 大 豆 、 恤 豆 、 王 米 的 种 子 ， 在 适合 的 气温 条 件 下 播种 到\n土壤 里 ， 每 天 浇 适 量 的 水 ， 注 意 观 察 种 子 在 什么 时 候 萌 发 。 待 种 子 萌发 出 幼苗\n后 ， 小 心地 照料 它们 长 大 ， 直 到 它们 产生 自己 的 种 子 。 记 录 下 你 的 观察 过 程 与\n结果 ， 并 与 同学 进行 交流 。\n@@ @@\nCs 科学 . 技术 . 社会\n人 工 秋子\n人 工种 子 是 根据 天 然 种 子 具 有 的 结构 ， 运 用 植物 组 织 培养 技术 ， 培 养 具有 胚芽 、\n胚 根 、 胚 轴 等 结构 的 植物 胚 状 体 ， 并 且 用 适当 的 方法 将 胚 状 体 包 衷 起 来 而 获得 的 。\n人 工种 子 的 结构 由 人 工种 皮 、 胚 状 体 和 人 工 胚 乳 组 成 。 人 工种 皮具 有 保护 胚\n状 体 的 作用 ， 人 工 肛 乳 可 以 提供 胚 状 体 发 育 所 需\n的 营 养 。\n人 工种 子 可 以 较 好 地 解决 一 些 作 物种 子 发 芽 率 人 工种 皮\n低 和 繁殖 能 力 差 的 问题 ， 也 可 以 进行 工业 化 生产 ，\n推动 农业 自动 化 的 进程 。 例 如 ， 利 用 人 工种 子 生 产",2.0,80.01408450704226,苏科版_八年级_义务教育教科书·生物学八年级上册,2,2025-07-21T14:25:09.108Z,2.0,义务教育教科书·生物学八年级上册,/Users/LeoQin/Documents/GitHub/PDFconvertor/training_data/初中/生物学/苏科版-江苏凤凰科学技术出版社/八年级/义务教育教科书·生物学八年级上册.pdf,八年级,tesseract.js-parallel,unknown,0.9047619047619048,0.5,1,80.01408450704226,,true,,true,,,biology,上册,苏科版_八年级_义务教育教科书·生物学八年级上册.json,生物,142,初中_生物学_苏科版_八年级_义务教育教科书·生物学八年级上册
苏科版_八年级_义务教育教科书·生物学八年级上册_chunk_2,2,和人 工胚 乳组 成。 人工种皮具有 保护胚 状体 的作用， 人工 肛乳 可以 提供胚 状体 发育 所需 的营 养。 人工种子 可以 较好 地解决一 些作 物种子 发芽 率人 工种皮 低和 繁殖能 力差 的问题， 也可 以进行工业化 生产， 推动农业自动化 的进程。 例如， 利用 人工种子 生产 技术， 可在 20 天内 生产胡 荔下 的人 工种子 达 1 000 胚状 体万 粒， 满足 几千 公项 农田的 种植 需要。 此外， 在人 人工 胚乳工种子 的胚乳中 可添加一 些附 加成 分， 如除草剂 、 固氮细菌 、 防病 虫农药和 植物激素类 似物， 这些 都人 工种子 示意图 有利于幼苗的 苗半 成长。 96， 第 2 节植物的 生长发 育人 们常常认为种 子的 萌发是 植物个 体生 命的 开始， 其实在种 子里 已有 一株 幼小的 植株。 因此， 绿色 开花 植物 的个 体发 育是 从受精卵 开始 的。 受精 卵在 胚珠 里发 育成豚， 豚珠 发育成种 子。 种子 在适宜的 环境条 件下， 萌发 成幼苗， 经过 生长 、 发育 直至开花 、 结果， 从而 完成绿色开花植物生命周期的 过程。 种子 的结构 Y 各种 植物的 种子， 虽然 大小 、 形状 、 颜色 各不 一样， 但是 它们的 结构基本相同。 O 观察种 子的 形态和 结构国 方去 实验材料和 用具 1. 取 1 镁浸 软的 蚕豆种 子 ( p.103) 或玉米浸泡过 的蚕豆种 子 (区 p.103 ) 等其 他种 子， 观察 它的 形状以 及种 皮或 其他 种子 、 刹子 、 放的 颜色。 大镜 、 刀片 、 碘液 等 2. 剥掉 种皮 或训 开种 子， 观察 里面 的且。 用,735,0.5654925169873214,medium-low,ocr,和 人 工 胚 乳 组 成 。 人 工种 皮具 有 保护 胚\n状 体 的 作用 ， 人 工 肛 乳 可 以 提供 胚 状 体 发 育 所 需\n的 营 养 。\n人 工种 子 可 以 较 好 地 解决 一 些 作 物种 子 发 芽 率 人 工种 皮\n低 和 繁殖 能 力 差 的 问题 ， 也 可 以 进行 工业 化 生产 ，\n推动 农业 自动 化 的 进程 。 例 如 ， 利 用 人 工种 子 生 产\n技术 ， 可 在 20 天 内 生产 胡 荔 下 的 人 工种 子 达 1 000 胚 状 体\n万 粒 ， 满 足 几 千 公 项 农田 的 种 植 需要 。 此 外 ， 在 人 人 工 胚乳\n工种 子 的 胚乳 中 可 添加 一 些 附 加 成 分 ， 如 除草 剂 、\n固氮 细菌 、 防 病 虫 农药 和 植物 激素 类 似 物 ， 这 些 都 人 工种 子 示意 图\n有 利于 幼苗 的 苗 半 成 长 。\n96 ，\n=== 第 5 页 ===\n第 2 节 植物 的 生长 发 育\n人 们 常常 认为 种 子 的 萌发 是 植物 个 体 生 命 的 开始 ， 其 实在 种 子 里 已 有 一 株\n幼小 的 植株 。 因 此 ， 绿 色 开 花 植 物 的 个 体 发 育 是 从 受精 卵 开 始 的 。 受 精 卵 在 胚\n珠 里 发 育成 豚 ， 豚 珠 发 育成 种 子 。 种 子 在 适宜 的 环境 条 件 下 ， 萌 发 成 幼苗 ， 经\n过 生长 、 发 育 直至 开花 、 结 果 ， 从 而 完成 绿色 开花 植物 生命 周期 的 过 程 。\n种 子 的 结构 Y\n各 种 植物 的 种 子 ， 虽 然 大 小 、 形 状 、 颜 色 各 不 一 样 ， 但 是 它们 的 结构 基本\n相同 。\nO 观察 种 子 的 形态 和 结构\n国 方 去] 实验 材料 和 用 具\n1. 取 1 镁 浸 软 的 蚕豆 种 子 (»p.103) 或 玉米 浸泡 过 的 蚕豆 种 子\n(区 p.103 ) 等 其 他 种 子 ， 观 察 它 的 形状 以 及 种 皮 | 或 其 他 种 子 、 刹 子 、 放\n的 颜色 。 大 镜 、 刀片 、 碘 液 等\n2. 剥 掉 种 皮 或 训 开 种 子 ， 观 察 里 面 的 且 。 用,2.0,80.01408450704226,苏科版_八年级_义务教育教科书·生物学八年级上册,3,2025-07-21T14:25:09.108Z,2.0,义务教育教科书·生物学八年级上册,/Users/LeoQin/Documents/GitHub/PDFconvertor/training_data/初中/生物学/苏科版-江苏凤凰科学技术出版社/八年级/义务教育教科书·生物学八年级上册.pdf,八年级,tesseract.js-parallel,unknown,0.8638941398865785,0.5,1,80.01408450704226,,true,,true,,,biology,上册,苏科版_八年级_义务教育教科书·生物学八年级上册.json,生物,142,初中_生物学_苏科版_八年级_义务教育教科书·生物学八年级上册
苏科版_八年级_义务教育教科书·生物学八年级上册_chunk_3,3,和结构国 方去 实验材料和 用具 1. 取 1 镁浸 软的 蚕豆种 子 ( p.103) 或玉米浸泡过 的蚕豆种 子 (区 p.103 ) 等其 他种 子， 观察 它的 形状以 及种 皮或 其他 种子 、 刹子 、 放的 颜色。 大镜 、 刀片 、 碘液 等 2. 剥掉 种皮 或训 开种 子， 观察 里面 的且。 用放大镜 辨认豚 芽 、 胚根 和胚 轴的 位置， 数一 数有 几片 子叶。 想一 想 : 它们各 有什么作用 ? 3. 在种 子的 剖面上 滴一 滴稀 释的 矶液， 观察 哪一 部分 被染 成了 蓝色。 想一 想 : 种子 里贮存着 哪一 种营养物质 ? 4. 根据实验， 对照 图 19 4 或图 19 5， 尝试 画出 你所 观察的 种子 的结构科 图 o 种皮 计生子叶种 孔豚 册种 脐胚 根一 一一 一图 19 4 蚕豆种 子的 外形 和结构图 97 5 s 一人 果皮和 种皮， 和 v K 会号， 胚轴 人二 胚根 R.; : 图 19 5 玉米种 子的 外形 和结构图 ( 番红 固绿 染色 ) 他 . 半 1. 种子 的结构由 哪几 部分 组成 ? 蚕豆与 玉米种 子的 结构有 什么异同 ? 2. 绿色开花植物的 发育 是以 种子 开始 的吗 ? 为什么 ? 大豆 、 油菜 、 苹果 等许多植物的 种子 与重 豆种 子的 结构相同， 都有 种皮 和豚， 而豚 有两 片子叶。 小麦 、 水稻 、 高梁 等许多植物的 种子 与玉米种 子的 结构相同， 都有 种皮 、 胚乳 和胚， 而且 豚只 有一 片子时。 由此 可知， 不同 植物的 种子 有相同的 基本结构。 植物 的种 子都 有种 皮和 胚， 胚可 以发 育成植物体， 是新,735,0.48836694424551075,medium-low,ocr,和 结构\n国 方 去] 实验 材料 和 用 具\n1. 取 1 镁 浸 软 的 蚕豆 种 子 (»p.103) 或 玉米 浸泡 过 的 蚕豆 种 子\n(区 p.103 ) 等 其 他 种 子 ， 观 察 它 的 形状 以 及 种 皮 | 或 其 他 种 子 、 刹 子 、 放\n的 颜色 。 大 镜 、 刀片 、 碘 液 等\n2. 剥 掉 种 皮 或 训 开 种 子 ， 观 察 里 面 的 且 。 用\n放大 镜 辨认 豚 芽 、 胚 根 和 胚 轴 的 位 置 ， 数 一 数 有 几 片 子叶 。 想 一 想 : 它们 各 有\n什么 作用 ?\n3. 在 种 子 的 剖面 上 滴 一 滴 稀 释 的 矶 液 ， 观 察 哪 一 部 分 被 染 成 了 蓝 色 。 想\n一 想 : 种 子 里 贮存 着 哪 一 种 营养 物质 ?\n4. 根据 实验 ， 对 照 图 19-4 或 图 19-5， 尝 试 画 出 你 所 观察 的 种 子 的 结构\n科 图 o\n种 皮\n计生 子叶\n种 孔 豚 册\n种 脐 胚 根 一 一 一 一\n图 19-4 蚕豆 种 子 的 外 形 和 结构 图\n97\n=== 第 6 页 ===\n5\ns 一 人\n- 果皮 和 种 皮 ， 和\nv K 会 号， 胚 轴\n人 二 胚 根\nR.; NS\n: 图 19-5 玉米 种 子 的 外 形 和 结构 图 ( 番 红 - 固 绿 染 色 )\n他 -. 半\n1. 种 子 的 结构 由 哪 几 部 分 组 成 ? 蚕豆 与 玉米 种 子 的 结构 有 什么 异同 ?\n2. 绿色 开花 植物 的 发 育 是 以 种 子 开 始 的 吗 ? 为 什么 ?\n大 豆 、 油 菜 、 苹 果 等 许多 植物 的 种 子 与 重 豆 种 子 的 结构 相同 ， 都 有 种 皮 和\n豚 ， 而 豚 有 两 片子 叶 。 小 麦 、 水 稻 、 高 梁 等 许多 植物 的 种 子 与 玉米 种 子 的 结构\n相同 ， 都 有 种 皮 、 胚 乳 和 胚 ， 而 且 豚 只 有 一 片子 时。 由 此 可 知 ， 不 同 植物 的 种\n子 有 相同 的 基本 结构 。 植 物 的 种 子 都 有 种 皮 和 胚 ， 胚 可 以 发 育成 植物 体 ， 是 新,2.0,80.01408450704226,苏科版_八年级_义务教育教科书·生物学八年级上册,4,2025-07-21T14:25:09.108Z,2.0,义务教育教科书·生物学八年级上册,/Users/LeoQin/Documents/GitHub/PDFconvertor/training_data/初中/生物学/苏科版-江苏凤凰科学技术出版社/八年级/义务教育教科书·生物学八年级上册.pdf,八年级,tesseract.js-parallel,unknown,0.8176470588235294,0.5,1,80.01408450704226,,true,,true,true,,biology,上册,苏科版_八年级_义务教育教科书·生物学八年级上册.json,生物,142,初中_生物学_苏科版_八年级_义务教育教科书·生物学八年级上册
苏科版_八年级_义务教育教科书·生物学八年级上册_chunk_4,4,都有 种皮 和豚， 而豚 有两 片子叶。 小麦 、 水稻 、 高梁 等许多植物的 种子 与玉米种 子的 结构相同， 都有 种皮 、 胚乳 和胚， 而且 豚只 有一 片子时。 由此 可知， 不同 植物的 种子 有相同的 基本结构。 植物 的种 子都 有种 皮和 胚， 胚可 以发 育成植物体， 是新 植物体 的幼体， 所以 胚是 种子 的主要部 分。 许多 植物的 种子， 只要 胚是 活的， 在适宜的 外界 条件 下， 就可 以萌发， 长出 幼苗。 种子 的萌 点 v 你有 过栽种植物的 经历 吗 ? 播种的 时候， 不仅 选择 的种 子要 完好， 还需要一 定的 外界 条件， 种子 才能 萌发。 O 探究种 子萌发的 外界 条件 生活经 验告 诉我 们， 植物 的播种具有一 定的 季节性。 播种 前要 松土， 播种 后要 及时 进行庶 水等 管理， 以保证种 子的 萌发。 水分 、 温度 和光照对 种子 的萌发具有影响吗 ? 下表 所示 是种 子萌发的 有关 实验。 1 税是， iu 有大 丁力 1 98 从上 述的 实验项 目中 选择一 项， 设计 一个 完整的 探究实验报告。 提出问题你 提出的 问题是 : 作出假设你 的假设是 : 制订计划实施计划 1. 根据实验方案， 把准备好 的种 子 〈 如蚕豆 、 大豆 或其 他植物的 种子 ) 放在 小组 设置的 外界 条件 中。 2. 每天 观察种 子萌 发的 情况， 把实验数据记录在 小组 设计的 表格中。 探究技能榨 制变量影响实验结果的 变量有 两类 : 一类 是本 实验所 要研究的 因素， 称为 实验变量 ;,694,0.5751607023220404,medium-low,ocr,都 有 种 皮 和\n豚 ， 而 豚 有 两 片子 叶 。 小 麦 、 水 稻 、 高 梁 等 许多 植物 的 种 子 与 玉米 种 子 的 结构\n相同 ， 都 有 种 皮 、 胚 乳 和 胚 ， 而 且 豚 只 有 一 片子 时。 由 此 可 知 ， 不 同 植物 的 种\n子 有 相同 的 基本 结构 。 植 物 的 种 子 都 有 种 皮 和 胚 ， 胚 可 以 发 育成 植物 体 ， 是 新\n植物 体 的 幼体 ， 所 以 胚 是 种 子 的 主要 部 分 。 许 多 植物 的 种 子 ， 只 要 胚 是 活 的 ，\n在 适宜 的 外 界 条 件 下 ， 就 可 以 萌发 ， 长 出 幼苗 。\n种 子 的 萌 点 ~v\n你 有 过 栽种 植物 的 经 历 吗 ? 播种 的 时 候 ， 不 仅 选 择 的 种 子 要 完好 ， 还 需要\n一 定 的 外 界 条 件 ， 种 子 才 能 萌发 。\nO 探究 种 子 萌发 的 外 界 条 件\n生活 经 验 告 诉 我 们 ， 植 物 的 播种 具有 一 定 的 季节 性 。 播 种 前 要 松 土 ， 播\n种 后 要 及 时 进行 庶 水 等 管理 ， 以 保证 种 子 的 萌发 。 水 分 、 温 度 和 光照 对 种 子\n的 萌发 具有 影响 吗 ? 下 表 所 示 是 种 子 萌发 的 有 关 实 验 。\n1 | 税 | 是，\n|- iu\n有 大 丁力\n1 98\n=== 第 7 页 ===\n从 上 述 的 实验 项 目 中 选择 一 项 ， 设 计 一 个 完整 的 探究 实验 报告 。\n提出 问题\n你 提出 的 问题 是 :\n作出 假设\n你 的 假设 是 :\n制订 计划\n实施 计划\n1. 根据 实验 方案 ， 把 准备 好 的 种 子 〈 如 蚕豆 、 大 豆 或 其 他 植物 的 种\n子 ) 放 在 小 组 设置 的 外 界 条 件 中 。\n2. 每 天 观察 种 子 萌 发 的 情况 ， 把 实验 数据 记录 在 小 组 设计 的 表格 中 。\n探究 技能\n榨 制 变量\n影响 实验 结果 的 变量 有 两 类 : 一 类 是 本 实验 所 要 研究 的 因素 ， 称 为 实验 变量 ;,2.0,80.01408450704226,苏科版_八年级_义务教育教科书·生物学八年级上册,5,2025-07-21T14:25:09.108Z,2.0,义务教育教科书·生物学八年级上册,/Users/LeoQin/Documents/GitHub/PDFconvertor/training_data/初中/生物学/苏科版-江苏凤凰科学技术出版社/八年级/义务教育教科书·生物学八年级上册.pdf,八年级,tesseract.js-parallel,unknown,0.8829365079365079,0.5,1,80.01408450704226,,true,,true,true,,biology,上册,苏科版_八年级_义务教育教科书·生物学八年级上册.json,生物,142,初中_生物学_苏科版_八年级_义务教育教科书·生物学八年级上册
