Chunk_ID,Chunk_Index,Content,Content_Length,Quality_Score,Reliability,Source_Type,Original_Content,Enhancement_Version,averageConfidence,book_name,chunkIndex,enhancementTimestamp,enhancementVersion,fileName,filePath,grade,ocrMethod,publisher,qualityMetrics_chineseCharRatio,qualityMetrics_coherenceScore,qualityMetrics_lengthScore,qualityMetrics_ocrConfidence,semanticFeatures_hasDefinition,semanticFeatures_hasExperiment,semanticFeatures_hasFormulas,semanticFeatures_hasNumbers,semanticFeatures_hasQuestion,semanticFeatures_isTableContent,semanticFeatures_subjectArea,semester,source_file,subject,totalPages,uniqueId
苏科版_八年级_义务教育教科书·生物学八年级上册_chunk_90,90,观察 动物行为的 类型 探究 蚂蚁 的砚 食行为人 7 嗓第 1 节人 体的 运动人 体能够 进行各 种运动。 运动 场上， 我们 能够 灵活地 运球 投篮 ; 健身房 里， 我们 能够 舒展健美的 舞姿。 当身体感受器 官受 到一 定的 刺激后， 就可 以作 出相应的 反应。 身体 各部 分的 运动是 一种 最主要的 反应。 人体 进行 的每 一项 运动， 都是 在神经系统和 内分 泥系 统的 支配下， 由骨骼肌 收缩 和舒张， 牵引所 附着的 骨， 绕着 骨连 结活动而 形成的。 骨 、 骨连结和 骨骼肌 组成 了人 体的 运动 系统。 人体 的支架一 一骨骼 v 一座 大楼 往往需要地 基和 搁体内的 钢筋骨架来 支撑。 在人 体的 内部 也有 一个 类似 的能 支撑身体并 支持运动的 支架， 这就 是人 体的 骨骼。 O 观察人 体的 骨骼组 成仔细观察图 17 1， 并对 照自己的 身体， 认识 人体 骨骼 的组 成。 头骨锁骨二， 肩有 骨肪 肯 Z 三全 肋骨。 轴十 骨和 于生生尺 肯 an _on 7) 下 p_ 股骨迟 骨下 肢骨 豚骨 腓骨图 17 1 人体 的骨骼组 成模式图 _59 1. 人体 的骨骼分 为哪 几大 部分 ? 2. 联系大 楼中 钢筋的 作用， 想一 想骨 骼对 人体 有哪些作用。 人体 的骨骼由 206 块骨 连结 而成。 它们 分为 头骨 (skull ) 、 船王 骨 (trunk skeleton ) 人体 的骨骼非常坚固， 和四 肢骨 (appendicular skeleton ) 三大 部但 很轻， 约占 成年 人体重的 分。 人体 的骨骼支持着 身体并 且保 护着 脑 、,726,0.42213875545743823,medium-low,ocr,观 察 动物 行为 的 类 型 = ER »\n@ 探 究 蚂 蚁 的 砚 食 行为 人 7 嗓\n<\n=== 第 104 页 ===\n第 1 节 ”人 体 的 运动\n人 体能 够 进行 各 种 运动 。 运 动 场 上 ， 我 们 能 够 灵活 地 运 球 投篮 ; 健身 房\n里 ， 我 们 能 够 舒展 健美 的 舞姿 。 当 身体 感受 器 官 受 到 一 定 的 刺激 后 ， 就 可 以 作\n出 相应 的 反应 。 身 体 各 部 分 的 运动 是 一 种 最 主要 的 反应 。 人 体 进 行 的 每 一 项 运\n动 ， 都 是 在 神经 系统 和 内 分 泥 系 统 的 支配 下 ， 由 骨骼 肌 收 缩 和 舒张， 牵引 所\n附着 的 骨 ， 绕 着 骨 连 结 活动 而 形成 的 。 骨 、 骨 连结 和 骨骼 肌 组 成 了 人 体 的 运\n动 系统 。\n人 体 的 支架 一 一 骨骼 v\n一 座 大 楼 往往 需要 地 基 和 搁 体内 的 钢筋 骨架 来 支撑 。 在 人 体 的 内 部 也 有 一\n个 类 似 的 能 支撑 身体 并 支持 运动 的 支架 ， 这 就 是 人 体 的 骨骼 。\nO 观察 人 体 的 骨骼 组 成\n仔细 观察 图 17-1， 并 对 照 自己 的 身体 ， 认 识 人 体 骨 骼 的 组 成 。\n头骨\n|\n锁骨 二 ，\n肩 有 骨 == |\n肪 肯 Z 三 全 肋骨 。 轴 十 骨\n和 于 生生\n- \\n尺 肯 \\nan |_on [7)\n下 p_-\n股骨\n迟 骨\n下 肢 骨 豚 骨 |\n腓骨\n图 17-1 人 体 的 骨骼 组 成 模式 图\n_59\n=== 第 105 页 ===\n1. 人 体 的 骨骼 分 为 哪 几 大 部 分 ?\n2. 联系 大 楼 中 钢筋 的 作用 ， 想 一 想 骨 骼 对 人 体 有 哪些 作用 。\n人 体 的 骨骼 由 206 块 骨 连 结 而 成 。 它 们 分\n为 头骨 (skull ) 、 船 王 骨 (trunk skeleton )\n人 体 的 骨骼 非常 坚固 ， 和 四 肢 骨 (appendicular skeleton ) 三 大 部\n但 很 轻 ， 约 占 成 年 人 体重 的 分 。 人 体 的 骨骼 支持 着 身体 并 且 保 护 着 脑 、,2.0,80.01408450704226,苏科版_八年级_义务教育教科书·生物学八年级上册,119,2025-07-21T14:25:09.110Z,2.0,义务教育教科书·生物学八年级上册,/Users/LeoQin/Documents/GitHub/PDFconvertor/training_data/初中/生物学/苏科版-江苏凤凰科学技术出版社/八年级/义务教育教科书·生物学八年级上册.pdf,八年级,tesseract.js-parallel,unknown,0.7996219281663516,0.5,1,80.01408450704226,,true,,true,true,,physics,上册,苏科版_八年级_义务教育教科书·生物学八年级上册.json,生物,142,初中_生物学_苏科版_八年级_义务教育教科书·生物学八年级上册
苏科版_八年级_义务教育教科书·生物学八年级上册_chunk_91,91,体有 哪些作用。 人体 的骨骼由 206 块骨 连结 而成。 它们 分为 头骨 (skull ) 、 船王 骨 (trunk skeleton ) 人体 的骨骼非常坚固， 和四 肢骨 (appendicular skeleton ) 三大 部但 很轻， 约占 成年 人体重的 分。 人体 的骨骼支持着 身体并 且保 护着 脑 、 20 和， 全身 的肌肉重量一 般 、 、 、 人要 占体重的 3596 40 . 并则 以及 心脏等 内脏 器官。 分布 在全 身各 处的 骨的 形态 、 大小 各不 相同， 但骨 的基本结构却 基本 相同。 在人 体的 运动中 长骨 具有 杠杆的 作用。 我们 以长 骨为 例来 研究骨 的结构 ( p71)。 O 观察长 骨的 结构详 验材料和 用有 具 mF Er 取一 块新 鲜的 猪的 解剖刀 、 令子 等长 骨 ( 如股骨 )， 用锯 子把 它纵向锯 开， 从外 向内 依次观察。 1. 用解剖刀 从骨 的表面刊 离出 一层 膜， . _ 骨松 质结构琉 松， 2， 骨密 质致 密坚 便， 吗 ? 观察骨膜的 颜色， 抗压力强 里面 有血管吗 ? 骨丹 中的 红骨 佣 2 对照 图 17 2， 观具有造血功能察 长肯 纵剖面上 的肯 松。 ne 质和 骨密 质。 看一 看 :。 神经人形册 这两 种骨 质分 别位 于长 血管骨 的什么部 位 ? 它们的 结结构有 什么不 同 ? 图 17 2 长骨 的结构示意图 60 3. 观察骨 散分 布在 什么部 位， 是什么颜色， 用解剖刀 除去 中央 一部 分骨 散， 可以 看到 中空 的骨髓腔， 说明 长骨 是管状的。 全 1. 长骨 是由 哪几 部分 组成 的 ? 这样 的结构对 于骨 的支持功能有 什么意义 ?,757,0.45401313273959926,medium-low,ocr,体 有 哪些 作用 。\n人 体 的 骨骼 由 206 块 骨 连 结 而 成 。 它 们 分\n为 头骨 (skull ) 、 船 王 骨 (trunk skeleton )\n人 体 的 骨骼 非常 坚固 ， 和 四 肢 骨 (appendicular skeleton ) 三 大 部\n但 很 轻 ， 约 占 成 年 人 体重 的 分 。 人 体 的 骨骼 支持 着 身体 并 且 保 护 着 脑 、\n20 和 %， 全 身 的 肌肉 重量 一 般 、 、 、 人\n要 占 体重 的 3596 ~ 40%. 并 则 以 及 心脏 等 内 脏 器 官 。\n分 布 在 全 身 各 处 的 骨 的 形态 、 大 小 各 不\n相同 ， 但 骨 的 基本 结构 却 基 本 相同 。 在 人 体\n的 运动 中 长 骨 具 有 杠杆 的 作用 。 我 们 以 长 骨 为 例 来 研究 骨 的 结构 (»p71) 。\nO 观察 长 骨 的 结构\n详 验 材料 和 用 有 具\nmF = Er\n取 一 块 新 鲜 的 猪 的 解剖 刀 、 令 子 等\n长 骨 ( 如 股骨 ) ， 用 锯\n子 把 它 纵向 锯 开 ， 从 外\n向 内 依次 观察 。\n1. 用 解剖 刀 从 骨\n的 表面 刊 离 出 一 层 膜 ，\n. _— 骨 松 质 结构 琉 松 ，\n2 |\n， 骨 密 质 致 密 坚 便 ，\n吗 ? 观察 骨膜 的 颜色 ， 抗 压力 强\n里 面 有 血管 吗 ?\n骨 丹 中 的 红 骨 佣\n2 对 照 图 17-2， 观 具有 造血 功能\n察 长 肯 纵 剖面 上 的 肯 松 。 ne\n质 和 骨 密 质 。 看 一 看 : 。 神经 人形 册\n这 两 种 骨 质 分 别 位 于 长 血管\n骨 的 什么 部 位 ? 它们 的\n结 NE\n结构 有 什么 不 同 ? 图 17-2 长 骨 的 结构 示意 图\n60\n=== 第 106 页 ===\n3. 观察 骨 散 分 布 在 什么 部 位 ， 是 什么 颜色 ， 用 解剖 刀 除 去 中 央 一 部 分 骨\n散 ， 可 以 看 到 中 空 的 骨髓 腔 ， 说 明 长 骨 是 管状 的 。\n全\n1. 长 骨 是 由 哪 几 部 分 组 成 的 ? 这 样 的 结构 对 于 骨 的 支持 功能 有 什么\n意义 ?,2.0,80.01408450704226,苏科版_八年级_义务教育教科书·生物学八年级上册,120,2025-07-21T14:25:09.110Z,2.0,义务教育教科书·生物学八年级上册,/Users/LeoQin/Documents/GitHub/PDFconvertor/training_data/初中/生物学/苏科版-江苏凤凰科学技术出版社/八年级/义务教育教科书·生物学八年级上册.pdf,八年级,tesseract.js-parallel,unknown,0.7597042513863216,0.5,1,80.01408450704226,,true,,true,true,,physics,上册,苏科版_八年级_义务教育教科书·生物学八年级上册.json,生物,142,初中_生物学_苏科版_八年级_义务教育教科书·生物学八年级上册
苏科版_八年级_义务教育教科书·生物学八年级上册_chunk_92,92,17 2 长骨 的结构示意图 60 3. 观察骨 散分 布在 什么部 位， 是什么颜色， 用解剖刀 除去 中央 一部 分骨 散， 可以 看到 中空 的骨髓腔， 说明 长骨 是管状的。 全 1. 长骨 是由 哪几 部分 组成 的 ? 这样 的结构对 于骨 的支持功能有 什么意义 ? 2. 发生 骨折 后， 骨能 够您 合吗 ? 为什么 ? 最娩 探究自己的 脚印。， 在人 的骨骼中， 足部 的一 些骨 和足 底的 韦带 、 肌内 共同构成了 一个 向上 谊曲 的吉 状结构。 这个 可状 结构叫 作足 可。 从科学上 来说， 当我 们 2 需要用 轻巧的 结构来 承受重量时， 可以 将它 设计 Ooc 成豆 形。 你注意过 自己的 脚底面 吗 ? 它们是 平面的， 还是 弯曲的 ? 正常中 准备一 块音 布， 一决 深色 的木板 (30 cmx 100 cm )， 将自己的 右脚 站在 湿布上， 然后 用沾 人湿 的脚 在木板上 踊一 个湿 脚钱， 立即 把它 画下 ) 来， 看看 像右 图中 的哪个脚印。 y 正常足 模型与 平足 模型相 比， 哪一 种能 承受一 更大 的压力 ? 平足 骨的 连结 v 想象一 下， 如果 你的 上肢 里只 有一 根连 结肩 和手 的骨， 你的 下肢 也只 有一 块连结腰 和足 的骨， 你能 运动自如吗 ? 人之 所以 能运动自如， 是因为人 体的 骨骼 是由 许多块 骨通 过不 同形式 的骨 连结 组合 而成 的。 骨的 连结有 不活动的 连结 、 半活动的 连结和 活动的 连结 3 种形式 〈 图 17 3 )。 骨和 人骨 之间 活动 的连结叫 作关节。 61 Q 8 本 LA 一 0 )) 4 于 J 一,734,0.3847353490728544,low,ocr,17-2 长 骨 的 结构 示意 图\n60\n=== 第 106 页 ===\n3. 观察 骨 散 分 布 在 什么 部 位 ， 是 什么 颜色 ， 用 解剖 刀 除 去 中 央 一 部 分 骨\n散 ， 可 以 看 到 中 空 的 骨髓 腔 ， 说 明 长 骨 是 管状 的 。\n全\n1. 长 骨 是 由 哪 几 部 分 组 成 的 ? 这 样 的 结构 对 于 骨 的 支持 功能 有 什么\n意义 ?\n2. 发 生 骨 折 后 ， 骨 能 够 您 合 吗 ? 为 什么 ?\n最 娩\n探究 自己 的 脚印\n@。%，\n在 人 的 骨骼 中 ， 足 部 的 一 些 骨 和 足 底 的 韦\n带 、 肌 内 共同 构成 了 一 个 向 上 谊 曲 的 吉 状 结构 。\n这 个 可 状 结构 叫 作 足 可 。 从 科学 上 来 说 ， 当 我 们 2\n需要 用 轻巧 的 结构 来 承受 重量 时 ， 可 以 将 它 设计 LA\nOoc\n成 豆 形 。 你 注意 过 自己 的 脚底 面 吗 ? 它们 是 平面\n的 ， 还 是 弯曲 的 ? 正常 中\n准备 一 块 音 布 ， 一 决 深 色 的 木板 (30 cmx\n100 cm ) ， 将 自己 的 右 脚 站 在 湿布 上 ， 然 后 用 沾 人\n湿 的 脚 在 木板 上 踊 一 个 湿 脚 钱 ， 立 即 把 它 画 下 )\n来 ， 看 看 像 右 图 中 的 哪个 脚印 。 y\n正常 足 模型 与 平 足 模型 相 比 ， 哪 一 种 能 承受 一\n更 大 的 压力 ?\n平 足\n骨 的 连结 v\n想象 一 下 ， 如 果 你 的 上 肢 里 只 有 一 根 连 结 肩 和 手 的 骨 ， 你 的 下 肢 也 只 有 一\n块 连结 腰 和 足 的 骨 ， 你 能 运动 自如 吗 ? 人 之 所 以 能 运动 自如 ， 是 因为 人 体 的 骨\n骼 是 由 许多 块 骨 通 过 不 同形 式 的 骨 连 结 组 合 而 成 的 。\n骨 的 连结 有 不 活动 的 连结 、 半 活动 的 连结 和 活动 的 连结 3 种 形式 〈 图\n17-3 ) 。 骨 和 人 骨 之 间 活 动 的 连结 叫 作 关节 。\n61\n=== 第 107 页 ===\nQ—— 8 RE\n本 AAS\nLA 一 0 ))\n4 于 | £ & J - -一,2.0,80.01408450704226,苏科版_八年级_义务教育教科书·生物学八年级上册,121,2025-07-21T14:25:09.110Z,2.0,义务教育教科书·生物学八年级上册,/Users/LeoQin/Documents/GitHub/PDFconvertor/training_data/初中/生物学/苏科版-江苏凤凰科学技术出版社/八年级/义务教育教科书·生物学八年级上册.pdf,八年级,tesseract.js-parallel,unknown,0.8333333333333334,0.6,1,80.01408450704226,,true,,true,true,,physics,上册,苏科版_八年级_义务教育教科书·生物学八年级上册.json,生物,142,初中_生物学_苏科版_八年级_义务教育教科书·生物学八年级上册
苏科版_八年级_义务教育教科书·生物学八年级上册_chunk_93,93,"的骨 骼是 由许多块 骨通 过不 同形式 的骨 连结 组合 而成 的。 骨的 连结有 不活动的 连结 、 半活动的 连结和 活动的 连结 3 种形式 〈 图 17 3 )。 骨和 人骨 之间 活动 的连结叫 作关节。 61 Q 8 本 LA 一 0 )) 4 于 J 一 2 m )) E : 加脑 颅骨 间的 不活动连结疹 椎骨 间的 半活 动连结信 关节 的活动连结图 17 3 骨连 结的 形式 O 观察关节关节是 骨连 结的 主要形式。 关节 的结构包括关节面 、 关节 吉和 关节有 舱三 部分 (图 17 4 )。 如果 没有 关节， 人体会像 木板 一样 僵硬。 仔细 观察 人的 几种 运动 方式与 关节的 典型结构， 分析 关节 的结构与 活动相 适应 的特点。 g ad ; h 二路 多。 户关 节本 4 全 4 1 oalil 1 河， 膝关 节 "" 关节圳 能把 相关节腔 内有 清邻 两骨 牢固 地连 液， 能够 润滑关节接 起来 软骨， 减少 摩氛 关节头 关节软骨是 关节面 表关节面 面光 滑的 部分， 能减少关节窜 两骨 的摩 探， 绥冲 运动 时产生的 震动韧带是 关节过 外面 的坚 韦的 结构， 使两 骨之 间的 连接更 牢回 图 17 4 关节的 结构示意图 62， 人 1. 联系平时的 运动， 你能 说说 关节在 人体内的 作用吗 ? 2. 关节分 为哪 几个 部分 ? 关节具有哪些适 于运动的 结构特点 ? 经常 参加体育锻炼能 增加关节的 牢固性 和和 柔韧性， 使人 体承受大 幅度活动的 能力 增强， 灵活性增加。 通常情况 下， 关节 是比较牢固的。 进行 运动时 如果",715,0.31970502170730475,low,ocr,"的 骨\n骼 是 由 许多 块 骨 通 过 不 同形 式 的 骨 连 结 组 合 而 成 的 。\n骨 的 连结 有 不 活动 的 连结 、 半 活动 的 连结 和 活动 的 连结 3 种 形式 〈 图\n17-3 ) 。 骨 和 人 骨 之 间 活 动 的 连结 叫 作 关节 。\n61\n=== 第 107 页 ===\nQ—— 8 RE\n本 AAS\nLA 一 0 ))\n4 于 | £ & J - -一\n2 m = )) E / :\n”加 SS\n脑 颅 骨 间 的 不 活动 连结 疹 椎 骨 间 的 半 活 动 连结 信 关 节 的 活动 连结\n图 17-3 ” 骨 连 结 的 形式\nO 观察 关节\n关节 是 骨 连 结 的 主要 形式 。 关 节 的 结构 包括 关节 面 、 关 节 吉 和 关节 有 舱 三 部\n分 (图 17-4 ) 。 如 果 没 有 关节 ， 人 体会 像 木 板 一 样 僵硬 。 仔 细 观 察 人 的 几 种 运\n动 方式 与 关节 的 典型 结构 ， 分 析 关 节 的 结构 与 活动 相 适 应 的 特点 。\ng ad ; h\n二 路 - AR 多 。 户 关 节\n本 4\n全 4\n1 \ oalil 1\n河 ，\n膝 关 节 ""\n关节 圳 能 把 相 关节 腔 内 有 清\n邻 两 骨 牢 固 地 连 液 ， 能 够 润滑 关节\n接 起 来 软骨 ， 减 少 摩 氛\n关节 头 关节 软骨 是 关节 面 表\n关节 面 面 光 滑 的 部 分 ， 能 减少\n关节 窜 两 骨 的 摩 探 ， 绥 冲 运 动\n时 产生 的 震动\n韧带 是 关节 过 外 面 的\n坚 韦 的 结构 ， 使 两 骨 之\n间 的 连接 更 牢 回\n图 17-4 关节 的 结构 示意 图\n62 ，\n=== 第 108 页 ===\n人\n1. 联系 平时 的 运动 ， 你 能 说 说 关节 在 人 体内 的 作用 吗 ?\n2. 关节 分 为 哪 几 个 部 分 ? 关节 具有 哪些 适 于 运动 的 结构 特点 ?\n经 常 参加 体育 锻炼 能 增加 关节 的 牢固 性 和 和 柔韧 性 ， 使 人 体 承受 大 幅度 活动\n的 能 力 增强 ， 灵 活性 增加 。 通 常情 况 下 ， 关 节 是 比较 牢固 的 。 进 行 运动 时 如 果",2.0,80.01408450704226,苏科版_八年级_义务教育教科书·生物学八年级上册,122,2025-07-21T14:25:09.110Z,2.0,义务教育教科书·生物学八年级上册,/Users/LeoQin/Documents/GitHub/PDFconvertor/training_data/初中/生物学/苏科版-江苏凤凰科学技术出版社/八年级/义务教育教科书·生物学八年级上册.pdf,八年级,tesseract.js-parallel,unknown,0.8352941176470589,0.5,1,80.01408450704226,,true,,true,true,,physics,上册,苏科版_八年级_义务教育教科书·生物学八年级上册.json,生物,142,初中_生物学_苏科版_八年级_义务教育教科书·生物学八年级上册
苏科版_八年级_义务教育教科书·生物学八年级上册_chunk_94,94,时的 运动， 你能 说说 关节在 人体内的 作用吗 ? 2. 关节分 为哪 几个 部分 ? 关节具有哪些适 于运动的 结构特点 ? 经常 参加体育锻炼能 增加关节的 牢固性 和和 柔韧性， 使人 体承受大 幅度活动的 能力 增强， 灵活性增加。 通常情况 下， 关节 是比较牢固的。 进行 运动时 如果 用力 过于 猛烈， 关节 头会 从关节窝 滑脱出来， 造成 脱白。 人体 大约 有 600 块骨骼肌， 它们 具有不 同的 功能。 有的 牵动嘴角使 你微 笑， 有的 则带动骨骼产生运动。 人体 的骨骼肌 可以 分为 头颈肌 、 躯和 干肌 和四 肢肌 三大 类。 O 观察人 体主 要骨骼肌 观察图 17， 看一 看全 身有 哪些主要的 骨骼肌， 并对 照图 在自己的 身体上 指出这 些主要骨骼肌 的位 置。 将它们分 别归 类， 填在 下页 的表格中。 win 4 ho! 斜方 肌胸 锁乳 突肌 h R 三角 肌胸 大肌 t 多 : 序珊 抽 S. V 腹直 肌 y 壁大 肌一 5 腓肠 肌股 四头 肌图 17 5 人体 主要 骨骼肌 示意图 63 1. 人体 的骨骼肌 主要分 为哪 几大 类 ? 它们各 由哪些骨骼肌 组成 ? 2. 做几 个动作体验一 下， 你能 说出 每个 动作主要有 哪些肌肉参与完 成的 吗 ? 骨骼肌 和包括肌 妥 、 肌腹 两个 部分 (图 17 6)。 肌腹 在中 间， 呈红 褐色， 主要 由肌 细胞组 成， 外面包有 结缔组 织膜， 里面 有许 多血管和 神经。 肌妥 在两 端， 呈白色， 由结 从缔 组织 组成。 肌妥 分别 附着在 不同 的骨 上。 血管一 上腊 在人 和动物体内， 骨骼 肌受到的 刺激主 中用,735,0.49893927523474185,medium-low,ocr,时 的 运动 ， 你 能 说 说 关节 在 人 体内 的 作用 吗 ?\n2. 关节 分 为 哪 几 个 部 分 ? 关节 具有 哪些 适 于 运动 的 结构 特点 ?\n经 常 参加 体育 锻炼 能 增加 关节 的 牢固 性 和 和 柔韧 性 ， 使 人 体 承受 大 幅度 活动\n的 能 力 增强 ， 灵 活性 增加 。 通 常情 况 下 ， 关 节 是 比较 牢固 的 。 进 行 运动 时 如 果\n用 力 过 于 猛烈 ， 关 节 头 会 从 关节 窝 滑 脱出 来 ， 造 成 脱 白 。\n人 体 大 约 有 600 块 骨骼 肌 ， 它 们 具有 不 同 的 功能 。 有 的 牵动 嘴角 使 你 微\n笑 ， 有 的 则 带动 骨骼 产生 运动 。 人 体 的 骨骼 肌 可 以 分 为 头颈 肌 、 躯 和 干 肌 和 四 肢\n肌 三 大 类 。\nO 观察 人 体 主 要 骨骼 肌\n观察 图 17-$， 看 一 看 全 身 有 哪些 主要 的 骨骼 肌 ， 并 对 照 图 在 自己 的 身体 上\n指出 这 些 主要 骨骼 肌 的 位 置 。 将 它们 分 别 归 类 ， 填 在 下 页 的 表格 中 。\nwin 4 ho! 斜 方 肌\n胸 锁 乳 突 肌 h- R 三 角 肌\n胸 大 肌\n=t\n多 : 序 珊 抽\nS.&\ V\nVE\n腹 直 肌 y 壁 大 肌\n一 5 腓 肠 肌\n股 四 头 肌\n图 17-5 人 体 主 要 骨骼 肌 示 意图\n63\n=== 第 109 页 ===\n1. 人 体 的 骨骼 肌 主要 分 为 哪 几 大 类 ? 它们 各 由 哪些 骨骼 肌 组 成 ?\n2. 做 几 个 动作 体验 一 下 ， 你 能 说 出 每 个 动作 主要 有 哪些 肌肉 参与 完\n成 的 吗 ?\n骨骼 肌 和 包括 肌 妥 、 肌 腹 两 个 部 分 (图\n17-6) 。 肌 腹 在 中 间 ， 呈 红 褐色 ， 主 要 由 肌\n细胞 组 成 ， 外 面包 有 结缔 组 织 膜 ， 里 面 有 许 |\n多 血管 和 神经 。 肌 妥 在 两 端 ， 呈 白色 ， 由 结 从\n缔 组 织 组 成 。 肌 妥 分 别 附着 在 不 同 的 骨 上 。 血管 一 上 腊\n在 人 和 动物 体内 ， 骨 骼 肌 受到 的 刺激 主 中 用,2.0,80.01408450704226,苏科版_八年级_义务教育教科书·生物学八年级上册,123,2025-07-21T14:25:09.110Z,2.0,义务教育教科书·生物学八年级上册,/Users/LeoQin/Documents/GitHub/PDFconvertor/training_data/初中/生物学/苏科版-江苏凤凰科学技术出版社/八年级/义务教育教科书·生物学八年级上册.pdf,八年级,tesseract.js-parallel,unknown,0.8547169811320755,0.5,1,80.01408450704226,,true,,true,true,,physics,上册,苏科版_八年级_义务教育教科书·生物学八年级上册.json,生物,142,初中_生物学_苏科版_八年级_义务教育教科书·生物学八年级上册
