Chunk_ID,Chunk_Index,Content,Content_Length,Quality_Score,Reliability,Source_Type,Original_Content,Enhancement_Version,averageConfidence,book_name,chunkIndex,enhancementTimestamp,enhancementVersion,fileName,filePath,grade,ocrMethod,publisher,qualityMetrics_chineseCharRatio,qualityMetrics_coherenceScore,qualityMetrics_lengthScore,qualityMetrics_ocrConfidence,semanticFeatures_hasDefinition,semanticFeatures_hasExperiment,semanticFeatures_hasFormulas,semanticFeatures_hasNumbers,semanticFeatures_hasQuestion,semanticFeatures_isTableContent,semanticFeatures_subjectArea,semester,source_file,subject,totalPages,uniqueId
苏科版_八年级_义务教育教科书·生物学八年级上册_chunk_60,60,到美丽的 大千 世界， 听不 到身边发 出的 任何声音， 感觉 不到 疼痛， 也无 法进行思考。 那么， 神经 系统的 调节作用是 怎样进行的 呢 ? 这与 神经系统的 结构和 功能有 关。 人体 的神经系统 v 当你 轻轻 敲打 着键盘， 通过 电脑邀 游互联网 时， 你就 能收集到 世界各 地的 信息。 与互联网 一样， 人体 的神经系统也 是一 个信息的 网络。 与人 体的 其他 系统一 样， 神经 系统也 是由 细胞 、 组织 和各 种器 官组 成的。 神经细胞又 称神经元 ( p.53)， 是一 类很 特殊的 细胞， 它在 神经组 织中 大量 存在， 是构成神经系统结构和 功能的 基本单位。 O 观察神经元 用显微镜观察神经元 的装 片， 认识 神经 元的 各部 分结构。 比较 一下， 神经 元与 组成 人体 的一 般细 胞有 无异同。 树突 轴突 散鞘 T 全的 一一 神经纤维一 下一 各细胞核 图 16 1 神经元 和神经纤维的 结构模式图 _32 人 3 1. 与人 的一 般细 胞相 比较， 神经 元在 结构上 有什么特点 ? 2. 神经元 的结构特点对 信息的 传递有 什么意义 ? 神经元 接受刺激后 能产生兴奋， 兴奋 能够 沿着 神经纤维进行传导。 这种 能够 传导的 兴奋叫 作神经冲动。 神经 冲动可 以传递给 其他 神经元 和肌肉。 人体 的神经系统由 数以 亿计 的神经元 组成， 各个 神经元 通过突起互相连接， 许多 神经 纤维集合成 束形 成神经， 分布 在人 体各 处， 构成 了人 体信 息传递和 处理 的网 络系统。 O 观察神经系统的 组成,700,0.5889418776539836,medium-low,ocr,到 美丽 的 大 千 世 界 ， 听 不 到 身边 发 出 的 任何 声音 ， 感 觉 不 到 疼\n痛 ， 也 无 法 进行 思考 。 那 么 ， 神 经 系统 的 调节 作用 是 怎样 进行 的 呢 ? 这 与 神经\n系统 的 结构 和 功能 有 关 。\n人 体 的 神经 系统 v\n当 你 轻 轻 敲 打 着 键盘 ， 通 过 电脑 邀 游 互联 网 时 ， 你 就 能 收集 到 世界 各 地\n的 信息 。 与 互联 网 一 样 ， 人 体 的 神经 系统 也 是 一 个 信息 的 网 络 。\n与 人 体 的 其 他 系统 一 样 ， 神 经 系统 也 是 由 细胞 、 组 织 和 各 种 器 官 组 成 的 。\n神经 细胞 又 称 神经 元 (»p.53) ， 是 一 类 很 特殊 的 细胞 ， 它 在 神经 组 织 中 大 量 存\n在 ， 是 构成 神经 系统 结构 和 功能 的 基本 单位 。\nO 观察 神经 元\n用 显微镜 观察 神经 元 的 装 片 ， 认 识 神 经 元 的 各 部 分 结构 。 比 较 一 下 ， 神\n经 元 与 组 成 人 体 的 一 般 细 胞 有 无 异同 。\n树 突 轴 突 散 鞘 T\n> 全\n%\n的 -一 一 神经 纤维 一 下 一 各\n细胞 核\n图 16-1 神经 元 和 神经 纤维 的 结构 模式 图\n_32\n=== 第 75 页 ===\n人 3\n1. 与 人 的 一 般 细 胞 相 比 较 ， 神 经 元 在 结构 上 有 什么 特点 ?\n2. 神经 元 的 结构 特点 对 信息 的 传递 有 什么 意义 ?\n神经 元 接受 刺激 后 能 产生 兴奋 ， 兴 奋 能 够 沿 着 神经 纤维 进行 传导 。 这 种 能\n够 传导 的 兴奋 叫 作 神经 冲动 。 神 经 冲动 可 以 传递 给 其 他 神经 元 和 肌肉 。 人 体 的\n神经 系统 由 数 以 亿 计 的 神经 元 组 成 ， 各 个 神经 元 通过 突起 互相 连接 ， 许 多 神\n经 纤维 集合 成 束 形 成 神经 ， 分 布 在 人 体 各 处 ， 构 成 了 人 体 信 息 传递 和 处 理 的 网\n络 系统 。\nO 观察 神经 系统 的 组 成,2.0,80.01408450704226,苏科版_八年级_义务教育教科书·生物学八年级上册,84,2025-07-21T14:25:09.109Z,2.0,义务教育教科书·生物学八年级上册,/Users/LeoQin/Documents/GitHub/PDFconvertor/training_data/初中/生物学/苏科版-江苏凤凰科学技术出版社/八年级/义务教育教科书·生物学八年级上册.pdf,八年级,tesseract.js-parallel,unknown,0.8925143953934741,0.6,1,80.01408450704226,,true,,true,true,,biology,上册,苏科版_八年级_义务教育教科书·生物学八年级上册.json,生物,142,初中_生物学_苏科版_八年级_义务教育教科书·生物学八年级上册
苏科版_八年级_义务教育教科书·生物学八年级上册_chunk_61,61,的兴奋叫 作神经冲动。 神经 冲动可 以传递给 其他 神经元 和肌肉。 人体 的神经系统由 数以 亿计 的神经元 组成， 各个 神经元 通过突起互相连接， 许多 神经 纤维集合成 束形 成神经， 分布 在人 体各 处， 构成 了人 体信 息传递和 处理 的网 络系统。 O 观察神经系统的 组成 观察人 体神经系统的 组成 模式图 (图 16 2)， 在自己身体上 确定组 成神经系统各 个器 官的 大致 位置， 想一 想它 们各 自的 功能。 Le 7N 1。 人脑 含有几 百亿 个神经细胞， 信人其 中被 开发利用的 仅占 1 10。 人的 7 1TEVA 大脑 每天 能记录生活中 大约 8 600 万政 川条 信息。 据估计， 人的 一生 能赁 记 A t 忆贮 存 100 多万 亿条 人信息。 因此， 人的 大脑 记忆贮存的 信息量 超过任 Al 何一 台电脑。 图 16 2 人体神 经系统的 组成 模式图 33 2 1. 人体 神经系统主要由 哪几 部分 组成 ? 脑和 硝著 分别位 于人 体的 哪个 部位 ? 2. 联系前 面学 过的 知识， 你认为神经系统对 人体 生命 活动有 什么重 要作用 ? 人体 的神经系统由 脑 、 稍人 骼以 及由 它们发 出的 神经三 部分 组成。 脑和 背髓 组成 神经系统的 中枢 部分， 由脑 和脊 髓所 发出 的神经包括脑 神经 和疹 神经， 组成 神经系统的 周围部 分。 脑和 疹骨 通过这 些神经调节人 体各 部分 的生 理活动。 脑由 大脑 (cerebrum ) 、 小脑 〈cerebellum ) 和脑 干 ( brain stem ) 三部 分组 成 (图 16 3 )。,726,0.40249247049866765,medium-low,ocr,的 兴奋 叫 作 神经 冲动 。 神 经 冲动 可 以 传递 给 其 他 神经 元 和 肌肉 。 人 体 的\n神经 系统 由 数 以 亿 计 的 神经 元 组 成 ， 各 个 神经 元 通过 突起 互相 连接 ， 许 多 神\n经 纤维 集合 成 束 形 成 神经 ， 分 布 在 人 体 各 处 ， 构 成 了 人 体 信 息 传递 和 处 理 的 网\n络 系统 。\nO 观察 神经 系统 的 组 成\n观察 人 体 神经 系统 的 组 成 模式 图 (图 16-2) ， 在 自己 身体 上 确定 组 成 神经\n系统 各 个 器 官 的 大 致 位 置 ， 想 一 想 它 们 各 自 的 功能 。\nLe -\n&\n7N\— =\n1 。\nAN 人 脑 含有 几 百 亿 个 神经 细胞 ，\n信人 其 中 被 开发 利用 的 仅 占 1/10。 人 的\n7 | 1TEVA 大 脑 每 天 能 记录 生活 中 大 约 8 600 万\n政 川 条 信息 。 据 估计 ， 人 的 一 生 能 赁 记\nA \t 忆 贮 存 100 多 万 亿 条 人 信息。 因此，\n| 人 的 大 脑 记忆 贮存 的 信息 量 超过 任\nAl \ 何 一 台电 脑 。\n图 16-2 人体 神 经 系统 的 组 成 模式 图\n33\n=== 第 76 页 ===\n2\n1. 人 体 神经 系统 主要 由 哪 几 部 分 组 成 ? 脑 和 硝 著 分别 位 于 人 体 的 哪\n个 部 位 ?\n2. 联系 前 面 学 过 的 知识 ， 你 认为 神经 系统 对 人 体 生 命 活动 有 什么 重\n要 作用 ?\n人 体 的 神经 系统 由 脑 、 稍 人 骼 以 及 由 它们 发 出 的 神经 三 部 分 组 成 。 脑 和\n背 髓 组 成 神经 系统 的 中 枢 部 分 ， 由 脑 和 脊 髓 所 发 出 的 神经 包括 脑 神 经 和 疹 神\n经 ， 组 成 神经 系统 的 周围 部 分 。 脑 和 疹 骨 通过 这 些 神经 调节 人 体 各 部 分 的 生\n理 活动 。\n脑 由 大 脑 (cerebrum ) 、 小 脑 〈cerebellum ) 和 脑 干 ( brain stem ) 三 部 分\n组 成 (图 16-3 ) 。,2.0,80.01408450704226,苏科版_八年级_义务教育教科书·生物学八年级上册,85,2025-07-21T14:25:09.109Z,2.0,义务教育教科书·生物学八年级上册,/Users/LeoQin/Documents/GitHub/PDFconvertor/training_data/初中/生物学/苏科版-江苏凤凰科学技术出版社/八年级/义务教育教科书·生物学八年级上册.pdf,八年级,tesseract.js-parallel,unknown,0.7943396226415095,0.6,1,80.01408450704226,,true,,true,true,,biology,上册,苏科版_八年级_义务教育教科书·生物学八年级上册.json,生物,142,初中_生物学_苏科版_八年级_义务教育教科书·生物学八年级上册
苏科版_八年级_义务教育教科书·生物学八年级上册_chunk_62,62,"系统的 中枢 部分， 由脑 和脊 髓所 发出 的神经包括脑 神经 和疹 神经， 组成 神经系统的 周围部 分。 脑和 疹骨 通过这 些神经调节人 体各 部分 的生 理活动。 脑由 大脑 (cerebrum ) 、 小脑 〈cerebellum ) 和脑 干 ( brain stem ) 三部 分组 成 (图 16 3 )。 大脑 由左右两 个大 脑半 球组 成， 约占 脑部 总体积的 3 4。 大脑 半球 的表层是 神经元 细胞体 密集的 部位， 色泽 灰暗， 叫作 灰质， 又称 大脑 皮质 (cerebral cortex )， 平均 厚度 为 2 3 mm。 大脑 皮质的 内部 是许多神经纤维汇集的 部位， 色泽 白亮， 叫作 白质。 由于 大脑 皮质的 表面有 许多凹陷的 沟和 隆起的 回， 大大 增加了 大脑 的表面积 和神经元 的数目。 据统计， 大脑 皮质的 总面 积约 有 2 200 cm2， 约含有 140 亿个 神经元 的细胞体。 在大 脑皮质里， 功能 相同 的神经元 细胞体 汇集在 一起， 调节 人体 某一 项相应的 生理活动， 这部 分结 构就 叫作 神经中 枢。 一大 脑脑 回大 脑皮质 (灰质 ) 脑二 下小 脑脑 沟一 和正质 小脑 图 16 3 人脑 的剖面示意图 在大 脑皮质中 有许多调节生命活动的 高级 中枢， 分别 主管人 体的 躯体运 动 、 躯体感觉 、 语言 、 视觉 、 听觉 、 嗅觉 等活动 (图 16 4 )。 例如 ,躯体运 动中 枢管理身体对 侧骨 骼肌 的运动， 躯体感觉 中枢 接受身体对 侧皮 肤 、 肌肉 等处 的感觉。 如果 左侧 大脑 半球 的运动中 枢受到损伤， 则右 侧身体 的运动功能表 失， 出现 半身不 遂。 34 目录",758,0.46850974231754167,medium-low,ocr,"系统 的 中 枢 部 分 ， 由 脑 和 脊 髓 所 发 出 的 神经 包括 脑 神 经 和 疹 神\n经 ， 组 成 神经 系统 的 周围 部 分 。 脑 和 疹 骨 通过 这 些 神经 调节 人 体 各 部 分 的 生\n理 活动 。\n脑 由 大 脑 (cerebrum ) 、 小 脑 〈cerebellum ) 和 脑 干 ( brain stem ) 三 部 分\n组 成 (图 16-3 ) 。\n大 脑 由 左右 两 个 大 脑 半 球 组 成 ， 约 占 脑 部 总 体积 的 3/4。 大 脑 半 球 的 表层\n是 神经 元 细胞 体 密集 的 部 位 ， 色 泽 灰暗 ， 叫 作 灰质 ， 又 称 大 脑 皮质 (cerebral\ncortex ) ， 平 均 厚 度 为 2 ~ 3 mm。 大 脑 皮质 的 内 部 是 许多 神经 纤维 汇集 的 部\n位 ， 色 泽 白 亮 ， 叫 作 白 质 。 由 于 大 脑 皮质 的 表面 有 许多 凹陷 的 沟 和 隆起 的\n回 ， 大 大 增加 了 大 脑 的 表面 积 和 神经 元 的 数目 。 据 统计 ， 大 脑 皮质 的 总 面\n积 约 有 2 200 cm2， 约 含有 140 亿 个 神经 元 的 细胞 体 。 在 大 脑 皮质 里 ， 功 能 相\n同 的 神经 元 细胞 体 汇集 在 一 起 ， 调 节 人 体 某 一 项 相应 的 生理 活动 ， 这 部 分 结\n构 就 叫 作 神经 中 枢 。\n= 一 大 脑 脑 回 大 脑 皮质\nSFXS (灰质 )\n脑 二 下 小 脑 脑 沟\n一 和正 质\n小 脑\n图 16-3 人 脑 的 剖面 示意 图\n在 大 脑 皮质 中 有 许多 调节 生命 活动 的 高 级 中 枢 ， 分 别 主管 人 体 的 躯体 运\n动 、 躯 体感 觉 、 语 言 、 视 觉 、 听 觉 、 嗅 觉 等 活动 (图 16-4 ) 。 例 如 ,躯体 运\n动 中 枢 管理 身体 对 侧 骨 骼 肌 的 运动 ， 躯 体感 觉 中 枢 接受 身体 对 侧 皮 肤 、 肌 肉 等\n处 的 感觉 。 如 果 左 侧 大 脑 半 球 的 运动 中 枢 受到 损伤 ， 则 右 侧身 体 的 运动 功能 表\n失 ， 出 现 半身 不 遂 。\n34\n=== 第 77 页 ===\n目录",2.0,80.01408450704226,苏科版_八年级_义务教育教科书·生物学八年级上册,86,2025-07-21T14:25:09.109Z,2.0,义务教育教科书·生物学八年级上册,/Users/LeoQin/Documents/GitHub/PDFconvertor/training_data/初中/生物学/苏科版-江苏凤凰科学技术出版社/八年级/义务教育教科书·生物学八年级上册.pdf,八年级,tesseract.js-parallel,unknown,0.7807971014492754,0.5,1,80.01408450704226,,,,true,,,physics,上册,苏科版_八年级_义务教育教科书·生物学八年级上册.json,生物,142,初中_生物学_苏科版_八年级_义务教育教科书·生物学八年级上册
苏科版_八年级_义务教育教科书·生物学八年级上册_chunk_63,63,"9 7 站 (0 让 0 ( 语言中 枢 As ) 视觉中 枢图 16 4 大脑皮 质功 能分 区示意图 小脑 位于 大脑 的后 下方， 也分 为左右两 个半球。 小脑 的作用本 4 江间 维持计 学家 指出， 大脑 的左右两 个半球分 ETRSAMREES, h 别控制着 人体 的不 同活动。 左侧 大脑 半球身体的 平衡。 如果 小脑 发生病变 控制身体右 半部 分的 运动和 感觉， 还管理或 受到损伤， 就会 使身体失去平 着人 的语言和 逻辑思维， 如演讲 、 计算 、 衡， 运动 不协调 、 不准确， 走路 科学分 析等 ; 右侧 大脑 半球则 控制着 身体， 和左 半部 分的 活动， 同时 还管理着 人的 形象站 立不 稳。 脑千 在大 脑的 下方， 下端 与疹 做相连。 脑干 里有 一些 调节人 体基本生命活动的 中枢， 如呼吸中 枢 、 心血管 35 中枢 等。 如果 脑干 受到损伤， 将直接影响呼吸和 心脏的 活动， 严重 时甚至危 及生命， 所以 脑王 有生命中 枢之 称。 兰侯 是脑 与躯体 、 内脏 之间 的联系通道， 兰侯 通过 疹神 经与 人体 大部 分器 官发 生联系。 用手指沿 着身体背部中 央往 下移动， 就能 感觉到 肴柱。 兰艇 在兰 柱的 椎管 里， 上端 与脑 相连， 下端 至身体腰部。 脊艇 由白质和 灰质组 成， 从横 切面 上看， 兰散 的灰质在 中央， 呈蝶 形， 白质 分布 在灰质的 周围 (图 16 5 )。 疹骨 是中 枢神经系统的 低级部 位， 具有 传导上 下神经冲动和 完成低级反射的 功能。 如果 兰髓 的某 个部 位受 损， 它所 控制的",712,0.5253259902431348,medium-low,ocr,"9 7\n站\n(0 让\n0 (&\n语言 中 枢 As ) — 视觉 中 枢\n图 16-4 ”大脑 皮 质 功 能 分 区 示意 图\n小 脑 位 于 大 脑 的 后 下 方 ， 也\n分 为 左右 两 个 半球 。 小 脑 的 作用 本\n4 江 间 维持 计 学 家 指出 ， 大 脑 的 左右 两 个 半球 分\nETRSAMREES, h 别 控制 着 人 体 的 不 同 活动 。 左 侧 大 脑 半球\n身体 的 平衡 。 如 果 小 脑 发 生病 变 控制 身体 右 半 部 分 的 运动 和 感觉 ， 还 管理\n或 受到 损伤 ， 就 会 使 身体 失去 平 着 人 的 语言 和 逻辑 思维 ， 如 演讲 、 计 算 、\n衡 ， 运 动 不 协调 、 不 准确 ， 走 路 “| 科学 分 析 等 ; 右 侧 大 脑 半球 则 控制 着 身体\n ， 和 左 半 部 分 的 活动 ， 同 时 还 管理 着 人 的 形象\n站 立 不 稳 。\n脑 千 在 大 脑 的 下 方 ， 下 端 与\n疹 做 相连 。 脑 干 里 有 一 些 调节 人 体 基本 生命 活动 的 中 枢 ， 如 呼吸 中 枢 、 心 血管\n35\n=== 第 79 页 ===\n中 枢 等 。 如 果 脑 干 受到 损伤 ， 将 直接 影响 呼吸 和 心脏 的 活动 ， 严 重 时 甚至 危\n及 生命 ， 所 以 脑 王 有 “生命 中 枢 ” 之 称 。\n兰 侯 是 脑 与 躯体 、 内 脏 之 间 的 联系 通道 ， 兰 侯 通 过 疹 神 经 与 人 体 大 部 分 器\n官 发 生 联系 。 用 手指 沿 着 身体 背部 中 央 往 下 移动 ， 就 能 感觉 到 肴 柱 。 兰 艇 在 兰\n柱 的 椎 管 里 ， 上 端 与 脑 相 连 ， 下 端 至 身体 腰部 。\n脊 艇 由 白质 和 灰质 组 成 ， 从 横 切 面 上 看 ， 兰 散 的 灰质 在 中 央 ， 呈 蝶 形 ， 白\n质 分 布 在 灰质 的 周围 (图 16-5 ) 。 疹 骨 是 中 枢 神经 系统 的 低级 部 位 ， 具 有 传导\n上 下 神经 冲动 和 完成 低级 反射 的 功能 。 如 果 兰 髓 的 某 个 部 位 受 损 ， 它 所 控制 的",2.0,80.01408450704226,苏科版_八年级_义务教育教科书·生物学八年级上册,88,2025-07-21T14:25:09.109Z,2.0,义务教育教科书·生物学八年级上册,/Users/LeoQin/Documents/GitHub/PDFconvertor/training_data/初中/生物学/苏科版-江苏凤凰科学技术出版社/八年级/义务教育教科书·生物学八年级上册.pdf,八年级,tesseract.js-parallel,unknown,0.8571428571428571,0.5,1,80.01408450704226,,,,true,,,physics,上册,苏科版_八年级_义务教育教科书·生物学八年级上册.json,生物,142,初中_生物学_苏科版_八年级_义务教育教科书·生物学八年级上册
苏科版_八年级_义务教育教科书·生物学八年级上册_chunk_64,64,， 下端 至身体腰部。 脊艇 由白质和 灰质组 成， 从横 切面 上看， 兰散 的灰质在 中央， 呈蝶 形， 白质 分布 在灰质的 周围 (图 16 5 )。 疹骨 是中 枢神经系统的 低级部 位， 具有 传导上 下神经冲动和 完成低级反射的 功能。 如果 兰髓 的某 个部 位受 损， 它所 控制的 身体相应部 位的 感觉和 和运动就 会丧失。 例如， 小儿 麻交 症是 由兰 髓灰质炎 病毒 感染引起的 一种 急性传染病。 如果 患儿 免疫力 较低 且治 疗不 及时 或不 当， 病毒 就会 随血液循环进入患 儿的 中枢 神经 系统， 对中 枢神 经系统特别是 脊化 灰质的 运动神经元 造成损伤， 严重 时会 引起患 儿的 下肢 肌肉 准痪 而丧失运动功能。 一司 本证 疹神 经 3 Ell6 5 神经调节的 基本方式你 知道望 梅止 渴这 个成 语故 事吗 ? 吃梅 的时 候， 我们 的口腔里 会分 泌许多唾液 ; 吃过 梅的 人看 见别人吃 梅的 时候， 口腔 里也 会分 泌许 多唾液。 这些 不同 的活动都 是人 体在 神经系统的 调节下， 对身体内 部或 来自 外界 的各 种刺激作出的 反应， 这种 反应就 是反射 (reflex )。 反射是 神经系统调节人 体各 种活动的 基本方式。 那么， 反射 活动 是怎样进 行的 呢 ? 036.， 四所 办 ( 人吃 梅分 泌唾 液和 吃过 梅的 人看 到梅 也会 分沁 唾液 O 探究人 体反 射活动的 神经结构如 果我 们迅速敲 击膝盖下 方的 所带， 小腿 会不 由自主地 向前 弹起。 请你,684,0.39703257436409506,low,ocr,， 下 端 至 身体 腰部 。\n脊 艇 由 白质 和 灰质 组 成 ， 从 横 切 面 上 看 ， 兰 散 的 灰质 在 中 央 ， 呈 蝶 形 ， 白\n质 分 布 在 灰质 的 周围 (图 16-5 ) 。 疹 骨 是 中 枢 神经 系统 的 低级 部 位 ， 具 有 传导\n上 下 神经 冲动 和 完成 低级 反射 的 功能 。 如 果 兰 髓 的 某 个 部 位 受 损 ， 它 所 控制 的\n身体 相应 部 位 的 感觉 和 和 运动 就 会 丧失 。 例 如 ， 小 儿 麻 交 症 是 由 兰 髓 灰质 炎 病 毒\n感染 引起 的 一 种 急性 传染 病 。 如 果 患 儿 免疫 力 较 低 且 治 疗 不 及 时 或 不 当 ， 病 毒\n就 会 随 血液 循环 进入 患 儿 的 中 枢 神 经 系统 ， 对 中 枢 神 经 系统 特别 是 脊 化 灰质 的\n运动 神经 元 造成 损伤 ， 严 重 时 会 引起 患 儿 的 下 肢 肌 肉 准 痪 而 丧失 运动 功能 。\n“一 司 | 本\nAN 证\nSNN\n— 疹 神 经\nHHE  3\nEll6-5 HBEMEREE\n神经 调节 的 基本 方式 ~\n你 知道 “ 望 梅 止 渴 ” 这 个 成 语 故 事 吗 ? 吃 梅 的 时 候 ， 我 们 的 口腔 里 会 分 泌\n许多 唾液 ; 吃 过 梅 的 人 看 见 别人 吃 梅 的 时 候 ， 口 腔 里 也 会 分 泌 许 多 唾液 。 这 些\n不 同 的 活动 都 是 人 体 在 神经 系统 的 调节 下 ， 对 身体 内 部 或 来 自 外 界 的 各 种 刺激\n作出 的 反应 ， 这 种 反应 就 是 反射 (reflex ) 。\n反射 是 神经 系统 调节 人 体 各 种 活动 的 基本 方式 。 那 么 ， 反 射 活 动 是 怎样 进\n行 的 呢 ?\n036.，\n=== 第 80 页 ===\n四 所\n办 -\n(\n人\n吃 梅 分 泌 唾 液 和 吃 过 梅 的 人 看 到 梅 也 会 分 沁 唾 液\nO 探究 人 体 反 射 活动 的 神经 结构\n如 果 我 们 迅速 敲 击 膝盖 下 方 的 所 带 ， 小 腿 会 不 由 自主 地 向 前 弹 起 。 请 你,2.0,80.01408450704226,苏科版_八年级_义务教育教科书·生物学八年级上册,89,2025-07-21T14:25:09.109Z,2.0,义务教育教科书·生物学八年级上册,/Users/LeoQin/Documents/GitHub/PDFconvertor/training_data/初中/生物学/苏科版-江苏凤凰科学技术出版社/八年级/义务教育教科书·生物学八年级上册.pdf,八年级,tesseract.js-parallel,unknown,0.8882235528942116,0.5,1,80.01408450704226,,,,true,true,,physics,上册,苏科版_八年级_义务教育教科书·生物学八年级上册.json,生物,142,初中_生物学_苏科版_八年级_义务教育教科书·生物学八年级上册
